play_id,period,time_remaining_period,secs_remaining,secs_remaining_absolute,description,home_score,away_score,score_diff,play_length,win_prob,home,away,home_time_out_remaining,away_time_out_remaining,home_timeout_ind,away_timeout_ind,home_favored_by,game_id,date,whichScored
197,3,3:17,797,797,Satou Sabally missed Free Throw.,39,61,-22,0,0.014567841053557256,UCLA,Oregon,5,5,0,0,NA,401172178,2020-02-14,
198,3,3:17,797,797,Sabrina Ionescu Offensive Rebound.,39,61,-22,0,0.014567841053557256,UCLA,Oregon,5,5,0,0,NA,401172178,2020-02-14,
199,3,3:17,797,797,Foul on Camryn Brown.,39,61,-22,15,0.014567841053557256,UCLA,Oregon,5,5,0,0,NA,401172178,2020-02-14,
200,3,3:02,782,782,Ruthy Hebard made Jumper.,39,63,-24,17,0.009553742916775828,UCLA,Oregon,5,5,0,0,NA,401172178,2020-02-14,Oregon
201,3,2:45,765,765,Michaela Onyenwere made Jumper. Assisted by Lindsey Corsaro.,41,63,-22,16,0.013322936963608185,UCLA,Oregon,5,5,0,0,NA,401172178,2020-02-14,UCLA
202,3,2:29,749,749,Satou Sabally made Layup. Assisted by Sabrina Ionescu.,41,65,-24,10,0.00854431508830801,UCLA,Oregon,5,5,0,0,NA,401172178,2020-02-14,Oregon
203,3,2:19,739,739,Lindsey Corsaro missed Three Point Jumper.,41,65,-24,0,0.008217300160267999,UCLA,Oregon,5,5,0,0,NA,401172178,2020-02-14,
204,3,2:19,739,739,Ruthy Hebard Defensive Rebound.,41,65,-24,16,0.008217300160267999,UCLA,Oregon,5,5,0,0,NA,401172178,2020-02-14,
205,3,2:03,723,723,Ruthy Hebard made Layup.,41,67,-26,10,0.005139989653166444,UCLA,Oregon,5,5,0,0,NA,401172178,2020-02-14,Oregon
206,3,1:53,713,713,Lauryn Miller made Jumper. Assisted by Japreece Dean.,43,67,-24,22,0.0073913068141178585,UCLA,Oregon,5,5,0,0,NA,401172178,2020-02-14,UCLA
207,3,1:31,691,691,Satou Sabally missed Three Point Jumper.,43,67,-24,0,0.0068357636226598194,UCLA,Oregon,5,5,0,0,NA,401172178,2020-02-14,
208,3,1:31,691,691,Lindsey Corsaro Defensive Rebound.,43,67,-24,6,0.0068357636226598194,UCLA,Oregon,5,5,0,0,NA,401172178,2020-02-14,
209,3,1:25,685,685,Foul on Taylor Chavez.,43,67,-24,15,0.006700946009344179,UCLA,Oregon,5,5,0,0,NA,401172178,2020-02-14,
210,3,1:10,670,670,Michaela Onyenwere made Jumper. Assisted by Japreece Dean.,45,67,-22,21,0.009690673718630848,UCLA,Oregon,5,5,0,0,NA,401172178,2020-02-14,UCLA
211,3,0:49,649,649,Minyon Moore missed Jumper.,45,67,-22,0,0.009114515472589377,UCLA,Oregon,5,5,0,0,NA,401172178,2020-02-14,
212,3,0:49,649,649,Natalie Chou Defensive Rebound.,45,67,-22,13,0.009114515472589377,UCLA,Oregon,5,5,0,0,NA,401172178,2020-02-14,
213,3,0:36,636,636,Foul on Sabrina Ionescu.,45,67,-22,0,0.00876289219892137,UCLA,Oregon,5,5,0,0,NA,401172178,2020-02-14,
214,3,0:36,636,636,Natalie Chou made Free Throw.,46,67,-21,0,0.010841221143394518,UCLA,Oregon,5,5,0,0,NA,401172178,2020-02-14,UCLA
215,3,0:36,636,636,Natalie Chou made Free Throw.,47,67,-20,9,0.013405808900577108,UCLA,Oregon,5,5,0,0,NA,401172178,2020-02-14,UCLA
216,3,0:27,627,627,Satou Sabally Turnover.,47,67,-20,0,0.013063969982773465,UCLA,Oregon,5,5,0,0,NA,401172178,2020-02-14,
217,3,0:27,627,627,Jaden Owens Steal.,47,67,-20,8,0.013063969982773465,UCLA,Oregon,5,5,0,0,NA,401172178,2020-02-14,
218,3,0:19,619,619,Foul on Lydia Giomi.,47,67,-20,4,0.012753250300273003,UCLA,Oregon,5,5,0,0,NA,401172178,2020-02-14,
219,3,0:15,615,615,Michaela Onyenwere missed Three Point Jumper.,47,67,-20,0,0.012594804953114302,UCLA,Oregon,5,5,0,0,NA,401172178,2020-02-14,
220,3,0:15,615,615,Charisma Osborne Offensive Rebound.,47,67,-20,10,0.012594804953114302,UCLA,Oregon,5,5,0,0,NA,401172178,2020-02-14,
221,3,0:05,605,605,Foul on Jaz Shelley.,47,67,-20,0,0.012187940875536363,UCLA,Oregon,5,5,0,0,NA,401172178,2020-02-14,
222,3,0:05,605,605,Charisma Osborne missed Free Throw.,47,67,-20,0,0.012187940875536363,UCLA,Oregon,5,5,0,0,NA,401172178,2020-02-14,
223,3,0:05,605,605,UCLA Deadball Team Rebound.,47,67,-20,0,0.012187940875536363,UCLA,Oregon,5,5,0,0,NA,401172178,2020-02-14,
224,3,0:05,605,605,Charisma Osborne made Free Throw.,48,67,-19,5,0.015138003238589397,UCLA,Oregon,5,5,0,0,NA,401172178,2020-02-14,UCLA
225,3,0:00,600,600,End of 3rd Quarter,48,67,-19,0,0.014890971642175607,UCLA,Oregon,5,5,0,0,NA,401172178,2020-02-14,
226,4,10:00,600,600,Jump Ball won by Oregon,48,67,-19,17,0.014890971642175607,UCLA,Oregon,6,6,0,0,NA,401172178,2020-02-14,
227,4,9:43,583,583,Satou Sabally missed Jumper.,48,67,-19,0,0.014005964292015415,UCLA,Oregon,6,6,0,0,NA,401172178,2020-02-14,
228,4,9:43,583,583,Chantel Horvat Defensive Rebound.,48,67,-19,8,0.014005964292015415,UCLA,Oregon,6,6,0,0,NA,401172178,2020-02-14,
229,4,9:35,575,575,Foul on Ruthy Hebard.,48,67,-19,0,0.013563493871327737,UCLA,Oregon,6,6,0,0,NA,401172178,2020-02-14,
230,4,9:35,575,575,Michaela Onyenwere made Free Throw.,49,67,-18,0,0.016938203271531397,UCLA,Oregon,6,6,0,0,NA,401172178,2020-02-14,UCLA
231,4,9:35,575,575,Michaela Onyenwere made Free Throw.,50,67,-17,22,0.021134578496872128,UCLA,Oregon,6,6,0,0,NA,401172178,2020-02-14,UCLA
232,4,9:13,553,553,Sabrina Ionescu Turnover.,50,67,-17,0,0.019317532810106983,UCLA,Oregon,6,6,0,1,NA,401172178,2020-02-14,
233,4,9:13,553,553,Oregon  Timeout,50,67,-17,21,0.019317532810106983,UCLA,Oregon,6,5,0,1,NA,401172178,2020-02-14,
234,4,8:52,532,532,Charisma Osborne made Layup.,52,67,-15,21,0.028052426984650485,UCLA,Oregon,6,5,0,1,NA,401172178,2020-02-14,UCLA
235,4,8:31,511,511,Sabrina Ionescu missed Jumper.,52,67,-15,0,0.026295947020699224,UCLA,Oregon,6,5,0,1,NA,401172178,2020-02-14,
236,4,8:31,511,511,Michaela Onyenwere Block.,52,67,-15,0,0.026295947020699224,UCLA,Oregon,6,5,0,1,NA,401172178,2020-02-14,
237,4,8:31,511,511,Japreece Dean Defensive Rebound.,52,67,-15,18,0.026295947020699224,UCLA,Oregon,6,5,0,1,NA,401172178,2020-02-14,
238,4,8:13,493,493,Foul on Sabrina Ionescu.,52,67,-15,0,0.024945683635062586,UCLA,Oregon,6,5,0,1,NA,401172178,2020-02-14,
239,4,8:13,493,493,Michaela Onyenwere made Free Throw.,53,67,-14,0,0.03163312419581105,UCLA,Oregon,6,5,0,1,NA,401172178,2020-02-14,UCLA
240,4,8:13,493,493,Michaela Onyenwere made Free Throw.,54,67,-13,9,0.04003971583111779,UCLA,Oregon,6,5,0,1,NA,401172178,2020-02-14,UCLA
241,4,8:04,484,484,Foul on Chantel Horvat.,54,67,-13,15,0.039106286812846724,UCLA,Oregon,6,5,0,0,NA,401172178,2020-02-14,
242,4,7:49,469,469,Erin Boley missed Jumper.,54,67,-13,0,0.037444397369296965,UCLA,Oregon,6,5,0,0,NA,401172178,2020-02-14,
243,4,7:49,469,469,Satou Sabally Offensive Rebound.,54,67,-13,6,0.037444397369296965,UCLA,Oregon,6,5,0,0,NA,401172178,2020-02-14,
244,4,7:43,463,463,Sabrina Ionescu missed Three Point Jumper.,54,67,-13,0,0.036723818699751866,UCLA,Oregon,6,5,0,0,NA,401172178,2020-02-14,
245,4,7:43,463,463,UCLA Defensive Rebound.,54,67,-13,21,0.036723818699751866,UCLA,Oregon,6,5,0,0,NA,401172178,2020-02-14,
246,4,7:22,442,442,Michaela Onyenwere missed Jumper.,54,67,-13,0,0.03385865134108309,UCLA,Oregon,6,5,0,0,NA,401172178,2020-02-14,
247,4,7:22,442,442,Ruthy Hebard Defensive Rebound.,54,67,-13,31,0.03385865134108309,UCLA,Oregon,6,5,0,0,NA,401172178,2020-02-14,
248,4,6:51,411,411,Ruthy Hebard missed Jumper.,54,67,-13,0,0.029070968137457194,UCLA,Oregon,6,5,0,0,NA,401172178,2020-02-14,
249,4,6:51,411,411,Ruthy Hebard Offensive Rebound.,54,67,-13,6,0.029070968137457194,UCLA,Oregon,6,5,0,0,NA,401172178,2020-02-14,
250,4,6:45,405,405,Ruthy Hebard made Layup.,54,69,-15,10,0.016600621198842952,UCLA,Oregon,6,5,0,0,NA,401172178,2020-02-14,Oregon
251,4,6:35,395,395,Charisma Osborne missed Three Point Jumper.,54,69,-15,0,0.01573189149152789,UCLA,Oregon,6,5,0,0,NA,401172178,2020-02-14,
252,4,6:35,395,395,Michaela Onyenwere Offensive Rebound.,54,69,-15,3,0.01573189149152789,UCLA,Oregon,6,5,0,0,NA,401172178,2020-02-14,
253,4,6:32,392,392,Foul on Ruthy Hebard.,54,69,-15,0,0.01548042302143316,UCLA,Oregon,6,5,0,0,NA,401172178,2020-02-14,
254,4,6:32,392,392,Michaela Onyenwere missed Free Throw.,54,69,-15,0,0.01548042302143316,UCLA,Oregon,6,5,0,0,NA,401172178,2020-02-14,
255,4,6:32,392,392,UCLA Deadball Team Rebound.,54,69,-15,0,0.01548042302143316,UCLA,Oregon,6,5,0,0,NA,401172178,2020-02-14,
256,4,6:32,392,392,Michaela Onyenwere made Free Throw.,55,69,-14,5,0.020317636815337478,UCLA,Oregon,6,5,0,0,NA,401172178,2020-02-14,UCLA
257,4,6:27,387,387,Erin Boley made Three Point Jumper. Assisted by Sabrina Ionescu.,55,72,-17,12,0.008685681777171233,UCLA,Oregon,6,5,0,0,NA,401172178,2020-02-14,Oregon
258,4,6:15,375,375,Michaela Onyenwere missed Layup.,55,72,-17,0,0.008049289985808407,UCLA,Oregon,6,5,0,0,NA,401172178,2020-02-14,
259,4,6:15,375,375,Ruthy Hebard Defensive Rebound.,55,72,-17,17,0.008049289985808407,UCLA,Oregon,6,5,0,0,NA,401172178,2020-02-14,
260,4,5:58,358,358,Erin Boley missed Three Point Jumper.,55,72,-17,0,0.007155903407425335,UCLA,Oregon,6,5,0,0,NA,401172178,2020-02-14,
261,4,5:58,358,358,Taylor Chavez Offensive Rebound.,55,72,-17,15,0.007155903407425335,UCLA,Oregon,6,5,0,0,NA,401172178,2020-02-14,
262,4,5:43,343,343,Satou Sabally missed Jumper.,55,72,-17,0,0.006350517322098643,UCLA,Oregon,6,5,0,0,NA,401172178,2020-02-14,
263,4,5:43,343,343,Lauryn Miller Defensive Rebound.,55,72,-17,0,0.006350517322098643,UCLA,Oregon,6,5,0,0,NA,401172178,2020-02-14,
264,4,5:43,343,343,Foul on Satou Sabally.,55,72,-17,0,0.006350517322098643,UCLA,Oregon,6,5,0,0,NA,401172178,2020-02-14,
265,4,5:43,343,343,Japreece Dean missed Free Throw.,55,72,-17,0,0.006350517322098643,UCLA,Oregon,6,5,0,0,NA,401172178,2020-02-14,
266,4,5:43,343,343,UCLA Deadball Team Rebound.,55,72,-17,0,0.006350517322098643,UCLA,Oregon,6,5,0,0,NA,401172178,2020-02-14,
267,4,5:43,343,343,Japreece Dean made Free Throw.,56,72,-16,17,0.008529809391068904,UCLA,Oregon,6,5,0,0,NA,401172178,2020-02-14,UCLA
268,4,5:26,326,326,Natalie Chou missed Jumper.,56,72,-16,0,0.007335505512588054,UCLA,Oregon,6,5,0,0,NA,401172178,2020-02-14,
269,4,5:26,326,326,Charisma Osborne Offensive Rebound.,56,72,-16,7,0.007335505512588054,UCLA,Oregon,6,5,0,0,NA,401172178,2020-02-14,
270,4,5:19,319,319,Charisma Osborne made Layup.,58,72,-14,20,0.012655014254495233,UCLA,Oregon,6,5,0,0,NA,401172178,2020-02-14,UCLA
271,4,4:59,299,299,Satou Sabally Turnover.,58,72,-14,0,0.010713756356088983,UCLA,Oregon,6,5,0,0,NA,401172178,2020-02-14,
272,4,4:59,299,299,Official TV Timeout,58,72,-14,26,0.010713756356088983,UCLA,Oregon,6,5,0,0,NA,401172178,2020-02-14,
273,4,4:33,273,273,Charisma Osborne missed Three Point Jumper.,58,72,-14,0,0.01079919549447563,UCLA,Oregon,6,5,0,0,NA,401172178,2020-02-14,
274,4,4:33,273,273,Oregon Defensive Rebound.,58,72,-14,15,0.01079919549447563,UCLA,Oregon,6,5,0,0,NA,401172178,2020-02-14,
275,4,4:18,258,258,Sabrina Ionescu made Jumper.,58,74,-16,9,0.006108032032017563,UCLA,Oregon,6,5,0,0,NA,401172178,2020-02-14,Oregon
276,4,4:09,249,249,Charisma Osborne missed Layup.,58,74,-16,0,0.006349380089079663,UCLA,Oregon,6,5,0,0,NA,401172178,2020-02-14,
277,4,4:09,249,249,Chantel Horvat Offensive Rebound.,58,74,-16,0,0.006349380089079663,UCLA,Oregon,6,5,0,0,NA,401172178,2020-02-14,
278,4,4:09,249,249,Chantel Horvat missed Layup.,58,74,-16,0,0.006349380089079663,UCLA,Oregon,6,5,0,0,NA,401172178,2020-02-14,
279,4,4:09,249,249,Michaela Onyenwere Offensive Rebound.,58,74,-16,2,0.006349380089079663,UCLA,Oregon,6,5,0,0,NA,401172178,2020-02-14,
280,4,4:07,247,247,Michaela Onyenwere made Layup.,60,74,-14,22,0.011945884230257948,UCLA,Oregon,6,5,0,0,NA,401172178,2020-02-14,UCLA
281,4,3:45,225,225,Ruthy Hebard Turnover.,60,74,-14,0,0.01185671329393186,UCLA,Oregon,6,5,0,0,NA,401172178,2020-02-14,
282,4,3:45,225,225,Natalie Chou Steal.,60,74,-14,4,0.01185671329393186,UCLA,Oregon,6,5,0,0,NA,401172178,2020-02-14,
283,4,3:41,221,221,Michaela Onyenwere made Layup. Assisted by Japreece Dean.,62,74,-12,9,0.021665524379874332,UCLA,Oregon,6,5,0,0,NA,401172178,2020-02-14,UCLA
284,4,3:32,212,212,Oregon  Timeout,62,74,-12,19,0.02022127882790436,UCLA,Oregon,6,4,0,1,NA,401172178,2020-02-14,
285,4,3:13,193,193,Foul on Michaela Onyenwere.,62,74,-12,3,0.014976748028951228,UCLA,Oregon,6,4,0,1,NA,401172178,2020-02-14,
286,4,3:10,190,190,Ruthy Hebard missed Jumper.,62,74,-12,0,0.013958256757674092,UCLA,Oregon,6,4,0,1,NA,401172178,2020-02-14,
287,4,3:10,190,190,Chantel Horvat Defensive Rebound.,62,74,-12,21,0.013958256757674092,UCLA,Oregon,6,4,0,1,NA,401172178,2020-02-14,
288,4,2:49,169,169,Michaela Onyenwere missed Jumper.,62,74,-12,0,0.008212259563890136,UCLA,Oregon,6,4,0,1,NA,401172178,2020-02-14,
289,4,2:49,169,169,Ruthy Hebard Defensive Rebound.,62,74,-12,6,0.008212259563890136,UCLA,Oregon,6,4,0,1,NA,401172178,2020-02-14,
290,4,2:43,163,163,Minyon Moore Turnover.,62,74,-12,0,0.00699431628001163,UCLA,Oregon,6,4,0,1,NA,401172178,2020-02-14,
291,4,2:43,163,163,Chantel Horvat Steal.,62,74,-12,7,0.00699431628001163,UCLA,Oregon,6,4,0,1,NA,401172178,2020-02-14,
292,4,2:36,156,156,Japreece Dean Turnover.,62,74,-12,1,0.005753057747902682,UCLA,Oregon,6,4,0,1,NA,401172178,2020-02-14,
293,4,2:35,155,155,Foul on Charisma Osborne.,62,74,-12,6,0.0055901204303576224,UCLA,Oregon,6,4,0,1,NA,401172178,2020-02-14,
294,4,2:29,149,149,Foul on Camryn Brown.,62,74,-12,11,0.004681987539307846,UCLA,Oregon,6,4,0,0,NA,401172178,2020-02-14,
295,4,2:18,138,138,Sabrina Ionescu missed Three Point Jumper.,62,74,-12,0,0.0032988640542577032,UCLA,Oregon,6,4,0,0,NA,401172178,2020-02-14,
296,4,2:18,138,138,Ruthy Hebard Offensive Rebound.,62,74,-12,2,0.0032988640542577032,UCLA,Oregon,6,4,0,0,NA,401172178,2020-02-14,
297,4,2:16,136,136,Foul on Chantel Horvat.,62,74,-12,0,0.0030830812785789296,UCLA,Oregon,6,4,0,0,NA,401172178,2020-02-14,
298,4,2:16,136,136,Ruthy Hebard missed Free Throw.,62,74,-12,0,0.0030830812785789296,UCLA,Oregon,6,4,0,0,NA,401172178,2020-02-14,
299,4,2:16,136,136,Oregon Deadball Team Rebound.,62,74,-12,0,0.0030830812785789296,UCLA,Oregon,6,4,0,0,NA,401172178,2020-02-14,
300,4,2:16,136,136,Ruthy Hebard missed Free Throw.,62,74,-12,0,0.0030830812785789296,UCLA,Oregon,6,4,0,0,NA,401172178,2020-02-14,
301,4,2:16,136,136,Michaela Onyenwere Defensive Rebound.,62,74,-12,11,0.0030830812785789296,UCLA,Oregon,6,4,0,0,NA,401172178,2020-02-14,
302,4,2:05,125,125,Natalie Chou made Jumper. Assisted by Michaela Onyenwere.,64,74,-10,25,0.005779548627014688,UCLA,Oregon,6,4,0,0,NA,401172178,2020-02-14,UCLA
303,4,1:40,100,100,Foul on Charisma Osborne.,64,74,-10,0,0.0023225721660002138,UCLA,Oregon,6,4,0,0,NA,401172178,2020-02-14,
304,4,1:40,100,100,Sabrina Ionescu made Free Throw.,64,75,-11,0,0.0012680195057788834,UCLA,Oregon,6,4,0,0,NA,401172178,2020-02-14,Oregon
305,4,1:40,100,100,Sabrina Ionescu made Free Throw.,64,76,-12,6,6.919492945333666e-4,UCLA,Oregon,6,4,0,0,NA,401172178,2020-02-14,Oregon
306,4,1:34,94,94,Michaela Onyenwere missed Jumper.,64,76,-12,0,5.071242421560675e-4,UCLA,Oregon,6,4,0,0,NA,401172178,2020-02-14,
307,4,1:34,94,94,Ruthy Hebard Defensive Rebound.,64,76,-12,18,5.071242421560675e-4,UCLA,Oregon,6,4,0,0,NA,401172178,2020-02-14,
308,4,1:16,76,76,Satou Sabally made Jumper.,64,78,-14,16,4.508712732828036e-5,UCLA,Oregon,6,4,0,0,NA,401172178,2020-02-14,Oregon
309,4,1:00,60,60,Foul on Minyon Moore.,64,78,-14,0,1.431094600414694e-5,UCLA,Oregon,6,4,0,0,NA,401172178,2020-02-14,
310,4,1:00,60,60,Japreece Dean made Free Throw.,65,78,-13,0,3.1745634883013744e-5,UCLA,Oregon,6,4,0,0,NA,401172178,2020-02-14,UCLA
311,4,1:00,60,60,Japreece Dean made Free Throw.,66,78,-12,15,7.041909936268146e-5,UCLA,Oregon,6,4,0,0,NA,401172178,2020-02-14,UCLA
312,4,0:45,45,45,Foul on Camryn Brown.,66,78,-12,0,2.5847215309726935e-5,UCLA,Oregon,6,4,0,0,NA,401172178,2020-02-14,
313,4,0:45,45,45,Minyon Moore missed Free Throw.,66,78,-12,0,2.5847215309726935e-5,UCLA,Oregon,6,4,0,0,NA,401172178,2020-02-14,
314,4,0:45,45,45,Oregon Deadball Team Rebound.,66,78,-12,0,2.5847215309726935e-5,UCLA,Oregon,6,4,0,0,NA,401172178,2020-02-14,
315,4,0:45,45,45,Minyon Moore missed Free Throw.,66,78,-12,0,2.5847215309726935e-5,UCLA,Oregon,6,4,0,0,NA,401172178,2020-02-14,
316,4,0:45,45,45,Satou Sabally Offensive Rebound.,66,78,-12,6,2.5847215309726935e-5,UCLA,Oregon,6,4,0,0,NA,401172178,2020-02-14,
317,4,0:39,39,39,Satou Sabally made Jumper.,66,80,-14,8,2.7007982256942535e-6,UCLA,Oregon,6,4,0,0,NA,401172178,2020-02-14,Oregon
318,4,0:31,31,31,Charisma Osborne missed Three Point Jumper.,66,80,-14,0,1.3557588899139727e-6,UCLA,Oregon,6,4,0,0,NA,401172178,2020-02-14,
319,4,0:31,31,31,Japreece Dean Offensive Rebound.,66,80,-14,5,1.3557588899139727e-6,UCLA,Oregon,6,4,0,0,NA,401172178,2020-02-14,
320,4,0:26,26,26,Japreece Dean missed Layup.,66,80,-14,0,8.706034154409891e-7,UCLA,Oregon,6,4,0,1,NA,401172178,2020-02-14,
321,4,0:26,26,26,Ruthy Hebard Defensive Rebound.,66,80,-14,0,8.706034154409891e-7,UCLA,Oregon,6,4,0,1,NA,401172178,2020-02-14,
322,4,0:26,26,26,Oregon  Timeout,66,80,-14,26,8.706034154409891e-7,UCLA,Oregon,6,3,0,1,NA,401172178,2020-02-14,
323,4,0:00,0,0,End of Game,66,80,-14,0,2.4977275669152505e-122,UCLA,Oregon,6,3,0,1,NA,401172178,2020-02-14,
