play_id,period,time_remaining_period,secs_remaining,secs_remaining_absolute,description,home_score,away_score,score_diff,play_length,win_prob,home,away,home_time_out_remaining,away_time_out_remaining,home_timeout_ind,away_timeout_ind,home_favored_by,game_id,date,whichScored
385,5,2:06,126,126,Gabrielle Cooper Turnover.,74,69,5,1,0.9281052321723561,Green Bay,Syracuse,3,3,0,0,NA,401187176,2019-11-30,
386,5,2:05,125,125,Anna Dier Steal.,74,69,5,17,0.9291573374058483,Green Bay,Syracuse,3,3,0,0,NA,401187176,2019-11-30,
387,5,1:48,108,108,Caitlyn Hibner missed Layup.,74,69,5,0,0.9464062236655004,Green Bay,Syracuse,3,3,0,0,NA,401187176,2019-11-30,
388,5,1:48,108,108,Emily Engstler Defensive Rebound.,74,69,5,2,0.9464062236655004,Green Bay,Syracuse,3,3,0,0,NA,401187176,2019-11-30,
389,5,1:46,106,106,Foul on Lyndsey Robson.,74,69,5,0,0.9483369899375026,Green Bay,Syracuse,3,3,0,0,NA,401187176,2019-11-30,
390,5,1:46,106,106,Emily Engstler made Free Throw.,74,70,4,0,0.9111675095948524,Green Bay,Syracuse,3,3,0,0,NA,401187176,2019-11-30,Syracuse
391,5,1:46,106,106,Emily Engstler made Free Throw.,74,71,3,27,0.8514451354022992,Green Bay,Syracuse,3,3,0,0,NA,401187176,2019-11-30,Syracuse
392,5,1:19,79,79,Frankie Wurtz made Jumper.,76,71,5,13,0.9707444644683182,Green Bay,Syracuse,3,3,0,0,NA,401187176,2019-11-30,Green Bay
393,5,1:06,66,66,Alisha Lewis missed Three Point Jumper.,76,71,5,0,0.9786671027881189,Green Bay,Syracuse,3,3,0,0,NA,401187176,2019-11-30,
394,5,1:06,66,66,Amaya Finklea-Guity Offensive Rebound.,76,71,5,8,0.9786671027881189,Green Bay,Syracuse,3,3,0,0,NA,401187176,2019-11-30,
395,5,0:58,58,58,Amaya Finklea-Guity made Layup. Assisted by Emily Engstler.,76,73,3,4,0.9185231131253686,Green Bay,Syracuse,3,3,0,0,NA,401187176,2019-11-30,Syracuse
396,5,0:54,54,54,Syracuse  Timeout,76,73,3,0,0.9232895132408648,Green Bay,Syracuse,2,3,1,0,NA,401187176,2019-11-30,
397,5,0:54,54,54,Official TV Timeout,76,73,3,21,0.9232895132408648,Green Bay,Syracuse,2,3,1,0,NA,401187176,2019-11-30,
398,5,0:33,33,33,Anna Brecht missed Three Point Jumper.,76,73,3,0,0.9457209448213074,Green Bay,Syracuse,2,3,1,0,NA,401187176,2019-11-30,
399,5,0:33,33,33,Gabrielle Cooper Defensive Rebound.,76,73,3,23,0.9457209448213074,Green Bay,Syracuse,2,3,1,0,NA,401187176,2019-11-30,
400,5,0:10,10,10,Gabrielle Cooper missed Three Point Jumper.,76,73,3,0,0.9648361167568685,Green Bay,Syracuse,2,3,1,0,NA,401187176,2019-11-30,
401,5,0:10,10,10,Caitlyn Hibner Defensive Rebound.,76,73,3,2,0.9648361167568685,Green Bay,Syracuse,2,3,1,0,NA,401187176,2019-11-30,
402,5,0:08,8,8,Foul on Digna Strautmane.,76,73,3,0,0.9662502423978944,Green Bay,Syracuse,2,3,1,0,NA,401187176,2019-11-30,
403,5,0:08,8,8,Caitlyn Hibner made Free Throw.,77,73,4,0,0.9887112925767356,Green Bay,Syracuse,2,3,1,0,NA,401187176,2019-11-30,Green Bay
404,5,0:08,8,8,Caitlyn Hibner made Free Throw.,78,73,5,3,0.9962816477111814,Green Bay,Syracuse,2,3,1,0,NA,401187176,2019-11-30,Green Bay
405,5,0:05,5,5,Alisha Lewis missed Three Point Jumper.,78,73,5,0,0.99665943014498,Green Bay,Syracuse,2,3,1,0,NA,401187176,2019-11-30,
406,5,0:05,5,5,Caitlyn Hibner Defensive Rebound.,78,73,5,2,0.99665943014498,Green Bay,Syracuse,2,3,1,0,NA,401187176,2019-11-30,
407,5,0:03,3,3,Foul on Digna Strautmane.,78,73,5,0,0.9968920744933377,Green Bay,Syracuse,2,3,1,0,NA,401187176,2019-11-30,
408,5,0:03,3,3,Caitlyn Hibner missed Free Throw.,78,73,5,0,0.9968920744933377,Green Bay,Syracuse,2,3,1,0,NA,401187176,2019-11-30,
409,5,0:03,3,3,Green Bay Deadball Team Rebound.,78,73,5,0,0.9968920744933377,Green Bay,Syracuse,2,3,1,0,NA,401187176,2019-11-30,
410,5,0:03,3,3,Caitlyn Hibner made Free Throw.,79,73,6,0,0.9990178898163832,Green Bay,Syracuse,2,3,1,0,NA,401187176,2019-11-30,Green Bay
