play_id,period,time_remaining_period,secs_remaining,secs_remaining_absolute,description,home_score,away_score,score_diff,play_length,win_prob,home,away,home_time_out_remaining,away_time_out_remaining,home_timeout_ind,away_timeout_ind,home_favored_by,game_id,date,whichScored
211,3,2:15,735,735,Kiara Jefferson missed Three Point Jumper.,44,45,-1,4,0.45006527851251904,UCLA,UCF,5,5,0,0,NA,401169227,2019-11-30,
212,3,2:11,731,731,Sianni Martin Defensive Rebound.,44,45,-1,3,0.4498903928108823,UCLA,UCF,5,5,0,0,NA,401169227,2019-11-30,
213,3,2:08,728,728,Sianni Martin missed Layup.,44,45,-1,3,0.44975739918281593,UCLA,UCF,5,5,0,0,NA,401169227,2019-11-30,
214,3,2:05,725,725,Jnaya Walker Offensive Rebound.,44,45,-1,0,0.4496271916090662,UCLA,UCF,5,5,0,0,NA,401169227,2019-11-30,
215,3,2:05,725,725,Foul on Diamond Battles.,44,45,-1,0,0.4496271916090662,UCLA,UCF,5,5,0,0,NA,401169227,2019-11-30,
216,3,2:05,725,725,Diamond Battles Turnover.,44,45,-1,19,0.4496271916090662,UCLA,UCF,5,5,0,0,NA,401169227,2019-11-30,
217,3,1:46,706,706,Michaela Onyenwere Turnover.,44,45,-1,10,0.44886538366240486,UCLA,UCF,5,5,0,0,NA,401169227,2019-11-30,
218,3,1:36,696,696,Georgia Gayle missed Three Point Jumper.,44,45,-1,5,0.4484995763356005,UCLA,UCF,5,5,0,0,NA,401169227,2019-11-30,
219,3,1:31,691,691,Michaela Onyenwere Defensive Rebound.,44,45,-1,11,0.4483234405483457,UCLA,UCF,5,5,0,0,NA,401169227,2019-11-30,
220,3,1:20,680,680,Kiara Jefferson missed Jumper.,44,45,-1,1,0.4479476615665749,UCLA,UCF,5,5,0,0,NA,401169227,2019-11-30,
221,3,1:19,679,679,UCLA Offensive Rebound.,44,45,-1,0,0.4479141134389915,UCLA,UCF,5,5,0,0,NA,401169227,2019-11-30,
222,3,1:19,679,679,Foul on Masseny Kaba.,44,45,-1,0,0.4479141134389915,UCLA,UCF,5,5,0,0,NA,401169227,2019-11-30,
223,3,1:19,679,679,Michaela Onyenwere made Free Throw.,45,45,0,0,0.5,UCLA,UCF,5,5,0,0,NA,401169227,2019-11-30,UCLA
224,3,1:19,679,679,Michaela Onyenwere made Free Throw.,46,45,1,26,0.5520858865610084,UCLA,UCF,5,5,0,0,NA,401169227,2019-11-30,UCLA
225,3,0:53,653,653,Georgia Gayle made Jumper.,46,47,-1,0,0.44705351894351864,UCLA,UCF,5,5,0,0,NA,401169227,2019-11-30,UCF
226,3,0:53,653,653,Foul on Japreece Dean.,46,47,-1,0,0.44705351894351864,UCLA,UCF,5,5,0,0,NA,401169227,2019-11-30,
227,3,0:53,653,653,Georgia Gayle made Free Throw.,46,48,-2,16,0.3952812823181859,UCLA,UCF,5,5,0,0,NA,401169227,2019-11-30,UCF
228,3,0:37,637,637,Kiara Jefferson Turnover.,46,47,-1,0,0.4465088452292547,UCLA,UCF,5,5,0,0,NA,401169227,2019-11-30,
229,3,0:37,637,637,Diamond Battles Steal.,46,47,-1,17,0.4465088452292547,UCLA,UCF,5,5,0,0,NA,401169227,2019-11-30,
230,3,0:20,620,620,Georgia Gayle made Three Point Jumper.,46,51,-5,15,0.25227699491786953,UCLA,UCF,5,5,0,0,NA,401169227,2019-11-30,UCF
231,3,0:05,605,605,Charisma Osborne missed Three Point Jumper.,46,51,-5,4,0.24997204988468405,UCLA,UCF,5,5,0,0,NA,401169227,2019-11-30,
232,3,0:01,601,601,Georgia Gayle Defensive Rebound.,46,51,-5,0,0.2493158928867744,UCLA,UCF,5,5,0,0,NA,401169227,2019-11-30,
233,3,0:01,601,601,Foul on Michaela Onyenwere.,46,51,-5,1,0.2493158928867744,UCLA,UCF,5,5,0,0,NA,401169227,2019-11-30,
234,3,0:00,600,600,End of 3rd Quarter,46,50,-4,22,0.2926546588354372,UCLA,UCF,5,5,0,0,NA,401169227,2019-11-30,
235,4,9:38,578,578,Foul on Lauryn Miller.,46,48,-2,0,0.38937976821980935,UCLA,UCF,6,6,0,0,NA,401169227,2019-11-30,
236,4,9:38,578,578,Diamond Battles made Free Throw.,46,52,-6,0,0.2059095730201154,UCLA,UCF,6,6,0,0,NA,401169227,2019-11-30,UCF
237,4,9:38,578,578,Diamond Battles made Free Throw.,46,53,-7,24,0.17154451992756245,UCLA,UCF,6,6,0,0,NA,401169227,2019-11-30,UCF
238,4,9:14,554,554,Natalie Chou missed Three Point Jumper.,46,53,-7,4,0.1658663516830662,UCLA,UCF,6,6,0,0,NA,401169227,2019-11-30,
239,4,9:10,550,550,Charisma Osborne Offensive Rebound.,46,53,-7,18,0.1648110711074176,UCLA,UCF,6,6,0,0,NA,401169227,2019-11-30,
240,4,8:52,532,532,UCLA  Turnover.,46,53,-7,29,0.16050989024256018,UCLA,UCF,6,6,0,0,NA,401169227,2019-11-30,
241,4,8:23,503,503,Brittney Smith missed Layup.,46,53,-7,4,0.1549074883654163,UCLA,UCF,6,6,0,0,NA,401169227,2019-11-30,
242,4,8:19,499,499,Lauryn Miller Defensive Rebound.,46,53,-7,15,0.1541771104514224,UCLA,UCF,6,6,0,0,NA,401169227,2019-11-30,
243,4,8:04,484,484,Foul on Jnaya Walker.,46,53,-7,17,0.15136590477992606,UCLA,UCF,6,6,0,0,NA,401169227,2019-11-30,
244,4,7:47,467,467,Japreece Dean made Three Point Jumper.,49,53,-4,28,0.2687416015457417,UCLA,UCF,6,6,0,0,NA,401169227,2019-11-30,UCLA
245,4,7:19,439,439,Masseny Kaba missed Jumper.,49,53,-4,5,0.2620275895637998,UCLA,UCF,6,6,0,0,NA,401169227,2019-11-30,
246,4,7:14,434,434,Michaela Onyenwere Defensive Rebound.,49,53,-4,0,0.2605494678236337,UCLA,UCF,6,6,0,0,NA,401169227,2019-11-30,
247,4,7:14,434,434,Foul on Brittney Smith.,49,53,-4,21,0.2605494678236337,UCLA,UCF,6,6,0,0,NA,401169227,2019-11-30,
248,4,6:53,413,413,Lauryn Miller made Jumper.,51,53,-2,20,0.36858995750346873,UCLA,UCF,6,6,0,0,NA,401169227,2019-11-30,UCLA
249,4,6:33,393,393,Diamond Battles Turnover.,51,53,-2,0,0.3651805297301244,UCLA,UCF,6,6,0,0,NA,401169227,2019-11-30,
250,4,6:33,393,393,Michaela Onyenwere Steal.,51,53,-2,4,0.3651805297301244,UCLA,UCF,6,6,0,0,NA,401169227,2019-11-30,
251,4,6:29,389,389,Michaela Onyenwere made Layup.,53,53,0,1,0.5,UCLA,UCF,6,6,0,0,NA,401169227,2019-11-30,UCLA
252,4,6:28,388,388,UCF  Timeout,53,53,0,0,0.5,UCLA,UCF,5,6,1,0,NA,401169227,2019-11-30,
253,4,6:28,388,388,Official TV Timeout,53,53,0,27,0.5,UCLA,UCF,5,6,1,0,NA,401169227,2019-11-30,
254,4,6:01,361,361,Diamond Battles missed Jumper.,53,53,0,4,0.5,UCLA,UCF,5,6,1,0,NA,401169227,2019-11-30,
255,4,5:57,357,357,Michaela Onyenwere Defensive Rebound.,53,53,0,27,0.5,UCLA,UCF,5,6,1,0,NA,401169227,2019-11-30,
256,4,5:30,330,330,Foul on Lindsey Corsaro.,53,53,0,0,0.5,UCLA,UCF,5,6,1,0,NA,401169227,2019-11-30,
257,4,5:30,330,330,Lindsey Corsaro Turnover.,53,53,0,20,0.5,UCLA,UCF,5,6,1,0,NA,401169227,2019-11-30,
258,4,5:10,310,310,Georgia Gayle missed Jumper.,53,53,0,3,0.5,UCLA,UCF,5,6,0,0,NA,401169227,2019-11-30,
259,4,5:07,307,307,Japreece Dean Defensive Rebound.,53,53,0,8,0.5,UCLA,UCF,5,6,0,0,NA,401169227,2019-11-30,
260,4,4:59,299,299,Michaela Onyenwere missed Layup.,53,53,0,5,0.5,UCLA,UCF,5,6,0,0,NA,401169227,2019-11-30,
261,4,4:54,294,294,Diamond Battles Defensive Rebound.,53,53,0,19,0.5,UCLA,UCF,5,6,0,0,NA,401169227,2019-11-30,
262,4,4:35,275,275,Sianni Martin missed Three Point Jumper.,53,53,0,4,0.5,UCLA,UCF,5,6,0,0,NA,401169227,2019-11-30,
263,4,4:31,271,271,Michaela Onyenwere Defensive Rebound.,53,53,0,6,0.5,UCLA,UCF,5,6,0,0,NA,401169227,2019-11-30,
264,4,4:25,265,265,Japreece Dean made Layup.,55,53,2,15,0.6549325319428858,UCLA,UCF,5,6,0,0,NA,401169227,2019-11-30,UCLA
265,4,4:10,250,250,Foul on Charisma Osborne.,55,53,2,0,0.6529649933967033,UCLA,UCF,5,6,0,0,NA,401169227,2019-11-30,
266,4,4:10,250,250,Official TV Timeout,55,53,2,9,0.6529649933967033,UCLA,UCF,5,6,0,0,NA,401169227,2019-11-30,
267,4,4:01,241,241,Sianni Martin made Layup. Assisted by Diamond Battles.,55,55,0,1,0.5,UCLA,UCF,5,6,0,0,NA,401169227,2019-11-30,UCF
268,4,4:00,240,240,Foul on Michaela Onyenwere.,55,55,0,0,0.5,UCLA,UCF,5,6,0,0,NA,401169227,2019-11-30,
269,4,4:00,240,240,Sianni Martin made Free Throw.,55,56,-1,22,0.42205159872083775,UCLA,UCF,5,6,0,0,NA,401169227,2019-11-30,UCF
270,4,3:38,218,218,Lindsey Corsaro missed Three Point Jumper.,55,56,-1,4,0.4208963804426877,UCLA,UCF,5,6,0,0,NA,401169227,2019-11-30,
271,4,3:34,214,214,Lauryn Miller Offensive Rebound.,55,56,-1,0,0.4202422927351815,UCLA,UCF,5,6,0,0,NA,401169227,2019-11-30,
272,4,3:34,214,214,Lauryn Miller missed Layup.,55,56,-1,4,0.4202422927351815,UCLA,UCF,5,6,0,0,NA,401169227,2019-11-30,
273,4,3:30,210,210,Charisma Osborne Offensive Rebound.,55,56,-1,2,0.41941613904916414,UCLA,UCF,5,6,0,0,NA,401169227,2019-11-30,
274,4,3:28,208,208,Japreece Dean missed Layup.,55,56,-1,3,0.41893415425786323,UCLA,UCF,5,6,0,0,NA,401169227,2019-11-30,
275,4,3:25,205,205,Georgia Gayle Defensive Rebound.,55,56,-1,17,0.41812014132543057,UCLA,UCF,5,6,0,0,NA,401169227,2019-11-30,
276,4,3:08,188,188,Diamond Battles missed Layup.,55,56,-1,3,0.4112087740686504,UCLA,UCF,5,6,0,0,NA,401169227,2019-11-30,
277,4,3:05,185,185,Lauryn Miller Defensive Rebound.,55,56,-1,8,0.40969226941947817,UCLA,UCF,5,6,0,0,NA,401169227,2019-11-30,
278,4,2:57,177,177,Michaela Onyenwere missed Layup.,55,56,-1,4,0.40561309102493875,UCLA,UCF,5,6,0,0,NA,401169227,2019-11-30,
279,4,2:53,173,173,Brittney Smith Defensive Rebound.,55,56,-1,18,0.4035401125196468,UCLA,UCF,5,6,0,0,NA,401169227,2019-11-30,
280,4,2:35,155,155,Sianni Martin missed Jumper.,55,56,-1,3,0.3937055684347136,UCLA,UCF,5,6,0,0,NA,401169227,2019-11-30,
281,4,2:32,152,152,Michaela Onyenwere Defensive Rebound.,55,56,-1,30,0.391955950859103,UCLA,UCF,5,6,0,0,NA,401169227,2019-11-30,
282,4,2:02,122,122,Japreece Dean missed Jumper.,55,56,-1,7,0.3718028303436294,UCLA,UCF,5,6,0,0,NA,401169227,2019-11-30,
283,4,1:55,115,115,Michaela Onyenwere Offensive Rebound.,55,56,-1,5,0.3662288278939948,UCLA,UCF,5,6,0,0,NA,401169227,2019-11-30,
284,4,1:50,110,110,Foul on Masseny Kaba.,55,56,-1,0,0.36200569436953534,UCLA,UCF,5,6,0,1,NA,401169227,2019-11-30,
285,4,1:50,110,110,Japreece Dean missed Free Throw.,55,56,-1,0,0.36200569436953534,UCLA,UCF,5,6,0,1,NA,401169227,2019-11-30,
286,4,1:50,110,110,UCLA Offensive Rebound.,55,56,-1,0,0.36200569436953534,UCLA,UCF,5,6,0,1,NA,401169227,2019-11-30,
287,4,1:50,110,110,Japreece Dean made Free Throw.,56,56,0,0,0.5,UCLA,UCF,5,6,0,1,NA,401169227,2019-11-30,UCLA
288,4,1:50,110,110,UCLA  Timeout,56,56,0,28,0.5,UCLA,UCF,5,5,0,1,NA,401169227,2019-11-30,
289,4,1:22,82,82,Diamond Battles missed Jumper.,56,56,0,3,0.5,UCLA,UCF,5,5,0,1,NA,401169227,2019-11-30,
290,4,1:19,79,79,Michaela Onyenwere Defensive Rebound.,56,56,0,26,0.5,UCLA,UCF,5,5,0,1,NA,401169227,2019-11-30,
291,4,0:53,53,53,Charisma Osborne made Three Point Jumper. Assisted by Lindsey Corsaro.,59,56,3,3,0.924456496002796,UCLA,UCF,5,5,0,1,NA,401169227,2019-11-30,UCLA
292,4,0:50,50,50,UCF  Timeout,59,56,3,7,0.9278988280641667,UCLA,UCF,4,5,1,1,NA,401169227,2019-11-30,
293,4,0:43,43,43,Sianni Martin Turnover.,59,56,3,25,0.9355942934384232,UCLA,UCF,4,5,1,0,NA,401169227,2019-11-30,
294,4,0:18,18,18,Foul on Sianni Martin.,59,56,3,0,0.9587762315563105,UCLA,UCF,4,5,1,0,NA,401169227,2019-11-30,
295,4,0:18,18,18,Lindsey Corsaro missed Free Throw.,59,56,3,0,0.9587762315563105,UCLA,UCF,4,5,1,0,NA,401169227,2019-11-30,
296,4,0:18,18,18,UCLA Offensive Rebound.,59,56,3,0,0.9587762315563105,UCLA,UCF,4,5,1,0,NA,401169227,2019-11-30,
297,4,0:18,18,18,Lindsey Corsaro missed Free Throw.,59,56,3,2,0.9587762315563105,UCLA,UCF,4,5,1,0,NA,401169227,2019-11-30,
298,4,0:16,16,16,Michaela Onyenwere Offensive Rebound.,59,56,3,1,0.9603490921001517,UCLA,UCF,4,5,1,0,NA,401169227,2019-11-30,
299,4,0:15,15,15,Michaela Onyenwere made Layup.,61,56,5,0,0.9952559108828367,UCLA,UCF,4,5,1,0,NA,401169227,2019-11-30,UCLA
300,4,0:15,15,15,UCF  Timeout,61,56,5,9,0.9952559108828367,UCLA,UCF,3,5,1,0,NA,401169227,2019-11-30,
301,4,0:06,6,6,Sianni Martin missed Three Point Jumper.,61,56,5,5,0.9965374199946047,UCLA,UCF,3,5,1,0,NA,401169227,2019-11-30,
302,4,0:01,1,1,Masseny Kaba Offensive Rebound.,61,56,5,0,0.9971100707139258,UCLA,UCF,3,5,1,0,NA,401169227,2019-11-30,
303,4,0:01,1,1,Masseny Kaba missed Layup.,61,56,5,1,0.9971100707139258,UCLA,UCF,3,5,1,0,NA,401169227,2019-11-30,
304,4,0:00,0,0,Charisma Osborne Defensive Rebound.,61,56,5,0,1,UCLA,UCF,3,5,1,0,NA,401169227,2019-11-30,
305,4,0:00,0,0,End of 4th Quarter,61,56,5,0,1,UCLA,UCF,3,5,1,0,NA,401169227,2019-11-30,
306,4,0:00,0,0,End of Game,61,56,5,0,1,UCLA,UCF,3,5,1,0,NA,401169227,2019-11-30,
