play_id,period,time_remaining_period,secs_remaining,secs_remaining_absolute,description,home_score,away_score,score_diff,play_length,win_prob,home,away,home_time_out_remaining,away_time_out_remaining,home_timeout_ind,away_timeout_ind,home_favored_by,game_id,date,whichScored
1,1,9:55,2395,2395,Japreece Dean made Three Point Jumper. Assisted by Lindsey Corsaro.,0,0,0,23,0.5,UCLA,UCF,4,4,0,0,NA,401169227,2019-11-30,NA
2,1,9:32,2372,2372,Georgia Gayle missed Three Point Jumper.,3,0,3,5,0.5667055204091812,UCLA,UCF,4,4,0,0,NA,401169227,2019-11-30,UCLA
3,1,9:27,2367,2367,Charisma Osborne Defensive Rebound.,3,0,3,4,0.5668642200525459,UCLA,UCF,4,4,0,0,NA,401169227,2019-11-30,
4,1,9:23,2363,2363,Michaela Onyenwere made Three Point Jumper. Assisted by Japreece Dean.,6,0,6,18,0.6316203077580519,UCLA,UCF,4,4,0,0,NA,401169227,2019-11-30,UCLA
5,1,9:05,2345,2345,Kay Kay Wright missed Jumper.,6,0,6,4,0.6327130954793688,UCLA,UCF,4,4,0,0,NA,401169227,2019-11-30,
6,1,9:01,2341,2341,Charisma Osborne Defensive Rebound.,6,0,6,10,0.6329573629568659,UCLA,UCF,4,4,0,0,NA,401169227,2019-11-30,
7,1,8:51,2331,2331,Michaela Onyenwere missed Three Point Jumper.,6,0,6,4,0.633570183289535,UCLA,UCF,4,4,0,0,NA,401169227,2019-11-30,
8,1,8:47,2327,2327,Kay Kay Wright Defensive Rebound.,6,0,6,11,0.6338161458867859,UCLA,UCF,4,4,0,0,NA,401169227,2019-11-30,
9,1,8:36,2316,2316,Masseny Kaba made Layup.,6,2,4,15,0.5909029385104733,UCLA,UCF,4,4,0,0,NA,401169227,2019-11-30,UCF
10,1,8:21,2301,2301,Lindsey Corsaro missed Layup.,6,2,4,3,0.5915499701662879,UCLA,UCF,4,4,0,0,NA,401169227,2019-11-30,
11,1,8:18,2298,2298,Brittney Smith Defensive Rebound.,6,2,4,10,0.5916799007296933,UCLA,UCF,4,4,0,0,NA,401169227,2019-11-30,
12,1,8:08,2288,2288,Brittney Smith made Jumper.,6,4,2,14,0.5464546722449519,UCLA,UCF,4,4,0,0,NA,401169227,2019-11-30,UCF
13,1,7:54,2274,2274,Lindsey Corsaro missed Layup.,6,4,2,3,0.5467682100997949,UCLA,UCF,4,4,0,0,NA,401169227,2019-11-30,
14,1,7:51,2271,2271,Brittney Smith Defensive Rebound.,6,4,2,8,0.5468356278580805,UCLA,UCF,4,4,0,0,NA,401169227,2019-11-30,
15,1,7:43,2263,2263,Kay Kay Wright made Jumper.,6,6,0,18,0.5,UCLA,UCF,4,4,0,0,NA,401169227,2019-11-30,UCF
16,1,7:25,2245,2245,Charisma Osborne missed Three Point Jumper.,6,6,0,4,0.5,UCLA,UCF,4,4,0,0,NA,401169227,2019-11-30,
17,1,7:21,2241,2241,Michaela Onyenwere Offensive Rebound.,6,6,0,1,0.5,UCLA,UCF,4,4,0,0,NA,401169227,2019-11-30,
18,1,7:20,2240,2240,Michaela Onyenwere missed Layup.,6,6,0,2,0.5,UCLA,UCF,4,4,0,0,NA,401169227,2019-11-30,
19,1,7:18,2238,2238,Brittney Smith Defensive Rebound.,6,6,0,13,0.5,UCLA,UCF,4,4,0,0,NA,401169227,2019-11-30,
20,1,7:05,2225,2225,Foul on Masseny Kaba.,6,6,0,0,0.5,UCLA,UCF,4,4,0,0,NA,401169227,2019-11-30,
21,1,7:05,2225,2225,Masseny Kaba Turnover.,6,6,0,25,0.5,UCLA,UCF,4,4,0,0,NA,401169227,2019-11-30,
22,1,6:40,2200,2200,Kiara Jefferson made Jumper.,8,6,2,30,0.5484509368654422,UCLA,UCF,4,4,0,0,NA,401169227,2019-11-30,UCLA
23,1,6:10,2170,2170,Diamond Battles made Layup.,8,8,0,0,0.5,UCLA,UCF,4,4,0,0,NA,401169227,2019-11-30,UCF
24,1,6:10,2170,2170,Foul on Lauryn Miller.,8,8,0,0,0.5,UCLA,UCF,4,4,0,0,NA,401169227,2019-11-30,
25,1,6:10,2170,2170,Diamond Battles missed Free Throw.,8,8,0,2,0.5,UCLA,UCF,4,4,0,0,NA,401169227,2019-11-30,
26,1,6:08,2168,2168,Michaela Onyenwere Defensive Rebound.,8,8,0,14,0.5,UCLA,UCF,4,4,0,0,NA,401169227,2019-11-30,
27,1,5:54,2154,2154,Natalie Chou missed Three Point Jumper.,8,8,0,4,0.5,UCLA,UCF,4,4,0,0,NA,401169227,2019-11-30,
28,1,5:50,2150,2150,Courtajia Sanders Defensive Rebound.,8,8,0,3,0.5,UCLA,UCF,4,4,0,0,NA,401169227,2019-11-30,
29,1,5:47,2147,2147,Kay Kay Wright missed Jumper.,8,8,0,4,0.5,UCLA,UCF,4,4,0,0,NA,401169227,2019-11-30,
30,1,5:43,2143,2143,Michaela Onyenwere Defensive Rebound.,8,8,0,2,0.5,UCLA,UCF,4,4,0,0,NA,401169227,2019-11-30,
31,1,5:41,2141,2141,Michaela Onyenwere Turnover.,8,8,0,0,0.5,UCLA,UCF,4,4,0,0,NA,401169227,2019-11-30,
32,1,5:41,2141,2141,Sianni Martin Steal.,8,8,0,5,0.5,UCLA,UCF,4,4,0,0,NA,401169227,2019-11-30,
33,1,5:36,2136,2136,Foul on Michaela Onyenwere.,8,8,0,0,0.5,UCLA,UCF,4,4,0,0,NA,401169227,2019-11-30,
34,1,5:36,2136,2136,Sianni Martin made Free Throw.,8,9,-1,0,0.47497153990593205,UCLA,UCF,4,4,0,0,NA,401169227,2019-11-30,UCF
35,1,5:36,2136,2136,Sianni Martin made Free Throw.,8,10,-2,12,0.450068193702164,UCLA,UCF,4,4,0,0,NA,401169227,2019-11-30,UCF
36,1,5:24,2124,2124,Natalie Chou missed Layup.,8,10,-2,0,0.44978723503534246,UCLA,UCF,4,4,0,0,NA,401169227,2019-11-30,
37,1,5:24,2124,2124,Brittney Smith Block.,8,10,-2,4,0.44978723503534246,UCLA,UCF,4,4,0,0,NA,401169227,2019-11-30,
38,1,5:20,2120,2120,Brittney Smith Defensive Rebound.,8,10,-2,19,0.4496933047773432,UCLA,UCF,4,4,0,0,NA,401169227,2019-11-30,
39,1,5:01,2101,2101,Brittney Smith missed Layup.,8,10,-2,2,0.44924515656012415,UCLA,UCF,4,4,0,0,NA,401169227,2019-11-30,
40,1,4:59,2099,2099,Brittney Smith Offensive Rebound.,8,10,-2,2,0.4491977869424719,UCLA,UCF,4,4,0,0,NA,401169227,2019-11-30,
41,1,4:57,2097,2097,Brittney Smith made Layup.,8,12,-4,8,0.3993418386531157,UCLA,UCF,4,4,0,0,NA,401169227,2019-11-30,UCF
42,1,4:49,2089,2089,Natalie Chou missed Three Point Jumper.,8,12,-4,3,0.3989734304972276,UCLA,UCF,4,4,0,0,NA,401169227,2019-11-30,
43,1,4:46,2086,2086,UCLA Offensive Rebound.,8,12,-4,0,0.3988349835971185,UCLA,UCF,4,4,0,0,NA,401169227,2019-11-30,
44,1,4:46,2086,2086,Foul on Jnaya Walker.,8,12,-4,0,0.3988349835971185,UCLA,UCF,4,4,0,0,NA,401169227,2019-11-30,
45,1,4:46,2086,2086,Official TV Timeout,8,12,-4,21,0.3988349835971185,UCLA,UCF,4,4,0,0,NA,401169227,2019-11-30,
46,1,4:25,2065,2065,Japreece Dean made Layup.,10,12,-2,17,0.4483864116833693,UCLA,UCF,4,4,0,0,NA,401169227,2019-11-30,UCLA
47,1,4:08,2048,2048,Courtajia Sanders missed Layup.,10,12,-2,0,0.4479761524920453,UCLA,UCF,4,4,0,0,NA,401169227,2019-11-30,
48,1,4:08,2048,2048,UCLA Defensive Rebound.,10,12,-2,0,0.4479761524920453,UCLA,UCF,4,4,0,0,NA,401169227,2019-11-30,
49,1,4:08,2048,2048,Chantel Horvat Block.,10,12,-2,18,0.4479761524920453,UCLA,UCF,4,4,0,0,NA,401169227,2019-11-30,
50,1,3:50,2030,2030,Kiara Jefferson missed Three Point Jumper.,10,12,-2,3,0.44753819602888806,UCLA,UCF,4,4,0,0,NA,401169227,2019-11-30,
51,1,3:47,2027,2027,Sianni Martin Defensive Rebound.,10,12,-2,6,0.4474648335063915,UCLA,UCF,4,4,0,0,NA,401169227,2019-11-30,
52,1,3:41,2021,2021,Sianni Martin missed Jumper.,10,12,-2,1,0.4473177833885138,UCLA,UCF,4,4,0,0,NA,401169227,2019-11-30,
53,1,3:40,2020,2020,UCLA Defensive Rebound.,10,12,-2,0,0.44729323250677677,UCLA,UCF,4,4,0,0,NA,401169227,2019-11-30,
54,1,3:40,2020,2020,Foul on Brittney Smith.,10,12,-2,5,0.44729323250677677,UCLA,UCF,4,4,0,0,NA,401169227,2019-11-30,
55,1,3:35,2015,2015,Foul on Sianni Martin.,10,12,-2,18,0.44717029382836343,UCLA,UCF,4,4,0,0,NA,401169227,2019-11-30,
56,1,3:17,1997,1997,Japreece Dean made Three Point Jumper. Assisted by Chantel Horvat.,13,12,1,20,0.5267134767682292,UCLA,UCF,4,4,0,0,NA,401169227,2019-11-30,UCLA
57,1,2:57,1977,1977,Foul on Charisma Osborne.,13,12,1,0,0.5269654408739634,UCLA,UCF,4,4,0,0,NA,401169227,2019-11-30,
58,1,2:57,1977,1977,Diamond Battles made Free Throw.,13,13,0,0,0.5,UCLA,UCF,4,4,0,0,NA,401169227,2019-11-30,UCF
59,1,2:57,1977,1977,Diamond Battles made Free Throw.,13,14,-1,13,0.47303455912603665,UCLA,UCF,4,4,0,0,NA,401169227,2019-11-30,UCF
60,1,2:44,1964,1964,Charisma Osborne missed Three Point Jumper.,13,14,-1,4,0.4728692893276093,UCLA,UCF,4,4,0,0,NA,401169227,2019-11-30,
61,1,2:40,1960,1960,Lindsey Corsaro Offensive Rebound.,13,14,-1,1,0.472818193272966,UCLA,UCF,4,4,0,0,NA,401169227,2019-11-30,
62,1,2:39,1959,1959,Foul on Diamond Battles.,13,14,-1,0,0.47280540107696134,UCLA,UCF,4,4,0,0,NA,401169227,2019-11-30,
63,1,2:39,1959,1959,Lindsey Corsaro made Free Throw.,14,14,0,0,0.5,UCLA,UCF,4,4,0,0,NA,401169227,2019-11-30,UCLA
64,1,2:39,1959,1959,Lindsey Corsaro missed Free Throw.,14,14,0,2,0.5,UCLA,UCF,4,4,0,0,NA,401169227,2019-11-30,
65,1,2:37,1957,1957,Masseny Kaba Defensive Rebound.,14,14,0,28,0.5,UCLA,UCF,4,4,0,0,NA,401169227,2019-11-30,
66,1,2:09,1929,1929,Masseny Kaba missed Jumper.,14,14,0,3,0.5,UCLA,UCF,4,4,0,0,NA,401169227,2019-11-30,
67,1,2:06,1926,1926,Destiny Thomas Offensive Rebound.,14,14,0,11,0.5,UCLA,UCF,4,4,0,0,NA,401169227,2019-11-30,
68,1,1:55,1915,1915,Sianni Martin missed Three Point Jumper.,14,14,0,4,0.5,UCLA,UCF,4,4,0,0,NA,401169227,2019-11-30,
69,1,1:51,1911,1911,Chantel Horvat Defensive Rebound.,14,14,0,20,0.5,UCLA,UCF,4,4,0,0,NA,401169227,2019-11-30,
70,1,1:31,1891,1891,Lauryn Miller missed Jumper.,14,14,0,4,0.5,UCLA,UCF,4,4,0,0,NA,401169227,2019-11-30,
71,1,1:27,1887,1887,Masseny Kaba Defensive Rebound.,14,14,0,17,0.5,UCLA,UCF,4,4,0,0,NA,401169227,2019-11-30,
72,1,1:10,1870,1870,Sianni Martin Turnover.,14,14,0,15,0.5,UCLA,UCF,4,4,0,0,NA,401169227,2019-11-30,
73,1,0:55,1855,1855,Chantel Horvat missed Layup.,14,14,0,2,0.5,UCLA,UCF,4,4,0,0,NA,401169227,2019-11-30,
74,1,0:53,1853,1853,Masseny Kaba Defensive Rebound.,14,14,0,9,0.5,UCLA,UCF,4,4,0,0,NA,401169227,2019-11-30,
75,1,0:44,1844,1844,Sianni Martin made Three Point Jumper. Assisted by Diamond Battles.,14,17,-3,20,0.41468841227594394,UCLA,UCF,4,4,0,0,NA,401169227,2019-11-30,UCF
76,1,0:24,1824,1824,Japreece Dean made Three Point Jumper. Assisted by Lindsey Corsaro.,17,17,0,22,0.5,UCLA,UCF,4,4,0,0,NA,401169227,2019-11-30,UCLA
77,1,0:02,1802,1802,Georgia Gayle made Three Point Jumper. Assisted by Sianni Martin.,17,20,-3,2,0.4130713725788033,UCLA,UCF,4,4,0,0,NA,401169227,2019-11-30,UCF
78,1,0:00,1800,1800,End of 1st Quarter,17,20,-3,10,0.4129936088523014,UCLA,UCF,4,4,0,0,NA,401169227,2019-11-30,
79,2,9:50,1790,1790,Sianni Martin Turnover.,17,20,-3,11,0.4126035087506628,UCLA,UCF,4,4,0,0,NA,401169227,2019-11-30,
80,2,9:39,1779,1779,Lauryn Miller made Layup. Assisted by Japreece Dean.,19,20,-1,20,0.4704515750294142,UCLA,UCF,4,4,0,0,NA,401169227,2019-11-30,UCLA
81,2,9:19,1759,1759,Sianni Martin made Three Point Jumper. Assisted by Diamond Battles.,19,23,-4,14,0.3827971801922037,UCLA,UCF,4,4,0,0,NA,401169227,2019-11-30,UCF
82,2,9:05,1745,1745,Lindsey Corsaro made Three Point Jumper. Assisted by Japreece Dean.,22,23,-1,15,0.4699868252033988,UCLA,UCF,4,4,0,0,NA,401169227,2019-11-30,UCLA
83,2,8:50,1730,1730,Georgia Gayle missed Three Point Jumper.,22,23,-1,4,0.469777666955943,UCLA,UCF,4,4,0,0,NA,401169227,2019-11-30,
84,2,8:46,1726,1726,Charisma Osborne Defensive Rebound.,22,23,-1,10,0.4697214132223624,UCLA,UCF,4,4,0,0,NA,401169227,2019-11-30,
85,2,8:36,1716,1716,Lauryn Miller missed Layup.,22,23,-1,3,0.46957984556608334,UCLA,UCF,4,4,0,0,NA,401169227,2019-11-30,
86,2,8:33,1713,1713,Michaela Onyenwere Offensive Rebound.,22,23,-1,0,0.46953710671225657,UCLA,UCF,4,4,0,0,NA,401169227,2019-11-30,
87,2,8:33,1713,1713,Foul on Brittney Smith.,22,23,-1,0,0.46953710671225657,UCLA,UCF,4,4,0,0,NA,401169227,2019-11-30,
88,2,8:33,1713,1713,Michaela Onyenwere made Free Throw.,23,23,0,0,0.5,UCLA,UCF,4,4,0,0,NA,401169227,2019-11-30,UCLA
89,2,8:33,1713,1713,Michaela Onyenwere made Free Throw.,24,23,1,17,0.5304628932877434,UCLA,UCF,4,4,0,0,NA,401169227,2019-11-30,UCLA
90,2,8:16,1696,1696,Sianni Martin made Three Point Jumper. Assisted by Diamond Battles.,24,26,-2,15,0.43881566986097503,UCLA,UCF,4,4,0,0,NA,401169227,2019-11-30,UCF
91,2,8:01,1681,1681,Michaela Onyenwere made Jumper.,26,26,0,22,0.5,UCLA,UCF,4,4,0,0,NA,401169227,2019-11-30,UCLA
92,2,7:39,1659,1659,Courtajia Sanders Turnover.,26,26,0,0,0.5,UCLA,UCF,4,4,0,0,NA,401169227,2019-11-30,
93,2,7:39,1659,1659,Lauryn Miller Steal.,26,26,0,4,0.5,UCLA,UCF,4,4,0,0,NA,401169227,2019-11-30,
94,2,7:35,1655,1655,Japreece Dean made Layup. Assisted by Charisma Osborne.,28,26,2,3,0.5623433181028693,UCLA,UCF,4,4,0,0,NA,401169227,2019-11-30,UCLA
95,2,7:32,1652,1652,Official TV Timeout,28,26,2,11,0.5624258875994105,UCLA,UCF,4,4,0,0,NA,401169227,2019-11-30,
96,2,7:21,1641,1641,Diamond Battles Turnover.,28,26,2,0,0.5627266811188697,UCLA,UCF,4,4,0,0,NA,401169227,2019-11-30,
97,2,7:21,1641,1641,Charisma Osborne Steal.,28,26,2,19,0.5627266811188697,UCLA,UCF,4,4,0,0,NA,401169227,2019-11-30,
98,2,7:02,1622,1622,Charisma Osborne missed Three Point Jumper.,28,26,2,3,0.5632406780112991,UCLA,UCF,4,4,0,0,NA,401169227,2019-11-30,
99,2,6:59,1619,1619,Lindsey Corsaro Offensive Rebound.,28,26,2,3,0.5633213893265225,UCLA,UCF,4,4,0,0,NA,401169227,2019-11-30,
100,2,6:56,1616,1616,Charisma Osborne missed Three Point Jumper.,28,26,2,4,0.563402019701762,UCLA,UCF,4,4,0,0,NA,401169227,2019-11-30,
101,2,6:52,1612,1612,UCLA Offensive Rebound.,28,26,2,0,0.5635094262892736,UCLA,UCF,4,4,0,0,NA,401169227,2019-11-30,
102,2,6:52,1612,1612,Foul on Destiny Thomas.,28,26,2,14,0.5635094262892736,UCLA,UCF,4,4,0,0,NA,401169227,2019-11-30,
103,2,6:38,1598,1598,Michaela Onyenwere Turnover.,28,26,2,27,0.5638849226553919,UCLA,UCF,4,4,0,0,NA,401169227,2019-11-30,
104,2,6:11,1571,1571,Diamond Battles Turnover.,28,26,2,9,0.5646117213053873,UCLA,UCF,4,4,0,0,NA,401169227,2019-11-30,
105,2,6:02,1562,1562,Michaela Onyenwere made Layup. Assisted by Lauryn Miller.,30,26,4,17,0.6275660984020264,UCLA,UCF,4,4,0,0,NA,401169227,2019-11-30,UCLA
106,2,5:45,1545,1545,Diamond Battles made Layup.,30,28,2,12,0.5653232062025131,UCLA,UCF,4,4,0,0,NA,401169227,2019-11-30,UCF
107,2,5:33,1533,1533,Lauryn Miller missed Jumper.,30,28,2,4,0.5656580965698224,UCLA,UCF,4,4,0,0,NA,401169227,2019-11-30,
108,2,5:29,1529,1529,UCF Defensive Rebound.,30,28,2,17,0.5657708828687078,UCLA,UCF,4,4,0,0,NA,401169227,2019-11-30,
109,2,5:12,1512,1512,Masseny Kaba missed Layup.,30,28,2,4,0.5662577340269302,UCLA,UCF,4,4,0,0,NA,401169227,2019-11-30,
110,2,5:08,1508,1508,Michaela Onyenwere Defensive Rebound.,30,28,2,29,0.5663742429985739,UCLA,UCF,4,4,0,0,NA,401169227,2019-11-30,
111,2,4:39,1479,1479,Japreece Dean missed Three Point Jumper.,30,28,2,4,0.5672455133490617,UCLA,UCF,4,4,0,0,NA,401169227,2019-11-30,
112,2,4:35,1475,1475,Diamond Battles Defensive Rebound.,30,28,2,7,0.5673697931127358,UCLA,UCF,4,4,0,0,NA,401169227,2019-11-30,
113,2,4:28,1468,1468,Diamond Battles missed Layup.,30,28,2,2,0.5675899531639167,UCLA,UCF,4,4,0,0,NA,401169227,2019-11-30,
114,2,4:26,1466,1466,Jnaya Walker Offensive Rebound.,30,28,2,10,0.567653501260949,UCLA,UCF,4,4,0,0,NA,401169227,2019-11-30,
115,2,4:16,1456,1456,Masseny Kaba Turnover.,30,28,2,0,0.5679757473721385,UCLA,UCF,4,4,0,0,NA,401169227,2019-11-30,
116,2,4:16,1456,1456,Chantel Horvat Steal.,30,28,2,8,0.5679757473721385,UCLA,UCF,4,4,0,0,NA,401169227,2019-11-30,
117,2,4:08,1448,1448,Michaela Onyenwere missed Jumper.,30,28,2,4,0.5682388887188476,UCLA,UCF,4,4,0,0,NA,401169227,2019-11-30,
118,2,4:04,1444,1444,Masseny Kaba Defensive Rebound.,30,28,2,6,0.5683700526011417,UCLA,UCF,4,4,0,0,NA,401169227,2019-11-30,
119,2,3:58,1438,1438,Masseny Kaba Turnover.,30,28,2,0,0.5685646516002714,UCLA,UCF,4,4,0,0,NA,401169227,2019-11-30,
120,2,3:58,1438,1438,Natalie Chou Steal.,30,28,2,4,0.5685646516002714,UCLA,UCF,4,4,0,0,NA,401169227,2019-11-30,
121,2,3:54,1434,1434,Natalie Chou missed Layup.,30,28,2,7,0.5686930434825275,UCLA,UCF,4,4,0,0,NA,401169227,2019-11-30,
122,2,3:47,1427,1427,Diamond Battles Defensive Rebound.,30,28,2,13,0.5689153595689013,UCLA,UCF,4,4,0,0,NA,401169227,2019-11-30,
123,2,3:34,1414,1414,Foul on Japreece Dean.,30,28,2,20,0.5693212374018192,UCLA,UCF,4,4,0,0,NA,401169227,2019-11-30,
124,2,3:14,1394,1394,Foul on Michaela Onyenwere.,30,28,2,0,0.5699321643304575,UCLA,UCF,4,4,0,0,NA,401169227,2019-11-30,
125,2,3:14,1394,1394,Diamond Battles made Free Throw.,30,29,1,0,0.5351387773616841,UCLA,UCF,4,4,0,0,NA,401169227,2019-11-30,UCF
126,2,3:14,1394,1394,Diamond Battles missed Free Throw.,30,29,1,3,0.5351387773616841,UCLA,UCF,4,4,0,0,NA,401169227,2019-11-30,
127,2,3:11,1391,1391,Masseny Kaba Offensive Rebound.,30,29,1,0,0.5351847679765457,UCLA,UCF,4,4,0,0,NA,401169227,2019-11-30,
128,2,3:11,1391,1391,Masseny Kaba made Layup.,30,31,-1,25,0.4648152320234543,UCLA,UCF,4,4,0,0,NA,401169227,2019-11-30,UCF
129,2,2:46,1366,1366,Michaela Onyenwere made Three Point Jumper. Assisted by Natalie Chou.,33,31,2,36,0.5707731704333556,UCLA,UCF,4,4,0,0,NA,401169227,2019-11-30,UCLA
130,2,2:10,1330,1330,Sianni Martin missed Jumper.,33,31,2,4,0.5718610733850391,UCLA,UCF,4,4,0,0,NA,401169227,2019-11-30,
131,2,2:06,1326,1326,Jnaya Walker Offensive Rebound.,33,31,2,3,0.5719841566532281,UCLA,UCF,4,4,0,0,NA,401169227,2019-11-30,
132,2,2:03,1323,1323,Jnaya Walker missed Layup.,33,31,2,2,0.572076903271759,UCLA,UCF,4,4,0,0,NA,401169227,2019-11-30,
133,2,2:01,1321,1321,Jnaya Walker Offensive Rebound.,33,31,2,0,0.5721389555107412,UCLA,UCF,4,4,0,0,NA,401169227,2019-11-30,
134,2,2:01,1321,1321,Jnaya Walker Turnover.,33,31,2,0,0.5721389555107412,UCLA,UCF,4,4,0,0,NA,401169227,2019-11-30,
135,2,2:01,1321,1321,Kayla Owens Steal.,33,31,2,21,0.5721389555107412,UCLA,UCF,4,4,0,0,NA,401169227,2019-11-30,
136,2,1:40,1300,1300,Chantel Horvat missed Jumper.,33,31,2,0,0.5728031960130557,UCLA,UCF,4,4,0,0,NA,401169227,2019-11-30,
137,2,1:40,1300,1300,Masseny Kaba Block.,33,31,2,4,0.5728031960130557,UCLA,UCF,4,4,0,0,NA,401169227,2019-11-30,
138,2,1:36,1296,1296,Chantel Horvat Offensive Rebound.,33,31,2,2,0.5729327776344029,UCLA,UCF,4,4,0,0,NA,401169227,2019-11-30,
139,2,1:34,1294,1294,Foul on Lindsey Corsaro.,33,31,2,0,0.5729979873928751,UCLA,UCF,4,4,0,0,NA,401169227,2019-11-30,
140,2,1:34,1294,1294,Lindsey Corsaro Turnover.,33,31,2,21,0.5729979873928751,UCLA,UCF,4,4,0,0,NA,401169227,2019-11-30,
141,2,1:13,1273,1273,Foul on Lindsey Corsaro.,33,31,2,19,0.5737016349170487,UCLA,UCF,4,4,0,0,NA,401169227,2019-11-30,
142,2,0:54,1254,1254,Masseny Kaba missed Layup.,33,31,2,4,0.5743731696974178,UCLA,UCF,4,4,0,0,NA,401169227,2019-11-30,
143,2,0:50,1250,1250,Destiny Thomas Offensive Rebound.,33,31,2,12,0.5745194152149439,UCLA,UCF,4,4,0,0,NA,401169227,2019-11-30,
144,2,0:38,1238,1238,Diamond Battles missed Jumper.,33,31,2,2,0.5749693836191339,UCLA,UCF,4,4,0,0,NA,401169227,2019-11-30,
145,2,0:36,1236,1236,Sianni Martin Offensive Rebound.,33,31,2,3,0.575046096403292,UCLA,UCF,4,4,0,0,NA,401169227,2019-11-30,
146,2,0:33,1233,1233,Sianni Martin missed Jumper.,33,31,2,0,0.5751621264482069,UCLA,UCF,4,4,0,0,NA,401169227,2019-11-30,
147,2,0:33,1233,1233,Chantel Horvat Block.,33,31,2,4,0.5751621264482069,UCLA,UCF,4,4,0,0,NA,401169227,2019-11-30,
148,2,0:29,1229,1229,Chantel Horvat Defensive Rebound.,33,31,2,1,0.5753186667761835,UCLA,UCF,4,4,0,0,NA,401169227,2019-11-30,
149,2,0:28,1228,1228,Chantel Horvat missed Layup.,33,31,2,7,0.5753581356307944,UCLA,UCF,4,4,0,0,NA,401169227,2019-11-30,
150,2,0:21,1221,1221,Diamond Battles Defensive Rebound.,33,31,2,10,0.5756382623846247,UCLA,UCF,4,4,0,0,NA,401169227,2019-11-30,
151,2,0:11,1211,1211,Diamond Battles missed Jumper.,33,31,2,5,0.5760505997298857,UCLA,UCF,4,4,0,0,NA,401169227,2019-11-30,
152,2,0:06,1206,1206,Lauryn Miller Defensive Rebound.,33,31,2,4,0.5762604048707007,UCLA,UCF,4,4,0,0,NA,401169227,2019-11-30,
153,2,0:02,1202,1202,Japreece Dean missed Jumper.,33,31,2,2,0.576426700548488,UCLA,UCF,4,4,0,0,NA,401169227,2019-11-30,
154,2,0:00,1200,1200,UCF Defensive Rebound.,33,31,2,0,0.5765093285143758,UCLA,UCF,4,4,0,0,NA,401169227,2019-11-30,
155,2,0:00,1200,1200,End of 2nd Quarter,33,31,2,18,0.5765093285143758,UCLA,UCF,4,4,0,0,NA,401169227,2019-11-30,
156,3,9:42,1182,1182,Sianni Martin missed Three Point Jumper.,33,31,2,5,0.5772393125887524,UCLA,UCF,5,5,0,0,NA,401169227,2019-11-30,
157,3,9:37,1177,1177,UCF Offensive Rebound.,33,31,2,19,0.5774383611488583,UCLA,UCF,5,5,0,0,NA,401169227,2019-11-30,
158,3,9:18,1158,1158,Sianni Martin made Jumper. Assisted by Masseny Kaba.,33,33,0,7,0.5,UCLA,UCF,5,5,0,0,NA,401169227,2019-11-30,UCF
159,3,9:11,1151,1151,Lauryn Miller missed Layup.,33,33,0,3,0.5,UCLA,UCF,5,5,0,0,NA,401169227,2019-11-30,
160,3,9:08,1148,1148,Sianni Martin Defensive Rebound.,33,33,0,17,0.5,UCLA,UCF,5,5,0,0,NA,401169227,2019-11-30,
161,3,8:51,1131,1131,Brittney Smith Turnover.,33,33,0,11,0.5,UCLA,UCF,5,5,0,0,NA,401169227,2019-11-30,
162,3,8:40,1120,1120,Michaela Onyenwere made Jumper.,35,33,2,26,0.5796559777708359,UCLA,UCF,5,5,0,0,NA,401169227,2019-11-30,UCLA
163,3,8:14,1094,1094,Brittney Smith made Jumper.,35,35,0,22,0.5,UCLA,UCF,5,5,0,0,NA,401169227,2019-11-30,UCF
164,3,7:52,1072,1072,Lindsey Corsaro missed Jumper.,35,35,0,3,0.5,UCLA,UCF,5,5,0,0,NA,401169227,2019-11-30,
165,3,7:49,1069,1069,Georgia Gayle Defensive Rebound.,35,35,0,3,0.5,UCLA,UCF,5,5,0,0,NA,401169227,2019-11-30,
166,3,7:46,1066,1066,Sianni Martin made Layup.,35,37,-2,8,0.4181762961118913,UCLA,UCF,5,5,0,0,NA,401169227,2019-11-30,UCF
167,3,7:38,1058,1058,Japreece Dean missed Jumper.,35,37,-2,5,0.41783657143446495,UCLA,UCF,5,5,0,0,NA,401169227,2019-11-30,
168,3,7:33,1053,1053,Masseny Kaba Defensive Rebound.,35,37,-2,18,0.41762084919503784,UCLA,UCF,5,5,0,0,NA,401169227,2019-11-30,
169,3,7:15,1035,1035,Brittney Smith missed Jumper.,35,37,-2,3,0.41681981063082846,UCLA,UCF,5,5,0,0,NA,401169227,2019-11-30,
170,3,7:12,1032,1032,Japreece Dean Defensive Rebound.,35,37,-2,6,0.41668222593180476,UCLA,UCF,5,5,0,0,NA,401169227,2019-11-30,
171,3,7:06,1026,1026,Lindsey Corsaro Turnover.,35,37,-2,0,0.416403241401469,UCLA,UCF,5,5,0,0,NA,401169227,2019-11-30,
172,3,7:06,1026,1026,Masseny Kaba Steal.,35,37,-2,15,0.416403241401469,UCLA,UCF,5,5,0,0,NA,401169227,2019-11-30,
173,3,6:51,1011,1011,Diamond Battles missed Layup.,35,37,-2,6,0.41568187158524655,UCLA,UCF,5,5,0,0,NA,401169227,2019-11-30,
174,3,6:45,1005,1005,Brittney Smith Offensive Rebound.,35,37,-2,0,0.4153830171859313,UCLA,UCF,5,5,0,0,NA,401169227,2019-11-30,
175,3,6:45,1005,1005,Brittney Smith made Layup.,35,39,-4,9,0.33547796761009274,UCLA,UCF,5,5,0,0,NA,401169227,2019-11-30,UCF
176,3,6:36,996,996,Lauryn Miller made Layup.,37,39,-2,18,0.41492280986996644,UCLA,UCF,5,5,0,0,NA,401169227,2019-11-30,UCLA
177,3,6:18,978,978,Foul on Brittney Smith.,37,39,-2,7,0.41395597458164246,UCLA,UCF,5,5,0,0,NA,401169227,2019-11-30,
178,3,6:11,971,971,Lindsey Corsaro missed Three Point Jumper.,37,39,-2,4,0.41356197675329026,UCLA,UCF,5,5,0,0,NA,401169227,2019-11-30,
179,3,6:07,967,967,Chantel Horvat Offensive Rebound.,37,39,-2,10,0.41333456294848997,UCLA,UCF,5,5,0,0,NA,401169227,2019-11-30,
180,3,5:57,957,957,Foul on Jnaya Walker.,37,39,-2,0,0.41278803950363663,UCLA,UCF,5,5,0,0,NA,401169227,2019-11-30,
181,3,5:57,957,957,Charisma Osborne made Free Throw.,38,39,-1,0,0.4560572126441647,UCLA,UCF,5,5,0,0,NA,401169227,2019-11-30,UCLA
182,3,5:57,957,957,Charisma Osborne made Free Throw.,39,39,0,0,0.5,UCLA,UCF,5,5,0,0,NA,401169227,2019-11-30,UCLA
183,3,5:57,957,957,Charisma Osborne missed Free Throw.,39,39,0,2,0.5,UCLA,UCF,5,5,0,0,NA,401169227,2019-11-30,
184,3,5:55,955,955,Georgia Gayle Defensive Rebound.,39,39,0,18,0.5,UCLA,UCF,5,5,0,0,NA,401169227,2019-11-30,
185,3,5:37,937,937,Diamond Battles made Jumper. Assisted by Masseny Kaba.,39,41,-2,19,0.4117790027843806,UCLA,UCF,5,5,0,0,NA,401169227,2019-11-30,UCF
186,3,5:18,918,918,Michaela Onyenwere missed Jumper.,39,41,-2,2,0.4109004558394887,UCLA,UCF,5,5,0,0,NA,401169227,2019-11-30,
187,3,5:16,916,916,Georgia Gayle Defensive Rebound.,39,41,-2,17,0.41081139140319084,UCLA,UCF,5,5,0,0,NA,401169227,2019-11-30,
188,3,4:59,899,899,Georgia Gayle missed Three Point Jumper.,39,41,-2,5,0.4100726173789266,UCLA,UCF,5,5,0,0,NA,401169227,2019-11-30,
189,3,4:54,894,894,Chantel Horvat Defensive Rebound.,39,41,-2,10,0.40985983956655214,UCLA,UCF,5,5,0,0,NA,401169227,2019-11-30,
190,3,4:44,884,884,Michaela Onyenwere missed Three Point Jumper.,39,41,-2,6,0.40943731814613776,UCLA,UCF,5,5,0,0,NA,401169227,2019-11-30,
191,3,4:38,878,878,Lindsey Corsaro Offensive Rebound.,39,41,-2,0,0.40918444089191247,UCLA,UCF,5,5,0,0,NA,401169227,2019-11-30,
192,3,4:38,878,878,Lindsey Corsaro missed Layup.,39,41,-2,2,0.40918444089191247,UCLA,UCF,5,5,0,0,NA,401169227,2019-11-30,
193,3,4:36,876,876,Diamond Battles Defensive Rebound.,39,41,-2,0,0.40910006792894604,UCLA,UCF,5,5,0,0,NA,401169227,2019-11-30,
194,3,4:36,876,876,Foul on Charisma Osborne.,39,41,-2,0,0.40910006792894604,UCLA,UCF,5,5,0,0,NA,401169227,2019-11-30,
195,3,4:36,876,876,Official TV Timeout,39,41,-2,18,0.40910006792894604,UCLA,UCF,5,5,0,0,NA,401169227,2019-11-30,
196,3,4:18,858,858,Foul on Japreece Dean.,39,41,-2,0,0.4083328454277878,UCLA,UCF,5,5,0,0,NA,401169227,2019-11-30,
197,3,4:18,858,858,Sianni Martin made Free Throw.,39,42,-3,0,0.36440576060341545,UCLA,UCF,5,5,0,0,NA,401169227,2019-11-30,UCF
198,3,4:18,858,858,Sianni Martin made Free Throw.,39,43,-4,24,0.3226274430392537,UCLA,UCF,5,5,0,0,NA,401169227,2019-11-30,UCF
199,3,3:54,834,834,Foul on Masseny Kaba.,39,43,-4,5,0.32068740637058357,UCLA,UCF,5,5,0,0,NA,401169227,2019-11-30,
200,3,3:49,829,829,Michaela Onyenwere made Jumper.,41,43,-2,21,0.40702386912829414,UCLA,UCF,5,5,0,0,NA,401169227,2019-11-30,UCLA
201,3,3:28,808,808,Diamond Battles missed Jumper.,41,43,-2,8,0.40597386156024656,UCLA,UCF,5,5,0,0,NA,401169227,2019-11-30,
202,3,3:20,800,800,Courtajia Sanders Offensive Rebound.,41,43,-2,0,0.40554265753338176,UCLA,UCF,5,5,0,0,NA,401169227,2019-11-30,
203,3,3:20,800,800,Courtajia Sanders missed Layup.,41,43,-2,0,0.40554265753338176,UCLA,UCF,5,5,0,0,NA,401169227,2019-11-30,
204,3,3:20,800,800,Destiny Thomas Offensive Rebound.,41,43,-2,1,0.40554265753338176,UCLA,UCF,5,5,0,0,NA,401169227,2019-11-30,
205,3,3:19,799,799,Destiny Thomas Turnover.,41,43,-2,0,0.4054873738759885,UCLA,UCF,5,5,0,0,NA,401169227,2019-11-30,
206,3,3:19,799,799,Michaela Onyenwere Steal.,41,43,-2,12,0.4054873738759885,UCLA,UCF,5,5,0,0,NA,401169227,2019-11-30,
207,3,3:07,787,787,Lindsey Corsaro made Three Point Jumper. Assisted by Japreece Dean.,44,43,1,17,0.5480404793368,UCLA,UCF,5,5,0,0,NA,401169227,2019-11-30,UCLA
208,3,2:50,770,770,Sianni Martin made Jumper.,44,45,-1,26,0.45141009693184303,UCLA,UCF,5,5,0,0,NA,401169227,2019-11-30,UCF
209,3,2:24,744,744,Lindsey Corsaro missed Three Point Jumper.,44,45,-1,6,0.450441875840281,UCLA,UCF,5,5,0,0,NA,401169227,2019-11-30,
210,3,2:18,738,738,Kiara Jefferson Offensive Rebound.,44,45,-1,3,0.45019336882672634,UCLA,UCF,5,5,0,0,NA,401169227,2019-11-30,
