play_id,period,time_remaining_period,secs_remaining,secs_remaining_absolute,description,home_score,away_score,score_diff,play_length,win_prob,home,away,home_time_out_remaining,away_time_out_remaining,home_timeout_ind,away_timeout_ind,home_favored_by,game_id,date,whichScored
1,1,9:41,2381,2381,Maria Martianez missed Jumper.,0,0,0,0,0.5,TCU,Oral Roberts,4,4,0,0,NA,400994132,2017-11-11,NA
2,1,9:41,2381,2381,Jordan Moore Defensive Rebound.,0,0,0,17,0.5,TCU,Oral Roberts,4,4,0,0,NA,400994132,2017-11-11,
3,1,9:24,2364,2364,Dakota Vann made Layup. Assisted by Amber Ramirez.,2,0,2,17,0.5447891790846144,TCU,Oral Roberts,4,4,0,0,NA,400994132,2017-11-11,TCU
4,1,9:07,2347,2347,Faith Ihim missed Layup.,2,0,2,0,0.5451557187753678,TCU,Oral Roberts,4,4,0,0,NA,400994132,2017-11-11,
5,1,9:07,2347,2347,Adeola Akomolafe Block.,2,0,2,9,0.5451557187753678,TCU,Oral Roberts,4,4,0,0,NA,400994132,2017-11-11,
6,1,8:58,2338,2338,Adeola Akomolafe Defensive Rebound.,2,0,2,5,0.5453512728162102,TCU,Oral Roberts,4,4,0,0,NA,400994132,2017-11-11,
7,1,8:53,2333,2333,Amber Ramirez missed Jumper.,2,0,2,0,0.5454603446991073,TCU,Oral Roberts,4,4,0,0,NA,400994132,2017-11-11,
8,1,8:53,2333,2333,Keni Jo Lippe Defensive Rebound.,2,0,2,13,0.5454603446991073,TCU,Oral Roberts,4,4,0,0,NA,400994132,2017-11-11,
9,1,8:40,2320,2320,Keni Jo Lippe missed Layup.,2,0,2,0,0.545745316074961,TCU,Oral Roberts,4,4,0,0,NA,400994132,2017-11-11,
10,1,8:40,2320,2320,Jordan Moore Block.,2,0,2,5,0.545745316074961,TCU,Oral Roberts,4,4,0,0,NA,400994132,2017-11-11,
11,1,8:35,2315,2315,Faith Ihim Offensive Rebound.,2,0,2,4,0.5458554347780128,TCU,Oral Roberts,4,4,0,0,NA,400994132,2017-11-11,
12,1,8:31,2311,2311,Foul on Dakota Vann.,2,0,2,0,0.5459437285227066,TCU,Oral Roberts,4,4,0,0,NA,400994132,2017-11-11,
13,1,8:31,2311,2311,Faith Ihim missed Free Throw.,2,0,2,0,0.5459437285227066,TCU,Oral Roberts,4,4,0,0,NA,400994132,2017-11-11,
14,1,8:31,2311,2311,Oral Roberts Deadball Team Rebound.,2,0,2,0,0.5459437285227066,TCU,Oral Roberts,4,4,0,0,NA,400994132,2017-11-11,
15,1,8:31,2311,2311,Faith Ihim missed Free Throw.,2,0,2,0,0.5459437285227066,TCU,Oral Roberts,4,4,0,0,NA,400994132,2017-11-11,
16,1,8:31,2311,2311,Toree Thompson Defensive Rebound.,2,0,2,23,0.5459437285227066,TCU,Oral Roberts,4,4,0,0,NA,400994132,2017-11-11,
17,1,8:08,2288,2288,Foul on Keni Jo Lippe.,2,0,2,0,0.5464546722449519,TCU,Oral Roberts,4,4,0,0,NA,400994132,2017-11-11,
18,1,8:08,2288,2288,Jordan Moore missed Free Throw.,2,0,2,0,0.5464546722449519,TCU,Oral Roberts,4,4,0,0,NA,400994132,2017-11-11,
19,1,8:08,2288,2288,TCU Deadball Team Rebound.,2,0,2,0,0.5464546722449519,TCU,Oral Roberts,4,4,0,0,NA,400994132,2017-11-11,
20,1,8:08,2288,2288,Jordan Moore made Free Throw.,3,0,3,29,0.5694320281024181,TCU,Oral Roberts,4,4,0,0,NA,400994132,2017-11-11,TCU
21,1,7:39,2259,2259,Keni Jo Lippe made Layup. Assisted by Montserrat Brotons.,3,2,1,22,0.523605531345516,TCU,Oral Roberts,4,4,0,0,NA,400994132,2017-11-11,Oral Roberts
22,1,7:17,2237,2237,Toree Thompson missed Jumper.,3,2,1,0,0.523856604151645,TCU,Oral Roberts,4,4,0,0,NA,400994132,2017-11-11,
23,1,7:17,2237,2237,Montserrat Brotons Defensive Rebound.,3,2,1,31,0.523856604151645,TCU,Oral Roberts,4,4,0,0,NA,400994132,2017-11-11,
24,1,6:46,2206,2206,Faith Ihim missed Three Point Jumper.,3,2,1,0,0.5242132490649751,TCU,Oral Roberts,4,4,0,0,NA,400994132,2017-11-11,
25,1,6:46,2206,2206,Adeola Akomolafe Defensive Rebound.,3,2,1,12,0.5242132490649751,TCU,Oral Roberts,4,4,0,0,NA,400994132,2017-11-11,
26,1,6:34,2194,2194,Amber Ramirez missed Jumper.,3,2,1,0,0.5243520563268457,TCU,Oral Roberts,4,4,0,0,NA,400994132,2017-11-11,
27,1,6:34,2194,2194,Faith Ihim Defensive Rebound.,3,2,1,7,0.5243520563268457,TCU,Oral Roberts,4,4,0,0,NA,400994132,2017-11-11,
28,1,6:27,2187,2187,Maria Martianez missed Three Point Jumper.,3,2,1,0,0.5244331916623864,TCU,Oral Roberts,4,4,0,0,NA,400994132,2017-11-11,
29,1,6:27,2187,2187,Toree Thompson Defensive Rebound.,3,2,1,9,0.5244331916623864,TCU,Oral Roberts,4,4,0,0,NA,400994132,2017-11-11,
30,1,6:18,2178,2178,Toree Thompson made Layup.,5,2,3,0,0.5731436279598284,TCU,Oral Roberts,4,4,0,0,NA,400994132,2017-11-11,TCU
31,1,6:18,2178,2178,Foul on Keni Jo Lippe.,5,2,3,0,0.5731436279598284,TCU,Oral Roberts,4,4,0,0,NA,400994132,2017-11-11,
32,1,6:18,2178,2178,Toree Thompson made Free Throw.,6,2,4,8,0.5969850319212389,TCU,Oral Roberts,4,4,0,0,NA,400994132,2017-11-11,TCU
33,1,6:10,2170,2170,Maria Martianez missed Jumper.,6,2,4,0,0.597343873385936,TCU,Oral Roberts,4,4,0,0,NA,400994132,2017-11-11,
34,1,6:10,2170,2170,Jordan Moore Defensive Rebound.,6,2,4,10,0.597343873385936,TCU,Oral Roberts,4,4,0,0,NA,400994132,2017-11-11,
35,1,6:00,2160,2160,Jordan Moore missed Jumper.,6,2,4,0,0.5977933026269484,TCU,Oral Roberts,4,4,0,0,NA,400994132,2017-11-11,
36,1,6:00,2160,2160,Maria Martianez Defensive Rebound.,6,2,4,1,0.5977933026269484,TCU,Oral Roberts,4,4,0,0,NA,400994132,2017-11-11,
37,1,5:59,2159,2159,Foul on Adeola Akomolafe.,6,2,4,21,0.5978383183584584,TCU,Oral Roberts,4,4,0,0,NA,400994132,2017-11-11,
38,1,5:38,2138,2138,Jordan Gilbert missed Jumper.,6,2,4,0,0.598786863221117,TCU,Oral Roberts,4,4,0,0,NA,400994132,2017-11-11,
39,1,5:38,2138,2138,Jordan Moore Block.,6,2,4,0,0.598786863221117,TCU,Oral Roberts,4,4,0,0,NA,400994132,2017-11-11,
40,1,5:38,2138,2138,Oral Roberts Offensive Rebound.,6,2,4,14,0.598786863221117,TCU,Oral Roberts,4,4,0,0,NA,400994132,2017-11-11,
41,1,5:24,2124,2124,Maya Mayberry Turnover.,6,2,4,1,0.5994228222266862,TCU,Oral Roberts,4,4,0,0,NA,400994132,2017-11-11,
42,1,5:23,2123,2123,Dakota Vann Steal.,6,2,4,2,0.5994683636419377,TCU,Oral Roberts,4,4,0,0,NA,400994132,2017-11-11,
43,1,5:21,2121,2121,Dakota Vann missed Layup.,6,2,4,1,0.5995594938555068,TCU,Oral Roberts,4,4,0,0,NA,400994132,2017-11-11,
44,1,5:20,2120,2120,Faith Ihim Defensive Rebound.,6,2,4,14,0.599605082780099,TCU,Oral Roberts,4,4,0,0,NA,400994132,2017-11-11,
45,1,5:06,2106,2106,Sarah Garvie missed Three Point Jumper.,6,2,4,0,0.6002450325045777,TCU,Oral Roberts,4,4,0,0,NA,400994132,2017-11-11,
46,1,5:06,2106,2106,Toree Thompson Defensive Rebound.,6,2,4,10,0.6002450325045777,TCU,Oral Roberts,4,4,0,0,NA,400994132,2017-11-11,
47,1,4:56,2096,2096,Amber Ramirez missed Three Point Jumper.,6,2,4,0,0.6007041507685156,TCU,Oral Roberts,4,4,0,0,NA,400994132,2017-11-11,
48,1,4:56,2096,2096,Montserrat Brotons Defensive Rebound.,6,2,4,17,0.6007041507685156,TCU,Oral Roberts,4,4,0,0,NA,400994132,2017-11-11,
49,1,4:39,2079,2079,Maya Mayberry made Layup.,6,4,2,18,0.5512780646738821,TCU,Oral Roberts,4,4,0,0,NA,400994132,2017-11-11,Oral Roberts
50,1,4:21,2061,2061,Jordan Moore made Layup. Assisted by Toree Thompson.,8,4,4,29,0.6023252366839837,TCU,Oral Roberts,4,4,0,0,NA,400994132,2017-11-11,TCU
51,1,3:52,2032,2032,Jordan Gilbert made Layup.,8,6,2,22,0.5524129552090024,TCU,Oral Roberts,4,4,0,0,NA,400994132,2017-11-11,Oral Roberts
52,1,3:30,2010,2010,Foul on Maya Mayberry.,8,6,2,0,0.5529529550265885,TCU,Oral Roberts,4,4,0,0,NA,400994132,2017-11-11,
53,1,3:30,2010,2010,Jordan Moore made Free Throw.,9,6,3,0,0.579059474071448,TCU,Oral Roberts,4,4,0,0,NA,400994132,2017-11-11,TCU
54,1,3:30,2010,2010,Jordan Moore made Free Throw.,10,6,4,23,0.604731238016845,TCU,Oral Roberts,4,4,0,0,NA,400994132,2017-11-11,TCU
55,1,3:07,1987,1987,Maya Mayberry made Layup.,10,8,2,24,0.5535240130236178,TCU,Oral Roberts,4,4,0,0,NA,400994132,2017-11-11,Oral Roberts
56,1,2:43,1963,1963,Amy Okonkwo missed Layup.,10,8,2,0,0.5541274301505975,TCU,Oral Roberts,4,4,0,0,NA,400994132,2017-11-11,
57,1,2:43,1963,1963,Rachel Skalnik Defensive Rebound.,10,8,2,7,0.5541274301505975,TCU,Oral Roberts,4,4,0,0,NA,400994132,2017-11-11,
58,1,2:36,1956,1956,Sarah Garvie made Three Point Jumper. Assisted by Rachel Skalnik.,10,11,-1,20,0.4727669805791183,TCU,Oral Roberts,4,4,0,0,NA,400994132,2017-11-11,Oral Roberts
59,1,2:16,1936,1936,Foul on Maria Martianez.,10,11,-1,0,0.47250912941693224,TCU,Oral Roberts,4,4,0,0,NA,400994132,2017-11-11,
60,1,2:16,1936,1936,Toree Thompson made Free Throw.,11,11,0,0,0.5,TCU,Oral Roberts,4,4,0,0,NA,400994132,2017-11-11,TCU
61,1,2:16,1936,1936,Toree Thompson made Free Throw.,12,11,1,12,0.5274908705830678,TCU,Oral Roberts,4,4,0,0,NA,400994132,2017-11-11,TCU
62,1,2:04,1924,1924,Foul on Lauren Heard.,12,11,1,0,0.5276468647155523,TCU,Oral Roberts,4,4,0,0,NA,400994132,2017-11-11,
63,1,2:04,1924,1924,Maya Mayberry made Free Throw.,12,12,0,0,0.5,TCU,Oral Roberts,4,4,0,0,NA,400994132,2017-11-11,Oral Roberts
64,1,2:04,1924,1924,Maya Mayberry made Free Throw.,12,13,-1,13,0.4723531352844477,TCU,Oral Roberts,4,4,0,0,NA,400994132,2017-11-11,Oral Roberts
65,1,1:51,1911,1911,Amy Okonkwo missed Three Point Jumper.,12,13,-1,0,0.47218428607041996,TCU,Oral Roberts,4,4,0,0,NA,400994132,2017-11-11,
66,1,1:51,1911,1911,Lauren Heard Offensive Rebound.,12,13,-1,4,0.47218428607041996,TCU,Oral Roberts,4,4,0,0,NA,400994132,2017-11-11,
67,1,1:47,1907,1907,Lauren Heard missed Layup.,12,13,-1,0,0.4721323802849542,TCU,Oral Roberts,4,4,0,0,NA,400994132,2017-11-11,
68,1,1:47,1907,1907,Faith Ihim Defensive Rebound.,12,13,-1,23,0.4721323802849542,TCU,Oral Roberts,4,4,0,0,NA,400994132,2017-11-11,
69,1,1:24,1884,1884,Faith Ihim made Layup. Assisted by Maya Mayberry.,12,15,-3,23,0.41621039799145243,TCU,Oral Roberts,4,4,0,0,NA,400994132,2017-11-11,Oral Roberts
70,1,1:01,1861,1861,Lauren Heard missed Three Point Jumper.,12,15,-3,0,0.4153365405766184,TCU,Oral Roberts,4,4,0,0,NA,400994132,2017-11-11,
71,1,1:01,1861,1861,Amy Okonkwo Offensive Rebound.,12,15,-3,6,0.4153365405766184,TCU,Oral Roberts,4,4,0,0,NA,400994132,2017-11-11,
72,1,0:55,1855,1855,Toree Thompson missed Three Point Jumper.,12,15,-3,0,0.41510807829856994,TCU,Oral Roberts,4,4,0,0,NA,400994132,2017-11-11,
73,1,0:55,1855,1855,Lauren Heard Offensive Rebound.,12,15,-3,7,0.41510807829856994,TCU,Oral Roberts,4,4,0,0,NA,400994132,2017-11-11,
74,1,0:48,1848,1848,Amy Okonkwo missed Jumper.,12,15,-3,0,0.4148411543563198,TCU,Oral Roberts,4,4,0,0,NA,400994132,2017-11-11,
75,1,0:48,1848,1848,Jordan Moore Offensive Rebound.,12,15,-3,3,0.4148411543563198,TCU,Oral Roberts,4,4,0,0,NA,400994132,2017-11-11,
76,1,0:45,1845,1845,Jordan Moore made Layup.,14,15,-1,11,0.47132653429417115,TCU,Oral Roberts,4,4,0,0,NA,400994132,2017-11-11,TCU
77,1,0:34,1834,1834,Foul on Toree Thompson.,14,15,-1,4,0.4711825052391752,TCU,Oral Roberts,4,4,0,0,NA,400994132,2017-11-11,
78,1,0:30,1830,1830,Faith Ihim Turnover.,14,15,-1,25,0.4711299923414153,TCU,Oral Roberts,4,4,0,0,NA,400994132,2017-11-11,
79,1,0:05,1805,1805,Foul on Lauren Heard.,14,15,-1,0,0.47079973580313295,TCU,Oral Roberts,4,4,0,0,NA,400994132,2017-11-11,
80,1,0:05,1805,1805,Jordan Moore Turnover.,14,15,-1,5,0.47079973580313295,TCU,Oral Roberts,4,4,0,0,NA,400994132,2017-11-11,
81,1,0:00,1800,1800,End of 1st Quarter,14,15,-1,11,0.47073319422403154,TCU,Oral Roberts,4,4,0,0,NA,400994132,2017-11-11,
82,2,9:49,1789,1789,Foul on Maria Martianez.,14,15,-1,0,0.47058613421136253,TCU,Oral Roberts,4,4,0,0,NA,400994132,2017-11-11,
83,2,9:49,1789,1789,Maria Martianez Turnover.,14,15,-1,23,0.47058613421136253,TCU,Oral Roberts,4,4,0,0,NA,400994132,2017-11-11,
84,2,9:26,1766,1766,Amy Okonkwo made Layup.,16,15,1,13,0.529724719528124,TCU,Oral Roberts,4,4,0,0,NA,400994132,2017-11-11,TCU
85,2,9:13,1753,1753,Faith Ihim missed Layup.,16,15,1,0,0.5299027173203668,TCU,Oral Roberts,4,4,0,0,NA,400994132,2017-11-11,
86,2,9:13,1753,1753,Jordan Moore Block.,16,15,1,1,0.5299027173203668,TCU,Oral Roberts,4,4,0,0,NA,400994132,2017-11-11,
87,2,9:12,1752,1752,Dakota Vann Defensive Rebound.,16,15,1,0,0.5299164848900471,TCU,Oral Roberts,4,4,0,0,NA,400994132,2017-11-11,
88,2,9:12,1752,1752,Foul on Faith Ihim.,16,15,1,17,0.5299164848900471,TCU,Oral Roberts,4,4,0,0,NA,400994132,2017-11-11,
89,2,8:55,1735,1735,Amy Okonkwo missed Three Point Jumper.,16,15,1,0,0.53015230483358,TCU,Oral Roberts,4,4,0,0,NA,400994132,2017-11-11,
90,2,8:55,1735,1735,Jordan Moore Offensive Rebound.,16,15,1,4,0.53015230483358,TCU,Oral Roberts,4,4,0,0,NA,400994132,2017-11-11,
91,2,8:51,1731,1731,Amber Ramirez made Three Point Jumper. Assisted by Jordan Moore.,19,15,4,25,0.6186736175520785,TCU,Oral Roberts,4,4,0,0,NA,400994132,2017-11-11,TCU
92,2,8:26,1706,1706,Maya Mayberry missed Three Point Jumper.,19,15,4,0,0.620016979544364,TCU,Oral Roberts,4,4,0,0,NA,400994132,2017-11-11,
93,2,8:26,1706,1706,Amber Ramirez Defensive Rebound.,19,15,4,9,0.620016979544364,TCU,Oral Roberts,4,4,0,0,NA,400994132,2017-11-11,
94,2,8:17,1697,1697,Amber Ramirez made Three Point Jumper. Assisted by Jordan Moore.,22,15,7,18,0.7027624093689702,TCU,Oral Roberts,4,4,0,0,NA,400994132,2017-11-11,TCU
95,2,7:59,1679,1679,Maya Mayberry made Jumper.,22,17,5,18,0.6501910778888925,TCU,Oral Roberts,4,4,0,0,NA,400994132,2017-11-11,Oral Roberts
96,2,7:41,1661,1661,Jordan Moore made Layup. Assisted by Amber Ramirez.,24,17,7,16,0.7057876635425343,TCU,Oral Roberts,4,4,0,0,NA,400994132,2017-11-11,TCU
97,2,7:25,1645,1645,Rachel Skalnik Turnover.,24,17,7,2,0.7070860624238889,TCU,Oral Roberts,4,4,0,0,NA,400994132,2017-11-11,
98,2,7:23,1643,1643,Amy Okonkwo Steal.,24,17,7,3,0.7072467866619507,TCU,Oral Roberts,4,4,0,0,NA,400994132,2017-11-11,
99,2,7:20,1640,1640,Mikayla Christian Turnover.,24,17,7,7,0.7074873021174427,TCU,Oral Roberts,4,4,0,0,NA,400994132,2017-11-11,
100,2,7:13,1633,1633,Rachel Skalnik made Three Point Jumper. Assisted by Faith Ihim.,24,20,4,4,0.623923709604715,TCU,Oral Roberts,4,4,0,0,NA,400994132,2017-11-11,Oral Roberts
101,2,7:09,1629,1629,Oral Roberts  Timeout,24,20,4,17,0.6241299699248363,TCU,Oral Roberts,3,4,1,0,NA,400994132,2017-11-11,
102,2,6:52,1612,1612,Foul on Faith Ihim.,24,20,4,0,0.6250020951618517,TCU,Oral Roberts,3,4,1,0,NA,400994132,2017-11-11,
103,2,6:52,1612,1612,Jordan Moore missed Free Throw.,24,20,4,0,0.6250020951618517,TCU,Oral Roberts,3,4,1,0,NA,400994132,2017-11-11,
104,2,6:52,1612,1612,TCU Deadball Team Rebound.,24,20,4,0,0.6250020951618517,TCU,Oral Roberts,3,4,1,0,NA,400994132,2017-11-11,
105,2,6:52,1612,1612,Jordan Moore made Free Throw.,25,20,5,18,0.6544240756613536,TCU,Oral Roberts,3,4,1,0,NA,400994132,2017-11-11,TCU
106,2,6:34,1594,1594,Maria Martianez missed Jumper.,25,20,5,0,0.6555331494316142,TCU,Oral Roberts,3,4,1,0,NA,400994132,2017-11-11,
107,2,6:34,1594,1594,Amber Ramirez Defensive Rebound.,25,20,5,27,0.6555331494316142,TCU,Oral Roberts,3,4,1,0,NA,400994132,2017-11-11,
108,2,6:07,1567,1567,Jordan Moore made Layup. Assisted by Amber Ramirez.,27,20,7,12,0.7132445548906124,TCU,Oral Roberts,3,4,0,0,NA,400994132,2017-11-11,TCU
109,2,5:55,1555,1555,Maria Martianez Turnover.,27,20,7,11,0.7141971229403054,TCU,Oral Roberts,3,4,0,0,NA,400994132,2017-11-11,
110,2,5:44,1544,1544,Amber Ramirez made Jumper.,29,20,9,13,0.7655019649448264,TCU,Oral Roberts,3,4,0,0,NA,400994132,2017-11-11,TCU
111,2,5:31,1531,1531,Foul on Amber Ramirez.,29,20,9,6,0.7666948491031563,TCU,Oral Roberts,3,4,0,0,NA,400994132,2017-11-11,
112,2,5:25,1525,1525,Sarah Garvie missed Three Point Jumper.,29,20,9,0,0.7672510348993472,TCU,Oral Roberts,3,4,0,0,NA,400994132,2017-11-11,
113,2,5:25,1525,1525,Maria Martianez Offensive Rebound.,29,20,9,9,0.7672510348993472,TCU,Oral Roberts,3,4,0,0,NA,400994132,2017-11-11,
114,2,5:16,1516,1516,Sarah Garvie made Three Point Jumper. Assisted by Maya Mayberry.,29,23,6,19,0.6896284844710738,TCU,Oral Roberts,3,4,0,0,NA,400994132,2017-11-11,Oral Roberts
115,2,4:57,1497,1497,Foul on Sarah Garvie.,29,23,6,0,0.691082825581152,TCU,Oral Roberts,3,4,0,0,NA,400994132,2017-11-11,
116,2,4:57,1497,1497,Amy Okonkwo made Free Throw.,30,23,7,0,0.7189752579831169,TCU,Oral Roberts,3,4,0,0,NA,400994132,2017-11-11,TCU
117,2,4:57,1497,1497,Amy Okonkwo made Free Throw.,31,23,8,14,0.7452775118264924,TCU,Oral Roberts,3,4,0,0,NA,400994132,2017-11-11,TCU
118,2,4:43,1483,1483,Maria Martianez made Jumper.,31,25,6,14,0.692186045715439,TCU,Oral Roberts,3,4,0,0,NA,400994132,2017-11-11,Oral Roberts
119,2,4:29,1469,1469,Toree Thompson made Three Point Jumper. Assisted by Mikayla Christian.,34,25,9,16,0.7726844457083583,TCU,Oral Roberts,3,4,0,0,NA,400994132,2017-11-11,TCU
120,2,4:13,1453,1453,Maria Martianez made Jumper. Assisted by Sarah Garvie.,34,27,7,20,0.7229195537894483,TCU,Oral Roberts,3,4,0,0,NA,400994132,2017-11-11,Oral Roberts
121,2,3:53,1433,1433,Amy Okonkwo made Layup. Assisted by Adeola Akomolafe.,36,27,9,22,0.7764209034206229,TCU,Oral Roberts,3,4,0,0,NA,400994132,2017-11-11,TCU
122,2,3:31,1411,1411,Maria Martianez missed Jumper.,36,27,9,0,0.7786073784128636,TCU,Oral Roberts,3,4,0,0,NA,400994132,2017-11-11,
123,2,3:31,1411,1411,Toree Thompson Defensive Rebound.,36,27,9,15,0.7786073784128636,TCU,Oral Roberts,3,4,0,0,NA,400994132,2017-11-11,
124,2,3:16,1396,1396,Amy Okonkwo made Layup. Assisted by Adeola Akomolafe.,38,27,11,2,0.8245235420035248,TCU,Oral Roberts,3,4,0,0,NA,400994132,2017-11-11,TCU
125,2,3:14,1394,1394,Oral Roberts  Timeout,38,27,11,12,0.8247199864851577,TCU,Oral Roberts,2,4,1,0,NA,400994132,2017-11-11,
126,2,3:02,1382,1382,Faith Ihim Turnover.,38,27,11,14,0.8258895693020673,TCU,Oral Roberts,2,4,1,0,NA,400994132,2017-11-11,
127,2,2:48,1368,1368,Mikayla Christian made Three Point Jumper. Assisted by Toree Thompson.,41,27,14,21,0.8800953031066884,TCU,Oral Roberts,2,4,1,0,NA,400994132,2017-11-11,TCU
128,2,2:27,1347,1347,Rachel Skalnik missed Three Point Jumper.,41,27,14,0,0.8819843000903687,TCU,Oral Roberts,2,4,1,0,NA,400994132,2017-11-11,
129,2,2:27,1347,1347,Toree Thompson Defensive Rebound.,41,27,14,12,0.8819843000903687,TCU,Oral Roberts,2,4,1,0,NA,400994132,2017-11-11,
130,2,2:15,1335,1335,Toree Thompson missed Three Point Jumper.,41,27,14,15,0.8830632836576817,TCU,Oral Roberts,2,4,1,0,NA,400994132,2017-11-11,
131,2,2:00,1320,1320,Montserrat Brotons Defensive Rebound.,41,27,14,0,0.8844204016861344,TCU,Oral Roberts,2,4,0,0,NA,400994132,2017-11-11,
132,2,2:00,1320,1320,Foul on Toree Thompson.,41,27,14,11,0.8844204016861344,TCU,Oral Roberts,2,4,0,0,NA,400994132,2017-11-11,
133,2,1:49,1309,1309,Foul on Sydney Coleman.,41,27,14,0,0.8854262840640776,TCU,Oral Roberts,2,4,0,0,NA,400994132,2017-11-11,
134,2,1:49,1309,1309,Faith Ihim made Free Throw.,41,28,13,0,0.8697545176470145,TCU,Oral Roberts,2,4,0,0,NA,400994132,2017-11-11,Oral Roberts
135,2,1:49,1309,1309,Faith Ihim missed Free Throw.,41,28,13,0,0.8697545176470145,TCU,Oral Roberts,2,4,0,0,NA,400994132,2017-11-11,
136,2,1:49,1309,1309,Sarah Garvie Offensive Rebound.,41,28,13,5,0.8697545176470145,TCU,Oral Roberts,2,4,0,0,NA,400994132,2017-11-11,
137,2,1:44,1304,1304,Sarah Garvie Turnover.,41,28,13,2,0.8702328780886324,TCU,Oral Roberts,2,4,0,0,NA,400994132,2017-11-11,
138,2,1:42,1302,1302,Dakota Vann Steal.,41,28,13,12,0.8704251126230026,TCU,Oral Roberts,2,4,0,0,NA,400994132,2017-11-11,
139,2,1:30,1290,1290,Foul on Maya Mayberry.,41,28,13,0,0.8715905504630256,TCU,Oral Roberts,2,4,0,0,NA,400994132,2017-11-11,
140,2,1:30,1290,1290,Dakota Vann made Free Throw.,42,28,14,0,0.8871956707570046,TCU,Oral Roberts,2,4,0,0,NA,400994132,2017-11-11,TCU
141,2,1:30,1290,1290,Dakota Vann missed Free Throw.,42,28,14,0,0.8871956707570046,TCU,Oral Roberts,2,4,0,0,NA,400994132,2017-11-11,
142,2,1:30,1290,1290,Rachel Skalnik Defensive Rebound.,42,28,14,7,0.8871956707570046,TCU,Oral Roberts,2,4,0,0,NA,400994132,2017-11-11,
143,2,1:23,1283,1283,Jordan Gilbert made Layup. Assisted by Rachel Skalnik.,42,30,12,19,0.8548910188500912,TCU,Oral Roberts,2,4,0,0,NA,400994132,2017-11-11,Oral Roberts
144,2,1:04,1264,1264,Foul on Sarah Garvie.,42,30,12,0,0.8568674924887267,TCU,Oral Roberts,2,4,0,0,NA,400994132,2017-11-11,
145,2,1:04,1264,1264,Amber Ramirez made Free Throw.,43,30,13,0,0.8742024922092582,TCU,Oral Roberts,2,4,0,0,NA,400994132,2017-11-11,TCU
146,2,1:04,1264,1264,Amber Ramirez made Free Throw.,44,30,14,6,0.8897082564772067,TCU,Oral Roberts,2,4,0,0,NA,400994132,2017-11-11,TCU
147,2,0:58,1258,1258,Jordan Gilbert missed Jumper.,44,30,14,0,0.8903066930748772,TCU,Oral Roberts,2,4,0,0,NA,400994132,2017-11-11,
148,2,0:58,1258,1258,Jordan Moore Block.,44,30,14,2,0.8903066930748772,TCU,Oral Roberts,2,4,0,0,NA,400994132,2017-11-11,
149,2,0:56,1256,1256,Oral Roberts Offensive Rebound.,44,30,14,7,0.8905079128743638,TCU,Oral Roberts,2,4,0,0,NA,400994132,2017-11-11,
150,2,0:49,1249,1249,Rachel Skalnik missed Three Point Jumper.,44,30,14,0,0.8912193516969713,TCU,Oral Roberts,2,4,0,0,NA,400994132,2017-11-11,
151,2,0:49,1249,1249,Sydney Coleman Defensive Rebound.,44,30,14,21,0.8912193516969713,TCU,Oral Roberts,2,4,0,0,NA,400994132,2017-11-11,
152,2,0:28,1228,1228,Jordan Moore missed Layup.,44,30,14,0,0.8934261826157144,TCU,Oral Roberts,2,4,0,0,NA,400994132,2017-11-11,
153,2,0:28,1228,1228,Maria Martianez Defensive Rebound.,44,30,14,9,0.8934261826157144,TCU,Oral Roberts,2,4,0,0,NA,400994132,2017-11-11,
154,2,0:19,1219,1219,Maria Martianez missed Jumper.,44,30,14,0,0.8944082603009887,TCU,Oral Roberts,2,4,0,0,NA,400994132,2017-11-11,
155,2,0:19,1219,1219,Sydney Coleman Defensive Rebound.,44,30,14,19,0.8944082603009887,TCU,Oral Roberts,2,4,0,0,NA,400994132,2017-11-11,
156,2,0:00,1200,1200,End of 2nd Quarter,44,30,14,28,0.8965272355199047,TCU,Oral Roberts,2,4,0,0,NA,400994132,2017-11-11,
157,3,9:32,1172,1172,Dakota Vann Turnover.,44,30,14,1,0.8994870255394323,TCU,Oral Roberts,3,5,0,0,NA,400994132,2017-11-11,
158,3,9:31,1171,1171,Keni Jo Lippe Steal.,44,30,14,14,0.899589200824386,TCU,Oral Roberts,3,5,0,0,NA,400994132,2017-11-11,
159,3,9:17,1157,1157,Keni Jo Lippe missed Three Point Jumper.,44,30,14,0,0.9009999104930533,TCU,Oral Roberts,3,5,0,0,NA,400994132,2017-11-11,
160,3,9:17,1157,1157,TCU Defensive Rebound.,44,30,14,22,0.9009999104930533,TCU,Oral Roberts,3,5,0,0,NA,400994132,2017-11-11,
161,3,8:55,1135,1135,Jordan Moore missed Jumper.,44,30,14,0,0.9031601566361557,TCU,Oral Roberts,3,5,0,0,NA,400994132,2017-11-11,
162,3,8:55,1135,1135,Rachel Skalnik Defensive Rebound.,44,30,14,9,0.9031601566361557,TCU,Oral Roberts,3,5,0,0,NA,400994132,2017-11-11,
163,3,8:46,1126,1126,Keni Jo Lippe missed Jumper.,44,30,14,0,0.9040313236649314,TCU,Oral Roberts,3,5,0,0,NA,400994132,2017-11-11,
164,3,8:46,1126,1126,Adeola Akomolafe Block.,44,30,14,2,0.9040313236649314,TCU,Oral Roberts,3,5,0,0,NA,400994132,2017-11-11,
165,3,8:44,1124,1124,Amber Ramirez Turnover.,44,30,14,0,0.9042243336863881,TCU,Oral Roberts,3,5,0,0,NA,400994132,2017-11-11,
166,3,8:44,1124,1124,Adeola Akomolafe Offensive Rebound.,44,30,14,9,0.9042243336863881,TCU,Oral Roberts,3,5,0,0,NA,400994132,2017-11-11,
167,3,8:35,1115,1115,Keni Jo Lippe Turnover.,44,30,14,10,0.9050913298032587,TCU,Oral Roberts,3,5,0,0,NA,400994132,2017-11-11,
168,3,8:25,1105,1105,Jordan Moore Turnover.,44,30,14,2,0.9060537892637726,TCU,Oral Roberts,3,5,0,0,NA,400994132,2017-11-11,
169,3,8:23,1103,1103,Maria Martianez Steal.,44,30,14,12,0.9062464312792681,TCU,Oral Roberts,3,5,0,0,NA,400994132,2017-11-11,
170,3,8:11,1091,1091,Maria Martianez made Layup.,44,32,12,24,0.8761327020436487,TCU,Oral Roberts,3,5,0,0,NA,400994132,2017-11-11,Oral Roberts
171,3,7:47,1067,1067,Foul on Rachel Skalnik.,44,32,12,15,0.8787397801841834,TCU,Oral Roberts,3,5,0,0,NA,400994132,2017-11-11,
172,3,7:32,1052,1052,Jordan Moore made Layup. Assisted by Amber Ramirez.,46,32,14,11,0.9112574090599218,TCU,Oral Roberts,3,5,0,0,NA,400994132,2017-11-11,TCU
173,3,7:21,1041,1041,Foul on Adeola Akomolafe.,46,32,14,0,0.912382357336488,TCU,Oral Roberts,3,5,0,0,NA,400994132,2017-11-11,
174,3,7:21,1041,1041,Maria Martianez missed Free Throw.,46,32,14,0,0.912382357336488,TCU,Oral Roberts,3,5,0,0,NA,400994132,2017-11-11,
175,3,7:21,1041,1041,Oral Roberts Deadball Team Rebound.,46,32,14,0,0.912382357336488,TCU,Oral Roberts,3,5,0,0,NA,400994132,2017-11-11,
176,3,7:21,1041,1041,Maria Martianez made Free Throw.,46,33,13,10,0.8980473356735367,TCU,Oral Roberts,3,5,0,0,NA,400994132,2017-11-11,Oral Roberts
177,3,7:11,1031,1031,Amber Ramirez made Jumper. Assisted by Lauren Heard.,48,33,15,15,0.9258406110680363,TCU,Oral Roberts,3,5,0,0,NA,400994132,2017-11-11,TCU
178,3,6:56,1016,1016,Maria Martianez missed Three Point Jumper.,48,33,15,0,0.9273308362580164,TCU,Oral Roberts,3,5,0,0,NA,400994132,2017-11-11,
179,3,6:56,1016,1016,Faith Ihim Offensive Rebound.,48,33,15,3,0.9273308362580164,TCU,Oral Roberts,3,5,0,0,NA,400994132,2017-11-11,
180,3,6:53,1013,1013,Foul on Jordan Moore.,48,33,15,5,0.9276343528681404,TCU,Oral Roberts,3,5,0,0,NA,400994132,2017-11-11,
181,3,6:48,1008,1008,Maria Martianez made Layup. Assisted by Maya Mayberry.,48,35,13,15,0.901800579003391,TCU,Oral Roberts,3,5,0,0,NA,400994132,2017-11-11,Oral Roberts
182,3,6:33,993,993,Dakota Vann missed Three Point Jumper.,48,35,13,0,0.9036042950381358,TCU,Oral Roberts,3,5,0,0,NA,400994132,2017-11-11,
183,3,6:33,993,993,TCU Offensive Rebound.,48,35,13,8,0.9036042950381358,TCU,Oral Roberts,3,5,0,0,NA,400994132,2017-11-11,
184,3,6:25,985,985,Lauren Heard made Three Point Jumper. Assisted by Dakota Vann.,51,35,16,15,0.9409458934335948,TCU,Oral Roberts,3,5,0,0,NA,400994132,2017-11-11,TCU
185,3,6:10,970,970,Montserrat Brotons missed Jumper.,51,35,16,0,0.9424572345869817,TCU,Oral Roberts,3,5,0,0,NA,400994132,2017-11-11,
186,3,6:10,970,970,Dakota Vann Block.,51,35,16,1,0.9424572345869817,TCU,Oral Roberts,3,5,0,0,NA,400994132,2017-11-11,
187,3,6:09,969,969,Amber Ramirez Defensive Rebound.,51,35,16,7,0.9425592868118317,TCU,Oral Roberts,3,5,0,0,NA,400994132,2017-11-11,
188,3,6:02,962,962,Amber Ramirez missed Three Point Jumper.,51,35,16,0,0.9432525840558652,TCU,Oral Roberts,3,5,0,0,NA,400994132,2017-11-11,
189,3,6:02,962,962,Maria Martianez Defensive Rebound.,51,35,16,13,0.9432525840558652,TCU,Oral Roberts,3,5,0,0,NA,400994132,2017-11-11,
190,3,5:49,949,949,Maria Martianez missed Layup.,51,35,16,0,0.9444512039597289,TCU,Oral Roberts,3,5,0,0,NA,400994132,2017-11-11,
191,3,5:49,949,949,Lauren Heard Defensive Rebound.,51,35,16,17,0.9444512039597289,TCU,Oral Roberts,3,5,0,0,NA,400994132,2017-11-11,
192,3,5:32,932,932,Toree Thompson missed Layup.,51,35,16,0,0.9458730458453154,TCU,Oral Roberts,3,5,0,0,NA,400994132,2017-11-11,
