play_id,period,time_remaining_period,secs_remaining,secs_remaining_absolute,description,home_score,away_score,score_diff,play_length,win_prob,home,away,home_time_out_remaining,away_time_out_remaining,home_timeout_ind,away_timeout_ind,home_favored_by,game_id,date,whichScored
1,1,9:43,2383,2383,Roxy Barahman made Layup.,0,0,0,28,0.5,Columbia,Yale,4,4,0,0,NA,401176287,2020-01-31,NA
2,1,9:15,2355,2355,Mikayla Markham missed Three Point Jumper.,0,2,-2,4,0.45501724388899867,Columbia,Yale,4,4,0,0,NA,401176287,2020-01-31,Yale
3,1,9:11,2351,2351,Camilla Emsbo Defensive Rebound.,0,2,-2,14,0.4549308659299886,Columbia,Yale,4,4,0,0,NA,401176287,2020-01-31,
4,1,8:57,2337,2337,Roxy Barahman Turnover.,0,2,-2,0,0.4546269370703341,Columbia,Yale,4,4,0,0,NA,401176287,2020-01-31,
5,1,8:57,2337,2337,Sienna Durr Steal.,0,2,-2,8,0.4546269370703341,Columbia,Yale,4,4,0,0,NA,401176287,2020-01-31,
6,1,8:49,2329,2329,Janiya Clemmons missed Three Point Jumper.,0,2,-2,2,0.4544521819541921,Columbia,Yale,4,4,0,0,NA,401176287,2020-01-31,
7,1,8:47,2327,2327,Abbey Hsu Offensive Rebound.,0,2,-2,8,0.45440837449252225,Columbia,Yale,4,4,0,0,NA,401176287,2020-01-31,
8,1,8:39,2319,2319,Janiya Clemmons missed Jumper.,0,2,-2,4,0.45423268255208255,Columbia,Yale,4,4,0,0,NA,401176287,2020-01-31,
9,1,8:35,2315,2315,Camilla Emsbo Defensive Rebound.,0,2,-2,13,0.4541445652219872,Columbia,Yale,4,4,0,0,NA,401176287,2020-01-31,
10,1,8:22,2302,2302,Foul on Camilla Emsbo.,0,2,-2,0,0.4538569829834506,Columbia,Yale,4,4,0,0,NA,401176287,2020-01-31,
11,1,8:22,2302,2302,Camilla Emsbo Turnover.,0,2,-2,10,0.4538569829834506,Columbia,Yale,4,4,0,0,NA,401176287,2020-01-31,
12,1,8:12,2292,2292,Sienna Durr missed Jumper.,0,2,-2,0,0.45363457052289796,Columbia,Yale,4,4,0,0,NA,401176287,2020-01-31,
13,1,8:12,2292,2292,Camilla Emsbo Block.,0,2,-2,5,0.45363457052289796,Columbia,Yale,4,4,0,0,NA,401176287,2020-01-31,
14,1,8:07,2287,2287,Camilla Emsbo Defensive Rebound.,0,2,-2,11,0.4535229929185476,Columbia,Yale,4,4,0,0,NA,401176287,2020-01-31,
15,1,7:56,2276,2276,Ellen Margaret Andrews missed Three Point Jumper.,0,2,-2,5,0.4532766908152387,Columbia,Yale,4,4,0,0,NA,401176287,2020-01-31,
16,1,7:51,2271,2271,Abbey Hsu Defensive Rebound.,0,2,-2,4,0.4531643721419195,Columbia,Yale,4,4,0,0,NA,401176287,2020-01-31,
17,1,7:47,2267,2267,Mikayla Markham Turnover.,0,2,-2,0,0.453074360085721,Columbia,Yale,4,4,0,0,NA,401176287,2020-01-31,
18,1,7:47,2267,2267,Camilla Emsbo Steal.,0,2,-2,6,0.453074360085721,Columbia,Yale,4,4,0,0,NA,401176287,2020-01-31,
19,1,7:41,2261,2261,Roxy Barahman made Layup. Assisted by Camilla Emsbo.,0,4,-4,15,0.4067046716886604,Columbia,Yale,4,4,0,0,NA,401176287,2020-01-31,Yale
20,1,7:26,2246,2246,Foul on Sienna Durr.,0,4,-4,0,0.40604368878856145,Columbia,Yale,4,4,0,0,NA,401176287,2020-01-31,
21,1,7:26,2246,2246,Sienna Durr Turnover.,0,4,-4,3,0.40604368878856145,Columbia,Yale,4,4,0,0,NA,401176287,2020-01-31,
22,1,7:23,2243,2243,Ellen Margaret Andrews Turnover.,0,4,-4,0,0.4059111228261333,Columbia,Yale,4,4,0,0,NA,401176287,2020-01-31,
23,1,7:23,2243,2243,Janiya Clemmons Steal.,0,4,-4,15,0.4059111228261333,Columbia,Yale,4,4,0,0,NA,401176287,2020-01-31,
24,1,7:08,2228,2228,Lilian Kennedy Turnover.,0,4,-4,13,0.4052466003757507,Columbia,Yale,4,4,0,0,NA,401176287,2020-01-31,
25,1,6:55,2215,2215,Ellen Margaret Andrews made Three Point Jumper. Assisted by Tori Andrew.,0,7,-7,15,0.3372469197648647,Columbia,Yale,4,4,0,0,NA,401176287,2020-01-31,Yale
26,1,6:40,2200,2200,Mikayla Markham missed Three Point Jumper.,0,7,-7,4,0.33616126016227627,Columbia,Yale,4,4,0,0,NA,401176287,2020-01-31,
27,1,6:36,2196,2196,Camilla Emsbo Defensive Rebound.,0,7,-7,7,0.33587139788311826,Columbia,Yale,4,4,0,0,NA,401176287,2020-01-31,
28,1,6:29,2189,2189,Tori Andrew made Three Point Jumper. Assisted by Roxy Barahman.,0,10,-10,23,0.27345233390687473,Columbia,Yale,4,4,0,0,NA,401176287,2020-01-31,Yale
29,1,6:06,2166,2166,Abbey Hsu made Three Point Jumper. Assisted by Mikayla Markham.,3,10,-7,25,0.33369402783580443,Columbia,Yale,4,4,0,0,NA,401176287,2020-01-31,Columbia
30,1,5:41,2141,2141,Camilla Emsbo missed Layup.,3,10,-7,3,0.33187148014803775,Columbia,Yale,4,4,0,0,NA,401176287,2020-01-31,
31,1,5:38,2138,2138,Janiya Clemmons Defensive Rebound.,3,10,-7,16,0.33165203749068217,Columbia,Yale,4,4,0,0,NA,401176287,2020-01-31,
32,1,5:22,2122,2122,Janiya Clemmons made Three Point Jumper. Assisted by Sienna Durr.,6,10,-4,16,0.4004860791695032,Columbia,Yale,4,4,0,0,NA,401176287,2020-01-31,Columbia
33,1,5:06,2106,2106,Megan Gorman missed Three Point Jumper.,6,10,-4,5,0.3997549674954223,Columbia,Yale,4,4,0,0,NA,401176287,2020-01-31,
34,1,5:01,2101,2101,Abbey Hsu Defensive Rebound.,6,10,-4,1,0.39952562285807824,Columbia,Yale,4,4,0,0,NA,401176287,2020-01-31,
35,1,5:00,2100,2100,Foul on Sienna Durr.,6,10,-4,0,0.39947970270338606,Columbia,Yale,4,4,0,0,NA,401176287,2020-01-31,
36,1,5:00,2100,2100,Sienna Durr Turnover.,6,10,-4,0,0.39947970270338606,Columbia,Yale,4,4,0,0,NA,401176287,2020-01-31,
37,1,5:00,2100,2100,Official TV Timeout,6,10,-4,10,0.39947970270338606,Columbia,Yale,4,4,0,0,NA,401176287,2020-01-31,
38,1,4:50,2090,2090,Ellen Margaret Andrews missed Three Point Jumper.,6,10,-4,3,0.3990195435539744,Columbia,Yale,4,4,0,0,NA,401176287,2020-01-31,
39,1,4:47,2087,2087,Columbia Defensive Rebound.,6,10,-4,12,0.3988811505815072,Columbia,Yale,4,4,0,0,NA,401176287,2020-01-31,
40,1,4:35,2075,2075,Hannah Pratt Turnover.,6,10,-4,21,0.3983259383027953,Columbia,Yale,4,4,0,0,NA,401176287,2020-01-31,
41,1,4:14,2054,2054,Foul on Janiya Clemmons.,6,10,-4,0,0.3973477412113458,Columbia,Yale,4,4,0,0,NA,401176287,2020-01-31,
42,1,4:14,2054,2054,Roxy Barahman missed Free Throw.,6,10,-4,0,0.3973477412113458,Columbia,Yale,4,4,0,0,NA,401176287,2020-01-31,
43,1,4:14,2054,2054,Yale Deadball Team Rebound.,6,10,-4,0,0.3973477412113458,Columbia,Yale,4,4,0,0,NA,401176287,2020-01-31,
44,1,4:14,2054,2054,Roxy Barahman made Free Throw.,6,11,-5,17,0.37269776302883884,Columbia,Yale,4,4,0,0,NA,401176287,2020-01-31,Yale
45,1,3:57,2037,2037,Janiya Clemmons missed Three Point Jumper.,6,11,-5,3,0.37172364495171323,Columbia,Yale,4,4,0,0,NA,401176287,2020-01-31,
46,1,3:54,2034,2034,Camilla Emsbo Defensive Rebound.,6,11,-5,8,0.3715510164178246,Columbia,Yale,4,4,0,0,NA,401176287,2020-01-31,
47,1,3:46,2026,2026,Foul on Hannah Pratt.,6,11,-5,0,0.37108957970039524,Columbia,Yale,4,4,0,0,NA,401176287,2020-01-31,
48,1,3:46,2026,2026,Camilla Emsbo made Free Throw.,6,12,-6,0,0.3468182824021428,Columbia,Yale,4,4,0,0,NA,401176287,2020-01-31,Yale
49,1,3:46,2026,2026,Camilla Emsbo made Free Throw.,6,13,-7,18,0.32331835113366475,Columbia,Yale,4,4,0,0,NA,401176287,2020-01-31,Yale
50,1,3:28,2008,2008,Carly Rivera made Jumper. Assisted by Abbey Hsu.,8,13,-5,24,0.3700453639832478,Columbia,Yale,4,4,0,0,NA,401176287,2020-01-31,Columbia
51,1,3:04,1984,1984,Megan Gorman missed Layup.,8,13,-5,3,0.3686395791775881,Columbia,Yale,4,4,0,0,NA,401176287,2020-01-31,
52,1,3:01,1981,1981,Kaitlyn Davis Defensive Rebound.,8,13,-5,9,0.3684627275554159,Columbia,Yale,4,4,0,0,NA,401176287,2020-01-31,
53,1,2:52,1972,1972,Hannah Pratt made Layup. Assisted by Abbey Hsu.,10,13,-3,22,0.4195397944573588,Columbia,Yale,4,4,0,0,NA,401176287,2020-01-31,Columbia
54,1,2:30,1950,1950,Roxy Barahman missed Three Point Jumper.,10,13,-3,3,0.41871584476614715,Columbia,Yale,4,4,0,0,NA,401176287,2020-01-31,
55,1,2:27,1947,1947,Carly Rivera Defensive Rebound.,10,13,-3,3,0.41860271145403766,Columbia,Yale,4,4,0,0,NA,401176287,2020-01-31,
56,1,2:24,1944,1944,Abbey Hsu made Layup. Assisted by Carly Rivera.,12,13,-1,19,0.4726126317748718,Columbia,Yale,4,4,0,0,NA,401176287,2020-01-31,Columbia
57,1,2:05,1925,1925,Foul on Abbey Hsu.,12,13,-1,0,0.4723661367928424,Columbia,Yale,4,4,0,0,NA,401176287,2020-01-31,
58,1,2:05,1925,1925,Roxy Barahman made Free Throw.,12,14,-2,0,0.44490057596560917,Columbia,Yale,4,4,0,0,NA,401176287,2020-01-31,Yale
59,1,2:05,1925,1925,Roxy Barahman made Free Throw.,12,15,-3,27,0.41776754457668186,Columbia,Yale,4,4,0,0,NA,401176287,2020-01-31,Yale
60,1,1:38,1898,1898,Hannah Pratt Offensive Rebound.,12,15,-3,3,0.4167416643991403,Columbia,Yale,4,4,0,0,NA,401176287,2020-01-31,
61,1,1:35,1895,1895,Abbey Hsu missed Three Point Jumper.,12,15,-3,5,0.4166278204378641,Columbia,Yale,4,4,0,0,NA,401176287,2020-01-31,
62,1,1:30,1890,1890,Alex Cade Defensive Rebound.,12,15,-3,17,0.41643809097700407,Columbia,Yale,4,4,0,0,NA,401176287,2020-01-31,
63,1,1:13,1873,1873,Alex Cade missed Layup.,12,15,-3,5,0.4157927555369989,Columbia,Yale,4,4,0,0,NA,401176287,2020-01-31,
64,1,1:08,1868,1868,Kaitlyn Davis Defensive Rebound.,12,15,-3,7,0.4156027638080216,Columbia,Yale,4,4,0,0,NA,401176287,2020-01-31,
65,1,1:01,1861,1861,Andrea McCormick missed Layup.,12,15,-3,2,0.4153365405766184,Columbia,Yale,4,4,0,0,NA,401176287,2020-01-31,
66,1,0:59,1859,1859,Columbia Offensive Rebound.,12,15,-3,0,0.4152604169840238,Columbia,Yale,4,4,0,0,NA,401176287,2020-01-31,
67,1,0:59,1859,1859,Kaitlyn Davis made Layup. Assisted by Carly Rivera.,14,15,-1,0,0.47150916621993594,Columbia,Yale,4,4,0,0,NA,401176287,2020-01-31,Columbia
68,1,0:59,1859,1859,Foul on Alex Cade.,14,15,-1,0,0.47150916621993594,Columbia,Yale,4,4,0,0,NA,401176287,2020-01-31,
69,1,0:59,1859,1859,Kaitlyn Davis made Free Throw.,15,15,0,24,0.5,Columbia,Yale,4,4,0,0,NA,401176287,2020-01-31,Columbia
70,1,0:35,1835,1835,Alex Cade missed Layup.,15,15,0,1,0.5,Columbia,Yale,4,4,0,0,NA,401176287,2020-01-31,
71,1,0:34,1834,1834,Lilian Kennedy Defensive Rebound.,15,15,0,0,0.5,Columbia,Yale,4,4,0,0,NA,401176287,2020-01-31,
72,1,0:34,1834,1834,Foul on Alex Cade.,15,15,0,25,0.5,Columbia,Yale,4,4,0,0,NA,401176287,2020-01-31,
73,1,0:09,1809,1809,Madison Pack missed Three Point Jumper.,15,15,0,3,0.5,Columbia,Yale,4,4,0,0,NA,401176287,2020-01-31,
74,1,0:06,1806,1806,Madison Pack Offensive Rebound.,15,15,0,6,0.5,Columbia,Yale,4,4,0,0,NA,401176287,2020-01-31,
75,1,0:00,1800,1800,Madison Pack missed Jumper.,15,15,0,0,0.5,Columbia,Yale,4,4,0,0,NA,401176287,2020-01-31,
76,1,0:00,1800,1800,Columbia Deadball Team Rebound.,15,15,0,0,0.5,Columbia,Yale,4,4,0,0,NA,401176287,2020-01-31,
77,1,0:00,1800,1800,End of 1st Quarter,15,15,0,21,0.5,Columbia,Yale,4,4,0,0,NA,401176287,2020-01-31,
78,2,9:39,1779,1779,Ellen Margaret Andrews made Jumper. Assisted by Roxy Barahman.,15,17,-2,26,0.44110882382112104,Columbia,Yale,4,4,0,0,NA,401176287,2020-01-31,Yale
79,2,9:13,1753,1753,Andrea McCormick missed Three Point Jumper.,15,17,-2,3,0.4404077085130537,Columbia,Yale,4,4,0,0,NA,401176287,2020-01-31,
80,2,9:10,1750,1750,Klara Astrom Defensive Rebound.,15,17,-2,13,0.44032591899175627,Columbia,Yale,4,4,0,0,NA,401176287,2020-01-31,
81,2,8:57,1737,1737,Foul on Andrea McCormick.,15,17,-2,10,0.43996914389435965,Columbia,Yale,4,4,0,0,NA,401176287,2020-01-31,
82,2,8:47,1727,1727,Roxy Barahman made Jumper.,15,19,-4,22,0.38111348366022896,Columbia,Yale,4,4,0,0,NA,401176287,2020-01-31,Yale
83,2,8:25,1705,1705,Kaitlyn Davis missed Layup.,15,19,-4,3,0.3799286277301697,Columbia,Yale,4,4,0,0,NA,401176287,2020-01-31,
84,2,8:22,1702,1702,Megan Gorman Defensive Rebound.,15,19,-4,11,0.37976512929794753,Columbia,Yale,4,4,0,0,NA,401176287,2020-01-31,
85,2,8:11,1691,1691,Camilla Emsbo Turnover.,15,19,-4,13,0.3791614162159941,Columbia,Yale,4,4,0,0,NA,401176287,2020-01-31,
86,2,7:58,1678,1678,Mikayla Markham made Layup. Assisted by Kaitlyn Davis.,17,19,-2,18,0.4382993364067255,Columbia,Yale,4,4,0,0,NA,401176287,2020-01-31,Columbia
87,2,7:40,1660,1660,Tori Andrew made Three Point Jumper. Assisted by Megan Gorman.,17,22,-5,14,0.3485791161779443,Columbia,Yale,4,4,0,0,NA,401176287,2020-01-31,Yale
88,2,7:26,1646,1646,Abbey Hsu made Three Point Jumper. Assisted by Janiya Clemmons.,20,22,-2,21,0.43740968560124915,Columbia,Yale,4,4,0,0,NA,401176287,2020-01-31,Columbia
89,2,7:05,1625,1625,Camilla Emsbo missed Jumper.,20,22,-2,3,0.4368401289001044,Columbia,Yale,4,4,0,0,NA,401176287,2020-01-31,
90,2,7:02,1622,1622,Hannah Pratt Defensive Rebound.,20,22,-2,9,0.4367593219887009,Columbia,Yale,4,4,0,0,NA,401176287,2020-01-31,
91,2,6:53,1613,1613,Mikayla Markham Turnover.,20,22,-2,0,0.4365174162092055,Columbia,Yale,4,4,0,0,NA,401176287,2020-01-31,
92,2,6:53,1613,1613,Megan Gorman Steal.,20,22,-2,14,0.4365174162092055,Columbia,Yale,4,4,0,0,NA,401176287,2020-01-31,
93,2,6:39,1599,1599,Foul on Sienna Durr.,20,22,-2,0,0.43614189648005225,Columbia,Yale,4,4,0,0,NA,401176287,2020-01-31,
94,2,6:39,1599,1599,Roxy Barahman missed Free Throw.,20,22,-2,0,0.43614189648005225,Columbia,Yale,4,4,0,0,NA,401176287,2020-01-31,
95,2,6:39,1599,1599,Yale Deadball Team Rebound.,20,22,-2,0,0.43614189648005225,Columbia,Yale,4,4,0,0,NA,401176287,2020-01-31,
96,2,6:39,1599,1599,Roxy Barahman missed Free Throw.,20,22,-2,1,0.43614189648005225,Columbia,Yale,4,4,0,0,NA,401176287,2020-01-31,
97,2,6:38,1598,1598,Madison Pack Defensive Rebound.,20,22,-2,11,0.4361150773446081,Columbia,Yale,4,4,0,0,NA,401176287,2020-01-31,
98,2,6:27,1587,1587,Foul on Klara Astrom.,20,22,-2,5,0.43581978930614085,Columbia,Yale,4,4,0,0,NA,401176287,2020-01-31,
99,2,6:22,1582,1582,Kaitlyn Davis made Layup.,22,22,0,13,0.5,Columbia,Yale,4,4,0,0,NA,401176287,2020-01-31,Columbia
100,2,6:09,1569,1569,Ellen Margaret Andrews missed Three Point Jumper.,22,22,0,3,0.5,Columbia,Yale,4,4,0,0,NA,401176287,2020-01-31,
101,2,6:06,1566,1566,Mikayla Markham Defensive Rebound.,22,22,0,5,0.5,Columbia,Yale,4,4,0,0,NA,401176287,2020-01-31,
102,2,6:01,1561,1561,Foul on Roxy Barahman.,22,22,0,3,0.5,Columbia,Yale,4,4,0,0,NA,401176287,2020-01-31,
103,2,5:58,1558,1558,Lilian Kennedy Turnover.,22,22,0,0,0.5,Columbia,Yale,4,4,0,0,NA,401176287,2020-01-31,
104,2,5:58,1558,1558,Camilla Emsbo Steal.,22,22,0,5,0.5,Columbia,Yale,4,4,0,0,NA,401176287,2020-01-31,
105,2,5:53,1553,1553,Camilla Emsbo made Layup.,22,24,-2,18,0.43489750937340615,Columbia,Yale,4,4,0,0,NA,401176287,2020-01-31,Yale
106,2,5:35,1535,1535,Abbey Hsu missed Layup.,22,24,-2,2,0.4343980689943466,Columbia,Yale,4,4,0,0,NA,401176287,2020-01-31,
107,2,5:33,1533,1533,Columbia Offensive Rebound.,22,24,-2,4,0.4343419034301776,Columbia,Yale,4,4,0,0,NA,401176287,2020-01-31,
108,2,5:29,1529,1529,Kaitlyn Davis missed Layup.,22,24,-2,3,0.43422911713129225,Columbia,Yale,4,4,0,0,NA,401176287,2020-01-31,
109,2,5:26,1526,1526,Ellen Margaret Andrews Defensive Rebound.,22,24,-2,12,0.43414411212486964,Columbia,Yale,4,4,0,0,NA,401176287,2020-01-31,
110,2,5:14,1514,1514,Tori Andrew missed Layup.,22,24,-2,3,0.4338002248838372,Columbia,Yale,4,4,0,0,NA,401176287,2020-01-31,
111,2,5:11,1511,1511,Mikayla Markham Defensive Rebound.,22,24,-2,6,0.43371321343271,Columbia,Yale,4,4,0,0,NA,401176287,2020-01-31,
112,2,5:05,1505,1505,Lilian Kennedy made Jumper. Assisted by Mikayla Markham.,24,24,0,25,0.5,Columbia,Yale,4,4,0,0,NA,401176287,2020-01-31,Columbia
113,2,4:40,1480,1480,Roxy Barahman missed Three Point Jumper.,24,24,0,4,0.5,Columbia,Yale,4,4,0,0,NA,401176287,2020-01-31,
114,2,4:36,1476,1476,Hannah Pratt Defensive Rebound.,24,24,0,3,0.5,Columbia,Yale,4,4,0,0,NA,401176287,2020-01-31,
115,2,4:33,1473,1473,Lilian Kennedy made Layup. Assisted by Mikayla Markham.,26,24,2,0,0.5674323437954826,Columbia,Yale,4,4,1,0,NA,401176287,2020-01-31,Columbia
116,2,4:33,1473,1473,Yale  Timeout,26,24,2,0,0.5674323437954826,Columbia,Yale,3,4,1,0,NA,401176287,2020-01-31,
117,2,4:33,1473,1473,Official TV Timeout,26,24,2,17,0.5674323437954826,Columbia,Yale,3,4,1,0,NA,401176287,2020-01-31,
118,2,4:16,1456,1456,Camilla Emsbo Turnover.,26,24,2,25,0.5679757473721385,Columbia,Yale,3,4,1,0,NA,401176287,2020-01-31,
119,2,3:51,1431,1431,Abbey Hsu missed Layup.,26,24,2,3,0.5687886775542065,Columbia,Yale,3,4,1,0,NA,401176287,2020-01-31,
120,2,3:48,1428,1428,Kaitlyn Davis Offensive Rebound.,26,24,2,1,0.5688837750981199,Columbia,Yale,3,4,1,0,NA,401176287,2020-01-31,
121,2,3:47,1427,1427,Kaitlyn Davis made Layup.,28,24,4,32,0.6352611220582262,Columbia,Yale,3,4,1,0,NA,401176287,2020-01-31,Columbia
122,2,3:15,1395,1395,Foul on Lilian Kennedy.,28,24,4,0,0.6371237195621078,Columbia,Yale,3,4,0,0,NA,401176287,2020-01-31,
123,2,3:15,1395,1395,Megan Gorman missed Free Throw.,28,24,4,0,0.6371237195621078,Columbia,Yale,3,4,0,0,NA,401176287,2020-01-31,
124,2,3:15,1395,1395,Yale Deadball Team Rebound.,28,24,4,0,0.6371237195621078,Columbia,Yale,3,4,0,0,NA,401176287,2020-01-31,
125,2,3:15,1395,1395,Megan Gorman made Free Throw.,28,25,3,20,0.6040039332141572,Columbia,Yale,3,4,0,0,NA,401176287,2020-01-31,Yale
126,2,2:55,1375,1375,Abbey Hsu made Jumper.,30,25,5,12,0.6703492808663359,Columbia,Yale,3,4,0,0,NA,401176287,2020-01-31,Columbia
127,2,2:43,1363,1363,Camilla Emsbo made Layup. Assisted by Ellen Margaret Andrews.,30,27,3,10,0.60541028891113835,Columbia,Yale,3,4,0,0,NA,401176287,2020-01-31,Yale
128,2,2:33,1353,1353,Janiya Clemmons Turnover.,30,27,3,14,0.6058492691702696,Columbia,Yale,3,4,0,0,NA,401176287,2020-01-31,
129,2,2:19,1339,1339,Tori Andrew Turnover.,30,27,3,0,0.6064678534927795,Columbia,Yale,3,4,0,0,NA,401176287,2020-01-31,
130,2,2:19,1339,1339,Janiya Clemmons Steal.,30,27,3,7,0.6064678534927795,Columbia,Yale,3,4,0,0,NA,401176287,2020-01-31,
131,2,2:12,1332,1332,Janiya Clemmons missed Jumper.,30,27,3,5,0.6067799678890241,Columbia,Yale,3,4,0,0,NA,401176287,2020-01-31,
132,2,2:07,1327,1327,Camilla Emsbo Defensive Rebound.,30,27,3,0,0.6070044234060387,Columbia,Yale,3,4,0,0,NA,401176287,2020-01-31,
133,2,2:07,1327,1327,Camilla Emsbo Turnover.,30,27,3,0,0.6070044234060387,Columbia,Yale,3,4,0,0,NA,401176287,2020-01-31,
134,2,2:07,1327,1327,Kaitlyn Davis Steal.,30,27,3,7,0.6070044234060387,Columbia,Yale,3,4,0,0,NA,401176287,2020-01-31,
135,2,2:00,1320,1320,Kaitlyn Davis missed Layup.,30,27,3,0,0.607321157085543,Columbia,Yale,3,4,0,0,NA,401176287,2020-01-31,
136,2,2:00,1320,1320,Camilla Emsbo Block.,30,27,3,4,0.607321157085543,Columbia,Yale,3,4,0,0,NA,401176287,2020-01-31,
137,2,1:56,1316,1316,Camilla Emsbo Defensive Rebound.,30,27,3,10,0.6075036193681723,Columbia,Yale,3,4,0,0,NA,401176287,2020-01-31,
138,2,1:46,1306,1306,Roxy Barahman missed Layup.,30,27,3,0,0.6079651424043253,Columbia,Yale,3,4,0,0,NA,401176287,2020-01-31,
139,2,1:46,1306,1306,Lilian Kennedy Block.,30,27,3,0,0.6079651424043253,Columbia,Yale,3,4,0,0,NA,401176287,2020-01-31,
140,2,1:46,1306,1306,Yale Offensive Rebound.,30,27,3,8,0.6079651424043253,Columbia,Yale,3,4,0,0,NA,401176287,2020-01-31,
141,2,1:38,1298,1298,Roxy Barahman missed Jumper.,30,27,3,1,0.6083406185823617,Columbia,Yale,3,4,0,0,NA,401176287,2020-01-31,
142,2,1:37,1297,1297,Camilla Emsbo Offensive Rebound.,30,27,3,0,0.6083879839551827,Columbia,Yale,3,4,0,0,NA,401176287,2020-01-31,
143,2,1:37,1297,1297,Camilla Emsbo missed Layup.,30,27,3,0,0.6083879839551827,Columbia,Yale,3,4,0,0,NA,401176287,2020-01-31,
144,2,1:37,1297,1297,Kaitlyn Davis Defensive Rebound.,30,27,3,0,0.6083879839551827,Columbia,Yale,3,4,0,0,NA,401176287,2020-01-31,
145,2,1:37,1297,1297,Foul on Camilla Emsbo.,30,27,3,15,0.6083879839551827,Columbia,Yale,3,4,0,0,NA,401176287,2020-01-31,
146,2,1:22,1282,1282,Lilian Kennedy missed Layup.,30,27,3,3,0.6091112902843044,Columbia,Yale,3,4,0,0,NA,401176287,2020-01-31,
147,2,1:19,1279,1279,Roxy Barahman Defensive Rebound.,30,27,3,4,0.6092590750509953,Columbia,Yale,3,4,0,0,NA,401176287,2020-01-31,
148,2,1:15,1275,1275,Klara Astrom made Three Point Jumper. Assisted by Roxy Barahman.,30,30,0,0,0.5,Columbia,Yale,3,4,0,0,NA,401176287,2020-01-31,Yale
149,2,1:15,1275,1275,Foul on Abbey Hsu.,30,30,0,11,0.5,Columbia,Yale,3,4,0,0,NA,401176287,2020-01-31,
150,2,1:04,1264,1264,Ellen Margaret Andrews made Layup.,30,32,-2,22,0.4259848330073558,Columbia,Yale,3,4,0,0,NA,401176287,2020-01-31,Yale
151,2,0:42,1242,1242,Carly Rivera made Jumper.,32,32,0,18,0.5,Columbia,Yale,3,4,0,0,NA,401176287,2020-01-31,Columbia
152,2,0:24,1224,1224,Roxy Barahman made Three Point Jumper. Assisted by Klara Astrom.,32,35,-3,23,0.38779329767761245,Columbia,Yale,3,4,0,0,NA,401176287,2020-01-31,Yale
153,2,0:01,1201,1201,Carly Rivera missed Three Point Jumper.,32,35,-3,1,0.38640798088719136,Columbia,Yale,3,4,0,0,NA,401176287,2020-01-31,
154,2,0:00,1200,1200,Yale Deadball Team Rebound.,32,35,-3,0,0.38634786325026177,Columbia,Yale,3,4,0,0,NA,401176287,2020-01-31,
155,2,0:00,1200,1200,End of 2nd Quarter,32,35,-3,18,0.38634786325026177,Columbia,Yale,3,4,0,0,NA,401176287,2020-01-31,
156,3,9:42,1182,1182,Ellen Margaret Andrews Turnover.,32,35,-3,0,0.38528486434987114,Columbia,Yale,4,5,0,0,NA,401176287,2020-01-31,
157,3,9:42,1182,1182,Sienna Durr Steal.,32,35,-3,16,0.38528486434987114,Columbia,Yale,4,5,0,0,NA,401176287,2020-01-31,
158,3,9:26,1166,1166,Lilian Kennedy made Layup. Assisted by Janiya Clemmons.,34,35,-1,18,0.4608250329665845,Columbia,Yale,4,5,0,0,NA,401176287,2020-01-31,Columbia
159,3,9:08,1148,1148,Megan Gorman made Layup. Assisted by Tori Andrew.,34,37,-3,13,0.38334529576962534,Columbia,Yale,4,5,0,0,NA,401176287,2020-01-31,Yale
160,3,8:55,1135,1135,Mikayla Markham Turnover.,34,37,-3,0,0.38261441981150573,Columbia,Yale,4,5,0,0,NA,401176287,2020-01-31,
161,3,8:55,1135,1135,Roxy Barahman Steal.,34,37,-3,11,0.38261441981150573,Columbia,Yale,4,5,0,0,NA,401176287,2020-01-31,
162,3,8:44,1124,1124,Foul on Lilian Kennedy.,34,37,-3,0,0.38199567253060934,Columbia,Yale,4,5,0,0,NA,401176287,2020-01-31,
163,3,8:44,1124,1124,Tori Andrew missed Free Throw.,34,37,-3,0,0.38199567253060934,Columbia,Yale,4,5,0,0,NA,401176287,2020-01-31,
164,3,8:44,1124,1124,Yale Deadball Team Rebound.,34,37,-3,0,0.38199567253060934,Columbia,Yale,4,5,0,0,NA,401176287,2020-01-31,
165,3,8:44,1124,1124,Tori Andrew made Free Throw.,34,38,-4,13,0.34491923625887044,Columbia,Yale,4,5,0,0,NA,401176287,2020-01-31,Yale
166,3,8:31,1111,1111,Janiya Clemmons Turnover.,34,38,-4,0,0.3439811028958127,Columbia,Yale,4,5,0,0,NA,401176287,2020-01-31,
167,3,8:31,1111,1111,Ellen Margaret Andrews Steal.,34,38,-4,5,0.3439811028958127,Columbia,Yale,4,5,0,0,NA,401176287,2020-01-31,
168,3,8:26,1106,1106,Ellen Margaret Andrews made Layup.,34,40,-6,18,0.2747171804166063,Columbia,Yale,4,5,0,0,NA,401176287,2020-01-31,Yale
169,3,8:08,1088,1088,Janiya Clemmons missed Jumper.,34,40,-6,3,0.2729633404627093,Columbia,Yale,4,5,0,0,NA,401176287,2020-01-31,
170,3,8:05,1085,1085,Ellen Margaret Andrews Defensive Rebound.,34,40,-6,20,0.2726670541461971,Columbia,Yale,4,5,0,0,NA,401176287,2020-01-31,
171,3,7:45,1065,1065,Camilla Emsbo made Layup. Assisted by Roxy Barahman.,34,42,-8,26,0.2105272894808483,Columbia,Yale,4,5,0,0,NA,401176287,2020-01-31,Yale
172,3,7:19,1039,1039,Sienna Durr missed Layup.,34,42,-8,3,0.20744732669873361,Columbia,Yale,4,5,0,0,NA,401176287,2020-01-31,
173,3,7:16,1036,1036,Megan Gorman Defensive Rebound.,34,42,-8,17,0.20707975836870782,Columbia,Yale,4,5,0,0,NA,401176287,2020-01-31,
174,3,6:59,1019,1019,Megan Gorman made Layup. Assisted by Ellen Margaret Andrews.,34,44,-10,26,0.15516960241546865,Columbia,Yale,4,5,0,0,NA,401176287,2020-01-31,Yale
175,3,6:33,993,993,Mikayla Markham missed Jumper.,34,44,-10,3,0.15168004537456384,Columbia,Yale,4,5,0,0,NA,401176287,2020-01-31,
176,3,6:30,990,990,Megan Gorman Defensive Rebound.,34,44,-10,16,0.15126054841630285,Columbia,Yale,4,5,0,0,NA,401176287,2020-01-31,
177,3,6:14,974,974,Camilla Emsbo made Layup. Assisted by Megan Gorman.,34,46,-12,1,0.10994054721117603,Columbia,Yale,4,5,0,0,NA,401176287,2020-01-31,Yale
178,3,6:13,973,973,Columbia  Timeout,34,46,-12,0,0.10980386180478573,Columbia,Yale,4,4,0,1,NA,401176287,2020-01-31,
179,3,6:13,973,973,Official TV Timeout,34,46,-12,28,0.10980386180478573,Columbia,Yale,4,4,0,1,NA,401176287,2020-01-31,
180,3,5:45,945,945,Foul on Roxy Barahman.,34,46,-12,0,0.10621521578228053,Columbia,Yale,4,4,0,1,NA,401176287,2020-01-31,
181,3,5:45,945,945,Kaitlyn Davis made Free Throw.,35,46,-11,0,0.12428124992229447,Columbia,Yale,4,4,0,1,NA,401176287,2020-01-31,Columbia
182,3,5:45,945,945,Kaitlyn Davis made Free Throw.,36,46,-10,18,0.14492187526583328,Columbia,Yale,4,4,0,1,NA,401176287,2020-01-31,Columbia
183,3,5:27,927,927,Tori Andrew made Three Point Jumper. Assisted by Megan Gorman.,36,49,-13,28,0.0886179472299454,Columbia,Yale,4,4,0,1,NA,401176287,2020-01-31,Yale
184,3,4:59,899,899,Abbey Hsu missed Jumper.,36,49,-13,3,0.08597324255170648,Columbia,Yale,4,4,0,0,NA,401176287,2020-01-31,
185,3,4:56,896,896,Megan Gorman Defensive Rebound.,36,49,-13,7,0.08570369949810602,Columbia,Yale,4,4,0,0,NA,401176287,2020-01-31,
186,3,4:49,889,889,Tori Andrew Turnover.,36,49,-13,0,0.08508126998018305,Columbia,Yale,4,4,0,0,NA,401176287,2020-01-31,
187,3,4:49,889,889,Abbey Hsu Steal.,36,49,-13,9,0.08508126998018305,Columbia,Yale,4,4,0,0,NA,401176287,2020-01-31,
188,3,4:40,880,880,Foul on Camilla Emsbo.,36,49,-13,0,0.08429054939896861,Columbia,Yale,4,4,0,0,NA,401176287,2020-01-31,
189,3,4:40,880,880,Official TV Timeout,36,49,-13,11,0.08429054939896861,Columbia,Yale,4,4,0,0,NA,401176287,2020-01-31,
190,3,4:29,869,869,Foul on Alex Cade.,36,49,-13,0,0.08333060154564786,Columbia,Yale,4,4,0,0,NA,401176287,2020-01-31,
191,3,4:29,869,869,Kaitlyn Davis made Free Throw.,37,49,-12,0,0.0985469567156926,Columbia,Yale,4,4,0,0,NA,401176287,2020-01-31,Columbia
192,3,4:29,869,869,Kaitlyn Davis made Free Throw.,38,49,-11,22,0.11618966699863793,Columbia,Yale,4,4,0,0,NA,401176287,2020-01-31,Columbia
193,3,4:07,847,847,Tori Andrew made Three Point Jumper. Assisted by Ellen Margaret Andrews.,38,52,-14,15,0.06849725855681879,Columbia,Yale,4,4,0,0,NA,401176287,2020-01-31,Yale
194,3,3:52,832,832,Kaitlyn Davis missed Three Point Jumper.,38,52,-14,4,0.06724098098709046,Columbia,Yale,4,4,0,0,NA,401176287,2020-01-31,
195,3,3:48,828,828,Megan Gorman Defensive Rebound.,38,52,-14,10,0.06689716701307886,Columbia,Yale,4,4,0,0,NA,401176287,2020-01-31,
196,3,3:38,818,818,Roxy Barahman made Three Point Jumper. Assisted by Megan Gorman.,38,55,-17,13,0.03851996278931233,Columbia,Yale,4,4,0,0,NA,401176287,2020-01-31,Yale
197,3,3:25,805,805,Abbey Hsu made Three Point Jumper. Assisted by Sienna Durr.,41,55,-14,30,0.06482329402071223,Columbia,Yale,4,4,0,0,NA,401176287,2020-01-31,Columbia
