play_id,period,time_remaining_period,secs_remaining,secs_remaining_absolute,description,home_score,away_score,score_diff,play_length,win_prob,home,away,home_time_out_remaining,away_time_out_remaining,home_timeout_ind,away_timeout_ind,home_favored_by,game_id,date,whichScored
1,1,9:46,2686,2686,Chennedy Carter made Jumper.,0,0,0,30,NA,Missouri,Texas A&M,4,4,0,0,NA,401091611,2019-02-07,NA
2,1,9:16,2656,2656,Cierra Porter missed Layup.,0,2,-2,0,NA,Missouri,Texas A&M,4,4,0,0,NA,401091611,2019-02-07,Texas A&M
3,1,9:16,2656,2656,N'dea Jones Defensive Rebound.,0,2,-2,10,NA,Missouri,Texas A&M,4,4,0,0,NA,401091611,2019-02-07,
4,1,9:06,2646,2646,Kayla Wells missed Three Point Jumper.,0,2,-2,0,NA,Missouri,Texas A&M,4,4,0,0,NA,401091611,2019-02-07,
5,1,9:06,2646,2646,Cierra Porter Defensive Rebound.,0,2,-2,8,NA,Missouri,Texas A&M,4,4,0,0,NA,401091611,2019-02-07,
6,1,8:58,2638,2638,Foul on Shambria Washington.,0,2,-2,1,NA,Missouri,Texas A&M,4,4,0,0,NA,401091611,2019-02-07,
7,1,8:57,2637,2637,Sophie Cunningham made Three Point Jumper. Assisted by Lauren Aldridge.,3,2,1,21,NA,Missouri,Texas A&M,4,4,0,0,NA,401091611,2019-02-07,Missouri
8,1,8:36,2616,2616,Kayla Wells missed Jumper.,3,2,1,0,NA,Missouri,Texas A&M,4,4,0,0,NA,401091611,2019-02-07,
9,1,8:36,2616,2616,Amber Smith Defensive Rebound.,3,2,1,11,NA,Missouri,Texas A&M,4,4,0,0,NA,401091611,2019-02-07,
10,1,8:25,2605,2605,Amber Smith missed Three Point Jumper.,3,2,1,0,NA,Missouri,Texas A&M,4,4,0,0,NA,401091611,2019-02-07,
11,1,8:25,2605,2605,Ciera Johnson Defensive Rebound.,3,2,1,17,NA,Missouri,Texas A&M,4,4,0,0,NA,401091611,2019-02-07,
12,1,8:08,2588,2588,Chennedy Carter missed Jumper.,3,2,1,0,NA,Missouri,Texas A&M,4,4,0,0,NA,401091611,2019-02-07,
13,1,8:08,2588,2588,Lauren Aldridge Defensive Rebound.,3,2,1,6,NA,Missouri,Texas A&M,4,4,0,0,NA,401091611,2019-02-07,
14,1,8:02,2582,2582,Sophie Cunningham made Layup. Assisted by Lauren Aldridge.,5,2,3,20,NA,Missouri,Texas A&M,4,4,0,0,NA,401091611,2019-02-07,Missouri
15,1,7:42,2562,2562,Chennedy Carter missed Three Point Jumper.,5,2,3,0,NA,Missouri,Texas A&M,4,4,0,0,NA,401091611,2019-02-07,
16,1,7:42,2562,2562,Missouri Defensive Rebound.,5,2,3,23,NA,Missouri,Texas A&M,4,4,0,0,NA,401091611,2019-02-07,
17,1,7:19,2539,2539,Amber Smith missed Layup.,5,2,3,0,NA,Missouri,Texas A&M,4,4,0,0,NA,401091611,2019-02-07,
18,1,7:19,2539,2539,Cierra Porter Offensive Rebound.,5,2,3,7,NA,Missouri,Texas A&M,4,4,0,0,NA,401091611,2019-02-07,
19,1,7:12,2532,2532,Sophie Cunningham made Three Point Jumper. Assisted by Lauren Aldridge.,8,2,6,19,NA,Missouri,Texas A&M,4,4,0,0,NA,401091611,2019-02-07,Missouri
20,1,6:53,2513,2513,N'dea Jones missed Jumper.,8,2,6,0,NA,Missouri,Texas A&M,4,4,0,0,NA,401091611,2019-02-07,
21,1,6:53,2513,2513,Missouri Defensive Rebound.,8,2,6,21,NA,Missouri,Texas A&M,4,4,0,0,NA,401091611,2019-02-07,
22,1,6:32,2492,2492,Lauren Aldridge missed Three Point Jumper.,8,2,6,0,NA,Missouri,Texas A&M,4,4,0,0,NA,401091611,2019-02-07,
23,1,6:32,2492,2492,N'dea Jones Defensive Rebound.,8,2,6,13,NA,Missouri,Texas A&M,4,4,0,0,NA,401091611,2019-02-07,
24,1,6:19,2479,2479,Shambria Washington missed Three Point Jumper.,8,2,6,0,NA,Missouri,Texas A&M,4,4,0,0,NA,401091611,2019-02-07,
25,1,6:19,2479,2479,N'dea Jones Offensive Rebound.,8,2,6,6,NA,Missouri,Texas A&M,4,4,0,0,NA,401091611,2019-02-07,
26,1,6:13,2473,2473,Foul on Cierra Porter.,8,2,6,0,NA,Missouri,Texas A&M,4,4,0,0,NA,401091611,2019-02-07,
27,1,6:13,2473,2473,N'dea Jones made Free Throw.,8,3,5,0,NA,Missouri,Texas A&M,4,4,0,0,NA,401091611,2019-02-07,Texas A&M
28,1,6:13,2473,2473,N'dea Jones made Free Throw.,8,4,4,20,NA,Missouri,Texas A&M,4,4,0,0,NA,401091611,2019-02-07,Texas A&M
29,1,5:53,2453,2453,Foul on Ciera Johnson.,8,4,4,21,NA,Missouri,Texas A&M,4,4,0,0,NA,401091611,2019-02-07,
30,1,5:32,2432,2432,Foul on Chennedy Carter.,8,4,4,3,NA,Missouri,Texas A&M,4,4,0,0,NA,401091611,2019-02-07,
31,1,5:29,2429,2429,Jordan Roundtree made Layup. Assisted by Lauren Aldridge.,10,4,6,17,NA,Missouri,Texas A&M,4,4,0,0,NA,401091611,2019-02-07,Missouri
32,1,5:12,2412,2412,Foul on Jordan Roundtree.,10,4,6,4,NA,Missouri,Texas A&M,4,4,0,0,NA,401091611,2019-02-07,
33,1,5:08,2408,2408,N'dea Jones missed Layup.,10,4,6,0,NA,Missouri,Texas A&M,4,4,0,0,NA,401091611,2019-02-07,
34,1,5:08,2408,2408,Cierra Porter Defensive Rebound.,10,4,6,10,NA,Missouri,Texas A&M,4,4,0,0,NA,401091611,2019-02-07,
35,1,4:58,2398,2398,Cierra Porter made Layup. Assisted by Emmanuelle Tahane.,12,4,8,3,0.6697212890515857,Missouri,Texas A&M,4,4,0,0,NA,401091611,2019-02-07,Missouri
36,1,4:55,2395,2395,Texas A&M  Timeout,12,4,8,26,0.6699457269407562,Missouri,Texas A&M,3,4,1,0,NA,401091611,2019-02-07,
37,1,4:29,2369,2369,Kayla Wells missed Three Point Jumper.,12,4,8,0,0.6719077033802204,Missouri,Texas A&M,3,4,1,0,NA,401091611,2019-02-07,
38,1,4:29,2369,2369,Emmanuelle Tahane Defensive Rebound.,12,4,8,11,0.6719077033802204,Missouri,Texas A&M,3,4,1,0,NA,401091611,2019-02-07,
39,1,4:18,2358,2358,Foul on N'dea Jones.,12,4,8,0,0.6727463021460353,Missouri,Texas A&M,3,4,1,0,NA,401091611,2019-02-07,
40,1,4:18,2358,2358,Emmanuelle Tahane missed Free Throw.,12,4,8,0,0.6727463021460353,Missouri,Texas A&M,3,4,1,0,NA,401091611,2019-02-07,
41,1,4:18,2358,2358,Missouri Deadball Team Rebound.,12,4,8,0,0.6727463021460353,Missouri,Texas A&M,3,4,1,0,NA,401091611,2019-02-07,
42,1,4:18,2358,2358,Emmanuelle Tahane made Free Throw.,13,4,9,16,0.6922611344267096,Missouri,Texas A&M,3,4,1,0,NA,401091611,2019-02-07,Missouri
43,1,4:02,2342,2342,Chennedy Carter Turnover.,13,4,9,1,0.6935976640380916,Missouri,Texas A&M,3,4,1,0,NA,401091611,2019-02-07,
44,1,4:01,2341,2341,Emmanuelle Tahane Steal.,13,4,9,3,0.6936815117362607,Missouri,Texas A&M,3,4,1,0,NA,401091611,2019-02-07,
45,1,3:58,2338,2338,Emmanuelle Tahane missed Layup.,13,4,9,0,0.693933267785904,Missouri,Texas A&M,3,4,1,0,NA,401091611,2019-02-07,
46,1,3:58,2338,2338,Ciera Johnson Defensive Rebound.,13,4,9,23,0.693933267785904,Missouri,Texas A&M,3,4,1,0,NA,401091611,2019-02-07,
47,1,3:35,2315,2315,Kayla Wells missed Jumper.,13,4,9,0,0.6958733995842745,Missouri,Texas A&M,3,4,0,0,NA,401091611,2019-02-07,
48,1,3:35,2315,2315,Cierra Porter Block.,13,4,9,3,0.6958733995842745,Missouri,Texas A&M,3,4,0,0,NA,401091611,2019-02-07,
49,1,3:32,2312,2312,Ciera Johnson Offensive Rebound.,13,4,9,2,0.696127679683492,Missouri,Texas A&M,3,4,0,0,NA,401091611,2019-02-07,
50,1,3:30,2310,2310,Ciera Johnson made Layup.,13,6,7,16,0.6559604214186431,Missouri,Texas A&M,3,4,0,0,NA,401091611,2019-02-07,Texas A&M
51,1,3:14,2294,2294,Foul on Kayla Wells.,13,6,7,0,0.6570909012663833,Missouri,Texas A&M,3,4,0,0,NA,401091611,2019-02-07,
52,1,3:14,2294,2294,Sophie Cunningham made Free Throw.,14,6,8,0,0.6777094333741094,Missouri,Texas A&M,3,4,0,0,NA,401091611,2019-02-07,Missouri
53,1,3:14,2294,2294,Sophie Cunningham made Free Throw.,15,6,9,0,0.6976586469104953,Missouri,Texas A&M,3,4,0,0,NA,401091611,2019-02-07,Missouri
54,1,3:14,2294,2294,Sophie Cunningham missed Free Throw.,15,6,9,0,0.6976586469104953,Missouri,Texas A&M,3,4,0,0,NA,401091611,2019-02-07,
55,1,3:14,2294,2294,N'dea Jones Defensive Rebound.,15,6,9,22,0.6976586469104953,Missouri,Texas A&M,3,4,0,0,NA,401091611,2019-02-07,
56,1,2:52,2272,2272,Chennedy Carter missed Layup.,15,6,9,0,0.6995407308099254,Missouri,Texas A&M,3,4,0,0,NA,401091611,2019-02-07,
57,1,2:52,2272,2272,Missouri Defensive Rebound.,15,6,9,27,0.6995407308099254,Missouri,Texas A&M,3,4,0,0,NA,401091611,2019-02-07,
58,1,2:25,2245,2245,Amber Smith Turnover.,15,6,9,1,0.7018636873351541,Missouri,Texas A&M,3,4,0,0,NA,401091611,2019-02-07,
59,1,2:24,2244,2244,Ciera Johnson Steal.,15,6,9,5,0.7019499494898329,Missouri,Texas A&M,3,4,0,0,NA,401091611,2019-02-07,
60,1,2:19,2239,2239,Chennedy Carter missed Jumper.,15,6,9,0,0.702381467341028,Missouri,Texas A&M,3,4,0,0,NA,401091611,2019-02-07,
61,1,2:19,2239,2239,Amber Smith Defensive Rebound.,15,6,9,9,0.702381467341028,Missouri,Texas A&M,3,4,0,0,NA,401091611,2019-02-07,
62,1,2:10,2230,2230,Akira Levy missed Layup.,15,6,9,0,0.7031590011771066,Missouri,Texas A&M,3,4,0,0,NA,401091611,2019-02-07,
63,1,2:10,2230,2230,Shambria Washington Defensive Rebound.,15,6,9,19,0.7031590011771066,Missouri,Texas A&M,3,4,0,0,NA,401091611,2019-02-07,
64,1,1:51,2211,2211,Chennedy Carter made Jumper. Assisted by Jasmine Williams.,15,8,7,24,0.663042366046659,Missouri,Texas A&M,3,4,0,0,NA,401091611,2019-02-07,Texas A&M
65,1,1:27,2187,2187,Amber Smith missed Layup.,15,8,7,0,0.6647812415814948,Missouri,Texas A&M,3,4,0,0,NA,401091611,2019-02-07,
66,1,1:27,2187,2187,Jasmine Williams Defensive Rebound.,15,8,7,16,0.6647812415814948,Missouri,Texas A&M,3,4,0,0,NA,401091611,2019-02-07,
67,1,1:11,2171,2171,Chennedy Carter made Jumper.,15,10,5,22,0.6207609534301429,Missouri,Texas A&M,3,4,0,0,NA,401091611,2019-02-07,Texas A&M
68,1,0:49,2149,2149,Sophie Cunningham Turnover.,15,10,5,9,0.6219721448464608,Missouri,Texas A&M,3,4,0,0,NA,401091611,2019-02-07,
69,1,0:40,2140,2140,Chennedy Carter missed Jumper.,15,10,5,0,0.6224698374899826,Missouri,Texas A&M,3,4,0,0,NA,401091611,2019-02-07,
70,1,0:40,2140,2140,Chennedy Carter Offensive Rebound.,15,10,5,11,0.6224698374899826,Missouri,Texas A&M,3,4,0,0,NA,401091611,2019-02-07,
71,1,0:29,2129,2129,Kayla Wells missed Jumper.,15,10,5,0,0.6230799858828722,Missouri,Texas A&M,3,4,0,0,NA,401091611,2019-02-07,
72,1,0:29,2129,2129,Shambria Washington Offensive Rebound.,15,10,5,24,0.6230799858828722,Missouri,Texas A&M,3,4,0,0,NA,401091611,2019-02-07,
73,1,0:05,2105,2105,Chennedy Carter missed Jumper.,15,10,5,0,0.6244187764379728,Missouri,Texas A&M,3,4,0,0,NA,401091611,2019-02-07,
74,1,0:05,2105,2105,Cheah Rael-Whitsitt Offensive Rebound.,15,10,5,5,0.6244187764379728,Missouri,Texas A&M,3,4,0,0,NA,401091611,2019-02-07,
75,1,0:00,2100,2100,Cheah Rael-Whitsitt missed Jumper.,15,10,5,0,0.6246990685759959,Missouri,Texas A&M,3,4,0,0,NA,401091611,2019-02-07,
76,1,0:00,2100,2100,Jordan Chavis Defensive Rebound.,15,10,5,0,0.6246990685759959,Missouri,Texas A&M,3,4,0,0,NA,401091611,2019-02-07,
77,1,0:00,2100,2100,End of 1st Quarter,15,10,5,13,0.6246990685759959,Missouri,Texas A&M,3,4,0,0,NA,401091611,2019-02-07,
78,2,9:47,2087,2087,Emmanuelle Tahane Turnover.,15,10,5,11,0.6254301739504524,Missouri,Texas A&M,4,4,0,0,NA,401091611,2019-02-07,
79,2,9:36,2076,2076,Ciera Johnson made Jumper.,15,12,3,32,0.5766872539992671,Missouri,Texas A&M,4,4,0,0,NA,401091611,2019-02-07,Texas A&M
80,2,9:04,2044,2044,Jordan Roundtree missed Jumper.,15,12,3,0,0.5778284444135545,Missouri,Texas A&M,4,4,0,0,NA,401091611,2019-02-07,
81,2,9:04,2044,2044,Chennedy Carter Defensive Rebound.,15,12,3,26,0.5778284444135545,Missouri,Texas A&M,4,4,0,0,NA,401091611,2019-02-07,
82,2,8:38,2018,2018,Shambria Washington missed Jumper.,15,12,3,0,0.5787680061771149,Missouri,Texas A&M,4,4,0,0,NA,401091611,2019-02-07,
83,2,8:38,2018,2018,Sophie Cunningham Defensive Rebound.,15,12,3,2,0.5787680061771149,Missouri,Texas A&M,4,4,0,0,NA,401091611,2019-02-07,
84,2,8:36,2016,2016,Foul on Ciera Johnson.,15,12,3,20,0.578840765789688,Missouri,Texas A&M,4,4,0,0,NA,401091611,2019-02-07,
85,2,8:16,1996,1996,Amber Smith made Layup. Assisted by Cierra Porter.,17,12,5,20,0.6306555481128907,Missouri,Texas A&M,4,4,0,0,NA,401091611,2019-02-07,Missouri
86,2,7:56,1976,1976,Kayla Wells made Three Point Jumper. Assisted by Shambria Washington.,17,15,2,7,0.5537995975404946,Missouri,Texas A&M,4,4,0,0,NA,401091611,2019-02-07,Texas A&M
87,2,7:49,1969,1969,Foul on Caylinne Martin.,17,15,2,10,0.5539758302751209,Missouri,Texas A&M,4,4,0,0,NA,401091611,2019-02-07,
88,2,7:39,1959,1959,Akira Levy made Jumper.,19,15,4,19,0.6071966000861357,Missouri,Texas A&M,4,4,0,0,NA,401091611,2019-02-07,Missouri
89,2,7:20,1940,1940,Chennedy Carter made Three Point Jumper.,19,18,1,15,0.5274390583629032,Missouri,Texas A&M,4,4,0,0,NA,401091611,2019-02-07,Texas A&M
90,2,7:05,1925,1925,Amber Smith Turnover.,19,18,1,18,0.5276338632071575,Missouri,Texas A&M,4,4,0,0,NA,401091611,2019-02-07,
91,2,6:47,1907,1907,Kayla Wells missed Jumper.,19,18,1,0,0.5278676197150458,Missouri,Texas A&M,4,4,0,0,NA,401091611,2019-02-07,
92,2,6:47,1907,1907,Emmanuelle Tahane Defensive Rebound.,19,18,1,31,0.5278676197150458,Missouri,Texas A&M,4,4,0,0,NA,401091611,2019-02-07,
93,2,6:16,1876,1876,Akira Levy missed Jumper.,19,18,1,0,0.5282698006654232,Missouri,Texas A&M,4,4,0,0,NA,401091611,2019-02-07,
94,2,6:16,1876,1876,Cheah Rael-Whitsitt Defensive Rebound.,19,18,1,9,0.5282698006654232,Missouri,Texas A&M,4,4,0,0,NA,401091611,2019-02-07,
95,2,6:07,1867,1867,Chennedy Carter made Three Point Jumper.,19,21,-2,33,0.44340892914977953,Missouri,Texas A&M,4,4,0,0,NA,401091611,2019-02-07,Texas A&M
96,2,5:34,1834,1834,Jordan Roundtree made Layup.,21,21,0,0,0.5,Missouri,Texas A&M,4,4,0,0,NA,401091611,2019-02-07,Missouri
97,2,5:34,1834,1834,Foul on Caylinne Martin.,21,21,0,0,0.5,Missouri,Texas A&M,4,4,0,0,NA,401091611,2019-02-07,
98,2,5:34,1834,1834,Jordan Roundtree made Free Throw.,22,21,1,14,0.5288174947608248,Missouri,Texas A&M,4,4,0,0,NA,401091611,2019-02-07,Missouri
99,2,5:20,1820,1820,Chennedy Carter made Jumper.,22,23,-1,10,0.47099834121014167,Missouri,Texas A&M,4,4,0,0,NA,401091611,2019-02-07,Texas A&M
100,2,5:10,1810,1810,Foul on Cheah Rael-Whitsitt.,22,23,-1,0,0.470866101029719,Missouri,Texas A&M,4,4,0,0,NA,401091611,2019-02-07,
101,2,5:10,1810,1810,Hannah Schuchts missed Free Throw.,22,23,-1,0,0.470866101029719,Missouri,Texas A&M,4,4,0,0,NA,401091611,2019-02-07,
102,2,5:10,1810,1810,Missouri Deadball Team Rebound.,22,23,-1,0,0.470866101029719,Missouri,Texas A&M,4,4,0,0,NA,401091611,2019-02-07,
103,2,5:10,1810,1810,Hannah Schuchts missed Free Throw.,22,23,-1,0,0.470866101029719,Missouri,Texas A&M,4,4,0,0,NA,401091611,2019-02-07,
104,2,5:10,1810,1810,Kayla Wells Defensive Rebound.,22,23,-1,17,0.470866101029719,Missouri,Texas A&M,4,4,0,0,NA,401091611,2019-02-07,
105,2,4:53,1793,1793,Chennedy Carter made Jumper. Assisted by Shambria Washington.,22,25,-3,0,0.41272077010309743,Missouri,Texas A&M,4,4,0,0,NA,401091611,2019-02-07,Texas A&M
106,2,4:53,1793,1793,Foul on Jordan Roundtree.,22,25,-3,0,0.41272077010309743,Missouri,Texas A&M,4,4,0,0,NA,401091611,2019-02-07,
107,2,4:53,1793,1793,Official TV Timeout,22,25,-3,1,0.41272077010309743,Missouri,Texas A&M,4,4,0,0,NA,401091611,2019-02-07,
108,2,4:52,1792,1792,Chennedy Carter missed Free Throw.,22,25,-3,0,0.41268170561417516,Missouri,Texas A&M,4,4,0,0,NA,401091611,2019-02-07,
109,2,4:52,1792,1792,Cheah Rael-Whitsitt Offensive Rebound.,22,25,-3,1,0.41268170561417516,Missouri,Texas A&M,4,4,0,0,NA,401091611,2019-02-07,
110,2,4:51,1791,1791,Kayla Wells made Layup.,22,27,-5,0,0.3569976248976468,Missouri,Texas A&M,4,4,0,0,NA,401091611,2019-02-07,Texas A&M
111,2,4:51,1791,1791,Foul on Jordan Chavis.,22,27,-5,6,0.3569976248976468,Missouri,Texas A&M,4,4,0,0,NA,401091611,2019-02-07,
112,2,4:45,1785,1785,Kayla Wells made Free Throw.,22,28,-6,21,0.33003150362922973,Missouri,Texas A&M,4,4,0,0,NA,401091611,2019-02-07,Texas A&M
113,2,4:24,1764,1764,Emmanuelle Tahane missed Layup.,22,28,-6,0,0.32851872957640205,Missouri,Texas A&M,4,4,0,0,NA,401091611,2019-02-07,
114,2,4:24,1764,1764,N'dea Jones Block.,22,28,-6,2,0.32851872957640205,Missouri,Texas A&M,4,4,0,0,NA,401091611,2019-02-07,
115,2,4:22,1762,1762,N'dea Jones Defensive Rebound.,22,28,-6,0,0.32837364502203287,Missouri,Texas A&M,4,4,0,0,NA,401091611,2019-02-07,
116,2,4:22,1762,1762,Foul on Cierra Porter.,22,28,-6,16,0.32837364502203287,Missouri,Texas A&M,4,4,0,0,NA,401091611,2019-02-07,
117,2,4:06,1746,1746,Chennedy Carter missed Jumper.,22,28,-6,0,0.3272059068900757,Missouri,Texas A&M,4,4,0,0,NA,401091611,2019-02-07,
118,2,4:06,1746,1746,Cierra Porter Defensive Rebound.,22,28,-6,20,0.3272059068900757,Missouri,Texas A&M,4,4,0,0,NA,401091611,2019-02-07,
119,2,3:46,1726,1726,Emmanuelle Tahane made Layup. Assisted by Cierra Porter.,24,28,-4,21,0.3810601423286777,Missouri,Texas A&M,4,4,0,0,NA,401091611,2019-02-07,Missouri
120,2,3:25,1705,1705,Kayla Wells missed Three Point Jumper.,24,28,-4,0,0.3799286277301697,Missouri,Texas A&M,4,4,0,0,NA,401091611,2019-02-07,
121,2,3:25,1705,1705,Cierra Porter Defensive Rebound.,24,28,-4,9,0.3799286277301697,Missouri,Texas A&M,4,4,0,0,NA,401091611,2019-02-07,
122,2,3:16,1696,1696,Lauren Aldridge Turnover.,24,28,-4,23,0.3794366658202934,Missouri,Texas A&M,4,4,0,0,NA,401091611,2019-02-07,
123,2,2:53,1673,1673,Cheah Rael-Whitsitt Turnover.,24,28,-4,1,0.3781795941649741,Missouri,Texas A&M,4,4,0,0,NA,401091611,2019-02-07,
124,2,2:52,1672,1672,Sophie Cunningham Steal.,24,28,-4,1,0.37812581805464135,Missouri,Texas A&M,4,4,0,0,NA,401091611,2019-02-07,
125,2,2:51,1671,1671,Foul on Cheah Rael-Whitsitt.,24,28,-4,0,0.37807211639726745,Missouri,Texas A&M,4,4,0,0,NA,401091611,2019-02-07,
126,2,2:51,1671,1671,Sophie Cunningham made Free Throw.,25,28,-3,0,0.4077428073028869,Missouri,Texas A&M,4,4,0,0,NA,401091611,2019-02-07,Missouri
127,2,2:51,1671,1671,Sophie Cunningham made Free Throw.,26,28,-2,23,0.4381017508589883,Missouri,Texas A&M,4,4,0,0,NA,401091611,2019-02-07,Missouri
128,2,2:28,1648,1648,Jordan Chavis missed Three Point Jumper.,26,28,-2,0,0.4374643940988438,Missouri,Texas A&M,4,4,0,0,NA,401091611,2019-02-07,
129,2,2:28,1648,1648,Emmanuelle Tahane Offensive Rebound.,26,28,-2,10,0.4374643940988438,Missouri,Texas A&M,4,4,0,0,NA,401091611,2019-02-07,
130,2,2:18,1638,1638,Amber Smith made Layup. Assisted by Emmanuelle Tahane.,28,28,0,25,0.5,Missouri,Texas A&M,4,4,0,0,NA,401091611,2019-02-07,Missouri
131,2,1:53,1613,1613,Chennedy Carter missed Three Point Jumper.,28,28,0,0,0.5,Missouri,Texas A&M,4,4,0,0,NA,401091611,2019-02-07,
132,2,1:53,1613,1613,Texas A&M Offensive Rebound.,28,28,0,6,0.5,Missouri,Texas A&M,4,4,0,0,NA,401091611,2019-02-07,
133,2,1:47,1607,1607,N'dea Jones missed Jumper.,28,28,0,0,0.5,Missouri,Texas A&M,4,4,0,0,NA,401091611,2019-02-07,
134,2,1:47,1607,1607,Aja Ellison Offensive Rebound.,28,28,0,2,0.5,Missouri,Texas A&M,4,4,0,0,NA,401091611,2019-02-07,
135,2,1:45,1605,1605,Foul on Emmanuelle Tahane.,28,28,0,3,0.5,Missouri,Texas A&M,4,4,0,0,NA,401091611,2019-02-07,
136,2,1:42,1602,1602,Kayla Wells missed Jumper.,28,28,0,0,0.5,Missouri,Texas A&M,4,4,0,0,NA,401091611,2019-02-07,
137,2,1:42,1602,1602,Amber Smith Defensive Rebound.,28,28,0,1,0.5,Missouri,Texas A&M,4,4,0,0,NA,401091611,2019-02-07,
138,2,1:41,1601,1601,Foul on Aja Ellison.,28,28,0,0,0.5,Missouri,Texas A&M,4,4,0,0,NA,401091611,2019-02-07,
139,2,1:41,1601,1601,Amber Smith made Free Throw.,29,28,1,0,0.5320331777955251,Missouri,Texas A&M,4,4,0,0,NA,401091611,2019-02-07,Missouri
140,2,1:41,1601,1601,Amber Smith made Free Throw.,30,28,2,8,0.563804470275599,Missouri,Texas A&M,4,4,0,0,NA,401091611,2019-02-07,Missouri
141,2,1:33,1593,1593,Foul on Jordan Chavis.,30,28,2,0,0.5640190651508649,Missouri,Texas A&M,4,4,0,0,NA,401091611,2019-02-07,
142,2,1:33,1593,1593,Chennedy Carter made Free Throw.,30,29,1,0,0.5321418082347733,Missouri,Texas A&M,4,4,0,0,NA,401091611,2019-02-07,Texas A&M
143,2,1:33,1593,1593,Chennedy Carter made Free Throw.,30,30,0,7,0.5,Missouri,Texas A&M,4,4,0,0,NA,401091611,2019-02-07,Texas A&M
144,2,1:26,1586,1586,Amber Smith made Three Point Jumper. Assisted by Akira Levy.,33,30,3,22,0.595652152557261,Missouri,Texas A&M,4,4,0,0,NA,401091611,2019-02-07,Missouri
145,2,1:04,1564,1564,Foul on Kayla Wells.,33,30,3,0,0.5965257275520335,Missouri,Texas A&M,4,4,0,0,NA,401091611,2019-02-07,
146,2,1:04,1564,1564,Kayla Wells Turnover.,33,30,3,17,0.5965257275520335,Missouri,Texas A&M,4,4,0,0,NA,401091611,2019-02-07,
147,2,0:47,1547,1547,Foul on Aja Ellison.,33,30,3,0,0.5972102229022763,Missouri,Texas A&M,4,4,0,0,NA,401091611,2019-02-07,
148,2,0:47,1547,1547,Emmanuelle Tahane missed Free Throw.,33,30,3,0,0.5972102229022763,Missouri,Texas A&M,4,4,0,0,NA,401091611,2019-02-07,
149,2,0:47,1547,1547,Missouri Deadball Team Rebound.,33,30,3,0,0.5972102229022763,Missouri,Texas A&M,4,4,0,0,NA,401091611,2019-02-07,
150,2,0:47,1547,1547,Emmanuelle Tahane made Free Throw.,34,30,4,7,0.6283486966054687,Missouri,Texas A&M,4,4,0,0,NA,401091611,2019-02-07,Missouri
151,2,0:40,1540,1540,Chennedy Carter missed Jumper.,34,30,4,0,0.6287179167243605,Missouri,Texas A&M,4,4,0,0,NA,401091611,2019-02-07,
152,2,0:40,1540,1540,Texas A&M Offensive Rebound.,34,30,4,6,0.6287179167243605,Missouri,Texas A&M,4,4,0,0,NA,401091611,2019-02-07,
153,2,0:34,1534,1534,Chennedy Carter missed Jumper.,34,30,4,0,0.6290367917721683,Missouri,Texas A&M,4,4,0,0,NA,401091611,2019-02-07,
154,2,0:34,1534,1534,Aja Ellison Offensive Rebound.,34,30,4,29,0.6290367917721683,Missouri,Texas A&M,4,4,0,0,NA,401091611,2019-02-07,
155,2,0:05,1505,1505,Foul on Amber Smith.,34,30,4,0,0.6306164719091955,Missouri,Texas A&M,4,4,0,0,NA,401091611,2019-02-07,
156,2,0:05,1505,1505,Chennedy Carter made Free Throw.,34,31,3,0,0.5989631584831999,Missouri,Texas A&M,4,4,0,0,NA,401091611,2019-02-07,Texas A&M
157,2,0:05,1505,1505,Chennedy Carter made Free Throw.,34,32,2,5,0.5664621589662935,Missouri,Texas A&M,4,4,0,0,NA,401091611,2019-02-07,Texas A&M
158,2,0:00,1500,1500,End of 2nd Quarter,34,32,2,13,0.5666097462963707,Missouri,Texas A&M,4,4,0,0,NA,401091611,2019-02-07,
159,3,9:47,1487,1487,Kayla Wells Turnover.,34,32,2,2,0.5670001197688102,Missouri,Texas A&M,5,5,0,0,NA,401091611,2019-02-07,
160,3,9:45,1485,1485,Jordan Roundtree Steal.,34,32,2,2,0.5670610831786758,Missouri,Texas A&M,5,5,0,0,NA,401091611,2019-02-07,
161,3,9:43,1483,1483,Jordan Roundtree made Layup.,36,32,4,14,0.6318681244680657,Missouri,Texas A&M,5,5,0,0,NA,401091611,2019-02-07,Missouri
162,3,9:29,1469,1469,Foul on Lauren Aldridge.,36,32,4,2,0.6326940490494581,Missouri,Texas A&M,5,5,0,0,NA,401091611,2019-02-07,
163,3,9:27,1467,1467,Kayla Wells missed Jumper.,36,32,4,0,0.6328141086951772,Missouri,Texas A&M,5,5,0,0,NA,401091611,2019-02-07,
164,3,9:27,1467,1467,Amber Smith Defensive Rebound.,36,32,4,21,0.6328141086951772,Missouri,Texas A&M,5,5,0,0,NA,401091611,2019-02-07,
165,3,9:06,1446,1446,Jordan Roundtree Turnover.,36,32,4,0,0.6341065305782657,Missouri,Texas A&M,5,5,0,0,NA,401091611,2019-02-07,
166,3,9:06,1446,1446,N'dea Jones Steal.,36,32,4,0,0.6341065305782657,Missouri,Texas A&M,5,5,0,0,NA,401091611,2019-02-07,
167,3,9:06,1446,1446,Foul on Amber Smith.,36,32,4,19,0.6341065305782657,Missouri,Texas A&M,5,5,0,0,NA,401091611,2019-02-07,
168,3,8:47,1427,1427,Kayla Wells Turnover.,36,32,4,1,0.6352611220582262,Missouri,Texas A&M,5,5,0,0,NA,401091611,2019-02-07,
169,3,8:46,1426,1426,Sophie Cunningham Steal.,36,32,4,4,0.6353206950383095,Missouri,Texas A&M,5,5,0,0,NA,401091611,2019-02-07,
170,3,8:42,1422,1422,Sophie Cunningham Turnover.,36,32,4,13,0.6355579396282618,Missouri,Texas A&M,5,5,0,0,NA,401091611,2019-02-07,
171,3,8:29,1409,1409,Chennedy Carter made Jumper.,36,34,2,19,0.5694752857545454,Missouri,Texas A&M,5,5,0,0,NA,401091611,2019-02-07,Texas A&M
172,3,8:10,1390,1390,Amber Smith made Jumper.,38,34,4,17,0.6374086305432503,Missouri,Texas A&M,5,5,0,0,NA,401091611,2019-02-07,Missouri
173,3,7:53,1373,1373,Kayla Wells made Three Point Jumper. Assisted by Chennedy Carter.,38,37,1,18,0.5354592030530729,Missouri,Texas A&M,5,5,0,0,NA,401091611,2019-02-07,Texas A&M
174,3,7:35,1355,1355,Foul on Ciera Johnson.,38,37,1,0,0.5357331137677486,Missouri,Texas A&M,5,5,0,0,NA,401091611,2019-02-07,
175,3,7:35,1355,1355,Cierra Porter made Free Throw.,39,37,2,0,0.5711030741531837,Missouri,Texas A&M,5,5,0,0,NA,401091611,2019-02-07,Missouri
176,3,7:35,1355,1355,Cierra Porter made Free Throw.,40,37,3,15,0.6057613420695408,Missouri,Texas A&M,5,5,0,0,NA,401091611,2019-02-07,Missouri
177,3,7:20,1340,1340,Shambria Washington made Jumper.,40,39,1,17,0.5359630312872208,Missouri,Texas A&M,5,5,0,0,NA,401091611,2019-02-07,Texas A&M
178,3,7:03,1323,1323,Cierra Porter missed Three Point Jumper.,40,39,1,0,0.5362276451857914,Missouri,Texas A&M,5,5,0,0,NA,401091611,2019-02-07,
179,3,7:03,1323,1323,Amber Smith Offensive Rebound.,40,39,1,4,0.5362276451857914,Missouri,Texas A&M,5,5,0,0,NA,401091611,2019-02-07,
180,3,6:59,1319,1319,Amber Smith missed Jumper.,40,39,1,0,0.5362907777334128,Missouri,Texas A&M,5,5,0,0,NA,401091611,2019-02-07,
181,3,6:59,1319,1319,Jordan Roundtree Offensive Rebound.,40,39,1,22,0.5362907777334128,Missouri,Texas A&M,5,5,0,0,NA,401091611,2019-02-07,
182,3,6:37,1297,1297,Lauren Aldridge missed Three Point Jumper.,40,39,1,0,0.5366459386529131,Missouri,Texas A&M,5,5,0,0,NA,401091611,2019-02-07,
183,3,6:37,1297,1297,Texas A&M Defensive Rebound.,40,39,1,20,0.5366459386529131,Missouri,Texas A&M,5,5,0,0,NA,401091611,2019-02-07,
184,3,6:17,1277,1277,Kayla Wells made Three Point Jumper.,40,42,-2,33,0.4264352665918207,Missouri,Texas A&M,5,5,0,0,NA,401091611,2019-02-07,Texas A&M
185,3,5:44,1244,1244,Amber Smith missed Jumper.,40,42,-2,0,0.4252577637639834,Missouri,Texas A&M,5,5,0,0,NA,401091611,2019-02-07,
186,3,5:44,1244,1244,Caylinne Martin Defensive Rebound.,40,42,-2,7,0.4252577637639834,Missouri,Texas A&M,5,5,0,0,NA,401091611,2019-02-07,
187,3,5:37,1237,1237,Chennedy Carter missed Jumper.,40,42,-2,0,0.4249923234119219,Missouri,Texas A&M,5,5,0,0,NA,401091611,2019-02-07,
188,3,5:37,1237,1237,N'dea Jones Offensive Rebound.,40,42,-2,5,0.4249923234119219,Missouri,Texas A&M,5,5,0,0,NA,401091611,2019-02-07,
189,3,5:32,1232,1232,Foul on Cierra Porter.,40,42,-2,3,0.42479893683050085,Missouri,Texas A&M,5,5,0,0,NA,401091611,2019-02-07,
190,3,5:29,1229,1229,Foul on Emmanuelle Tahane.,40,42,-2,0,0.4246813332238164,Missouri,Texas A&M,5,5,0,0,NA,401091611,2019-02-07,
191,3,5:29,1229,1229,Kayla Wells made Free Throw.,40,43,-3,0,0.38808297810989856,Missouri,Texas A&M,5,5,0,0,NA,401091611,2019-02-07,Texas A&M
192,3,5:29,1229,1229,Kayla Wells made Free Throw.,40,44,-4,11,0.3527050260016461,Missouri,Texas A&M,5,5,0,0,NA,401091611,2019-02-07,Texas A&M
193,3,5:18,1218,1218,Foul on Hannah Schuchts.,40,44,-4,0,0.3518797712997255,Missouri,Texas A&M,5,5,0,0,NA,401091611,2019-02-07,
194,3,5:18,1218,1218,Hannah Schuchts Turnover.,40,44,-4,17,0.3518797712997255,Missouri,Texas A&M,5,5,0,0,NA,401091611,2019-02-07,
