play_id,period,time_remaining_period,secs_remaining,secs_remaining_absolute,description,home_score,away_score,score_diff,play_length,win_prob,home,away,home_time_out_remaining,away_time_out_remaining,home_timeout_ind,away_timeout_ind,home_favored_by,game_id,date,whichScored
1,1,9:43,2383,2383,Katie Lou Samuelson missed Three Point Jumper.,0,0,0,4,0.5,Saint Louis,UConn,4,4,0,0,NA,401090508,2018-12-04,NA
2,1,9:39,2379,2379,Kendra Wilken Defensive Rebound.,0,0,0,14,0.5,Saint Louis,UConn,4,4,0,0,NA,401090508,2018-12-04,
3,1,9:25,2365,2365,Jordyn Frantz missed Three Point Jumper.,0,0,0,3,0.5,Saint Louis,UConn,4,4,0,0,NA,401090508,2018-12-04,
4,1,9:22,2362,2362,Christyn Williams Defensive Rebound.,0,0,0,5,0.5,Saint Louis,UConn,4,4,0,0,NA,401090508,2018-12-04,
5,1,9:17,2357,2357,Napheesa Collier made Layup. Assisted by Katie Lou Samuelson.,0,2,-2,0,0.4550603542849654,Saint Louis,UConn,4,4,0,0,NA,401090508,2018-12-04,UConn
6,1,9:17,2357,2357,Foul on Kendra Wilken.,0,2,-2,2,0.4550603542849654,Saint Louis,UConn,4,4,0,0,NA,401090508,2018-12-04,
7,1,9:15,2355,2355,Napheesa Collier missed Free Throw.,0,2,-2,1,0.45501724388899867,Saint Louis,UConn,4,4,0,0,NA,401090508,2018-12-04,
8,1,9:14,2354,2354,Myia Clark Defensive Rebound.,0,2,-2,23,0.45499566896610333,Saint Louis,UConn,4,4,0,0,NA,401090508,2018-12-04,
9,1,8:51,2331,2331,Ciaja Harbison made Jumper.,2,2,0,12,0.5,Saint Louis,UConn,4,4,0,0,NA,401090508,2018-12-04,Saint Louis
10,1,8:39,2319,2319,Katie Lou Samuelson made Jumper. Assisted by Kyla Irwin.,2,4,-2,25,0.45423268255208255,Saint Louis,UConn,4,4,0,0,NA,401090508,2018-12-04,UConn
11,1,8:14,2294,2294,Myia Clark missed Three Point Jumper.,2,4,-2,5,0.4536791332234905,Saint Louis,UConn,4,4,0,0,NA,401090508,2018-12-04,
12,1,8:09,2289,2289,Crystal Dangerfield Defensive Rebound.,2,4,-2,7,0.4535676529863345,Saint Louis,UConn,4,4,0,0,NA,401090508,2018-12-04,
13,1,8:02,2282,2282,Crystal Dangerfield missed Three Point Jumper.,2,4,-2,2,0.45341117649875384,Saint Louis,UConn,4,4,0,0,NA,401090508,2018-12-04,
14,1,8:00,2280,2280,Napheesa Collier Offensive Rebound.,2,4,-2,0,0.4533663845351968,Saint Louis,UConn,4,4,0,0,NA,401090508,2018-12-04,
15,1,8:00,2280,2280,Napheesa Collier Turnover.,2,4,-2,0,0.4533663845351968,Saint Louis,UConn,4,4,0,0,NA,401090508,2018-12-04,
16,1,8:00,2280,2280,Ciaja Harbison Steal.,2,4,-2,0,0.4533663845351968,Saint Louis,UConn,4,4,0,0,NA,401090508,2018-12-04,
17,1,8:00,2280,2280,Foul on Napheesa Collier.,2,4,-2,18,0.4533663845351968,Saint Louis,UConn,4,4,0,0,NA,401090508,2018-12-04,
18,1,7:42,2262,2262,Ciaja Harbison missed Jumper.,2,4,-2,3,0.452961654138631,Saint Louis,UConn,4,4,0,0,NA,401090508,2018-12-04,
19,1,7:39,2259,2259,Kendra Wilken Offensive Rebound.,2,4,-2,1,0.45289393129255906,Saint Louis,UConn,4,4,0,0,NA,401090508,2018-12-04,
20,1,7:38,2258,2258,Kendra Wilken missed Layup.,2,4,-2,3,0.4528713407795984,Saint Louis,UConn,4,4,0,0,NA,401090508,2018-12-04,
21,1,7:35,2255,2255,Kyla Irwin Defensive Rebound.,2,4,-2,6,0.4528035212836969,Saint Louis,UConn,4,4,0,0,NA,401090508,2018-12-04,
22,1,7:29,2249,2249,Napheesa Collier missed Jumper.,2,4,-2,4,0.4526676712149446,Saint Louis,UConn,4,4,0,0,NA,401090508,2018-12-04,
23,1,7:25,2245,2245,Kyla Irwin Offensive Rebound.,2,4,-2,9,0.4525769527031459,Saint Louis,UConn,4,4,0,0,NA,401090508,2018-12-04,
24,1,7:16,2236,2236,Katie Lou Samuelson made Three Point Jumper. Assisted by Crystal Dangerfield.,2,7,-5,1,0.38278964656005837,Saint Louis,UConn,4,4,0,0,NA,401090508,2018-12-04,UConn
25,1,7:15,2235,2235,Foul on Myia Clark.,2,7,-5,0,0.3827353777967364,Saint Louis,UConn,4,4,0,0,NA,401090508,2018-12-04,
26,1,7:15,2235,2235,Myia Clark Turnover.,2,7,-5,11,0.3827353777967364,Saint Louis,UConn,4,4,0,0,NA,401090508,2018-12-04,
27,1,7:04,2224,2224,Foul on Kendra Wilken.,2,7,-5,1,0.3821375382119141,Saint Louis,UConn,4,4,0,0,NA,401090508,2018-12-04,
28,1,7:03,2223,2223,Foul on Christyn Williams.,2,7,-5,0,0.38208311220521607,Saint Louis,UConn,4,4,0,0,NA,401090508,2018-12-04,
29,1,7:03,2223,2223,Christyn Williams Turnover.,2,7,-5,17,0.38208311220521607,Saint Louis,UConn,4,4,0,0,NA,401090508,2018-12-04,
30,1,6:46,2206,2206,Ciaja Harbison missed Three Point Jumper.,2,7,-5,3,0.3811560972886602,Saint Louis,UConn,4,4,0,0,NA,401090508,2018-12-04,
31,1,6:43,2203,2203,Christyn Williams Defensive Rebound.,2,7,-5,7,0.38099218567935184,Saint Louis,UConn,4,4,0,0,NA,401090508,2018-12-04,
32,1,6:36,2196,2196,Napheesa Collier missed Jumper.,2,7,-5,5,0.3806093913034527,Saint Louis,UConn,4,4,0,0,NA,401090508,2018-12-04,
33,1,6:31,2191,2191,Evan Zars Defensive Rebound.,2,7,-5,18,0.3803356996362228,Saint Louis,UConn,4,4,0,0,NA,401090508,2018-12-04,
34,1,6:13,2173,2173,Ciaja Harbison Turnover.,2,7,-5,0,0.37934883015282783,Saint Louis,UConn,4,4,0,0,NA,401090508,2018-12-04,
35,1,6:13,2173,2173,Napheesa Collier Steal.,2,7,-5,7,0.37934883015282783,Saint Louis,UConn,4,4,0,0,NA,401090508,2018-12-04,
36,1,6:06,2166,2166,Christyn Williams made Three Point Jumper. Assisted by Katie Lou Samuelson.,2,10,-8,18,0.31210131433973254,Saint Louis,UConn,4,4,0,0,NA,401090508,2018-12-04,UConn
37,1,5:48,2148,2148,Myia Clark missed Layup.,2,10,-8,3,0.31065481742821033,Saint Louis,UConn,4,4,0,0,NA,401090508,2018-12-04,
38,1,5:45,2145,2145,Kyla Irwin Defensive Rebound.,2,10,-8,7,0.310413221410914,Saint Louis,UConn,4,4,0,0,NA,401090508,2018-12-04,
39,1,5:38,2138,2138,Katie Lou Samuelson made Three Point Jumper. Assisted by Crystal Dangerfield.,2,13,-11,2,0.24952719357173606,Saint Louis,UConn,4,4,0,0,NA,401090508,2018-12-04,UConn
40,1,5:36,2136,2136,Saint Louis  Timeout,2,13,-11,0,0.24933288057470931,Saint Louis,UConn,3,4,1,0,NA,401090508,2018-12-04,
41,1,5:36,2136,2136,Official TV Timeout,2,13,-11,32,0.24933288057470931,Saint Louis,UConn,3,4,1,0,NA,401090508,2018-12-04,
42,1,5:04,2104,2104,Chloe Rice Turnover.,2,13,-11,0,0.24621763751668024,Saint Louis,UConn,3,4,1,0,NA,401090508,2018-12-04,
43,1,5:04,2104,2104,Napheesa Collier Steal.,2,13,-11,6,0.24621763751668024,Saint Louis,UConn,3,4,1,0,NA,401090508,2018-12-04,
44,1,4:58,2098,2098,Christyn Williams missed Three Point Jumper.,2,13,-11,3,0.24563205954084932,Saint Louis,UConn,3,4,1,0,NA,401090508,2018-12-04,
45,1,4:55,2095,2095,Katie Lou Samuelson Offensive Rebound.,2,13,-11,7,0.24533907698230473,Saint Louis,UConn,3,4,1,0,NA,401090508,2018-12-04,
46,1,4:48,2088,2088,Napheesa Collier made Layup. Assisted by Crystal Dangerfield.,2,15,-13,19,0.2087801187352197,Saint Louis,UConn,3,4,1,0,NA,401090508,2018-12-04,UConn
47,1,4:29,2069,2069,Myia Clark made Layup. Assisted by Jordyn Frantz.,4,15,-11,8,0.24279403614149,Saint Louis,UConn,3,4,0,0,NA,401090508,2018-12-04,Saint Louis
48,1,4:21,2061,2061,Napheesa Collier made Jumper. Assisted by Christyn Williams.,4,17,-13,15,0.20598811368238257,Saint Louis,UConn,3,4,0,0,NA,401090508,2018-12-04,UConn
49,1,4:06,2046,2046,Chloe Rice missed Three Point Jumper.,4,17,-13,3,0.20443421115176252,Saint Louis,UConn,3,4,0,0,NA,401090508,2018-12-04,
50,1,4:03,2043,2043,Napheesa Collier Defensive Rebound.,4,17,-13,3,0.2041231540022154,Saint Louis,UConn,3,4,0,0,NA,401090508,2018-12-04,
51,1,4:00,2040,2040,Katie Lou Samuelson missed Three Point Jumper.,4,17,-13,3,0.20381199895684354,Saint Louis,UConn,3,4,0,0,NA,401090508,2018-12-04,
52,1,3:57,2037,2037,Myia Clark Defensive Rebound.,4,17,-13,3,0.20350074361763462,Saint Louis,UConn,3,4,0,0,NA,401090508,2018-12-04,
53,1,3:54,2034,2034,Myia Clark missed Layup.,4,17,-13,0,0.20318938560508298,Saint Louis,UConn,3,4,0,0,NA,401090508,2018-12-04,
54,1,3:54,2034,2034,Napheesa Collier Block.,4,17,-13,0,0.20318938560508298,Saint Louis,UConn,3,4,0,0,NA,401090508,2018-12-04,
55,1,3:54,2034,2034,Saint Louis Offensive Rebound.,4,17,-13,4,0.20318938560508298,Saint Louis,UConn,3,4,0,0,NA,401090508,2018-12-04,
56,1,3:50,2030,2030,Evan Zars made Jumper. Assisted by Ciaja Harbison.,6,17,-11,16,0.2389539063948828,Saint Louis,UConn,3,4,0,0,NA,401090508,2018-12-04,Saint Louis
57,1,3:34,2014,2014,Olivia Nelson-Ododa made Layup. Assisted by Crystal Dangerfield.,6,19,-13,10,0.20111086929403418,Saint Louis,UConn,3,4,0,0,NA,401090508,2018-12-04,UConn
58,1,3:24,2004,2004,Ciaja Harbison Turnover.,6,19,-13,0,0.2000696482774201,Saint Louis,UConn,3,4,0,0,NA,401090508,2018-12-04,
59,1,3:24,2004,2004,Christyn Williams Steal.,6,19,-13,3,0.2000696482774201,Saint Louis,UConn,3,4,0,0,NA,401090508,2018-12-04,
60,1,3:21,2001,2001,Foul on Ciaja Harbison.,6,19,-13,0,0.1997570091490449,Saint Louis,UConn,3,4,0,0,NA,401090508,2018-12-04,
61,1,3:21,2001,2001,Napheesa Collier missed Free Throw.,6,19,-13,0,0.1997570091490449,Saint Louis,UConn,3,4,0,0,NA,401090508,2018-12-04,
62,1,3:21,2001,2001,Napheesa Collier missed Free Throw.,6,19,-13,0,0.1997570091490449,Saint Louis,UConn,3,4,0,0,NA,401090508,2018-12-04,
63,1,3:21,2001,2001,Evan Zars Defensive Rebound.,6,19,-13,1,0.1997570091490449,Saint Louis,UConn,3,4,0,0,NA,401090508,2018-12-04,
64,1,3:20,2000,2000,UConn Deadball Team Rebound.,6,19,-13,19,0.19965276737488113,Saint Louis,UConn,3,4,0,0,NA,401090508,2018-12-04,
65,1,3:01,1981,1981,Ciaja Harbison made Jumper.,8,19,-11,14,0.23408295895079487,Saint Louis,UConn,3,4,0,0,NA,401090508,2018-12-04,Saint Louis
66,1,2:47,1967,1967,Napheesa Collier missed Jumper.,8,19,-11,1,0.23268047609281198,Saint Louis,UConn,3,4,0,0,NA,401090508,2018-12-04,
67,1,2:46,1966,1966,Saint Louis Defensive Rebound.,8,19,-11,26,0.23258010179573016,Saint Louis,UConn,3,4,0,0,NA,401090508,2018-12-04,
68,1,2:20,1940,1940,Myia Clark missed Three Point Jumper.,8,19,-11,3,0.22996076641730015,Saint Louis,UConn,3,4,0,0,NA,401090508,2018-12-04,
69,1,2:17,1937,1937,Napheesa Collier Defensive Rebound.,8,19,-11,4,0.22965731108391527,Saint Louis,UConn,3,4,0,0,NA,401090508,2018-12-04,
70,1,2:13,1933,1933,Crystal Dangerfield missed Three Point Jumper.,8,19,-11,4,0.22925229810346998,Saint Louis,UConn,3,4,0,0,NA,401090508,2018-12-04,
71,1,2:09,1929,1929,Myia Clark Defensive Rebound.,8,19,-11,20,0.228846857484502,Saint Louis,UConn,3,4,0,0,NA,401090508,2018-12-04,
72,1,1:49,1909,1909,Evan Zars Turnover.,8,19,-11,0,0.22682933203109523,Saint Louis,UConn,3,4,0,0,NA,401090508,2018-12-04,
73,1,1:49,1909,1909,Christyn Williams Steal.,8,19,-11,4,0.22682933203109523,Saint Louis,UConn,3,4,0,0,NA,401090508,2018-12-04,
74,1,1:45,1905,1905,Christyn Williams made Layup. Assisted by Napheesa Collier.,8,21,-13,30,0.18969810182584546,Saint Louis,UConn,3,4,0,0,NA,401090508,2018-12-04,UConn
75,1,1:15,1875,1875,Evan Zars missed Jumper.,8,21,-13,4,0.1865968429768639,Saint Louis,UConn,3,4,0,0,NA,401090508,2018-12-04,
76,1,1:11,1871,1871,Olivia Nelson-Ododa Defensive Rebound.,8,21,-13,9,0.18618577671662484,Saint Louis,UConn,3,4,0,0,NA,401090508,2018-12-04,
77,1,1:02,1862,1862,Christyn Williams made Jumper.,8,23,-15,23,0.1532995848553322,Saint Louis,UConn,3,4,0,0,NA,401090508,2018-12-04,UConn
78,1,0:39,1839,1839,Jordyn Frantz missed Jumper.,8,23,-15,3,0.15096877543073842,Saint Louis,UConn,3,4,0,0,NA,401090508,2018-12-04,
79,1,0:36,1836,1836,Olivia Nelson-Ododa Defensive Rebound.,8,23,-15,4,0.1506657313116727,Saint Louis,UConn,3,4,0,0,NA,401090508,2018-12-04,
80,1,0:32,1832,1832,Katie Lou Samuelson missed Layup.,8,23,-15,2,0.15026194374533675,Saint Louis,UConn,3,4,0,0,NA,401090508,2018-12-04,
81,1,0:30,1830,1830,Katie Lou Samuelson Offensive Rebound.,8,23,-15,1,0.15006015630101763,Saint Louis,UConn,3,4,0,0,NA,401090508,2018-12-04,
82,1,0:29,1829,1829,Katie Lou Samuelson Turnover.,8,23,-15,0,0.1499592872469467,Saint Louis,UConn,3,4,0,0,NA,401090508,2018-12-04,
83,1,0:29,1829,1829,Ciaja Harbison Steal.,8,23,-15,4,0.1499592872469467,Saint Louis,UConn,3,4,0,0,NA,401090508,2018-12-04,
84,1,0:25,1825,1825,Ciaja Harbison made Layup.,10,23,-13,23,0.18148140868886295,Saint Louis,UConn,3,4,0,0,NA,401090508,2018-12-04,Saint Louis
85,1,0:02,1802,1802,Crystal Dangerfield made Layup.,10,25,-15,2,0.14724001078113194,Saint Louis,UConn,3,4,0,0,NA,401090508,2018-12-04,UConn
86,1,0:00,1800,1800,End of 1st Quarter,10,25,-15,17,0.14703875159162783,Saint Louis,UConn,3,4,0,0,NA,401090508,2018-12-04,
87,2,9:43,1783,1783,Brooke Flowers Turnover.,10,25,-15,13,0.14532772278287256,Saint Louis,UConn,4,4,0,0,NA,401090508,2018-12-04,
88,2,9:30,1770,1770,Crystal Dangerfield missed Three Point Jumper.,10,25,-15,4,0.1440178733295692,Saint Louis,UConn,4,4,0,0,NA,401090508,2018-12-04,
89,2,9:26,1766,1766,Katie Lou Samuelson Offensive Rebound.,10,25,-15,3,0.14361441108165082,Saint Louis,UConn,4,4,0,0,NA,401090508,2018-12-04,
90,2,9:23,1763,1763,Napheesa Collier made Jumper. Assisted by Katie Lou Samuelson.,10,27,-17,27,0.1164527051836398,Saint Louis,UConn,4,4,0,0,NA,401090508,2018-12-04,UConn
91,2,8:56,1736,1736,Ciaja Harbison missed Layup.,10,27,-17,0,0.11386110681747036,Saint Louis,UConn,4,4,0,0,NA,401090508,2018-12-04,
92,2,8:56,1736,1736,Olivia Nelson-Ododa Block.,10,27,-17,0,0.11386110681747036,Saint Louis,UConn,4,4,0,0,NA,401090508,2018-12-04,
93,2,8:56,1736,1736,Saint Louis Offensive Rebound.,10,27,-17,6,0.11386110681747036,Saint Louis,UConn,4,4,0,0,NA,401090508,2018-12-04,
94,2,8:50,1730,1730,Myia Clark made Three Point Jumper.,13,27,-14,20,0.1551828209447807,Saint Louis,UConn,4,4,0,0,NA,401090508,2018-12-04,Saint Louis
95,2,8:30,1710,1710,Napheesa Collier made Jumper. Assisted by Crystal Dangerfield.,13,29,-16,15,0.1240312838422353,Saint Louis,UConn,4,4,0,0,NA,401090508,2018-12-04,UConn
96,2,8:15,1695,1695,Kerri McMahan missed Layup.,13,29,-16,0,0.1225293210637351,Saint Louis,UConn,4,4,0,0,NA,401090508,2018-12-04,
97,2,8:15,1695,1695,Olivia Nelson-Ododa Block.,13,29,-16,4,0.1225293210637351,Saint Louis,UConn,4,4,0,0,NA,401090508,2018-12-04,
98,2,8:11,1691,1691,Napheesa Collier Defensive Rebound.,13,29,-16,7,0.12212743245355628,Saint Louis,UConn,4,4,0,0,NA,401090508,2018-12-04,
99,2,8:04,1684,1684,Napheesa Collier missed Three Point Jumper.,13,29,-16,0,0.12142750285230756,Saint Louis,UConn,4,4,0,0,NA,401090508,2018-12-04,
100,2,8:04,1684,1684,UConn Offensive Rebound.,13,29,-16,2,0.12142750285230756,Saint Louis,UConn,4,4,0,0,NA,401090508,2018-12-04,
101,2,8:02,1682,1682,Foul on Kerri McMahan.,13,29,-16,19,0.12122951653182935,Saint Louis,UConn,4,4,0,0,NA,401090508,2018-12-04,
102,2,7:43,1663,1663,Napheesa Collier Turnover.,13,29,-16,0,0.11938959124321281,Saint Louis,UConn,4,4,0,0,NA,401090508,2018-12-04,
103,2,7:43,1663,1663,Amber Lindfors Steal.,13,29,-16,18,0.11938959124321281,Saint Louis,UConn,4,4,0,0,NA,401090508,2018-12-04,
104,2,7:25,1645,1645,Kerri McMahan missed Layup.,13,29,-16,2,0.11770556390660547,Saint Louis,UConn,4,4,0,0,NA,401090508,2018-12-04,
105,2,7:23,1643,1643,Amber Lindfors missed Layup.,13,29,-16,0,0.11752145415027727,Saint Louis,UConn,4,4,0,0,NA,401090508,2018-12-04,
106,2,7:23,1643,1643,Crystal Dangerfield Defensive Rebound.,13,29,-16,1,0.11752145415027727,Saint Louis,UConn,4,4,0,0,NA,401090508,2018-12-04,
107,2,7:22,1642,1642,Amber Lindfors Offensive Rebound.,13,29,-16,6,0.11742960325100857,Saint Louis,UConn,4,4,0,0,NA,401090508,2018-12-04,
108,2,7:16,1636,1636,Foul on Ciaja Harbison.,13,29,-16,0,0.11688122768715356,Saint Louis,UConn,4,4,0,0,NA,401090508,2018-12-04,
109,2,7:16,1636,1636,Napheesa Collier missed Free Throw.,13,29,-16,0,0.11688122768715356,Saint Louis,UConn,4,4,0,0,NA,401090508,2018-12-04,
110,2,7:16,1636,1636,UConn Deadball Team Rebound.,13,29,-16,0,0.11688122768715356,Saint Louis,UConn,4,4,0,0,NA,401090508,2018-12-04,
111,2,7:16,1636,1636,Napheesa Collier made Free Throw.,13,30,-17,14,0.10445320818676325,Saint Louis,UConn,4,4,0,0,NA,401090508,2018-12-04,UConn
112,2,7:02,1622,1622,Kerri McMahan Turnover.,13,30,-17,0,0.10323737409830344,Saint Louis,UConn,4,4,0,0,NA,401090508,2018-12-04,
113,2,7:02,1622,1622,Crystal Dangerfield Steal.,13,30,-17,2,0.10323737409830344,Saint Louis,UConn,4,4,0,0,NA,401090508,2018-12-04,
114,2,7:00,1620,1620,Crystal Dangerfield made Layup.,13,32,-19,0,0.08179809702245242,Saint Louis,UConn,4,4,0,0,NA,401090508,2018-12-04,UConn
115,2,7:00,1620,1620,Foul on Jordyn Frantz.,13,32,-19,0,0.08179809702245242,Saint Louis,UConn,4,4,0,0,NA,401090508,2018-12-04,
116,2,7:00,1620,1620,Crystal Dangerfield made Free Throw.,13,33,-20,21,0.0727337600523781,Saint Louis,UConn,4,4,0,0,NA,401090508,2018-12-04,UConn
117,2,6:39,1599,1599,Jordyn Frantz Turnover.,13,33,-20,9,0.07120335414874404,Saint Louis,UConn,4,4,0,0,NA,401090508,2018-12-04,
118,2,6:30,1590,1590,Christyn Williams made Three Point Jumper. Assisted by Katie Lou Samuelson.,13,36,-23,25,0.04903716573804854,Saint Louis,UConn,4,4,0,0,NA,401090508,2018-12-04,UConn
119,2,6:05,1565,1565,Amber Lindfors missed Layup.,13,36,-23,3,0.04758569960675613,Saint Louis,UConn,4,4,0,0,NA,401090508,2018-12-04,
120,2,6:02,1562,1562,Crystal Dangerfield Defensive Rebound.,13,36,-23,3,0.0474128101167245,Saint Louis,UConn,4,4,0,0,NA,401090508,2018-12-04,
121,2,5:59,1559,1559,Christyn Williams missed Layup.,13,36,-23,2,0.04724009520925752,Saint Louis,UConn,4,4,0,0,NA,401090508,2018-12-04,
122,2,5:57,1557,1557,Saint Louis Defensive Rebound.,13,36,-23,23,0.04712503500278451,Saint Louis,UConn,4,4,0,0,NA,401090508,2018-12-04,
123,2,5:34,1534,1534,Kerri McMahan Turnover.,13,36,-23,0,0.045803923007120266,Saint Louis,UConn,4,4,0,0,NA,401090508,2018-12-04,
124,2,5:34,1534,1534,Mikayla Coombs Steal.,13,36,-23,24,0.045803923007120266,Saint Louis,UConn,4,4,0,0,NA,401090508,2018-12-04,
125,2,5:10,1510,1510,Katie Lou Samuelson missed Jumper.,13,36,-23,5,0.044420810914156464,Saint Louis,UConn,4,4,0,0,NA,401090508,2018-12-04,
126,2,5:05,1505,1505,Napheesa Collier Offensive Rebound.,13,36,-23,1,0.044130984690349054,Saint Louis,UConn,4,4,0,0,NA,401090508,2018-12-04,
127,2,5:04,1504,1504,Napheesa Collier made Layup.,13,38,-25,24,0.034079453687390716,Saint Louis,UConn,4,4,0,0,NA,401090508,2018-12-04,UConn
128,2,4:40,1480,1480,Chloe Rice missed Jumper.,13,38,-25,3,0.03288829742137133,Saint Louis,UConn,4,4,0,0,NA,401090508,2018-12-04,
129,2,4:37,1477,1477,Olivia Nelson-Ododa Defensive Rebound.,13,38,-25,7,0.0327381545418791,Saint Louis,UConn,4,4,0,0,NA,401090508,2018-12-04,
130,2,4:30,1470,1470,Olivia Nelson-Ododa missed Layup.,13,38,-25,2,0.03238653809194738,Saint Louis,UConn,4,4,0,0,NA,401090508,2018-12-04,
131,2,4:28,1468,1468,Myia Clark Defensive Rebound.,13,38,-25,8,0.032285729400575607,Saint Louis,UConn,4,4,0,0,NA,401090508,2018-12-04,
132,2,4:20,1460,1460,Myia Clark made Layup.,15,38,-23,5,0.041475922178517484,Saint Louis,UConn,4,4,0,0,NA,401090508,2018-12-04,Saint Louis
133,2,4:15,1455,1455,Foul on Myia Clark.,15,38,-23,0,0.04117427637636913,Saint Louis,UConn,4,4,0,0,NA,401090508,2018-12-04,
134,2,4:15,1455,1455,Official TV Timeout,15,38,-23,0,0.04117427637636913,Saint Louis,UConn,4,4,0,0,NA,401090508,2018-12-04,
135,2,4:15,1455,1455,Mikayla Coombs made Free Throw.,15,39,-24,0,0.03609770461173541,Saint Louis,UConn,4,4,0,0,NA,401090508,2018-12-04,UConn
136,2,4:15,1455,1455,Mikayla Coombs made Free Throw.,15,40,-25,19,0.03162640196085945,Saint Louis,UConn,4,4,0,0,NA,401090508,2018-12-04,UConn
137,2,3:56,1436,1436,Foul on Mikayla Coombs.,15,40,-25,19,0.030672235340373034,Saint Louis,UConn,4,4,0,0,NA,401090508,2018-12-04,
138,2,3:37,1417,1417,Chloe Rice missed Three Point Jumper.,15,40,-25,4,0.02977694502307528,Saint Louis,UConn,4,4,0,0,NA,401090508,2018-12-04,
139,2,3:33,1413,1413,Mikayla Coombs Defensive Rebound.,15,40,-25,11,0.02959510673065033,Saint Louis,UConn,4,4,0,0,NA,401090508,2018-12-04,
140,2,3:22,1402,1402,Crystal Dangerfield made Three Point Jumper. Assisted by Katie Lou Samuelson.,15,43,-28,20,0.019299750429474783,Saint Louis,UConn,4,4,0,0,NA,401090508,2018-12-04,UConn
141,2,3:02,1382,1382,Jordyn Frantz missed Three Point Jumper.,15,43,-28,3,0.018657183328629798,Saint Louis,UConn,4,4,0,0,NA,401090508,2018-12-04,
142,2,2:59,1379,1379,UConn Defensive Rebound.,15,43,-28,11,0.018563243642719593,Saint Louis,UConn,4,4,0,0,NA,401090508,2018-12-04,
143,2,2:48,1368,1368,Katie Lou Samuelson missed Three Point Jumper.,15,43,-28,3,0.018223245656083985,Saint Louis,UConn,4,4,0,0,NA,401090508,2018-12-04,
144,2,2:45,1365,1365,Brooke Flowers Defensive Rebound.,15,43,-28,5,0.018131601744218896,Saint Louis,UConn,4,4,0,0,NA,401090508,2018-12-04,
145,2,2:40,1360,1360,Ciaja Harbison missed Layup.,15,43,-28,0,0.01797975924905074,Saint Louis,UConn,4,4,0,0,NA,401090508,2018-12-04,
146,2,2:40,1360,1360,Mikayla Coombs Block.,15,43,-28,0,0.01797975924905074,Saint Louis,UConn,4,4,0,0,NA,401090508,2018-12-04,
147,2,2:40,1360,1360,Kyla Irwin Defensive Rebound.,15,43,-28,5,0.01797975924905074,Saint Louis,UConn,4,4,0,0,NA,401090508,2018-12-04,
148,2,2:35,1355,1355,Kyla Irwin Turnover.,15,43,-28,0,0.017828928184249564,Saint Louis,UConn,4,4,0,0,NA,401090508,2018-12-04,
149,2,2:35,1355,1355,Brooke Flowers Steal.,15,43,-28,5,0.017828928184249564,Saint Louis,UConn,4,4,0,0,NA,401090508,2018-12-04,
150,2,2:30,1350,1350,Jordyn Frantz missed Three Point Jumper.,15,43,-28,0,0.017678984920769646,Saint Louis,UConn,4,4,0,0,NA,401090508,2018-12-04,
151,2,2:30,1350,1350,Kyla Irwin Defensive Rebound.,15,43,-28,9,0.017678984920769646,Saint Louis,UConn,4,4,0,0,NA,401090508,2018-12-04,
152,2,2:21,1341,1341,Katie Lou Samuelson made Three Point Jumper. Assisted by Crystal Dangerfield.,15,46,-31,33,0.011371493763611117,Saint Louis,UConn,4,4,0,0,NA,401090508,2018-12-04,UConn
153,2,1:48,1308,1308,Brooke Flowers missed Jumper.,15,46,-31,2,0.010666818722463655,Saint Louis,UConn,4,4,0,0,NA,401090508,2018-12-04,
154,2,1:46,1306,1306,Napheesa Collier Defensive Rebound.,15,46,-31,5,0.010624371543958117,Saint Louis,UConn,4,4,0,0,NA,401090508,2018-12-04,
155,2,1:41,1301,1301,Mikayla Coombs missed Three Point Jumper.,15,46,-31,6,0.010518262975719157,Saint Louis,UConn,4,4,0,0,NA,401090508,2018-12-04,
156,2,1:35,1295,1295,Evan Zars Defensive Rebound.,15,46,-31,26,0.010390884163722977,Saint Louis,UConn,4,4,0,0,NA,401090508,2018-12-04,
157,2,1:09,1269,1269,Ciaja Harbison made Jumper.,17,46,-29,18,0.013199755515260845,Saint Louis,UConn,4,4,0,0,NA,401090508,2018-12-04,Saint Louis
158,2,0:51,1251,1251,Napheesa Collier missed Jumper.,17,46,-29,7,0.012712411541051339,Saint Louis,UConn,4,4,0,0,NA,401090508,2018-12-04,
159,2,0:44,1244,1244,Jordyn Frantz Defensive Rebound.,17,46,-29,8,0.012520611377261497,Saint Louis,UConn,4,4,0,0,NA,401090508,2018-12-04,
160,2,0:36,1236,1236,Chloe Rice made Three Point Jumper. Assisted by Evan Zars.,20,46,-26,33,0.019225528030670073,Saint Louis,UConn,4,4,0,0,NA,401090508,2018-12-04,Saint Louis
161,2,0:03,1203,1203,UConn  Turnover.,20,46,-26,3,0.017926706098035424,Saint Louis,UConn,4,4,0,0,NA,401090508,2018-12-04,
162,2,0:00,1200,1200,End of 2nd Quarter,20,46,-26,17,0.017810773728736146,Saint Louis,UConn,4,4,0,0,NA,401090508,2018-12-04,
163,3,9:43,1183,1183,Christyn Williams made Three Point Jumper. Assisted by Napheesa Collier.,20,49,-29,27,0.010839507076846005,Saint Louis,UConn,5,5,0,0,NA,401090508,2018-12-04,UConn
164,3,9:16,1156,1156,Kerri McMahan missed Jumper.,20,49,-29,3,0.010182779258507683,Saint Louis,UConn,5,5,0,0,NA,401090508,2018-12-04,
165,3,9:13,1153,1153,UConn Defensive Rebound.,20,49,-29,23,0.010113194771924714,Saint Louis,UConn,5,5,0,0,NA,401090508,2018-12-04,
166,3,8:50,1130,1130,Christyn Williams missed Jumper.,20,49,-29,0,0.009596882114749754,Saint Louis,UConn,5,5,0,0,NA,401090508,2018-12-04,
167,3,8:50,1130,1130,UConn Offensive Rebound.,20,49,-29,8,0.009596882114749754,Saint Louis,UConn,5,5,0,0,NA,401090508,2018-12-04,
168,3,8:42,1122,1122,Crystal Dangerfield missed Three Point Jumper.,20,49,-29,4,0.009423161937467991,Saint Louis,UConn,5,5,0,0,NA,401090508,2018-12-04,
169,3,8:38,1118,1118,Christyn Williams Offensive Rebound.,20,49,-29,9,0.00933720648109298,Saint Louis,UConn,5,5,0,0,NA,401090508,2018-12-04,
170,3,8:29,1109,1109,Napheesa Collier missed Layup.,20,49,-29,2,0.009145704488191382,Saint Louis,UConn,5,5,0,0,NA,401090508,2018-12-04,
171,3,8:27,1107,1107,Napheesa Collier missed Layup.,20,49,-29,0,0.009103466123079126,Saint Louis,UConn,5,5,0,0,NA,401090508,2018-12-04,
172,3,8:27,1107,1107,Napheesa Collier Offensive Rebound.,20,49,-29,1,0.009103466123079126,Saint Louis,UConn,5,5,0,0,NA,401090508,2018-12-04,
173,3,8:26,1106,1106,Napheesa Collier Offensive Rebound.,20,49,-29,1,0.00908238612922904,Saint Louis,UConn,5,5,0,0,NA,401090508,2018-12-04,
174,3,8:25,1105,1105,Napheesa Collier made Layup.,20,51,-31,25,0.006571600211217006,Saint Louis,UConn,5,5,0,0,NA,401090508,2018-12-04,UConn
175,3,8:00,1080,1080,Ciaja Harbison Turnover.,20,51,-31,0,0.006168335691244043,Saint Louis,UConn,5,5,0,0,NA,401090508,2018-12-04,
176,3,8:00,1080,1080,Crystal Dangerfield Steal.,20,51,-31,3,0.006168335691244043,Saint Louis,UConn,5,5,0,0,NA,401090508,2018-12-04,
177,3,7:57,1077,1077,Crystal Dangerfield made Layup. Assisted by Katie Lou Samuelson.,20,53,-33,1,0.004414862239420067,Saint Louis,UConn,5,5,0,0,NA,401090508,2018-12-04,UConn
178,3,7:56,1076,1076,Saint Louis  Timeout,20,53,-33,0,0.00440261869318876,Saint Louis,UConn,4,5,1,0,NA,401090508,2018-12-04,
179,3,7:56,1076,1076,Official TV Timeout,20,53,-33,16,0.00440261869318876,Saint Louis,UConn,4,5,1,0,NA,401090508,2018-12-04,
180,3,7:40,1060,1060,Jordyn Frantz missed Jumper.,20,53,-33,3,0.004207787394733313,Saint Louis,UConn,4,5,1,0,NA,401090508,2018-12-04,
181,3,7:37,1057,1057,Napheesa Collier Defensive Rebound.,20,53,-33,7,0.00417143228878529,Saint Louis,UConn,4,5,1,0,NA,401090508,2018-12-04,
182,3,7:30,1050,1050,Crystal Dangerfield made Layup. Assisted by Kyla Irwin.,20,55,-35,25,0.002932406379478884,Saint Louis,UConn,4,5,1,0,NA,401090508,2018-12-04,UConn
183,3,7:05,1025,1025,Amber Lindfors made Jumper.,22,55,-33,17,0.003785185236431034,Saint Louis,UConn,4,5,1,0,NA,401090508,2018-12-04,Saint Louis
184,3,6:48,1008,1008,Foul on Jordyn Frantz.,22,55,-33,0,0.0035801390633098252,Saint Louis,UConn,4,5,0,0,NA,401090508,2018-12-04,
185,3,6:48,1008,1008,Katie Lou Samuelson missed Free Throw.,22,55,-33,0,0.0035801390633098252,Saint Louis,UConn,4,5,0,0,NA,401090508,2018-12-04,
186,3,6:48,1008,1008,UConn Deadball Team Rebound.,22,55,-33,0,0.0035801390633098252,Saint Louis,UConn,4,5,0,0,NA,401090508,2018-12-04,
