play_id,period,time_remaining_period,secs_remaining,secs_remaining_absolute,description,home_score,away_score,score_diff,play_length,win_prob,home,away,home_time_out_remaining,away_time_out_remaining,home_timeout_ind,away_timeout_ind,home_favored_by,game_id,date,whichScored
1,1,9:32,2372,2372,Lashann Higgs missed Layup.,0,0,0,1,0.5,Hawai'i,Texas,4,4,0,0,NA,401176864,2019-12-01,NA
2,1,9:31,2371,2371,Lashann Higgs Offensive Rebound.,0,0,0,15,0.5,Hawai'i,Texas,4,4,0,0,NA,401176864,2019-12-01,
3,1,9:16,2356,2356,Sug Sutton missed Three Point Jumper.,0,0,0,3,0.5,Hawai'i,Texas,4,4,0,0,NA,401176864,2019-12-01,
4,1,9:13,2353,2353,Jadynn Alexander Defensive Rebound.,0,0,0,14,0.5,Hawai'i,Texas,4,4,0,0,NA,401176864,2019-12-01,
5,1,8:59,2339,2339,Amy Atwell made Three Point Jumper. Assisted by Nae Nae Calhoun.,3,0,3,14,0.5677619613590958,Hawai'i,Texas,4,4,0,0,NA,401176864,2019-12-01,Hawai'i
6,1,8:45,2325,2325,Charli Collier made Three Point Jumper. Assisted by Celeste Taylor.,3,3,0,36,0.5,Hawai'i,Texas,4,4,0,0,NA,401176864,2019-12-01,Texas
7,1,8:09,2289,2289,Jadynn Alexander made Three Point Jumper. Assisted by Nae Nae Calhoun.,6,3,3,13,0.5693988998708198,Hawai'i,Texas,4,4,0,0,NA,401176864,2019-12-01,Hawai'i
8,1,7:56,2276,2276,Lashann Higgs missed Three Point Jumper.,6,3,3,3,0.5698306292559723,Hawai'i,Texas,4,4,0,0,NA,401176864,2019-12-01,
9,1,7:53,2273,2273,Jadynn Alexander Defensive Rebound.,6,3,3,9,0.5699305765631278,Hawai'i,Texas,4,4,0,0,NA,401176864,2019-12-01,
10,1,7:44,2264,2264,Amy Atwell made Three Point Jumper. Assisted by Nae Nae Calhoun.,9,3,6,3,0.6377445460764132,Hawai'i,Texas,4,4,0,0,NA,401176864,2019-12-01,Hawai'i
11,1,7:41,2261,2261,Texas  Timeout,9,3,6,8,0.6379338117958658,Hawai'i,Texas,3,4,1,0,NA,401176864,2019-12-01,
12,1,7:33,2253,2253,Foul on Lauren Rewers.,9,3,6,0,0.6384393307923631,Hawai'i,Texas,3,4,1,0,NA,401176864,2019-12-01,
13,1,7:33,2253,2253,Celeste Taylor missed Free Throw.,9,3,6,0,0.6384393307923631,Hawai'i,Texas,3,4,1,0,NA,401176864,2019-12-01,
14,1,7:33,2253,2253,Texas Deadball Team Rebound.,9,3,6,0,0.6384393307923631,Hawai'i,Texas,3,4,1,0,NA,401176864,2019-12-01,
15,1,7:33,2253,2253,Celeste Taylor made Free Throw.,9,4,5,25,0.6162900219067821,Hawai'i,Texas,3,4,1,0,NA,401176864,2019-12-01,Texas
16,1,7:08,2228,2228,Foul on Sug Sutton.,9,4,5,0,0.6176448830241921,Hawai'i,Texas,3,4,1,0,NA,401176864,2019-12-01,
17,1,7:08,2228,2228,Nae Nae Calhoun made Free Throw.,10,4,6,0,0.640025918553328,Hawai'i,Texas,3,4,1,0,NA,401176864,2019-12-01,Hawai'i
18,1,7:08,2228,2228,Nae Nae Calhoun made Free Throw.,11,4,7,12,0.6618142023496538,Hawai'i,Texas,3,4,1,0,NA,401176864,2019-12-01,Hawai'i
19,1,6:56,2216,2216,Lashann Higgs made Layup.,11,6,5,17,0.618298206224493,Hawai'i,Texas,3,4,1,0,NA,401176864,2019-12-01,Texas
20,1,6:39,2199,2199,Jadynn Alexander made Layup.,13,6,7,62,0.663911192852751,Hawai'i,Texas,3,4,0,0,NA,401176864,2019-12-01,Hawai'i
21,1,5:37,2137,2137,Julissa Tago missed Jumper.,13,8,5,3,0.6226360353346091,Hawai'i,Texas,3,4,0,0,NA,401176864,2019-12-01,Texas
22,1,5:34,2134,2134,Charli Collier Defensive Rebound.,13,8,5,6,0.6228023867402612,Hawai'i,Texas,3,4,0,0,NA,401176864,2019-12-01,
23,1,5:28,2128,2128,Lashann Higgs missed Three Point Jumper.,13,8,5,6,0.6231355584122863,Hawai'i,Texas,3,4,0,0,NA,401176864,2019-12-01,
24,1,5:22,2122,2122,Barbara Rangel Defensive Rebound.,13,8,5,0,0.6234693688430759,Hawai'i,Texas,3,4,0,0,NA,401176864,2019-12-01,
25,1,5:22,2122,2122,Barbara Rangel Turnover.,13,8,5,0,0.6234693688430759,Hawai'i,Texas,3,4,0,0,NA,401176864,2019-12-01,
26,1,5:22,2122,2122,Charli Collier Steal.,13,8,5,2,0.6234693688430759,Hawai'i,Texas,3,4,0,0,NA,401176864,2019-12-01,
27,1,5:20,2120,2120,Charli Collier made Layup.,13,10,3,0,0.5751427199016728,Hawai'i,Texas,3,4,0,0,NA,401176864,2019-12-01,Texas
28,1,5:20,2120,2120,Foul on Nae Nae Calhoun.,13,10,3,0,0.5751427199016728,Hawai'i,Texas,3,4,0,0,NA,401176864,2019-12-01,
29,1,5:20,2120,2120,Charli Collier made Free Throw.,13,11,2,15,0.5503066952226568,Hawai'i,Texas,3,4,0,0,NA,401176864,2019-12-01,Texas
30,1,5:05,2105,2105,Foul on Joanne Allen-Taylor.,13,11,2,9,0.5506602182867172,Hawai'i,Texas,3,4,0,0,NA,401176864,2019-12-01,
31,1,4:56,2096,2096,Amy Atwell missed Layup.,13,11,2,4,0.5508733395399744,Hawai'i,Texas,3,4,0,0,NA,401176864,2019-12-01,
32,1,4:52,2092,2092,Joyner Holmes Defensive Rebound.,13,11,2,4,0.5509683107627823,Hawai'i,Texas,3,4,0,0,NA,401176864,2019-12-01,
33,1,4:48,2088,2088,Jada Underwood made Layup. Assisted by Celeste Taylor.,13,13,0,25,0.5,Hawai'i,Texas,3,4,0,0,NA,401176864,2019-12-01,Texas
34,1,4:23,2063,2063,Jadynn Alexander missed Three Point Jumper.,13,13,0,3,0.5,Hawai'i,Texas,3,4,0,0,NA,401176864,2019-12-01,
35,1,4:20,2060,2060,Joyner Holmes Defensive Rebound.,13,13,0,10,0.5,Hawai'i,Texas,3,4,0,0,NA,401176864,2019-12-01,
36,1,4:10,2050,2050,Joyner Holmes made Layup.,13,15,-2,27,0.4480245846669113,Hawai'i,Texas,3,4,0,0,NA,401176864,2019-12-01,Texas
37,1,3:43,2023,2023,Savannah Reier missed Layup.,13,15,-2,2,0.4473668485651764,Hawai'i,Texas,3,4,0,0,NA,401176864,2019-12-01,
38,1,3:41,2021,2021,Savannah Reier Offensive Rebound.,13,15,-2,1,0.4473177833885138,Hawai'i,Texas,3,4,0,0,NA,401176864,2019-12-01,
39,1,3:40,2020,2020,Courtney Middap missed Three Point Jumper.,13,15,-2,3,0.44729323250677677,Hawai'i,Texas,3,4,0,0,NA,401176864,2019-12-01,
40,1,3:37,2017,2017,Joyner Holmes Defensive Rebound.,13,15,-2,22,0.4472195062872298,Hawai'i,Texas,3,4,0,0,NA,401176864,2019-12-01,
41,1,3:15,1995,1995,Celeste Taylor made Layup.,13,17,-4,32,0.39455018314976736,Hawai'i,Texas,3,4,0,0,NA,401176864,2019-12-01,Texas
42,1,2:43,1963,1963,Foul on Joanne Allen-Taylor.,13,17,-4,0,0.39299909557915164,Hawai'i,Texas,3,4,0,0,NA,401176864,2019-12-01,
43,1,2:43,1963,1963,Savannah Reier made Free Throw.,14,17,-3,0,0.4192039205336557,Hawai'i,Texas,3,4,0,0,NA,401176864,2019-12-01,Hawai'i
44,1,2:43,1963,1963,Savannah Reier made Free Throw.,15,17,-2,13,0.4458725698494025,Hawai'i,Texas,3,4,0,0,NA,401176864,2019-12-01,Hawai'i
45,1,2:30,1950,1950,Lashann Higgs made Jumper. Assisted by Joyner Holmes.,15,19,-4,17,0.392361560796539,Hawai'i,Texas,3,4,0,0,NA,401176864,2019-12-01,Texas
46,1,2:13,1933,1933,Jadynn Alexander missed Layup.,15,19,-4,0,0.39152108484434883,Hawai'i,Texas,3,4,0,0,NA,401176864,2019-12-01,
47,1,2:13,1933,1933,Charli Collier Block.,15,19,-4,4,0.39152108484434883,Hawai'i,Texas,3,4,0,0,NA,401176864,2019-12-01,
48,1,2:09,1929,1929,Charli Collier Defensive Rebound.,15,19,-4,7,0.3913222007566154,Hawai'i,Texas,3,4,0,0,NA,401176864,2019-12-01,
49,1,2:02,1922,1922,Joyner Holmes missed Layup.,15,19,-4,3,0.39097428559336717,Hawai'i,Texas,3,4,0,0,NA,401176864,2019-12-01,
50,1,1:59,1919,1919,Lauren Rewers Defensive Rebound.,15,19,-4,17,0.39082533300908245,Hawai'i,Texas,3,4,0,0,NA,401176864,2019-12-01,
51,1,1:42,1902,1902,Foul on Isabel Palmer.,15,19,-4,11,0.3899825587058245,Hawai'i,Texas,3,4,0,0,NA,401176864,2019-12-01,
52,1,1:31,1891,1891,Nae Nae Calhoun Turnover.,15,19,-4,0,0.3894379316418235,Hawai'i,Texas,3,4,0,0,NA,401176864,2019-12-01,
53,1,1:31,1891,1891,Isabel Palmer Steal.,15,19,-4,12,0.3894379316418235,Hawai'i,Texas,3,4,0,0,NA,401176864,2019-12-01,
54,1,1:19,1879,1879,Charli Collier made Layup. Assisted by Joyner Holmes.,15,21,-6,26,0.33664935864831524,Hawai'i,Texas,3,4,0,0,NA,401176864,2019-12-01,Texas
55,1,0:53,1853,1853,Courtney Middap missed Three Point Jumper.,15,21,-6,3,0.33483345475703247,Hawai'i,Texas,3,4,0,0,NA,401176864,2019-12-01,
56,1,0:50,1850,1850,Hawai'i Deadball Team Rebound.,15,21,-6,0,0.3346235937189171,Hawai'i,Texas,3,4,0,0,NA,401176864,2019-12-01,
57,1,0:50,1850,1850,Foul on Joyner Holmes.,15,21,-6,0,0.3346235937189171,Hawai'i,Texas,3,4,0,0,NA,401176864,2019-12-01,
58,1,0:50,1850,1850,Kasey Neubert missed Free Throw.,15,21,-6,0,0.3346235937189171,Hawai'i,Texas,3,4,0,0,NA,401176864,2019-12-01,
59,1,0:50,1850,1850,Hawai'i Deadball Team Rebound.,15,21,-6,0,0.3346235937189171,Hawai'i,Texas,3,4,0,0,NA,401176864,2019-12-01,
60,1,0:50,1850,1850,Kasey Neubert made Free Throw.,16,21,-5,20,0.36059356436226525,Hawai'i,Texas,3,4,0,0,NA,401176864,2019-12-01,Hawai'i
61,1,0:30,1830,1830,Isabel Palmer made Three Point Jumper. Assisted by Celeste Taylor.,16,24,-8,27,0.2839668476739112,Hawai'i,Texas,3,4,0,0,NA,401176864,2019-12-01,Texas
62,1,0:03,1803,1803,Lauren Rewers missed Three Point Jumper.,16,24,-8,3,0.28164289026047057,Hawai'i,Texas,3,4,0,0,NA,401176864,2019-12-01,
63,1,0:00,1800,1800,Lashann Higgs Defensive Rebound.,16,24,-8,0,0.2813834505990485,Hawai'i,Texas,3,4,0,0,NA,401176864,2019-12-01,
64,1,0:00,1800,1800,End of 1st Quarter,16,24,-8,17,0.2813834505990485,Hawai'i,Texas,3,4,0,0,NA,401176864,2019-12-01,
65,2,9:43,1783,1783,Jadynn Alexander Turnover.,16,24,-8,11,0.2799074101071991,Hawai'i,Texas,4,4,0,0,NA,401176864,2019-12-01,
66,2,9:32,1772,1772,Lashann Higgs Turnover.,16,24,-8,15,0.2789462495558709,Hawai'i,Texas,4,4,0,0,NA,401176864,2019-12-01,
67,2,9:17,1757,1757,Lauren Rewers missed Jumper.,16,24,-8,2,0.27762658472042606,Hawai'i,Texas,4,4,0,0,NA,401176864,2019-12-01,
68,2,9:15,1755,1755,Charli Collier Defensive Rebound.,16,24,-8,7,0.2774497725957903,Hawai'i,Texas,4,4,0,0,NA,401176864,2019-12-01,
69,2,9:08,1748,1748,Charli Collier missed Jumper.,16,24,-8,3,0.2768292276200053,Hawai'i,Texas,4,4,0,0,NA,401176864,2019-12-01,
70,2,9:05,1745,1745,Nae Nae Calhoun Defensive Rebound.,16,24,-8,7,0.27656244185661866,Hawai'i,Texas,4,4,0,0,NA,401176864,2019-12-01,
71,2,8:58,1738,1738,Foul on Lauren Rewers.,16,24,-8,0,0.27593789716530276,Hawai'i,Texas,4,4,0,0,NA,401176864,2019-12-01,
72,2,8:58,1738,1738,Lauren Rewers Turnover.,16,24,-8,15,0.27593789716530276,Hawai'i,Texas,4,4,0,0,NA,401176864,2019-12-01,
73,2,8:43,1723,1723,Joyner Holmes missed Jumper.,16,24,-8,4,0.2745893333059131,Hawai'i,Texas,4,4,0,0,NA,401176864,2019-12-01,
74,2,8:39,1719,1719,Barbara Rangel Defensive Rebound.,16,24,-8,13,0.2742272085675567,Hawai'i,Texas,4,4,0,0,NA,401176864,2019-12-01,
75,2,8:26,1706,1706,Amy Atwell missed Three Point Jumper.,16,24,-8,3,0.27304249306227246,Hawai'i,Texas,4,4,0,0,NA,401176864,2019-12-01,
76,2,8:23,1703,1703,Lashann Higgs Defensive Rebound.,16,24,-8,4,0.2727673312236351,Hawai'i,Texas,4,4,0,0,NA,401176864,2019-12-01,
77,2,8:19,1699,1699,Foul on Amy Atwell.,16,24,-8,0,0.2723993782827556,Hawai'i,Texas,4,4,0,0,NA,401176864,2019-12-01,
78,2,8:19,1699,1699,Celeste Taylor made Free Throw.,16,25,-9,0,0.24874938788579443,Hawai'i,Texas,4,4,0,0,NA,401176864,2019-12-01,Texas
79,2,8:19,1699,1699,Celeste Taylor made Free Throw.,16,26,-10,3,0.22651348412806727,Hawai'i,Texas,4,4,0,0,NA,401176864,2019-12-01,Texas
80,2,8:16,1696,1696,Foul on Celeste Taylor.,16,26,-10,16,0.22620769143186747,Hawai'i,Texas,4,4,0,0,NA,401176864,2019-12-01,
81,2,8:00,1680,1680,Amy Atwell made Three Point Jumper. Assisted by Jadynn Alexander.,19,26,-7,19,0.2957900204976792,Hawai'i,Texas,4,4,0,0,NA,401176864,2019-12-01,Hawai'i
82,2,7:41,1661,1661,Lashann Higgs Turnover.,19,26,-7,16,0.2942123364574657,Hawai'i,Texas,4,4,0,0,NA,401176864,2019-12-01,
83,2,7:25,1645,1645,Jadynn Alexander made Three Point Jumper. Assisted by Nae Nae Calhoun.,22,26,-4,11,0.37669857792189887,Hawai'i,Texas,4,4,0,0,NA,401176864,2019-12-01,Hawai'i
84,2,7:14,1634,1634,Charli Collier missed Jumper.,22,26,-4,3,0.3761279372621487,Hawai'i,Texas,4,4,0,0,NA,401176864,2019-12-01,
85,2,7:11,1631,1631,Amy Atwell Defensive Rebound.,22,26,-4,11,0.3759730968834536,Hawai'i,Texas,4,4,0,0,NA,401176864,2019-12-01,
86,2,7:00,1620,1620,Amy Atwell made Three Point Jumper. Assisted by Nae Nae Calhoun.,25,26,-1,20,0.4682249412379411,Hawai'i,Texas,4,4,0,0,NA,401176864,2019-12-01,Hawai'i
87,2,6:40,1600,1600,Joyner Holmes made Jumper. Assisted by Sug Sutton.,25,28,-3,20,0.4049001017541032,Hawai'i,Texas,4,4,0,0,NA,401176864,2019-12-01,Texas
88,2,6:20,1580,1580,Julissa Tago made Three Point Jumper. Assisted by Jadynn Alexander.,28,28,0,11,0.5,Hawai'i,Texas,4,4,0,0,NA,401176864,2019-12-01,Hawai'i
89,2,6:09,1569,1569,Sug Sutton Turnover.,28,28,0,0,0.5,Hawai'i,Texas,4,4,0,0,NA,401176864,2019-12-01,
90,2,6:09,1569,1569,Nae Nae Calhoun Steal.,28,28,0,13,0.5,Hawai'i,Texas,4,4,0,0,NA,401176864,2019-12-01,
91,2,5:56,1556,1556,Jadynn Alexander missed Layup.,28,28,0,0,0.5,Hawai'i,Texas,4,4,0,0,NA,401176864,2019-12-01,
92,2,5:56,1556,1556,Charli Collier Block.,28,28,0,3,0.5,Hawai'i,Texas,4,4,0,0,NA,401176864,2019-12-01,
93,2,5:53,1553,1553,Charli Collier Defensive Rebound.,28,28,0,10,0.5,Hawai'i,Texas,4,4,0,0,NA,401176864,2019-12-01,
94,2,5:43,1543,1543,Lashann Higgs Turnover.,28,28,0,17,0.5,Hawai'i,Texas,4,4,0,0,NA,401176864,2019-12-01,
95,2,5:26,1526,1526,Foul on Jadynn Alexander.,28,28,0,0,0.5,Hawai'i,Texas,4,4,0,0,NA,401176864,2019-12-01,
96,2,5:26,1526,1526,Jadynn Alexander Turnover.,28,28,0,13,0.5,Hawai'i,Texas,4,4,0,0,NA,401176864,2019-12-01,
97,2,5:13,1513,1513,Lashann Higgs Turnover.,28,28,0,22,0.5,Hawai'i,Texas,4,4,0,0,NA,401176864,2019-12-01,
98,2,4:51,1491,1491,Foul on Jada Underwood.,28,28,0,0,0.5,Hawai'i,Texas,4,4,0,0,NA,401176864,2019-12-01,
99,2,4:51,1491,1491,Official TV Timeout,28,28,0,1,0.5,Hawai'i,Texas,4,4,0,0,NA,401176864,2019-12-01,
100,2,4:50,1490,1490,Nae Nae Calhoun Turnover.,28,28,0,4,0.5,Hawai'i,Texas,4,4,0,0,NA,401176864,2019-12-01,
101,2,4:46,1486,1486,Jada Underwood missed Layup.,28,28,0,2,0.5,Hawai'i,Texas,4,4,0,0,NA,401176864,2019-12-01,
102,2,4:44,1484,1484,Celeste Taylor Offensive Rebound.,28,28,0,12,0.5,Hawai'i,Texas,4,4,0,0,NA,401176864,2019-12-01,
103,2,4:32,1472,1472,Charli Collier made Jumper. Assisted by Sug Sutton.,28,30,-2,19,0.4325362762813512,Hawai'i,Texas,4,4,0,0,NA,401176864,2019-12-01,Texas
104,2,4:13,1453,1453,Julissa Tago missed Jumper.,28,30,-2,2,0.4319260621196006,Hawai'i,Texas,4,4,0,0,NA,401176864,2019-12-01,
105,2,4:11,1451,1451,Texas Defensive Rebound.,28,30,-2,18,0.431860199473201,Hawai'i,Texas,4,4,0,0,NA,401176864,2019-12-01,
106,2,3:53,1433,1433,Charli Collier Turnover.,28,30,-2,18,0.4312750172656792,Hawai'i,Texas,4,4,0,0,NA,401176864,2019-12-01,
107,2,3:35,1415,1415,Amy Atwell Turnover.,28,30,-2,0,0.43070969789667135,Hawai'i,Texas,4,4,0,0,NA,401176864,2019-12-01,
108,2,3:35,1415,1415,Sug Sutton Steal.,28,30,-2,6,0.43070969789667135,Hawai'i,Texas,4,4,0,0,NA,401176864,2019-12-01,
109,2,3:29,1409,1409,Sug Sutton missed Layup.,28,30,-2,1,0.4305247142454546,Hawai'i,Texas,4,4,0,0,NA,401176864,2019-12-01,
110,2,3:28,1408,1408,Hawai'i Deadball Team Rebound.,28,30,-2,0,0.43049402343509324,Hawai'i,Texas,4,4,0,0,NA,401176864,2019-12-01,
111,2,3:28,1408,1408,Foul on Charli Collier.,28,30,-2,24,0.43049402343509324,Hawai'i,Texas,4,4,0,0,NA,401176864,2019-12-01,
112,2,3:04,1384,1384,Foul on Amy Atwell.,28,30,-2,0,0.42976643110730595,Hawai'i,Texas,4,4,0,0,NA,401176864,2019-12-01,
113,2,3:04,1384,1384,Amy Atwell Turnover.,28,30,-2,14,0.42976643110730595,Hawai'i,Texas,4,4,0,0,NA,401176864,2019-12-01,
114,2,2:50,1370,1370,Sug Sutton missed Layup.,28,30,-2,3,0.4293466319089923,Hawai'i,Texas,4,4,0,0,NA,401176864,2019-12-01,
115,2,2:47,1367,1367,Julissa Tago Defensive Rebound.,28,30,-2,12,0.4292567825024442,Hawai'i,Texas,4,4,0,0,NA,401176864,2019-12-01,
116,2,2:35,1355,1355,Foul on Celeste Taylor.,28,30,-2,0,0.4288969258468162,Hawai'i,Texas,4,4,0,0,NA,401176864,2019-12-01,
117,2,2:35,1355,1355,Julissa Tago missed Free Throw.,28,30,-2,0,0.4288969258468162,Hawai'i,Texas,4,4,0,0,NA,401176864,2019-12-01,
118,2,2:35,1355,1355,Hawai'i Deadball Team Rebound.,28,30,-2,0,0.4288969258468162,Hawai'i,Texas,4,4,0,0,NA,401176864,2019-12-01,
119,2,2:35,1355,1355,Julissa Tago made Free Throw.,29,30,-1,0,0.46426688623225143,Hawai'i,Texas,4,4,0,0,NA,401176864,2019-12-01,Hawai'i
120,2,2:35,1355,1355,Julissa Tago missed Free Throw.,29,30,-1,1,0.46426688623225143,Hawai'i,Texas,4,4,0,0,NA,401176864,2019-12-01,
121,2,2:34,1354,1354,Hawai'i Offensive Rebound.,29,30,-1,19,0.4642516270003991,Hawai'i,Texas,4,4,0,0,NA,401176864,2019-12-01,
122,2,2:15,1335,1335,Foul on Jada Underwood.,29,30,-1,0,0.46395968459517145,Hawai'i,Texas,4,4,0,0,NA,401176864,2019-12-01,
123,2,2:15,1335,1335,Julissa Tago made Free Throw.,30,30,0,0,0.5,Hawai'i,Texas,4,4,0,0,NA,401176864,2019-12-01,Hawai'i
124,2,2:15,1335,1335,Julissa Tago made Free Throw.,31,30,1,21,0.5360403154048287,Hawai'i,Texas,4,4,0,0,NA,401176864,2019-12-01,Hawai'i
125,2,1:54,1314,1314,Joyner Holmes missed Layup.,31,30,1,2,0.5363702550936889,Hawai'i,Texas,4,4,0,0,NA,401176864,2019-12-01,
126,2,1:52,1312,1312,Kasey Neubert Defensive Rebound.,31,30,1,26,0.536402233331425,Hawai'i,Texas,4,4,0,0,NA,401176864,2019-12-01,
127,2,1:26,1286,1286,Julissa Tago missed Jumper.,31,30,1,4,0.5368296471182202,Hawai'i,Texas,4,4,0,0,NA,401176864,2019-12-01,
128,2,1:22,1282,1282,Isabel Palmer Defensive Rebound.,31,30,1,6,0.5368976439240658,Hawai'i,Texas,4,4,0,0,NA,401176864,2019-12-01,
129,2,1:16,1276,1276,Charli Collier missed Layup.,31,30,1,3,0.537000935470091,Hawai'i,Texas,4,4,0,0,NA,401176864,2019-12-01,
130,2,1:13,1273,1273,Kasey Neubert Defensive Rebound.,31,30,1,17,0.5370531931747506,Hawai'i,Texas,4,4,0,0,NA,401176864,2019-12-01,
131,2,0:56,1256,1256,Julissa Tago missed Jumper.,31,30,1,3,0.53735774562224,Hawai'i,Texas,4,4,0,0,NA,401176864,2019-12-01,
132,2,0:53,1253,1253,Barbara Rangel Offensive Rebound.,31,30,1,17,0.5374130893377504,Hawai'i,Texas,4,4,0,0,NA,401176864,2019-12-01,
133,2,0:36,1236,1236,Julissa Tago missed Three Point Jumper.,31,30,1,3,0.537736789279994,Hawai'i,Texas,4,4,0,0,NA,401176864,2019-12-01,
134,2,0:33,1233,1233,Sug Sutton Defensive Rebound.,31,30,1,7,0.5377958048564924,Hawai'i,Texas,4,4,0,0,NA,401176864,2019-12-01,
135,2,0:26,1226,1226,Charli Collier missed Three Point Jumper.,31,30,1,5,0.5379358689688774,Hawai'i,Texas,4,4,0,0,NA,401176864,2019-12-01,
136,2,0:21,1221,1221,Sug Sutton Offensive Rebound.,31,30,1,16,0.5380380117341688,Hawai'i,Texas,4,4,0,0,NA,401176864,2019-12-01,
137,2,0:05,1205,1205,Foul on Nae Nae Calhoun.,31,30,1,0,0.5383757965642224,Hawai'i,Texas,4,4,0,0,NA,401176864,2019-12-01,
138,2,0:05,1205,1205,Sug Sutton missed Free Throw.,31,30,1,0,0.5383757965642224,Hawai'i,Texas,4,4,0,0,NA,401176864,2019-12-01,
139,2,0:05,1205,1205,Texas Deadball Team Rebound.,31,30,1,0,0.5383757965642224,Hawai'i,Texas,4,4,0,0,NA,401176864,2019-12-01,
140,2,0:05,1205,1205,Sug Sutton missed Free Throw.,31,30,1,1,0.5383757965642224,Hawai'i,Texas,4,4,0,0,NA,401176864,2019-12-01,
141,2,0:04,1204,1204,Joyner Holmes Offensive Rebound.,31,30,1,0,0.5383969761493493,Hawai'i,Texas,4,4,0,0,NA,401176864,2019-12-01,
142,2,0:04,1204,1204,Joyner Holmes missed Layup.,31,30,1,2,0.5383969761493493,Hawai'i,Texas,4,4,0,0,NA,401176864,2019-12-01,
143,2,0:02,1202,1202,Texas Offensive Rebound.,31,30,1,2,0.5384392022206768,Hawai'i,Texas,4,4,0,0,NA,401176864,2019-12-01,
144,2,0:00,1200,1200,Joyner Holmes missed Jumper.,31,30,1,0,0.5384812553577752,Hawai'i,Texas,4,4,0,0,NA,401176864,2019-12-01,
145,2,0:00,1200,1200,Texas Offensive Rebound.,31,30,1,0,0.5384812553577752,Hawai'i,Texas,4,4,0,0,NA,401176864,2019-12-01,
146,2,0:00,1200,1200,End of 2nd Quarter,31,30,1,9,0.5384812553577752,Hawai'i,Texas,4,4,0,0,NA,401176864,2019-12-01,
147,3,9:51,1191,1191,Nae Nae Calhoun missed Three Point Jumper.,31,30,1,5,0.5386685001849195,Hawai'i,Texas,5,5,0,0,NA,401176864,2019-12-01,
148,3,9:46,1186,1186,Celeste Taylor Defensive Rebound.,31,30,1,22,0.5387712418258391,Hawai'i,Texas,5,5,0,0,NA,401176864,2019-12-01,
149,3,9:24,1164,1164,Celeste Taylor made Layup.,31,32,-1,17,0.46078516320620144,Hawai'i,Texas,5,5,0,0,NA,401176864,2019-12-01,Texas
150,3,9:07,1147,1147,Foul on Joyner Holmes.,31,32,-1,0,0.4604485354055376,Hawai'i,Texas,5,5,0,0,NA,401176864,2019-12-01,
151,3,9:07,1147,1147,Lauren Rewers made Free Throw.,32,32,0,0,0.5,Hawai'i,Texas,5,5,0,0,NA,401176864,2019-12-01,Hawai'i
152,3,9:07,1147,1147,Lauren Rewers made Free Throw.,33,32,1,5,0.5395514645944625,Hawai'i,Texas,5,5,0,0,NA,401176864,2019-12-01,Hawai'i
153,3,9:02,1142,1142,Sug Sutton Turnover.,33,32,1,21,0.5396500000301686,Hawai'i,Texas,5,5,0,0,NA,401176864,2019-12-01,
154,3,8:41,1121,1121,Lauren Rewers missed Layup.,33,32,1,3,0.5400641577836345,Hawai'i,Texas,5,5,0,0,NA,401176864,2019-12-01,
155,3,8:38,1118,1118,Celeste Taylor Defensive Rebound.,33,32,1,5,0.5401236000051486,Hawai'i,Texas,5,5,0,0,NA,401176864,2019-12-01,
156,3,8:33,1113,1113,Sug Sutton Turnover.,33,32,1,0,0.5402229553008159,Hawai'i,Texas,5,5,0,0,NA,401176864,2019-12-01,
157,3,8:33,1113,1113,Lauren Rewers Steal.,33,32,1,6,0.5402229553008159,Hawai'i,Texas,5,5,0,0,NA,401176864,2019-12-01,
158,3,8:27,1107,1107,Jadynn Alexander made Three Point Jumper. Assisted by Nae Nae Calhoun.,36,32,4,20,0.6563093638041018,Hawai'i,Texas,5,5,0,0,NA,401176864,2019-12-01,Hawai'i
159,3,8:07,1087,1087,Sug Sutton missed Jumper.,36,32,4,3,0.6577816942487171,Hawai'i,Texas,5,5,0,0,NA,401176864,2019-12-01,
160,3,8:04,1084,1084,Nae Nae Calhoun Defensive Rebound.,36,32,4,19,0.6580061723160412,Hawai'i,Texas,5,5,0,0,NA,401176864,2019-12-01,
161,3,7:45,1065,1065,Amy Atwell missed Layup.,36,32,4,3,0.6594569156002289,Hawai'i,Texas,5,5,0,0,NA,401176864,2019-12-01,
162,3,7:42,1062,1062,Celeste Taylor Defensive Rebound.,36,32,4,4,0.6596912276379977,Hawai'i,Texas,5,5,0,0,NA,401176864,2019-12-01,
163,3,7:38,1058,1058,Lashann Higgs Turnover.,36,32,4,22,0.6600061602285403,Hawai'i,Texas,5,5,0,0,NA,401176864,2019-12-01,
164,3,7:16,1036,1036,Nae Nae Calhoun missed Layup.,36,32,4,2,0.6617962728515572,Hawai'i,Texas,5,5,0,0,NA,401176864,2019-12-01,
165,3,7:14,1034,1034,Joanne Allen-Taylor Defensive Rebound.,36,32,4,13,0.6619644063440001,Hawai'i,Texas,5,5,0,0,NA,401176864,2019-12-01,
166,3,7:01,1021,1021,Joanne Allen-Taylor missed Jumper.,36,32,4,3,0.6630820236440284,Hawai'i,Texas,5,5,0,0,NA,401176864,2019-12-01,
167,3,6:58,1018,1018,Julissa Tago Defensive Rebound.,36,32,4,4,0.6633463640001346,Hawai'i,Texas,5,5,0,0,NA,401176864,2019-12-01,
168,3,6:54,1014,1014,Julissa Tago Turnover.,36,32,4,0,0.663702785094265,Hawai'i,Texas,5,5,0,0,NA,401176864,2019-12-01,
169,3,6:54,1014,1014,Lashann Higgs Steal.,36,32,4,8,0.663702785094265,Hawai'i,Texas,5,5,0,0,NA,401176864,2019-12-01,
170,3,6:46,1006,1006,Joanne Allen-Taylor missed Jumper.,36,32,4,1,0.6644297850878392,Hawai'i,Texas,5,5,0,0,NA,401176864,2019-12-01,
171,3,6:45,1005,1005,Charli Collier Offensive Rebound.,36,32,4,0,0.6645220323899073,Hawai'i,Texas,5,5,0,0,NA,401176864,2019-12-01,
172,3,6:45,1005,1005,Foul on Lauren Rewers.,36,32,4,0,0.6645220323899073,Hawai'i,Texas,5,5,0,0,NA,401176864,2019-12-01,
173,3,6:45,1005,1005,Charli Collier made Free Throw.,36,33,3,0,0.6254236983539635,Hawai'i,Texas,5,5,0,0,NA,401176864,2019-12-01,Texas
174,3,6:45,1005,1005,Charli Collier made Free Throw.,36,34,2,14,0.5846169828140687,Hawai'i,Texas,5,5,0,0,NA,401176864,2019-12-01,Texas
175,3,6:31,991,991,Kasey Neubert missed Layup.,36,34,2,2,0.5853393492708255,Hawai'i,Texas,5,5,0,0,NA,401176864,2019-12-01,
176,3,6:29,989,989,Joanne Allen-Taylor Defensive Rebound.,36,34,2,10,0.5854455593029567,Hawai'i,Texas,5,5,0,0,NA,401176864,2019-12-01,
177,3,6:19,979,979,Charli Collier made Layup. Assisted by Jada Underwood.,36,36,0,30,0.5,Hawai'i,Texas,5,5,0,0,NA,401176864,2019-12-01,Texas
178,3,5:49,949,949,Courtney Middap made Layup.,38,36,2,15,0.5876278867008967,Hawai'i,Texas,5,5,0,0,NA,401176864,2019-12-01,Hawai'i
179,3,5:34,934,934,Joyner Holmes made Layup. Assisted by Joanne Allen-Taylor.,38,38,0,33,0.5,Hawai'i,Texas,5,5,0,0,NA,401176864,2019-12-01,Texas
180,3,5:01,901,901,Kasey Neubert missed Jumper.,38,38,0,0,0.5,Hawai'i,Texas,5,5,0,0,NA,401176864,2019-12-01,
181,3,5:01,901,901,Joyner Holmes Block.,38,38,0,4,0.5,Hawai'i,Texas,5,5,0,0,NA,401176864,2019-12-01,
182,3,4:57,897,897,Charli Collier Defensive Rebound.,38,38,0,3,0.5,Hawai'i,Texas,5,5,0,0,NA,401176864,2019-12-01,
183,3,4:54,894,894,Joyner Holmes made Layup. Assisted by Celeste Taylor.,38,40,-2,25,0.40985983956655214,Hawai'i,Texas,5,5,0,0,NA,401176864,2019-12-01,Texas
184,3,4:29,869,869,Courtney Middap missed Layup.,38,40,-2,2,0.408803834017661,Hawai'i,Texas,5,5,0,0,NA,401176864,2019-12-01,
185,3,4:27,867,867,Joyner Holmes Defensive Rebound.,38,40,-2,5,0.4087188024279029,Hawai'i,Texas,5,5,0,0,NA,401176864,2019-12-01,
186,3,4:22,862,862,Joanne Allen-Taylor missed Three Point Jumper.,38,40,-2,2,0.4085051419646765,Hawai'i,Texas,5,5,0,0,NA,401176864,2019-12-01,
187,3,4:20,860,860,Hawai'i Deadball Team Rebound.,38,40,-2,0,0.4084191637945269,Hawai'i,Texas,5,5,0,0,NA,401176864,2019-12-01,
188,3,4:20,860,860,Foul on Charli Collier.,38,40,-2,0,0.4084191637945269,Hawai'i,Texas,5,5,0,0,NA,401176864,2019-12-01,
189,3,4:20,860,860,Official TV Timeout,38,40,-2,18,0.4084191637945269,Hawai'i,Texas,5,5,0,0,NA,401176864,2019-12-01,
190,3,4:02,842,842,Julissa Tago missed Three Point Jumper.,38,40,-2,3,0.407626335376072,Hawai'i,Texas,5,5,0,0,NA,401176864,2019-12-01,
191,3,3:59,839,839,Jada Underwood Defensive Rebound.,38,40,-2,5,0.40748993377761367,Hawai'i,Texas,5,5,0,0,NA,401176864,2019-12-01,
192,3,3:54,834,834,Foul on Jada Underwood.,38,40,-2,0,0.4072592209936792,Hawai'i,Texas,5,5,0,0,NA,401176864,2019-12-01,
193,3,3:54,834,834,Jada Underwood Turnover.,38,40,-2,23,0.4072592209936792,Hawai'i,Texas,5,5,0,0,NA,401176864,2019-12-01,
194,3,3:31,811,811,Kasey Neubert made Layup. Assisted by Savannah Reier.,40,40,0,20,0.5,Hawai'i,Texas,5,5,0,0,NA,401176864,2019-12-01,Hawai'i
195,3,3:11,791,791,Foul on Nae Nae Calhoun.,40,40,0,13,0.5,Hawai'i,Texas,5,5,0,0,NA,401176864,2019-12-01,
196,3,2:58,778,778,Sug Sutton missed Layup.,40,40,0,3,0.5,Hawai'i,Texas,5,5,0,0,NA,401176864,2019-12-01,
197,3,2:55,775,775,Sug Sutton Offensive Rebound.,40,40,0,21,0.5,Hawai'i,Texas,5,5,0,0,NA,401176864,2019-12-01,
198,3,2:34,754,754,Savannah Reier Turnover.,40,42,-2,0,0.4026103025982569,Hawai'i,Texas,5,5,0,0,NA,401176864,2019-12-01,Texas
199,3,2:34,754,754,Lashann Higgs Steal.,40,42,-2,9,0.4026103025982569,Hawai'i,Texas,5,5,0,0,NA,401176864,2019-12-01,
200,3,2:25,745,745,Texas  Timeout,40,42,-2,8,0.4019265485404912,Hawai'i,Texas,4,5,1,0,NA,401176864,2019-12-01,
201,3,2:17,737,737,Foul on Celeste Taylor.,40,42,-2,0,0.4012831383979186,Hawai'i,Texas,4,5,1,0,NA,401176864,2019-12-01,
