play_id,period,time_remaining_period,secs_remaining,secs_remaining_absolute,description,home_score,away_score,score_diff,play_length,win_prob,home,away,home_time_out_remaining,away_time_out_remaining,home_timeout_ind,away_timeout_ind,home_favored_by,game_id,date,whichScored
1,1,9:50,2390,2390,Ivonne Cook-Taylor missed Jumper.,0,0,0,0,0.5,Texas Tech,New Mexico,4,4,0,0,NA,400911071,2016-11-20,NA
2,1,9:50,2390,2390,Richelle van der Keijl Defensive Rebound.,0,0,0,10,0.5,Texas Tech,New Mexico,4,4,0,0,NA,400911071,2016-11-20,
3,1,9:40,2380,2380,Cherise Beynon missed Layup.,0,0,0,0,0.5,Texas Tech,New Mexico,4,4,0,0,NA,400911071,2016-11-20,
4,1,9:40,2380,2380,Arella Guirantes Defensive Rebound.,0,0,0,7,0.5,Texas Tech,New Mexico,4,4,0,0,NA,400911071,2016-11-20,
5,1,9:33,2373,2373,Arella Guirantes Turnover.,0,0,0,17,0.5,Texas Tech,New Mexico,4,4,0,0,NA,400911071,2016-11-20,
6,1,9:16,2356,2356,Cherise Beynon missed Three Point Jumper.,0,0,0,0,0.5,Texas Tech,New Mexico,4,4,0,0,NA,400911071,2016-11-20,
7,1,9:16,2356,2356,Ivonne Cook-Taylor Defensive Rebound.,0,0,0,10,0.5,Texas Tech,New Mexico,4,4,0,0,NA,400911071,2016-11-20,
8,1,9:06,2346,2346,Recee' Caldwell Turnover.,0,0,0,1,0.5,Texas Tech,New Mexico,4,4,0,0,NA,400911071,2016-11-20,
9,1,9:05,2345,2345,Richelle van der Keijl Steal.,0,0,0,5,0.5,Texas Tech,New Mexico,4,4,0,0,NA,400911071,2016-11-20,
10,1,9:00,2340,2340,Mykiel Burleson made Layup. Assisted by Richelle van der Keijl.,0,2,-2,27,0.4546922706473648,Texas Tech,New Mexico,4,4,0,0,NA,400911071,2016-11-20,New Mexico
11,1,8:33,2313,2313,Arella Guirantes missed Three Point Jumper.,0,2,-2,0,0.4541004401909216,Texas Tech,New Mexico,4,4,0,0,NA,400911071,2016-11-20,
12,1,8:33,2313,2313,Mykiel Burleson Defensive Rebound.,0,2,-2,11,0.4541004401909216,Texas Tech,New Mexico,4,4,0,0,NA,400911071,2016-11-20,
13,1,8:22,2302,2302,Jayda Bovero missed Three Point Jumper.,0,2,-2,0,0.4538569829834506,Texas Tech,New Mexico,4,4,0,0,NA,400911071,2016-11-20,
14,1,8:22,2302,2302,Texas Tech Defensive Rebound.,0,2,-2,24,0.4538569829834506,Texas Tech,New Mexico,4,4,0,0,NA,400911071,2016-11-20,
15,1,7:58,2278,2278,Recee' Caldwell missed Layup.,0,2,-2,0,0.45332155583379324,Texas Tech,New Mexico,4,4,0,0,NA,400911071,2016-11-20,
16,1,7:58,2278,2278,Jada Terry Offensive Rebound.,0,2,-2,3,0.45332155583379324,Texas Tech,New Mexico,4,4,0,0,NA,400911071,2016-11-20,
17,1,7:55,2275,2275,Jada Terry made Two Point Tip Shot.,2,2,0,6,0.5,Texas Tech,New Mexico,4,4,0,0,NA,400911071,2016-11-20,Texas Tech
18,1,7:49,2269,2269,Mykiel Burleson missed Layup.,2,2,0,0,0.5,Texas Tech,New Mexico,4,4,0,0,NA,400911071,2016-11-20,
19,1,7:49,2269,2269,Texas Tech Defensive Rebound.,2,2,0,14,0.5,Texas Tech,New Mexico,4,4,0,0,NA,400911071,2016-11-20,
20,1,7:35,2255,2255,Jada Terry made Jumper. Assisted by Arella Guirantes.,4,2,2,11,0.5471964787163031,Texas Tech,New Mexico,4,4,0,0,NA,400911071,2016-11-20,Texas Tech
21,1,7:24,2244,2244,Jayda Bovero made Layup.,4,4,0,21,0.5,Texas Tech,New Mexico,4,4,0,0,NA,400911071,2016-11-20,New Mexico
22,1,7:03,2223,2223,Arella Guirantes made Jumper.,6,4,2,14,0.5479240095827266,Texas Tech,New Mexico,4,4,0,0,NA,400911071,2016-11-20,Texas Tech
23,1,6:49,2209,2209,Richelle van der Keijl missed Jumper.,6,4,2,0,0.5482443987813758,Texas Tech,New Mexico,4,4,0,0,NA,400911071,2016-11-20,
24,1,6:49,2209,2209,Richelle van der Keijl Offensive Rebound.,6,4,2,4,0.5482443987813758,Texas Tech,New Mexico,4,4,0,0,NA,400911071,2016-11-20,
25,1,6:45,2205,2205,Richelle van der Keijl made Jumper.,6,6,0,13,0.5,Texas Tech,New Mexico,4,4,0,0,NA,400911071,2016-11-20,New Mexico
26,1,6:32,2192,2192,Jada Terry made Layup.,8,6,2,12,0.5486348662607666,Texas Tech,New Mexico,4,4,0,0,NA,400911071,2016-11-20,Texas Tech
27,1,6:20,2180,2180,Foul on Arella Guirantes.,8,6,2,0,0.548911299485386,Texas Tech,New Mexico,4,4,0,0,NA,400911071,2016-11-20,
28,1,6:20,2180,2180,Mykiel Burleson missed Free Throw.,8,6,2,0,0.548911299485386,Texas Tech,New Mexico,4,4,0,0,NA,400911071,2016-11-20,
29,1,6:20,2180,2180,New Mexico Deadball Team Rebound.,8,6,2,0,0.548911299485386,Texas Tech,New Mexico,4,4,0,0,NA,400911071,2016-11-20,
30,1,6:20,2180,2180,Mykiel Burleson made Free Throw.,8,7,1,22,0.5245144369789915,Texas Tech,New Mexico,4,4,0,0,NA,400911071,2016-11-20,New Mexico
31,1,5:58,2158,2158,Recee' Caldwell missed Three Point Jumper.,8,7,1,0,0.5247705449934248,Texas Tech,New Mexico,4,4,0,0,NA,400911071,2016-11-20,
32,1,5:58,2158,2158,Ivonne Cook-Taylor Offensive Rebound.,8,7,1,6,0.5247705449934248,Texas Tech,New Mexico,4,4,0,0,NA,400911071,2016-11-20,
33,1,5:52,2152,2152,Ivonne Cook-Taylor made Jumper.,10,7,3,12,0.574035172682011,Texas Tech,New Mexico,4,4,0,0,NA,400911071,2016-11-20,Texas Tech
34,1,5:40,2140,2140,Alex Lapeyrolerie missed Three Point Jumper.,10,7,3,0,0.5744490742188592,Texas Tech,New Mexico,4,4,0,0,NA,400911071,2016-11-20,
35,1,5:40,2140,2140,Jaisa Nunn Offensive Rebound.,10,7,3,7,0.5744490742188592,Texas Tech,New Mexico,4,4,0,0,NA,400911071,2016-11-20,
36,1,5:33,2133,2133,Mykiel Burleson missed Three Point Jumper.,10,7,3,0,0.574691294339453,Texas Tech,New Mexico,4,4,0,0,NA,400911071,2016-11-20,
37,1,5:33,2133,2133,Jaisa Nunn Offensive Rebound.,10,7,3,6,0.574691294339453,Texas Tech,New Mexico,4,4,0,0,NA,400911071,2016-11-20,
38,1,5:27,2127,2127,Cherise Beynon missed Three Point Jumper.,10,7,3,0,0.5748993835743894,Texas Tech,New Mexico,4,4,0,0,NA,400911071,2016-11-20,
39,1,5:27,2127,2127,Cherise Beynon Offensive Rebound.,10,7,3,5,0.5748993835743894,Texas Tech,New Mexico,4,4,0,0,NA,400911071,2016-11-20,
40,1,5:22,2122,2122,Cherise Beynon missed Jumper.,10,7,3,0,0.5750731321879385,Texas Tech,New Mexico,4,4,0,0,NA,400911071,2016-11-20,
41,1,5:22,2122,2122,Brittany Brewer Block.,10,7,3,3,0.5750731321879385,Texas Tech,New Mexico,4,4,0,0,NA,400911071,2016-11-20,
42,1,5:19,2119,2119,Ivonne Cook-Taylor Defensive Rebound.,10,7,3,7,0.5751775328694879,Texas Tech,New Mexico,4,4,0,0,NA,400911071,2016-11-20,
43,1,5:12,2112,2112,Brittany Brewer Turnover.,10,7,3,1,0.575421584960564,Texas Tech,New Mexico,4,4,0,0,NA,400911071,2016-11-20,
44,1,5:11,2111,2111,Alex Lapeyrolerie Steal.,10,7,3,16,0.5754565017501353,Texas Tech,New Mexico,4,4,0,0,NA,400911071,2016-11-20,
45,1,4:55,2095,2095,Mykiel Burleson missed Jumper.,10,7,3,0,0.5760169986786545,Texas Tech,New Mexico,4,4,0,0,NA,400911071,2016-11-20,
46,1,4:55,2095,2095,Brittany Brewer Block.,10,7,3,0,0.5760169986786545,Texas Tech,New Mexico,4,4,0,0,NA,400911071,2016-11-20,
47,1,4:55,2095,2095,New Mexico Offensive Rebound.,10,7,3,0,0.5760169986786545,Texas Tech,New Mexico,4,4,0,0,NA,400911071,2016-11-20,
48,1,4:55,2095,2095,Official TV Timeout,10,7,3,2,0.5760169986786545,Texas Tech,New Mexico,4,4,0,0,NA,400911071,2016-11-20,
49,1,4:53,2093,2093,Jaisa Nunn missed Layup.,10,7,3,0,0.5760873083578365,Texas Tech,New Mexico,4,4,0,0,NA,400911071,2016-11-20,
50,1,4:53,2093,2093,Dayo Olabode Defensive Rebound.,10,7,3,6,0.5760873083578365,Texas Tech,New Mexico,4,4,0,0,NA,400911071,2016-11-20,
51,1,4:47,2087,2087,Ivonne Cook-Taylor missed Jumper.,10,7,3,0,0.5762985768755345,Texas Tech,New Mexico,4,4,0,0,NA,400911071,2016-11-20,
52,1,4:47,2087,2087,Cherise Beynon Defensive Rebound.,10,7,3,11,0.5762985768755345,Texas Tech,New Mexico,4,4,0,0,NA,400911071,2016-11-20,
53,1,4:36,2076,2076,Cherise Beynon missed Layup.,10,7,3,0,0.5766872539992671,Texas Tech,New Mexico,4,4,0,0,NA,400911071,2016-11-20,
54,1,4:36,2076,2076,Brittany Brewer Block.,10,7,3,1,0.5766872539992671,Texas Tech,New Mexico,4,4,0,0,NA,400911071,2016-11-20,
55,1,4:35,2075,2075,Arella Guirantes Defensive Rebound.,10,7,3,4,0.5767226767699644,Texas Tech,New Mexico,4,4,0,0,NA,400911071,2016-11-20,
56,1,4:31,2071,2071,Larryn Brooks missed Layup.,10,7,3,0,0.5768645179347631,Texas Tech,New Mexico,4,4,0,0,NA,400911071,2016-11-20,
57,1,4:31,2071,2071,Alex Lapeyrolerie Defensive Rebound.,10,7,3,11,0.5768645179347631,Texas Tech,New Mexico,4,4,0,0,NA,400911071,2016-11-20,
58,1,4:20,2060,2060,Jaisa Nunn made Three Point Jumper. Assisted by Cherise Beynon.,10,10,0,24,0.5,Texas Tech,New Mexico,4,4,0,0,NA,400911071,2016-11-20,New Mexico
59,1,3:56,2036,2036,Larryn Brooks Turnover.,10,10,0,2,0.5,Texas Tech,New Mexico,4,4,0,0,NA,400911071,2016-11-20,
60,1,3:54,2034,2034,Cherise Beynon Steal.,10,10,0,2,0.5,Texas Tech,New Mexico,4,4,0,0,NA,400911071,2016-11-20,
61,1,3:52,2032,2032,Laneah Bryan missed Three Point Jumper.,10,10,0,0,0.5,Texas Tech,New Mexico,4,4,0,0,NA,400911071,2016-11-20,
62,1,3:52,2032,2032,Dayo Olabode Defensive Rebound.,10,10,0,28,0.5,Texas Tech,New Mexico,4,4,0,0,NA,400911071,2016-11-20,
63,1,3:24,2004,2004,Brittany Brewer missed Jumper.,10,10,0,0,0.5,Texas Tech,New Mexico,4,4,0,0,NA,400911071,2016-11-20,
64,1,3:24,2004,2004,Kianna Keller Block.,10,10,0,1,0.5,Texas Tech,New Mexico,4,4,0,0,NA,400911071,2016-11-20,
65,1,3:23,2003,2003,Brittany Brewer Offensive Rebound.,10,10,0,2,0.5,Texas Tech,New Mexico,4,4,0,0,NA,400911071,2016-11-20,
66,1,3:21,2001,2001,Brittany Brewer missed Jumper.,10,10,0,0,0.5,Texas Tech,New Mexico,4,4,0,0,NA,400911071,2016-11-20,
67,1,3:21,2001,2001,Larryn Brooks Offensive Rebound.,10,10,0,3,0.5,Texas Tech,New Mexico,4,4,0,0,NA,400911071,2016-11-20,
68,1,3:18,1998,1998,Dayo Olabode missed Three Point Jumper.,10,10,0,0,0.5,Texas Tech,New Mexico,4,4,0,0,NA,400911071,2016-11-20,
69,1,3:18,1998,1998,Cherise Beynon Defensive Rebound.,10,10,0,28,0.5,Texas Tech,New Mexico,4,4,0,0,NA,400911071,2016-11-20,
70,1,2:50,1970,1970,Alex Lapeyrolerie made Three Point Jumper. Assisted by Laneah Bryan.,10,13,-3,16,0.41946529672286503,Texas Tech,New Mexico,4,4,0,0,NA,400911071,2016-11-20,New Mexico
71,1,2:34,1954,1954,Arella Guirantes made Layup.,12,13,-1,0,0.4727413301522449,Texas Tech,New Mexico,4,4,0,0,NA,400911071,2016-11-20,Texas Tech
72,1,2:34,1954,1954,Foul on Alex Lapeyrolerie.,12,13,-1,0,0.4727413301522449,Texas Tech,New Mexico,4,4,0,0,NA,400911071,2016-11-20,
73,1,2:34,1954,1954,Arella Guirantes missed Free Throw.,12,13,-1,0,0.4727413301522449,Texas Tech,New Mexico,4,4,0,0,NA,400911071,2016-11-20,
74,1,2:34,1954,1954,Richelle van der Keijl Defensive Rebound.,12,13,-1,6,0.4727413301522449,Texas Tech,New Mexico,4,4,0,0,NA,400911071,2016-11-20,
75,1,2:28,1948,1948,Mykiel Burleson missed Layup.,12,13,-1,0,0.4726642009187456,Texas Tech,New Mexico,4,4,0,0,NA,400911071,2016-11-20,
76,1,2:28,1948,1948,Richelle van der Keijl Offensive Rebound.,12,13,-1,5,0.4726642009187456,Texas Tech,New Mexico,4,4,0,0,NA,400911071,2016-11-20,
77,1,2:23,1943,1943,Alex Lapeyrolerie missed Three Point Jumper.,12,13,-1,0,0.4725997206261266,Texas Tech,New Mexico,4,4,0,0,NA,400911071,2016-11-20,
78,1,2:23,1943,1943,Grayson Bright Defensive Rebound.,12,13,-1,14,0.4725997206261266,Texas Tech,New Mexico,4,4,0,0,NA,400911071,2016-11-20,
79,1,2:09,1929,1929,Foul on Laneah Bryan.,12,13,-1,0,0.4724181662118191,Texas Tech,New Mexico,4,4,0,0,NA,400911071,2016-11-20,
80,1,2:09,1929,1929,Arella Guirantes made Free Throw.,13,13,0,0,0.5,Texas Tech,New Mexico,4,4,0,0,NA,400911071,2016-11-20,Texas Tech
81,1,2:09,1929,1929,Arella Guirantes made Free Throw.,14,13,1,17,0.5275818337881809,Texas Tech,New Mexico,4,4,0,0,NA,400911071,2016-11-20,Texas Tech
82,1,1:52,1912,1912,Richelle van der Keijl missed Jumper.,14,13,1,0,0.527802734743821,Texas Tech,New Mexico,4,4,0,0,NA,400911071,2016-11-20,
83,1,1:52,1912,1912,Dayo Olabode Defensive Rebound.,14,13,1,8,0.527802734743821,Texas Tech,New Mexico,4,4,0,0,NA,400911071,2016-11-20,
84,1,1:44,1904,1904,Jada Terry missed Jumper.,14,13,1,0,0.5279065397233292,Texas Tech,New Mexico,4,4,0,0,NA,400911071,2016-11-20,
85,1,1:44,1904,1904,Laneah Bryan Defensive Rebound.,14,13,1,9,0.5279065397233292,Texas Tech,New Mexico,4,4,0,0,NA,400911071,2016-11-20,
86,1,1:35,1895,1895,Jaisa Nunn missed Three Point Jumper.,14,13,1,0,0.528023274127686,Texas Tech,New Mexico,4,4,0,0,NA,400911071,2016-11-20,
87,1,1:35,1895,1895,Recee' Caldwell Defensive Rebound.,14,13,1,21,0.528023274127686,Texas Tech,New Mexico,4,4,0,0,NA,400911071,2016-11-20,
88,1,1:14,1874,1874,Jada Terry missed Jumper.,14,13,1,0,0.528295774020342,Texas Tech,New Mexico,4,4,0,0,NA,400911071,2016-11-20,
89,1,1:14,1874,1874,Grayson Bright Offensive Rebound.,14,13,1,3,0.528295774020342,Texas Tech,New Mexico,4,4,0,0,NA,400911071,2016-11-20,
90,1,1:11,1871,1871,Grayson Bright made Layup.,16,13,3,24,0.5842832266439791,Texas Tech,New Mexico,4,4,0,0,NA,400911071,2016-11-20,Texas Tech
91,1,0:47,1847,1847,Mykiel Burleson missed Three Point Jumper.,16,13,3,0,0.5851970156624611,Texas Tech,New Mexico,4,4,0,0,NA,400911071,2016-11-20,
92,1,0:47,1847,1847,Dayo Olabode Defensive Rebound.,16,13,3,12,0.5851970156624611,Texas Tech,New Mexico,4,4,0,0,NA,400911071,2016-11-20,
93,1,0:35,1835,1835,Recee' Caldwell missed Three Point Jumper.,16,13,3,0,0.5856559147328643,Texas Tech,New Mexico,4,4,0,0,NA,400911071,2016-11-20,
94,1,0:35,1835,1835,Alex Lapeyrolerie Defensive Rebound.,16,13,3,27,0.5856559147328643,Texas Tech,New Mexico,4,4,0,0,NA,400911071,2016-11-20,
95,1,0:08,1808,1808,Alex Lapeyrolerie missed Three Point Jumper.,16,13,3,0,0.5866958165178315,Texas Tech,New Mexico,4,4,0,0,NA,400911071,2016-11-20,
96,1,0:08,1808,1808,Dayo Olabode Defensive Rebound.,16,13,3,5,0.5866958165178315,Texas Tech,New Mexico,4,4,0,0,NA,400911071,2016-11-20,
97,1,0:03,1803,1803,Dayo Olabode Turnover.,16,13,3,0,0.5868897761363941,Texas Tech,New Mexico,4,4,0,0,NA,400911071,2016-11-20,
98,1,0:03,1803,1803,Jaisa Nunn Steal.,16,13,3,0,0.5868897761363941,Texas Tech,New Mexico,4,4,0,0,NA,400911071,2016-11-20,
99,1,0:03,1803,1803,Foul on Dayo Olabode.,16,13,3,0,0.5868897761363941,Texas Tech,New Mexico,4,4,0,0,NA,400911071,2016-11-20,
100,1,0:03,1803,1803,Jaisa Nunn made Free Throw.,16,14,2,0,0.5582546715191289,Texas Tech,New Mexico,4,4,0,0,NA,400911071,2016-11-20,New Mexico
101,1,0:03,1803,1803,Jaisa Nunn missed Free Throw.,16,14,2,0,0.5582546715191289,Texas Tech,New Mexico,4,4,0,0,NA,400911071,2016-11-20,
102,1,0:03,1803,1803,Jada Terry Defensive Rebound.,16,14,2,3,0.5582546715191289,Texas Tech,New Mexico,4,4,0,0,NA,400911071,2016-11-20,
103,1,0:00,1800,1800,End of 1st Quarter,16,14,2,16,0.558333749411633,Texas Tech,New Mexico,4,4,0,0,NA,400911071,2016-11-20,
104,2,9:44,1784,1784,Jada Terry missed Jumper.,16,14,2,0,0.5587578006611388,Texas Tech,New Mexico,4,4,0,0,NA,400911071,2016-11-20,
105,2,9:44,1784,1784,Brittany Brewer Offensive Rebound.,16,14,2,1,0.5587578006611388,Texas Tech,New Mexico,4,4,0,0,NA,400911071,2016-11-20,
106,2,9:43,1783,1783,Foul on Jaisa Nunn.,16,14,2,0,0.5587844412889225,Texas Tech,New Mexico,4,4,0,0,NA,400911071,2016-11-20,
107,2,9:43,1783,1783,Brittany Brewer made Free Throw.,17,14,3,0,0.587670916600577,Texas Tech,New Mexico,4,4,0,0,NA,400911071,2016-11-20,Texas Tech
108,2,9:43,1783,1783,Brittany Brewer made Free Throw.,18,14,4,8,0.6159659499433138,Texas Tech,New Mexico,4,4,0,0,NA,400911071,2016-11-20,Texas Tech
109,2,9:35,1775,1775,Richelle van der Keijl made Layup. Assisted by Cherise Beynon.,18,16,2,14,0.5589981942113165,Texas Tech,New Mexico,4,4,0,0,NA,400911071,2016-11-20,New Mexico
110,2,9:21,1761,1761,Jada Terry made Jumper. Assisted by Grayson Bright.,20,16,4,12,0.6170989709080659,Texas Tech,New Mexico,4,4,0,0,NA,400911071,2016-11-20,Texas Tech
111,2,9:09,1749,1749,Jaisa Nunn missed Three Point Jumper.,20,16,4,0,0.6177243772979365,Texas Tech,New Mexico,4,4,0,0,NA,400911071,2016-11-20,
112,2,9:09,1749,1749,Grayson Bright Defensive Rebound.,20,16,4,16,0.6177243772979365,Texas Tech,New Mexico,4,4,0,0,NA,400911071,2016-11-20,
113,2,8:53,1733,1733,Foul on Cherise Beynon.,20,16,4,2,0.6185674440905651,Texas Tech,New Mexico,4,4,0,0,NA,400911071,2016-11-20,
114,2,8:51,1731,1731,Recee' Caldwell Turnover.,20,16,4,1,0.6186736175520785,Texas Tech,New Mexico,4,4,0,0,NA,400911071,2016-11-20,
115,2,8:50,1730,1730,Mykiel Burleson Steal.,20,16,4,3,0.618726772838221,Texas Tech,New Mexico,4,4,0,0,NA,400911071,2016-11-20,
116,2,8:47,1727,1727,Jaisa Nunn made Layup. Assisted by Mykiel Burleson.,20,18,2,21,0.5603080532624475,Texas Tech,New Mexico,4,4,0,0,NA,400911071,2016-11-20,New Mexico
117,2,8:26,1706,1706,Ivonne Cook-Taylor missed Jumper.,20,18,2,0,0.5608986918759065,Texas Tech,New Mexico,4,4,0,0,NA,400911071,2016-11-20,
118,2,8:26,1706,1706,Jaisa Nunn Defensive Rebound.,20,18,2,11,0.5608986918759065,Texas Tech,New Mexico,4,4,0,0,NA,400911071,2016-11-20,
119,2,8:15,1695,1695,Cherise Beynon missed Jumper.,20,18,2,0,0.5612130583715181,Texas Tech,New Mexico,4,4,0,0,NA,400911071,2016-11-20,
120,2,8:15,1695,1695,Jada Terry Defensive Rebound.,20,18,2,3,0.5612130583715181,Texas Tech,New Mexico,4,4,0,0,NA,400911071,2016-11-20,
121,2,8:12,1692,1692,Foul on Richelle van der Keijl.,20,18,2,12,0.5612994266774889,Texas Tech,New Mexico,4,4,0,0,NA,400911071,2016-11-20,
122,2,8:00,1680,1680,Larryn Brooks made Layup.,22,18,4,15,0.6214418002995874,Texas Tech,New Mexico,4,4,0,0,NA,400911071,2016-11-20,Texas Tech
123,2,7:45,1665,1665,Jaisa Nunn made Layup. Assisted by Cherise Beynon.,22,20,2,10,0.5620661480250033,Texas Tech,New Mexico,4,4,0,0,NA,400911071,2016-11-20,New Mexico
124,2,7:35,1655,1655,Larryn Brooks missed Layup.,22,20,2,0,0.5623433181028693,Texas Tech,New Mexico,4,4,0,0,NA,400911071,2016-11-20,
125,2,7:35,1655,1655,Cherise Beynon Defensive Rebound.,22,20,2,11,0.5623433181028693,Texas Tech,New Mexico,4,4,0,0,NA,400911071,2016-11-20,
126,2,7:24,1644,1644,Mykiel Burleson missed Layup.,22,20,2,0,0.5626449282595558,Texas Tech,New Mexico,4,4,0,0,NA,400911071,2016-11-20,
127,2,7:24,1644,1644,Mykiel Burleson Offensive Rebound.,22,20,2,3,0.5626449282595558,Texas Tech,New Mexico,4,4,0,0,NA,400911071,2016-11-20,
128,2,7:21,1641,1641,Mykiel Burleson made Jumper.,22,22,0,0,0.5,Texas Tech,New Mexico,4,4,0,0,NA,400911071,2016-11-20,New Mexico
129,2,7:21,1641,1641,Foul on Ivonne Cook-Taylor.,22,22,0,0,0.5,Texas Tech,New Mexico,4,4,0,0,NA,400911071,2016-11-20,
130,2,7:21,1641,1641,Mykiel Burleson missed Free Throw.,22,22,0,0,0.5,Texas Tech,New Mexico,4,4,0,0,NA,400911071,2016-11-20,
131,2,7:21,1641,1641,Jaisa Nunn Offensive Rebound.,22,22,0,3,0.5,Texas Tech,New Mexico,4,4,0,0,NA,400911071,2016-11-20,
132,2,7:18,1638,1638,Jaisa Nunn made Layup.,22,24,-2,22,0.43719175449674724,Texas Tech,New Mexico,4,4,0,0,NA,400911071,2016-11-20,New Mexico
133,2,6:56,1616,1616,Arella Guirantes missed Layup.,22,24,-2,0,0.43659798029823804,Texas Tech,New Mexico,4,4,0,0,NA,400911071,2016-11-20,
134,2,6:56,1616,1616,Kianna Keller Defensive Rebound.,22,24,-2,12,0.43659798029823804,Texas Tech,New Mexico,4,4,0,0,NA,400911071,2016-11-20,
135,2,6:44,1604,1604,Jaisa Nunn made Layup.,22,26,-4,1,0.3745890018322981,Texas Tech,New Mexico,4,4,0,0,NA,400911071,2016-11-20,New Mexico
136,2,6:43,1603,1603,Texas Tech  Timeout,22,26,-4,14,0.3745379165134954,Texas Tech,New Mexico,3,4,1,0,NA,400911071,2016-11-20,
137,2,6:29,1589,1589,Recee' Caldwell missed Jumper.,22,26,-4,0,0.37382253415405664,Texas Tech,New Mexico,3,4,1,0,NA,400911071,2016-11-20,
138,2,6:29,1589,1589,Jaisa Nunn Defensive Rebound.,22,26,-4,10,0.37382253415405664,Texas Tech,New Mexico,3,4,1,0,NA,400911071,2016-11-20,
139,2,6:19,1579,1579,Alex Lapeyrolerie missed Layup.,22,26,-4,0,0.3733103017289127,Texas Tech,New Mexico,3,4,1,0,NA,400911071,2016-11-20,
140,2,6:19,1579,1579,Arella Guirantes Block.,22,26,-4,3,0.3733103017289127,Texas Tech,New Mexico,3,4,1,0,NA,400911071,2016-11-20,
141,2,6:16,1576,1576,Arella Guirantes Defensive Rebound.,22,26,-4,5,0.3731562491513981,Texas Tech,New Mexico,3,4,1,0,NA,400911071,2016-11-20,
142,2,6:11,1571,1571,Larryn Brooks missed Three Point Jumper.,22,26,-4,0,0.3728989789701693,Texas Tech,New Mexico,3,4,1,0,NA,400911071,2016-11-20,
143,2,6:11,1571,1571,Mykiel Burleson Defensive Rebound.,22,26,-4,7,0.3728989789701693,Texas Tech,New Mexico,3,4,1,0,NA,400911071,2016-11-20,
144,2,6:04,1564,1564,Alex Lapeyrolerie missed Three Point Jumper.,22,26,-4,0,0.3725375020338303,Texas Tech,New Mexico,3,4,1,0,NA,400911071,2016-11-20,
145,2,6:04,1564,1564,Larryn Brooks Defensive Rebound.,22,26,-4,16,0.3725375020338303,Texas Tech,New Mexico,3,4,1,0,NA,400911071,2016-11-20,
146,2,5:48,1548,1548,Ivonne Cook-Taylor missed Jumper.,22,26,-4,0,0.37170382190413,Texas Tech,New Mexico,3,4,1,0,NA,400911071,2016-11-20,
147,2,5:48,1548,1548,Mykiel Burleson Defensive Rebound.,22,26,-4,6,0.37170382190413,Texas Tech,New Mexico,3,4,1,0,NA,400911071,2016-11-20,
148,2,5:42,1542,1542,Mykiel Burleson made Layup.,22,28,-6,12,0.31229726729239055,Texas Tech,New Mexico,3,4,0,0,NA,400911071,2016-11-20,New Mexico
149,2,5:30,1530,1530,Larryn Brooks made Three Point Jumper.,25,28,-3,20,0.4020927617918122,Texas Tech,New Mexico,3,4,0,0,NA,400911071,2016-11-20,Texas Tech
150,2,5:10,1510,1510,Mykiel Burleson missed Three Point Jumper.,25,28,-3,0,0.40125145421521435,Texas Tech,New Mexico,3,4,0,0,NA,400911071,2016-11-20,
151,2,5:10,1510,1510,Ivonne Cook-Taylor Defensive Rebound.,25,28,-3,17,0.40125145421521435,Texas Tech,New Mexico,3,4,0,0,NA,400911071,2016-11-20,
152,2,4:53,1493,1493,Brittany Brewer missed Layup.,25,28,-3,0,0.4005137873325576,Texas Tech,New Mexico,3,4,0,0,NA,400911071,2016-11-20,
153,2,4:53,1493,1493,Kianna Keller Defensive Rebound.,25,28,-3,8,0.4005137873325576,Texas Tech,New Mexico,3,4,0,0,NA,400911071,2016-11-20,
154,2,4:45,1485,1485,Jayda Bovero missed Three Point Jumper.,25,28,-3,0,0.4001582995646299,Texas Tech,New Mexico,3,4,0,0,NA,400911071,2016-11-20,
155,2,4:45,1485,1485,Recee' Caldwell Defensive Rebound.,25,28,-3,15,0.4001582995646299,Texas Tech,New Mexico,3,4,0,0,NA,400911071,2016-11-20,
156,2,4:30,1470,1470,Brittany Brewer missed Jumper.,25,28,-3,0,0.3994755532212195,Texas Tech,New Mexico,3,4,0,0,NA,400911071,2016-11-20,
157,2,4:30,1470,1470,Jayda Bovero Defensive Rebound.,25,28,-3,27,0.3994755532212195,Texas Tech,New Mexico,3,4,0,0,NA,400911071,2016-11-20,
158,2,4:03,1443,1443,Alex Lapeyrolerie missed Three Point Jumper.,25,28,-3,0,0.3981916750619686,Texas Tech,New Mexico,3,4,0,0,NA,400911071,2016-11-20,
159,2,4:03,1443,1443,Arella Guirantes Defensive Rebound.,25,28,-3,17,0.3981916750619686,Texas Tech,New Mexico,3,4,0,0,NA,400911071,2016-11-20,
160,2,3:46,1426,1426,Brittany Brewer missed Jumper.,25,28,-3,0,0.3973944041171829,Texas Tech,New Mexico,3,4,0,0,NA,400911071,2016-11-20,
161,2,3:46,1426,1426,Arella Guirantes Offensive Rebound.,25,28,-3,6,0.3973944041171829,Texas Tech,New Mexico,3,4,0,0,NA,400911071,2016-11-20,
162,2,3:40,1420,1420,Arella Guirantes made Three Point Jumper.,28,28,0,4,0.5,Texas Tech,New Mexico,3,4,0,0,NA,400911071,2016-11-20,Texas Tech
163,2,3:36,1416,1416,New Mexico  Timeout,28,28,0,7,0.5,Texas Tech,New Mexico,3,3,0,1,NA,400911071,2016-11-20,
164,2,3:29,1409,1409,Foul on Cherise Beynon.,28,28,0,0,0.5,Texas Tech,New Mexico,3,3,0,1,NA,400911071,2016-11-20,
165,2,3:29,1409,1409,Cherise Beynon Turnover.,28,28,0,19,0.5,Texas Tech,New Mexico,3,3,0,1,NA,400911071,2016-11-20,
166,2,3:10,1390,1390,Foul on Recee' Caldwell.,28,28,0,0,0.5,Texas Tech,New Mexico,3,3,0,1,NA,400911071,2016-11-20,
167,2,3:10,1390,1390,Recee' Caldwell Turnover.,28,28,0,12,0.5,Texas Tech,New Mexico,3,3,0,1,NA,400911071,2016-11-20,
168,2,2:58,1378,1378,Jayda Bovero missed Layup.,28,28,0,0,0.5,Texas Tech,New Mexico,3,3,0,1,NA,400911071,2016-11-20,
169,2,2:58,1378,1378,Arella Guirantes Block.,28,28,0,2,0.5,Texas Tech,New Mexico,3,3,0,1,NA,400911071,2016-11-20,
170,2,2:56,1376,1376,Kianna Keller Offensive Rebound.,28,28,0,2,0.5,Texas Tech,New Mexico,3,3,0,1,NA,400911071,2016-11-20,
171,2,2:54,1374,1374,Kianna Keller made Three Point Jumper. Assisted by Alex Lapeyrolerie.,28,31,-3,16,0.39507172739181645,Texas Tech,New Mexico,3,3,0,1,NA,400911071,2016-11-20,New Mexico
172,2,2:38,1358,1358,Recee' Caldwell missed Layup.,28,31,-3,0,0.3943704081327692,Texas Tech,New Mexico,3,3,0,1,NA,400911071,2016-11-20,
173,2,2:38,1358,1358,Kianna Keller Defensive Rebound.,28,31,-3,17,0.3943704081327692,Texas Tech,New Mexico,3,3,0,1,NA,400911071,2016-11-20,
174,2,2:21,1341,1341,Alex Lapeyrolerie missed Jumper.,28,31,-3,0,0.39362092593880976,Texas Tech,New Mexico,3,3,0,0,NA,400911071,2016-11-20,
175,2,2:21,1341,1341,Arella Guirantes Defensive Rebound.,28,31,-3,10,0.39362092593880976,Texas Tech,New Mexico,3,3,0,0,NA,400911071,2016-11-20,
176,2,2:11,1331,1331,Jada Terry missed Jumper.,28,31,-3,0,0.3931752495931724,Texas Tech,New Mexico,3,3,0,0,NA,400911071,2016-11-20,
177,2,2:11,1331,1331,Jada Terry Offensive Rebound.,28,31,-3,2,0.3931752495931724,Texas Tech,New Mexico,3,3,0,0,NA,400911071,2016-11-20,
178,2,2:09,1329,1329,Jada Terry made Layup.,30,31,-1,6,0.46386637808543496,Texas Tech,New Mexico,3,3,0,0,NA,400911071,2016-11-20,Texas Tech
179,2,2:03,1323,1323,Cherise Beynon missed Layup.,30,31,-1,0,0.46377235481420864,Texas Tech,New Mexico,3,3,0,0,NA,400911071,2016-11-20,
180,2,2:03,1323,1323,Larryn Brooks Defensive Rebound.,30,31,-1,7,0.46377235481420864,Texas Tech,New Mexico,3,3,0,0,NA,400911071,2016-11-20,
181,2,1:56,1316,1316,Larryn Brooks missed Jumper.,30,31,-1,0,0.4636616141633348,Texas Tech,New Mexico,3,3,0,0,NA,400911071,2016-11-20,
182,2,1:56,1316,1316,Richelle van der Keijl Defensive Rebound.,30,31,-1,23,0.4636616141633348,Texas Tech,New Mexico,3,3,0,0,NA,400911071,2016-11-20,
183,2,1:33,1293,1293,Richelle van der Keijl Turnover.,30,31,-1,15,0.4632877902567029,Texas Tech,New Mexico,3,3,0,0,NA,400911071,2016-11-20,
184,2,1:18,1278,1278,Larryn Brooks missed Three Point Jumper.,30,31,-1,0,0.4630336731015302,Texas Tech,New Mexico,3,3,0,0,NA,400911071,2016-11-20,
185,2,1:18,1278,1278,Kianna Keller Defensive Rebound.,30,31,-1,9,0.4630336731015302,Texas Tech,New Mexico,3,3,0,0,NA,400911071,2016-11-20,
186,2,1:09,1269,1269,Kianna Keller made Three Point Jumper. Assisted by Cherise Beynon.,30,34,-4,27,0.3554720346319572,Texas Tech,New Mexico,3,3,0,0,NA,400911071,2016-11-20,New Mexico
187,2,0:42,1242,1242,Arella Guirantes made Jumper.,32,34,-2,13,0.425182538843073,Texas Tech,New Mexico,3,3,0,0,NA,400911071,2016-11-20,Texas Tech
188,2,0:29,1229,1229,Jayda Bovero missed Layup.,32,34,-2,0,0.4246813332238164,Texas Tech,New Mexico,3,3,0,0,NA,400911071,2016-11-20,
