play_id,period,time_remaining_period,secs_remaining,secs_remaining_absolute,description,home_score,away_score,score_diff,play_length,win_prob,home,away,home_time_out_remaining,away_time_out_remaining,home_timeout_ind,away_timeout_ind,home_favored_by,game_id,date,whichScored
189,2,0:29,1229,1229,Jada Terry Block.,32,34,-2,2,0.4246813332238164,Texas Tech,New Mexico,3,3,0,0,NA,400911071,2016-11-20,
190,2,0:27,1227,1227,Arella Guirantes Defensive Rebound.,32,34,-2,5,0.4246022601030206,Texas Tech,New Mexico,3,3,0,0,NA,400911071,2016-11-20,
191,2,0:22,1222,1222,Arella Guirantes missed Three Point Jumper.,32,34,-2,0,0.4244021743175779,Texas Tech,New Mexico,3,3,0,0,NA,400911071,2016-11-20,
192,2,0:22,1222,1222,Alex Lapeyrolerie Defensive Rebound.,32,34,-2,21,0.4244021743175779,Texas Tech,New Mexico,3,3,0,0,NA,400911071,2016-11-20,
193,2,0:01,1201,1201,Alex Lapeyrolerie missed Jumper.,32,34,-2,0,0.4235319432624558,Texas Tech,New Mexico,3,3,0,0,NA,400911071,2016-11-20,
194,2,0:01,1201,1201,Grayson Bright Defensive Rebound.,32,34,-2,1,0.4235319432624558,Texas Tech,New Mexico,3,3,0,0,NA,400911071,2016-11-20,
195,2,0:00,1200,1200,End of 2nd Quarter,32,34,-2,14,0.4234906714856242,Texas Tech,New Mexico,3,3,0,0,NA,400911071,2016-11-20,
196,3,9:46,1186,1186,Recee' Caldwell missed Three Point Jumper.,32,34,-2,0,0.42292097991455413,Texas Tech,New Mexico,4,4,0,0,NA,400911071,2016-11-20,
197,3,9:46,1186,1186,Jada Terry Offensive Rebound.,32,34,-2,23,0.42292097991455413,Texas Tech,New Mexico,4,4,0,0,NA,400911071,2016-11-20,
198,3,9:23,1163,1163,Jada Terry missed Layup.,32,34,-2,0,0.42201072550202207,Texas Tech,New Mexico,4,4,0,0,NA,400911071,2016-11-20,
199,3,9:23,1163,1163,Ivonne Cook-Taylor Offensive Rebound.,32,34,-2,6,0.42201072550202207,Texas Tech,New Mexico,4,4,0,0,NA,400911071,2016-11-20,
200,3,9:17,1157,1157,Ivonne Cook-Taylor missed Jumper.,32,34,-2,0,0.4217768494716882,Texas Tech,New Mexico,4,4,0,0,NA,400911071,2016-11-20,
201,3,9:17,1157,1157,New Mexico Defensive Rebound.,32,34,-2,13,0.4217768494716882,Texas Tech,New Mexico,4,4,0,0,NA,400911071,2016-11-20,
202,3,9:04,1144,1144,Cherise Beynon missed Three Point Jumper.,32,34,-2,0,0.42127289501209686,Texas Tech,New Mexico,4,4,0,0,NA,400911071,2016-11-20,
203,3,9:04,1144,1144,Recee' Caldwell Defensive Rebound.,32,34,-2,18,0.42127289501209686,Texas Tech,New Mexico,4,4,0,0,NA,400911071,2016-11-20,
204,3,8:46,1126,1126,Recee' Caldwell missed Layup.,32,34,-2,0,0.4205768001642287,Texas Tech,New Mexico,4,4,0,0,NA,400911071,2016-11-20,
205,3,8:46,1126,1126,Richelle van der Keijl Defensive Rebound.,32,34,-2,9,0.4205768001642287,Texas Tech,New Mexico,4,4,0,0,NA,400911071,2016-11-20,
206,3,8:37,1117,1117,Cherise Beynon missed Layup.,32,34,-2,0,0.42022733176445787,Texas Tech,New Mexico,4,4,0,0,NA,400911071,2016-11-20,
207,3,8:37,1117,1117,Texas Tech Defensive Rebound.,32,34,-2,16,0.42022733176445787,Texas Tech,New Mexico,4,4,0,0,NA,400911071,2016-11-20,
208,3,8:21,1101,1101,Ivonne Cook-Taylor missed Jumper.,32,34,-2,0,0.41959990553443405,Texas Tech,New Mexico,4,4,0,0,NA,400911071,2016-11-20,
209,3,8:21,1101,1101,Richelle van der Keijl Defensive Rebound.,32,34,-2,11,0.41959990553443405,Texas Tech,New Mexico,4,4,0,0,NA,400911071,2016-11-20,
210,3,8:10,1090,1090,Mykiel Burleson made Three Point Jumper. Assisted by Kianna Keller.,32,37,-5,17,0.3067112282183894,Texas Tech,New Mexico,4,4,0,0,NA,400911071,2016-11-20,New Mexico
211,3,7:53,1073,1073,Arella Guirantes made Jumper.,34,37,-3,9,0.37904702653987343,Texas Tech,New Mexico,4,4,0,0,NA,400911071,2016-11-20,Texas Tech
212,3,7:44,1064,1064,Mykiel Burleson missed Layup.,34,37,-3,0,0.3785007818778264,Texas Tech,New Mexico,4,4,0,0,NA,400911071,2016-11-20,
213,3,7:44,1064,1064,Ivonne Cook-Taylor Defensive Rebound.,34,37,-3,7,0.3785007818778264,Texas Tech,New Mexico,4,4,0,0,NA,400911071,2016-11-20,
214,3,7:37,1057,1057,Ivonne Cook-Taylor missed Layup.,34,37,-3,0,0.3780681689018611,Texas Tech,New Mexico,4,4,0,0,NA,400911071,2016-11-20,
215,3,7:37,1057,1057,Ivonne Cook-Taylor Offensive Rebound.,34,37,-3,1,0.3780681689018611,Texas Tech,New Mexico,4,4,0,0,NA,400911071,2016-11-20,
216,3,7:36,1056,1056,Foul on Jayda Bovero.,34,37,-3,16,0.37800577002886815,Texas Tech,New Mexico,4,4,0,0,NA,400911071,2016-11-20,
217,3,7:20,1040,1040,Brittany Brewer missed Jumper.,34,37,-3,0,0.3769850299066314,Texas Tech,New Mexico,4,4,0,0,NA,400911071,2016-11-20,
218,3,7:20,1040,1040,Brittany Brewer Offensive Rebound.,34,37,-3,3,0.3769850299066314,Texas Tech,New Mexico,4,4,0,0,NA,400911071,2016-11-20,
219,3,7:17,1037,1037,Brittany Brewer missed Jumper.,34,37,-3,0,0.37678859693404093,Texas Tech,New Mexico,4,4,0,0,NA,400911071,2016-11-20,
220,3,7:17,1037,1037,Texas Tech Offensive Rebound.,34,37,-3,8,0.37678859693404093,Texas Tech,New Mexico,4,4,0,0,NA,400911071,2016-11-20,
221,3,7:09,1029,1029,Arella Guirantes missed Jumper.,34,37,-3,0,0.37625624203768543,Texas Tech,New Mexico,4,4,0,0,NA,400911071,2016-11-20,
222,3,7:09,1029,1029,Cherise Beynon Defensive Rebound.,34,37,-3,9,0.37625624203768543,Texas Tech,New Mexico,4,4,0,0,NA,400911071,2016-11-20,
223,3,7:00,1020,1020,Cherise Beynon made Three Point Jumper.,34,40,-6,16,0.265772436430524,Texas Tech,New Mexico,4,4,0,0,NA,400911071,2016-11-20,New Mexico
224,3,6:44,1004,1004,Ivonne Cook-Taylor made Jumper.,36,40,-4,15,0.3353854076795946,Texas Tech,New Mexico,4,4,0,0,NA,400911071,2016-11-20,Texas Tech
225,3,6:29,989,989,Jayda Bovero missed Three Point Jumper.,36,40,-4,0,0.33395793636446114,Texas Tech,New Mexico,4,4,0,0,NA,400911071,2016-11-20,
226,3,6:29,989,989,Texas Tech Defensive Rebound.,36,40,-4,19,0.33395793636446114,Texas Tech,New Mexico,4,4,0,0,NA,400911071,2016-11-20,
227,3,6:10,970,970,Recee' Caldwell missed Three Point Jumper.,36,40,-4,0,0.3320360779701048,Texas Tech,New Mexico,4,4,0,0,NA,400911071,2016-11-20,
228,3,6:10,970,970,Kianna Keller Defensive Rebound.,36,40,-4,9,0.3320360779701048,Texas Tech,New Mexico,4,4,0,0,NA,400911071,2016-11-20,
229,3,6:01,961,961,Cherise Beynon missed Three Point Jumper.,36,40,-4,0,0.33111853610370556,Texas Tech,New Mexico,4,4,0,0,NA,400911071,2016-11-20,
230,3,6:01,961,961,Recee' Caldwell Defensive Rebound.,36,40,-4,10,0.33111853610370556,Texas Tech,New Mexico,4,4,0,0,NA,400911071,2016-11-20,
231,3,5:51,951,951,Foul on Mykiel Burleson.,36,40,-4,1,0.330153480506085,Texas Tech,New Mexico,4,4,0,0,NA,400911071,2016-11-20,
232,3,5:50,950,950,Ivonne Cook-Taylor missed Jumper.,36,40,-4,0,0.3300598569779778,Texas Tech,New Mexico,4,4,0,0,NA,400911071,2016-11-20,
233,3,5:50,950,950,Dayo Olabode Offensive Rebound.,36,40,-4,4,0.3300598569779778,Texas Tech,New Mexico,4,4,0,0,NA,400911071,2016-11-20,
234,3,5:46,946,946,Dayo Olabode made Layup.,38,40,-2,0,0.4122205671113835,Texas Tech,New Mexico,4,4,0,0,NA,400911071,2016-11-20,Texas Tech
235,3,5:46,946,946,Foul on Jaisa Nunn.,38,40,-2,0,0.4122205671113835,Texas Tech,New Mexico,4,4,0,0,NA,400911071,2016-11-20,
236,3,5:46,946,946,Dayo Olabode made Free Throw.,39,40,-1,7,0.4557667891265667,Texas Tech,New Mexico,4,4,0,0,NA,400911071,2016-11-20,Texas Tech
237,3,5:39,939,939,Alex Lapeyrolerie missed Three Point Jumper.,39,40,-1,0,0.4555901582118864,Texas Tech,New Mexico,4,4,0,0,NA,400911071,2016-11-20,
238,3,5:39,939,939,Ivonne Cook-Taylor Defensive Rebound.,39,40,-1,17,0.4555901582118864,Texas Tech,New Mexico,4,4,0,0,NA,400911071,2016-11-20,
239,3,5:22,922,922,Ivonne Cook-Taylor missed Jumper.,39,40,-1,0,0.45518294812495075,Texas Tech,New Mexico,4,4,0,0,NA,400911071,2016-11-20,
240,3,5:22,922,922,Jaisa Nunn Defensive Rebound.,39,40,-1,9,0.45518294812495075,Texas Tech,New Mexico,4,4,0,0,NA,400911071,2016-11-20,
241,3,5:13,913,913,Foul on Ivonne Cook-Taylor.,39,40,-1,0,0.454977273495301,Texas Tech,New Mexico,4,4,0,0,NA,400911071,2016-11-20,
242,3,5:13,913,913,Cherise Beynon missed Free Throw.,39,40,-1,0,0.454977273495301,Texas Tech,New Mexico,4,4,0,0,NA,400911071,2016-11-20,
243,3,5:13,913,913,New Mexico Deadball Team Rebound.,39,40,-1,0,0.454977273495301,Texas Tech,New Mexico,4,4,0,0,NA,400911071,2016-11-20,
244,3,5:13,913,913,Cherise Beynon missed Free Throw.,39,40,-1,0,0.454977273495301,Texas Tech,New Mexico,4,4,0,0,NA,400911071,2016-11-20,
245,3,5:13,913,913,Arella Guirantes Defensive Rebound.,39,40,-1,31,0.454977273495301,Texas Tech,New Mexico,4,4,0,0,NA,400911071,2016-11-20,
246,3,4:42,882,882,Arella Guirantes made Layup.,41,40,1,4,0.5457021486991778,Texas Tech,New Mexico,4,4,0,0,NA,400911071,2016-11-20,Texas Tech
247,3,4:38,878,878,Cherise Beynon missed Layup.,41,40,1,0,0.5457885863834978,Texas Tech,New Mexico,4,4,0,0,NA,400911071,2016-11-20,
248,3,4:38,878,878,Texas Tech Defensive Rebound.,41,40,1,2,0.5457885863834978,Texas Tech,New Mexico,4,4,0,0,NA,400911071,2016-11-20,
249,3,4:36,876,876,Official TV Timeout,41,40,1,17,0.5458318472347176,Texas Tech,New Mexico,4,4,0,0,NA,400911071,2016-11-20,
250,3,4:19,859,859,Jada Terry made Layup.,43,40,3,7,0.63553211048734215,Texas Tech,New Mexico,4,4,0,0,NA,400911071,2016-11-20,Texas Tech
251,3,4:12,852,852,Foul on Grayson Bright.,43,40,3,0,0.6359699570674832,Texas Tech,New Mexico,4,4,0,0,NA,400911071,2016-11-20,
252,3,4:12,852,852,Cherise Beynon made Free Throw.,43,41,2,0,0.5919284606319891,Texas Tech,New Mexico,4,4,0,0,NA,400911071,2016-11-20,New Mexico
253,3,4:12,852,852,Cherise Beynon made Free Throw.,43,42,1,14,0.5463593740600178,Texas Tech,New Mexico,4,4,0,0,NA,400911071,2016-11-20,New Mexico
254,3,3:58,838,838,Dayo Olabode made Jumper. Assisted by Larryn Brooks.,45,42,3,7,0.6368716891785073,Texas Tech,New Mexico,4,4,0,0,NA,400911071,2016-11-20,Texas Tech
255,3,3:51,831,831,Cherise Beynon missed Three Point Jumper.,45,42,3,0,0.637339366764226,Texas Tech,New Mexico,4,4,0,0,NA,400911071,2016-11-20,
256,3,3:51,831,831,Jada Terry Defensive Rebound.,45,42,3,24,0.637339366764226,Texas Tech,New Mexico,4,4,0,0,NA,400911071,2016-11-20,
257,3,3:27,807,807,Recee' Caldwell missed Jumper.,45,42,3,0,0.6390586178552988,Texas Tech,New Mexico,4,4,0,0,NA,400911071,2016-11-20,
258,3,3:27,807,807,Richelle van der Keijl Defensive Rebound.,45,42,3,5,0.6390586178552988,Texas Tech,New Mexico,4,4,0,0,NA,400911071,2016-11-20,
259,3,3:22,802,802,Foul on Dayo Olabode.,45,42,3,4,0.6394441224411944,Texas Tech,New Mexico,4,4,0,0,NA,400911071,2016-11-20,
260,3,3:18,798,798,Alex Lapeyrolerie missed Three Point Jumper.,45,42,3,0,0.6397603894648966,Texas Tech,New Mexico,4,4,0,0,NA,400911071,2016-11-20,
261,3,3:18,798,798,Recee' Caldwell Defensive Rebound.,45,42,3,19,0.6397603894648966,Texas Tech,New Mexico,4,4,0,0,NA,400911071,2016-11-20,
262,3,2:59,779,779,Jada Terry made Layup. Assisted by Arella Guirantes.,47,42,5,9,0.7248907412963657,Texas Tech,New Mexico,4,4,0,0,NA,400911071,2016-11-20,Texas Tech
263,3,2:50,770,770,Cherise Beynon missed Layup.,47,42,5,0,0.7260900631414965,Texas Tech,New Mexico,4,4,0,0,NA,400911071,2016-11-20,
264,3,2:50,770,770,Cherise Beynon Offensive Rebound.,47,42,5,5,0.7260900631414965,Texas Tech,New Mexico,4,4,0,0,NA,400911071,2016-11-20,
265,3,2:45,765,765,Cherise Beynon missed Jumper.,47,42,5,0,0.7267859173697245,Texas Tech,New Mexico,4,4,0,0,NA,400911071,2016-11-20,
266,3,2:45,765,765,Dayo Olabode Defensive Rebound.,47,42,5,7,0.7267859173697245,Texas Tech,New Mexico,4,4,0,0,NA,400911071,2016-11-20,
267,3,2:38,758,758,Dayo Olabode missed Three Point Jumper.,47,42,5,0,0.727797679483552,Texas Tech,New Mexico,4,4,0,0,NA,400911071,2016-11-20,
268,3,2:38,758,758,Arella Guirantes Offensive Rebound.,47,42,5,4,0.727797679483552,Texas Tech,New Mexico,4,4,0,0,NA,400911071,2016-11-20,
269,3,2:34,754,754,Foul on Jayda Bovero.,47,42,5,7,0.7283963281954308,Texas Tech,New Mexico,4,4,0,0,NA,400911071,2016-11-20,
270,3,2:27,747,747,Arella Guirantes Turnover.,47,42,5,12,0.7294814297973601,Texas Tech,New Mexico,4,4,0,0,NA,400911071,2016-11-20,
271,3,2:15,735,735,Mykiel Burleson made Three Point Jumper. Assisted by Jaisa Nunn.,47,45,2,22,0.5988831913549924,Texas Tech,New Mexico,4,4,0,0,NA,400911071,2016-11-20,New Mexico
272,3,1:53,713,713,Arella Guirantes missed Jumper.,47,45,2,0,0.6006888151560321,Texas Tech,New Mexico,4,4,0,0,NA,400911071,2016-11-20,
273,3,1:53,713,713,Texas Tech Offensive Rebound.,47,45,2,11,0.6006888151560321,Texas Tech,New Mexico,4,4,0,0,NA,400911071,2016-11-20,
274,3,1:42,702,702,Recee' Caldwell Turnover.,47,45,2,16,0.6014989291772624,Texas Tech,New Mexico,4,4,0,0,NA,400911071,2016-11-20,
275,3,1:26,686,686,Foul on Kianna Keller.,47,45,2,0,0.602594950263461,Texas Tech,New Mexico,4,4,0,0,NA,400911071,2016-11-20,
276,3,1:26,686,686,Kianna Keller Turnover.,47,45,2,14,0.602594950263461,Texas Tech,New Mexico,4,4,0,0,NA,400911071,2016-11-20,
277,3,1:12,672,672,Larryn Brooks Turnover.,47,45,2,13,0.6035043806177453,Texas Tech,New Mexico,4,4,0,0,NA,400911071,2016-11-20,
278,3,0:59,659,659,Kianna Keller missed Layup.,47,45,2,0,0.6043340150553401,Texas Tech,New Mexico,4,4,0,0,NA,400911071,2016-11-20,
279,3,0:59,659,659,Recee' Caldwell Defensive Rebound.,47,45,2,11,0.6043340150553401,Texas Tech,New Mexico,4,4,0,0,NA,400911071,2016-11-20,
280,3,0:48,648,648,Recee' Caldwell missed Layup.,47,45,2,0,0.605042484415825,Texas Tech,New Mexico,4,4,0,0,NA,400911071,2016-11-20,
281,3,0:48,648,648,Jaisa Nunn Defensive Rebound.,47,45,2,9,0.605042484415825,Texas Tech,New Mexico,4,4,0,0,NA,400911071,2016-11-20,
282,3,0:39,639,639,Alex Lapeyrolerie missed Layup.,47,45,2,0,0.6056369644339262,Texas Tech,New Mexico,4,4,0,0,NA,400911071,2016-11-20,
283,3,0:39,639,639,New Mexico Offensive Rebound.,47,45,2,4,0.6056369644339262,Texas Tech,New Mexico,4,4,0,0,NA,400911071,2016-11-20,
284,3,0:35,635,635,Mykiel Burleson missed Three Point Jumper.,47,45,2,0,0.6059076426631723,Texas Tech,New Mexico,4,4,0,0,NA,400911071,2016-11-20,
285,3,0:35,635,635,Ionna McKenzie Defensive Rebound.,47,45,2,32,0.6059076426631723,Texas Tech,New Mexico,4,4,0,0,NA,400911071,2016-11-20,
286,3,0:03,603,603,Texas Tech  Turnover.,47,45,2,3,0.6083066085062183,Texas Tech,New Mexico,4,4,0,0,NA,400911071,2016-11-20,
287,3,0:00,600,600,End of 3rd Quarter,47,45,2,10,0.6085599051970726,Texas Tech,New Mexico,4,4,0,0,NA,400911071,2016-11-20,
288,4,9:50,590,590,Richelle van der Keijl missed Three Point Jumper.,47,45,2,0,0.6094494884371889,Texas Tech,New Mexico,5,5,0,0,NA,400911071,2016-11-20,
289,4,9:50,590,590,Jada Terry Defensive Rebound.,47,45,2,3,0.6094494884371889,Texas Tech,New Mexico,5,5,0,0,NA,400911071,2016-11-20,
290,4,9:47,587,587,Jada Terry Turnover.,47,45,2,1,0.6097310140629838,Texas Tech,New Mexico,5,5,0,0,NA,400911071,2016-11-20,
291,4,9:46,586,586,Richelle van der Keijl Steal.,47,45,2,5,0.6098264545977161,Texas Tech,New Mexico,5,5,0,0,NA,400911071,2016-11-20,
292,4,9:41,581,581,Mykiel Burleson made Layup.,47,47,0,26,0.5,Texas Tech,New Mexico,5,5,0,0,NA,400911071,2016-11-20,New Mexico
293,4,9:15,555,555,Larryn Brooks missed Layup.,47,47,0,0,0.5,Texas Tech,New Mexico,5,5,0,0,NA,400911071,2016-11-20,
294,4,9:15,555,555,Mykiel Burleson Defensive Rebound.,47,47,0,4,0.5,Texas Tech,New Mexico,5,5,0,0,NA,400911071,2016-11-20,
295,4,9:11,551,551,Foul on Brittany Brewer.,47,47,0,9,0.5,Texas Tech,New Mexico,5,5,0,0,NA,400911071,2016-11-20,
296,4,9:02,542,542,Jaisa Nunn made Layup.,47,49,-2,16,0.3851107089477924,Texas Tech,New Mexico,5,5,0,0,NA,400911071,2016-11-20,New Mexico
297,4,8:46,526,526,Ivonne Cook-Taylor missed Jumper.,47,49,-2,0,0.3833494514761642,Texas Tech,New Mexico,5,5,0,0,NA,400911071,2016-11-20,
298,4,8:46,526,526,Jada Terry Offensive Rebound.,47,49,-2,5,0.3833494514761642,Texas Tech,New Mexico,5,5,0,0,NA,400911071,2016-11-20,
299,4,8:41,521,521,Jada Terry missed Jumper.,47,49,-2,0,0.3828475242940222,Texas Tech,New Mexico,5,5,0,0,NA,400911071,2016-11-20,
300,4,8:41,521,521,Jada Terry Offensive Rebound.,47,49,-2,5,0.3828475242940222,Texas Tech,New Mexico,5,5,0,0,NA,400911071,2016-11-20,
301,4,8:36,516,516,Ivonne Cook-Taylor made Jumper. Assisted by Arella Guirantes.,49,49,0,15,0.5,Texas Tech,New Mexico,5,5,0,0,NA,400911071,2016-11-20,Texas Tech
302,4,8:21,501,501,Jayda Bovero Turnover.,49,49,0,14,0.5,Texas Tech,New Mexico,5,5,0,0,NA,400911071,2016-11-20,
303,4,8:07,487,487,Jada Terry missed Jumper.,49,49,0,0,0.5,Texas Tech,New Mexico,5,5,0,0,NA,400911071,2016-11-20,
304,4,8:07,487,487,Richelle van der Keijl Defensive Rebound.,49,49,0,6,0.5,Texas Tech,New Mexico,5,5,0,0,NA,400911071,2016-11-20,
305,4,8:01,481,481,Cherise Beynon missed Layup.,49,49,0,0,0.5,Texas Tech,New Mexico,5,5,0,0,NA,400911071,2016-11-20,
306,4,8:01,481,481,Texas Tech Defensive Rebound.,49,49,0,20,0.5,Texas Tech,New Mexico,5,5,0,0,NA,400911071,2016-11-20,
307,4,7:41,461,461,Arella Guirantes missed Jumper.,49,49,0,0,0.5,Texas Tech,New Mexico,5,5,0,0,NA,400911071,2016-11-20,
308,4,7:41,461,461,Ivonne Cook-Taylor Offensive Rebound.,49,49,0,10,0.5,Texas Tech,New Mexico,5,5,0,0,NA,400911071,2016-11-20,
309,4,7:31,451,451,Recee' Caldwell missed Jumper.,49,49,0,0,0.5,Texas Tech,New Mexico,5,5,0,0,NA,400911071,2016-11-20,
310,4,7:31,451,451,Cherise Beynon Defensive Rebound.,49,49,0,24,0.5,Texas Tech,New Mexico,5,5,0,0,NA,400911071,2016-11-20,
311,4,7:07,427,427,Jaisa Nunn missed Jumper.,49,49,0,0,0.5,Texas Tech,New Mexico,5,5,0,0,NA,400911071,2016-11-20,
312,4,7:07,427,427,Ivonne Cook-Taylor Defensive Rebound.,49,49,0,14,0.5,Texas Tech,New Mexico,5,5,0,0,NA,400911071,2016-11-20,
313,4,6:53,413,413,Recee' Caldwell missed Three Point Jumper.,49,49,0,0,0.5,Texas Tech,New Mexico,5,5,0,0,NA,400911071,2016-11-20,
314,4,6:53,413,413,Jaisa Nunn Defensive Rebound.,49,49,0,8,0.5,Texas Tech,New Mexico,5,5,0,0,NA,400911071,2016-11-20,
315,4,6:45,405,405,Cherise Beynon missed Three Point Jumper.,49,49,0,0,0.5,Texas Tech,New Mexico,5,5,0,0,NA,400911071,2016-11-20,
316,4,6:45,405,405,Recee' Caldwell Defensive Rebound.,49,49,0,9,0.5,Texas Tech,New Mexico,5,5,0,0,NA,400911071,2016-11-20,
317,4,6:36,396,396,Ivonne Cook-Taylor missed Jumper.,49,49,0,0,0.5,Texas Tech,New Mexico,5,5,0,0,NA,400911071,2016-11-20,
318,4,6:36,396,396,Mykiel Burleson Defensive Rebound.,49,49,0,8,0.5,Texas Tech,New Mexico,5,5,0,0,NA,400911071,2016-11-20,
319,4,6:28,388,388,Alex Lapeyrolerie missed Three Point Jumper.,49,49,0,0,0.5,Texas Tech,New Mexico,5,5,0,0,NA,400911071,2016-11-20,
320,4,6:28,388,388,Mykiel Burleson Offensive Rebound.,49,49,0,9,0.5,Texas Tech,New Mexico,5,5,0,0,NA,400911071,2016-11-20,
321,4,6:19,379,379,Richelle van der Keijl made Layup. Assisted by Mykiel Burleson.,49,51,-2,9,0.36278384513351825,Texas Tech,New Mexico,5,5,0,0,NA,400911071,2016-11-20,New Mexico
322,4,6:10,370,370,Texas Tech  Timeout,49,51,-2,5,0.36116985091374765,Texas Tech,New Mexico,4,5,1,0,NA,400911071,2016-11-20,
323,4,6:05,365,365,Arella Guirantes made Layup. Assisted by Larryn Brooks.,51,51,0,6,0.5,Texas Tech,New Mexico,4,5,1,0,NA,400911071,2016-11-20,Texas Tech
324,4,5:59,359,359,Mykiel Burleson made Layup.,51,53,-2,0,0.3590621270299792,Texas Tech,New Mexico,4,5,1,0,NA,400911071,2016-11-20,New Mexico
325,4,5:59,359,359,Foul on Ionna McKenzie.,51,53,-2,0,0.3590621270299792,Texas Tech,New Mexico,4,5,1,0,NA,400911071,2016-11-20,
326,4,5:59,359,359,Mykiel Burleson missed Free Throw.,51,53,-2,0,0.3590621270299792,Texas Tech,New Mexico,4,5,1,0,NA,400911071,2016-11-20,
327,4,5:59,359,359,Larryn Brooks Defensive Rebound.,51,53,-2,27,0.3590621270299792,Texas Tech,New Mexico,4,5,1,0,NA,400911071,2016-11-20,
328,4,5:32,332,332,Recee' Caldwell made Three Point Jumper.,54,53,1,14,0.5752162381897457,Texas Tech,New Mexico,4,5,1,0,NA,400911071,2016-11-20,Texas Tech
329,4,5:18,318,318,Jaisa Nunn Turnover.,54,53,1,1,0.5773447489204293,Texas Tech,New Mexico,4,5,1,0,NA,400911071,2016-11-20,
330,4,5:17,317,317,Arella Guirantes Steal.,54,53,1,0,0.5775103807403125,Texas Tech,New Mexico,4,5,1,0,NA,400911071,2016-11-20,
331,4,5:17,317,317,Arella Guirantes Turnover.,54,53,1,1,0.5775103807403125,Texas Tech,New Mexico,4,5,1,0,NA,400911071,2016-11-20,
332,4,5:16,316,316,Richelle van der Keijl missed Jumper.,54,53,1,0,0.5776779533086999,Texas Tech,New Mexico,4,5,1,0,NA,400911071,2016-11-20,
333,4,5:16,316,316,Ionna McKenzie Defensive Rebound.,54,53,1,9,0.5776779533086999,Texas Tech,New Mexico,4,5,1,0,NA,400911071,2016-11-20,
334,4,5:07,307,307,Recee' Caldwell made Jumper.,56,53,3,10,0.7228661396856231,Texas Tech,New Mexico,4,5,0,0,NA,400911071,2016-11-20,Texas Tech
335,4,4:57,297,297,Jaisa Nunn missed Three Point Jumper.,56,53,3,0,0.725403495604033,Texas Tech,New Mexico,4,5,0,0,NA,400911071,2016-11-20,
336,4,4:57,297,297,Arella Guirantes Defensive Rebound.,56,53,3,3,0.725403495604033,Texas Tech,New Mexico,4,5,0,0,NA,400911071,2016-11-20,
337,4,4:54,294,294,Foul on Mykiel Burleson.,56,53,3,0,0.7257648516591592,Texas Tech,New Mexico,4,5,0,0,NA,400911071,2016-11-20,
338,4,4:54,294,294,Official TV Timeout,56,53,3,20,0.7257648516591592,Texas Tech,New Mexico,4,5,0,0,NA,400911071,2016-11-20,
339,4,4:34,274,274,Jada Terry made Jumper. Assisted by Dayo Olabode.,58,53,5,10,0.8340510148749116,Texas Tech,New Mexico,4,5,0,0,NA,400911071,2016-11-20,Texas Tech
340,4,4:24,264,264,Mykiel Burleson made Layup.,58,55,3,18,0.7231759732130546,Texas Tech,New Mexico,4,5,0,0,NA,400911071,2016-11-20,New Mexico
341,4,4:06,246,246,Recee' Caldwell made Three Point Jumper.,61,55,6,10,0.8688831260604569,Texas Tech,New Mexico,4,5,0,0,NA,400911071,2016-11-20,Texas Tech
342,4,3:56,236,236,Cherise Beynon missed Layup.,61,55,6,0,0.8682065488073258,Texas Tech,New Mexico,4,5,0,0,NA,400911071,2016-11-20,
343,4,3:56,236,236,Dayo Olabode Defensive Rebound.,61,55,6,12,0.8682065488073258,Texas Tech,New Mexico,4,5,0,0,NA,400911071,2016-11-20,
344,4,3:44,224,224,Recee' Caldwell missed Layup.,61,55,6,0,0.8696199224542785,Texas Tech,New Mexico,4,5,0,0,NA,400911071,2016-11-20,
345,4,3:44,224,224,Kianna Keller Block.,61,55,6,1,0.8696199224542785,Texas Tech,New Mexico,4,5,0,0,NA,400911071,2016-11-20,
346,4,3:43,223,223,Texas Tech Offensive Rebound.,61,55,6,15,0.8698770562270444,Texas Tech,New Mexico,4,5,0,0,NA,400911071,2016-11-20,
347,4,3:28,208,208,Recee' Caldwell missed Three Point Jumper.,61,55,6,0,0.8768466665471961,Texas Tech,New Mexico,4,5,0,0,NA,400911071,2016-11-20,
348,4,3:28,208,208,Jada Terry Offensive Rebound.,61,55,6,1,0.8768466665471961,Texas Tech,New Mexico,4,5,0,0,NA,400911071,2016-11-20,
349,4,3:27,207,207,Foul on Jaisa Nunn.,61,55,6,19,0.8775343885460694,Texas Tech,New Mexico,4,5,0,0,NA,400911071,2016-11-20,
350,4,3:08,188,188,Arella Guirantes made Jumper.,63,55,8,7,0.9464328954770416,Texas Tech,New Mexico,4,5,0,0,NA,400911071,2016-11-20,Texas Tech
351,4,3:01,181,181,Cherise Beynon missed Three Point Jumper.,63,55,8,0,0.9520808894075475,Texas Tech,New Mexico,4,5,0,0,NA,400911071,2016-11-20,
352,4,3:01,181,181,Arella Guirantes Defensive Rebound.,63,55,8,30,0.9520808894075475,Texas Tech,New Mexico,4,5,0,0,NA,400911071,2016-11-20,
353,4,2:31,151,151,Foul on Jaisa Nunn.,63,55,8,0,0.9716027801953313,Texas Tech,New Mexico,4,5,0,0,NA,400911071,2016-11-20,
354,4,2:31,151,151,Arella Guirantes made Free Throw.,64,55,9,0,0.9815530639774535,Texas Tech,New Mexico,4,5,0,0,NA,400911071,2016-11-20,Texas Tech
355,4,2:31,151,151,Arella Guirantes made Free Throw.,65,55,10,11,0.9880596513669201,Texas Tech,New Mexico,4,5,0,0,NA,400911071,2016-11-20,Texas Tech
356,4,2:20,140,140,Mykiel Burleson made Three Point Jumper. Assisted by Alex Lapeyrolerie.,65,58,7,2,0.9641708089547514,Texas Tech,New Mexico,4,5,0,0,NA,400911071,2016-11-20,New Mexico
357,4,2:18,138,138,New Mexico  Timeout,65,58,7,23,0.9654885288239164,Texas Tech,New Mexico,4,4,0,1,NA,400911071,2016-11-20,
358,4,1:55,115,115,Recee' Caldwell made Jumper.,67,58,9,11,0.9928670119412244,Texas Tech,New Mexico,4,4,0,1,NA,400911071,2016-11-20,Texas Tech
359,4,1:44,104,104,Mykiel Burleson missed Three Point Jumper.,67,58,9,0,0.9950784447461183,Texas Tech,New Mexico,4,4,0,1,NA,400911071,2016-11-20,
360,4,1:44,104,104,Recee' Caldwell Defensive Rebound.,67,58,9,26,0.9950784447461183,Texas Tech,New Mexico,4,4,0,1,NA,400911071,2016-11-20,
361,4,1:18,78,78,Dayo Olabode missed Three Point Jumper.,67,58,9,0,0.9982500060461196,Texas Tech,New Mexico,4,4,0,1,NA,400911071,2016-11-20,
362,4,1:18,78,78,Arella Guirantes Offensive Rebound.,67,58,9,26,0.9982500060461196,Texas Tech,New Mexico,4,4,0,1,NA,400911071,2016-11-20,
363,4,0:52,52,52,Recee' Caldwell made Layup.,69,58,11,3,0.9999033526695291,Texas Tech,New Mexico,4,4,0,0,NA,400911071,2016-11-20,Texas Tech
364,4,0:49,49,49,Kianna Keller Turnover.,69,58,11,1,0.9999197323091844,Texas Tech,New Mexico,4,4,0,0,NA,400911071,2016-11-20,
365,4,0:48,48,48,Jada Terry Steal.,69,58,11,0,0.9999246060047914,Texas Tech,New Mexico,4,4,0,0,NA,400911071,2016-11-20,
366,4,0:48,48,48,Foul on Alex Lapeyrolerie.,69,58,11,23,0.9999246060047914,Texas Tech,New Mexico,4,4,0,0,NA,400911071,2016-11-20,
367,4,0:25,25,25,Foul on Kianna Keller.,69,58,11,0,0.9999838614202653,Texas Tech,New Mexico,4,4,0,0,NA,400911071,2016-11-20,
368,4,0:25,25,25,Jada Terry missed Free Throw.,69,58,11,0,0.9999838614202653,Texas Tech,New Mexico,4,4,0,0,NA,400911071,2016-11-20,
369,4,0:25,25,25,Texas Tech Deadball Team Rebound.,69,58,11,0,0.9999838614202653,Texas Tech,New Mexico,4,4,0,0,NA,400911071,2016-11-20,
370,4,0:25,25,25,Jada Terry missed Free Throw.,69,58,11,0,0.9999838614202653,Texas Tech,New Mexico,4,4,0,0,NA,400911071,2016-11-20,
371,4,0:25,25,25,Jaisa Nunn Defensive Rebound.,69,58,11,1,0.9999838614202653,Texas Tech,New Mexico,4,4,0,0,NA,400911071,2016-11-20,
372,4,0:24,24,24,New Mexico  Timeout,69,58,11,4,0.9999849614293205,Texas Tech,New Mexico,4,3,0,1,NA,400911071,2016-11-20,
373,4,0:20,20,20,Mykiel Burleson missed Three Point Jumper.,69,58,11,0,0.9999887054251725,Texas Tech,New Mexico,4,3,0,1,NA,400911071,2016-11-20,
374,4,0:20,20,20,Arella Guirantes Defensive Rebound.,69,58,11,20,0.9999887054251725,Texas Tech,New Mexico,4,3,0,1,NA,400911071,2016-11-20,
375,4,0:00,0,0,End of Game,69,58,11,0,1,Texas Tech,New Mexico,4,3,0,1,NA,400911071,2016-11-20,
