play_id,period,time_remaining_period,secs_remaining,secs_remaining_absolute,description,home_score,away_score,score_diff,play_length,win_prob,home,away,home_time_out_remaining,away_time_out_remaining,home_timeout_ind,away_timeout_ind,home_favored_by,game_id,date,whichScored
1,1,9:41,2381,2381,Faustine Aifuwa missed Jumper.,0,0,0,0,0.5,LSU,Tennessee,4,4,0,0,NA,401166709,2020-02-13,NA
2,1,9:41,2381,2381,Tamari Key Block.,0,0,0,6,0.5,LSU,Tennessee,4,4,0,0,NA,401166709,2020-02-13,
3,1,9:35,2375,2375,Lou Brown Defensive Rebound.,0,0,0,14,0.5,LSU,Tennessee,4,4,0,0,NA,401166709,2020-02-13,
4,1,9:21,2361,2361,Rennia Davis Turnover.,0,0,0,0,0.5,LSU,Tennessee,4,4,0,0,NA,401166709,2020-02-13,
5,1,9:21,2361,2361,Faustine Aifuwa Steal.,0,0,0,16,0.5,LSU,Tennessee,4,4,0,0,NA,401166709,2020-02-13,
6,1,9:05,2345,2345,Jailin Cherry missed Jumper.,0,0,0,3,0.5,LSU,Tennessee,4,4,0,0,NA,401166709,2020-02-13,
7,1,9:02,2342,2342,Jazmine Massengill Defensive Rebound.,0,0,0,5,0.5,LSU,Tennessee,4,4,0,0,NA,401166709,2020-02-13,
8,1,8:57,2337,2337,Rae Burrell missed Jumper.,0,0,0,3,0.5,LSU,Tennessee,4,4,0,0,NA,401166709,2020-02-13,
9,1,8:54,2334,2334,Khayla Pointer Defensive Rebound.,0,0,0,13,0.5,LSU,Tennessee,4,4,0,0,NA,401166709,2020-02-13,
10,1,8:41,2321,2321,Foul on Tamari Key.,0,0,0,6,0.5,LSU,Tennessee,4,4,0,0,NA,401166709,2020-02-13,
11,1,8:35,2315,2315,Foul on Rae Burrell.,0,0,0,0,0.5,LSU,Tennessee,4,4,0,0,NA,401166709,2020-02-13,
12,1,8:35,2315,2315,Khayla Pointer missed Free Throw.,0,0,0,0,0.5,LSU,Tennessee,4,4,0,0,NA,401166709,2020-02-13,
13,1,8:35,2315,2315,LSU Deadball Team Rebound.,0,0,0,0,0.5,LSU,Tennessee,4,4,0,0,NA,401166709,2020-02-13,
14,1,8:35,2315,2315,Khayla Pointer made Free Throw.,1,0,1,13,0.5229761317984666,LSU,Tennessee,4,4,0,0,NA,401166709,2020-02-13,LSU
15,1,8:22,2302,2302,Jazmine Massengill missed Jumper.,1,0,1,3,0.5231208421619332,LSU,Tennessee,4,4,0,0,NA,401166709,2020-02-13,
16,1,8:19,2299,2299,Rae Burrell Offensive Rebound.,1,0,1,12,0.5231543655278497,LSU,Tennessee,4,4,0,0,NA,401166709,2020-02-13,
17,1,8:07,2287,2287,Foul on Faustine Aifuwa.,1,0,1,3,0.5232889193593527,LSU,Tennessee,4,4,0,0,NA,401166709,2020-02-13,
18,1,8:04,2284,2284,Lou Brown made Jumper. Assisted by Jazmine Massengill.,1,2,-1,12,0.476677330647579,LSU,Tennessee,4,4,0,0,NA,401166709,2020-02-13,Tennessee
19,1,7:52,2272,2272,Khayla Pointer missed Jumper.,1,2,-1,2,0.4765419058740616,LSU,Tennessee,4,4,0,0,NA,401166709,2020-02-13,
20,1,7:50,2270,2270,Jailin Cherry Offensive Rebound.,1,2,-1,16,0.4765192710882224,LSU,Tennessee,4,4,0,0,NA,401166709,2020-02-13,
21,1,7:34,2254,2254,Jailin Cherry made Jumper.,3,2,1,20,0.523662427451084,LSU,Tennessee,4,4,0,0,NA,401166709,2020-02-13,LSU
22,1,7:14,2234,2234,Foul on Rennia Davis.,3,2,1,0,0.5238909811467304,LSU,Tennessee,4,4,0,0,NA,401166709,2020-02-13,
23,1,7:14,2234,2234,Rennia Davis Turnover.,3,2,1,14,0.5238909811467304,LSU,Tennessee,4,4,0,0,NA,401166709,2020-02-13,
24,1,7:00,2220,2220,Jailin Cherry made Jumper.,5,2,3,25,0.571713260398693,LSU,Tennessee,4,4,0,0,NA,401166709,2020-02-13,LSU
25,1,6:35,2195,2195,Rae Burrell missed Jumper.,5,2,3,0,0.5725632195630992,LSU,Tennessee,4,4,0,0,NA,401166709,2020-02-13,
26,1,6:35,2195,2195,Faustine Aifuwa Block.,5,2,3,1,0.5725632195630992,LSU,Tennessee,4,4,0,0,NA,401166709,2020-02-13,
27,1,6:34,2194,2194,Khayla Pointer Defensive Rebound.,5,2,3,0,0.5725973120619123,LSU,Tennessee,4,4,0,0,NA,401166709,2020-02-13,
28,1,6:34,2194,2194,Foul on Rae Burrell.,5,2,3,13,0.5725973120619123,LSU,Tennessee,4,4,0,0,NA,401166709,2020-02-13,
29,1,6:21,2181,2181,Awa Trasi Turnover.,5,2,3,11,0.5730410809822923,LSU,Tennessee,4,4,0,0,NA,401166709,2020-02-13,
30,1,6:10,2170,2170,Tamari Key made Jumper. Assisted by Lou Brown.,5,4,1,0,0.5246306745998974,LSU,Tennessee,4,4,0,0,NA,401166709,2020-02-13,Tennessee
31,1,6:10,2170,2170,Foul on Faustine Aifuwa.,5,4,1,0,0.5246306745998974,LSU,Tennessee,4,4,0,0,NA,401166709,2020-02-13,
32,1,6:10,2170,2170,Tamari Key made Free Throw.,5,5,0,14,0.5,LSU,Tennessee,4,4,0,0,NA,401166709,2020-02-13,Tennessee
33,1,5:56,2156,2156,Khayla Pointer made Layup.,7,5,2,11,0.5494661865413782,LSU,Tennessee,4,4,0,0,NA,401166709,2020-02-13,LSU
34,1,5:45,2145,2145,Tamari Key missed Jumper.,7,5,2,1,0.5497218799510991,LSU,Tennessee,4,4,0,0,NA,401166709,2020-02-13,
35,1,5:44,2144,2144,Tamari Key Offensive Rebound.,7,5,2,2,0.549745172445259,LSU,Tennessee,4,4,0,0,NA,401166709,2020-02-13,
36,1,5:42,2142,2142,Lou Brown made Layup. Assisted by Jazmine Massengill.,7,7,0,29,0.5,LSU,Tennessee,4,4,0,0,NA,401166709,2020-02-13,Tennessee
37,1,5:13,2113,2113,Jaelyn Richard-Harris missed Three Point Jumper.,7,7,0,4,0.5,LSU,Tennessee,4,4,0,0,NA,401166709,2020-02-13,
38,1,5:09,2109,2109,Tamari Key Defensive Rebound.,7,7,0,13,0.5,LSU,Tennessee,4,4,0,0,NA,401166709,2020-02-13,
39,1,4:56,2096,2096,Rennia Davis missed Jumper.,7,7,0,4,0.5,LSU,Tennessee,4,4,0,0,NA,401166709,2020-02-13,
40,1,4:52,2092,2092,Awa Trasi Defensive Rebound.,7,7,0,8,0.5,LSU,Tennessee,4,4,0,0,NA,401166709,2020-02-13,
41,1,4:44,2084,2084,Khayla Pointer missed Jumper.,7,7,0,3,0.5,LSU,Tennessee,4,4,0,0,NA,401166709,2020-02-13,
42,1,4:41,2081,2081,Jalaysha Thomas Offensive Rebound.,7,7,0,15,0.5,LSU,Tennessee,4,4,0,0,NA,401166709,2020-02-13,
43,1,4:26,2066,2066,Official TV Timeout,7,7,0,4,0.5,LSU,Tennessee,4,4,0,0,NA,401166709,2020-02-13,
44,1,4:22,2062,2062,LSU  Turnover.,7,7,0,11,0.5,LSU,Tennessee,4,4,0,0,NA,401166709,2020-02-13,
45,1,4:11,2051,2051,Rennia Davis Turnover.,7,7,0,15,0.5,LSU,Tennessee,4,4,0,0,NA,401166709,2020-02-13,
46,1,3:56,2036,2036,Awa Trasi missed Three Point Jumper.,7,7,0,3,0.5,LSU,Tennessee,4,4,0,0,NA,401166709,2020-02-13,
47,1,3:53,2033,2033,Jordan Horston Defensive Rebound.,7,7,0,11,0.5,LSU,Tennessee,4,4,0,0,NA,401166709,2020-02-13,
48,1,3:42,2022,2022,Jordan Horston Turnover.,7,7,0,0,0.5,LSU,Tennessee,4,4,0,0,NA,401166709,2020-02-13,
49,1,3:42,2022,2022,Khayla Pointer Steal.,7,7,0,4,0.5,LSU,Tennessee,4,4,0,0,NA,401166709,2020-02-13,
50,1,3:38,2018,2018,Khayla Pointer missed Layup.,7,7,0,1,0.5,LSU,Tennessee,4,4,0,0,NA,401166709,2020-02-13,
51,1,3:37,2017,2017,Jaelyn Richard-Harris Offensive Rebound.,7,7,0,2,0.5,LSU,Tennessee,4,4,0,0,NA,401166709,2020-02-13,
52,1,3:35,2015,2015,Foul on Jaiden McCoy.,7,7,0,0,0.5,LSU,Tennessee,4,4,0,0,NA,401166709,2020-02-13,
53,1,3:35,2015,2015,Khayla Pointer missed Free Throw.,7,7,0,0,0.5,LSU,Tennessee,4,4,0,0,NA,401166709,2020-02-13,
54,1,3:35,2015,2015,LSU Deadball Team Rebound.,7,7,0,0,0.5,LSU,Tennessee,4,4,0,0,NA,401166709,2020-02-13,
55,1,3:35,2015,2015,Khayla Pointer made Free Throw.,8,7,1,19,0.5264889907698167,LSU,Tennessee,4,4,0,0,NA,401166709,2020-02-13,LSU
56,1,3:16,1996,1996,Jaiden McCoy missed Layup.,8,7,1,0,0.5267260105688514,LSU,Tennessee,4,4,0,0,NA,401166709,2020-02-13,
57,1,3:16,1996,1996,Jaelyn Richard-Harris Block.,8,7,1,0,0.5267260105688514,LSU,Tennessee,4,4,0,0,NA,401166709,2020-02-13,
58,1,3:16,1996,1996,LSU Defensive Rebound.,8,7,1,30,0.5267260105688514,LSU,Tennessee,4,4,0,0,NA,401166709,2020-02-13,
59,1,2:46,1966,1966,Khayla Pointer missed Jumper.,8,7,1,2,0.5271052060445058,LSU,Tennessee,4,4,0,0,NA,401166709,2020-02-13,
60,1,2:44,1964,1964,Jalaysha Thomas Offensive Rebound.,8,7,1,0,0.5271307106723907,LSU,Tennessee,4,4,0,0,NA,401166709,2020-02-13,
61,1,2:44,1964,1964,LSU  Turnover.,8,7,1,13,0.5271307106723907,LSU,Tennessee,4,4,0,0,NA,401166709,2020-02-13,
62,1,2:31,1951,1951,Jazmine Massengill missed Layup.,8,7,1,3,0.5272972009707604,LSU,Tennessee,4,4,0,0,NA,401166709,2020-02-13,
63,1,2:28,1948,1948,Jailin Cherry Defensive Rebound.,8,7,1,20,0.5273357990812544,LSU,Tennessee,4,4,0,0,NA,401166709,2020-02-13,
64,1,2:08,1928,1928,Jalaysha Thomas Turnover.,8,7,1,0,0.5275948448060975,LSU,Tennessee,4,4,0,0,NA,401166709,2020-02-13,
65,1,2:08,1928,1928,Rennia Davis Steal.,8,7,1,28,0.5275948448060975,LSU,Tennessee,4,4,0,0,NA,401166709,2020-02-13,
66,1,1:40,1900,1900,Lou Brown made Three Point Jumper. Assisted by Rennia Davis.,8,10,-2,27,0.444257440700617,LSU,Tennessee,4,4,0,0,NA,401166709,2020-02-13,Tennessee
67,1,1:13,1873,1873,Awa Trasi missed Jumper.,8,10,-2,5,0.44356338365673664,LSU,Tennessee,4,4,0,0,NA,401166709,2020-02-13,
68,1,1:08,1868,1868,Jaiden McCoy Defensive Rebound.,8,10,-2,11,0.4434346812096754,LSU,Tennessee,4,4,0,0,NA,401166709,2020-02-13,
69,1,0:57,1857,1857,Jordan Horston missed Three Point Jumper.,8,10,-2,2,0.44315115138806743,LSU,Tennessee,4,4,0,0,NA,401166709,2020-02-13,
70,1,0:55,1855,1855,Jaelyn Richard-Harris Defensive Rebound.,8,10,-2,0,0.4430995317453636,LSU,Tennessee,4,4,0,0,NA,401166709,2020-02-13,
71,1,0:55,1855,1855,Foul on Lou Brown.,8,10,-2,0,0.4430995317453636,LSU,Tennessee,4,4,0,0,NA,401166709,2020-02-13,
72,1,0:55,1855,1855,Jaelyn Richard-Harris missed Free Throw.,8,10,-2,0,0.4430995317453636,LSU,Tennessee,4,4,0,0,NA,401166709,2020-02-13,
73,1,0:55,1855,1855,LSU Deadball Team Rebound.,8,10,-2,0,0.4430995317453636,LSU,Tennessee,4,4,0,0,NA,401166709,2020-02-13,
74,1,0:55,1855,1855,Jaelyn Richard-Harris made Free Throw.,9,10,-1,18,0.4714570522650251,LSU,Tennessee,4,4,0,0,NA,401166709,2020-02-13,LSU
75,1,0:37,1837,1837,Jazmine Massengill made Jumper.,9,12,-3,23,0.4144206868220977,LSU,Tennessee,4,4,0,0,NA,401166709,2020-02-13,Tennessee
76,1,0:14,1814,1814,Awa Trasi made Three Point Jumper. Assisted by Khayla Pointer.,12,12,0,14,0.5,LSU,Tennessee,4,4,0,0,NA,401166709,2020-02-13,LSU
77,1,0:00,1800,1800,Jaiden McCoy missed Layup.,12,12,0,0,0.5,LSU,Tennessee,4,4,0,0,NA,401166709,2020-02-13,
78,1,0:00,1800,1800,Khayla Pointer Defensive Rebound.,12,12,0,0,0.5,LSU,Tennessee,4,4,0,0,NA,401166709,2020-02-13,
79,1,0:00,1800,1800,End of 1st Quarter,12,12,0,9,0.5,LSU,Tennessee,4,4,0,0,NA,401166709,2020-02-13,
80,2,9:51,1791,1791,Awa Trasi missed Jumper.,12,12,0,4,0.5,LSU,Tennessee,4,4,0,0,NA,401166709,2020-02-13,
81,2,9:47,1787,1787,Awa Trasi Offensive Rebound.,12,12,0,6,0.5,LSU,Tennessee,4,4,0,0,NA,401166709,2020-02-13,
82,2,9:41,1781,1781,Awa Trasi missed Jumper.,12,12,0,3,0.5,LSU,Tennessee,4,4,0,0,NA,401166709,2020-02-13,
83,2,9:38,1778,1778,Rennia Davis Defensive Rebound.,12,12,0,7,0.5,LSU,Tennessee,4,4,0,0,NA,401166709,2020-02-13,
84,2,9:31,1771,1771,Kamera Harris made Jumper. Assisted by Jaiden McCoy.,12,14,-2,21,0.4408944948338006,LSU,Tennessee,4,4,0,0,NA,401166709,2020-02-13,Tennessee
85,2,9:10,1750,1750,Awa Trasi made Three Point Jumper. Assisted by Khayla Pointer.,15,14,1,17,0.5299440535974776,LSU,Tennessee,4,4,0,0,NA,401166709,2020-02-13,LSU
86,2,8:53,1733,1733,Jessie Rennie made Three Point Jumper. Assisted by Jordan Horston.,15,17,-2,16,0.4398585628516246,LSU,Tennessee,4,4,0,0,NA,401166709,2020-02-13,Tennessee
87,2,8:37,1717,1717,Khayla Pointer made Jumper. Assisted by Jailin Cherry.,17,17,0,20,0.5,LSU,Tennessee,4,4,0,0,NA,401166709,2020-02-13,LSU
88,2,8:17,1697,1697,Jaiden McCoy made Layup. Assisted by Rennia Davis.,17,19,-2,28,0.43884436774536145,LSU,Tennessee,4,4,0,0,NA,401166709,2020-02-13,Tennessee
89,2,7:49,1669,1669,Jailin Cherry missed Jumper.,17,19,-2,0,0.4380456413367831,LSU,Tennessee,4,4,0,0,NA,401166709,2020-02-13,
90,2,7:49,1669,1669,Tennessee Defensive Rebound.,17,19,-2,12,0.4380456413367831,LSU,Tennessee,4,4,0,0,NA,401166709,2020-02-13,
91,2,7:37,1657,1657,Jordan Horston missed Jumper.,17,19,-2,3,0.4377118700852333,LSU,Tennessee,4,4,0,0,NA,401166709,2020-02-13,
92,2,7:34,1654,1654,Kamera Harris Offensive Rebound.,17,19,-2,0,0.43762913090404526,LSU,Tennessee,4,4,0,0,NA,401166709,2020-02-13,
93,2,7:34,1654,1654,Kamera Harris missed Layup.,17,19,-2,0,0.43762913090404526,LSU,Tennessee,4,4,0,0,NA,401166709,2020-02-13,
94,2,7:34,1654,1654,LSU Defensive Rebound.,17,19,-2,18,0.43762913090404526,LSU,Tennessee,4,4,0,0,NA,401166709,2020-02-13,
95,2,7:16,1636,1636,Awa Trasi missed Jumper.,17,19,-2,0,0.4371374757034874,LSU,Tennessee,4,4,0,0,NA,401166709,2020-02-13,
96,2,7:16,1636,1636,Jordan Horston Block.,17,19,-2,5,0.4371374757034874,LSU,Tennessee,4,4,0,0,NA,401166709,2020-02-13,
97,2,7:11,1631,1631,Awa Trasi Offensive Rebound.,17,19,-2,2,0.4370020881483216,LSU,Tennessee,4,4,0,0,NA,401166709,2020-02-13,
98,2,7:09,1629,1629,Awa Trasi missed Three Point Jumper.,17,19,-2,3,0.4369480454900342,LSU,Tennessee,4,4,0,0,NA,401166709,2020-02-13,
99,2,7:06,1626,1626,Kamera Harris Defensive Rebound.,17,19,-2,5,0.4368670883143523,LSU,Tennessee,4,4,0,0,NA,401166709,2020-02-13,
100,2,7:01,1621,1621,Rennia Davis missed Jumper.,17,19,-2,2,0.4367324083189744,LSU,Tennessee,4,4,0,0,NA,401166709,2020-02-13,
101,2,6:59,1619,1619,Tiara Young Defensive Rebound.,17,19,-2,25,0.4366786106734774,LSU,Tennessee,4,4,0,0,NA,401166709,2020-02-13,
102,2,6:34,1594,1594,Mercedes Brooks made Jumper.,19,19,0,15,0.5,LSU,Tennessee,4,4,0,0,NA,401166709,2020-02-13,LSU
103,2,6:19,1579,1579,Rennia Davis made Layup.,19,21,-2,21,0.435604440192275,LSU,Tennessee,4,4,0,0,NA,401166709,2020-02-13,Tennessee
104,2,5:58,1558,1558,Tiara Young made Jumper. Assisted by Jaelyn Richard-Harris.,21,21,0,15,0.5,LSU,Tennessee,4,4,0,0,NA,401166709,2020-02-13,LSU
105,2,5:43,1543,1543,Kasiyahna Kushkituah missed Jumper.,21,21,0,3,0.5,LSU,Tennessee,4,4,0,0,NA,401166709,2020-02-13,
106,2,5:40,1540,1540,Tiara Young Defensive Rebound.,21,21,0,8,0.5,LSU,Tennessee,4,4,0,0,NA,401166709,2020-02-13,
107,2,5:32,1532,1532,Awa Trasi made Three Point Jumper. Assisted by Jaelyn Richard-Harris.,24,21,3,30,0.5978244600998407,LSU,Tennessee,4,4,0,0,NA,401166709,2020-02-13,LSU
108,2,5:02,1502,1502,Kasiyahna Kushkituah missed Layup.,24,21,3,2,0.5990928370854987,LSU,Tennessee,4,4,0,0,NA,401166709,2020-02-13,
109,2,5:00,1500,1500,Kasiyahna Kushkituah Offensive Rebound.,24,21,3,0,0.5991796821583484,LSU,Tennessee,4,4,0,0,NA,401166709,2020-02-13,
110,2,5:00,1500,1500,Foul on Mercedes Brooks.,24,21,3,0,0.5991796821583484,LSU,Tennessee,4,4,0,0,NA,401166709,2020-02-13,
111,2,5:00,1500,1500,Official TV Timeout,24,21,3,0,0.5991796821583484,LSU,Tennessee,4,4,0,0,NA,401166709,2020-02-13,
112,2,5:00,1500,1500,Kasiyahna Kushkituah made Free Throw.,24,22,2,0,0.5666097462963707,LSU,Tennessee,4,4,0,0,NA,401166709,2020-02-13,Tennessee
113,2,5:00,1500,1500,Kasiyahna Kushkituah missed Free Throw.,24,22,2,2,0.5666097462963707,LSU,Tennessee,4,4,0,0,NA,401166709,2020-02-13,
114,2,4:58,1498,1498,Tiara Young Defensive Rebound.,24,22,2,4,0.5666691650524704,LSU,Tennessee,4,4,0,0,NA,401166709,2020-02-13,
115,2,4:54,1494,1494,Khayla Pointer made Jumper. Assisted by Tiara Young.,26,22,4,25,0.6312357405524374,LSU,Tennessee,4,4,0,0,NA,401166709,2020-02-13,LSU
116,2,4:29,1469,1469,Kasiyahna Kushkituah made Jumper. Assisted by Jazmine Massengill.,26,24,2,16,0.5675582882649438,LSU,Tennessee,4,4,0,0,NA,401166709,2020-02-13,Tennessee
117,2,4:13,1453,1453,Khayla Pointer missed Three Point Jumper.,26,24,2,3,0.5680739378803993,LSU,Tennessee,4,4,0,0,NA,401166709,2020-02-13,
118,2,4:10,1450,1450,Kasiyahna Kushkituah Defensive Rebound.,26,24,2,12,0.5681728541516072,LSU,Tennessee,4,4,0,0,NA,401166709,2020-02-13,
119,2,3:58,1438,1438,Lou Brown missed Jumper.,26,24,2,2,0.5685646516002714,LSU,Tennessee,4,4,0,0,NA,401166709,2020-02-13,
120,2,3:56,1436,1436,Jalaysha Thomas Defensive Rebound.,26,24,2,10,0.5686289764534042,LSU,Tennessee,4,4,0,0,NA,401166709,2020-02-13,
121,2,3:46,1426,1426,Karli Seay missed Jumper.,26,24,2,2,0.5689468882977077,LSU,Tennessee,4,4,0,0,NA,401166709,2020-02-13,
122,2,3:44,1424,1424,Rennia Davis Defensive Rebound.,26,24,2,17,0.5690097824007856,LSU,Tennessee,4,4,0,0,NA,401166709,2020-02-13,
123,2,3:27,1407,1407,Lou Brown missed Jumper.,26,24,2,5,0.5695366300108091,LSU,Tennessee,4,4,0,0,NA,401166709,2020-02-13,
124,2,3:22,1402,1402,Tamari Key Offensive Rebound.,26,24,2,0,0.5696893706003575,LSU,Tennessee,4,4,0,0,NA,401166709,2020-02-13,
125,2,3:22,1402,1402,Tamari Key made Layup.,26,26,0,29,0.5,LSU,Tennessee,4,4,0,0,NA,401166709,2020-02-13,Tennessee
126,2,2:53,1373,1373,Tiara Young made Jumper.,28,26,2,23,0.5705635125419892,LSU,Tennessee,4,4,0,0,NA,401166709,2020-02-13,LSU
127,2,2:30,1350,1350,Rennia Davis made Jumper.,28,28,0,29,0.5,LSU,Tennessee,4,4,0,0,NA,401166709,2020-02-13,Tennessee
128,2,2:01,1321,1321,Awa Trasi missed Three Point Jumper.,28,28,0,3,0.5,LSU,Tennessee,4,4,0,0,NA,401166709,2020-02-13,
129,2,1:58,1318,1318,Jazmine Massengill Defensive Rebound.,28,28,0,8,0.5,LSU,Tennessee,4,4,0,0,NA,401166709,2020-02-13,
130,2,1:50,1310,1310,Foul on Tiara Young.,28,28,0,0,0.5,LSU,Tennessee,4,4,0,0,NA,401166709,2020-02-13,
131,2,1:50,1310,1310,Lou Brown made Free Throw.,28,29,-1,0,0.46356567553874145,LSU,Tennessee,4,4,0,0,NA,401166709,2020-02-13,Tennessee
132,2,1:50,1310,1310,Lou Brown made Free Throw.,28,30,-2,21,0.42751622830746183,LSU,Tennessee,4,4,0,0,NA,401166709,2020-02-13,Tennessee
133,2,1:29,1289,1289,Awa Trasi made Jumper.,30,30,0,14,0.5,LSU,Tennessee,4,4,0,0,NA,401166709,2020-02-13,LSU
134,2,1:15,1275,1275,Rennia Davis missed Jumper.,30,30,0,4,0.5,LSU,Tennessee,4,4,0,0,NA,401166709,2020-02-13,
135,2,1:11,1271,1271,Khayla Pointer Defensive Rebound.,30,30,0,5,0.5,LSU,Tennessee,4,4,0,0,NA,401166709,2020-02-13,
136,2,1:06,1266,1266,Foul on Jordan Horston.,30,30,0,0,0.5,LSU,Tennessee,4,4,0,0,NA,401166709,2020-02-13,
137,2,1:06,1266,1266,Tiara Young made Free Throw.,31,30,1,0,0.5371768054917166,LSU,Tennessee,4,4,0,0,NA,401166709,2020-02-13,LSU
138,2,1:06,1266,1266,Tiara Young made Free Throw.,32,30,2,25,0.5739448100980645,LSU,Tennessee,4,4,0,0,NA,401166709,2020-02-13,LSU
139,2,0:41,1241,1241,Foul on Tiara Young.,32,30,2,0,0.5748552562656751,LSU,Tennessee,4,4,0,0,NA,401166709,2020-02-13,
140,2,0:41,1241,1241,Jordan Horston missed Free Throw.,32,30,2,0,0.5748552562656751,LSU,Tennessee,4,4,0,0,NA,401166709,2020-02-13,
141,2,0:41,1241,1241,Tennessee Deadball Team Rebound.,32,30,2,1,0.5748552562656751,LSU,Tennessee,4,4,0,0,NA,401166709,2020-02-13,
142,2,0:40,1240,1240,Jordan Horston missed Free Throw.,32,30,2,2,0.5748931744104848,LSU,Tennessee,4,4,0,0,NA,401166709,2020-02-13,
143,2,0:38,1238,1238,Mercedes Brooks Defensive Rebound.,32,30,2,20,0.5749693836191339,LSU,Tennessee,4,4,0,0,NA,401166709,2020-02-13,
144,2,0:18,1218,1218,Khayla Pointer made Jumper.,34,30,4,13,0.6481202287002746,LSU,Tennessee,4,4,0,0,NA,401166709,2020-02-13,LSU
145,2,0:05,1205,1205,Foul on Khayla Pointer.,34,30,4,0,0.649131248360961,LSU,Tennessee,4,4,0,0,NA,401166709,2020-02-13,
146,2,0:05,1205,1205,Tamari Key made Free Throw.,34,31,3,0,0.6133502802168322,LSU,Tennessee,4,4,0,0,NA,401166709,2020-02-13,Tennessee
147,2,0:05,1205,1205,Tamari Key made Free Throw.,34,32,2,4,0.5763021121086765,LSU,Tennessee,4,4,0,0,NA,401166709,2020-02-13,Tennessee
148,2,0:01,1201,1201,Jaelyn Richard-Harris Turnover.,34,32,2,0,0.5764680567375442,LSU,Tennessee,4,4,0,0,NA,401166709,2020-02-13,
149,2,0:01,1201,1201,Rennia Davis Steal.,34,32,2,1,0.5764680567375442,LSU,Tennessee,4,4,0,0,NA,401166709,2020-02-13,
150,2,0:00,1200,1200,End of 2nd Quarter,34,32,2,12,0.5765093285143758,LSU,Tennessee,4,4,0,0,NA,401166709,2020-02-13,
151,3,9:48,1188,1188,Lou Brown missed Jumper.,34,32,2,7,0.5769984931950138,LSU,Tennessee,5,5,0,0,NA,401166709,2020-02-13,
152,3,9:41,1181,1181,Faustine Aifuwa Defensive Rebound.,34,32,2,13,0.5772792349167439,LSU,Tennessee,5,5,0,0,NA,401166709,2020-02-13,
153,3,9:28,1168,1168,Jaelyn Richard-Harris missed Layup.,34,32,2,0,0.5777934660014936,LSU,Tennessee,5,5,0,0,NA,401166709,2020-02-13,
154,3,9:28,1168,1168,Tamari Key Block.,34,32,2,0,0.5777934660014936,LSU,Tennessee,5,5,0,0,NA,401166709,2020-02-13,
155,3,9:28,1168,1168,LSU Offensive Rebound.,34,32,2,7,0.5777934660014936,LSU,Tennessee,5,5,0,0,NA,401166709,2020-02-13,
156,3,9:21,1161,1161,Awa Trasi missed Three Point Jumper.,34,32,2,3,0.5780673533458943,LSU,Tennessee,5,5,0,0,NA,401166709,2020-02-13,
157,3,9:18,1158,1158,Rennia Davis Defensive Rebound.,34,32,2,7,0.5781842429615593,LSU,Tennessee,5,5,0,0,NA,401166709,2020-02-13,
158,3,9:11,1151,1151,Jazmine Massengill missed Jumper.,34,32,2,3,0.5784561050861952,LSU,Tennessee,5,5,0,0,NA,401166709,2020-02-13,
159,3,9:08,1148,1148,Awa Trasi Defensive Rebound.,34,32,2,8,0.5785723268220714,LSU,Tennessee,5,5,0,0,NA,401166709,2020-02-13,
160,3,9:00,1140,1140,Faustine Aifuwa made Layup. Assisted by Khayla Pointer.,36,32,4,20,0.6539322327370383,LSU,Tennessee,5,5,0,0,NA,401166709,2020-02-13,LSU
161,3,8:40,1120,1120,Rae Burrell missed Jumper.,36,32,4,3,0.6553686526543422,LSU,Tennessee,5,5,0,0,NA,401166709,2020-02-13,
162,3,8:37,1117,1117,Faustine Aifuwa Defensive Rebound.,36,32,4,4,0.6555849656082006,LSU,Tennessee,5,5,0,0,NA,401166709,2020-02-13,
163,3,8:33,1113,1113,Awa Trasi Turnover.,36,32,4,19,0.6558740370139131,LSU,Tennessee,5,5,0,0,NA,401166709,2020-02-13,
164,3,8:14,1094,1094,Foul on Khayla Pointer.,36,32,4,12,0.6572619607533846,LSU,Tennessee,5,5,0,0,NA,401166709,2020-02-13,
165,3,8:02,1082,1082,Tamari Key missed Layup.,36,32,4,0,0.6581564510742942,LSU,Tennessee,5,5,0,0,NA,401166709,2020-02-13,
166,3,8:02,1082,1082,Faustine Aifuwa Block.,36,32,4,1,0.6581564510742942,LSU,Tennessee,5,5,0,0,NA,401166709,2020-02-13,
167,3,8:01,1081,1081,Khayla Pointer Defensive Rebound.,36,32,4,0,0.6582317857063557,LSU,Tennessee,5,5,0,0,NA,401166709,2020-02-13,
168,3,8:01,1081,1081,Foul on Rae Burrell.,36,32,4,19,0.6582317857063557,LSU,Tennessee,5,5,0,0,NA,401166709,2020-02-13,
169,3,7:42,1062,1062,Faustine Aifuwa made Jumper.,38,32,6,23,0.7296559656071265,LSU,Tennessee,5,5,0,0,NA,401166709,2020-02-13,LSU
170,3,7:19,1039,1039,Rennia Davis made Jumper.,38,34,4,17,0.6615458709061123,LSU,Tennessee,5,5,0,0,NA,401166709,2020-02-13,Tennessee
171,3,7:02,1022,1022,Faustine Aifuwa missed Jumper.,38,34,4,3,0.6629944645611459,LSU,Tennessee,5,5,0,0,NA,401166709,2020-02-13,
172,3,6:59,1019,1019,Jailin Cherry Offensive Rebound.,38,34,4,16,0.6632579710389936,LSU,Tennessee,5,5,0,0,NA,401166709,2020-02-13,
173,3,6:43,1003,1003,Jailin Cherry missed Layup.,38,34,4,3,0.664707467175814,LSU,Tennessee,5,5,0,0,NA,401166709,2020-02-13,
174,3,6:40,1000,1000,Jordan Horston Defensive Rebound.,38,34,4,6,0.6649880042274091,LSU,Tennessee,5,5,0,0,NA,401166709,2020-02-13,
175,3,6:34,994,994,Tamari Key missed Jumper.,38,34,4,2,0.6655578904525972,LSU,Tennessee,5,5,0,0,NA,401166709,2020-02-13,
176,3,6:32,992,992,Khayla Pointer Defensive Rebound.,38,34,4,20,0.6657505304713511,LSU,Tennessee,5,5,0,0,NA,401166709,2020-02-13,
177,3,6:12,972,972,Khayla Pointer made Layup.,40,34,6,2,0.7402127408942895,LSU,Tennessee,5,5,0,0,NA,401166709,2020-02-13,LSU
178,3,6:10,970,970,Tennessee  Timeout,40,34,6,11,0.7404840247129979,LSU,Tennessee,4,5,1,0,NA,401166709,2020-02-13,
179,3,5:59,959,959,Foul on Awa Trasi.,40,34,6,0,0.7419316465215161,LSU,Tennessee,4,5,1,0,NA,401166709,2020-02-13,
180,3,5:59,959,959,Jaiden McCoy made Free Throw.,40,35,5,0,0.7068278562814981,LSU,Tennessee,4,5,1,0,NA,401166709,2020-02-13,Tennessee
181,3,5:59,959,959,Rennia Davis Turnover.,40,35,5,10,0.7068278562814981,LSU,Tennessee,4,5,1,0,NA,401166709,2020-02-13,
182,3,5:49,949,949,Jailin Cherry missed Jumper.,40,35,5,5,0.7079440002859485,LSU,Tennessee,4,5,1,0,NA,401166709,2020-02-13,
183,3,5:44,944,944,Jordan Horston Defensive Rebound.,40,35,5,5,0.7084798546317377,LSU,Tennessee,4,5,1,0,NA,401166709,2020-02-13,
184,3,5:39,939,939,Jordan Horston Turnover.,40,35,5,14,0.7090023390836687,LSU,Tennessee,4,5,1,0,NA,401166709,2020-02-13,
185,3,5:25,925,925,Awa Trasi made Layup.,42,35,7,10,0.7783852342021799,LSU,Tennessee,4,5,1,0,NA,401166709,2020-02-13,LSU
186,3,5:15,915,915,Foul on Jaiden McCoy.,42,35,7,0,0.7795049076662101,LSU,Tennessee,4,5,1,0,NA,401166709,2020-02-13,
187,3,5:15,915,915,Jaiden McCoy Turnover.,42,35,7,10,0.7795049076662101,LSU,Tennessee,4,5,1,0,NA,401166709,2020-02-13,
188,3,5:05,905,905,Faustine Aifuwa made Layup. Assisted by Khayla Pointer.,44,35,9,0,0.8364027465660258,LSU,Tennessee,4,5,0,0,NA,401166709,2020-02-13,LSU
189,3,5:05,905,905,Foul on Kasiyahna Kushkituah.,44,35,9,1,0.8364027465660258,LSU,Tennessee,4,5,0,0,NA,401166709,2020-02-13,
190,3,5:04,904,904,Faustine Aifuwa missed Free Throw.,44,35,9,3,0.8365124768160598,LSU,Tennessee,4,5,0,0,NA,401166709,2020-02-13,
191,3,5:01,901,901,Jordan Horston Defensive Rebound.,44,35,9,8,0.8368400644454349,LSU,Tennessee,4,5,0,0,NA,401166709,2020-02-13,
192,3,4:53,893,893,Jaiden McCoy missed Jumper.,44,35,9,4,0.8377036665915222,LSU,Tennessee,4,5,0,0,NA,401166709,2020-02-13,
193,3,4:49,889,889,Khayla Pointer Defensive Rebound.,44,35,9,13,0.8381312433012575,LSU,Tennessee,4,5,0,0,NA,401166709,2020-02-13,
194,3,4:36,876,876,Jaelyn Richard-Harris missed Jumper.,44,35,9,3,0.8395105743513045,LSU,Tennessee,4,5,0,0,NA,401166709,2020-02-13,
195,3,4:33,873,873,Jazmine Massengill Defensive Rebound.,44,35,9,6,0.8398282134582513,LSU,Tennessee,4,5,0,0,NA,401166709,2020-02-13,
196,3,4:27,867,867,Rennia Davis made Jumper. Assisted by Kasiyahna Kushkituah.,44,37,7,0,0.7845573764694823,LSU,Tennessee,4,5,0,0,NA,401166709,2020-02-13,Tennessee
197,3,4:27,867,867,Foul on Jaelyn Richard-Harris.,44,37,7,0,0.7845573764694823,LSU,Tennessee,4,5,0,0,NA,401166709,2020-02-13,
198,3,4:27,867,867,Official TV Timeout,44,37,7,0,0.7845573764694823,LSU,Tennessee,4,5,0,0,NA,401166709,2020-02-13,
199,3,4:27,867,867,Rennia Davis made Free Throw.,44,38,6,24,0.7517174158254566,LSU,Tennessee,4,5,0,0,NA,401166709,2020-02-13,Tennessee
200,3,4:03,843,843,Foul on Kasiyahna Kushkituah.,44,38,6,0,0.7541369256770558,LSU,Tennessee,4,5,0,0,NA,401166709,2020-02-13,
201,3,4:03,843,843,Khayla Pointer made Free Throw.,45,38,7,0,0.787111111223585,LSU,Tennessee,4,5,0,0,NA,401166709,2020-02-13,LSU
202,3,4:03,843,843,Khayla Pointer made Free Throw.,46,38,8,14,0.8167376061976133,LSU,Tennessee,4,5,0,0,NA,401166709,2020-02-13,LSU
203,3,3:49,829,829,Jordan Horston made Layup.,46,40,6,0,0.7556260449291836,LSU,Tennessee,4,5,0,0,NA,401166709,2020-02-13,Tennessee
204,3,3:49,829,829,Foul on Jailin Cherry.,46,40,6,0,0.7556260449291836,LSU,Tennessee,4,5,0,0,NA,401166709,2020-02-13,
205,3,3:49,829,829,Jordan Horston made Free Throw.,46,41,5,31,0.7192422018994117,LSU,Tennessee,4,5,0,0,NA,401166709,2020-02-13,Tennessee
206,3,3:18,798,798,Jailin Cherry missed Jumper.,46,41,5,3,0.7225622917223012,LSU,Tennessee,4,5,0,0,NA,401166709,2020-02-13,
