play_id,period,time_remaining_period,secs_remaining,secs_remaining_absolute,description,home_score,away_score,score_diff,play_length,win_prob,home,away,home_time_out_remaining,away_time_out_remaining,home_timeout_ind,away_timeout_ind,home_favored_by,game_id,date,whichScored
1,1,9:43,2383,2383,Grace Vander Weide missed Layup.,0,0,0,4,0.5,Marist,Canisius,4,4,0,0,NA,401178899,2020-02-13,NA
2,1,9:39,2379,2379,Shannon Conely Defensive Rebound.,0,0,0,25,0.5,Marist,Canisius,4,4,0,0,NA,401178899,2020-02-13,
3,1,9:14,2354,2354,AJ Timbers missed Three Point Jumper.,0,0,0,5,0.5,Marist,Canisius,4,4,0,0,NA,401178899,2020-02-13,
4,1,9:09,2349,2349,Shannon Conely Offensive Rebound.,0,0,0,8,0.5,Marist,Canisius,4,4,0,0,NA,401178899,2020-02-13,
5,1,9:01,2341,2341,Shannon Conely Turnover.,0,0,0,8,0.5,Marist,Canisius,4,4,0,0,NA,401178899,2020-02-13,
6,1,8:53,2333,2333,Sarah Barcello missed Three Point Jumper.,0,0,0,4,0.5,Marist,Canisius,4,4,0,0,NA,401178899,2020-02-13,
7,1,8:49,2329,2329,Danielle Sanderlin Defensive Rebound.,0,0,0,5,0.5,Marist,Canisius,4,4,0,0,NA,401178899,2020-02-13,
8,1,8:44,2324,2324,Danielle Sanderlin Turnover.,0,0,0,21,0.5,Marist,Canisius,4,4,0,0,NA,401178899,2020-02-13,
9,1,8:23,2303,2303,Rebekah Hand made Jumper.,2,0,2,29,0.5461208317819461,Marist,Canisius,4,4,0,0,NA,401178899,2020-02-13,Marist
10,1,7:54,2274,2274,Danielle Sanderlin Turnover.,2,0,2,0,0.5467682100997949,Marist,Canisius,4,4,0,0,NA,401178899,2020-02-13,
11,1,7:54,2274,2274,Rebekah Hand Steal.,2,0,2,7,0.5467682100997949,Marist,Canisius,4,4,0,0,NA,401178899,2020-02-13,
12,1,7:47,2267,2267,Willow Duffell Turnover.,2,0,2,29,0.546925639914279,Marist,Canisius,4,4,0,0,NA,401178899,2020-02-13,
13,1,7:18,2238,2238,D'Jhai Patterson-Ricks made Three Point Jumper. Assisted by AJ Timbers.,2,3,-1,22,0.4761548477597399,Marist,Canisius,4,4,0,0,NA,401178899,2020-02-13,Canisius
14,1,6:56,2216,2216,Rebekah Hand missed Three Point Jumper.,2,3,-1,4,0.4759021236633784,Marist,Canisius,4,4,0,0,NA,401178899,2020-02-13,
15,1,6:52,2212,2212,Canisius Defensive Rebound.,2,3,-1,17,0.4758560091939416,Marist,Canisius,4,4,0,0,NA,401178899,2020-02-13,
16,1,6:35,2195,2195,AJ Timbers Turnover.,2,3,-1,0,0.4756595249308129,Marist,Canisius,4,4,0,0,NA,401178899,2020-02-13,
17,1,6:35,2195,2195,Grace Vander Weide Steal.,2,3,-1,6,0.4756595249308129,Marist,Canisius,4,4,0,0,NA,401178899,2020-02-13,
18,1,6:29,2189,2189,Grace Vander Weide made Layup.,4,3,1,7,0.5244099985205071,Marist,Canisius,4,4,0,0,NA,401178899,2020-02-13,Marist
19,1,6:22,2182,2182,Foul on Sarah Barcello.,4,3,1,4,0.5244912133353336,Marist,Canisius,4,4,0,0,NA,401178899,2020-02-13,
20,1,6:18,2178,2178,AJ Timbers missed Jumper.,4,3,1,3,0.5245376688636048,Marist,Canisius,4,4,0,0,NA,401178899,2020-02-13,
21,1,6:15,2175,2175,Grace Vander Weide Defensive Rebound.,4,3,1,3,0.5245725316816549,Marist,Canisius,4,4,0,0,NA,401178899,2020-02-13,
22,1,6:12,2172,2172,Hannah Hand missed Three Point Jumper.,4,3,1,3,0.5246074118573106,Marist,Canisius,4,4,0,0,NA,401178899,2020-02-13,
23,1,6:09,2169,2169,Danielle Sanderlin Defensive Rebound.,4,3,1,15,0.5246423096444954,Marist,Canisius,4,4,0,0,NA,401178899,2020-02-13,
24,1,5:54,2154,2154,D'Jhai Patterson-Ricks made Jumper.,4,5,-1,17,0.4751827076689996,Marist,Canisius,4,4,0,0,NA,401178899,2020-02-13,Canisius
25,1,5:37,2137,2137,Molly Smith missed Three Point Jumper.,4,5,-1,4,0.4749833070103019,Marist,Canisius,4,4,0,0,NA,401178899,2020-02-13,
26,1,5:33,2133,2133,Hannah Hand Offensive Rebound.,4,5,-1,6,0.47493621277391146,Marist,Canisius,4,4,0,0,NA,401178899,2020-02-13,
27,1,5:27,2127,2127,Grace Vander Weide made Three Point Jumper. Assisted by Willow Duffell.,7,5,2,7,0.5501424093407381,Marist,Canisius,4,4,0,0,NA,401178899,2020-02-13,Marist
28,1,5:20,2120,2120,D'Jhai Patterson-Ricks Turnover.,7,5,2,11,0.5503066952226568,Marist,Canisius,4,4,0,0,NA,401178899,2020-02-13,
29,1,5:09,2109,2109,Grace Vander Weide missed Three Point Jumper.,7,5,2,4,0.5505657434540481,Marist,Canisius,4,4,0,0,NA,401178899,2020-02-13,
30,1,5:05,2105,2105,Hannah Hand Offensive Rebound.,7,5,2,5,0.5506602182867172,Marist,Canisius,4,4,0,0,NA,401178899,2020-02-13,
31,1,5:00,2100,2100,Rebekah Hand made Three Point Jumper. Assisted by Grace Vander Weide.,10,5,5,21,0.6246990685759959,Marist,Canisius,4,4,0,0,NA,401178899,2020-02-13,Marist
32,1,4:39,2079,2079,Danielle Sanderlin missed Jumper.,10,5,5,3,0.6258818235372359,Marist,Canisius,4,4,0,0,NA,401178899,2020-02-13,
33,1,4:36,2076,2076,Willow Duffell Defensive Rebound.,10,5,5,0,0.626051543483149,Marist,Canisius,4,4,0,0,NA,401178899,2020-02-13,
34,1,4:36,2076,2076,Foul on AJ Timbers.,10,5,5,0,0.626051543483149,Marist,Canisius,4,4,0,0,NA,401178899,2020-02-13,
35,1,4:36,2076,2076,Official TV Timeout,10,5,5,20,0.626051543483149,Marist,Canisius,4,4,0,0,NA,401178899,2020-02-13,
36,1,4:16,2056,2056,Alana Gilmer missed Jumper.,10,5,5,4,0.6271880839810767,Marist,Canisius,4,4,0,0,NA,401178899,2020-02-13,
37,1,4:12,2052,2052,Tiana Pugh Defensive Rebound.,10,5,5,17,0.6274164830430046,Marist,Canisius,4,4,0,0,NA,401178899,2020-02-13,
38,1,3:55,2035,2035,Tiana Pugh missed Layup.,10,5,5,0,0.6283914160944843,Marist,Canisius,4,4,0,0,NA,401178899,2020-02-13,
39,1,3:55,2035,2035,Allie Best Block.,10,5,5,7,0.6283914160944843,Marist,Canisius,4,4,0,0,NA,401178899,2020-02-13,
40,1,3:48,2028,2028,Alana Gilmer Defensive Rebound.,10,5,5,4,0.6287949106266261,Marist,Canisius,4,4,0,0,NA,401178899,2020-02-13,
41,1,3:44,2024,2024,Alana Gilmer made Layup.,12,5,7,19,0.6768333709576275,Marist,Canisius,4,4,0,0,NA,401178899,2020-02-13,Marist
42,1,3:25,2005,2005,Tiana Pugh made Jumper. Assisted by Anna Sweny.,12,7,5,17,0.6301294995623724,Marist,Canisius,4,4,0,0,NA,401178899,2020-02-13,Canisius
43,1,3:08,1988,1988,Alana Gilmer made Layup. Assisted by Hannah Hand.,14,7,7,15,0.6795848599997738,Marist,Canisius,4,4,0,0,NA,401178899,2020-02-13,Marist
44,1,2:53,1973,1973,AJ Timbers made Jumper.,14,9,5,9,0.6320101397408582,Marist,Canisius,4,4,0,0,NA,401178899,2020-02-13,Canisius
45,1,2:44,1964,1964,Rebekah Hand made Layup. Assisted by Allie Best.,16,9,7,19,0.6814420424638296,Marist,Canisius,4,4,0,0,NA,401178899,2020-02-13,Marist
46,1,2:25,1945,1945,AJ Timbers missed Three Point Jumper.,16,9,7,3,0.682926194753849,Marist,Canisius,4,4,0,0,NA,401178899,2020-02-13,
47,1,2:22,1942,1942,Tiana Pugh Offensive Rebound.,16,9,7,2,0.6831616983921132,Marist,Canisius,4,4,0,0,NA,401178899,2020-02-13,
48,1,2:20,1940,1940,Tiana Pugh made Layup.,16,11,5,16,0.6339808441759184,Marist,Canisius,4,4,0,0,NA,401178899,2020-02-13,Canisius
49,1,2:04,1924,1924,Molly Smith Turnover.,16,11,5,0,0.6349476638844399,Marist,Canisius,4,4,0,0,NA,401178899,2020-02-13,
50,1,2:04,1924,1924,Anna Sweny Steal.,16,11,5,5,0.6349476638844399,Marist,Canisius,4,4,0,0,NA,401178899,2020-02-13,
51,1,1:59,1919,1919,Anna Sweny made Jumper.,16,13,3,34,0.5824607430877299,Marist,Canisius,4,4,0,0,NA,401178899,2020-02-13,Canisius
52,1,1:25,1885,1885,Willow Duffell missed Jumper.,16,13,3,1,0.5837516499530961,Marist,Canisius,4,4,0,0,NA,401178899,2020-02-13,
53,1,1:24,1884,1884,Marist Offensive Rebound.,16,13,3,0,0.5837896020085477,Marist,Canisius,4,4,0,0,NA,401178899,2020-02-13,
54,1,1:24,1884,1884,Marist  Turnover.,16,13,3,19,0.5837896020085477,Marist,Canisius,4,4,0,0,NA,401178899,2020-02-13,
55,1,1:05,1865,1865,Anna Sweny made Three Point Jumper. Assisted by Shayla Sweeney.,16,16,0,25,0.5,Marist,Canisius,4,4,0,0,NA,401178899,2020-02-13,Canisius
56,1,0:40,1840,1840,Alana Gilmer made Jumper.,18,16,2,14,0.5572884726183811,Marist,Canisius,4,4,0,0,NA,401178899,2020-02-13,Marist
57,1,0:26,1826,1826,D'Jhai Patterson-Ricks missed Three Point Jumper.,18,16,2,4,0.5576522962936057,Marist,Canisius,4,4,0,0,NA,401178899,2020-02-13,
58,1,0:22,1822,1822,Willow Duffell Defensive Rebound.,18,16,2,21,0.557756605665876,Marist,Canisius,4,4,0,0,NA,401178899,2020-02-13,
59,1,0:01,1801,1801,Alana Gilmer made Free Throw.,19,16,3,0,0.5869674990168224,Marist,Canisius,4,4,0,0,NA,401178899,2020-02-13,Marist
60,1,0:01,1801,1801,Foul on Shayla Sweeney.,18,16,2,0,0.5583073758330988,Marist,Canisius,4,4,0,0,NA,401178899,2020-02-13,
61,1,0:01,1801,1801,Alana Gilmer made Free Throw.,20,16,4,1,0.6150501841763585,Marist,Canisius,4,4,0,0,NA,401178899,2020-02-13,Marist
62,1,0:00,1800,1800,End of 1st Quarter,18,16,2,16,0.558333749411633,Marist,Canisius,4,4,0,0,NA,401178899,2020-02-13,
63,2,9:44,1784,1784,Anna Sweny Turnover.,20,16,4,0,0.6159148272308327,Marist,Canisius,4,4,0,0,NA,401178899,2020-02-13,Marist
64,2,9:44,1784,1784,Rebekah Hand Steal.,20,16,4,6,0.6159148272308327,Marist,Canisius,4,4,0,0,NA,401178899,2020-02-13,
65,2,9:38,1778,1778,Grace Vander Weide made Layup. Assisted by Rebekah Hand.,22,16,6,16,0.6704707036322993,Marist,Canisius,4,4,0,0,NA,401178899,2020-02-13,Marist
66,2,9:22,1762,1762,Danielle Sanderlin made Layup. Assisted by Tiana Pugh.,22,18,4,15,0.6170471024165468,Marist,Canisius,4,4,0,0,NA,401178899,2020-02-13,Canisius
67,2,9:07,1747,1747,Grace Vander Weide made Layup. Assisted by Sarah Barcello.,24,18,6,15,0.6727207251242981,Marist,Canisius,4,4,0,0,NA,401178899,2020-02-13,Marist
68,2,8:52,1732,1732,D'Jhai Patterson-Ricks missed Three Point Jumper.,24,18,6,3,0.6738270330398481,Marist,Canisius,4,4,0,0,NA,401178899,2020-02-13,
69,2,8:49,1729,1729,Rebekah Hand Defensive Rebound.,24,18,6,19,0.6740498420550047,Marist,Canisius,4,4,0,0,NA,401178899,2020-02-13,
70,2,8:30,1710,1710,Foul on Anna Sweny.,24,18,6,3,0.6754739337532675,Marist,Canisius,4,4,0,0,NA,401178899,2020-02-13,
71,2,8:27,1707,1707,Grace Vander Weide Turnover.,24,18,6,0,0.6757009428509324,Marist,Canisius,4,4,0,0,NA,401178899,2020-02-13,
72,2,8:27,1707,1707,Tiana Pugh Steal.,24,18,6,20,0.6757009428509324,Marist,Canisius,4,4,0,0,NA,401178899,2020-02-13,
73,2,8:07,1687,1687,Danielle Sanderlin Turnover.,24,18,6,0,0.6772296188321094,Marist,Canisius,4,4,0,0,NA,401178899,2020-02-13,
74,2,8:07,1687,1687,Alana Gilmer Steal.,24,18,6,7,0.6772296188321094,Marist,Canisius,4,4,0,0,NA,401178899,2020-02-13,
75,2,8:00,1680,1680,Rebekah Hand missed Three Point Jumper.,24,18,6,3,0.6777626257961811,Marist,Canisius,4,4,0,0,NA,401178899,2020-02-13,
76,2,7:57,1677,1677,Alana Gilmer Offensive Rebound.,24,18,6,3,0.6779892209330605,Marist,Canisius,4,4,0,0,NA,401178899,2020-02-13,
77,2,7:54,1674,1674,Sarah Barcello made Three Point Jumper. Assisted by Grace Vander Weide.,27,18,9,18,0.753686154389053,Marist,Canisius,4,4,0,0,NA,401178899,2020-02-13,Marist
78,2,7:36,1656,1656,AJ Timbers missed Jumper.,27,18,9,3,0.7553856884114613,Marist,Canisius,4,4,0,0,NA,401178899,2020-02-13,
79,2,7:33,1653,1653,Grace Vander Weide Defensive Rebound.,27,18,9,0,0.7556648301335054,Marist,Canisius,4,4,0,0,NA,401178899,2020-02-13,
80,2,7:33,1653,1653,Foul on Shayla Sweeney.,27,18,9,13,0.7556648301335054,Marist,Canisius,4,4,0,0,NA,401178899,2020-02-13,
81,2,7:20,1640,1640,Rebekah Hand missed Three Point Jumper.,27,18,9,3,0.7568631082435295,Marist,Canisius,4,4,0,0,NA,401178899,2020-02-13,
82,2,7:17,1637,1637,Danielle Sanderlin Defensive Rebound.,27,18,9,15,0.7571373049558976,Marist,Canisius,4,4,0,0,NA,401178899,2020-02-13,
83,2,7:02,1622,1622,Danielle Sanderlin Turnover.,27,18,9,11,0.7584977993838061,Marist,Canisius,4,4,0,0,NA,401178899,2020-02-13,
84,2,6:51,1611,1611,Sarah Barcello made Three Point Jumper. Assisted by Rebekah Hand.,30,18,12,25,0.8224679488341095,Marist,Canisius,4,4,0,0,NA,401178899,2020-02-13,Marist
85,2,6:26,1586,1586,Danielle Sanderlin missed Layup.,30,18,12,4,0.8248451708175287,Marist,Canisius,4,4,0,0,NA,401178899,2020-02-13,
86,2,6:22,1582,1582,Alana Gilmer Defensive Rebound.,30,18,12,3,0.825224310105401,Marist,Canisius,4,4,0,0,NA,401178899,2020-02-13,
87,2,6:19,1579,1579,Sarah Barcello missed Three Point Jumper.,30,18,12,3,0.8255086557287848,Marist,Canisius,4,4,0,0,NA,401178899,2020-02-13,
88,2,6:16,1576,1576,Danielle Sanderlin Defensive Rebound.,30,18,12,12,0.8257930495274886,Marist,Canisius,4,4,0,0,NA,401178899,2020-02-13,
89,2,6:04,1564,1564,D'Jhai Patterson-Ricks made Three Point Jumper. Assisted by AJ Timbers.,30,21,9,15,0.7636920744647031,Marist,Canisius,4,4,0,0,NA,401178899,2020-02-13,Canisius
90,2,5:49,1549,1549,Sarah Barcello made Layup. Assisted by Rebekah Hand.,32,21,11,23,0.8089028061624921,Marist,Canisius,4,4,0,0,NA,401178899,2020-02-13,Marist
91,2,5:26,1526,1526,Danielle Sanderlin missed Jumper.,32,21,11,3,0.8111187457082797,Marist,Canisius,4,4,0,0,NA,401178899,2020-02-13,
92,2,5:23,1523,1523,Grace Vander Weide Defensive Rebound.,32,21,11,6,0.8114114233419184,Marist,Canisius,4,4,0,0,NA,401178899,2020-02-13,
93,2,5:17,1517,1517,Rebekah Hand missed Three Point Jumper.,32,21,11,4,0.811999789662869,Marist,Canisius,4,4,0,0,NA,401178899,2020-02-13,
94,2,5:13,1513,1513,Marist Offensive Rebound.,32,21,11,9,0.8123944091711787,Marist,Canisius,4,4,0,0,NA,401178899,2020-02-13,
95,2,5:04,1504,1504,Hannah Hand made Three Point Jumper. Assisted by Grace Vander Weide.,35,21,14,19,0.8667884719912308,Marist,Canisius,4,4,0,0,NA,401178899,2020-02-13,Marist
96,2,4:45,1485,1485,AJ Timbers missed Jumper.,35,21,14,4,0.8686520416532602,Marist,Canisius,4,4,0,0,NA,401178899,2020-02-13,
97,2,4:41,1481,1481,Willow Duffell Defensive Rebound.,35,21,14,18,0.8690506836779424,Marist,Canisius,4,4,0,0,NA,401178899,2020-02-13,
98,2,4:23,1463,1463,Willow Duffell missed Layup.,35,21,14,1,0.8708754615942961,Marist,Canisius,4,4,0,0,NA,401178899,2020-02-13,
99,2,4:22,1462,1462,Willow Duffell missed Layup.,35,21,14,1,0.8709784164083796,Marist,Canisius,4,4,0,0,NA,401178899,2020-02-13,
100,2,4:21,1461,1461,Canisius Defensive Rebound.,35,21,14,0,0.871081545950395,Marist,Canisius,4,4,0,0,NA,401178899,2020-02-13,
101,2,4:21,1461,1461,Official TV Timeout,35,21,14,1,0.871081545950395,Marist,Canisius,4,4,0,0,NA,401178899,2020-02-13,
102,2,4:20,1460,1460,Willow Duffell Offensive Rebound.,35,21,14,26,0.8711848514811446,Marist,Canisius,4,4,0,0,NA,401178899,2020-02-13,
103,2,3:54,1434,1434,Shaunae Brown missed Jumper.,35,21,14,0,0.8738729784147613,Marist,Canisius,4,4,0,0,NA,401178899,2020-02-13,
104,2,3:54,1434,1434,Grace Vander Weide Block.,35,21,14,1,0.8738729784147613,Marist,Canisius,4,4,0,0,NA,401178899,2020-02-13,
105,2,3:53,1433,1433,Shannon Conely Offensive Rebound.,35,21,14,0,0.8739734100947804,Marist,Canisius,4,4,0,0,NA,401178899,2020-02-13,
106,2,3:53,1433,1433,Foul on Hannah Hand.,35,21,14,0,0.8739734100947804,Marist,Canisius,4,4,0,0,NA,401178899,2020-02-13,
107,2,3:53,1433,1433,Shannon Conely missed Free Throw.,35,21,14,0,0.8739734100947804,Marist,Canisius,4,4,0,0,NA,401178899,2020-02-13,
108,2,3:53,1433,1433,Canisius Offensive Rebound.,35,21,14,0,0.8739734100947804,Marist,Canisius,4,4,0,0,NA,401178899,2020-02-13,
109,2,3:53,1433,1433,Shannon Conely made Free Throw.,35,22,13,21,0.8579335244825581,Marist,Canisius,4,4,0,0,NA,401178899,2020-02-13,Canisius
110,2,3:32,1412,1412,Alana Gilmer made Layup. Assisted by Molly Smith.,37,22,15,25,0.8904168674114097,Marist,Canisius,4,4,0,0,NA,401178899,2020-02-13,Marist
111,2,3:07,1387,1387,AJ Timbers missed Three Point Jumper.,37,22,15,5,0.8926662854123868,Marist,Canisius,4,4,0,0,NA,401178899,2020-02-13,
112,2,3:02,1382,1382,Molly Smith Defensive Rebound.,37,22,15,6,0.8931062279999743,Marist,Canisius,4,4,0,0,NA,401178899,2020-02-13,
113,2,2:56,1376,1376,Foul on Danielle Sanderlin.,37,22,15,0,0.8936309669685933,Marist,Canisius,4,4,0,0,NA,401178899,2020-02-13,
114,2,2:56,1376,1376,Rebekah Hand made Free Throw.,38,22,16,0,0.9063847259439225,Marist,Canisius,4,4,0,0,NA,401178899,2020-02-13,Marist
115,2,2:56,1376,1376,Rebekah Hand made Free Throw.,39,22,17,16,0.9177500426451833,Marist,Canisius,4,4,0,0,NA,401178899,2020-02-13,Marist
116,2,2:40,1360,1360,Danielle Sanderlin made Three Point Jumper. Assisted by Shaunae Brown.,39,25,14,11,0.8808162527189514,Marist,Canisius,4,4,0,0,NA,401178899,2020-02-13,Canisius
117,2,2:29,1349,1349,Foul on Danielle Sanderlin.,39,25,14,13,0.8818046849873387,Marist,Canisius,4,4,0,0,NA,401178899,2020-02-13,
118,2,2:16,1336,1336,Alana Gilmer made Layup.,41,25,16,11,0.9096682467454386,Marist,Canisius,4,4,0,0,NA,401178899,2020-02-13,Marist
119,2,2:05,1325,1325,AJ Timbers made Three Point Jumper.,41,28,13,20,0.8682417870044058,Marist,Canisius,4,4,0,0,NA,401178899,2020-02-13,Canisius
120,2,1:45,1305,1305,Hannah Hand made Layup. Assisted by Allie Best.,43,28,15,0,0.8997826416515606,Marist,Canisius,4,4,0,0,NA,401178899,2020-02-13,Marist
121,2,1:45,1305,1305,Foul on Shaunae Brown.,43,28,15,0,0.8997826416515606,Marist,Canisius,4,4,0,0,NA,401178899,2020-02-13,
122,2,1:45,1305,1305,Hannah Hand missed Free Throw.,43,28,15,0,0.8997826416515606,Marist,Canisius,4,4,0,0,NA,401178899,2020-02-13,
123,2,1:45,1305,1305,Tiana Pugh Defensive Rebound.,43,28,15,10,0.8997826416515606,Marist,Canisius,4,4,0,0,NA,401178899,2020-02-13,
124,2,1:35,1295,1295,Foul on Hannah Hand.,43,28,15,21,0.90067082824542255,Marist,Canisius,4,4,0,0,NA,401178899,2020-02-13,
125,2,1:14,1274,1274,AJ Timbers missed Three Point Jumper.,43,28,15,4,0.9025795831241776,Marist,Canisius,4,4,0,0,NA,401178899,2020-02-13,
126,2,1:10,1270,1270,Sarah Barcello Defensive Rebound.,43,28,15,5,0.9029510865590077,Marist,Canisius,4,4,0,0,NA,401178899,2020-02-13,
127,2,1:05,1265,1265,Foul on Shaunae Brown.,43,28,15,2,0.9034194916919295,Marist,Canisius,4,4,0,0,NA,401178899,2020-02-13,
128,2,1:03,1263,1263,Alana Gilmer missed Free Throw.,43,28,15,0,0.9036081563441031,Marist,Canisius,4,4,0,0,NA,401178899,2020-02-13,
129,2,1:03,1263,1263,Marist Offensive Rebound.,43,28,15,0,0.9036081563441031,Marist,Canisius,4,4,0,0,NA,401178899,2020-02-13,
130,2,1:03,1263,1263,Alana Gilmer missed Free Throw.,43,28,15,2,0.9036081563441031,Marist,Canisius,4,4,0,0,NA,401178899,2020-02-13,
131,2,1:01,1261,1261,Tiana Pugh Defensive Rebound.,43,28,15,22,0.9037975883785233,Marist,Canisius,4,4,0,0,NA,401178899,2020-02-13,
132,2,0:39,1239,1239,Erika Joseph missed Three Point Jumper.,43,28,15,5,0.9059361977587898,Marist,Canisius,4,4,0,0,NA,401178899,2020-02-13,
133,2,0:34,1234,1234,Willow Duffell Defensive Rebound.,43,28,15,4,0.9064374179030004,Marist,Canisius,4,4,0,0,NA,401178899,2020-02-13,
134,2,0:30,1230,1230,Allie Best made Jumper. Assisted by Grace Vander Weide.,45,28,17,30,0.9295045906517924,Marist,Canisius,4,4,0,0,NA,401178899,2020-02-13,Marist
135,2,0:00,1200,1200,End of 2nd Quarter,45,28,17,17,0.9322584459832474,Marist,Canisius,4,4,0,0,NA,401178899,2020-02-13,
136,3,9:43,1183,1183,Foul on Erika Joseph.,45,28,17,0,0.9337601943450682,Marist,Canisius,5,5,0,0,NA,401178899,2020-02-13,
137,3,9:43,1183,1183,Rebekah Hand made Free Throw.,46,28,18,0,0.9427612252628855,Marist,Canisius,5,5,0,0,NA,401178899,2020-02-13,Marist
138,3,9:43,1183,1183,Rebekah Hand made Free Throw.,47,28,19,16,0.950603849168422,Marist,Canisius,5,5,0,0,NA,401178899,2020-02-13,Marist
139,3,9:27,1167,1167,Anna Sweny made Layup.,47,30,17,16,0.9351119663380567,Marist,Canisius,5,5,0,0,NA,401178899,2020-02-13,Canisius
140,3,9:11,1151,1151,Alana Gilmer made Jumper. Assisted by Rebekah Hand.,49,30,19,18,0.9528520075851497,Marist,Canisius,5,5,0,0,NA,401178899,2020-02-13,Marist
141,3,8:53,1133,1133,D'Jhai Patterson-Ricks Turnover.,49,30,19,0,0.9540559616753238,Marist,Canisius,5,5,0,0,NA,401178899,2020-02-13,
142,3,8:53,1133,1133,Grace Vander Weide Steal.,49,30,19,6,0.9540559616753238,Marist,Canisius,5,5,0,0,NA,401178899,2020-02-13,
143,3,8:47,1127,1127,Rebekah Hand missed Three Point Jumper.,49,30,19,3,0.9544509834873579,Marist,Canisius,5,5,0,0,NA,401178899,2020-02-13,
144,3,8:44,1124,1124,D'Jhai Patterson-Ricks Defensive Rebound.,49,30,19,9,0.9546475986135132,Marist,Canisius,5,5,0,0,NA,401178899,2020-02-13,
145,3,8:35,1115,1115,Erika Joseph made Three Point Jumper. Assisted by Anna Sweny.,49,33,16,18,0.929385027259529,Marist,Canisius,5,5,0,0,NA,401178899,2020-02-13,Canisius
146,3,8:17,1097,1097,Foul on D'Jhai Patterson-Ricks.,49,33,16,13,0.9308962241583876,Marist,Canisius,5,5,0,0,NA,401178899,2020-02-13,
147,3,8:04,1084,1084,Alana Gilmer missed Layup.,49,33,16,8,0.9319912143260981,Marist,Canisius,5,5,0,0,NA,401178899,2020-02-13,
148,3,7:56,1076,1076,Alana Gilmer Offensive Rebound.,49,33,16,0,0.9326692235007357,Marist,Canisius,5,5,0,0,NA,401178899,2020-02-13,
149,3,7:56,1076,1076,Alana Gilmer made Layup.,51,33,18,12,0.9505926915980802,Marist,Canisius,5,5,0,0,NA,401178899,2020-02-13,Marist
150,3,7:44,1064,1064,Foul on Willow Duffell.,51,33,18,0,0.9514549028535698,Marist,Canisius,5,5,0,0,NA,401178899,2020-02-13,
151,3,7:44,1064,1064,Anna Sweny made Three Point Jumper. Assisted by AJ Timbers.,51,36,15,33,0.9226980294533352,Marist,Canisius,5,5,0,0,NA,401178899,2020-02-13,Canisius
152,3,7:11,1031,1031,Willow Duffell missed Jumper.,51,36,15,3,0.9258406110680363,Marist,Canisius,5,5,0,0,NA,401178899,2020-02-13,
153,3,7:08,1028,1028,Danielle Sanderlin Defensive Rebound.,51,36,15,9,0.9261351605936964,Marist,Canisius,5,5,0,0,NA,401178899,2020-02-13,
154,3,6:59,1019,1019,Danielle Sanderlin missed Jumper.,51,36,15,7,0.9270292031304104,Marist,Canisius,5,5,0,0,NA,401178899,2020-02-13,
155,3,6:52,1012,1012,Grace Vander Weide Defensive Rebound.,51,36,15,0,0.9277359510044381,Marist,Canisius,5,5,0,0,NA,401178899,2020-02-13,
156,3,6:52,1012,1012,Willow Duffell made Layup. Assisted by Rebekah Hand.,53,36,17,0,0.9474865352920185,Marist,Canisius,5,5,0,0,NA,401178899,2020-02-13,Marist
157,3,6:52,1012,1012,Foul on Erika Joseph.,53,36,17,0,0.9474865352920185,Marist,Canisius,5,5,0,0,NA,401178899,2020-02-13,
158,3,6:52,1012,1012,Willow Duffell made Free Throw.,54,36,18,19,0.9553363915136397,Marist,Canisius,5,5,0,0,NA,401178899,2020-02-13,Marist
159,3,6:33,993,993,Danielle Sanderlin made Layup.,54,38,16,9,0.9401599725036838,Marist,Canisius,5,5,0,0,NA,401178899,2020-02-13,Canisius
160,3,6:24,984,984,Willow Duffell made Jumper. Assisted by Sarah Barcello.,56,38,18,18,0.9575680680912896,Marist,Canisius,5,5,0,0,NA,401178899,2020-02-13,Marist
161,3,6:06,966,966,Anna Sweny missed Three Point Jumper.,56,38,18,3,0.9590604612718865,Marist,Canisius,5,5,0,0,NA,401178899,2020-02-13,
162,3,6:03,963,963,Tiana Pugh Turnover.,56,38,18,1,0.9593021358310719,Marist,Canisius,5,5,0,0,NA,401178899,2020-02-13,
163,3,6:02,962,962,Tiana Pugh Offensive Rebound.,56,38,18,10,0.9593814725679547,Marist,Canisius,5,5,0,0,NA,401178899,2020-02-13,
164,3,5:52,952,952,Rebekah Hand missed Three Point Jumper.,56,38,18,3,0.9601433851352583,Marist,Canisius,5,5,0,0,NA,401178899,2020-02-13,
165,3,5:49,949,949,Anna Sweny Defensive Rebound.,56,38,18,7,0.9603615397583365,Marist,Canisius,5,5,0,0,NA,401178899,2020-02-13,
166,3,5:42,942,942,Foul on Rebekah Hand.,56,38,18,4,0.9608536746148651,Marist,Canisius,5,5,0,0,NA,401178899,2020-02-13,
167,3,5:38,938,938,Danielle Sanderlin made Jumper.,56,40,16,19,0.9453877534242116,Marist,Canisius,5,5,0,0,NA,401178899,2020-02-13,Canisius
168,3,5:19,919,919,Rebekah Hand made Layup. Assisted by Alana Gilmer.,58,40,18,15,0.9623314800649636,Marist,Canisius,5,5,0,0,NA,401178899,2020-02-13,Marist
169,3,5:04,904,904,D'Jhai Patterson-Ricks missed Layup.,58,40,18,4,0.9632087289050991,Marist,Canisius,5,5,0,0,NA,401178899,2020-02-13,
170,3,5:00,900,900,Sarah Barcello Defensive Rebound.,58,40,18,7,0.9634344067925353,Marist,Canisius,5,5,0,0,NA,401178899,2020-02-13,
171,3,4:53,893,893,Sarah Barcello made Layup.,60,40,20,23,0.9745980995804204,Marist,Canisius,5,5,0,0,NA,401178899,2020-02-13,Marist
172,3,4:30,870,870,Foul on Rebekah Hand.,60,40,20,0,0.975573782214159,Marist,Canisius,5,5,0,0,NA,401178899,2020-02-13,
173,3,4:30,870,870,Official TV Timeout,60,40,20,0,0.975573782214159,Marist,Canisius,5,5,0,0,NA,401178899,2020-02-13,
174,3,4:30,870,870,Shayla Sweeney missed Free Throw.,60,40,20,0,0.975573782214159,Marist,Canisius,5,5,0,0,NA,401178899,2020-02-13,
175,3,4:30,870,870,Canisius Offensive Rebound.,60,40,20,0,0.975573782214159,Marist,Canisius,5,5,0,0,NA,401178899,2020-02-13,
176,3,4:30,870,870,Shayla Sweeney made Free Throw.,60,41,19,11,0.9707730164268941,Marist,Canisius,5,5,0,0,NA,401178899,2020-02-13,Canisius
177,3,4:19,859,859,Rebekah Hand made Three Point Jumper. Assisted by Allie Best.,63,41,22,13,0.983332892374322,Marist,Canisius,5,5,0,0,NA,401178899,2020-02-13,Marist
178,3,4:06,846,846,Danielle Sanderlin made Three Point Jumper. Assisted by Shayla Sweeney.,63,44,19,14,0.971911473519201,Marist,Canisius,5,5,0,0,NA,401178899,2020-02-13,Canisius
179,3,3:52,832,832,Alana Gilmer made Jumper. Assisted by Rebekah Hand.,65,44,21,16,0.9810123443089462,Marist,Canisius,5,5,0,0,NA,401178899,2020-02-13,Marist
180,3,3:36,816,816,Danielle Sanderlin missed Layup.,65,44,21,4,0.981633452353189,Marist,Canisius,5,5,0,0,NA,401178899,2020-02-13,
181,3,3:32,812,812,Alana Gilmer Defensive Rebound.,65,44,21,8,0.981793101404213,Marist,Canisius,5,5,0,0,NA,401178899,2020-02-13,
182,3,3:24,804,804,Molly Smith made Layup. Assisted by Allie Best.,67,44,23,10,0.9877204516744388,Marist,Canisius,5,5,0,0,NA,401178899,2020-02-13,Marist
183,3,3:14,794,794,Danielle Sanderlin made Three Point Jumper. Assisted by D'Jhai Patterson-Ricks.,67,47,20,17,0.978921384282413,Marist,Canisius,5,5,0,0,NA,401178899,2020-02-13,Canisius
184,3,2:57,777,777,Alana Gilmer Turnover.,67,47,20,0,0.979779748727127,Marist,Canisius,5,5,0,0,NA,401178899,2020-02-13,
185,3,2:57,777,777,D'Jhai Patterson-Ricks Steal.,67,47,20,8,0.979779748727127,Marist,Canisius,5,5,0,0,NA,401178899,2020-02-13,
186,3,2:49,769,769,D'Jhai Patterson-Ricks missed Layup.,67,47,20,0,0.9802036614030808,Marist,Canisius,5,5,0,0,NA,401178899,2020-02-13,
187,3,2:49,769,769,Allie Best Defensive Rebound.,67,47,20,0,0.9802036614030808,Marist,Canisius,5,5,0,0,NA,401178899,2020-02-13,
188,3,2:49,769,769,Foul on Danielle Sanderlin.,67,47,20,9,0.9802036614030808,Marist,Canisius,5,5,0,0,NA,401178899,2020-02-13,
189,3,2:40,760,760,Foul on D'Jhai Patterson-Ricks.,67,47,20,0,0.9806966126567226,Marist,Canisius,5,5,0,0,NA,401178899,2020-02-13,
190,3,2:40,760,760,Willow Duffell missed Free Throw.,67,47,20,0,0.9806966126567226,Marist,Canisius,5,5,0,0,NA,401178899,2020-02-13,
191,3,2:40,760,760,Marist Offensive Rebound.,67,47,20,0,0.9806966126567226,Marist,Canisius,5,5,0,0,NA,401178899,2020-02-13,
