play_id,period,time_remaining_period,secs_remaining,secs_remaining_absolute,description,home_score,away_score,score_diff,play_length,win_prob,home,away,home_time_out_remaining,away_time_out_remaining,home_timeout_ind,away_timeout_ind,home_favored_by,game_id,date,whichScored
1,1,9:42,2382,2382,Kyra Lambert made Three Point Jumper. Assisted by Lexie Brown.,0,0,0,7,0.5,Duke,Pennsylvania,4,4,0,0,NA,400911948,2016-11-13,NA
2,1,9:35,2375,2375,Michelle Nwokedi Turnover.,3,0,3,0,0.5666105463676995,Duke,Pennsylvania,4,4,0,0,NA,400911948,2016-11-13,Duke
3,1,9:35,2375,2375,Kyra Lambert Steal.,3,0,3,0,0.5666105463676995,Duke,Pennsylvania,4,4,0,0,NA,400911948,2016-11-13,
4,1,9:35,2375,2375,Kyra Lambert made Layup.,5,0,5,0,0.6098604686181203,Duke,Pennsylvania,4,4,0,0,NA,400911948,2016-11-13,Duke
5,1,9:35,2375,2375,Foul on Michelle Nwokedi.,5,0,5,0,0.6098604686181203,Duke,Pennsylvania,4,4,0,0,NA,400911948,2016-11-13,
6,1,9:35,2375,2375,Kyra Lambert made Free Throw.,6,0,6,12,0.6308979345771885,Duke,Pennsylvania,4,4,0,0,NA,400911948,2016-11-13,Duke
7,1,9:23,2363,2363,Anna Ross missed Layup.,6,0,6,0,0.6316203077580519,Duke,Pennsylvania,4,4,0,0,NA,400911948,2016-11-13,
8,1,9:23,2363,2363,Oderah Chidom Defensive Rebound.,6,0,6,16,0.6316203077580519,Duke,Pennsylvania,4,4,0,0,NA,400911948,2016-11-13,
9,1,9:07,2347,2347,Rebecca Greenwell made Layup. Assisted by Erin Mathias.,8,0,8,21,0.6735895741049903,Duke,Pennsylvania,4,4,0,0,NA,400911948,2016-11-13,Duke
10,1,8:46,2326,2326,Lauren Whitlatch Turnover.,8,0,8,0,0.6752114449752122,Duke,Pennsylvania,4,4,1,0,NA,400911948,2016-11-13,
11,1,8:46,2326,2326,Pennsylvania  Timeout,8,0,8,0,0.6752114449752122,Duke,Pennsylvania,3,4,1,0,NA,400911948,2016-11-13,
12,1,8:46,2326,2326,Official TV Timeout,8,0,8,11,0.6752114449752122,Duke,Pennsylvania,3,4,1,0,NA,400911948,2016-11-13,
13,1,8:35,2315,2315,Lexie Brown made Three Point Jumper. Assisted by Kyra Lambert.,11,0,11,23,0.7333453339706882,Duke,Pennsylvania,3,4,1,0,NA,400911948,2016-11-13,Duke
14,1,8:12,2292,2292,Michelle Nwokedi Turnover.,11,0,11,20,0.7355523502876496,Duke,Pennsylvania,3,4,1,0,NA,400911948,2016-11-13,
15,1,7:52,2272,2272,Lexie Brown made Layup.,13,0,13,14,0.7721897162791554,Duke,Pennsylvania,3,4,1,0,NA,400911948,2016-11-13,Duke
16,1,7:38,2258,2258,Michelle Nwokedi missed Layup.,13,0,13,0,0.7736423547737644,Duke,Pennsylvania,3,4,0,0,NA,400911948,2016-11-13,
17,1,7:38,2258,2258,Michelle Nwokedi Offensive Rebound.,13,0,13,1,0.7736423547737644,Duke,Pennsylvania,3,4,0,0,NA,400911948,2016-11-13,
18,1,7:37,2257,2257,Michelle Nwokedi made Layup.,13,2,11,0,0.7389308743740715,Duke,Pennsylvania,3,4,0,0,NA,400911948,2016-11-13,Pennsylvania
19,1,7:37,2257,2257,Foul on Oderah Chidom.,13,2,11,0,0.7389308743740715,Duke,Pennsylvania,3,4,0,0,NA,400911948,2016-11-13,
20,1,7:37,2257,2257,Michelle Nwokedi missed Free Throw.,13,2,11,0,0.7389308743740715,Duke,Pennsylvania,3,4,0,0,NA,400911948,2016-11-13,
21,1,7:37,2257,2257,Oderah Chidom Defensive Rebound.,13,2,11,27,0.7389308743740715,Duke,Pennsylvania,3,4,0,0,NA,400911948,2016-11-13,
22,1,7:10,2230,2230,Lexie Brown missed Jumper.,13,2,11,0,0.7415476020151331,Duke,Pennsylvania,3,4,0,0,NA,400911948,2016-11-13,
23,1,7:10,2230,2230,Sydney Stipanovich Defensive Rebound.,13,2,11,12,0.7415476020151331,Duke,Pennsylvania,3,4,0,0,NA,400911948,2016-11-13,
24,1,6:58,2218,2218,Michelle Nwokedi made Layup.,13,4,9,24,0.7041970814795854,Duke,Pennsylvania,3,4,0,0,NA,400911948,2016-11-13,Pennsylvania
25,1,6:34,2194,2194,Oderah Chidom made Jumper. Assisted by Kyra Lambert.,15,4,11,14,0.7450414573919381,Duke,Pennsylvania,3,4,0,0,NA,400911948,2016-11-13,Duke
26,1,6:20,2180,2180,Sydney Stipanovich missed Layup.,15,4,11,0,0.7463994954020181,Duke,Pennsylvania,3,4,0,0,NA,400911948,2016-11-13,
27,1,6:20,2180,2180,Lexie Brown Defensive Rebound.,15,4,11,6,0.7463994954020181,Duke,Pennsylvania,3,4,0,0,NA,400911948,2016-11-13,
28,1,6:14,2174,2174,Lexie Brown Turnover.,15,4,11,12,0.7469811263814385,Duke,Pennsylvania,3,4,0,0,NA,400911948,2016-11-13,
29,1,6:02,2162,2162,Sydney Stipanovich Turnover.,15,4,11,0,0.7481439633450472,Duke,Pennsylvania,3,4,0,0,NA,400911948,2016-11-13,
30,1,6:02,2162,2162,Rebecca Greenwell made Three Point Jumper. Assisted by Oderah Chidom.,18,4,14,13,0.799899486300759,Duke,Pennsylvania,3,4,0,0,NA,400911948,2016-11-13,Duke
31,1,5:49,2149,2149,Foul on Kyra Lambert.,18,4,14,0,0.801261391525224,Duke,Pennsylvania,3,4,0,0,NA,400911948,2016-11-13,
32,1,5:49,2149,2149,Michelle Nwokedi made Free Throw.,18,5,13,10,0.7849266775415837,Duke,Pennsylvania,3,4,0,0,NA,400911948,2016-11-13,Pennsylvania
33,1,5:39,2139,2139,Michelle Nwokedi made Free Throw.,18,6,12,14,0.7686444701808646,Duke,Pennsylvania,3,4,0,0,NA,400911948,2016-11-13,Pennsylvania
34,1,5:25,2125,2125,Oderah Chidom missed Layup.,18,6,12,0,0.7700535399746755,Duke,Pennsylvania,3,4,0,0,NA,400911948,2016-11-13,
35,1,5:25,2125,2125,Sydney Stipanovich Block.,18,6,12,2,0.7700535399746755,Duke,Pennsylvania,3,4,0,0,NA,400911948,2016-11-13,
36,1,5:23,2123,2123,Sydney Stipanovich Defensive Rebound.,18,6,12,6,0.7702549483685575,Duke,Pennsylvania,3,4,0,0,NA,400911948,2016-11-13,
37,1,5:17,2117,2117,Michelle Nwokedi missed Three Point Jumper.,18,6,12,0,0.7708593617014495,Duke,Pennsylvania,3,4,0,0,NA,400911948,2016-11-13,
38,1,5:17,2117,2117,Sydney Stipanovich Offensive Rebound.,18,6,12,5,0.7708593617014495,Duke,Pennsylvania,3,4,0,0,NA,400911948,2016-11-13,
39,1,5:12,2112,2112,Sydney Stipanovich missed Layup.,18,6,12,0,0.771363267842996,Duke,Pennsylvania,3,4,0,0,NA,400911948,2016-11-13,
40,1,5:12,2112,2112,Sydney Stipanovich Offensive Rebound.,18,6,12,2,0.771363267842996,Duke,Pennsylvania,3,4,0,0,NA,400911948,2016-11-13,
41,1,5:10,2110,2110,Sydney Stipanovich missed Layup.,18,6,12,0,0.7715648916589817,Duke,Pennsylvania,3,4,0,0,NA,400911948,2016-11-13,
42,1,5:10,2110,2110,Pennsylvania Offensive Rebound.,18,6,12,16,0.7715648916589817,Duke,Pennsylvania,3,4,0,0,NA,400911948,2016-11-13,
43,1,4:54,2094,2094,Sydney Stipanovich missed Jumper.,18,6,12,0,0.773179260499241,Duke,Pennsylvania,3,4,0,0,NA,400911948,2016-11-13,
44,1,4:54,2094,2094,Oderah Chidom Block.,18,6,12,1,0.773179260499241,Duke,Pennsylvania,3,4,0,0,NA,400911948,2016-11-13,
45,1,4:53,2093,2093,Kyra Lambert Defensive Rebound.,18,6,12,10,0.7732802455087854,Duke,Pennsylvania,3,4,0,0,NA,400911948,2016-11-13,
46,1,4:43,2083,2083,Lexie Brown missed Three Point Jumper.,18,6,12,0,0.7742907090605161,Duke,Pennsylvania,3,4,0,0,NA,400911948,2016-11-13,
47,1,4:43,2083,2083,Rebecca Greenwell Offensive Rebound.,18,6,12,13,0.7742907090605161,Duke,Pennsylvania,3,4,0,0,NA,400911948,2016-11-13,
48,1,4:30,2070,2070,Leaonna Odom missed Jumper.,18,6,12,0,0.7756060995919593,Duke,Pennsylvania,3,4,0,0,NA,400911948,2016-11-13,
49,1,4:30,2070,2070,Kasey Chambers Defensive Rebound.,18,6,12,10,0.7756060995919593,Duke,Pennsylvania,3,4,0,0,NA,400911948,2016-11-13,
50,1,4:20,2060,2060,Kasey Chambers missed Jumper.,18,6,12,0,0.7766194390735047,Duke,Pennsylvania,3,4,0,0,NA,400911948,2016-11-13,
51,1,4:20,2060,2060,Sydney Stipanovich Offensive Rebound.,18,6,12,5,0.7766194390735047,Duke,Pennsylvania,3,4,0,0,NA,400911948,2016-11-13,
52,1,4:15,2055,2055,Anna Ross missed Three Point Jumper.,18,6,12,0,0.7771266321608453,Duke,Pennsylvania,3,4,0,0,NA,400911948,2016-11-13,
53,1,4:15,2055,2055,Michelle Nwokedi Offensive Rebound.,18,6,12,7,0.7771266321608453,Duke,Pennsylvania,3,4,0,0,NA,400911948,2016-11-13,
54,1,4:08,2048,2048,Sydney Stipanovich made Layup. Assisted by Michelle Nwokedi.,18,8,10,20,0.739670414614523,Duke,Pennsylvania,3,4,0,0,NA,400911948,2016-11-13,Pennsylvania
55,1,3:48,2028,2028,Rebecca Greenwell missed Layup.,18,8,10,0,0.7415616012388568,Duke,Pennsylvania,3,4,0,0,NA,400911948,2016-11-13,
56,1,3:48,2028,2028,Sydney Stipanovich Block.,18,8,10,0,0.7415616012388568,Duke,Pennsylvania,3,4,0,0,NA,400911948,2016-11-13,
57,1,3:48,2028,2028,Duke Offensive Rebound.,18,8,10,4,0.7415616012388568,Duke,Pennsylvania,3,4,0,0,NA,400911948,2016-11-13,
58,1,3:44,2024,2024,Lexie Brown missed Layup.,18,8,10,0,0.7419410015025208,Duke,Pennsylvania,3,4,0,0,NA,400911948,2016-11-13,
59,1,3:44,2024,2024,Pennsylvania Defensive Rebound.,18,8,10,9,0.7419410015025208,Duke,Pennsylvania,3,4,0,0,NA,400911948,2016-11-13,
60,1,3:35,2015,2015,Michelle Nwokedi Turnover.,18,8,10,0,0.7427961299550059,Duke,Pennsylvania,3,4,0,0,NA,400911948,2016-11-13,
61,1,3:35,2015,2015,Foul on Michelle Nwokedi.,18,8,10,12,0.7427961299550059,Duke,Pennsylvania,3,4,0,0,NA,400911948,2016-11-13,
62,1,3:23,2003,2003,Foul on Sydney Stipanovich.,18,8,10,0,0.7439395813372136,Duke,Pennsylvania,3,4,0,0,NA,400911948,2016-11-13,
63,1,3:23,2003,2003,Leaonna Odom missed Free Throw.,18,8,10,0,0.7439395813372136,Duke,Pennsylvania,3,4,0,0,NA,400911948,2016-11-13,
64,1,3:23,2003,2003,Duke Deadball Team Rebound.,18,8,10,0,0.7439395813372136,Duke,Pennsylvania,3,4,0,0,NA,400911948,2016-11-13,
65,1,3:23,2003,2003,Leaonna Odom missed Free Throw.,18,8,10,0,0.7439395813372136,Duke,Pennsylvania,3,4,0,0,NA,400911948,2016-11-13,
66,1,3:23,2003,2003,Beth Brzozowski Defensive Rebound.,18,8,10,14,0.7439395813372136,Duke,Pennsylvania,3,4,0,0,NA,400911948,2016-11-13,
67,1,3:09,1989,1989,Ashley Russell Turnover.,18,8,10,19,0.7452785390259222,Duke,Pennsylvania,3,4,0,0,NA,400911948,2016-11-13,
68,1,2:50,1970,1970,Lyneé Belton made Layup. Assisted by Crystal Primm.,20,8,12,21,0.7858139678178905,Duke,Pennsylvania,3,4,0,0,NA,400911948,2016-11-13,Duke
69,1,2:29,1949,1949,Sydney Stipanovich missed Jumper.,20,8,12,0,0.787982694202384,Duke,Pennsylvania,3,4,0,0,NA,400911948,2016-11-13,
70,1,2:29,1949,1949,Kyra Lambert Defensive Rebound.,20,8,12,8,0.787982694202384,Duke,Pennsylvania,3,4,0,0,NA,400911948,2016-11-13,
71,1,2:21,1941,1941,Lexie Brown missed Three Point Jumper.,20,8,12,0,0.7888115633734363,Duke,Pennsylvania,3,4,0,0,NA,400911948,2016-11-13,
72,1,2:21,1941,1941,Lyneé Belton Offensive Rebound.,20,8,12,4,0.7888115633734363,Duke,Pennsylvania,3,4,0,0,NA,400911948,2016-11-13,
73,1,2:17,1937,1937,Foul on Princess Aghayere.,20,8,12,0,0.7892265732306609,Duke,Pennsylvania,3,4,0,0,NA,400911948,2016-11-13,
74,1,2:17,1937,1937,Rebecca Greenwell missed Free Throw.,20,8,12,0,0.7892265732306609,Duke,Pennsylvania,3,4,0,0,NA,400911948,2016-11-13,
75,1,2:17,1937,1937,Duke Deadball Team Rebound.,20,8,12,0,0.7892265732306609,Duke,Pennsylvania,3,4,0,0,NA,400911948,2016-11-13,
76,1,2:17,1937,1937,Rebecca Greenwell made Free Throw.,21,8,13,11,0.8069468350777564,Duke,Pennsylvania,3,4,0,0,NA,400911948,2016-11-13,Duke
77,1,2:06,1926,1926,Anna Ross made Layup.,21,10,11,18,0.771456958751858,Duke,Pennsylvania,3,4,0,0,NA,400911948,2016-11-13,Pennsylvania
78,1,1:48,1908,1908,Rebecca Greenwell missed Three Point Jumper.,21,10,11,0,0.7732710939441028,Duke,Pennsylvania,3,4,0,0,NA,400911948,2016-11-13,
79,1,1:48,1908,1908,Princess Aghayere Block.,21,10,11,2,0.7732710939441028,Duke,Pennsylvania,3,4,0,0,NA,400911948,2016-11-13,
80,1,1:46,1906,1906,Rebecca Greenwell Offensive Rebound.,21,10,11,4,0.7734718312593025,Duke,Pennsylvania,3,4,0,0,NA,400911948,2016-11-13,
81,1,1:42,1902,1902,Lyneé Belton missed Layup.,21,10,11,0,0.7738728642781748,Duke,Pennsylvania,3,4,0,0,NA,400911948,2016-11-13,
82,1,1:42,1902,1902,Lauren Whitlatch Defensive Rebound.,21,10,11,5,0.7738728642781748,Duke,Pennsylvania,3,4,0,0,NA,400911948,2016-11-13,
83,1,1:37,1897,1897,Lauren Whitlatch missed Three Point Jumper.,21,10,11,0,0.7743733772276207,Duke,Pennsylvania,3,4,0,0,NA,400911948,2016-11-13,
84,1,1:37,1897,1897,Kendall Cooper Defensive Rebound.,21,10,11,9,0.7743733772276207,Duke,Pennsylvania,3,4,0,0,NA,400911948,2016-11-13,
85,1,1:28,1888,1888,Rebecca Greenwell missed Jumper.,21,10,11,0,0.7752723475330451,Duke,Pennsylvania,3,4,0,0,NA,400911948,2016-11-13,
86,1,1:28,1888,1888,Sydney Stipanovich Defensive Rebound.,21,10,11,18,0.7752723475330451,Duke,Pennsylvania,3,4,0,0,NA,400911948,2016-11-13,
87,1,1:10,1870,1870,Sydney Stipanovich missed Jumper.,21,10,11,0,0.7770642896200185,Duke,Pennsylvania,3,4,0,0,NA,400911948,2016-11-13,
88,1,1:10,1870,1870,Lyneé Belton Defensive Rebound.,21,10,11,21,0.7770642896200185,Duke,Pennsylvania,3,4,0,0,NA,400911948,2016-11-13,
89,1,0:49,1849,1849,Kyra Lambert missed Jumper.,21,10,11,0,0.77914859432399,Duke,Pennsylvania,3,4,0,0,NA,400911948,2016-11-13,
90,1,0:49,1849,1849,Anna Ross Defensive Rebound.,21,10,11,11,0.77914859432399,Duke,Pennsylvania,3,4,0,0,NA,400911948,2016-11-13,
91,1,0:38,1838,1838,Lauren Whitlatch made Jumper. Assisted by Anna Ross.,21,12,9,17,0.7382102235287054,Duke,Pennsylvania,3,4,0,0,NA,400911948,2016-11-13,Pennsylvania
92,1,0:21,1821,1821,Kendall Cooper missed Jumper.,21,12,9,0,0.7397667335431951,Duke,Pennsylvania,3,4,0,0,NA,400911948,2016-11-13,
93,1,0:21,1821,1821,Rebecca Greenwell Offensive Rebound.,21,12,9,4,0.7397667335431951,Duke,Pennsylvania,3,4,0,0,NA,400911948,2016-11-13,
94,1,0:17,1817,1817,Foul on Lauren Whitlatch.,21,12,9,0,0.7401337079148835,Duke,Pennsylvania,3,4,0,0,NA,400911948,2016-11-13,
95,1,0:17,1817,1817,Rebecca Greenwell made Free Throw.,22,12,10,0,0.7618700692922002,Duke,Pennsylvania,3,4,0,0,NA,400911948,2016-11-13,Duke
96,1,0:17,1817,1817,Rebecca Greenwell made Free Throw.,23,12,11,6,0.7823230251915401,Duke,Pennsylvania,3,4,0,0,NA,400911948,2016-11-13,Duke
97,1,0:11,1811,1811,Anna Ross made Layup. Assisted by Beth Brzozowski.,23,14,9,10,0.7406848331988772,Duke,Pennsylvania,3,4,0,0,NA,400911948,2016-11-13,Pennsylvania
98,1,0:01,1801,1801,Lexie Brown made Three Point Jumper. Assisted by Oderah Chidom.,26,14,12,1,0.8030983252195599,Duke,Pennsylvania,3,4,0,0,NA,400911948,2016-11-13,Duke
99,1,0:00,1800,1800,End of 1st Quarter,26,14,12,11,0.8031997778152151,Duke,Pennsylvania,3,4,0,0,NA,400911948,2016-11-13,
100,2,9:49,1789,1789,Lexie Brown missed Three Point Jumper.,26,14,12,0,0.8043170256469057,Duke,Pennsylvania,4,4,0,0,NA,400911948,2016-11-13,
101,2,9:49,1789,1789,Erin Mathias Offensive Rebound.,26,14,12,8,0.8043170256469057,Duke,Pennsylvania,4,4,0,0,NA,400911948,2016-11-13,
102,2,9:41,1781,1781,Rebecca Greenwell missed Jumper.,26,14,12,0,0.8051312945764635,Duke,Pennsylvania,4,4,0,0,NA,400911948,2016-11-13,
103,2,9:41,1781,1781,Erin Mathias Offensive Rebound.,26,14,12,19,0.8051312945764635,Duke,Pennsylvania,4,4,0,0,NA,400911948,2016-11-13,
104,2,9:22,1762,1762,Erin Mathias missed Jumper.,26,14,12,0,0.8070726646079005,Duke,Pennsylvania,4,4,0,0,NA,400911948,2016-11-13,
105,2,9:22,1762,1762,Oderah Chidom Offensive Rebound.,26,14,12,0,0.8070726646079005,Duke,Pennsylvania,4,4,0,0,NA,400911948,2016-11-13,
106,2,9:22,1762,1762,Foul on Jackie Falconer.,26,14,12,9,0.8070726646079005,Duke,Pennsylvania,4,4,0,0,NA,400911948,2016-11-13,
107,2,9:13,1753,1753,Oderah Chidom Turnover.,26,14,12,10,0.8079966910285837,Duke,Pennsylvania,4,4,0,0,NA,400911948,2016-11-13,
108,2,9:03,1743,1743,Foul on Lexie Brown.,26,14,12,9,0.8090273145492878,Duke,Pennsylvania,4,4,0,0,NA,400911948,2016-11-13,
109,2,8:54,1734,1734,Anna Ross Turnover.,26,14,12,0,0.8099587906253403,Duke,Pennsylvania,4,4,0,0,NA,400911948,2016-11-13,
110,2,8:54,1734,1734,Oderah Chidom Steal.,26,14,12,9,0.8099587906253403,Duke,Pennsylvania,4,4,0,0,NA,400911948,2016-11-13,
111,2,8:45,1725,1725,Lexie Brown missed Three Point Jumper.,26,14,12,0,0.8108943286137172,Duke,Pennsylvania,4,4,0,0,NA,400911948,2016-11-13,
112,2,8:45,1725,1725,Anna Ross Defensive Rebound.,26,14,12,9,0.8108943286137172,Duke,Pennsylvania,4,4,0,0,NA,400911948,2016-11-13,
113,2,8:36,1716,1716,Michelle Nwokedi missed Jumper.,26,14,12,0,0.8118342620051553,Duke,Pennsylvania,4,4,0,0,NA,400911948,2016-11-13,
114,2,8:36,1716,1716,Sydney Stipanovich Offensive Rebound.,26,14,12,2,0.8118342620051553,Duke,Pennsylvania,4,4,0,0,NA,400911948,2016-11-13,
115,2,8:34,1714,1714,Foul on Erin Mathias.,26,14,12,21,0.8120437659902888,Duke,Pennsylvania,4,4,0,0,NA,400911948,2016-11-13,
116,2,8:13,1693,1693,Sydney Stipanovich made Jumper. Assisted by Michelle Nwokedi.,26,16,10,18,0.7740987918804086,Duke,Pennsylvania,4,4,0,0,NA,400911948,2016-11-13,Pennsylvania
117,2,7:55,1675,1675,Rebecca Greenwell missed Layup.,26,16,10,0,0.7759223029871444,Duke,Pennsylvania,4,4,0,0,NA,400911948,2016-11-13,
118,2,7:55,1675,1675,Michelle Nwokedi Block.,26,16,10,0,0.7759223029871444,Duke,Pennsylvania,4,4,0,0,NA,400911948,2016-11-13,
119,2,7:55,1675,1675,Duke Offensive Rebound.,26,16,10,8,0.7759223029871444,Duke,Pennsylvania,4,4,0,0,NA,400911948,2016-11-13,
120,2,7:47,1667,1667,Oderah Chidom missed Layup.,26,16,10,0,0.7767149804359581,Duke,Pennsylvania,4,4,0,0,NA,400911948,2016-11-13,
121,2,7:47,1667,1667,Sydney Stipanovich Defensive Rebound.,26,16,10,24,0.7767149804359581,Duke,Pennsylvania,4,4,0,0,NA,400911948,2016-11-13,
122,2,7:23,1643,1643,Beth Brzozowski missed Three Point Jumper.,26,16,10,0,0.7790383268261581,Duke,Pennsylvania,4,4,0,0,NA,400911948,2016-11-13,
123,2,7:23,1643,1643,Oderah Chidom Defensive Rebound.,26,16,10,9,0.7790383268261581,Duke,Pennsylvania,4,4,0,0,NA,400911948,2016-11-13,
124,2,7:14,1634,1634,Rebecca Greenwell missed Jumper.,26,16,10,0,0.7798924849683554,Duke,Pennsylvania,4,4,0,0,NA,400911948,2016-11-13,
125,2,7:14,1634,1634,Rebecca Greenwell Offensive Rebound.,26,16,10,3,0.7798924849683554,Duke,Pennsylvania,4,4,0,0,NA,400911948,2016-11-13,
126,2,7:11,1631,1631,Rebecca Greenwell missed Three Point Jumper.,26,16,10,0,0.7801755574363958,Duke,Pennsylvania,4,4,0,0,NA,400911948,2016-11-13,
127,2,7:11,1631,1631,Sydney Stipanovich Defensive Rebound.,26,16,10,19,0.7801755574363958,Duke,Pennsylvania,4,4,0,0,NA,400911948,2016-11-13,
128,2,6:52,1612,1612,Kasey Chambers missed Three Point Jumper.,26,16,10,0,0.7819534104465748,Duke,Pennsylvania,4,4,0,0,NA,400911948,2016-11-13,
129,2,6:52,1612,1612,Michelle Nwokedi Offensive Rebound.,26,16,10,6,0.7819534104465748,Duke,Pennsylvania,4,4,0,0,NA,400911948,2016-11-13,
130,2,6:46,1606,1606,Foul on Erin Mathias.,26,16,10,0,0.7825108175090786,Duke,Pennsylvania,4,4,0,0,NA,400911948,2016-11-13,
131,2,6:46,1606,1606,Michelle Nwokedi missed Free Throw.,26,16,10,0,0.7825108175090786,Duke,Pennsylvania,4,4,0,0,NA,400911948,2016-11-13,
132,2,6:46,1606,1606,Pennsylvania Deadball Team Rebound.,26,16,10,0,0.7825108175090786,Duke,Pennsylvania,4,4,0,0,NA,400911948,2016-11-13,
133,2,6:46,1606,1606,Michelle Nwokedi made Free Throw.,26,17,9,6,0.7599349245442413,Duke,Pennsylvania,4,4,0,0,NA,400911948,2016-11-13,Pennsylvania
134,2,6:40,1600,1600,Lexie Brown made Layup.,28,17,11,15,0.8040800516871152,Duke,Pennsylvania,4,4,0,0,NA,400911948,2016-11-13,Duke
135,2,6:25,1585,1585,Anna Ross made Three Point Jumper. Assisted by Kasey Chambers.,28,20,8,20,0.7375850581736746,Duke,Pennsylvania,4,4,0,0,NA,400911948,2016-11-13,Pennsylvania
136,2,6:05,1565,1565,Kendall Cooper Turnover.,28,20,8,16,0.7392838508555032,Duke,Pennsylvania,4,4,0,0,NA,400911948,2016-11-13,
137,2,5:49,1549,1549,Michelle Nwokedi missed Three Point Jumper.,28,20,8,0,0.7406556989789264,Duke,Pennsylvania,4,4,0,0,NA,400911948,2016-11-13,
138,2,5:49,1549,1549,Rebecca Greenwell Defensive Rebound.,28,20,8,26,0.7406556989789264,Duke,Pennsylvania,4,4,0,0,NA,400911948,2016-11-13,
139,2,5:23,1523,1523,Lexie Brown made Layup. Assisted by Kendall Cooper.,30,20,10,16,0.7902697578615909,Duke,Pennsylvania,4,4,0,0,NA,400911948,2016-11-13,Duke
140,2,5:07,1507,1507,Alexis Glasgow made Three Point Jumper. Assisted by Anna Ross.,30,23,7,30,0.7181236265662885,Duke,Pennsylvania,4,4,0,0,NA,400911948,2016-11-13,Pennsylvania
141,2,4:37,1477,1477,Kendall Cooper missed Jumper.,30,23,7,0,0.7207248309090587,Duke,Pennsylvania,4,4,0,0,NA,400911948,2016-11-13,
142,2,4:37,1477,1477,Michelle Nwokedi Defensive Rebound.,30,23,7,27,0.7207248309090587,Duke,Pennsylvania,4,4,0,0,NA,400911948,2016-11-13,
143,2,4:10,1450,1450,Michelle Nwokedi Turnover.,30,23,7,0,0.7232021020417432,Duke,Pennsylvania,4,4,0,0,NA,400911948,2016-11-13,
144,2,4:10,1450,1450,Official TV Timeout,30,23,7,6,0.7232021020417432,Duke,Pennsylvania,4,4,0,0,NA,400911948,2016-11-13,
145,2,4:04,1444,1444,Leaonna Odom missed Layup.,30,23,7,0,0.7237649025821182,Duke,Pennsylvania,4,4,0,0,NA,400911948,2016-11-13,
146,2,4:04,1444,1444,Leaonna Odom Offensive Rebound.,30,23,7,3,0.7237649025821182,Duke,Pennsylvania,4,4,0,0,NA,400911948,2016-11-13,
147,2,4:01,1441,1441,Leaonna Odom Turnover.,30,23,7,3,0.7240432443690814,Duke,Pennsylvania,4,4,0,0,NA,400911948,2016-11-13,
148,2,3:58,1438,1438,Kasey Chambers Steal.,30,23,7,5,0.7243196506953241,Duke,Pennsylvania,4,4,0,0,NA,400911948,2016-11-13,
149,2,3:53,1433,1433,Alexis Glasgow missed Three Point Jumper.,30,23,7,0,0.7247762369972092,Duke,Pennsylvania,4,4,0,0,NA,400911948,2016-11-13,
150,2,3:53,1433,1433,Oderah Chidom Defensive Rebound.,30,23,7,32,0.7247762369972092,Duke,Pennsylvania,4,4,0,0,NA,400911948,2016-11-13,
151,2,3:21,1401,1401,Foul on Michelle Nwokedi.,30,23,7,0,0.7275997113499851,Duke,Pennsylvania,4,4,0,0,NA,400911948,2016-11-13,
152,2,3:21,1401,1401,Lexie Brown made Free Throw.,31,23,8,0,0.7545137334995153,Duke,Pennsylvania,4,4,0,0,NA,400911948,2016-11-13,Duke
153,2,3:21,1401,1401,Lexie Brown missed Free Throw.,31,23,8,0,0.7545137334995153,Duke,Pennsylvania,4,4,0,0,NA,400911948,2016-11-13,
154,2,3:21,1401,1401,Sydney Stipanovich Defensive Rebound.,31,23,8,13,0.7545137334995153,Duke,Pennsylvania,4,4,0,0,NA,400911948,2016-11-13,
155,2,3:08,1388,1388,Sydney Stipanovich missed Jumper.,31,23,8,0,0.7557009406941532,Duke,Pennsylvania,4,4,0,0,NA,400911948,2016-11-13,
156,2,3:08,1388,1388,Anna Ross Offensive Rebound.,31,23,8,6,0.7557009406941532,Duke,Pennsylvania,4,4,0,0,NA,400911948,2016-11-13,
157,2,3:02,1382,1382,Alexis Glasgow missed Three Point Jumper.,31,23,8,0,0.7562441786092368,Duke,Pennsylvania,4,4,0,0,NA,400911948,2016-11-13,
158,2,3:02,1382,1382,Lexie Brown Defensive Rebound.,31,23,8,12,0.7562441786092368,Duke,Pennsylvania,4,4,0,0,NA,400911948,2016-11-13,
159,2,2:50,1370,1370,Rebecca Greenwell missed Jumper.,31,23,8,0,0.7573250181763532,Duke,Pennsylvania,4,4,0,0,NA,400911948,2016-11-13,
160,2,2:50,1370,1370,Leaonna Odom Offensive Rebound.,31,23,8,9,0.7573250181763532,Duke,Pennsylvania,4,4,0,0,NA,400911948,2016-11-13,
161,2,2:41,1361,1361,Lyneé Belton missed Jumper.,31,23,8,0,0.7581331882103345,Duke,Pennsylvania,4,4,0,0,NA,400911948,2016-11-13,
162,2,2:41,1361,1361,Sydney Stipanovich Block.,31,23,8,1,0.7581331882103345,Duke,Pennsylvania,4,4,0,0,NA,400911948,2016-11-13,
163,2,2:40,1360,1360,Oderah Chidom Offensive Rebound.,31,23,8,2,0.7582229605713092,Duke,Pennsylvania,4,4,0,0,NA,400911948,2016-11-13,
164,2,2:38,1358,1358,Oderah Chidom made Layup.,33,23,10,20,0.806889876249865,Duke,Pennsylvania,4,4,0,0,NA,400911948,2016-11-13,Duke
165,2,2:18,1338,1338,Alexis Glasgow missed Three Point Jumper.,33,23,10,0,0.8088029484750975,Duke,Pennsylvania,4,4,0,0,NA,400911948,2016-11-13,
166,2,2:18,1338,1338,Lyneé Belton Defensive Rebound.,33,23,10,24,0.8088029484750975,Duke,Pennsylvania,4,4,0,0,NA,400911948,2016-11-13,
167,2,1:54,1314,1314,Oderah Chidom Turnover.,33,23,10,18,0.8111322795091142,Duke,Pennsylvania,4,4,0,0,NA,400911948,2016-11-13,
168,2,1:36,1296,1296,Lauren Whitlatch missed Three Point Jumper.,33,23,10,0,0.8129258465913569,Duke,Pennsylvania,4,4,0,0,NA,400911948,2016-11-13,
169,2,1:36,1296,1296,Kasey Chambers Offensive Rebound.,33,23,10,6,0.8129258465913569,Duke,Pennsylvania,4,4,0,0,NA,400911948,2016-11-13,
170,2,1:30,1290,1290,Kasey Chambers missed Layup.,33,23,10,0,0.813535789261581,Duke,Pennsylvania,4,4,0,0,NA,400911948,2016-11-13,
171,2,1:30,1290,1290,Kendall Cooper Block.,33,23,10,1,0.813535789261581,Duke,Pennsylvania,4,4,0,0,NA,400911948,2016-11-13,
172,2,1:29,1289,1289,Pennsylvania Offensive Rebound.,33,23,10,18,0.8136381134821088,Duke,Pennsylvania,4,4,0,0,NA,400911948,2016-11-13,
173,2,1:11,1271,1271,Kasey Chambers missed Three Point Jumper.,33,23,10,0,0.8155163427535259,Duke,Pennsylvania,4,4,0,0,NA,400911948,2016-11-13,
174,2,1:11,1271,1271,Rebecca Greenwell Defensive Rebound.,33,23,10,19,0.8155163427535259,Duke,Pennsylvania,4,4,0,0,NA,400911948,2016-11-13,
175,2,0:52,1252,1252,Foul on Sydney Stipanovich.,33,23,10,0,0.8175853070822168,Duke,Pennsylvania,4,4,0,0,NA,400911948,2016-11-13,
176,2,0:52,1252,1252,Lyneé Belton missed Free Throw.,33,23,10,0,0.8175853070822168,Duke,Pennsylvania,4,4,0,0,NA,400911948,2016-11-13,
177,2,0:52,1252,1252,Duke Deadball Team Rebound.,33,23,10,0,0.8175853070822168,Duke,Pennsylvania,4,4,0,0,NA,400911948,2016-11-13,
178,2,0:52,1252,1252,Lyneé Belton missed Free Throw.,33,23,10,0,0.8175853070822168,Duke,Pennsylvania,4,4,0,0,NA,400911948,2016-11-13,
179,2,0:52,1252,1252,Kasey Chambers Defensive Rebound.,33,23,10,23,0.8175853070822168,Duke,Pennsylvania,4,4,0,0,NA,400911948,2016-11-13,
180,2,0:29,1229,1229,Foul on Kendall Cooper.,33,23,10,0,0.8202327281074044,Duke,Pennsylvania,4,4,0,0,NA,400911948,2016-11-13,
181,2,0:29,1229,1229,Jackie Falconer missed Free Throw.,33,23,10,0,0.8202327281074044,Duke,Pennsylvania,4,4,0,0,NA,400911948,2016-11-13,
182,2,0:29,1229,1229,Pennsylvania Deadball Team Rebound.,33,23,10,0,0.8202327281074044,Duke,Pennsylvania,4,4,0,0,NA,400911948,2016-11-13,
183,2,0:29,1229,1229,Jackie Falconer missed Free Throw.,33,23,10,0,0.8202327281074044,Duke,Pennsylvania,4,4,0,0,NA,400911948,2016-11-13,
184,2,0:29,1229,1229,Kendall Cooper Defensive Rebound.,33,23,10,17,0.8202327281074044,Duke,Pennsylvania,4,4,0,0,NA,400911948,2016-11-13,
185,2,0:12,1212,1212,Duke  Timeout,33,23,10,5,0.8223059293945836,Duke,Pennsylvania,4,3,0,1,NA,400911948,2016-11-13,
186,2,0:07,1207,1207,Kyra Lambert made Layup.,35,23,12,7,0.8633758324723285,Duke,Pennsylvania,4,3,0,1,NA,400911948,2016-11-13,Duke
187,2,0:00,1200,1200,End of 2nd Quarter,35,23,12,20,0.8642163350891481,Duke,Pennsylvania,4,3,0,1,NA,400911948,2016-11-13,
188,3,9:40,1180,1180,Anna Ross missed Jumper.,35,23,12,0,0.8665352908648016,Duke,Pennsylvania,5,4,0,0,NA,400911948,2016-11-13,
189,3,9:40,1180,1180,Erin Mathias Block.,35,23,12,1,0.8665352908648016,Duke,Pennsylvania,5,4,0,0,NA,400911948,2016-11-13,
190,3,9:39,1179,1179,Erin Mathias Defensive Rebound.,35,23,12,9,0.8666484525775063,Duke,Pennsylvania,5,4,0,0,NA,400911948,2016-11-13,
