play_id,period,time_remaining_period,secs_remaining,secs_remaining_absolute,description,home_score,away_score,score_diff,play_length,win_prob,home,away,home_time_out_remaining,away_time_out_remaining,home_timeout_ind,away_timeout_ind,home_favored_by,game_id,date,whichScored
1,1,9:43,2383,2383,Jocelyn Willoughby made Three Point Jumper. Assisted by Dominique Toussaint.,0,0,0,15,0.5,Virginia,South Florida,4,4,0,0,NA,401090542,2018-12-21,NA
2,1,9:28,2368,2368,Laura Ferreira made Layup.,3,2,1,18,0.5223965953861575,Virginia,South Florida,4,4,0,0,NA,401090542,2018-12-21,Virginia
3,1,9:10,2350,2350,Dominique Toussaint missed Jumper.,3,2,1,0,0.5225914065901247,Virginia,South Florida,4,4,0,0,NA,401090542,2018-12-21,
4,1,9:10,2350,2350,Alyssa Rader Defensive Rebound.,3,2,1,15,0.5225914065901247,Virginia,South Florida,4,4,0,0,NA,401090542,2018-12-21,
5,1,8:55,2335,2335,Laura Ferreira made Jumper.,3,4,-1,21,0.4772446260183281,Virginia,South Florida,4,4,0,0,NA,401090542,2018-12-21,South Florida
6,1,8:34,2314,2314,Brianna Tinsley missed Jumper.,3,4,-1,0,0.4770127695922438,Virginia,South Florida,4,4,0,0,NA,401090542,2018-12-21,
7,1,8:34,2314,2314,Beatriz Jordao Defensive Rebound.,3,4,-1,14,0.4770127695922438,Virginia,South Florida,4,4,0,0,NA,401090542,2018-12-21,
8,1,8:20,2300,2300,Beatriz Jordao missed Jumper.,3,4,-1,0,0.4768568141568248,Virginia,South Florida,4,4,0,0,NA,401090542,2018-12-21,
9,1,8:20,2300,2300,Alyssa Rader Offensive Rebound.,3,4,-1,6,0.4768568141568248,Virginia,South Florida,4,4,0,0,NA,401090542,2018-12-21,
10,1,8:14,2294,2294,Beatriz Jordao missed Jumper.,3,4,-1,0,0.47678965866213896,Virginia,South Florida,4,4,0,0,NA,401090542,2018-12-21,
11,1,8:14,2294,2294,Lisa Jablonowski Defensive Rebound.,3,4,-1,15,0.47678965866213896,Virginia,South Florida,4,4,0,0,NA,401090542,2018-12-21,
12,1,7:59,2279,2279,Jocelyn Willoughby missed Jumper.,3,4,-1,0,0.4766209850294595,Virginia,South Florida,4,4,0,0,NA,401090542,2018-12-21,
13,1,7:59,2279,2279,Elisa Pinzan Defensive Rebound.,3,4,-1,12,0.4766209850294595,Virginia,South Florida,4,4,0,0,NA,401090542,2018-12-21,
14,1,7:47,2267,2267,Alyssa Rader made Layup. Assisted by Elisa Pinzan.,3,6,-3,23,0.42986918725572126,Virginia,South Florida,4,4,0,0,NA,401090542,2018-12-21,South Florida
15,1,7:24,2244,2244,Lisa Jablonowski Turnover.,3,6,-3,2,0.42909767566260976,Virginia,South Florida,4,4,0,0,NA,401090542,2018-12-21,
16,1,7:22,2242,2242,Sydni Harvey Steal.,3,6,-3,6,0.42903031265841174,Virginia,South Florida,4,4,0,0,NA,401090542,2018-12-21,
17,1,7:16,2236,2236,Beatriz Jordao made Layup. Assisted by Alyssa Rader.,3,8,-5,2,0.38278964656005837,Virginia,South Florida,4,4,0,0,NA,401090542,2018-12-21,South Florida
18,1,7:14,2234,2234,Virginia  Timeout,3,8,-5,0,0.38268109522381877,Virginia,South Florida,3,4,1,0,NA,401090542,2018-12-21,
19,1,7:14,2234,2234,Official TV Timeout,3,8,-5,13,0.38268109522381877,Virginia,South Florida,3,4,1,0,NA,401090542,2018-12-21,
20,1,7:01,2221,2221,Dominique Toussaint missed Three Point Jumper.,3,8,-5,0,0.3819742235102472,Virginia,South Florida,3,4,1,0,NA,401090542,2018-12-21,
21,1,7:01,2221,2221,Beatriz Jordao Defensive Rebound.,3,8,-5,14,0.3819742235102472,Virginia,South Florida,3,4,1,0,NA,401090542,2018-12-21,
22,1,6:47,2207,2207,Laura Ferreira made Three Point Jumper. Assisted by Elisa Pinzan.,3,11,-8,16,0.3153855358381446,Virginia,South Florida,3,4,1,0,NA,401090542,2018-12-21,South Florida
23,1,6:31,2191,2191,Dominique Toussaint missed Jumper.,3,11,-8,0,0.3141048866335044,Virginia,South Florida,3,4,1,0,NA,401090542,2018-12-21,
24,1,6:31,2191,2191,Moné Jones Offensive Rebound.,3,11,-8,3,0.3141048866335044,Virginia,South Florida,3,4,1,0,NA,401090542,2018-12-21,
25,1,6:28,2188,2188,Moné Jones Turnover.,3,11,-8,14,0.3138645886863517,Virginia,South Florida,3,4,1,0,NA,401090542,2018-12-21,
26,1,6:14,2174,2174,Beatriz Jordao made Layup. Assisted by Elisa Pinzan.,3,13,-10,21,0.272067158969189,Virginia,South Florida,3,4,1,0,NA,401090542,2018-12-21,South Florida
27,1,5:53,2153,2153,Jocelyn Willoughby missed Three Point Jumper.,3,13,-10,0,0.27012723764014634,Virginia,South Florida,3,4,0,0,NA,401090542,2018-12-21,
28,1,5:53,2153,2153,Moné Jones Offensive Rebound.,3,13,-10,3,0.27012723764014634,Virginia,South Florida,3,4,0,0,NA,401090542,2018-12-21,
29,1,5:50,2150,2150,Moné Jones missed Layup.,3,13,-10,0,0.2698497183387947,Virginia,South Florida,3,4,0,0,NA,401090542,2018-12-21,
30,1,5:50,2150,2150,Moné Jones Offensive Rebound.,3,13,-10,2,0.2698497183387947,Virginia,South Florida,3,4,0,0,NA,401090542,2018-12-21,
31,1,5:48,2148,2148,Moné Jones missed Layup.,3,13,-10,0,0.269664644464639,Virginia,South Florida,3,4,0,0,NA,401090542,2018-12-21,
32,1,5:48,2148,2148,Laura Ferreira Defensive Rebound.,3,13,-10,18,0.269664644464639,Virginia,South Florida,3,4,0,0,NA,401090542,2018-12-21,
33,1,5:30,2130,2130,Beatriz Jordao Turnover.,3,13,-10,0,0.2679966317352766,Virginia,South Florida,3,4,0,0,NA,401090542,2018-12-21,
34,1,5:30,2130,2130,Foul on Beatriz Jordao.,3,13,-10,15,0.2679966317352766,Virginia,South Florida,3,4,0,0,NA,401090542,2018-12-21,
35,1,5:15,2115,2115,Jocelyn Willoughby made Jumper.,5,13,-8,16,0.3079883399673244,Virginia,South Florida,3,4,0,0,NA,401090542,2018-12-21,Virginia
36,1,4:59,2099,2099,Sydni Harvey made Three Point Jumper.,5,16,-11,26,0.24572969136915956,Virginia,South Florida,3,4,0,0,NA,401090542,2018-12-21,South Florida
37,1,4:33,2073,2073,Foul on Laura Ferreira.,5,16,-11,0,0.24318630195719673,Virginia,South Florida,3,4,0,0,NA,401090542,2018-12-21,
38,1,4:33,2073,2073,Dominique Toussaint made Free Throw.,6,16,-10,0,0.26268082384665264,Virginia,South Florida,3,4,0,0,NA,401090542,2018-12-21,Virginia
39,1,4:33,2073,2073,Dominique Toussaint made Free Throw.,7,16,-9,15,0.2831534025111303,Virginia,South Florida,3,4,0,0,NA,401090542,2018-12-21,Virginia
40,1,4:18,2058,2058,Enna Pehadzic made Jumper.,7,18,-11,16,0.24171385131490158,Virginia,South Florida,3,4,0,0,NA,401090542,2018-12-21,South Florida
41,1,4:02,2042,2042,Jocelyn Willoughby made Jumper.,9,18,-9,17,0.28039974480515484,Virginia,South Florida,3,4,0,0,NA,401090542,2018-12-21,Virginia
42,1,3:45,2025,2025,Foul on Jocelyn Willoughby.,9,18,-9,9,0.2788793182197024,Virginia,South Florida,3,4,0,0,NA,401090542,2018-12-21,
43,1,3:36,2016,2016,Alyssa Rader missed Layup.,9,18,-9,0,0.2780712047455477,Virginia,South Florida,3,4,0,0,NA,401090542,2018-12-21,
44,1,3:36,2016,2016,Alyssa Rader Offensive Rebound.,9,18,-9,3,0.2780712047455477,Virginia,South Florida,3,4,0,0,NA,401090542,2018-12-21,
45,1,3:33,2013,2013,Alyssa Rader missed Layup.,9,18,-9,0,0.27780132780006045,Virginia,South Florida,3,4,0,0,NA,401090542,2018-12-21,
46,1,3:33,2013,2013,Moné Jones Defensive Rebound.,9,18,-9,10,0.27780132780006045,Virginia,South Florida,3,4,0,0,NA,401090542,2018-12-21,
47,1,3:23,2003,2003,Erica Martinsen made Jumper.,11,18,-7,14,0.32156641738399094,Virginia,South Florida,3,4,0,0,NA,401090542,2018-12-21,Virginia
48,1,3:09,1989,1989,Enna Pehadzic Turnover.,11,18,-7,20,0.32049211327294685,Virginia,South Florida,3,4,0,0,NA,401090542,2018-12-21,
49,1,2:49,1969,1969,Erica Martinsen missed Jumper.,11,18,-7,0,0.3189464528798176,Virginia,South Florida,3,4,0,0,NA,401090542,2018-12-21,
50,1,2:49,1969,1969,Sydni Harvey Defensive Rebound.,11,18,-7,12,0.3189464528798176,Virginia,South Florida,3,4,0,0,NA,401090542,2018-12-21,
51,1,2:37,1957,1957,Alyssa Rader made Three Point Jumper. Assisted by Laura Ferreira.,11,21,-10,23,0.2516397870436345,Virginia,South Florida,3,4,0,0,NA,401090542,2018-12-21,South Florida
52,1,2:14,1934,1934,Moné Jones missed Three Point Jumper.,11,21,-10,0,0.24940537523930645,Virginia,South Florida,3,4,0,0,NA,401090542,2018-12-21,
53,1,2:14,1934,1934,Shae Leverett Defensive Rebound.,11,21,-10,11,0.24940537523930645,Virginia,South Florida,3,4,0,0,NA,401090542,2018-12-21,
54,1,2:03,1923,1923,Alyssa Rader missed Layup.,11,21,-10,0,0.248332544150534,Virginia,South Florida,3,4,0,0,NA,401090542,2018-12-21,
55,1,2:03,1923,1923,Dominique Toussaint Defensive Rebound.,11,21,-10,8,0.248332544150534,Virginia,South Florida,3,4,0,0,NA,401090542,2018-12-21,
56,1,1:55,1915,1915,Dominique Toussaint made Jumper.,13,21,-8,18,0.2912427305423862,Virginia,South Florida,3,4,0,0,NA,401090542,2018-12-21,Virginia
57,1,1:37,1897,1897,Sydni Harvey missed Three Point Jumper.,13,21,-8,0,0.2896976717750628,Virginia,South Florida,3,4,0,0,NA,401090542,2018-12-21,
58,1,1:37,1897,1897,Lisa Jablonowski Defensive Rebound.,13,21,-8,15,0.2896976717750628,Virginia,South Florida,3,4,0,0,NA,401090542,2018-12-21,
59,1,1:22,1882,1882,Dominique Toussaint missed Three Point Jumper.,13,21,-8,0,0.28841404312329266,Virginia,South Florida,3,4,0,0,NA,401090542,2018-12-21,
60,1,1:22,1882,1882,Enna Pehadzic Defensive Rebound.,13,21,-8,9,0.28841404312329266,Virginia,South Florida,3,4,0,0,NA,401090542,2018-12-21,
61,1,1:13,1873,1873,Enna Pehadzic made Layup.,13,23,-10,15,0.2435041993475778,Virginia,South Florida,3,4,0,0,NA,401090542,2018-12-21,South Florida
62,1,0:58,1858,1858,Khyasia Caldwell missed Layup.,13,23,-10,0,0.2420649079498186,Virginia,South Florida,3,4,0,0,NA,401090542,2018-12-21,
63,1,0:58,1858,1858,Shae Leverett Defensive Rebound.,13,23,-10,24,0.2420649079498186,Virginia,South Florida,3,4,0,0,NA,401090542,2018-12-21,
64,1,0:34,1834,1834,Alyssa Rader made Jumper.,13,25,-12,27,0.2002433014762035,Virginia,South Florida,3,4,0,0,NA,401090542,2018-12-21,South Florida
65,1,0:07,1807,1807,Moné Jones made Jumper. Assisted by Dominique Toussaint.,15,25,-10,7,0.23716695103825974,Virginia,South Florida,3,4,0,0,NA,401090542,2018-12-21,Virginia
66,1,0:00,1800,1800,End of 1st Quarter,15,25,-10,22,0.23649150459798127,Virginia,South Florida,3,4,0,0,NA,401090542,2018-12-21,
67,2,9:38,1778,1778,Enna Pehadzic missed Three Point Jumper.,15,25,-10,0,0.2343592426474705,Virginia,South Florida,4,4,0,0,NA,401090542,2018-12-21,
68,2,9:38,1778,1778,Shae Leverett Offensive Rebound.,15,25,-10,4,0.2343592426474705,Virginia,South Florida,4,4,0,0,NA,401090542,2018-12-21,
69,2,9:34,1774,1774,Shae Leverett Turnover.,15,25,-10,16,0.23396973099762525,Virginia,South Florida,4,4,0,0,NA,401090542,2018-12-21,
70,2,9:18,1758,1758,Foul on Enna Pehadzic.,15,25,-10,0,0.2324049420390874,Virginia,South Florida,4,4,0,0,NA,401090542,2018-12-21,
71,2,9:18,1758,1758,Jocelyn Willoughby missed Free Throw.,15,25,-10,0,0.2324049420390874,Virginia,South Florida,4,4,0,0,NA,401090542,2018-12-21,
72,2,9:18,1758,1758,Virginia Deadball Team Rebound.,15,25,-10,0,0.2324049420390874,Virginia,South Florida,4,4,0,0,NA,401090542,2018-12-21,
73,2,9:18,1758,1758,Jocelyn Willoughby made Free Throw.,16,25,-9,16,0.25439592182251775,Virginia,South Florida,4,4,0,0,NA,401090542,2018-12-21,Virginia
74,2,9:02,1742,1742,Enna Pehadzic missed Jumper.,16,25,-9,0,0.2528861319950729,Virginia,South Florida,4,4,0,0,NA,401090542,2018-12-21,
75,2,9:02,1742,1742,Enna Pehadzic Offensive Rebound.,16,25,-9,4,0.2528861319950729,Virginia,South Florida,4,4,0,0,NA,401090542,2018-12-21,
76,2,8:58,1738,1738,Foul on Khyasia Caldwell.,16,25,-9,1,0.2525064274540705,Virginia,South Florida,4,4,0,0,NA,401090542,2018-12-21,
77,2,8:57,1737,1737,Tamara Henshaw made Jumper. Assisted by Elisa Pinzan.,16,27,-11,14,0.2096427660443517,Virginia,South Florida,4,4,0,0,NA,401090542,2018-12-21,South Florida
78,2,8:43,1723,1723,Erica Martinsen made Jumper. Assisted by Khyasia Caldwell.,18,27,-9,9,0.2510737217502943,Virginia,South Florida,4,4,0,0,NA,401090542,2018-12-21,Virginia
79,2,8:34,1714,1714,Janeta Rozentale missed Jumper.,18,27,-9,0,0.25020695653654607,Virginia,South Florida,4,4,0,0,NA,401090542,2018-12-21,
80,2,8:34,1714,1714,Erica Martinsen Defensive Rebound.,18,27,-9,9,0.25020695653654607,Virginia,South Florida,4,4,0,0,NA,401090542,2018-12-21,
81,2,8:25,1705,1705,Erica Martinsen missed Three Point Jumper.,18,27,-9,0,0.24933443168210076,Virginia,South Florida,4,4,0,0,NA,401090542,2018-12-21,
82,2,8:25,1705,1705,Tamara Henshaw Defensive Rebound.,18,27,-9,17,0.24933443168210076,Virginia,South Florida,4,4,0,0,NA,401090542,2018-12-21,
83,2,8:08,1688,1688,Janeta Rozentale Turnover.,18,27,-9,20,0.2476700031118941,Virginia,South Florida,4,4,0,0,NA,401090542,2018-12-21,
84,2,7:48,1668,1668,Jocelyn Willoughby made Jumper.,20,27,-7,21,0.2947885313017884,Virginia,South Florida,4,4,0,0,NA,401090542,2018-12-21,Virginia
85,2,7:27,1647,1647,Foul on Erica Martinsen.,20,27,-7,0,0.2930749814801282,Virginia,South Florida,4,4,0,0,NA,401090542,2018-12-21,
86,2,7:27,1647,1647,Sydni Harvey missed Free Throw.,20,27,-7,0,0.2930749814801282,Virginia,South Florida,4,4,0,0,NA,401090542,2018-12-21,
87,2,7:27,1647,1647,South Florida Deadball Team Rebound.,20,27,-7,0,0.2930749814801282,Virginia,South Florida,4,4,0,0,NA,401090542,2018-12-21,
88,2,7:27,1647,1647,Sydni Harvey made Free Throw.,20,28,-8,26,0.2677082408888585,Virginia,South Florida,4,4,0,0,NA,401090542,2018-12-21,South Florida
89,2,7:01,1621,1621,Lisa Jablonowski missed Jumper.,20,28,-8,0,0.2654685243161618,Virginia,South Florida,4,4,0,0,NA,401090542,2018-12-21,
90,2,7:01,1621,1621,Khyasia Caldwell Offensive Rebound.,20,28,-8,17,0.2654685243161618,Virginia,South Florida,4,4,0,0,NA,401090542,2018-12-21,
91,2,6:44,1604,1604,Jocelyn Willoughby made Three Point Jumper. Assisted by Khyasia Caldwell.,23,28,-5,20,0.34508278330082764,Virginia,South Florida,4,4,0,0,NA,401090542,2018-12-21,Virginia
92,2,6:24,1584,1584,Sydni Harvey missed Three Point Jumper.,23,28,-5,0,0.34385030654282556,Virginia,South Florida,4,4,0,0,NA,401090542,2018-12-21,
93,2,6:24,1584,1584,Enna Pehadzic Offensive Rebound.,23,28,-5,15,0.34385030654282556,Virginia,South Florida,4,4,0,0,NA,401090542,2018-12-21,
94,2,6:09,1569,1569,Laura Ferreira made Three Point Jumper.,23,31,-8,16,0.26105697740412726,Virginia,South Florida,4,4,0,0,NA,401090542,2018-12-21,South Florida
95,2,5:53,1553,1553,Lisa Jablonowski Turnover.,23,31,-8,0,0.2596887542276022,Virginia,South Florida,4,4,0,0,NA,401090542,2018-12-21,
96,2,5:53,1553,1553,Foul on Lisa Jablonowski.,23,31,-8,21,0.2596887542276022,Virginia,South Florida,4,4,0,0,NA,401090542,2018-12-21,
97,2,5:32,1532,1532,Foul on Brianna Tinsley.,23,31,-8,6,0.25786607654348775,Virginia,South Florida,4,4,0,0,NA,401090542,2018-12-21,
98,2,5:26,1526,1526,Sydni Harvey missed Layup.,23,31,-8,0,0.2573378180929273,Virginia,South Florida,4,4,0,0,NA,401090542,2018-12-21,
99,2,5:26,1526,1526,Shakyna Payne Block.,23,31,-8,2,0.2573378180929273,Virginia,South Florida,4,4,0,0,NA,401090542,2018-12-21,
100,2,5:24,1524,1524,Lisa Jablonowski Defensive Rebound.,23,31,-8,6,0.2571608674657768,Virginia,South Florida,4,4,0,0,NA,401090542,2018-12-21,
101,2,5:18,1518,1518,Dominique Toussaint missed Jumper.,23,31,-8,0,0.2566272436070097,Virginia,South Florida,4,4,0,0,NA,401090542,2018-12-21,
102,2,5:18,1518,1518,Virginia Offensive Rebound.,23,31,-8,16,0.2566272436070097,Virginia,South Florida,4,4,0,0,NA,401090542,2018-12-21,
103,2,5:02,1502,1502,Dominique Toussaint missed Three Point Jumper.,23,31,-8,0,0.2551816921558113,Virginia,South Florida,4,4,0,0,NA,401090542,2018-12-21,
104,2,5:02,1502,1502,Beatriz Jordao Defensive Rebound.,23,31,-8,23,0.2551816921558113,Virginia,South Florida,4,4,0,0,NA,401090542,2018-12-21,
105,2,4:39,1479,1479,Enna Pehadzic made Three Point Jumper. Assisted by Laura Ferreira.,23,34,-11,18,0.18415913222045444,Virginia,South Florida,4,4,0,0,NA,401090542,2018-12-21,South Florida
106,2,4:21,1461,1461,Lisa Jablonowski made Jumper. Assisted by Dominique Toussaint.,25,34,-9,12,0.22649412312916337,Virginia,South Florida,4,4,0,0,NA,401090542,2018-12-21,Virginia
107,2,4:09,1449,1449,Foul on Dominique Toussaint.,25,34,-9,0,0.22523635742651665,Virginia,South Florida,4,4,0,0,NA,401090542,2018-12-21,
108,2,4:09,1449,1449,Official TV Timeout,25,34,-9,0,0.22523635742651665,Virginia,South Florida,4,4,0,0,NA,401090542,2018-12-21,
109,2,4:09,1449,1449,Beatriz Jordao made Free Throw.,25,35,-10,0,0.20218797195864965,Virginia,South Florida,4,4,0,0,NA,401090542,2018-12-21,South Florida
110,2,4:09,1449,1449,Beatriz Jordao made Free Throw.,25,36,-11,10,0.18094728270314167,Virginia,South Florida,4,4,0,0,NA,401090542,2018-12-21,South Florida
111,2,3:59,1439,1439,Erica Martinsen missed Three Point Jumper.,25,36,-11,0,0.1798650381096919,Virginia,South Florida,4,4,0,0,NA,401090542,2018-12-21,
112,2,3:59,1439,1439,South Florida Defensive Rebound.,25,36,-11,24,0.1798650381096919,Virginia,South Florida,4,4,0,0,NA,401090542,2018-12-21,
113,2,3:35,1415,1415,Sydni Harvey made Layup.,25,38,-13,27,0.14024998224571975,Virginia,South Florida,4,4,0,0,NA,401090542,2018-12-21,South Florida
114,2,3:08,1388,1388,Foul on Jocelyn Willoughby.,25,38,-13,0,0.13763949894213243,Virginia,South Florida,4,4,0,0,NA,401090542,2018-12-21,
115,2,3:08,1388,1388,Jocelyn Willoughby Turnover.,25,38,-13,13,0.13763949894213243,Virginia,South Florida,4,4,0,0,NA,401090542,2018-12-21,
116,2,2:55,1375,1375,Beatriz Jordao made Layup. Assisted by Sydni Harvey.,25,40,-15,25,0.10628187439142775,Virginia,South Florida,4,4,0,0,NA,401090542,2018-12-21,South Florida
117,2,2:30,1350,1350,Foul on Alyssa Rader.,25,40,-15,8,0.10412074749809869,Virginia,South Florida,4,4,0,0,NA,401090542,2018-12-21,
118,2,2:22,1342,1342,Jocelyn Willoughby missed Three Point Jumper.,25,40,-15,0,0.10343231538626967,Virginia,South Florida,4,4,0,0,NA,401090542,2018-12-21,
119,2,2:22,1342,1342,Enna Pehadzic Defensive Rebound.,25,40,-15,10,0.10343231538626967,Virginia,South Florida,4,4,0,0,NA,401090542,2018-12-21,
120,2,2:12,1332,1332,Beatriz Jordao missed Layup.,25,40,-15,0,0.10257047186162058,Virginia,South Florida,4,4,0,0,NA,401090542,2018-12-21,
121,2,2:12,1332,1332,Lisa Jablonowski Block.,25,40,-15,4,0.10257047186162058,Virginia,South Florida,4,4,0,0,NA,401090542,2018-12-21,
122,2,2:08,1328,1328,Moné Jones Defensive Rebound.,25,40,-15,5,0.10222480131848154,Virginia,South Florida,4,4,0,0,NA,401090542,2018-12-21,
123,2,2:03,1323,1323,Erica Martinsen missed Three Point Jumper.,25,40,-15,0,0.10179160491197199,Virginia,South Florida,4,4,0,0,NA,401090542,2018-12-21,
124,2,2:03,1323,1323,Enna Pehadzic Defensive Rebound.,25,40,-15,21,0.10179160491197199,Virginia,South Florida,4,4,0,0,NA,401090542,2018-12-21,
125,2,1:42,1302,1302,Alyssa Rader Turnover.,25,40,-15,0,0.09995209224028556,Virginia,South Florida,4,4,0,0,NA,401090542,2018-12-21,
126,2,1:42,1302,1302,Foul on Alyssa Rader.,25,40,-15,10,0.09995209224028556,Virginia,South Florida,4,4,0,0,NA,401090542,2018-12-21,
127,2,1:32,1292,1292,Jocelyn Willoughby missed Three Point Jumper.,25,40,-15,0,0.0990603605241447,Virginia,South Florida,4,4,0,0,NA,401090542,2018-12-21,
128,2,1:32,1292,1292,Brianna Tinsley Offensive Rebound.,25,40,-15,16,0.0990603605241447,Virginia,South Florida,4,4,0,0,NA,401090542,2018-12-21,
129,2,1:16,1276,1276,Dominique Toussaint made Jumper. Assisted by Moné Jones.,27,40,-13,9,0.12701951808009293,Virginia,South Florida,4,4,0,0,NA,401090542,2018-12-21,Virginia
130,2,1:07,1267,1267,Enna Pehadzic missed Three Point Jumper.,27,40,-13,0,0.12610590086025722,Virginia,South Florida,4,4,0,0,NA,401090542,2018-12-21,
131,2,1:07,1267,1267,Virginia Defensive Rebound.,27,40,-13,27,0.12610590086025722,Virginia,South Florida,4,4,0,0,NA,401090542,2018-12-21,
132,2,0:40,1240,1240,Jocelyn Willoughby Turnover.,27,40,-13,1,0.1232524543285297,Virginia,South Florida,4,4,0,0,NA,401090542,2018-12-21,
133,2,0:39,1239,1239,Enna Pehadzic Steal.,27,40,-13,3,0.12314315873956885,Virginia,South Florida,4,4,0,0,NA,401090542,2018-12-21,
134,2,0:36,1236,1236,Sydni Harvey Turnover.,27,40,-13,1,0.12281359737847991,Virginia,South Florida,4,4,0,0,NA,401090542,2018-12-21,
135,2,0:35,1235,1235,Khyasia Caldwell Steal.,27,40,-13,4,0.1227031788665155,Virginia,South Florida,4,4,0,0,NA,401090542,2018-12-21,
136,2,0:31,1231,1231,Brianna Tinsley missed Three Point Jumper.,27,40,-13,0,0.12225862960986693,Virginia,South Florida,4,4,0,0,NA,401090542,2018-12-21,
137,2,0:31,1231,1231,Shae Leverett Defensive Rebound.,27,40,-13,13,0.12225862960986693,Virginia,South Florida,4,4,0,0,NA,401090542,2018-12-21,
138,2,0:18,1218,1218,South Florida  Timeout,27,40,-13,6,0.12078082838208114,Virginia,South Florida,4,3,0,1,NA,401090542,2018-12-21,
139,2,0:12,1212,1212,Sydni Harvey missed Jumper.,27,40,-13,0,0.1200809436312336,Virginia,South Florida,4,3,0,1,NA,401090542,2018-12-21,
140,2,0:12,1212,1212,Khyasia Caldwell Defensive Rebound.,27,40,-13,7,0.1200809436312336,Virginia,South Florida,4,3,0,1,NA,401090542,2018-12-21,
141,2,0:05,1205,1205,Khyasia Caldwell missed Layup.,27,40,-13,0,0.11925818288111503,Virginia,South Florida,4,3,0,1,NA,401090542,2018-12-21,
142,2,0:05,1205,1205,Sydni Harvey Defensive Rebound.,27,40,-13,5,0.11925818288111503,Virginia,South Florida,4,3,0,1,NA,401090542,2018-12-21,
143,2,0:00,1200,1200,End of 2nd Quarter,27,40,-13,22,0.11867997550573603,Virginia,South Florida,4,3,0,1,NA,401090542,2018-12-21,
144,3,9:38,1178,1178,Brianna Tinsley made Three Point Jumper. Assisted by Dominique Toussaint.,30,40,-10,18,0.17357227537137632,Virginia,South Florida,5,4,0,0,NA,401090542,2018-12-21,Virginia
145,3,9:20,1160,1160,Foul on Lisa Jablonowski.,30,40,-10,3,0.17150152846789632,Virginia,South Florida,5,4,0,0,NA,401090542,2018-12-21,
146,3,9:17,1157,1157,Elisa Pinzan missed Three Point Jumper.,30,40,-10,0,0.1711615477298322,Virginia,South Florida,5,4,0,0,NA,401090542,2018-12-21,
147,3,9:17,1157,1157,Moné Jones Defensive Rebound.,30,40,-10,14,0.1711615477298322,Virginia,South Florida,5,4,0,0,NA,401090542,2018-12-21,
148,3,9:03,1143,1143,Lisa Jablonowski Turnover.,30,40,-10,2,0.16958882249755253,Virginia,South Florida,5,4,0,0,NA,401090542,2018-12-21,
149,3,9:01,1141,1141,Sydni Harvey Steal.,30,40,-10,5,0.1693656102409591,Virginia,South Florida,5,4,0,0,NA,401090542,2018-12-21,
150,3,8:56,1136,1136,Laura Ferreira made Three Point Jumper. Assisted by Elisa Pinzan.,30,43,-13,23,0.11181622645087172,Virginia,South Florida,5,4,0,0,NA,401090542,2018-12-21,South Florida
151,3,8:33,1113,1113,Foul on Beatriz Jordao.,30,43,-13,5,0.10947419472956678,Virginia,South Florida,5,4,0,0,NA,401090542,2018-12-21,
152,3,8:28,1108,1108,Dominique Toussaint made Layup.,32,43,-11,16,0.14454261095180257,Virginia,South Florida,5,4,0,0,NA,401090542,2018-12-21,Virginia
153,3,8:12,1092,1092,Laura Ferreira made Layup.,32,45,-13,31,0.10733443372716968,Virginia,South Florida,5,4,0,0,NA,401090542,2018-12-21,South Florida
154,3,7:41,1061,1061,Dominique Toussaint made Jumper.,34,45,-11,18,0.13928549814438668,Virginia,South Florida,5,4,0,0,NA,401090542,2018-12-21,Virginia
155,3,7:23,1043,1043,Alyssa Rader missed Layup.,34,45,-11,0,0.13717375357071138,Virginia,South Florida,5,4,0,0,NA,401090542,2018-12-21,
156,3,7:23,1043,1043,Brianna Tinsley Defensive Rebound.,34,45,-11,6,0.13717375357071138,Virginia,South Florida,5,4,0,0,NA,401090542,2018-12-21,
157,3,7:17,1037,1037,Brianna Tinsley Turnover.,34,45,-11,2,0.1364525144877744,Virginia,South Florida,5,4,0,0,NA,401090542,2018-12-21,
158,3,7:15,1035,1035,Elisa Pinzan Steal.,34,45,-11,19,0.13620997848389607,Virginia,South Florida,5,4,0,0,NA,401090542,2018-12-21,
159,3,6:56,1016,1016,Beatriz Jordao missed Layup.,34,45,-11,0,0.13384806167866284,Virginia,South Florida,5,4,0,0,NA,401090542,2018-12-21,
160,3,6:56,1016,1016,Moné Jones Defensive Rebound.,34,45,-11,13,0.13384806167866284,Virginia,South Florida,5,4,0,0,NA,401090542,2018-12-21,
161,3,6:43,1003,1003,Brianna Tinsley made Jumper.,36,45,-9,15,0.1765682415667421,Virginia,South Florida,5,4,0,0,NA,401090542,2018-12-21,Virginia
162,3,6:28,988,988,Sydni Harvey Turnover.,36,45,-9,0,0.1744732665356709,Virginia,South Florida,5,4,0,0,NA,401090542,2018-12-21,
163,3,6:28,988,988,Foul on Sydni Harvey.,36,45,-9,12,0.1744732665356709,Virginia,South Florida,5,4,0,0,NA,401090542,2018-12-21,
164,3,6:16,976,976,Moné Jones missed Three Point Jumper.,36,45,-9,0,0.1727263328724527,Virginia,South Florida,5,4,0,0,NA,401090542,2018-12-21,
165,3,6:16,976,976,Shakyna Payne Offensive Rebound.,36,45,-9,4,0.1727263328724527,Virginia,South Florida,5,4,0,0,NA,401090542,2018-12-21,
166,3,6:12,972,972,Shakyna Payne made Layup.,38,45,-7,1,0.22765728879072172,Virginia,South Florida,5,4,0,0,NA,401090542,2018-12-21,Virginia
167,3,6:11,971,971,Foul on Beatriz Jordao.,38,45,-7,0,0.22751285719128544,Virginia,South Florida,5,4,0,0,NA,401090542,2018-12-21,
168,3,6:11,971,971,Shakyna Payne made Free Throw.,39,45,-6,6,0.2596518580861738,Virginia,South Florida,5,4,0,0,NA,401090542,2018-12-21,Virginia
169,3,6:05,965,965,Elisa Pinzan Turnover.,39,45,-6,1,0.2588458815041692,Virginia,South Florida,5,4,0,0,NA,401090542,2018-12-21,
170,3,6:04,964,964,Khyasia Caldwell Steal.,39,45,-6,2,0.2587143294826708,Virginia,South Florida,5,4,0,0,NA,401090542,2018-12-21,
171,3,6:02,962,962,Foul on Elisa Pinzan.,39,45,-6,0,0.2584536121399719,Virginia,South Florida,5,4,0,0,NA,401090542,2018-12-21,
172,3,6:02,962,962,Dominique Toussaint made Free Throw.,40,45,-5,0,0.2935195583688833,Virginia,South Florida,5,4,0,0,NA,401090542,2018-12-21,Virginia
173,3,6:02,962,962,Dominique Toussaint made Free Throw.,41,45,-4,18,0.3312180851508733,Virginia,South Florida,5,4,0,0,NA,401090542,2018-12-21,Virginia
174,3,5:44,944,944,Laura Ferreira missed Three Point Jumper.,41,45,-4,0,0.3295082493581304,Virginia,South Florida,5,4,0,0,NA,401090542,2018-12-21,
175,3,5:44,944,944,Khyasia Caldwell Defensive Rebound.,41,45,-4,6,0.3295082493581304,Virginia,South Florida,5,4,0,0,NA,401090542,2018-12-21,
176,3,5:38,938,938,Foul on Enna Pehadzic.,41,45,-4,0,0.3289728766989295,Virginia,South Florida,5,4,0,0,NA,401090542,2018-12-21,
177,3,5:38,938,938,Khyasia Caldwell made Free Throw.,42,45,-3,0,0.369438667121747,Virginia,South Florida,5,4,0,0,NA,401090542,2018-12-21,Virginia
178,3,5:38,938,938,Khyasia Caldwell made Free Throw.,43,45,-2,14,0.4118271544767493,Virginia,South Florida,5,4,0,0,NA,401090542,2018-12-21,Virginia
179,3,5:24,924,924,Laura Ferreira missed Layup.,43,45,-2,0,0.4111711448727001,Virginia,South Florida,5,4,0,0,NA,401090542,2018-12-21,
