play_id,period,time_remaining_period,secs_remaining,secs_remaining_absolute,description,home_score,away_score,score_diff,play_length,win_prob,home,away,home_time_out_remaining,away_time_out_remaining,home_timeout_ind,away_timeout_ind,home_favored_by,game_id,date,whichScored
189,3,7:17,1037,1037,Kaila Charles made Free Throw.,45,25,20,0,0.9662576486619104,Maryland,Illinois,4,4,0,0,NA,400914344,2017-02-09,Maryland
190,3,7:17,1037,1037,Kaila Charles made Free Throw.,46,25,21,9,0.9713187361693899,Maryland,Illinois,4,4,0,0,NA,400914344,2017-02-09,Maryland
191,3,7:08,1028,1028,Petra Holesinska made Three Point Jumper.,46,28,18,15,0.9541103576355577,Maryland,Illinois,4,4,0,0,NA,400914344,2017-02-09,Illinois
192,3,6:53,1013,1013,Destiny Slocum Turnover.,46,28,18,2,0.955258783152915,Maryland,Illinois,4,4,0,0,NA,400914344,2017-02-09,
193,3,6:51,1011,1011,Ali Andrews Steal.,46,28,18,8,0.9554141365302954,Maryland,Illinois,4,4,0,0,NA,400914344,2017-02-09,
194,3,6:43,1003,1003,Jaelyne Kirkpatrick Turnover.,46,28,18,1,0.9560411286118371,Maryland,Illinois,4,4,0,0,NA,400914344,2017-02-09,
195,3,6:42,1002,1002,Brionna Jones Steal.,46,28,18,3,0.9561201450444541,Maryland,Illinois,4,4,0,0,NA,400914344,2017-02-09,
196,3,6:39,999,999,Kaila Charles made Layup. Assisted by Destiny Slocum.,48,28,20,0,0.9686329177663218,Maryland,Illinois,4,4,0,0,NA,400914344,2017-02-09,Maryland
197,3,6:39,999,999,Foul on Ali Andrews.,48,28,20,0,0.9686329177663218,Maryland,Illinois,4,4,0,0,NA,400914344,2017-02-09,
198,3,6:39,999,999,Kaila Charles missed Free Throw.,48,28,20,0,0.9686329177663218,Maryland,Illinois,4,4,0,0,NA,400914344,2017-02-09,
199,3,6:39,999,999,Brionna Jones Offensive Rebound.,48,28,20,1,0.9686329177663218,Maryland,Illinois,4,4,0,0,NA,400914344,2017-02-09,
200,3,6:38,998,998,Foul on Ali Andrews.,48,28,20,0,0.9686972970569457,Maryland,Illinois,4,4,0,0,NA,400914344,2017-02-09,
201,3,6:38,998,998,Brionna Jones made Free Throw.,49,28,21,0,0.9735027607564575,Maryland,Illinois,4,4,0,0,NA,400914344,2017-02-09,Maryland
202,3,6:38,998,998,Brionna Jones made Free Throw.,50,28,22,6,0.9775875774735567,Maryland,Illinois,4,4,0,0,NA,400914344,2017-02-09,Maryland
203,3,6:32,992,992,Brandi Beasley made Layup.,50,30,20,7,0.9690857830804319,Maryland,Illinois,4,4,0,0,NA,400914344,2017-02-09,Illinois
204,3,6:25,985,985,Destiny Slocum missed Jumper.,50,30,20,0,0.9695438997427324,Maryland,Illinois,4,4,0,0,NA,400914344,2017-02-09,
205,3,6:25,985,985,Kaila Charles Offensive Rebound.,50,30,20,9,0.9695438997427324,Maryland,Illinois,4,4,0,0,NA,400914344,2017-02-09,
206,3,6:16,976,976,Shatori Walker-Kimbrough missed Three Point Jumper.,50,30,20,0,0.9701408262460925,Maryland,Illinois,4,4,0,0,NA,400914344,2017-02-09,
207,3,6:16,976,976,Brionna Jones Offensive Rebound.,50,30,20,5,0.9701408262460925,Maryland,Illinois,4,4,0,0,NA,400914344,2017-02-09,
208,3,6:11,971,971,Brionna Jones Turnover.,50,30,20,0,0.9704763683679987,Maryland,Illinois,4,4,0,0,NA,400914344,2017-02-09,
209,3,6:11,971,971,Jaelyne Kirkpatrick Steal.,50,30,20,9,0.9704763683679987,Maryland,Illinois,4,4,0,0,NA,400914344,2017-02-09,
210,3,6:02,962,962,Destiny Slocum Defensive Rebound.,50,30,20,0,0.9710667841268583,Maryland,Illinois,4,4,0,0,NA,400914344,2017-02-09,
211,3,6:02,962,962,Brandi Beasley missed Jumper.,50,30,20,13,0.9710667841268583,Maryland,Illinois,4,4,0,0,NA,400914344,2017-02-09,
212,3,5:49,949,949,Shatori Walker-Kimbrough missed Layup.,50,30,20,0,0.9718506458456874,Maryland,Illinois,4,4,0,0,NA,400914344,2017-02-09,
213,3,5:49,949,949,Sarah Overcash Defensive Rebound.,50,30,20,29,0.9718506458456874,Maryland,Illinois,4,4,0,0,NA,400914344,2017-02-09,
214,3,5:20,920,920,Courtney Joens Turnover.,50,30,20,14,0.9733703502789589,Maryland,Illinois,4,4,0,0,NA,400914344,2017-02-09,
215,3,5:06,906,906,Destiny Slocum made Three Point Jumper.,53,30,23,27,0.9847506646957074,Maryland,Illinois,4,4,0,0,NA,400914344,2017-02-09,Maryland
216,3,4:39,879,879,Jaelyne Kirkpatrick missed Layup.,53,30,23,0,0.9855482134217673,Maryland,Illinois,4,4,0,0,NA,400914344,2017-02-09,
217,3,4:39,879,879,Sarah Overcash Offensive Rebound.,53,30,23,3,0.9855482134217673,Maryland,Illinois,4,4,0,0,NA,400914344,2017-02-09,
218,3,4:36,876,876,Sarah Overcash missed Layup.,53,30,23,0,0.9856336952459329,Maryland,Illinois,4,4,0,0,NA,400914344,2017-02-09,
219,3,4:36,876,876,Stephanie Jones Defensive Rebound.,53,30,23,4,0.9856336952459329,Maryland,Illinois,4,4,0,0,NA,400914344,2017-02-09,
220,3,4:32,872,872,Ieshia Small made Layup. Assisted by Destiny Slocum.,55,30,25,10,0.990095657699702,Maryland,Illinois,4,4,0,0,NA,400914344,2017-02-09,Maryland
221,3,4:22,862,862,Illinois  Timeout,55,30,25,13,0.9903093523226186,Maryland,Illinois,3,4,1,0,NA,400914344,2017-02-09,
222,3,4:09,849,849,Brandi Beasley missed Jumper.,55,30,25,0,0.9905863002206164,Maryland,Illinois,3,4,1,0,NA,400914344,2017-02-09,
223,3,4:09,849,849,Brandi Beasley Offensive Rebound.,55,30,25,7,0.9905863002206164,Maryland,Illinois,3,4,1,0,NA,400914344,2017-02-09,
224,3,4:02,842,842,Jaelyne Kirkpatrick missed Layup.,55,30,25,0,0.9907361997930585,Maryland,Illinois,3,4,1,0,NA,400914344,2017-02-09,
225,3,4:02,842,842,Brianna Fraser Defensive Rebound.,55,30,25,9,0.9907361997930585,Maryland,Illinois,3,4,1,0,NA,400914344,2017-02-09,
226,3,3:53,833,833,Kristen Confroy missed Three Point Jumper.,55,30,25,0,0.9909307797202727,Maryland,Illinois,3,4,1,0,NA,400914344,2017-02-09,
227,3,3:53,833,833,Jaelyne Kirkpatrick Defensive Rebound.,55,30,25,6,0.9909307797202727,Maryland,Illinois,3,4,1,0,NA,400914344,2017-02-09,
228,3,3:47,827,827,Jaelyne Kirkpatrick made Layup.,55,32,23,7,0.9870266453286698,Maryland,Illinois,3,4,1,0,NA,400914344,2017-02-09,Illinois
229,3,3:40,820,820,Brianna Fraser missed Jumper.,55,32,23,0,0.9872332925442882,Maryland,Illinois,3,4,1,0,NA,400914344,2017-02-09,
230,3,3:40,820,820,Alex Wittinger Defensive Rebound.,55,32,23,12,0.9872332925442882,Maryland,Illinois,3,4,1,0,NA,400914344,2017-02-09,
231,3,3:28,808,808,Jaelyne Kirkpatrick Turnover.,55,32,23,0,0.9875965214250937,Maryland,Illinois,3,4,1,0,NA,400914344,2017-02-09,
232,3,3:28,808,808,Official TV Timeout,55,32,23,8,0.9875965214250937,Maryland,Illinois,3,4,1,0,NA,400914344,2017-02-09,
233,3,3:20,800,800,Brianna Fraser missed Jumper.,55,32,23,0,0.987845937635574,Maryland,Illinois,3,4,0,0,NA,400914344,2017-02-09,
234,3,3:20,800,800,Brandi Beasley Defensive Rebound.,55,32,23,11,0.987845937635574,Maryland,Illinois,3,4,0,0,NA,400914344,2017-02-09,
235,3,3:09,789,789,Petra Holesinska missed Three Point Jumper.,55,32,23,0,0.9881995795891686,Maryland,Illinois,3,4,0,0,NA,400914344,2017-02-09,
236,3,3:09,789,789,Kristen Confroy Defensive Rebound.,55,32,23,10,0.9881995795891686,Maryland,Illinois,3,4,0,0,NA,400914344,2017-02-09,
237,3,2:59,779,779,Brianna Fraser Turnover.,55,32,23,0,0.9885326980759824,Maryland,Illinois,3,4,0,0,NA,400914344,2017-02-09,
238,3,2:59,779,779,Foul on Brianna Fraser.,55,32,23,21,0.9885326980759824,Maryland,Illinois,3,4,0,0,NA,400914344,2017-02-09,
239,3,2:38,758,758,Brandi Beasley missed Layup.,55,32,23,0,0.9892707714014702,Maryland,Illinois,3,4,0,0,NA,400914344,2017-02-09,
240,3,2:38,758,758,Kaila Charles Defensive Rebound.,55,32,23,7,0.9892707714014702,Maryland,Illinois,3,4,0,0,NA,400914344,2017-02-09,
241,3,2:31,751,751,Ieshia Small missed Layup.,55,32,23,0,0.9895286641507325,Maryland,Illinois,3,4,0,0,NA,400914344,2017-02-09,
242,3,2:31,751,751,Sarah Overcash Defensive Rebound.,55,32,23,26,0.9895286641507325,Maryland,Illinois,3,4,0,0,NA,400914344,2017-02-09,
243,3,2:05,725,725,Brandi Beasley made Three Point Jumper.,55,35,20,23,0.9827669356831441,Maryland,Illinois,3,4,0,0,NA,400914344,2017-02-09,Illinois
244,3,1:42,702,702,Kaila Charles Turnover.,55,35,20,8,0.9839701933105158,Maryland,Illinois,3,4,0,0,NA,400914344,2017-02-09,
245,3,1:34,694,694,Foul on Ieshia Small.,55,35,20,1,0.9843333868593428,Maryland,Illinois,3,4,0,0,NA,400914344,2017-02-09,
246,3,1:33,693,693,Alex Wittinger made Jumper. Assisted by Brandi Beasley.,55,37,18,19,0.976545356978815,Maryland,Illinois,3,4,0,0,NA,400914344,2017-02-09,Illinois
247,3,1:14,674,674,Destiny Slocum missed Jumper.,55,37,18,0,0.9775984870671158,Maryland,Illinois,3,4,0,0,NA,400914344,2017-02-09,
248,3,1:14,674,674,Kiah Gillespie Offensive Rebound.,55,37,18,2,0.9775984870671158,Maryland,Illinois,3,4,0,0,NA,400914344,2017-02-09,
249,3,1:12,672,672,Kiah Gillespie missed Layup.,55,37,18,0,0.9777038927938962,Maryland,Illinois,3,4,0,0,NA,400914344,2017-02-09,
250,3,1:12,672,672,Stephanie Jones Offensive Rebound.,55,37,18,3,0.9777038927938962,Maryland,Illinois,3,4,0,0,NA,400914344,2017-02-09,
251,3,1:09,669,669,Stephanie Jones made Layup.,57,37,20,18,0.9853549603386967,Maryland,Illinois,3,4,0,0,NA,400914344,2017-02-09,Maryland
252,3,0:51,651,651,Ali Andrews missed Jumper.,57,37,20,0,0.9860339060068877,Maryland,Illinois,3,4,0,0,NA,400914344,2017-02-09,
253,3,0:51,651,651,Alex Wittinger Offensive Rebound.,57,37,20,4,0.9860339060068877,Maryland,Illinois,3,4,0,0,NA,400914344,2017-02-09,
254,3,0:47,647,647,Brandi Beasley missed Jumper.,57,37,20,0,0.9861828927842414,Maryland,Illinois,3,4,0,0,NA,400914344,2017-02-09,
255,3,0:47,647,647,Alex Wittinger Offensive Rebound.,57,37,20,5,0.9861828927842414,Maryland,Illinois,3,4,0,0,NA,400914344,2017-02-09,
256,3,0:42,642,642,Alex Wittinger missed Layup.,57,37,20,0,0.9863693231892837,Maryland,Illinois,3,4,0,0,NA,400914344,2017-02-09,
257,3,0:42,642,642,Alex Wittinger Offensive Rebound.,57,37,20,18,0.9863693231892837,Maryland,Illinois,3,4,0,0,NA,400914344,2017-02-09,
258,3,0:24,624,624,Brandi Beasley Turnover.,57,37,20,0,0.9870516699454502,Maryland,Illinois,3,4,0,0,NA,400914344,2017-02-09,
259,3,0:24,624,624,Shatori Walker-Kimbrough made Three Point Jumper. Assisted by Destiny Slocum.,60,37,23,21,0.9931987129832286,Maryland,Illinois,3,4,0,0,NA,400914344,2017-02-09,Maryland
260,3,0:03,603,603,Brandi Beasley missed Three Point Jumper.,60,37,23,0,0.9937088243767757,Maryland,Illinois,3,4,0,0,NA,400914344,2017-02-09,
261,3,0:03,603,603,Brionna Jones Defensive Rebound.,60,37,23,3,0.9937088243767757,Maryland,Illinois,3,4,0,0,NA,400914344,2017-02-09,
262,3,0:00,600,600,End of 3rd Quarter,60,37,23,11,0.9937848010894879,Maryland,Illinois,3,4,0,0,NA,400914344,2017-02-09,
263,4,9:49,589,589,Brionna Jones missed Jumper.,60,37,23,0,0.9940711692621551,Maryland,Illinois,4,5,0,0,NA,400914344,2017-02-09,
264,4,9:49,589,589,Alex Wittinger Block.,60,37,23,1,0.9940711692621551,Maryland,Illinois,4,5,0,0,NA,400914344,2017-02-09,
265,4,9:48,588,588,Maryland Offensive Rebound.,60,37,23,6,0.9940978337718831,Maryland,Illinois,4,5,0,0,NA,400914344,2017-02-09,
266,4,9:42,582,582,Destiny Slocum missed Three Point Jumper.,60,37,23,0,0.9942600957012865,Maryland,Illinois,4,5,0,0,NA,400914344,2017-02-09,
267,4,9:42,582,582,Maryland Offensive Rebound.,60,37,23,20,0.9942600957012865,Maryland,Illinois,4,5,0,0,NA,400914344,2017-02-09,
268,4,9:22,562,562,Destiny Slocum missed Jumper.,60,37,23,0,0.9948291388002863,Maryland,Illinois,4,5,0,0,NA,400914344,2017-02-09,
269,4,9:22,562,562,Kennedy Cattenhead Defensive Rebound.,60,37,23,1,0.9948291388002863,Maryland,Illinois,4,5,0,0,NA,400914344,2017-02-09,
270,4,9:21,561,561,Foul on Stephanie Jones.,60,37,23,19,0.9948586919968732,Maryland,Illinois,4,5,0,0,NA,400914344,2017-02-09,
271,4,9:02,542,542,Jaelyne Kirkpatrick made Three Point Jumper. Assisted by Kennedy Cattenhead.,60,40,20,17,0.9907982193293605,Maryland,Illinois,4,5,0,0,NA,400914344,2017-02-09,Illinois
272,4,8:45,525,525,Brionna Jones Turnover.,60,40,20,2,0.9914891157303761,Maryland,Illinois,4,5,0,0,NA,400914344,2017-02-09,
273,4,8:43,523,523,Alex Wittinger Steal.,60,40,20,22,0.9915607259830251,Maryland,Illinois,4,5,0,0,NA,400914344,2017-02-09,
274,4,8:21,501,501,Alex Wittinger missed Jumper.,60,40,20,0,0.9922743453647002,Maryland,Illinois,4,5,0,0,NA,400914344,2017-02-09,
275,4,8:21,501,501,Ali Andrews Offensive Rebound.,60,40,20,5,0.9922743453647002,Maryland,Illinois,4,5,0,0,NA,400914344,2017-02-09,
276,4,8:16,496,496,Foul on Stephanie Jones.,60,40,20,21,0.9924266951134942,Maryland,Illinois,4,5,0,0,NA,400914344,2017-02-09,
277,4,7:55,475,475,Petra Holesinska missed Jumper.,60,40,20,0,0.9930770194132585,Maryland,Illinois,4,5,0,0,NA,400914344,2017-02-09,
278,4,7:55,475,475,Kristen Confroy Defensive Rebound.,60,40,20,19,0.9930770194132585,Maryland,Illinois,4,5,0,0,NA,400914344,2017-02-09,
279,4,7:36,456,456,Shatori Walker-Kimbrough Turnover.,60,40,20,6,0.9937273331368581,Maryland,Illinois,4,5,0,0,NA,400914344,2017-02-09,
280,4,7:30,450,450,Jaelyne Kirkpatrick Turnover.,60,40,20,0,0.9939514424815472,Maryland,Illinois,4,5,0,0,NA,400914344,2017-02-09,
281,4,7:30,450,450,Shatori Walker-Kimbrough Steal.,60,40,20,0,0.9939514424815472,Maryland,Illinois,4,5,0,0,NA,400914344,2017-02-09,
282,4,7:30,450,450,Foul on Jaelyne Kirkpatrick.,60,40,20,6,0.9939514424815472,Maryland,Illinois,4,5,0,0,NA,400914344,2017-02-09,
283,4,7:24,444,444,Kaila Charles made Layup. Assisted by Destiny Slocum.,62,40,22,14,0.9965147907743875,Maryland,Illinois,4,5,0,0,NA,400914344,2017-02-09,Maryland
284,4,7:10,430,430,Ali Andrews missed Three Point Jumper.,62,40,22,0,0.9968992873219338,Maryland,Illinois,4,5,0,0,NA,400914344,2017-02-09,
285,4,7:10,430,430,Shatori Walker-Kimbrough Defensive Rebound.,62,40,22,22,0.9968992873219338,Maryland,Illinois,4,5,0,0,NA,400914344,2017-02-09,
286,4,6:48,408,408,Foul on Kennedy Cattenhead.,62,40,22,0,0.9974318824118142,Maryland,Illinois,4,5,0,0,NA,400914344,2017-02-09,
287,4,6:48,408,408,Kaila Charles made Free Throw.,63,40,23,0,0.9980403174329158,Maryland,Illinois,4,5,0,0,NA,400914344,2017-02-09,Maryland
288,4,6:48,408,408,Kaila Charles made Free Throw.,64,40,24,12,0.9985048189185579,Maryland,Illinois,4,5,0,0,NA,400914344,2017-02-09,Maryland
289,4,6:36,396,396,Ali Andrews made Three Point Jumper. Assisted by Jaelyne Kirkpatrick.,64,43,21,8,0.9969301820345372,Maryland,Illinois,4,5,0,0,NA,400914344,2017-02-09,Illinois
290,4,6:28,388,388,Kristen Confroy missed Three Point Jumper.,64,43,21,0,0.997112036587935,Maryland,Illinois,4,5,0,0,NA,400914344,2017-02-09,
291,4,6:28,388,388,Brandi Beasley Defensive Rebound.,64,43,21,10,0.997112036587935,Maryland,Illinois,4,5,0,0,NA,400914344,2017-02-09,
292,4,6:18,378,378,Brandi Beasley missed Jumper.,64,43,21,0,0.997329043407906,Maryland,Illinois,4,5,0,0,NA,400914344,2017-02-09,
293,4,6:18,378,378,Kaila Charles Defensive Rebound.,64,43,21,20,0.997329043407906,Maryland,Illinois,4,5,0,0,NA,400914344,2017-02-09,
294,4,5:58,358,358,Maryland  Timeout,64,43,21,5,0.997747043018518,Maryland,Illinois,4,4,0,1,NA,400914344,2017-02-09,
295,4,5:53,353,353,Shatori Walker-Kimbrough made Three Point Jumper. Assisted by Kristen Confroy.,67,43,24,13,0.9991047862319793,Maryland,Illinois,4,4,0,1,NA,400914344,2017-02-09,Maryland
296,4,5:40,340,340,Ali Andrews made Three Point Jumper. Assisted by Brandi Beasley.,67,46,21,17,0.9981194142696085,Maryland,Illinois,4,4,0,1,NA,400914344,2017-02-09,Illinois
297,4,5:23,323,323,Kaila Charles made Jumper.,69,46,23,13,0.9991738670030869,Maryland,Illinois,4,4,0,1,NA,400914344,2017-02-09,Maryland
298,4,5:10,310,310,Petra Holesinska missed Layup.,69,46,23,0,0.9993272756224687,Maryland,Illinois,4,4,0,1,NA,400914344,2017-02-09,
299,4,5:10,310,310,Destiny Slocum Defensive Rebound.,69,46,23,8,0.9993272756224687,Maryland,Illinois,4,4,0,1,NA,400914344,2017-02-09,
300,4,5:02,302,302,Shatori Walker-Kimbrough made Three Point Jumper. Assisted by Destiny Slocum.,72,46,26,14,0.9997696915563279,Maryland,Illinois,4,4,0,1,NA,400914344,2017-02-09,Maryland
301,4,4:48,288,288,Brandi Beasley Turnover.,72,46,26,1,0.9997853610079261,Maryland,Illinois,4,4,0,0,NA,400914344,2017-02-09,
302,4,4:47,287,287,Kristen Confroy Steal.,72,46,26,10,0.9997852826631833,Maryland,Illinois,4,4,0,0,NA,400914344,2017-02-09,
303,4,4:37,277,277,Shatori Walker-Kimbrough missed Three Point Jumper.,72,46,26,0,0.9997782350368375,Maryland,Illinois,4,4,0,0,NA,400914344,2017-02-09,
304,4,4:37,277,277,Jaelyne Kirkpatrick Defensive Rebound.,72,46,26,3,0.9997782350368375,Maryland,Illinois,4,4,0,0,NA,400914344,2017-02-09,
305,4,4:34,274,274,Foul on Kristen Confroy.,72,46,26,8,0.9997742809126003,Maryland,Illinois,4,4,0,0,NA,400914344,2017-02-09,
306,4,4:26,266,266,Foul on Kiah Gillespie.,72,46,26,1,0.9997608515023444,Maryland,Illinois,4,4,0,0,NA,400914344,2017-02-09,
307,4,4:25,265,265,Brandi Beasley made Layup.,72,48,24,0,0.9995426056902705,Maryland,Illinois,4,4,0,0,NA,400914344,2017-02-09,Illinois
308,4,4:25,265,265,Brandi Beasley made Free Throw.,72,49,23,15,0.9993699688614844,Maryland,Illinois,4,4,0,0,NA,400914344,2017-02-09,Illinois
309,4,4:10,250,250,Destiny Slocum missed Three Point Jumper.,72,49,23,0,0.9993037639998016,Maryland,Illinois,4,4,0,0,NA,400914344,2017-02-09,
310,4,4:10,250,250,Kiah Gillespie Offensive Rebound.,72,49,23,2,0.9993037639998016,Maryland,Illinois,4,4,0,0,NA,400914344,2017-02-09,
311,4,4:08,248,248,Foul on Ali Andrews.,72,49,23,2,0.9992964091538625,Maryland,Illinois,4,4,0,0,NA,400914344,2017-02-09,
312,4,4:06,246,246,Foul on Sarah Overcash.,72,49,23,9,0.9992898270032123,Maryland,Illinois,4,4,0,0,NA,400914344,2017-02-09,
313,4,3:57,237,237,Brionna Jones made Layup. Assisted by Shatori Walker-Kimbrough.,74,49,25,15,0.9996123879129614,Maryland,Illinois,4,4,0,0,NA,400914344,2017-02-09,Maryland
314,4,3:42,222,222,Foul on Destiny Slocum.,74,49,25,0,0.9996390790627178,Maryland,Illinois,4,4,0,0,NA,400914344,2017-02-09,
315,4,3:42,222,222,Brandi Beasley made Free Throw.,74,50,24,0,0.9995044917987778,Maryland,Illinois,4,4,0,0,NA,400914344,2017-02-09,Illinois
316,4,3:42,222,222,Brandi Beasley made Free Throw.,74,51,23,17,0.9993197511537196,Maryland,Illinois,4,4,0,0,NA,400914344,2017-02-09,Illinois
317,4,3:25,205,205,Shatori Walker-Kimbrough made Three Point Jumper. Assisted by Destiny Slocum.,77,51,26,16,0.9998146121195043,Maryland,Illinois,4,4,0,0,NA,400914344,2017-02-09,Maryland
318,4,3:09,189,189,Brandi Beasley missed Jumper.,77,51,26,0,0.9999066471862894,Maryland,Illinois,4,4,0,0,NA,400914344,2017-02-09,
319,4,3:09,189,189,Alex Wittinger Offensive Rebound.,77,51,26,11,0.9999066471862894,Maryland,Illinois,4,4,0,0,NA,400914344,2017-02-09,
320,4,2:58,178,178,Alex Wittinger made Jumper. Assisted by Ashley McConnell.,77,53,24,5,0.9998905543297166,Maryland,Illinois,4,4,0,0,NA,400914344,2017-02-09,Illinois
321,4,2:53,173,173,Kiah Gillespie made Layup. Assisted by Destiny Slocum.,79,53,26,2,0.9999612808900697,Maryland,Illinois,4,4,0,0,NA,400914344,2017-02-09,Maryland
322,4,2:51,171,171,Foul on Jaelyne Kirkpatrick.,79,53,26,0,0.999965427078611,Maryland,Illinois,4,4,0,0,NA,400914344,2017-02-09,
323,4,2:51,171,171,Kiah Gillespie made Free Throw.,80,53,27,15,0.9999767108046965,Maryland,Illinois,4,4,0,0,NA,400914344,2017-02-09,Maryland
324,4,2:36,156,156,Foul on Brionna Jones.,80,53,27,0,0.9999907656560698,Maryland,Illinois,4,4,0,0,NA,400914344,2017-02-09,
325,4,2:36,156,156,Alex Wittinger made Free Throw.,80,54,26,0,0.9999858136657166,Maryland,Illinois,4,4,0,0,NA,400914344,2017-02-09,Illinois
326,4,2:36,156,156,Alex Wittinger missed Free Throw.,80,54,26,0,0.9999858136657166,Maryland,Illinois,4,4,0,0,NA,400914344,2017-02-09,
327,4,2:36,156,156,Kristen Confroy Defensive Rebound.,80,54,26,11,0.9999858136657166,Maryland,Illinois,4,4,0,0,NA,400914344,2017-02-09,
328,4,2:25,145,145,Kiah Gillespie made Jumper. Assisted by Destiny Slocum.,82,54,28,19,0.9999972227866705,Maryland,Illinois,4,4,0,0,NA,400914344,2017-02-09,Maryland
329,4,2:06,126,126,Alex Wittinger made Jumper. Assisted by Courtney Joens.,82,56,26,18,0.9999983276791308,Maryland,Illinois,4,4,0,0,NA,400914344,2017-02-09,Illinois
330,4,1:48,108,108,Brianna Fraser missed Jumper.,82,56,26,0,0.9999996720625077,Maryland,Illinois,4,4,0,0,NA,400914344,2017-02-09,
331,4,1:48,108,108,Courtney Joens Defensive Rebound.,82,56,26,15,0.9999996720625077,Maryland,Illinois,4,4,0,0,NA,400914344,2017-02-09,
332,4,1:33,93,93,Alex Wittinger made Three Point Jumper. Assisted by Courtney Joens.,82,59,23,5,0.9999995624820405,Maryland,Illinois,4,4,0,0,NA,400914344,2017-02-09,Illinois
333,4,1:28,88,88,Maryland  Timeout,82,59,23,22,0.9999997381232956,Maryland,Illinois,4,3,0,1,NA,400914344,2017-02-09,
334,4,1:06,66,66,Kristen Confroy made Jumper. Assisted by Kiah Gillespie.,84,59,25,21,0.9999999950787634,Maryland,Illinois,4,3,0,1,NA,400914344,2017-02-09,Maryland
335,4,0:45,45,45,Jaelyne Kirkpatrick Turnover.,84,59,25,15,0.9999999997229538,Maryland,Illinois,4,3,0,1,NA,400914344,2017-02-09,
336,4,0:30,30,30,Sarah Myers Turnover.,84,59,25,18,0.9999999999715826,Maryland,Illinois,4,3,0,1,NA,400914344,2017-02-09,
337,4,0:12,12,12,Alex Wittinger missed Jumper.,84,59,25,0,0.9999999999985346,Maryland,Illinois,4,3,0,0,NA,400914344,2017-02-09,
338,4,0:12,12,12,Sarah Myers Defensive Rebound.,84,59,25,12,0.9999999999985346,Maryland,Illinois,4,3,0,0,NA,400914344,2017-02-09,
339,4,0:00,0,0,End of Game,84,59,25,0,1,Maryland,Illinois,4,3,0,0,NA,400914344,2017-02-09,
