play_id,period,time_remaining_period,secs_remaining,secs_remaining_absolute,description,home_score,away_score,score_diff,play_length,win_prob,home,away,home_time_out_remaining,away_time_out_remaining,home_timeout_ind,away_timeout_ind,home_favored_by,game_id,date,whichScored
1,1,10:00,2400,2400,Jump Ball won by Miami,0,0,0,23,0.5,Miami,Florida Gulf Coast,4,4,0,0,NA,401124191,2019-03-22,NA
2,1,9:37,2377,2377,Mykea Gray Turnover.,0,0,0,11,0.5,Miami,Florida Gulf Coast,4,4,0,0,NA,401124191,2019-03-22,
3,1,9:26,2366,2366,Keri Jewett-Giles missed Three Point Jumper.,0,0,0,0,0.5,Miami,Florida Gulf Coast,4,4,0,0,NA,401124191,2019-03-22,
4,1,9:26,2366,2366,Beatrice Mompremier Defensive Rebound.,0,0,0,12,0.5,Miami,Florida Gulf Coast,4,4,0,0,NA,401124191,2019-03-22,
5,1,9:14,2354,2354,Endia Banks made Three Point Jumper. Assisted by Emese Hof.,3,0,3,22,0.5672791704388894,Miami,Florida Gulf Coast,4,4,0,0,NA,401124191,2019-03-22,Miami
6,1,8:52,2332,2332,Destiny Washington-Mabon missed Three Point Jumper.,3,0,3,0,0.5679886602964822,Miami,Florida Gulf Coast,4,4,0,0,NA,401124191,2019-03-22,
7,1,8:52,2332,2332,Endia Banks Defensive Rebound.,3,0,3,16,0.5679886602964822,Miami,Florida Gulf Coast,4,4,0,0,NA,401124191,2019-03-22,
8,1,8:36,2316,2316,Laura Cornelius made Jumper.,5,0,5,18,0.6129250130248688,Miami,Florida Gulf Coast,4,4,0,0,NA,401124191,2019-03-22,Miami
9,1,8:18,2298,2298,Tytionia Adderly missed Three Point Jumper.,5,0,5,0,0.613878027519658,Miami,Florida Gulf Coast,4,4,0,0,NA,401124191,2019-03-22,
10,1,8:18,2298,2298,Emese Hof Defensive Rebound.,5,0,5,12,0.613878027519658,Miami,Florida Gulf Coast,4,4,0,0,NA,401124191,2019-03-22,
11,1,8:06,2286,2286,Beatrice Mompremier made Layup. Assisted by Emese Hof.,7,0,7,20,0.6576586017241425,Miami,Florida Gulf Coast,4,4,0,0,NA,401124191,2019-03-22,Miami
12,1,7:46,2266,2266,Destiny Washington-Mabon made Three Point Jumper. Assisted by Tytionia Adderly.,7,3,4,21,0.5930757245876026,Miami,Florida Gulf Coast,4,4,0,0,NA,401124191,2019-03-22,Florida Gulf Coast
13,1,7:25,2245,2245,Mykea Gray made Three Point Jumper. Assisted by Endia Banks.,10,3,7,12,0.6605899445365986,Miami,Florida Gulf Coast,4,4,0,0,NA,401124191,2019-03-22,Miami
14,1,7:13,2233,2233,Keri Jewett-Giles made Three Point Jumper.,10,6,4,15,0.5945315899344339,Miami,Florida Gulf Coast,4,4,0,0,NA,401124191,2019-03-22,Florida Gulf Coast
15,1,6:58,2218,2218,Foul on Beatrice Mompremier.,10,6,4,0,0.5951978608019828,Miami,Florida Gulf Coast,4,4,0,0,NA,401124191,2019-03-22,
16,1,6:58,2218,2218,Beatrice Mompremier Turnover.,10,6,4,20,0.5951978608019828,Miami,Florida Gulf Coast,4,4,0,0,NA,401124191,2019-03-22,
17,1,6:38,2198,2198,Nasrin Ulel missed Three Point Jumper.,10,6,4,0,0.5960897878572667,Miami,Florida Gulf Coast,4,4,0,0,NA,401124191,2019-03-22,
18,1,6:38,2198,2198,Beatrice Mompremier Defensive Rebound.,10,6,4,20,0.5960897878572667,Miami,Florida Gulf Coast,4,4,0,0,NA,401124191,2019-03-22,
19,1,6:18,2178,2178,Beatrice Mompremier missed Layup.,10,6,4,0,0.5969850319212389,Miami,Florida Gulf Coast,4,4,0,0,NA,401124191,2019-03-22,
20,1,6:18,2178,2178,Destiny Washington-Mabon Block.,10,6,4,0,0.5969850319212389,Miami,Florida Gulf Coast,4,4,0,0,NA,401124191,2019-03-22,
21,1,6:18,2178,2178,Florida Gulf Coast Defensive Rebound.,10,6,4,15,0.5969850319212389,Miami,Florida Gulf Coast,4,4,0,0,NA,401124191,2019-03-22,
22,1,6:03,2163,2163,Tytionia Adderly missed Three Point Jumper.,10,6,4,0,0.5976583357494077,Miami,Florida Gulf Coast,4,4,0,0,NA,401124191,2019-03-22,
23,1,6:03,2163,2163,Beatrice Mompremier Defensive Rebound.,10,6,4,15,0.5976583357494077,Miami,Florida Gulf Coast,4,4,0,0,NA,401124191,2019-03-22,
24,1,5:48,2148,2148,Foul on Tytionia Adderly.,10,6,4,0,0.5983343958667185,Miami,Florida Gulf Coast,4,4,0,0,NA,401124191,2019-03-22,
25,1,5:48,2148,2148,Emese Hof made Free Throw.,11,6,5,0,0.6220273784098609,Miami,Florida Gulf Coast,4,4,0,0,NA,401124191,2019-03-22,Miami
26,1,5:48,2148,2148,Emese Hof made Free Throw.,12,6,6,24,0.6451516325709856,Miami,Florida Gulf Coast,4,4,0,0,NA,401124191,2019-03-22,Miami
27,1,5:24,2124,2124,Keri Jewett-Giles missed Three Point Jumper.,12,6,6,0,0.646705989004505,Miami,Florida Gulf Coast,4,4,0,0,NA,401124191,2019-03-22,
28,1,5:24,2124,2124,Emese Hof Defensive Rebound.,12,6,6,15,0.646705989004505,Miami,Florida Gulf Coast,4,4,0,0,NA,401124191,2019-03-22,
29,1,5:09,2109,2109,Beatrice Mompremier missed Jumper.,12,6,6,5,0.6476830750781524,Miami,Florida Gulf Coast,4,4,0,0,NA,401124191,2019-03-22,
30,1,5:04,2104,2104,Emese Hof Offensive Rebound.,12,6,6,11,0.6480097928299587,Miami,Florida Gulf Coast,4,4,0,0,NA,401124191,2019-03-22,
31,1,4:53,2093,2093,Beatrice Mompremier made Layup.,14,6,8,0,0.6938012683524268,Miami,Florida Gulf Coast,4,4,0,0,NA,401124191,2019-03-22,Miami
32,1,4:53,2093,2093,Foul on Destiny Washington-Mabon.,14,6,8,0,0.6938012683524268,Miami,Florida Gulf Coast,4,4,0,0,NA,401124191,2019-03-22,
33,1,4:53,2093,2093,Official TV Timeout,14,6,8,2,0.6938012683524268,Miami,Florida Gulf Coast,4,4,0,0,NA,401124191,2019-03-22,
34,1,4:51,2091,2091,Beatrice Mompremier made Free Throw.,15,6,9,13,0.715257947636463,Miami,Florida Gulf Coast,4,4,0,0,NA,401124191,2019-03-22,Miami
35,1,4:38,2078,2078,Tytionia Adderly missed Three Point Jumper.,15,6,9,0,0.7164045892046175,Miami,Florida Gulf Coast,4,4,0,0,NA,401124191,2019-03-22,
36,1,4:38,2078,2078,Nasrin Ulel Offensive Rebound.,15,6,9,30,0.7164045892046175,Miami,Florida Gulf Coast,4,4,0,0,NA,401124191,2019-03-22,
37,1,4:08,2048,2048,Nasrin Ulel missed Layup.,15,6,9,0,0.7190654408202114,Miami,Florida Gulf Coast,4,4,0,0,NA,401124191,2019-03-22,
38,1,4:08,2048,2048,Keri Jewett-Giles Offensive Rebound.,15,6,9,7,0.7190654408202114,Miami,Florida Gulf Coast,4,4,0,0,NA,401124191,2019-03-22,
39,1,4:01,2041,2041,Keri Jewett-Giles missed Three Point Jumper.,15,6,9,0,0.719689480791981,Miami,Florida Gulf Coast,4,4,0,0,NA,401124191,2019-03-22,
40,1,4:01,2041,2041,Emese Hof Defensive Rebound.,15,6,9,10,0.719689480791981,Miami,Florida Gulf Coast,4,4,0,0,NA,401124191,2019-03-22,
41,1,3:51,2031,2031,Beatrice Mompremier Turnover.,15,6,9,10,0.7205831787469349,Miami,Florida Gulf Coast,4,4,0,0,NA,401124191,2019-03-22,
42,1,3:41,2021,2021,Kerstie Phills made Three Point Jumper. Assisted by Davion Wingate.,15,9,6,20,0.6535185752672347,Miami,Florida Gulf Coast,4,4,0,0,NA,401124191,2019-03-22,Florida Gulf Coast
43,1,3:21,2001,2001,Mykea Gray Turnover.,15,9,6,18,0.6548731272413891,Miami,Florida Gulf Coast,4,4,0,0,NA,401124191,2019-03-22,
44,1,3:03,1983,1983,Foul on Kelsey Marshall.,15,9,6,0,0.6561023630849656,Miami,Florida Gulf Coast,4,4,0,0,NA,401124191,2019-03-22,
45,1,3:03,1983,1983,Davion Wingate made Free Throw.,15,10,5,0,0.6314193428984108,Miami,Florida Gulf Coast,4,4,0,0,NA,401124191,2019-03-22,Florida Gulf Coast
46,1,3:03,1983,1983,Davion Wingate made Free Throw.,15,11,4,17,0.6060285171204809,Miami,Florida Gulf Coast,4,4,0,0,NA,401124191,2019-03-22,Florida Gulf Coast
47,1,2:46,1966,1966,Emese Hof missed Layup.,15,11,4,0,0.6068544027811372,Miami,Florida Gulf Coast,4,4,0,0,NA,401124191,2019-03-22,
48,1,2:46,1966,1966,Nasrin Ulel Defensive Rebound.,15,11,4,1,0.6068544027811372,Miami,Florida Gulf Coast,4,4,0,0,NA,401124191,2019-03-22,
49,1,2:45,1965,1965,Nasrin Ulel Turnover.,15,11,4,7,0.6069032110581148,Miami,Florida Gulf Coast,4,4,0,0,NA,401124191,2019-03-22,
50,1,2:38,1958,1958,Emese Hof missed Layup.,15,11,4,0,0.6072455887198756,Miami,Florida Gulf Coast,4,4,0,0,NA,401124191,2019-03-22,
51,1,2:38,1958,1958,Tytionia Adderly Defensive Rebound.,15,11,4,1,0.6072455887198756,Miami,Florida Gulf Coast,4,4,0,0,NA,401124191,2019-03-22,
52,1,2:37,1957,1957,Foul on Emese Hof.,15,11,4,22,0.6072946033622159,Miami,Florida Gulf Coast,4,4,0,0,NA,401124191,2019-03-22,
53,1,2:15,1935,1935,Tytionia Adderly missed Layup.,15,11,4,0,0.6083796285257003,Miami,Florida Gulf Coast,4,4,0,0,NA,401124191,2019-03-22,
54,1,2:15,1935,1935,Keri Jewett-Giles Offensive Rebound.,15,11,4,11,0.6083796285257003,Miami,Florida Gulf Coast,4,4,0,0,NA,401124191,2019-03-22,
55,1,2:04,1924,1924,Keri Jewett-Giles missed Three Point Jumper.,15,11,4,0,0.6089263638543446,Miami,Florida Gulf Coast,4,4,0,0,NA,401124191,2019-03-22,
56,1,2:04,1924,1924,Kelsey Marshall Defensive Rebound.,15,11,4,5,0.6089263638543446,Miami,Florida Gulf Coast,4,4,0,0,NA,401124191,2019-03-22,
57,1,1:59,1919,1919,Laura Cornelius made Layup. Assisted by Kelsey Marshall.,17,11,6,8,0.6605545475273218,Miami,Florida Gulf Coast,4,4,0,0,NA,401124191,2019-03-22,Miami
58,1,1:51,1911,1911,Keri Jewett-Giles missed Jumper.,17,11,6,0,0.6611150255864098,Miami,Florida Gulf Coast,4,4,0,0,NA,401124191,2019-03-22,
59,1,1:51,1911,1911,Khaila Prather Defensive Rebound.,17,11,6,7,0.6611150255864098,Miami,Florida Gulf Coast,4,4,0,0,NA,401124191,2019-03-22,
60,1,1:44,1904,1904,Mykea Gray missed Layup.,17,11,6,0,0.6616047448739356,Miami,Florida Gulf Coast,4,4,0,0,NA,401124191,2019-03-22,
61,1,1:44,1904,1904,Kerstie Phills Defensive Rebound.,17,11,6,19,0.6616047448739356,Miami,Florida Gulf Coast,4,4,0,0,NA,401124191,2019-03-22,
62,1,1:25,1885,1885,Nasrin Ulel missed Layup.,17,11,6,0,0.6629318627150644,Miami,Florida Gulf Coast,4,4,0,0,NA,401124191,2019-03-22,
63,1,1:25,1885,1885,Kelsey Marshall Defensive Rebound.,17,11,6,11,0.6629318627150644,Miami,Florida Gulf Coast,4,4,0,0,NA,401124191,2019-03-22,
64,1,1:14,1874,1874,Khaila Prather made Layup. Assisted by Laura Cornelius.,19,11,8,10,0.7122697402445444,Miami,Florida Gulf Coast,4,4,0,0,NA,401124191,2019-03-22,Miami
65,1,1:04,1864,1864,Nasrin Ulel made Three Point Jumper. Assisted by Keri Jewett-Giles.,19,14,5,19,0.6385621242918414,Miami,Florida Gulf Coast,4,4,0,0,NA,401124191,2019-03-22,Florida Gulf Coast
66,1,0:45,1845,1845,Foul on Chandler Ryan.,19,14,5,6,0.6397085069645284,Miami,Florida Gulf Coast,4,4,0,0,NA,401124191,2019-03-22,
67,1,0:39,1839,1839,Kelsey Marshall missed Three Point Jumper.,19,14,5,0,0.640071459202356,Miami,Florida Gulf Coast,4,4,0,0,NA,401124191,2019-03-22,
68,1,0:39,1839,1839,Tytionia Adderly Defensive Rebound.,19,14,5,8,0.640071459202356,Miami,Florida Gulf Coast,4,4,0,0,NA,401124191,2019-03-22,
69,1,0:31,1831,1831,Foul on Khaila Prather.,19,14,5,0,0.6405563126381448,Miami,Florida Gulf Coast,4,4,0,0,NA,401124191,2019-03-22,
70,1,0:31,1831,1831,Davion Wingate made Free Throw.,19,15,4,0,0.6135415457675434,Miami,Florida Gulf Coast,4,4,0,0,NA,401124191,2019-03-22,Florida Gulf Coast
71,1,0:31,1831,1831,Davion Wingate missed Free Throw.,19,15,4,0,0.6135415457675434,Miami,Florida Gulf Coast,4,4,0,0,NA,401124191,2019-03-22,
72,1,0:31,1831,1831,Beatrice Mompremier Defensive Rebound.,19,15,4,29,0.6135415457675434,Miami,Florida Gulf Coast,4,4,0,0,NA,401124191,2019-03-22,
73,1,0:02,1802,1802,Foul on Kerstie Phills.,19,15,4,0,0.6149995676756664,Miami,Florida Gulf Coast,4,4,0,0,NA,401124191,2019-03-22,
74,1,0:02,1802,1802,Mykea Gray made Free Throw.,20,15,5,0,0.6423253977468899,Miami,Florida Gulf Coast,4,4,0,0,NA,401124191,2019-03-22,Miami
75,1,0:02,1802,1802,Mykea Gray made Free Throw.,21,15,6,2,0.6687563666720667,Miami,Florida Gulf Coast,4,4,0,0,NA,401124191,2019-03-22,Miami
76,1,0:00,1800,1800,End of 1st Quarter,21,15,6,0,0.6688984611571205,Miami,Florida Gulf Coast,4,4,0,0,NA,401124191,2019-03-22,
77,2,10:00,1800,1800,Jump Ball won by Florida Gulf Coast,21,15,6,11,0.6688984611571205,Miami,Florida Gulf Coast,4,4,0,0,NA,401124191,2019-03-22,
78,2,9:49,1789,1789,Nasrin Ulel missed Three Point Jumper.,21,15,6,0,0.6696823691968643,Miami,Florida Gulf Coast,4,4,0,0,NA,401124191,2019-03-22,
79,2,9:49,1789,1789,Laura Cornelius Defensive Rebound.,21,15,6,35,0.6696823691968643,Miami,Florida Gulf Coast,4,4,0,0,NA,401124191,2019-03-22,
80,2,9:14,1754,1754,Miami  Turnover.,21,15,6,14,0.6722086131863931,Miami,Florida Gulf Coast,4,4,0,0,NA,401124191,2019-03-22,
81,2,9:00,1740,1740,Davion Wingate missed Three Point Jumper.,21,15,6,0,0.673235437000404,Miami,Florida Gulf Coast,4,4,0,0,NA,401124191,2019-03-22,
82,2,9:00,1740,1740,Taylor Mason Defensive Rebound.,21,15,6,11,0.673235437000404,Miami,Florida Gulf Coast,4,4,0,0,NA,401124191,2019-03-22,
83,2,8:49,1729,1729,Taylor Mason Turnover.,21,15,6,14,0.6740498420550047,Miami,Florida Gulf Coast,4,4,0,0,NA,401124191,2019-03-22,
84,2,8:35,1715,1715,Keri Jewett-Giles missed Three Point Jumper.,21,15,6,0,0.6750969253349562,Miami,Florida Gulf Coast,4,4,0,0,NA,401124191,2019-03-22,
85,2,8:35,1715,1715,Laura Cornelius Defensive Rebound.,21,15,6,13,0.6750969253349562,Miami,Florida Gulf Coast,4,4,0,0,NA,401124191,2019-03-22,
86,2,8:22,1702,1702,Emese Hof missed Layup.,21,15,6,0,0.6760806642709845,Miami,Florida Gulf Coast,4,4,0,0,NA,401124191,2019-03-22,
87,2,8:22,1702,1702,Davion Wingate Defensive Rebound.,21,15,6,2,0.6760806642709845,Miami,Florida Gulf Coast,4,4,0,0,NA,401124191,2019-03-22,
88,2,8:20,1700,1700,Foul on Khaila Prather.,21,15,6,9,0.6762330421842283,Miami,Florida Gulf Coast,4,4,0,0,NA,401124191,2019-03-22,
89,2,8:11,1691,1691,Nasrin Ulel missed Three Point Jumper.,21,15,6,0,0.6769223026662567,Miami,Florida Gulf Coast,4,4,0,0,NA,401124191,2019-03-22,
90,2,8:11,1691,1691,Emese Hof Defensive Rebound.,21,15,6,17,0.6769223026662567,Miami,Florida Gulf Coast,4,4,0,0,NA,401124191,2019-03-22,
91,2,7:54,1674,1674,Beatrice Mompremier made Jumper. Assisted by Endia Banks.,23,15,8,9,0.7298982187011925,Miami,Florida Gulf Coast,4,4,0,0,NA,401124191,2019-03-22,Miami
92,2,7:45,1665,1665,Keri Jewett-Giles made Layup.,23,17,6,21,0.6788855606773685,Miami,Florida Gulf Coast,4,4,0,0,NA,401124191,2019-03-22,Florida Gulf Coast
93,2,7:24,1644,1644,Emese Hof made Layup. Assisted by Beatrice Mompremier.,25,17,8,8,0.7325528397130457,Miami,Florida Gulf Coast,4,4,0,0,NA,401124191,2019-03-22,Miami
94,2,7:16,1636,1636,Tytionia Adderly missed Three Point Jumper.,25,17,8,0,0.7332452856560684,Miami,Florida Gulf Coast,4,4,0,0,NA,401124191,2019-03-22,
95,2,7:16,1636,1636,Beatrice Mompremier Defensive Rebound.,25,17,8,13,0.7332452856560684,Miami,Florida Gulf Coast,4,4,0,0,NA,401124191,2019-03-22,
96,2,7:03,1623,1623,Beatrice Mompremier Turnover.,25,17,8,9,0.7343607397266407,Miami,Florida Gulf Coast,4,4,0,0,NA,401124191,2019-03-22,
97,2,6:54,1614,1614,Kerstie Phills made Three Point Jumper. Assisted by Davion Wingate.,25,20,5,22,0.6543006525151589,Miami,Florida Gulf Coast,4,4,0,0,NA,401124191,2019-03-22,Florida Gulf Coast
98,2,6:32,1592,1592,Kelsey Marshall Turnover.,25,20,5,0,0.6556563696398553,Miami,Florida Gulf Coast,4,4,0,0,NA,401124191,2019-03-22,
99,2,6:32,1592,1592,Nasrin Ulel Steal.,25,20,5,9,0.6556563696398553,Miami,Florida Gulf Coast,4,4,0,0,NA,401124191,2019-03-22,
100,2,6:23,1583,1583,Keri Jewett-Giles missed Layup.,25,20,5,0,0.6562114292001092,Miami,Florida Gulf Coast,4,4,0,0,NA,401124191,2019-03-22,
101,2,6:23,1583,1583,Beatrice Mompremier Defensive Rebound.,25,20,5,15,0.6562114292001092,Miami,Florida Gulf Coast,4,4,0,0,NA,401124191,2019-03-22,
102,2,6:08,1568,1568,Emese Hof missed Jumper.,25,20,5,0,0.6571405250670624,Miami,Florida Gulf Coast,4,4,0,0,NA,401124191,2019-03-22,
103,2,6:08,1568,1568,Keri Jewett-Giles Defensive Rebound.,25,20,5,7,0.6571405250670624,Miami,Florida Gulf Coast,4,4,0,0,NA,401124191,2019-03-22,
104,2,6:01,1561,1561,Foul on Laura Cornelius.,25,20,5,0,0.6575767937541213,Miami,Florida Gulf Coast,4,4,0,0,NA,401124191,2019-03-22,
105,2,6:01,1561,1561,Davion Wingate made Free Throw.,25,21,4,0,0.6276179572889758,Miami,Florida Gulf Coast,4,4,0,0,NA,401124191,2019-03-22,Florida Gulf Coast
106,2,6:01,1561,1561,Davion Wingate made Free Throw.,25,22,3,14,0.5966457828145045,Miami,Florida Gulf Coast,4,4,0,0,NA,401124191,2019-03-22,Florida Gulf Coast
107,2,5:47,1547,1547,Beatrice Mompremier missed Layup.,25,22,3,0,0.5972102229022763,Miami,Florida Gulf Coast,4,4,0,0,NA,401124191,2019-03-22,
108,2,5:47,1547,1547,Destiny Washington-Mabon Block.,25,22,3,0,0.5972102229022763,Miami,Florida Gulf Coast,4,4,0,0,NA,401124191,2019-03-22,
109,2,5:47,1547,1547,Miami Offensive Rebound.,25,22,3,15,0.5972102229022763,Miami,Florida Gulf Coast,4,4,0,0,NA,401124191,2019-03-22,
110,2,5:32,1532,1532,Laura Cornelius missed Three Point Jumper.,25,22,3,0,0.5978244600998407,Miami,Florida Gulf Coast,4,4,0,0,NA,401124191,2019-03-22,
111,2,5:32,1532,1532,Davion Wingate Block.,25,22,3,0,0.5978244600998407,Miami,Florida Gulf Coast,4,4,0,0,NA,401124191,2019-03-22,
112,2,5:32,1532,1532,Laura Cornelius Offensive Rebound.,25,22,3,6,0.5978244600998407,Miami,Florida Gulf Coast,4,4,0,0,NA,401124191,2019-03-22,
113,2,5:26,1526,1526,Beatrice Mompremier missed Jumper.,25,22,3,0,0.5980734817822355,Miami,Florida Gulf Coast,4,4,0,0,NA,401124191,2019-03-22,
114,2,5:26,1526,1526,Nasrin Ulel Defensive Rebound.,25,22,3,0,0.5980734817822355,Miami,Florida Gulf Coast,4,4,0,0,NA,401124191,2019-03-22,
115,2,5:26,1526,1526,Davion Wingate Turnover.,25,22,3,20,0.5980734817822355,Miami,Florida Gulf Coast,4,4,0,0,NA,401124191,2019-03-22,
116,2,5:06,1506,1506,Endia Banks made Three Point Jumper. Assisted by Mykea Gray.,28,22,6,33,0.6903882371059828,Miami,Florida Gulf Coast,4,4,0,0,NA,401124191,2019-03-22,Miami
117,2,4:33,1473,1473,Davion Wingate missed Three Point Jumper.,28,22,6,0,0.6929927849690484,Miami,Florida Gulf Coast,4,4,0,0,NA,401124191,2019-03-22,
118,2,4:33,1473,1473,Laura Cornelius Defensive Rebound.,28,22,6,13,0.6929927849690484,Miami,Florida Gulf Coast,4,4,0,0,NA,401124191,2019-03-22,
119,2,4:20,1460,1460,Laura Cornelius made Three Point Jumper.,31,22,9,7,0.77360950143892,Miami,Florida Gulf Coast,4,4,0,0,NA,401124191,2019-03-22,Miami
120,2,4:13,1453,1453,Florida Gulf Coast  Timeout,31,22,9,0,0.7743409811053223,Miami,Florida Gulf Coast,3,4,1,0,NA,401124191,2019-03-22,
121,2,4:13,1453,1453,Official TV Timeout,31,22,9,18,0.7743409811053223,Miami,Florida Gulf Coast,3,4,1,0,NA,401124191,2019-03-22,
122,2,3:55,1435,1435,Kerstie Phills missed Jumper.,31,22,9,0,0.7762172006569726,Miami,Florida Gulf Coast,3,4,1,0,NA,401124191,2019-03-22,
123,2,3:55,1435,1435,Emese Hof Defensive Rebound.,31,22,9,8,0.7762172006569726,Miami,Florida Gulf Coast,3,4,1,0,NA,401124191,2019-03-22,
124,2,3:47,1427,1427,Mykea Gray Turnover.,31,22,9,0,0.7770266654556053,Miami,Florida Gulf Coast,3,4,1,0,NA,401124191,2019-03-22,
125,2,3:47,1427,1427,Keri Jewett-Giles Steal.,31,22,9,13,0.7770266654556053,Miami,Florida Gulf Coast,3,4,1,0,NA,401124191,2019-03-22,
126,2,3:34,1414,1414,Kerstie Phills made Layup. Assisted by Keri Jewett-Giles.,31,24,7,15,0.7264704708075641,Miami,Florida Gulf Coast,3,4,1,0,NA,401124191,2019-03-22,Florida Gulf Coast
127,2,3:19,1399,1399,Emese Hof missed Jumper.,31,24,7,0,0.7277717554617142,Miami,Florida Gulf Coast,3,4,1,0,NA,401124191,2019-03-22,
128,2,3:19,1399,1399,Kerstie Phills Block.,31,24,7,0,0.7277717554617142,Miami,Florida Gulf Coast,3,4,1,0,NA,401124191,2019-03-22,
129,2,3:19,1399,1399,Endia Banks Offensive Rebound.,31,24,7,13,0.7277717554617142,Miami,Florida Gulf Coast,3,4,1,0,NA,401124191,2019-03-22,
130,2,3:06,1386,1386,Emese Hof made Jumper. Assisted by Laura Cornelius.,33,24,9,26,0.7810019010857296,Miami,Florida Gulf Coast,3,4,0,0,NA,401124191,2019-03-22,Miami
131,2,2:40,1360,1360,Kerstie Phills missed Three Point Jumper.,33,24,9,0,0.7834408251182648,Miami,Florida Gulf Coast,3,4,0,0,NA,401124191,2019-03-22,
132,2,2:40,1360,1360,Endia Banks Defensive Rebound.,33,24,9,6,0.7834408251182648,Miami,Florida Gulf Coast,3,4,0,0,NA,401124191,2019-03-22,
133,2,2:34,1354,1354,Foul on Kerstie Phills.,33,24,9,0,0.7840017648043931,Miami,Florida Gulf Coast,3,4,0,0,NA,401124191,2019-03-22,
134,2,2:34,1354,1354,Beatrice Mompremier made Free Throw.,34,24,10,0,0.8072717095171988,Miami,Florida Gulf Coast,3,4,0,0,NA,401124191,2019-03-22,Miami
135,2,2:34,1354,1354,Beatrice Mompremier made Free Throw.,35,24,11,11,0.8285828566907226,Miami,Florida Gulf Coast,3,4,0,0,NA,401124191,2019-03-22,Miami
136,2,2:23,1343,1343,Keri Jewett-Giles Turnover.,35,24,11,0,0.8296385254306378,Miami,Florida Gulf Coast,3,4,0,0,NA,401124191,2019-03-22,
137,2,2:23,1343,1343,Laura Cornelius Steal.,35,24,11,2,0.8296385254306378,Miami,Florida Gulf Coast,3,4,0,0,NA,401124191,2019-03-22,
138,2,2:21,1341,1341,Foul on Davion Wingate.,35,24,11,10,0.8298308560513886,Miami,Florida Gulf Coast,3,4,0,0,NA,401124191,2019-03-22,
139,2,2:11,1331,1331,Beatrice Mompremier Turnover.,35,24,11,20,0.8307956707788128,Miami,Florida Gulf Coast,3,4,0,0,NA,401124191,2019-03-22,
140,2,1:51,1311,1311,Nasrin Ulel missed Three Point Jumper.,35,24,11,0,0.8327503600441138,Miami,Florida Gulf Coast,3,4,0,0,NA,401124191,2019-03-22,
141,2,1:51,1311,1311,Endia Banks Defensive Rebound.,35,24,11,21,0.8327503600441138,Miami,Florida Gulf Coast,3,4,0,0,NA,401124191,2019-03-22,
142,2,1:30,1290,1290,Emese Hof missed Jumper.,35,24,11,0,0.8348593398091166,Miami,Florida Gulf Coast,3,4,0,0,NA,401124191,2019-03-22,
143,2,1:30,1290,1290,Florida Gulf Coast Defensive Rebound.,35,24,11,7,0.8348593398091166,Miami,Florida Gulf Coast,3,4,0,0,NA,401124191,2019-03-22,
144,2,1:23,1283,1283,Davion Wingate missed Three Point Jumper.,35,24,11,0,0.8355794824912044,Miami,Florida Gulf Coast,3,4,0,0,NA,401124191,2019-03-22,
145,2,1:23,1283,1283,Emese Hof Defensive Rebound.,35,24,11,11,0.8355794824912044,Miami,Florida Gulf Coast,3,4,0,0,NA,401124191,2019-03-22,
146,2,1:12,1272,1272,Foul on Tytionia Adderly.,35,24,11,0,0.8367318470245937,Miami,Florida Gulf Coast,3,4,0,0,NA,401124191,2019-03-22,
147,2,1:12,1272,1272,Beatrice Mompremier made Free Throw.,36,24,12,0,0.8560256413618206,Miami,Florida Gulf Coast,3,4,0,0,NA,401124191,2019-03-22,Miami
148,2,1:12,1272,1272,Beatrice Mompremier missed Free Throw.,36,24,12,0,0.8560256413618206,Miami,Florida Gulf Coast,3,4,0,0,NA,401124191,2019-03-22,
149,2,1:12,1272,1272,Tytionia Adderly Defensive Rebound.,36,24,12,8,0.8560256413618206,Miami,Florida Gulf Coast,3,4,0,0,NA,401124191,2019-03-22,
150,2,1:04,1264,1264,Keri Jewett-Giles made Layup.,36,26,10,18,0.8162673740619215,Miami,Florida Gulf Coast,3,4,0,0,NA,401124191,2019-03-22,Florida Gulf Coast
151,2,0:46,1246,1246,Emese Hof Turnover.,36,26,10,0,0.8182598185732238,Miami,Florida Gulf Coast,3,4,0,0,NA,401124191,2019-03-22,
152,2,0:46,1246,1246,Destiny Washington-Mabon Steal.,36,26,10,8,0.8182598185732238,Miami,Florida Gulf Coast,3,4,0,0,NA,401124191,2019-03-22,
153,2,0:38,1238,1238,Keri Jewett-Giles missed Layup.,36,26,10,0,0.8191764693633788,Miami,Florida Gulf Coast,3,4,0,0,NA,401124191,2019-03-22,
154,2,0:38,1238,1238,Mykea Gray Defensive Rebound.,36,26,10,7,0.8191764693633788,Miami,Florida Gulf Coast,3,4,0,0,NA,401124191,2019-03-22,
155,2,0:31,1231,1231,Beatrice Mompremier made Layup. Assisted by Mykea Gray.,38,26,12,29,0.8605159001321282,Miami,Florida Gulf Coast,3,4,0,0,NA,401124191,2019-03-22,Miami
156,2,0:02,1202,1202,Davion Wingate missed Jumper.,38,26,12,0,0.8639778792073194,Miami,Florida Gulf Coast,3,4,0,0,NA,401124191,2019-03-22,
157,2,0:02,1202,1202,Emese Hof Block.,38,26,12,0,0.8639778792073194,Miami,Florida Gulf Coast,3,4,0,0,NA,401124191,2019-03-22,
158,2,0:02,1202,1202,Florida Gulf Coast Offensive Rebound.,38,26,12,0,0.8639778792073194,Miami,Florida Gulf Coast,3,4,0,0,NA,401124191,2019-03-22,
159,2,0:02,1202,1202,Keri Jewett-Giles missed Jumper.,38,26,12,2,0.8639778792073194,Miami,Florida Gulf Coast,3,4,0,0,NA,401124191,2019-03-22,
160,2,0:00,1200,1200,End of 2nd Quarter,38,26,12,0,0.8642163350891481,Miami,Florida Gulf Coast,3,4,0,0,NA,401124191,2019-03-22,
161,3,10:00,1200,1200,Jump Ball won by Miami,38,26,12,14,0.8642163350891481,Miami,Florida Gulf Coast,4,5,0,0,NA,401124191,2019-03-22,
162,3,9:46,1186,1186,Foul on Endia Banks.,38,26,12,0,0.8658511636584043,Miami,Florida Gulf Coast,4,5,0,0,NA,401124191,2019-03-22,
163,3,9:46,1186,1186,Endia Banks Turnover.,38,26,12,8,0.8658511636584043,Miami,Florida Gulf Coast,4,5,0,0,NA,401124191,2019-03-22,
164,3,9:38,1178,1178,Tytionia Adderly Turnover.,38,26,12,0,0.8667613798468872,Miami,Florida Gulf Coast,4,5,0,0,NA,401124191,2019-03-22,
165,3,9:38,1178,1178,Beatrice Mompremier Steal.,38,26,12,12,0.8667613798468872,Miami,Florida Gulf Coast,4,5,0,0,NA,401124191,2019-03-22,
166,3,9:26,1166,1166,Beatrice Mompremier made Jumper. Assisted by Emese Hof.,40,26,14,10,0.9000970874574828,Miami,Florida Gulf Coast,4,5,0,0,NA,401124191,2019-03-22,Miami
167,3,9:16,1156,1156,Davion Wingate missed Three Point Jumper.,40,26,14,0,0.9010994142519302,Miami,Florida Gulf Coast,4,5,0,0,NA,401124191,2019-03-22,
168,3,9:16,1156,1156,Endia Banks Defensive Rebound.,40,26,14,10,0.9010994142519302,Miami,Florida Gulf Coast,4,5,0,0,NA,401124191,2019-03-22,
169,3,9:06,1146,1146,Mykea Gray missed Three Point Jumper.,40,26,14,0,0.9020868734601898,Miami,Florida Gulf Coast,4,5,0,0,NA,401124191,2019-03-22,
170,3,9:06,1146,1146,Keri Jewett-Giles Defensive Rebound.,40,26,14,7,0.9020868734601898,Miami,Florida Gulf Coast,4,5,0,0,NA,401124191,2019-03-22,
171,3,8:59,1139,1139,Keri Jewett-Giles made Layup.,40,28,12,15,0.8710257358406618,Miami,Florida Gulf Coast,4,5,0,0,NA,401124191,2019-03-22,Florida Gulf Coast
172,3,8:44,1124,1124,Beatrice Mompremier missed Jumper.,40,28,12,0,0.8726221434177243,Miami,Florida Gulf Coast,4,5,0,0,NA,401124191,2019-03-22,
173,3,8:44,1124,1124,Tytionia Adderly Defensive Rebound.,40,28,12,11,0.8726221434177243,Miami,Florida Gulf Coast,4,5,0,0,NA,401124191,2019-03-22,
174,3,8:33,1113,1113,Keri Jewett-Giles made Three Point Jumper. Assisted by Tytionia Adderly.,40,31,9,24,0.8101772381554048,Miami,Florida Gulf Coast,4,5,0,0,NA,401124191,2019-03-22,Florida Gulf Coast
175,3,8:09,1089,1089,Endia Banks missed Jumper.,40,31,9,0,0.8128619753011306,Miami,Florida Gulf Coast,4,5,0,0,NA,401124191,2019-03-22,
176,3,8:09,1089,1089,Tytionia Adderly Defensive Rebound.,40,31,9,31,0.8128619753011306,Miami,Florida Gulf Coast,4,5,0,0,NA,401124191,2019-03-22,
177,3,7:38,1058,1058,Davion Wingate missed Jumper.,40,31,9,0,0.8164492796002515,Miami,Florida Gulf Coast,4,5,0,0,NA,401124191,2019-03-22,
178,3,7:38,1058,1058,Emese Hof Defensive Rebound.,40,31,9,7,0.8164492796002515,Miami,Florida Gulf Coast,4,5,0,0,NA,401124191,2019-03-22,
