play_id,period,time_remaining_period,secs_remaining,secs_remaining_absolute,description,home_score,away_score,score_diff,play_length,win_prob,home,away,home_time_out_remaining,away_time_out_remaining,home_timeout_ind,away_timeout_ind,home_favored_by,game_id,date,whichScored
1,1,9:42,2382,2382,Alexis Hyder missed Layup.,0,0,0,0,0.5,Louisiana Tech,LSU,4,4,0,0,NA,400912540,2016-11-11,NA
2,1,9:42,2382,2382,Alexus Malone Defensive Rebound.,0,0,0,5,0.5,Louisiana Tech,LSU,4,4,0,0,NA,400912540,2016-11-11,
3,1,9:37,2377,2377,Kierra Anthony Turnover.,0,0,0,11,0.5,Louisiana Tech,LSU,4,4,0,0,NA,400912540,2016-11-11,
4,1,9:26,2366,2366,Chloe Jackson Steal.,0,0,0,18,0.5,Louisiana Tech,LSU,4,4,0,0,NA,400912540,2016-11-11,
5,1,9:08,2348,2348,Raigyne Moncrief Turnover.,0,0,0,9,0.5,Louisiana Tech,LSU,4,4,0,0,NA,400912540,2016-11-11,
6,1,8:59,2339,2339,Foul on Raigyne Moncrief.,0,0,0,0,0.5,Louisiana Tech,LSU,4,4,0,0,NA,400912540,2016-11-11,
7,1,8:59,2339,2339,Jasmine LeBlanc made Free Throw.,1,0,1,0,0.5227115105291243,Louisiana Tech,LSU,4,4,0,0,NA,400912540,2016-11-11,Louisiana Tech
8,1,8:59,2339,2339,Jasmine LeBlanc missed Free Throw.,1,0,1,0,0.5227115105291243,Louisiana Tech,LSU,4,4,0,0,NA,400912540,2016-11-11,
9,1,8:59,2339,2339,Ayana Mitchell Defensive Rebound.,1,0,1,14,0.5227115105291243,Louisiana Tech,LSU,4,4,0,0,NA,400912540,2016-11-11,
10,1,8:45,2325,2325,Raigyne Moncrief made Jumper.,1,2,-1,30,0.4771345410764835,Louisiana Tech,LSU,4,4,0,0,NA,400912540,2016-11-11,LSU
11,1,8:15,2295,2295,Ashley Santos missed Three Point Jumper.,1,2,-1,0,0.47680086405453603,Louisiana Tech,LSU,4,4,0,0,NA,400912540,2016-11-11,
12,1,8:15,2295,2295,Shanice Norton Defensive Rebound.,1,2,-1,5,0.47680086405453603,Louisiana Tech,LSU,4,4,0,0,NA,400912540,2016-11-11,
13,1,8:10,2290,2290,Foul on Rochelle Vasquez.,1,2,-1,9,0.4767447867309777,Louisiana Tech,LSU,4,4,0,0,NA,400912540,2016-11-11,
14,1,8:01,2281,2281,Chloe Jackson made Jumper. Assisted by Raigyne Moncrief.,1,4,-3,14,0.43033568924146987,Louisiana Tech,LSU,4,4,0,0,NA,400912540,2016-11-11,LSU
15,1,7:47,2267,2267,Foul on Ayana Mitchell.,1,4,-3,12,0.42986918725572126,Louisiana Tech,LSU,4,4,0,0,NA,400912540,2016-11-11,
16,1,7:35,2255,2255,Kierra Anthony missed Three Point Jumper.,1,4,-3,0,0.42946740801801747,Louisiana Tech,LSU,4,4,0,0,NA,400912540,2016-11-11,
17,1,7:35,2255,2255,Ashley Santos Offensive Rebound.,1,4,-3,11,0.42946740801801747,Louisiana Tech,LSU,4,4,0,0,NA,400912540,2016-11-11,
18,1,7:24,2244,2244,Foul on Ashley Santos.,1,4,-3,0,0.42909767566260976,Louisiana Tech,LSU,4,4,0,0,NA,400912540,2016-11-11,
19,1,7:24,2244,2244,Ashley Santos Turnover.,1,4,-3,8,0.42909767566260976,Louisiana Tech,LSU,4,4,0,0,NA,400912540,2016-11-11,
20,1,7:16,2236,2236,Jasmine Rhodes missed Jumper.,1,4,-3,0,0.42882797906493575,Louisiana Tech,LSU,4,4,0,0,NA,400912540,2016-11-11,
21,1,7:16,2236,2236,Louisiana Tech Defensive Rebound.,1,4,-3,3,0.42882797906493575,Louisiana Tech,LSU,4,4,0,0,NA,400912540,2016-11-11,
22,1,7:13,2233,2233,Foul on Chloe Jackson.,1,4,-3,15,0.428726678572818,Louisiana Tech,LSU,4,4,0,0,NA,400912540,2016-11-11,
23,1,6:58,2218,2218,Alexus Malone made Jumper. Assisted by Ashley Santos.,3,4,-1,19,0.4759251629552016,Louisiana Tech,LSU,4,4,0,0,NA,400912540,2016-11-11,Louisiana Tech
24,1,6:39,2199,2199,Jasmine Rhodes Turnover.,3,4,-1,14,0.4757058251469711,Louisiana Tech,LSU,4,4,0,0,NA,400912540,2016-11-11,
25,1,6:25,2185,2185,Foul on Raigyne Moncrief.,3,4,-1,18,0.4755436062176915,Louisiana Tech,LSU,4,4,0,0,NA,400912540,2016-11-11,
26,1,6:07,2167,2167,Jasmine LeBlanc Turnover.,3,4,-1,21,0.47533440906265767,Louisiana Tech,LSU,4,4,0,0,NA,400912540,2016-11-11,
27,1,5:46,2146,2146,Alexis Hyder Turnover.,3,4,-1,27,0.47508902063357916,Louisiana Tech,LSU,4,4,0,0,NA,400912540,2016-11-11,
28,1,5:19,2119,2119,Jasmine LeBlanc made Jumper. Assisted by Ashley Santos.,5,4,1,10,0.5252291714270902,Louisiana Tech,LSU,4,4,0,0,NA,400912540,2016-11-11,Louisiana Tech
29,1,5:09,2109,2109,Jasmine Rhodes made Layup. Assisted by Chloe Jackson.,5,6,-1,28,0.47465214992702653,Louisiana Tech,LSU,4,4,0,0,NA,400912540,2016-11-11,LSU
30,1,4:41,2081,2081,Rochelle Vasquez Turnover.,5,6,-1,0,0.4743172671380922,Louisiana Tech,LSU,4,4,1,0,NA,400912540,2016-11-11,
31,1,4:41,2081,2081,LSU  Timeout,5,6,-1,10,0.4743172671380922,Louisiana Tech,LSU,3,4,1,0,NA,400912540,2016-11-11,
32,1,4:31,2071,2071,Alexis Hyder made Layup. Assisted by Chloe Jackson.,5,8,-3,31,0.42313548206523693,Louisiana Tech,LSU,3,4,1,0,NA,400912540,2016-11-11,LSU
33,1,4:00,2040,2040,Shlonte Allen made Layup. Assisted by Kierra Anthony.,7,8,-1,14,0.47381940151492263,Louisiana Tech,LSU,3,4,1,0,NA,400912540,2016-11-11,Louisiana Tech
34,1,3:46,2026,2026,Alexis Hyder missed Jumper.,7,8,-1,0,0.4736471753455028,Louisiana Tech,LSU,3,4,1,0,NA,400912540,2016-11-11,
35,1,3:46,2026,2026,Alexis Hyder Offensive Rebound.,7,8,-1,2,0.4736471753455028,Louisiana Tech,LSU,3,4,1,0,NA,400912540,2016-11-11,
36,1,3:44,2024,2024,Foul on Jasmine LeBlanc.,7,8,-1,3,0.4736224740327764,Louisiana Tech,LSU,3,4,1,0,NA,400912540,2016-11-11,
37,1,3:41,2021,2021,Alexis Hyder made Layup. Assisted by Shanice Norton.,7,10,-3,10,0.4213410003729196,Louisiana Tech,LSU,3,4,1,0,NA,400912540,2016-11-11,LSU
38,1,3:31,2011,2011,Foul on Jasmine Rhodes.,7,10,-3,0,0.42097702232514267,Louisiana Tech,LSU,3,4,0,0,NA,400912540,2016-11-11,
39,1,3:31,2011,2011,Kierra Lang missed Free Throw.,7,10,-3,0,0.42097702232514267,Louisiana Tech,LSU,3,4,0,0,NA,400912540,2016-11-11,
40,1,3:31,2011,2011,Louisiana Tech Deadball Team Rebound.,7,10,-3,0,0.42097702232514267,Louisiana Tech,LSU,3,4,0,0,NA,400912540,2016-11-11,
41,1,3:31,2011,2011,Kierra Lang made Free Throw.,8,10,-2,11,0.4470717197588073,Louisiana Tech,LSU,3,4,0,0,NA,400912540,2016-11-11,Louisiana Tech
42,1,3:20,2000,2000,Chloe Jackson Turnover.,8,10,-2,2,0.44679960004646263,Louisiana Tech,LSU,3,4,0,0,NA,400912540,2016-11-11,
43,1,3:18,1998,1998,Shlonte Allen Steal.,8,10,-2,2,0.4467499572376093,Louisiana Tech,LSU,3,4,0,0,NA,400912540,2016-11-11,
44,1,3:16,1996,1996,Alexus Malone made Layup. Assisted by Shlonte Allen.,10,10,0,21,0.5,Louisiana Tech,LSU,3,4,0,0,NA,400912540,2016-11-11,Louisiana Tech
45,1,2:55,1975,1975,Foul on Ashley Santos.,10,10,0,0,0.5,Louisiana Tech,LSU,3,4,0,0,NA,400912540,2016-11-11,
46,1,2:55,1975,1975,Alexis Hyder missed Free Throw.,10,10,0,0,0.5,Louisiana Tech,LSU,3,4,0,0,NA,400912540,2016-11-11,
47,1,2:55,1975,1975,LSU Deadball Team Rebound.,10,10,0,0,0.5,Louisiana Tech,LSU,3,4,0,0,NA,400912540,2016-11-11,
48,1,2:55,1975,1975,Alexis Hyder made Free Throw.,10,11,-1,18,0.47300921094673154,Louisiana Tech,LSU,3,4,0,0,NA,400912540,2016-11-11,LSU
49,1,2:37,1957,1957,Foul on Alexis Hyder.,10,11,-1,0,0.4727797947470498,Louisiana Tech,LSU,3,4,0,0,NA,400912540,2016-11-11,
50,1,2:37,1957,1957,Shlonte Allen made Free Throw.,11,11,0,0,0.5,Louisiana Tech,LSU,3,4,0,0,NA,400912540,2016-11-11,Louisiana Tech
51,1,2:37,1957,1957,Shlonte Allen missed Free Throw.,11,11,0,0,0.5,Louisiana Tech,LSU,3,4,0,0,NA,400912540,2016-11-11,
52,1,2:37,1957,1957,Shlonte Allen Offensive Rebound.,11,11,0,4,0.5,Louisiana Tech,LSU,3,4,0,0,NA,400912540,2016-11-11,
53,1,2:33,1953,1953,Foul on Shlonte Allen.,11,11,0,0,0.5,Louisiana Tech,LSU,3,4,0,0,NA,400912540,2016-11-11,
54,1,2:33,1953,1953,Shlonte Allen Turnover.,11,11,0,15,0.5,Louisiana Tech,LSU,3,4,0,0,NA,400912540,2016-11-11,
55,1,2:18,1938,1938,Jenna Deemer missed Three Point Jumper.,11,11,0,0,0.5,Louisiana Tech,LSU,3,4,0,0,NA,400912540,2016-11-11,
56,1,2:18,1938,1938,Reauna Cleaver Defensive Rebound.,11,11,0,8,0.5,Louisiana Tech,LSU,3,4,0,0,NA,400912540,2016-11-11,
57,1,2:10,1930,1930,Foul on Jenna Deemer.,11,11,0,0,0.5,Louisiana Tech,LSU,3,4,0,0,NA,400912540,2016-11-11,
58,1,2:10,1930,1930,Kierra Anthony made Free Throw.,12,11,1,0,0.5275688201986779,Louisiana Tech,LSU,3,4,0,0,NA,400912540,2016-11-11,Louisiana Tech
59,1,2:10,1930,1930,Kierra Anthony made Free Throw.,13,11,2,15,0.5549705212510788,Louisiana Tech,LSU,3,4,0,0,NA,400912540,2016-11-11,Louisiana Tech
60,1,1:55,1915,1915,Jenna Deemer missed Three Point Jumper.,13,11,2,0,0.5553568961563955,Louisiana Tech,LSU,3,4,0,0,NA,400912540,2016-11-11,
61,1,1:55,1915,1915,Alexus Malone Defensive Rebound.,13,11,2,11,0.5553568961563955,Louisiana Tech,LSU,3,4,0,0,NA,400912540,2016-11-11,
62,1,1:44,1904,1904,Alexus Malone missed Jumper.,13,11,2,0,0.5556397560516335,Louisiana Tech,LSU,3,4,0,0,NA,400912540,2016-11-11,
63,1,1:44,1904,1904,LSU Defensive Rebound.,13,11,2,14,0.5556397560516335,Louisiana Tech,LSU,3,4,0,0,NA,400912540,2016-11-11,
64,1,1:30,1890,1890,Foul on Shlonte Allen.,13,11,2,0,0.5559995290432497,Louisiana Tech,LSU,3,4,0,0,NA,400912540,2016-11-11,
65,1,1:30,1890,1890,Jaelyn Richard-Harris made Free Throw.,13,12,1,0,0.5280881253706348,Louisiana Tech,LSU,3,4,0,0,NA,400912540,2016-11-11,LSU
66,1,1:30,1890,1890,Jaelyn Richard-Harris made Free Throw.,13,13,0,26,0.5,Louisiana Tech,LSU,3,4,0,0,NA,400912540,2016-11-11,LSU
67,1,1:04,1864,1864,Kierra Anthony missed Jumper.,13,13,0,0,0.5,Louisiana Tech,LSU,3,4,0,0,NA,400912540,2016-11-11,
68,1,1:04,1864,1864,Louisiana Tech Offensive Rebound.,13,13,0,2,0.5,Louisiana Tech,LSU,3,4,0,0,NA,400912540,2016-11-11,
69,1,1:02,1862,1862,Foul on Shanice Norton.,13,13,0,0,0.5,Louisiana Tech,LSU,3,4,0,0,NA,400912540,2016-11-11,
70,1,1:02,1862,1862,Reauna Cleaver made Free Throw.,14,13,1,0,0.5284517786582487,Louisiana Tech,LSU,3,4,0,0,NA,400912540,2016-11-11,Louisiana Tech
71,1,1:02,1862,1862,Reauna Cleaver missed Free Throw.,14,13,1,0,0.5284517786582487,Louisiana Tech,LSU,3,4,0,0,NA,400912540,2016-11-11,
72,1,1:02,1862,1862,Shanice Norton Defensive Rebound.,14,13,1,16,0.5284517786582487,Louisiana Tech,LSU,3,4,0,0,NA,400912540,2016-11-11,
73,1,0:46,1846,1846,Jaelyn Richard-Harris missed Jumper.,14,13,1,0,0.5286603974113568,Louisiana Tech,LSU,3,4,0,0,NA,400912540,2016-11-11,
74,1,0:46,1846,1846,Rochelle Vasquez Defensive Rebound.,14,13,1,11,0.5286603974113568,Louisiana Tech,LSU,3,4,0,0,NA,400912540,2016-11-11,
75,1,0:35,1835,1835,Foul on Ayana Mitchell.,14,13,1,0,0.5288043787410257,Louisiana Tech,LSU,3,4,0,0,NA,400912540,2016-11-11,
76,1,0:35,1835,1835,Alexus Malone made Free Throw.,15,13,2,0,0.5574181997442285,Louisiana Tech,LSU,3,4,0,0,NA,400912540,2016-11-11,Louisiana Tech
77,1,0:35,1835,1835,Alexus Malone made Free Throw.,16,13,3,24,0.5856559147328643,Louisiana Tech,LSU,3,4,0,0,NA,400912540,2016-11-11,Louisiana Tech
78,1,0:11,1811,1811,Jenna Deemer missed Layup.,16,13,3,0,0.5865796701071997,Louisiana Tech,LSU,3,4,0,0,NA,400912540,2016-11-11,
79,1,0:11,1811,1811,Alexus Malone Block.,16,13,3,2,0.5865796701071997,Louisiana Tech,LSU,3,4,0,0,NA,400912540,2016-11-11,
80,1,0:09,1809,1809,Alexus Malone Defensive Rebound.,16,13,3,8,0.5866570823834444,Louisiana Tech,LSU,3,4,0,0,NA,400912540,2016-11-11,
81,1,0:01,1801,1801,Rochelle Vasquez missed Three Point Jumper.,16,13,3,0,0.5869674990168224,Louisiana Tech,LSU,3,4,0,0,NA,400912540,2016-11-11,
82,1,0:01,1801,1801,LSU Defensive Rebound.,16,13,3,1,0.5869674990168224,Louisiana Tech,LSU,3,4,0,0,NA,400912540,2016-11-11,
83,1,0:00,1800,1800,End of 1st Quarter,16,13,3,17,0.5870063911476985,Louisiana Tech,LSU,3,4,0,0,NA,400912540,2016-11-11,
84,2,9:43,1783,1783,Reauna Cleaver made Jumper. Assisted by Rochelle Vasquez.,18,13,5,24,0.643497199934432,Louisiana Tech,LSU,4,4,0,0,NA,400912540,2016-11-11,Louisiana Tech
85,2,9:19,1759,1759,Chloe Jackson missed Layup.,18,13,5,0,0.6449960999878918,Louisiana Tech,LSU,4,4,0,0,NA,400912540,2016-11-11,
86,2,9:19,1759,1759,Anna McLeod Defensive Rebound.,18,13,5,9,0.6449960999878918,Louisiana Tech,LSU,4,4,0,0,NA,400912540,2016-11-11,
87,2,9:10,1750,1750,Foul on Alexis Hyder.,18,13,5,0,0.6455644659542759,Louisiana Tech,LSU,4,4,0,0,NA,400912540,2016-11-11,
88,2,9:10,1750,1750,Reauna Cleaver made Free Throw.,19,13,6,0,0.672500937980324,Louisiana Tech,LSU,4,4,0,0,NA,400912540,2016-11-11,Louisiana Tech
89,2,9:10,1750,1750,Reauna Cleaver made Free Throw.,20,13,7,25,0.6983468463611365,Louisiana Tech,LSU,4,4,0,0,NA,400912540,2016-11-11,Louisiana Tech
90,2,8:45,1725,1725,Foul on Reauna Cleaver.,20,13,7,2,0.7004066848235114,Louisiana Tech,LSU,4,4,0,0,NA,400912540,2016-11-11,
91,2,8:43,1723,1723,Jasmine Rhodes missed Layup.,20,13,7,0,0.7005731467267545,Louisiana Tech,LSU,4,4,0,0,NA,400912540,2016-11-11,
92,2,8:43,1723,1723,Anna McLeod Block.,20,13,7,2,0.7005731467267545,Louisiana Tech,LSU,4,4,0,0,NA,400912540,2016-11-11,
93,2,8:41,1721,1721,Reauna Cleaver Defensive Rebound.,20,13,7,4,0.700739872939187,Louisiana Tech,LSU,4,4,0,0,NA,400912540,2016-11-11,
94,2,8:37,1717,1717,Kierra Anthony Turnover.,20,13,7,13,0.7010741315977451,Louisiana Tech,LSU,4,4,0,0,NA,400912540,2016-11-11,
95,2,8:24,1704,1704,Alexis Hyder Turnover.,20,13,7,20,0.7021681860283174,Louisiana Tech,LSU,4,4,0,0,NA,400912540,2016-11-11,
96,2,8:04,1684,1684,Anna McLeod missed Three Point Jumper.,20,13,7,0,0.703871889829018,Louisiana Tech,LSU,4,4,0,0,NA,400912540,2016-11-11,
97,2,8:04,1684,1684,Jenna Deemer Defensive Rebound.,20,13,7,8,0.703871889829018,Louisiana Tech,LSU,4,4,0,0,NA,400912540,2016-11-11,
98,2,7:56,1676,1676,Jasmine Rhodes made Jumper. Assisted by Chloe Jackson.,20,15,5,28,0.6503874541020207,Louisiana Tech,LSU,4,4,0,0,NA,400912540,2016-11-11,LSU
99,2,7:28,1648,1648,Jasmine LeBlanc missed Jumper.,20,15,5,0,0.6521827882934683,Louisiana Tech,LSU,4,4,0,0,NA,400912540,2016-11-11,
100,2,7:28,1648,1648,Chloe Jackson Defensive Rebound.,20,15,5,7,0.6521827882934683,Louisiana Tech,LSU,4,4,0,0,NA,400912540,2016-11-11,
101,2,7:21,1641,1641,Chloe Jackson missed Jumper.,20,15,5,0,0.6526230031957734,Louisiana Tech,LSU,4,4,0,0,NA,400912540,2016-11-11,
102,2,7:21,1641,1641,Kierra Anthony Defensive Rebound.,20,15,5,28,0.6526230031957734,Louisiana Tech,LSU,4,4,0,0,NA,400912540,2016-11-11,
103,2,6:53,1613,1613,Reauna Cleaver missed Jumper.,20,15,5,0,0.6543623728541206,Louisiana Tech,LSU,4,4,0,0,NA,400912540,2016-11-11,
104,2,6:53,1613,1613,Jaelyn Richard-Harris Defensive Rebound.,20,15,5,7,0.6543623728541206,Louisiana Tech,LSU,4,4,0,0,NA,400912540,2016-11-11,
105,2,6:46,1606,1606,Jenna Deemer missed Three Point Jumper.,20,15,5,0,0.6547939942205286,Louisiana Tech,LSU,4,4,0,0,NA,400912540,2016-11-11,
106,2,6:46,1606,1606,Jaelyn Richard-Harris Offensive Rebound.,20,15,5,6,0.6547939942205286,Louisiana Tech,LSU,4,4,0,0,NA,400912540,2016-11-11,
107,2,6:40,1600,1600,Jasmine Rhodes made Jumper. Assisted by Jaelyn Richard-Harris.,20,17,3,4,0.5950998982458968,Louisiana Tech,LSU,4,4,0,0,NA,400912540,2016-11-11,LSU
108,2,6:36,1596,1596,LSU  Timeout,20,17,3,26,0.5952575645806943,Louisiana Tech,LSU,3,4,1,0,NA,400912540,2016-11-11,
109,2,6:10,1570,1570,Jasmine LeBlanc missed Jumper.,20,17,3,0,0.5962864018946599,Louisiana Tech,LSU,3,4,1,0,NA,400912540,2016-11-11,
110,2,6:10,1570,1570,LSU Defensive Rebound.,20,17,3,30,0.5962864018946599,Louisiana Tech,LSU,3,4,1,0,NA,400912540,2016-11-11,
111,2,5:40,1540,1540,Chloe Jackson made Jumper.,20,19,1,16,0.5328725505053704,Louisiana Tech,LSU,3,4,1,0,NA,400912540,2016-11-11,LSU
112,2,5:24,1524,1524,Foul on Jenna Deemer.,20,19,1,3,0.5331008183732554,Louisiana Tech,LSU,3,4,0,0,NA,400912540,2016-11-11,
113,2,5:21,1521,1521,Jasmine LeBlanc made Jumper. Assisted by Daria McCutcheon.,22,19,3,20,0.5982826401077885,Louisiana Tech,LSU,3,4,0,0,NA,400912540,2016-11-11,Louisiana Tech
114,2,5:01,1501,1501,Jaelyn Richard-Harris missed Jumper.,22,19,3,0,0.5991362198311965,Louisiana Tech,LSU,3,4,0,0,NA,400912540,2016-11-11,
115,2,5:01,1501,1501,Jasmine Rhodes Offensive Rebound.,22,19,3,12,0.5991362198311965,Louisiana Tech,LSU,3,4,0,0,NA,400912540,2016-11-11,
116,2,4:49,1489,1489,Jasmine Rhodes made Jumper. Assisted by Chloe Jackson.,22,21,1,23,0.5336210360573875,Louisiana Tech,LSU,3,4,0,0,NA,400912540,2016-11-11,LSU
117,2,4:26,1466,1466,Jasmine LeBlanc missed Jumper.,22,21,1,0,0.5339830092345219,Louisiana Tech,LSU,3,4,0,0,NA,400912540,2016-11-11,
118,2,4:26,1466,1466,Yasmine Bidikuindila Defensive Rebound.,22,21,1,10,0.5339830092345219,Louisiana Tech,LSU,3,4,0,0,NA,400912540,2016-11-11,
119,2,4:16,1456,1456,Chloe Jackson made Three Point Jumper.,22,24,-2,24,0.4320242526278614,Louisiana Tech,LSU,3,4,0,0,NA,400912540,2016-11-11,LSU
120,2,3:52,1432,1432,Alexus Malone made Layup.,24,24,0,16,0.5,Louisiana Tech,LSU,3,4,0,0,NA,400912540,2016-11-11,Louisiana Tech
121,2,3:36,1416,1416,Chloe Jackson made Jumper. Assisted by Jenna Deemer.,24,26,-2,0,0.430740677327383,Louisiana Tech,LSU,3,4,0,0,NA,400912540,2016-11-11,LSU
122,2,3:36,1416,1416,Foul on Jasmine LeBlanc.,24,26,-2,0,0.430740677327383,Louisiana Tech,LSU,3,4,0,0,NA,400912540,2016-11-11,
123,2,3:36,1416,1416,Chloe Jackson made Free Throw.,24,27,-3,17,0.3969368363875747,Louisiana Tech,LSU,3,4,0,0,NA,400912540,2016-11-11,LSU
124,2,3:19,1399,1399,Kierra Anthony made Three Point Jumper. Assisted by Kierra Lang.,27,27,0,12,0.5,Louisiana Tech,LSU,3,4,0,0,NA,400912540,2016-11-11,Louisiana Tech
125,2,3:07,1387,1387,Yasmine Bidikuindila Turnover.,27,27,0,21,0.5,Louisiana Tech,LSU,3,4,0,0,NA,400912540,2016-11-11,
126,2,2:46,1366,1366,Kierra Lang made Three Point Jumper. Assisted by Kierra Anthony.,30,27,3,14,0.6052788136162416,Louisiana Tech,LSU,3,4,0,0,NA,400912540,2016-11-11,Louisiana Tech
127,2,2:32,1352,1352,Chloe Jackson missed Three Point Jumper.,30,27,3,0,0.6058932650302651,Louisiana Tech,LSU,3,4,0,0,NA,400912540,2016-11-11,
128,2,2:32,1352,1352,Jaelyn Richard-Harris Offensive Rebound.,30,27,3,15,0.6058932650302651,Louisiana Tech,LSU,3,4,0,0,NA,400912540,2016-11-11,
129,2,2:17,1337,1337,Shanice Norton Turnover.,30,27,3,2,0.60655679962203,Louisiana Tech,LSU,3,4,0,0,NA,400912540,2016-11-11,
130,2,2:15,1335,1335,Kierra Anthony Steal.,30,27,3,5,0.6066459236719226,Louisiana Tech,LSU,3,4,0,0,NA,400912540,2016-11-11,
131,2,2:10,1330,1330,Kierra Anthony Turnover.,30,27,3,2,0.6068695858164489,Louisiana Tech,LSU,3,4,0,0,NA,400912540,2016-11-11,
132,2,2:08,1328,1328,Chloe Jackson Steal.,30,27,3,1,0.6069594209153129,Louisiana Tech,LSU,3,4,0,0,NA,400912540,2016-11-11,
133,2,2:07,1327,1327,Chloe Jackson made Layup.,30,29,1,0,0.5361648781480068,Louisiana Tech,LSU,3,4,0,0,NA,400912540,2016-11-11,LSU
134,2,2:07,1327,1327,Foul on Kierra Lang.,30,29,1,0,0.5361648781480068,Louisiana Tech,LSU,3,4,0,0,NA,400912540,2016-11-11,
135,2,2:07,1327,1327,Chloe Jackson made Free Throw.,30,30,0,8,0.5,Louisiana Tech,LSU,3,4,0,0,NA,400912540,2016-11-11,LSU
136,2,1:59,1319,1319,Alexus Malone Turnover.,30,30,0,21,0.5,Louisiana Tech,LSU,3,4,0,0,NA,400912540,2016-11-11,
137,2,1:38,1298,1298,Jenna Deemer missed Three Point Jumper.,30,30,0,0,0.5,Louisiana Tech,LSU,3,4,0,0,NA,400912540,2016-11-11,
138,2,1:38,1298,1298,Chloe Jackson Offensive Rebound.,30,30,0,14,0.5,Louisiana Tech,LSU,3,4,0,0,NA,400912540,2016-11-11,
139,2,1:24,1284,1284,Shanice Norton missed Jumper.,30,30,0,0,0.5,Louisiana Tech,LSU,3,4,0,0,NA,400912540,2016-11-11,
140,2,1:24,1284,1284,Louisiana Tech Defensive Rebound.,30,30,0,3,0.5,Louisiana Tech,LSU,3,4,0,0,NA,400912540,2016-11-11,
141,2,1:21,1281,1281,Foul on Shanice Norton.,30,30,0,28,0.5,Louisiana Tech,LSU,3,4,0,0,NA,400912540,2016-11-11,
142,2,0:53,1253,1253,Rochelle Vasquez missed Three Point Jumper.,30,30,0,0,0.5,Louisiana Tech,LSU,3,4,0,0,NA,400912540,2016-11-11,
143,2,0:53,1253,1253,Alexis Hyder Defensive Rebound.,30,30,0,8,0.5,Louisiana Tech,LSU,3,4,0,0,NA,400912540,2016-11-11,
144,2,0:45,1245,1245,Shanice Norton made Layup.,30,32,-2,31,0.42529519548225636,Louisiana Tech,LSU,3,4,0,0,NA,400912540,2016-11-11,LSU
145,2,0:14,1214,1214,Reauna Cleaver made Jumper. Assisted by Rochelle Vasquez.,32,32,0,12,0.5,Louisiana Tech,LSU,3,4,0,0,NA,400912540,2016-11-11,Louisiana Tech
146,2,0:02,1202,1202,Chloe Jackson missed Jumper.,32,32,0,0,0.5,Louisiana Tech,LSU,3,4,0,0,NA,400912540,2016-11-11,
147,2,0:02,1202,1202,Alexus Malone Defensive Rebound.,32,32,0,2,0.5,Louisiana Tech,LSU,3,4,0,0,NA,400912540,2016-11-11,
148,2,0:00,1200,1200,End of 2nd Quarter,32,32,0,8,0.5,Louisiana Tech,LSU,3,4,0,0,NA,400912540,2016-11-11,
149,3,9:52,1192,1192,Raigyne Moncrief made Layup.,32,34,-2,35,0.42316337537567084,Louisiana Tech,LSU,4,5,0,0,NA,400912540,2016-11-11,LSU
150,3,9:17,1157,1157,Ashley Santos missed Layup.,32,34,-2,0,0.4217768494716882,Louisiana Tech,LSU,4,5,0,0,NA,400912540,2016-11-11,
151,3,9:17,1157,1157,Alexis Hyder Block.,32,34,-2,0,0.4217768494716882,Louisiana Tech,LSU,4,5,0,0,NA,400912540,2016-11-11,
152,3,9:17,1157,1157,LSU Defensive Rebound.,32,34,-2,12,0.4217768494716882,Louisiana Tech,LSU,4,5,0,0,NA,400912540,2016-11-11,
153,3,9:05,1145,1145,Alexis Hyder Turnover.,32,34,-2,13,0.4213115738206691,Louisiana Tech,LSU,4,5,0,0,NA,400912540,2016-11-11,
154,3,8:52,1132,1132,Alexus Malone Turnover.,32,34,-2,18,0.42080901338516086,Louisiana Tech,LSU,4,5,0,0,NA,400912540,2016-11-11,
155,3,8:34,1114,1114,Ayana Mitchell missed Jumper.,32,34,-2,0,0.42011039246825355,Louisiana Tech,LSU,4,5,0,0,NA,400912540,2016-11-11,
156,3,8:34,1114,1114,Alexis Hyder Offensive Rebound.,32,34,-2,4,0.42011039246825355,Louisiana Tech,LSU,4,5,0,0,NA,400912540,2016-11-11,
157,3,8:30,1110,1110,Alexis Hyder made Layup.,32,36,-4,13,0.3439085831984986,Louisiana Tech,LSU,4,5,0,0,NA,400912540,2016-11-11,LSU
158,3,8:17,1097,1097,Kierra Anthony Turnover.,32,36,-4,3,0.3429592043869802,Louisiana Tech,LSU,4,5,0,0,NA,400912540,2016-11-11,
159,3,8:14,1094,1094,Chloe Jackson Steal.,32,36,-4,2,0.34273803924661544,Louisiana Tech,LSU,4,5,0,0,NA,400912540,2016-11-11,
160,3,8:12,1092,1092,Chloe Jackson made Layup.,32,38,-6,0,0.2733564142436877,Louisiana Tech,LSU,4,5,0,1,NA,400912540,2016-11-11,LSU
161,3,8:12,1092,1092,Louisiana Tech  Timeout,32,38,-6,7,0.2733564142436877,Louisiana Tech,LSU,4,4,0,1,NA,400912540,2016-11-11,
162,3,8:05,1085,1085,Shlonte Allen Turnover.,32,38,-6,4,0.2726670541461971,Louisiana Tech,LSU,4,4,0,1,NA,400912540,2016-11-11,
163,3,8:01,1081,1081,Shanice Norton Steal.,32,38,-6,6,0.27226987030430405,Louisiana Tech,LSU,4,4,0,1,NA,400912540,2016-11-11,
164,3,7:55,1075,1075,Raigyne Moncrief Turnover.,32,38,-6,2,0.2716691132495679,Louisiana Tech,LSU,4,4,0,1,NA,400912540,2016-11-11,
165,3,7:53,1073,1073,Shlonte Allen Steal.,32,38,-6,4,0.27146743315712846,Louisiana Tech,LSU,4,4,0,1,NA,400912540,2016-11-11,
166,3,7:49,1069,1069,Kierra Anthony missed Jumper.,32,38,-6,0,0.2710617829062453,Louisiana Tech,LSU,4,4,0,1,NA,400912540,2016-11-11,
167,3,7:49,1069,1069,Ashley Santos Offensive Rebound.,32,38,-6,2,0.2710617829062453,Louisiana Tech,LSU,4,4,0,1,NA,400912540,2016-11-11,
168,3,7:47,1067,1067,Foul on Ayana Mitchell.,32,38,-6,1,0.2708577634529639,Louisiana Tech,LSU,4,4,0,1,NA,400912540,2016-11-11,
169,3,7:46,1066,1066,Jasmine LeBlanc made Layup. Assisted by Kierra Anthony.,34,38,-4,20,0.34062084164179196,Louisiana Tech,LSU,4,4,0,1,NA,400912540,2016-11-11,Louisiana Tech
170,3,7:26,1046,1046,Ayana Mitchell Turnover.,34,38,-4,2,0.339030337900886,Louisiana Tech,LSU,4,4,0,1,NA,400912540,2016-11-11,
171,3,7:24,1044,1044,Shlonte Allen Steal.,34,38,-4,1,0.33886682714092264,Louisiana Tech,LSU,4,4,0,1,NA,400912540,2016-11-11,
172,3,7:23,1043,1043,Shlonte Allen made Layup.,36,38,-2,0,0.41718081357292236,Louisiana Tech,LSU,4,4,0,1,NA,400912540,2016-11-11,Louisiana Tech
173,3,7:23,1043,1043,Foul on Shanice Norton.,36,38,-2,0,0.41718081357292236,Louisiana Tech,LSU,4,4,0,1,NA,400912540,2016-11-11,
174,3,7:23,1043,1043,Shlonte Allen made Free Throw.,37,38,-1,10,0.45830241321201487,Louisiana Tech,LSU,4,4,0,1,NA,400912540,2016-11-11,Louisiana Tech
175,3,7:13,1033,1033,Foul on Ashley Santos.,37,38,-1,2,0.4580713270411348,Louisiana Tech,LSU,4,4,0,1,NA,400912540,2016-11-11,
176,3,7:11,1031,1031,Foul on Alexus Malone.,37,38,-1,0,0.4580242750599105,Louisiana Tech,LSU,4,4,0,0,NA,400912540,2016-11-11,
177,3,7:11,1031,1031,Ayana Mitchell made Free Throw.,37,39,-2,0,0.4166360861414005,Louisiana Tech,LSU,4,4,0,0,NA,400912540,2016-11-11,LSU
178,3,7:11,1031,1031,Ayana Mitchell made Free Throw.,37,40,-3,11,0.3763905282764396,Louisiana Tech,LSU,4,4,0,0,NA,400912540,2016-11-11,LSU
179,3,7:00,1020,1020,Shlonte Allen made Layup.,39,40,-1,17,0.4577601447576344,Louisiana Tech,LSU,4,4,0,0,NA,400912540,2016-11-11,Louisiana Tech
180,3,6:43,1003,1003,Chloe Jackson made Jumper.,39,42,-3,15,0.3744301447954055,Louisiana Tech,LSU,4,4,0,0,NA,400912540,2016-11-11,LSU
181,3,6:28,988,988,Foul on Alexis Hyder.,39,42,-3,0,0.37330051437651496,Louisiana Tech,LSU,4,4,0,0,NA,400912540,2016-11-11,
182,3,6:28,988,988,Alexus Malone made Free Throw.,40,42,-2,0,0.41450104195972143,Louisiana Tech,LSU,4,4,0,0,NA,400912540,2016-11-11,Louisiana Tech
183,3,6:28,988,988,Alexus Malone made Free Throw.,41,42,-1,22,0.45693336515365407,Louisiana Tech,LSU,4,4,0,0,NA,400912540,2016-11-11,Louisiana Tech
184,3,6:06,966,966,Jenna Deemer made Jumper.,41,44,-3,15,0.37153366867482857,Louisiana Tech,LSU,4,4,0,0,NA,400912540,2016-11-11,LSU
185,3,5:51,951,951,Alexus Malone missed Jumper.,41,44,-3,0,0.37037270748334744,Louisiana Tech,LSU,4,4,0,0,NA,400912540,2016-11-11,
186,3,5:51,951,951,Alexis Hyder Defensive Rebound.,41,44,-3,2,0.37037270748334744,Louisiana Tech,LSU,4,4,0,0,NA,400912540,2016-11-11,
187,3,5:49,949,949,Foul on Shlonte Allen.,41,44,-3,21,0.37022500585082563,Louisiana Tech,LSU,4,4,0,0,NA,400912540,2016-11-11,
188,3,5:28,928,928,Chloe Jackson missed Jumper.,41,44,-3,0,0.3687574424265795,Louisiana Tech,LSU,4,4,0,0,NA,400912540,2016-11-11,
189,3,5:28,928,928,Alexis Hyder Offensive Rebound.,41,44,-3,5,0.3687574424265795,Louisiana Tech,LSU,4,4,0,0,NA,400912540,2016-11-11,
190,3,5:23,923,923,Foul on Reauna Cleaver.,41,44,-3,0,0.3684269946859019,Louisiana Tech,LSU,4,4,0,0,NA,400912540,2016-11-11,
191,3,5:23,923,923,Alexis Hyder made Free Throw.,41,45,-4,0,0.3276951887395537,Louisiana Tech,LSU,4,4,0,0,NA,400912540,2016-11-11,LSU
192,3,5:23,923,923,Alexis Hyder made Free Throw.,41,46,-5,18,0.28940307015791367,Louisiana Tech,LSU,4,4,0,0,NA,400912540,2016-11-11,LSU
193,3,5:05,905,905,Reauna Cleaver missed Layup.,41,46,-5,0,0.28771628130857174,Louisiana Tech,LSU,4,4,0,0,NA,400912540,2016-11-11,
