play_id,period,time_remaining_period,secs_remaining,secs_remaining_absolute,description,home_score,away_score,score_diff,play_length,win_prob,home,away,home_time_out_remaining,away_time_out_remaining,home_timeout_ind,away_timeout_ind,home_favored_by,game_id,date,whichScored
194,3,5:05,905,905,Chloe Jackson Defensive Rebound.,41,46,-5,7,0.28771628130857174,Louisiana Tech,LSU,4,4,0,0,NA,400912540,2016-11-11,
195,3,4:58,898,898,Chloe Jackson missed Layup.,41,46,-5,0,0.2870808833391939,Louisiana Tech,LSU,4,4,0,0,NA,400912540,2016-11-11,
196,3,4:58,898,898,Reauna Cleaver Defensive Rebound.,41,46,-5,3,0.2870808833391939,Louisiana Tech,LSU,4,4,0,0,NA,400912540,2016-11-11,
197,3,4:55,895,895,Foul on Jenna Deemer.,41,46,-5,0,0.28681093000561864,Louisiana Tech,LSU,4,4,0,1,NA,400912540,2016-11-11,
198,3,4:55,895,895,Louisiana Tech  Timeout,41,46,-5,16,0.28681093000561864,Louisiana Tech,LSU,4,3,0,1,NA,400912540,2016-11-11,
199,3,4:39,879,879,Jasmine LeBlanc made Jumper. Assisted by Reauna Cleaver.,43,46,-3,24,0.3656915300673551,Louisiana Tech,LSU,4,3,0,1,NA,400912540,2016-11-11,Louisiana Tech
200,3,4:15,855,855,Foul on Alexis Hyder.,43,46,-3,0,0.3642185659581457,Louisiana Tech,LSU,4,3,0,1,NA,400912540,2016-11-11,
201,3,4:15,855,855,Alexis Hyder Turnover.,43,46,-3,17,0.3642185659581457,Louisiana Tech,LSU,4,3,0,1,NA,400912540,2016-11-11,
202,3,3:58,838,838,Reauna Cleaver Turnover.,43,46,-3,1,0.36312831082149266,Louisiana Tech,LSU,4,3,0,1,NA,400912540,2016-11-11,
203,3,3:57,837,837,Jasmine Rhodes Steal.,43,46,-3,7,0.3630622686816518,Louisiana Tech,LSU,4,3,0,1,NA,400912540,2016-11-11,
204,3,3:50,830,830,Foul on Reauna Cleaver.,43,46,-3,0,0.36259274550246423,Louisiana Tech,LSU,4,3,0,0,NA,400912540,2016-11-11,
205,3,3:50,830,830,Ayana Mitchell missed Free Throw.,43,46,-3,0,0.36259274550246423,Louisiana Tech,LSU,4,3,0,0,NA,400912540,2016-11-11,
206,3,3:50,830,830,LSU Deadball Team Rebound.,43,46,-3,0,0.36259274550246423,Louisiana Tech,LSU,4,3,0,0,NA,400912540,2016-11-11,
207,3,3:50,830,830,Ayana Mitchell missed Free Throw.,43,46,-3,0,0.36259274550246423,Louisiana Tech,LSU,4,3,0,0,NA,400912540,2016-11-11,
208,3,3:50,830,830,Jasmine Rhodes Offensive Rebound.,43,46,-3,10,0.36259274550246423,Louisiana Tech,LSU,4,3,0,0,NA,400912540,2016-11-11,
209,3,3:40,820,820,Jasmine Rhodes missed Jumper.,43,46,-3,0,0.36189725019006946,Louisiana Tech,LSU,4,3,0,0,NA,400912540,2016-11-11,
210,3,3:40,820,820,Raigyne Moncrief Offensive Rebound.,43,46,-3,4,0.36189725019006946,Louisiana Tech,LSU,4,3,0,0,NA,400912540,2016-11-11,
211,3,3:36,816,816,Raigyne Moncrief made Layup.,43,48,-5,16,0.2794268422477317,Louisiana Tech,LSU,4,3,0,0,NA,400912540,2016-11-11,LSU
212,3,3:20,800,800,Kierra Anthony made Three Point Jumper. Assisted by Kierra Lang.,46,48,-2,16,0.40554265753338176,Louisiana Tech,LSU,4,3,0,0,NA,400912540,2016-11-11,Louisiana Tech
213,3,3:04,784,784,Raigyne Moncrief made Jumper. Assisted by Jasmine Rhodes.,46,50,-4,14,0.3159335254786994,Louisiana Tech,LSU,4,3,0,0,NA,400912540,2016-11-11,LSU
214,3,2:50,770,770,Jasmine LeBlanc missed Jumper.,46,50,-4,0,0.31434148939497253,Louisiana Tech,LSU,4,3,0,0,NA,400912540,2016-11-11,
215,3,2:50,770,770,Kierra Lang Offensive Rebound.,46,50,-4,10,0.31434148939497253,Louisiana Tech,LSU,4,3,0,0,NA,400912540,2016-11-11,
216,3,2:40,760,760,Foul on Jaelyn Richard-Harris.,46,50,-4,0,0.31311496493603425,Louisiana Tech,LSU,4,3,0,0,NA,400912540,2016-11-11,
217,3,2:40,760,760,Kierra Anthony made Free Throw.,47,50,-3,0,0.3568190329421036,Louisiana Tech,LSU,4,3,0,0,NA,400912540,2016-11-11,Louisiana Tech
218,3,2:40,760,760,Kierra Anthony made Free Throw.,48,50,-2,23,0.4030438594705088,Louisiana Tech,LSU,4,3,0,0,NA,400912540,2016-11-11,Louisiana Tech
219,3,2:17,737,737,Chloe Jackson missed Three Point Jumper.,48,50,-2,0,0.4012831383979186,Louisiana Tech,LSU,4,3,0,0,NA,400912540,2016-11-11,
220,3,2:17,737,737,Kierra Anthony Defensive Rebound.,48,50,-2,10,0.4012831383979186,Louisiana Tech,LSU,4,3,0,0,NA,400912540,2016-11-11,
221,3,2:07,727,727,Ashley Santos made Jumper. Assisted by Kierra Anthony.,50,50,0,32,0.5,Louisiana Tech,LSU,4,3,0,0,NA,400912540,2016-11-11,Louisiana Tech
222,3,1:35,695,695,Foul on Alexus Malone.,50,50,0,0,0.5,Louisiana Tech,LSU,4,3,0,0,NA,400912540,2016-11-11,
223,3,1:35,695,695,Jaelyn Richard-Harris made Free Throw.,50,51,-1,0,0.4484640282553319,Louisiana Tech,LSU,4,3,0,0,NA,400912540,2016-11-11,LSU
224,3,1:35,695,695,Jaelyn Richard-Harris missed Free Throw.,50,51,-1,0,0.4484640282553319,Louisiana Tech,LSU,4,3,0,0,NA,400912540,2016-11-11,
225,3,1:35,695,695,Ashley Santos Defensive Rebound.,50,51,-1,16,0.4484640282553319,Louisiana Tech,LSU,4,3,0,0,NA,400912540,2016-11-11,
226,3,1:19,679,679,Kierra Anthony missed Jumper.,50,51,-1,0,0.4479141134389915,Louisiana Tech,LSU,4,3,0,0,NA,400912540,2016-11-11,
227,3,1:19,679,679,LSU Defensive Rebound.,50,51,-1,22,0.4479141134389915,Louisiana Tech,LSU,4,3,0,0,NA,400912540,2016-11-11,
228,3,0:57,657,657,Raigyne Moncrief made Jumper. Assisted by Chloe Jackson.,50,53,-3,20,0.34612021411719385,Louisiana Tech,LSU,4,3,0,0,NA,400912540,2016-11-11,LSU
229,3,0:37,637,637,Kierra Anthony Turnover.,50,53,-3,14,0.34426169296006204,Louisiana Tech,LSU,4,3,0,0,NA,400912540,2016-11-11,
230,3,0:23,623,623,Chloe Jackson Turnover.,50,53,-3,1,0.34287258190926834,Louisiana Tech,LSU,4,3,0,0,NA,400912540,2016-11-11,
231,3,0:22,622,622,Alexus Malone Steal.,50,53,-3,3,0.342769292831771,Louisiana Tech,LSU,4,3,0,0,NA,400912540,2016-11-11,
232,3,0:19,619,619,Kierra Anthony made Layup. Assisted by Alexus Malone.,52,53,-1,1,0.4458490471778671,Louisiana Tech,LSU,4,3,0,0,NA,400912540,2016-11-11,Louisiana Tech
233,3,0:18,618,618,Foul on Chloe Jackson.,52,53,-1,0,0.44581032870980836,Louisiana Tech,LSU,4,3,0,0,NA,400912540,2016-11-11,
234,3,0:18,618,618,Kierra Anthony made Free Throw.,53,53,0,16,0.5,Louisiana Tech,LSU,4,3,0,0,NA,400912540,2016-11-11,Louisiana Tech
235,3,0:02,602,602,Foul on Alexus Malone.,53,53,0,0,0.5,Louisiana Tech,LSU,4,3,0,0,NA,400912540,2016-11-11,
236,3,0:02,602,602,Shanice Norton made Free Throw.,53,54,-1,0,0.4451526810602755,Louisiana Tech,LSU,4,3,0,0,NA,400912540,2016-11-11,LSU
237,3,0:02,602,602,Shanice Norton missed Free Throw.,53,54,-1,0,0.4451526810602755,Louisiana Tech,LSU,4,3,0,0,NA,400912540,2016-11-11,
238,3,0:02,602,602,Alexus Malone Defensive Rebound.,53,54,-1,2,0.4451526810602755,Louisiana Tech,LSU,4,3,0,0,NA,400912540,2016-11-11,
239,3,0:00,600,600,End of 3rd Quarter,53,54,-1,4,0.44506480685690686,Louisiana Tech,LSU,4,3,0,0,NA,400912540,2016-11-11,
240,4,9:56,596,596,Shlonte Allen missed Three Point Jumper.,53,54,-1,0,0.4448848023129791,Louisiana Tech,LSU,5,4,0,0,NA,400912540,2016-11-11,
241,4,9:56,596,596,Jasmine LeBlanc Offensive Rebound.,53,54,-1,3,0.4448848023129791,Louisiana Tech,LSU,5,4,0,0,NA,400912540,2016-11-11,
242,4,9:53,593,593,Foul on Raigyne Moncrief.,53,54,-1,1,0.444745904051371,Louisiana Tech,LSU,5,4,0,0,NA,400912540,2016-11-11,
243,4,9:52,592,592,Jasmine LeBlanc missed Jumper.,53,54,-1,0,0.44469883385549597,Louisiana Tech,LSU,5,4,0,0,NA,400912540,2016-11-11,
244,4,9:52,592,592,Raigyne Moncrief Defensive Rebound.,53,54,-1,8,0.44469883385549597,Louisiana Tech,LSU,5,4,0,0,NA,400912540,2016-11-11,
245,4,9:44,584,584,Raigyne Moncrief missed Jumper.,53,54,-1,0,0.4443076184784542,Louisiana Tech,LSU,5,4,0,0,NA,400912540,2016-11-11,
246,4,9:44,584,584,Shlonte Allen Defensive Rebound.,53,54,-1,5,0.4443076184784542,Louisiana Tech,LSU,5,4,0,0,NA,400912540,2016-11-11,
247,4,9:39,579,579,Shlonte Allen missed Layup.,53,54,-1,0,0.4440490588438959,Louisiana Tech,LSU,5,4,0,0,NA,400912540,2016-11-11,
248,4,9:39,579,579,Raigyne Moncrief Block.,53,54,-1,2,0.4440490588438959,Louisiana Tech,LSU,5,4,0,0,NA,400912540,2016-11-11,
249,4,9:37,577,577,Shanice Norton Defensive Rebound.,53,54,-1,22,0.44394241950673563,Louisiana Tech,LSU,5,4,0,0,NA,400912540,2016-11-11,
250,4,9:15,555,555,Ayana Mitchell made Layup. Assisted by Jenna Deemer.,53,56,-3,21,0.3337144700716417,Louisiana Tech,LSU,5,4,0,0,NA,400912540,2016-11-11,LSU
251,4,8:54,534,534,Kierra Anthony missed Jumper.,53,56,-3,0,0.3301143596226269,Louisiana Tech,LSU,5,4,0,0,NA,400912540,2016-11-11,
252,4,8:54,534,534,Jasmine Rhodes Defensive Rebound.,53,56,-3,16,0.3301143596226269,Louisiana Tech,LSU,5,4,0,0,NA,400912540,2016-11-11,
253,4,8:38,518,518,Shanice Norton made Layup. Assisted by Jasmine Rhodes.,53,58,-5,16,0.23204392139561508,Louisiana Tech,LSU,5,4,0,0,NA,400912540,2016-11-11,LSU
254,4,8:22,502,502,Shlonte Allen Turnover.,53,58,-5,2,0.22919433042084017,Louisiana Tech,LSU,5,4,0,0,NA,400912540,2016-11-11,
255,4,8:20,500,500,Ayana Mitchell Steal.,53,58,-5,8,0.22884189478933045,Louisiana Tech,LSU,5,4,0,0,NA,400912540,2016-11-11,
256,4,8:12,492,492,Shanice Norton made Jumper. Assisted by Raigyne Moncrief.,53,60,-7,2,0.15288650292796582,Louisiana Tech,LSU,5,4,0,0,NA,400912540,2016-11-11,LSU
257,4,8:10,490,490,Louisiana Tech  Timeout,53,60,-7,12,0.15251214025469506,Louisiana Tech,LSU,5,3,0,1,NA,400912540,2016-11-11,
258,4,7:58,478,478,Alexus Malone made Layup. Assisted by Ashley Santos.,55,60,-5,30,0.22477949231419472,Louisiana Tech,LSU,5,3,0,1,NA,400912540,2016-11-11,Louisiana Tech
259,4,7:28,448,448,Raigyne Moncrief missed Three Point Jumper.,55,60,-5,0,0.2177739930360457,Louisiana Tech,LSU,5,3,0,1,NA,400912540,2016-11-11,
260,4,7:28,448,448,Raigyne Moncrief Offensive Rebound.,55,60,-5,19,0.2177739930360457,Louisiana Tech,LSU,5,3,0,1,NA,400912540,2016-11-11,
261,4,7:09,429,429,Raigyne Moncrief made Layup.,55,62,-7,0,0.13707576635738958,Louisiana Tech,LSU,5,3,0,0,NA,400912540,2016-11-11,LSU
262,4,7:09,429,429,Foul on Reauna Cleaver.,55,62,-7,0,0.13707576635738958,Louisiana Tech,LSU,5,3,0,0,NA,400912540,2016-11-11,
263,4,7:09,429,429,Raigyne Moncrief missed Free Throw.,55,62,-7,0,0.13707576635738958,Louisiana Tech,LSU,5,3,0,0,NA,400912540,2016-11-11,
264,4,7:09,429,429,Alexus Malone Defensive Rebound.,55,62,-7,26,0.13707576635738958,Louisiana Tech,LSU,5,3,0,0,NA,400912540,2016-11-11,
265,4,6:43,403,403,Ashley Santos missed Three Point Jumper.,55,62,-7,0,0.12899670956517806,Louisiana Tech,LSU,5,3,0,0,NA,400912540,2016-11-11,
266,4,6:43,403,403,Raigyne Moncrief Defensive Rebound.,55,62,-7,25,0.12899670956517806,Louisiana Tech,LSU,5,3,0,0,NA,400912540,2016-11-11,
267,4,6:18,378,378,Raigyne Moncrief missed Layup.,55,62,-7,0,0.12193690773634548,Louisiana Tech,LSU,5,3,0,0,NA,400912540,2016-11-11,
268,4,6:18,378,378,Alexus Malone Block.,55,62,-7,2,0.12193690773634548,Louisiana Tech,LSU,5,3,0,0,NA,400912540,2016-11-11,
269,4,6:16,376,376,Daria McCutcheon Defensive Rebound.,55,62,-7,3,0.12136446869145687,Louisiana Tech,LSU,5,3,0,0,NA,400912540,2016-11-11,
270,4,6:13,373,373,Shlonte Allen made Layup. Assisted by Alexus Malone.,57,62,-5,29,0.1946930579130556,Louisiana Tech,LSU,5,3,0,0,NA,400912540,2016-11-11,Louisiana Tech
271,4,5:44,344,344,Ayana Mitchell made Layup. Assisted by Raigyne Moncrief.,57,64,-7,22,0.111347920037317,Louisiana Tech,LSU,5,3,0,0,NA,400912540,2016-11-11,LSU
272,4,5:22,322,322,Jasmine LeBlanc missed Jumper.,57,64,-7,0,0.10296365245304637,Louisiana Tech,LSU,5,3,0,0,NA,400912540,2016-11-11,
273,4,5:22,322,322,Alexus Malone Offensive Rebound.,57,64,-7,5,0.10296365245304637,Louisiana Tech,LSU,5,3,0,0,NA,400912540,2016-11-11,
274,4,5:17,317,317,Ashley Santos missed Jumper.,57,64,-7,0,0.10083955624822988,Louisiana Tech,LSU,5,3,0,0,NA,400912540,2016-11-11,
275,4,5:17,317,317,Jasmine LeBlanc Offensive Rebound.,57,64,-7,5,0.10083955624822988,Louisiana Tech,LSU,5,3,0,0,NA,400912540,2016-11-11,
276,4,5:12,312,312,Jasmine LeBlanc made Layup.,59,64,-5,24,0.17074027070237607,Louisiana Tech,LSU,5,3,0,0,NA,400912540,2016-11-11,Louisiana Tech
277,4,4:48,288,288,Raigyne Moncrief made Jumper. Assisted by Shanice Norton.,59,66,-7,20,0.0932980836024161,Louisiana Tech,LSU,5,3,0,0,NA,400912540,2016-11-11,LSU
278,4,4:28,268,268,Foul on Jasmine Rhodes.,59,66,-7,14,0.09543029912368872,Louisiana Tech,LSU,5,3,0,0,NA,400912540,2016-11-11,
279,4,4:14,254,254,Shlonte Allen missed Three Point Jumper.,59,66,-7,0,0.09800141235031437,Louisiana Tech,LSU,5,3,0,0,NA,400912540,2016-11-11,
280,4,4:14,254,254,Chloe Jackson Defensive Rebound.,59,66,-7,19,0.09800141235031437,Louisiana Tech,LSU,5,3,0,0,NA,400912540,2016-11-11,
281,4,3:55,235,235,Jenna Deemer missed Three Point Jumper.,59,66,-7,0,0.09979354939643213,Louisiana Tech,LSU,5,3,0,0,NA,400912540,2016-11-11,
282,4,3:55,235,235,Alexis Hyder Offensive Rebound.,59,66,-7,5,0.09979354939643213,Louisiana Tech,LSU,5,3,0,0,NA,400912540,2016-11-11,
283,4,3:50,230,230,Alexis Hyder made Layup.,59,68,-9,19,0.0556029121035845,Louisiana Tech,LSU,5,3,0,0,NA,400912540,2016-11-11,LSU
284,4,3:31,211,211,Foul on Jasmine LeBlanc.,59,68,-9,0,0.05125736555041251,Louisiana Tech,LSU,5,3,0,0,NA,400912540,2016-11-11,
285,4,3:31,211,211,Jasmine LeBlanc Turnover.,59,68,-9,15,0.05125736555041251,Louisiana Tech,LSU,5,3,0,0,NA,400912540,2016-11-11,
286,4,3:16,196,196,Raigyne Moncrief missed Jumper.,59,68,-9,0,0.043472807482444774,Louisiana Tech,LSU,5,3,0,0,NA,400912540,2016-11-11,
287,4,3:16,196,196,Kierra Anthony Defensive Rebound.,59,68,-9,7,0.043472807482444774,Louisiana Tech,LSU,5,3,0,0,NA,400912540,2016-11-11,
288,4,3:09,189,189,Foul on Jenna Deemer.,59,68,-9,0,0.03871766008701885,Louisiana Tech,LSU,5,3,0,0,NA,400912540,2016-11-11,
289,4,3:09,189,189,Jasmine LeBlanc made Free Throw.,60,68,-8,0,0.05441898332143622,Louisiana Tech,LSU,5,3,0,0,NA,400912540,2016-11-11,Louisiana Tech
290,4,3:09,189,189,Jasmine LeBlanc missed Free Throw.,60,68,-8,0,0.05441898332143622,Louisiana Tech,LSU,5,3,0,0,NA,400912540,2016-11-11,
291,4,3:09,189,189,Jasmine Rhodes Defensive Rebound.,60,68,-8,8,0.05441898332143622,Louisiana Tech,LSU,5,3,0,0,NA,400912540,2016-11-11,
292,4,3:01,181,181,Jenna Deemer missed Three Point Jumper.,60,68,-8,0,0.04791911059245242,Louisiana Tech,LSU,5,3,0,0,NA,400912540,2016-11-11,
293,4,3:01,181,181,Alexus Malone Defensive Rebound.,60,68,-8,9,0.04791911059245242,Louisiana Tech,LSU,5,3,0,0,NA,400912540,2016-11-11,
294,4,2:52,172,172,Kierra Anthony made Jumper. Assisted by Alexus Malone.,62,68,-6,13,0.08647491599770571,Louisiana Tech,LSU,5,3,0,0,NA,400912540,2016-11-11,Louisiana Tech
295,4,2:39,159,159,LSU  Timeout,62,68,-6,1,0.07354866318702455,Louisiana Tech,LSU,4,3,1,0,NA,400912540,2016-11-11,
296,4,2:38,158,158,Alexis Hyder missed Jumper.,62,68,-6,0,0.07259124931629668,Louisiana Tech,LSU,4,3,1,0,NA,400912540,2016-11-11,
297,4,2:38,158,158,Alexus Malone Block.,62,68,-6,3,0.07259124931629668,Louisiana Tech,LSU,4,3,1,0,NA,400912540,2016-11-11,
298,4,2:35,155,155,Jasmine LeBlanc Defensive Rebound.,62,68,-6,24,0.0697475100337427,Louisiana Tech,LSU,4,3,1,0,NA,400912540,2016-11-11,
299,4,2:11,131,131,Ashley Santos Turnover.,62,68,-6,1,0.048467762679700065,Louisiana Tech,LSU,4,3,1,0,NA,400912540,2016-11-11,
300,4,2:10,130,130,Foul on Shlonte Allen.,62,68,-6,16,0.047640028399697054,Louisiana Tech,LSU,4,3,1,0,NA,400912540,2016-11-11,
301,4,1:54,114,114,Alexis Hyder made Layup. Assisted by Chloe Jackson.,62,70,-8,24,0.011938328525156553,Louisiana Tech,LSU,4,3,1,0,NA,400912540,2016-11-11,LSU
302,4,1:30,90,90,Kierra Anthony made Three Point Jumper. Assisted by Shlonte Allen.,65,70,-5,19,0.03733375426475111,Louisiana Tech,LSU,4,3,0,0,NA,400912540,2016-11-11,Louisiana Tech
303,4,1:11,71,71,LSU  Timeout,65,70,-5,11,0.024179148788219133,Louisiana Tech,LSU,3,3,1,0,NA,400912540,2016-11-11,
304,4,1:00,60,60,Alexis Hyder made Layup. Assisted by Jasmine Rhodes.,65,72,-7,9,0.0037687509538199306,Louisiana Tech,LSU,3,3,1,0,NA,400912540,2016-11-11,LSU
305,4,0:51,51,51,Foul on Alexis Hyder.,65,72,-7,2,0.0026728622180475703,Louisiana Tech,LSU,3,3,1,0,NA,400912540,2016-11-11,
306,4,0:49,49,49,Shlonte Allen Turnover.,65,72,-7,0,0.0024702829345435154,Louisiana Tech,LSU,3,3,1,0,NA,400912540,2016-11-11,
307,4,0:49,49,49,Raigyne Moncrief Steal.,65,72,-7,3,0.0024702829345435154,Louisiana Tech,LSU,3,3,1,0,NA,400912540,2016-11-11,
308,4,0:46,46,46,Foul on Kierra Anthony.,65,72,-7,3,0.002190824738038808,Louisiana Tech,LSU,3,3,1,0,NA,400912540,2016-11-11,
309,4,0:43,43,43,Ayana Mitchell made Jumper. Assisted by Jasmine Rhodes.,65,74,-9,13,3.261134433300751e-4,Louisiana Tech,LSU,3,3,1,0,NA,400912540,2016-11-11,LSU
310,4,0:30,30,30,Kierra Anthony made Three Point Jumper. Assisted by Daria McCutcheon.,68,74,-6,3,0.0029348346104883754,Louisiana Tech,LSU,3,3,1,0,NA,400912540,2016-11-11,Louisiana Tech
311,4,0:27,27,27,Louisiana Tech  Timeout,68,74,-6,0,0.002619703084679086,Louisiana Tech,LSU,3,2,1,1,NA,400912540,2016-11-11,
312,4,0:27,27,27,Foul on Jasmine LeBlanc.,68,74,-6,0,0.002619703084679086,Louisiana Tech,LSU,3,2,1,1,NA,400912540,2016-11-11,
313,4,0:27,27,27,Chloe Jackson made Free Throw.,68,75,-7,0,9.746895862391419e-4,Louisiana Tech,LSU,3,2,1,1,NA,400912540,2016-11-11,LSU
314,4,0:27,27,27,Chloe Jackson missed Free Throw.,68,75,-7,0,9.746895862391419e-4,Louisiana Tech,LSU,3,2,1,1,NA,400912540,2016-11-11,
315,4,0:27,27,27,Jasmine LeBlanc Defensive Rebound.,68,75,-7,5,9.746895862391419e-4,Louisiana Tech,LSU,3,2,1,1,NA,400912540,2016-11-11,
316,4,0:22,22,22,Jasmine LeBlanc made Three Point Jumper. Assisted by Kierra Anthony.,71,75,-4,5,0.01646700528889956,Louisiana Tech,LSU,3,2,1,1,NA,400912540,2016-11-11,Louisiana Tech
317,4,0:17,17,17,Foul on Kierra Anthony.,71,75,-4,1,0.014450697851424174,Louisiana Tech,LSU,3,2,1,1,NA,400912540,2016-11-11,
318,4,0:16,16,16,Raigyne Moncrief made Free Throw.,71,76,-5,0,0.004907985272695086,Louisiana Tech,LSU,3,2,1,1,NA,400912540,2016-11-11,LSU
319,4,0:16,16,16,Raigyne Moncrief missed Free Throw.,71,76,-5,0,0.004907985272695086,Louisiana Tech,LSU,3,2,1,1,NA,400912540,2016-11-11,
320,4,0:16,16,16,Chloe Jackson Offensive Rebound.,71,76,-5,2,0.004907985272695086,Louisiana Tech,LSU,3,2,1,1,NA,400912540,2016-11-11,
321,4,0:14,14,14,LSU  Timeout,71,76,-5,0,0.004584635902413504,Louisiana Tech,LSU,2,2,1,1,NA,400912540,2016-11-11,
322,4,0:14,14,14,Foul on Ashley Santos.,71,76,-5,0,0.004584635902413504,Louisiana Tech,LSU,2,2,1,1,NA,400912540,2016-11-11,
323,4,0:14,14,14,Raigyne Moncrief missed Free Throw.,71,76,-5,0,0.004584635902413504,Louisiana Tech,LSU,2,2,1,1,NA,400912540,2016-11-11,
324,4,0:14,14,14,LSU Deadball Team Rebound.,71,76,-5,0,0.004584635902413504,Louisiana Tech,LSU,2,2,1,1,NA,400912540,2016-11-11,
325,4,0:14,14,14,Raigyne Moncrief missed Free Throw.,71,76,-5,0,0.004584635902413504,Louisiana Tech,LSU,2,2,1,1,NA,400912540,2016-11-11,
326,4,0:14,14,14,Louisiana Tech Defensive Rebound.,71,76,-5,6,0.004584635902413504,Louisiana Tech,LSU,2,2,1,1,NA,400912540,2016-11-11,
327,4,0:08,8,8,Chloe Jackson made Free Throw.,71,77,-6,0,0.0012185197287773533,Louisiana Tech,LSU,2,2,1,1,NA,400912540,2016-11-11,LSU
328,4,0:08,8,8,Chloe Jackson missed Free Throw.,71,77,-6,0,0.0012185197287773533,Louisiana Tech,LSU,2,2,1,1,NA,400912540,2016-11-11,
329,4,0:08,8,8,Foul on Ashley Santos.,71,77,-6,0,0.0012185197287773533,Louisiana Tech,LSU,2,2,1,1,NA,400912540,2016-11-11,
330,4,0:08,8,8,LSU Deadball Team Rebound.,71,77,-6,1,0.0012185197287773533,Louisiana Tech,LSU,2,2,1,1,NA,400912540,2016-11-11,
331,4,0:07,7,7,Foul on Raigyne Moncrief.,71,77,-6,2,0.0011675063603289724,Louisiana Tech,LSU,2,2,1,1,NA,400912540,2016-11-11,
332,4,0:05,5,5,Kierra Anthony missed Three Point Jumper.,71,77,-6,0,0.001071181529272076,Louisiana Tech,LSU,2,2,1,1,NA,400912540,2016-11-11,
333,4,0:05,5,5,LSU Defensive Rebound.,71,77,-6,2,0.001071181529272076,Louisiana Tech,LSU,2,2,1,1,NA,400912540,2016-11-11,
334,4,0:03,3,3,Kierra Anthony made Free Throw.,72,77,-5,3,0.003107925506662311,Louisiana Tech,LSU,2,2,1,1,NA,400912540,2016-11-11,Louisiana Tech
335,4,0:00,0,0,Kierra Anthony made Free Throw.,73,77,-4,0,1.8048513878454153e-35,Louisiana Tech,LSU,2,2,1,1,NA,400912540,2016-11-11,Louisiana Tech
336,4,0:00,0,0,End of Game,72,76,-4,0,1.8048513878454153e-35,Louisiana Tech,LSU,2,2,1,1,NA,400912540,2016-11-11,
