play_id,period,time_remaining_period,secs_remaining,secs_remaining_absolute,description,home_score,away_score,score_diff,play_length,win_prob,home,away,home_time_out_remaining,away_time_out_remaining,home_timeout_ind,away_timeout_ind,home_favored_by,game_id,date,whichScored
196,3,3:28,808,808,Carlie Wagner made Layup.,51,47,4,0,0.6816292036850854,Iowa,Minnesota,3,4,0,0,NA,400914394,2017-01-21,Minnesota
197,3,3:28,808,808,Foul on Kathleen Doyle.,51,47,4,0,0.6816292036850854,Iowa,Minnesota,3,4,0,0,NA,400914394,2017-01-21,
198,3,3:28,808,808,Carlie Wagner made Free Throw.,51,48,3,13,0.6389827731758565,Iowa,Minnesota,3,4,0,0,NA,400914394,2017-01-21,Minnesota
199,3,3:15,795,795,Megan Gustafson made Layup.,53,48,5,23,0.7229130577045942,Iowa,Minnesota,3,4,0,0,NA,400914394,2017-01-21,Iowa
200,3,2:52,772,772,Carlie Wagner missed Jumper.,53,48,5,0,0.725817751291559,Iowa,Minnesota,3,4,0,0,NA,400914394,2017-01-21,
201,3,2:52,772,772,Jessie Edwards Offensive Rebound.,53,48,5,2,0.725817751291559,Iowa,Minnesota,3,4,0,0,NA,400914394,2017-01-21,
202,3,2:50,770,770,Jessie Edwards missed Jumper.,53,48,5,0,0.7260900631414965,Iowa,Minnesota,3,4,0,0,NA,400914394,2017-01-21,
203,3,2:50,770,770,Chase Coley Defensive Rebound.,53,48,5,7,0.7260900631414965,Iowa,Minnesota,3,4,0,0,NA,400914394,2017-01-21,
204,3,2:43,763,763,Christina Buttenham missed Three Point Jumper.,53,48,5,0,0.7270704379636768,Iowa,Minnesota,3,4,0,0,NA,400914394,2017-01-21,
205,3,2:43,763,763,Jessie Edwards Defensive Rebound.,53,48,5,10,0.7270704379636768,Iowa,Minnesota,3,4,0,0,NA,400914394,2017-01-21,
206,3,2:33,753,753,Joanna Hedstrom made Three Point Jumper. Assisted by Carlie Wagner.,53,51,2,17,0.5974636545064567,Iowa,Minnesota,3,4,0,0,NA,400914394,2017-01-21,Minnesota
207,3,2:16,736,736,Chase Coley missed Jumper.,53,51,2,0,0.598799747000911,Iowa,Minnesota,3,4,0,0,NA,400914394,2017-01-21,
208,3,2:16,736,736,Megan Gustafson Offensive Rebound.,53,51,2,12,0.598799747000911,Iowa,Minnesota,3,4,0,0,NA,400914394,2017-01-21,
209,3,2:04,724,724,Foul on Gadiva Hubbard.,53,51,2,0,0.5998162650991825,Iowa,Minnesota,3,4,0,0,NA,400914394,2017-01-21,
210,3,2:04,724,724,Megan Gustafson made Free Throw.,54,51,3,0,0.6472674384576349,Iowa,Minnesota,3,4,0,0,NA,400914394,2017-01-21,Iowa
211,3,2:04,724,724,Megan Gustafson made Free Throw.,55,51,4,15,0.6919814646448283,Iowa,Minnesota,3,4,0,0,NA,400914394,2017-01-21,Iowa
212,3,1:49,709,709,Carlie Wagner missed Jumper.,55,51,4,0,0.6940628072250521,Iowa,Minnesota,3,4,0,0,NA,400914394,2017-01-21,
213,3,1:49,709,709,Megan Gustafson Block.,55,51,4,2,0.6940628072250521,Iowa,Minnesota,3,4,0,0,NA,400914394,2017-01-21,
214,3,1:47,707,707,Megan Gustafson Defensive Rebound.,55,51,4,18,0.6943242433081843,Iowa,Minnesota,3,4,0,0,NA,400914394,2017-01-21,
215,3,1:29,689,689,Chase Coley Turnover.,55,51,4,2,0.6965474164549059,Iowa,Minnesota,3,4,0,0,NA,400914394,2017-01-21,
216,3,1:27,687,687,Bryanna Fernstrom Steal.,55,51,4,11,0.696782818099313,Iowa,Minnesota,3,4,0,0,NA,400914394,2017-01-21,
217,3,1:16,676,676,Whitney Tinjum missed Three Point Jumper.,55,51,4,0,0.6980499853434914,Iowa,Minnesota,3,4,0,0,NA,400914394,2017-01-21,
218,3,1:16,676,676,Tania Davis Defensive Rebound.,55,51,4,36,0.6980499853434914,Iowa,Minnesota,3,4,0,0,NA,400914394,2017-01-21,
219,3,0:40,640,640,Tania Davis missed Three Point Jumper.,55,51,4,0,0.7021290422373617,Iowa,Minnesota,3,4,0,0,NA,400914394,2017-01-21,
220,3,0:40,640,640,Minnesota Defensive Rebound.,55,51,4,8,0.7021290422373617,Iowa,Minnesota,3,4,0,0,NA,400914394,2017-01-21,
221,3,0:32,632,632,Carlie Wagner missed Jumper.,55,51,4,0,0.7030808166155911,Iowa,Minnesota,3,4,0,0,NA,400914394,2017-01-21,
222,3,0:32,632,632,Megan Gustafson Defensive Rebound.,55,51,4,6,0.7030808166155911,Iowa,Minnesota,3,4,0,0,NA,400914394,2017-01-21,
223,3,0:26,626,626,Ally Disterhoft made Layup. Assisted by Tania Davis.,57,51,6,12,0.7855520780184362,Iowa,Minnesota,3,4,0,0,NA,400914394,2017-01-21,Iowa
224,3,0:14,614,614,Bryanna Fernstrom Turnover.,57,51,6,0,0.7874302408070558,Iowa,Minnesota,3,4,0,0,NA,400914394,2017-01-21,
225,3,0:14,614,614,Foul on Bryanna Fernstrom.,57,51,6,6,0.7874302408070558,Iowa,Minnesota,3,4,0,0,NA,400914394,2017-01-21,
226,3,0:08,608,608,Christina Buttenham Turnover.,57,51,6,8,0.7884227709134339,Iowa,Minnesota,3,4,0,0,NA,400914394,2017-01-21,
227,3,0:00,600,600,End of 3rd Quarter,57,51,6,25,0.7898113397940275,Iowa,Minnesota,3,4,0,0,NA,400914394,2017-01-21,
228,4,9:35,575,575,Ally Disterhoft made Three Point Jumper. Assisted by Kathleen Doyle.,60,51,9,14,0.8839675214530335,Iowa,Minnesota,4,5,0,0,NA,400914394,2017-01-21,Iowa
229,4,9:21,561,561,Jessie Edwards made Layup. Assisted by Joanna Hedstrom.,60,53,7,13,0.8323647886477832,Iowa,Minnesota,4,5,0,0,NA,400914394,2017-01-21,Minnesota
230,4,9:08,548,548,Chase Coley missed Jumper.,60,53,7,0,0.8357174798071845,Iowa,Minnesota,4,5,0,0,NA,400914394,2017-01-21,
231,4,9:08,548,548,Kenisha Bell Block.,60,53,7,2,0.8357174798071845,Iowa,Minnesota,4,5,0,0,NA,400914394,2017-01-21,
232,4,9:06,546,546,Chase Coley Offensive Rebound.,60,53,7,9,0.8362317699552806,Iowa,Minnesota,4,5,0,0,NA,400914394,2017-01-21,
233,4,8:57,537,537,Foul on Jessie Edwards.,60,53,7,5,0.8383881178768556,Iowa,Minnesota,4,5,0,0,NA,400914394,2017-01-21,
234,4,8:52,532,532,Tania Davis made Three Point Jumper. Assisted by Ally Disterhoft.,63,53,10,17,0.9140000943894752,Iowa,Minnesota,4,5,0,0,NA,400914394,2017-01-21,Iowa
235,4,8:35,515,515,Minnesota  Timeout,63,53,10,2,0.9168071357852234,Iowa,Minnesota,4,4,0,1,NA,400914394,2017-01-21,
236,4,8:33,513,513,Kenisha Bell Turnover.,63,53,10,23,0.9171149246462592,Iowa,Minnesota,4,4,0,1,NA,400914394,2017-01-21,
237,4,8:10,490,490,Megan Gustafson missed Jumper.,63,53,10,0,0.9205648264737829,Iowa,Minnesota,4,4,0,1,NA,400914394,2017-01-21,
238,4,8:10,490,490,Jessie Edwards Defensive Rebound.,63,53,10,15,0.9205648264737829,Iowa,Minnesota,4,4,0,1,NA,400914394,2017-01-21,
239,4,7:55,475,475,Gadiva Hubbard missed Jumper.,63,53,10,0,0.9229400729109368,Iowa,Minnesota,4,4,0,1,NA,400914394,2017-01-21,
240,4,7:55,475,475,Megan Gustafson Defensive Rebound.,63,53,10,23,0.9229400729109368,Iowa,Minnesota,4,4,0,1,NA,400914394,2017-01-21,
241,4,7:32,452,452,Megan Gustafson Turnover.,63,53,10,3,0.9272145598449757,Iowa,Minnesota,4,4,0,0,NA,400914394,2017-01-21,
242,4,7:29,449,449,Carlie Wagner Steal.,63,53,10,9,0.9278505567961186,Iowa,Minnesota,4,4,0,0,NA,400914394,2017-01-21,
243,4,7:20,440,440,Kenisha Bell missed Jumper.,63,53,10,0,0.9298880412736829,Iowa,Minnesota,4,4,0,0,NA,400914394,2017-01-21,
244,4,7:20,440,440,Chase Coley Defensive Rebound.,63,53,10,8,0.9298880412736829,Iowa,Minnesota,4,4,0,0,NA,400914394,2017-01-21,
245,4,7:12,432,432,Tania Davis Turnover.,63,53,10,1,0.9318733500761379,Iowa,Minnesota,4,4,0,0,NA,400914394,2017-01-21,
246,4,7:11,431,431,Kenisha Bell Steal.,63,53,10,4,0.9321335777219608,Iowa,Minnesota,4,4,0,0,NA,400914394,2017-01-21,
247,4,7:07,427,427,Foul on Chase Coley.,63,53,10,0,0.9331760698415493,Iowa,Minnesota,4,4,0,0,NA,400914394,2017-01-21,
248,4,7:07,427,427,Kenisha Bell made Free Throw.,63,54,9,0,0.9147357041262404,Iowa,Minnesota,4,4,0,0,NA,400914394,2017-01-21,Minnesota
249,4,7:07,427,427,Kenisha Bell made Free Throw.,63,55,8,23,0.8917966796144349,Iowa,Minnesota,4,4,0,0,NA,400914394,2017-01-21,Minnesota
250,4,6:44,404,404,Megan Gustafson made Layup. Assisted by Ally Disterhoft.,65,55,10,34,0.9384692870215198,Iowa,Minnesota,4,4,0,0,NA,400914394,2017-01-21,Iowa
251,4,6:10,370,370,Kenisha Bell made Jumper.,65,57,8,8,0.9073047407975813,Iowa,Minnesota,4,4,0,0,NA,400914394,2017-01-21,Minnesota
252,4,6:02,362,362,Ally Disterhoft missed Three Point Jumper.,65,57,8,0,0.9094922558427924,Iowa,Minnesota,4,4,0,0,NA,400914394,2017-01-21,
253,4,6:02,362,362,Minnesota Defensive Rebound.,65,57,8,11,0.9094922558427924,Iowa,Minnesota,4,4,0,0,NA,400914394,2017-01-21,
254,4,5:51,351,351,Kenisha Bell made Layup.,65,59,6,27,0.8532036078641606,Iowa,Minnesota,4,4,0,0,NA,400914394,2017-01-21,Minnesota
255,4,5:24,324,324,Makenzie Meyer made Three Point Jumper. Assisted by Ally Disterhoft.,68,59,9,20,0.9411303147333986,Iowa,Minnesota,4,4,0,0,NA,400914394,2017-01-21,Iowa
256,4,5:04,304,304,Gadiva Hubbard missed Jumper.,68,59,9,0,0.9474054679873075,Iowa,Minnesota,4,4,0,0,NA,400914394,2017-01-21,
257,4,5:04,304,304,Jessie Edwards Offensive Rebound.,68,59,9,0,0.9474054679873075,Iowa,Minnesota,4,4,0,0,NA,400914394,2017-01-21,
258,4,5:04,304,304,Carlie Wagner missed Jumper.,68,59,9,0,0.9474054679873075,Iowa,Minnesota,4,4,0,0,NA,400914394,2017-01-21,
259,4,5:04,304,304,Hannah Stewart Defensive Rebound.,68,59,9,11,0.9474054679873075,Iowa,Minnesota,4,4,0,0,NA,400914394,2017-01-21,
260,4,4:53,293,293,Makenzie Meyer missed Three Point Jumper.,68,59,9,0,0.9488747480638369,Iowa,Minnesota,4,4,0,0,NA,400914394,2017-01-21,
261,4,4:53,293,293,Hannah Stewart Offensive Rebound.,68,59,9,7,0.9488747480638369,Iowa,Minnesota,4,4,0,0,NA,400914394,2017-01-21,
262,4,4:46,286,286,Makenzie Meyer made Layup. Assisted by Kathleen Doyle.,70,59,11,14,0.9726920931059576,Iowa,Minnesota,4,4,0,0,NA,400914394,2017-01-21,Iowa
263,4,4:32,272,272,Gadiva Hubbard missed Three Point Jumper.,70,59,11,0,0.9719836685467307,Iowa,Minnesota,4,4,0,0,NA,400914394,2017-01-21,
264,4,4:32,272,272,Kathleen Doyle Defensive Rebound.,70,59,11,7,0.9719836685467307,Iowa,Minnesota,4,4,0,0,NA,400914394,2017-01-21,
265,4,4:25,265,265,Tania Davis made Layup. Assisted by Kathleen Doyle.,72,59,13,0,0.9847100238103585,Iowa,Minnesota,4,4,1,0,NA,400914394,2017-01-21,Iowa
266,4,4:25,265,265,Foul on Jessie Edwards.,72,59,13,0,0.9847100238103585,Iowa,Minnesota,4,4,1,0,NA,400914394,2017-01-21,
267,4,4:25,265,265,Iowa  Timeout,72,59,13,0,0.9847100238103585,Iowa,Minnesota,3,4,1,0,NA,400914394,2017-01-21,
268,4,4:25,265,265,Tania Davis made Free Throw.,73,59,14,15,0.9888548802679307,Iowa,Minnesota,3,4,1,0,NA,400914394,2017-01-21,Iowa
269,4,4:10,250,250,Kenisha Bell missed Three Point Jumper.,73,59,14,0,0.9881637904336554,Iowa,Minnesota,3,4,1,0,NA,400914394,2017-01-21,
270,4,4:10,250,250,Makenzie Meyer Defensive Rebound.,73,59,14,15,0.9881637904336554,Iowa,Minnesota,3,4,1,0,NA,400914394,2017-01-21,
271,4,3:55,235,235,Bre Cera made Jumper.,75,59,16,18,0.993487354679426,Iowa,Minnesota,3,4,1,0,NA,400914394,2017-01-21,Iowa
272,4,3:37,217,217,Jessie Edwards missed Jumper.,75,59,16,0,0.9940313154760178,Iowa,Minnesota,3,4,1,0,NA,400914394,2017-01-21,
273,4,3:37,217,217,Hannah Stewart Defensive Rebound.,75,59,16,15,0.9940313154760178,Iowa,Minnesota,3,4,1,0,NA,400914394,2017-01-21,
274,4,3:22,202,202,Bre Cera missed Jumper.,75,59,16,0,0.9952695829319546,Iowa,Minnesota,3,4,0,0,NA,400914394,2017-01-21,
275,4,3:22,202,202,Kenisha Bell Defensive Rebound.,75,59,16,7,0.9952695829319546,Iowa,Minnesota,3,4,0,0,NA,400914394,2017-01-21,
276,4,3:15,195,195,Kenisha Bell missed Jumper.,75,59,16,0,0.9960225928212382,Iowa,Minnesota,3,4,0,0,NA,400914394,2017-01-21,
277,4,3:15,195,195,Gadiva Hubbard Offensive Rebound.,75,59,16,5,0.9960225928212382,Iowa,Minnesota,3,4,0,0,NA,400914394,2017-01-21,
278,4,3:10,190,190,Gadiva Hubbard missed Jumper.,75,59,16,0,0.9965873124365756,Iowa,Minnesota,3,4,0,0,NA,400914394,2017-01-21,
279,4,3:10,190,190,Hannah Stewart Block.,75,59,16,2,0.9965873124365756,Iowa,Minnesota,3,4,0,0,NA,400914394,2017-01-21,
280,4,3:08,188,188,Makenzie Meyer Defensive Rebound.,75,59,16,14,0.996806788553794,Iowa,Minnesota,3,4,0,0,NA,400914394,2017-01-21,
281,4,2:54,174,174,Foul on Gadiva Hubbard.,75,59,16,0,0.9980090555913438,Iowa,Minnesota,3,4,0,0,NA,400914394,2017-01-21,
282,4,2:54,174,174,Ally Disterhoft made Free Throw.,76,59,17,0,0.9986492253176684,Iowa,Minnesota,3,4,0,0,NA,400914394,2017-01-21,Iowa
283,4,2:54,174,174,Ally Disterhoft made Free Throw.,77,59,18,17,0.9990837433794659,Iowa,Minnesota,3,4,0,0,NA,400914394,2017-01-21,Iowa
284,4,2:37,157,157,Annalese Lamke missed Jumper.,77,59,18,0,0.9995407056549357,Iowa,Minnesota,3,4,0,0,NA,400914394,2017-01-21,
285,4,2:37,157,157,Kathleen Doyle Defensive Rebound.,77,59,18,23,0.9995407056549357,Iowa,Minnesota,3,4,0,0,NA,400914394,2017-01-21,
286,4,2:14,134,134,Kathleen Doyle Turnover.,77,59,18,1,0.9998449965302825,Iowa,Minnesota,3,4,0,0,NA,400914394,2017-01-21,
287,4,2:13,133,133,Annalese Lamke Steal.,77,59,18,4,0.9998529487678748,Iowa,Minnesota,3,4,0,0,NA,400914394,2017-01-21,
288,4,2:09,129,129,Carlie Wagner made Layup.,77,61,16,7,0.9996765468592799,Iowa,Minnesota,3,4,0,0,NA,400914394,2017-01-21,Minnesota
289,4,2:02,122,122,Foul on Kenisha Bell.,77,61,16,14,0.9997733430650889,Iowa,Minnesota,3,4,0,0,NA,400914394,2017-01-21,
290,4,1:48,108,108,Foul on Jasmine Brunson.,77,61,16,0,0.9998977476589085,Iowa,Minnesota,3,4,0,0,NA,400914394,2017-01-21,
291,4,1:48,108,108,Kathleen Doyle missed Free Throw.,77,61,16,0,0.9998977476589085,Iowa,Minnesota,3,4,0,0,NA,400914394,2017-01-21,
292,4,1:48,108,108,Iowa Deadball Team Rebound.,77,61,16,0,0.9998977476589085,Iowa,Minnesota,3,4,0,0,NA,400914394,2017-01-21,
293,4,1:48,108,108,Kathleen Doyle made Free Throw.,78,61,17,12,0.9999424162405214,Iowa,Minnesota,3,4,0,0,NA,400914394,2017-01-21,Iowa
294,4,1:36,96,96,Gadiva Hubbard made Layup.,78,63,15,13,0.9999130950955321,Iowa,Minnesota,3,4,0,0,NA,400914394,2017-01-21,Minnesota
295,4,1:23,83,83,Iowa  Timeout,78,63,15,12,0.9999637679450813,Iowa,Minnesota,2,4,1,0,NA,400914394,2017-01-21,
296,4,1:11,71,71,Carly Mohns missed Jumper.,78,63,15,0,0.9999847873058157,Iowa,Minnesota,2,4,1,0,NA,400914394,2017-01-21,
297,4,1:11,71,71,Gadiva Hubbard Defensive Rebound.,78,63,15,11,0.9999847873058157,Iowa,Minnesota,2,4,1,0,NA,400914394,2017-01-21,
298,4,1:00,60,60,Foul on Hailey Schneden.,78,63,15,0,0.9999935486810949,Iowa,Minnesota,2,4,1,0,NA,400914394,2017-01-21,
299,4,1:00,60,60,Gadiva Hubbard made Free Throw.,78,64,14,0,0.9999856890539959,Iowa,Minnesota,2,4,1,0,NA,400914394,2017-01-21,Minnesota
300,4,1:00,60,60,Gadiva Hubbard made Free Throw.,78,65,13,18,0.9999682543651169,Iowa,Minnesota,2,4,1,0,NA,400914394,2017-01-21,Minnesota
301,4,0:42,42,42,Hailey Schneden missed Jumper.,78,65,13,0,0.9999914774905424,Iowa,Minnesota,2,4,1,0,NA,400914394,2017-01-21,
302,4,0:42,42,42,Christina Buttenham Offensive Rebound.,78,65,13,0,0.9999914774905424,Iowa,Minnesota,2,4,1,0,NA,400914394,2017-01-21,
303,4,0:42,42,42,Foul on Jasmine Brunson.,78,65,13,0,0.9999914774905424,Iowa,Minnesota,2,4,1,0,NA,400914394,2017-01-21,
304,4,0:42,42,42,Christina Buttenham made Free Throw.,79,65,14,0,0.9999965277289207,Iowa,Minnesota,2,4,1,0,NA,400914394,2017-01-21,Iowa
305,4,0:42,42,42,Christina Buttenham made Free Throw.,80,65,15,18,0.9999985853192154,Iowa,Minnesota,2,4,1,0,NA,400914394,2017-01-21,Iowa
306,4,0:24,24,24,Carlie Wagner missed Three Point Jumper.,80,65,15,0,0.9999997348618122,Iowa,Minnesota,2,4,1,0,NA,400914394,2017-01-21,
307,4,0:24,24,24,Amanda Ollinger Defensive Rebound.,80,65,15,24,0.9999997348618122,Iowa,Minnesota,2,4,1,0,NA,400914394,2017-01-21,
308,4,0:00,0,0,End of Game,80,65,15,0,1,Iowa,Minnesota,2,4,0,0,NA,400914394,2017-01-21,
