play_id,period,time_remaining_period,secs_remaining,secs_remaining_absolute,description,home_score,away_score,score_diff,play_length,win_prob,home,away,home_time_out_remaining,away_time_out_remaining,home_timeout_ind,away_timeout_ind,home_favored_by,game_id,date,whichScored
1,1,9:31,2371,2371,Ashtyn Veerbeek missed Jumper.,0,0,0,3,0.5,Nebraska,Creighton,4,4,0,0,NA,401177305,2019-11-24,NA
2,1,9:28,2368,2368,Jaylyn Agnew Defensive Rebound.,0,0,0,12,0.5,Nebraska,Creighton,4,4,0,0,NA,401177305,2019-11-24,
3,1,9:16,2356,2356,Jaylyn Agnew made Three Point Jumper. Assisted by Gracey Griglione.,0,3,-3,12,0.4327848826321762,Nebraska,Creighton,4,4,0,0,NA,401177305,2019-11-24,Creighton
4,1,9:04,2344,2344,Kate Cain made Jumper. Assisted by Nicea Eliely.,2,3,-1,21,0.47734317800282505,Nebraska,Creighton,4,4,0,0,NA,401177305,2019-11-24,Nebraska
5,1,8:43,2323,2323,Temi Carda made Three Point Jumper. Assisted by Gracey Griglione.,2,6,-4,16,0.40939744742535117,Nebraska,Creighton,4,4,0,0,NA,401177305,2019-11-24,Creighton
6,1,8:27,2307,2307,Kate Cain made Layup. Assisted by Sam Haiby.,4,6,-2,25,0.4539678046865719,Nebraska,Creighton,4,4,0,0,NA,401177305,2019-11-24,Nebraska
7,1,8:02,2282,2282,Jaylyn Agnew made Three Point Jumper. Assisted by Temi Carda.,4,9,-5,1,0.38526885497560553,Nebraska,Creighton,4,4,0,0,NA,401177305,2019-11-24,Creighton
8,1,8:01,2281,2281,Official TV Timeout,4,9,-5,14,0.3852153607054046,Nebraska,Creighton,4,4,0,0,NA,401177305,2019-11-24,
9,1,7:47,2267,2267,Foul on Temi Carda.,4,9,-5,10,0.38446442678649795,Nebraska,Creighton,4,4,0,0,NA,401177305,2019-11-24,
10,1,7:37,2257,2257,Sam Haiby made Layup.,6,9,-3,7,0.42953448804264266,Nebraska,Creighton,4,4,0,0,NA,401177305,2019-11-24,Nebraska
11,1,7:30,2250,2250,Tatum Rembao Turnover.,6,9,-3,0,0.42929951130972055,Nebraska,Creighton,4,4,0,0,NA,401177305,2019-11-24,
12,1,7:30,2250,2250,Sam Haiby Steal.,6,9,-3,7,0.42929951130972055,Nebraska,Creighton,4,4,0,0,NA,401177305,2019-11-24,
13,1,7:23,2243,2243,Hannah Whitish missed Three Point Jumper.,6,9,-3,3,0.4290639993474413,Nebraska,Creighton,4,4,0,0,NA,401177305,2019-11-24,
14,1,7:20,2240,2240,Jaylyn Agnew Defensive Rebound.,6,9,-3,19,0.4289629084724894,Nebraska,Creighton,4,4,0,0,NA,401177305,2019-11-24,
15,1,7:01,2221,2221,Gracey Griglione missed Three Point Jumper.,6,9,-3,3,0.42832063468160925,Nebraska,Creighton,4,4,0,0,NA,401177305,2019-11-24,
16,1,6:58,2218,2218,Ashtyn Veerbeek Defensive Rebound.,6,9,-3,19,0.4282189238051186,Nebraska,Creighton,4,4,0,0,NA,401177305,2019-11-24,
17,1,6:39,2199,2199,Ashtyn Veerbeek Turnover.,6,9,-3,0,0.427573083497328,Nebraska,Creighton,4,4,0,0,NA,401177305,2019-11-24,
18,1,6:39,2199,2199,Olivia Elger Steal.,6,9,-3,18,0.427573083497328,Nebraska,Creighton,4,4,0,0,NA,401177305,2019-11-24,
19,1,6:21,2181,2181,Tatum Rembao missed Three Point Jumper.,6,9,-3,5,0.42695891901770777,Nebraska,Creighton,4,4,0,0,NA,401177305,2019-11-24,
20,1,6:16,2176,2176,Sam Haiby Defensive Rebound.,6,9,-3,5,0.4267879808218812,Nebraska,Creighton,4,4,0,0,NA,401177305,2019-11-24,
21,1,6:11,2171,2171,Sam Haiby missed Layup.,6,9,-3,2,0.42661691434651705,Nebraska,Creighton,4,4,0,0,NA,401177305,2019-11-24,
22,1,6:09,2169,2169,Mykel Parham Defensive Rebound.,6,9,-3,2,0.4265484511850659,Nebraska,Creighton,4,4,0,0,NA,401177305,2019-11-24,
23,1,6:07,2167,2167,Tatum Rembao Turnover.,6,9,-3,0,0.4264799494336897,Nebraska,Creighton,4,4,0,0,NA,401177305,2019-11-24,
24,1,6:07,2167,2167,Nicea Eliely Steal.,6,9,-3,3,0.4264799494336897,Nebraska,Creighton,4,4,0,0,NA,401177305,2019-11-24,
25,1,6:04,2164,2164,Sam Haiby made Layup. Assisted by Nicea Eliely.,8,9,-1,0,0.47529945885834446,Nebraska,Creighton,4,4,0,0,NA,401177305,2019-11-24,Nebraska
26,1,6:04,2164,2164,Foul on Jaylyn Agnew.,8,9,-1,0,0.47529945885834446,Nebraska,Creighton,4,4,0,0,NA,401177305,2019-11-24,
27,1,6:04,2164,2164,Sam Haiby made Free Throw.,9,9,0,15,0.5,Nebraska,Creighton,4,4,0,0,NA,401177305,2019-11-24,Nebraska
28,1,5:49,2149,2149,Jaylyn Agnew missed Jumper.,9,9,0,0,0.5,Nebraska,Creighton,4,4,0,0,NA,401177305,2019-11-24,
29,1,5:49,2149,2149,Kate Cain Block.,9,9,0,2,0.5,Nebraska,Creighton,4,4,0,0,NA,401177305,2019-11-24,
30,1,5:47,2147,2147,Jaylyn Agnew Offensive Rebound.,9,9,0,0,0.5,Nebraska,Creighton,4,4,0,0,NA,401177305,2019-11-24,
31,1,5:47,2147,2147,Foul on Kate Cain.,9,9,0,13,0.5,Nebraska,Creighton,4,4,0,0,NA,401177305,2019-11-24,
32,1,5:34,2134,2134,Payton Brotzki missed Layup.,9,9,0,3,0.5,Nebraska,Creighton,4,4,0,0,NA,401177305,2019-11-24,
33,1,5:31,2131,2131,Mykel Parham Offensive Rebound.,9,9,0,1,0.5,Nebraska,Creighton,4,4,0,0,NA,401177305,2019-11-24,
34,1,5:30,2130,2130,Jaylyn Agnew missed Three Point Jumper.,9,9,0,3,0.5,Nebraska,Creighton,4,4,0,0,NA,401177305,2019-11-24,
35,1,5:27,2127,2127,Olivia Elger Offensive Rebound.,9,9,0,0,0.5,Nebraska,Creighton,4,4,0,0,NA,401177305,2019-11-24,
36,1,5:27,2127,2127,Payton Brotzki Turnover.,9,9,0,22,0.5,Nebraska,Creighton,4,4,0,0,NA,401177305,2019-11-24,
37,1,5:05,2105,2105,Ashtyn Veerbeek made Layup. Assisted by Hannah Whitish.,11,9,2,21,0.5506602182867172,Nebraska,Creighton,4,4,0,0,NA,401177305,2019-11-24,Nebraska
38,1,4:44,2084,2084,Olivia Elger missed Layup.,11,9,2,0,0.5511587272416973,Nebraska,Creighton,4,4,0,0,NA,401177305,2019-11-24,
39,1,4:44,2084,2084,Kate Cain Block.,11,9,2,4,0.5511587272416973,Nebraska,Creighton,4,4,0,0,NA,401177305,2019-11-24,
40,1,4:40,2080,2080,Olivia Elger Offensive Rebound.,11,9,2,1,0.5512541767881072,Nebraska,Creighton,4,4,0,0,NA,401177305,2019-11-24,
41,1,4:39,2079,2079,Payton Brotzki missed Three Point Jumper.,11,9,2,2,0.5512780646738821,Nebraska,Creighton,4,4,0,0,NA,401177305,2019-11-24,
42,1,4:37,2077,2077,Hannah Whitish Defensive Rebound.,11,9,2,10,0.551325871278967,Nebraska,Creighton,4,4,0,0,NA,401177305,2019-11-24,
43,1,4:27,2067,2067,Nicea Eliely missed Jumper.,11,9,2,2,0.5515655296841933,Nebraska,Creighton,4,4,0,0,NA,401177305,2019-11-24,
44,1,4:25,2065,2065,Olivia Elger Defensive Rebound.,11,9,2,7,0.5516135883166307,Nebraska,Creighton,4,4,0,0,NA,401177305,2019-11-24,
45,1,4:18,2058,2058,Jaylyn Agnew made Three Point Jumper. Assisted by Tatum Rembao.,11,12,-1,17,0.47403913442073575,Nebraska,Creighton,4,4,0,0,NA,401177305,2019-11-24,Creighton
46,1,4:01,2041,2041,Foul on Payton Brotzki.,11,12,-1,2,0.4738316583701015,Nebraska,Creighton,4,4,0,0,NA,401177305,2019-11-24,
47,1,3:59,2039,2039,Hannah Whitish missed Three Point Jumper.,11,12,-1,3,0.47380713873167757,Nebraska,Creighton,4,4,0,0,NA,401177305,2019-11-24,
48,1,3:56,2036,2036,Mykel Parham Defensive Rebound.,11,12,-1,11,0.47377031464321007,Nebraska,Creighton,4,4,0,0,NA,401177305,2019-11-24,
49,1,3:45,2025,2025,Carly Bachelor Turnover.,11,12,-1,0,0.473634827780912,Nebraska,Creighton,4,4,0,0,NA,401177305,2019-11-24,
50,1,3:45,2025,2025,Nicea Eliely Steal.,11,12,-1,3,0.473634827780912,Nebraska,Creighton,4,4,0,0,NA,401177305,2019-11-24,
51,1,3:42,2022,2022,Nicea Eliely made Layup.,13,12,1,28,0.5264022520822487,Nebraska,Creighton,4,4,0,0,NA,401177305,2019-11-24,Nebraska
52,1,3:14,1994,1994,Carly Bachelor missed Jumper.,13,12,1,3,0.5267510982190485,Nebraska,Creighton,4,4,0,0,NA,401177305,2019-11-24,
53,1,3:11,1991,1991,Ashtyn Veerbeek Defensive Rebound.,13,12,1,9,0.5267887800720596,Nebraska,Creighton,4,4,0,0,NA,401177305,2019-11-24,
54,1,3:02,1982,1982,Foul on Mykel Parham.,13,12,1,0,0.52690219264,Nebraska,Creighton,4,4,0,0,NA,401177305,2019-11-24,
55,1,3:02,1982,1982,Isabelle Bourne made Free Throw.,14,12,2,0,0.5536490759329797,Nebraska,Creighton,4,4,0,0,NA,401177305,2019-11-24,Nebraska
56,1,3:02,1982,1982,Isabelle Bourne made Free Throw.,15,12,3,17,0.580088906418124,Nebraska,Creighton,4,4,0,0,NA,401177305,2019-11-24,Nebraska
57,1,2:45,1965,1965,Jaylyn Agnew made Layup. Assisted by Temi Carda.,15,14,1,19,0.5271179547560068,Nebraska,Creighton,4,4,0,0,NA,401177305,2019-11-24,Creighton
58,1,2:26,1946,1946,Foul on Jaylyn Agnew.,15,14,1,0,0.5273615685969871,Nebraska,Creighton,4,4,0,0,NA,401177305,2019-11-24,
59,1,2:26,1946,1946,Leigha Brown made Free Throw.,16,14,2,0,0.554559751376137,Nebraska,Creighton,4,4,0,0,NA,401177305,2019-11-24,Nebraska
60,1,2:26,1946,1946,Leigha Brown missed Free Throw.,16,14,2,1,0.554559751376137,Nebraska,Creighton,4,4,0,0,NA,401177305,2019-11-24,
61,1,2:25,1945,1945,Jaylyn Agnew Defensive Rebound.,16,14,2,19,0.5545853127900813,Nebraska,Creighton,4,4,0,0,NA,401177305,2019-11-24,
62,1,2:06,1926,1926,Chloe Dworak missed Layup.,16,14,2,3,0.5550736534985536,Nebraska,Creighton,4,4,0,0,NA,401177305,2019-11-24,
63,1,2:03,1923,1923,Leigha Brown Defensive Rebound.,16,14,2,7,0.555150951152577,Nebraska,Creighton,4,4,0,0,NA,401177305,2019-11-24,
64,1,1:56,1916,1916,Leigha Brown made Layup.,18,14,4,17,0.6093235388069982,Nebraska,Creighton,4,4,0,0,NA,401177305,2019-11-24,Nebraska
65,1,1:39,1899,1899,Temi Carda made Jumper.,18,16,2,19,0.5557682575874999,Nebraska,Creighton,4,4,0,0,NA,401177305,2019-11-24,Creighton
66,1,1:20,1880,1880,Isabelle Bourne missed Layup.,18,16,2,2,0.5562565669528433,Nebraska,Creighton,4,4,0,0,NA,401177305,2019-11-24,
67,1,1:18,1878,1878,Carly Bachelor Defensive Rebound.,18,16,2,15,0.5563079962391981,Nebraska,Creighton,4,4,0,0,NA,401177305,2019-11-24,
68,1,1:03,1863,1863,Temi Carda missed Three Point Jumper.,18,16,2,4,0.5566941227763208,Nebraska,Creighton,4,4,0,0,NA,401177305,2019-11-24,
69,1,0:59,1859,1859,Isabelle Bourne Defensive Rebound.,18,16,2,20,0.5567972519698614,Nebraska,Creighton,4,4,0,0,NA,401177305,2019-11-24,
70,1,0:39,1839,1839,Taylor Kissinger missed Three Point Jumper.,18,16,2,5,0.5573144007142591,Nebraska,Creighton,4,4,0,0,NA,401177305,2019-11-24,
71,1,0:34,1834,1834,Kayla Mershon Offensive Rebound.,18,16,2,0,0.5574441719299004,Nebraska,Creighton,4,4,0,0,NA,401177305,2019-11-24,
72,1,0:34,1834,1834,Kayla Mershon missed Layup.,18,16,2,0,0.5574441719299004,Nebraska,Creighton,4,4,0,0,NA,401177305,2019-11-24,
73,1,0:34,1834,1834,Temi Carda Defensive Rebound.,18,16,2,27,0.5574441719299004,Nebraska,Creighton,4,4,0,0,NA,401177305,2019-11-24,
74,1,0:07,1807,1807,Foul on Isabelle Bourne.,18,16,2,0,0.5581494299785912,Nebraska,Creighton,4,4,0,0,NA,401177305,2019-11-24,
75,1,0:07,1807,1807,Tatum Rembao missed Free Throw.,18,16,2,0,0.5581494299785912,Nebraska,Creighton,4,4,0,0,NA,401177305,2019-11-24,
76,1,0:07,1807,1807,Creighton Offensive Rebound.,18,16,2,0,0.5581494299785912,Nebraska,Creighton,4,4,0,0,NA,401177305,2019-11-24,
77,1,0:07,1807,1807,Tatum Rembao made Free Throw.,18,17,1,2,0.529173697486894,Nebraska,Creighton,4,4,0,0,NA,401177305,2019-11-24,Creighton
78,1,0:05,1805,1805,Taylor Kissinger missed Three Point Jumper.,18,17,1,3,0.529200264196867,Nebraska,Creighton,4,4,0,0,NA,401177305,2019-11-24,
79,1,0:02,1802,1802,Olivia Elger Defensive Rebound.,18,17,1,2,0.5292401673615074,Nebraska,Creighton,4,4,0,0,NA,401177305,2019-11-24,
80,1,0:00,1800,1800,End of 1st Quarter,18,17,1,11,0.5292668057759684,Nebraska,Creighton,4,4,0,0,NA,401177305,2019-11-24,
81,2,9:49,1789,1789,Grace Mitchell missed Jumper.,18,17,1,0,0.5294138657886375,Nebraska,Creighton,4,4,0,0,NA,401177305,2019-11-24,
82,2,9:49,1789,1789,Payton Brotzki Block.,18,17,1,0,0.5294138657886375,Nebraska,Creighton,4,4,0,0,NA,401177305,2019-11-24,
83,2,9:49,1789,1789,Nebraska Offensive Rebound.,18,17,1,2,0.5294138657886375,Nebraska,Creighton,4,4,0,0,NA,401177305,2019-11-24,
84,2,9:47,1787,1787,Kate Cain made Jumper.,20,17,3,28,0.5875139596205512,Nebraska,Creighton,4,4,0,0,NA,401177305,2019-11-24,Nebraska
85,2,9:19,1759,1759,Tatum Rembao Turnover.,20,17,3,18,0.5886214151819169,Nebraska,Creighton,4,4,0,0,NA,401177305,2019-11-24,
86,2,9:01,1741,1741,Foul on Olivia Elger.,20,17,3,0,0.5893454354779577,Nebraska,Creighton,4,4,0,0,NA,401177305,2019-11-24,
87,2,9:01,1741,1741,Leigha Brown made Free Throw.,21,17,4,0,0.6181445365300222,Nebraska,Creighton,4,4,0,0,NA,401177305,2019-11-24,Nebraska
88,2,9:01,1741,1741,Leigha Brown made Free Throw.,22,17,5,16,0.6461366457293268,Nebraska,Creighton,4,4,0,0,NA,401177305,2019-11-24,Nebraska
89,2,8:45,1725,1725,Olivia Elger Turnover.,22,17,5,10,0.6471640445992196,Nebraska,Creighton,4,4,0,0,NA,401177305,2019-11-24,
90,2,8:35,1715,1715,Grace Mitchell missed Three Point Jumper.,22,17,5,4,0.6478133079462229,Nebraska,Creighton,4,4,0,0,NA,401177305,2019-11-24,
91,2,8:31,1711,1711,Payton Brotzki Defensive Rebound.,22,17,5,18,0.6480746456736483,Nebraska,Creighton,4,4,0,0,NA,401177305,2019-11-24,
92,2,8:13,1693,1693,Temi Carda missed Jumper.,22,17,5,0,0.6492629197141043,Nebraska,Creighton,4,4,0,0,NA,401177305,2019-11-24,
93,2,8:13,1693,1693,Kate Cain Block.,22,17,5,2,0.6492629197141043,Nebraska,Creighton,4,4,0,0,NA,401177305,2019-11-24,
94,2,8:11,1691,1691,Grace Mitchell Defensive Rebound.,22,17,5,0,0.649396241622471,Nebraska,Creighton,4,4,0,0,NA,401177305,2019-11-24,
95,2,8:11,1691,1691,Foul on Mykel Parham.,22,17,5,23,0.649396241622471,Nebraska,Creighton,4,4,0,0,NA,401177305,2019-11-24,
96,2,7:48,1668,1668,Sam Haiby missed Three Point Jumper.,22,17,5,3,0.6509069480101296,Nebraska,Creighton,4,4,0,0,NA,401177305,2019-11-24,
97,2,7:45,1665,1665,Payton Brotzki Defensive Rebound.,22,17,5,19,0.6511002903082111,Nebraska,Creighton,4,4,0,0,NA,401177305,2019-11-24,
98,2,7:26,1646,1646,Foul on Hannah Whitish.,22,17,5,15,0.6523088524925122,Nebraska,Creighton,4,4,0,0,NA,401177305,2019-11-24,
99,2,7:11,1631,1631,Foul on Sam Haiby.,22,17,5,11,0.6532475126566645,Nebraska,Creighton,4,4,0,0,NA,401177305,2019-11-24,
100,2,7:00,1620,1620,Gracey Griglione missed Jumper.,22,17,5,2,0.6539298923510367,Nebraska,Creighton,4,4,0,0,NA,401177305,2019-11-24,
101,2,6:58,1618,1618,Ashtyn Veerbeek Defensive Rebound.,22,17,5,9,0.6540535708590453,Nebraska,Creighton,4,4,0,0,NA,401177305,2019-11-24,
102,2,6:49,1609,1609,Kate Cain Turnover.,22,17,5,12,0.6546090913747628,Nebraska,Creighton,4,4,0,0,NA,401177305,2019-11-24,
103,2,6:37,1597,1597,Payton Brotzki missed Three Point Jumper.,22,17,5,2,0.65534836188932,Nebraska,Creighton,4,4,0,0,NA,401177305,2019-11-24,
104,2,6:35,1595,1595,Tatum Rembao Offensive Rebound.,22,17,5,2,0.6554715491223534,Nebraska,Creighton,4,4,0,0,NA,401177305,2019-11-24,
105,2,6:33,1593,1593,Jaylyn Agnew missed Three Point Jumper.,22,17,5,7,0.6555947558573074,Nebraska,Creighton,4,4,0,0,NA,401177305,2019-11-24,
106,2,6:26,1586,1586,Kate Cain Defensive Rebound.,22,17,5,17,0.656026276239117,Nebraska,Creighton,4,4,0,0,NA,401177305,2019-11-24,
107,2,6:09,1569,1569,Kate Cain missed Jumper.,22,17,5,2,0.657078363707769,Nebraska,Creighton,4,4,0,0,NA,401177305,2019-11-24,
108,2,6:07,1567,1567,Payton Brotzki Defensive Rebound.,22,17,5,5,0.6572027246539117,Nebraska,Creighton,4,4,0,0,NA,401177305,2019-11-24,
109,2,6:02,1562,1562,Olivia Elger missed Three Point Jumper.,22,17,5,3,0.6575143390056941,Nebraska,Creighton,4,4,0,0,NA,401177305,2019-11-24,
110,2,5:59,1559,1559,Sam Haiby Defensive Rebound.,22,17,5,6,0.6577018449432936,Nebraska,Creighton,4,4,0,0,NA,401177305,2019-11-24,
111,2,5:53,1553,1553,Sam Haiby missed Jumper.,22,17,5,2,0.658078220263089,Nebraska,Creighton,4,4,0,0,NA,401177305,2019-11-24,
112,2,5:51,1551,1551,Nicea Eliely Offensive Rebound.,22,17,5,3,0.6582041185919089,Nebraska,Creighton,4,4,0,0,NA,401177305,2019-11-24,
113,2,5:48,1548,1548,Ashtyn Veerbeek missed Jumper.,22,17,5,2,0.6583934120977166,Nebraska,Creighton,4,4,0,0,NA,401177305,2019-11-24,
114,2,5:46,1546,1546,Payton Brotzki Defensive Rebound.,22,17,5,0,0.6585199193539275,Nebraska,Creighton,4,4,0,0,NA,401177305,2019-11-24,
115,2,5:46,1546,1546,Foul on Ashtyn Veerbeek.,22,17,5,18,0.6585199193539275,Nebraska,Creighton,4,4,0,0,NA,401177305,2019-11-24,
116,2,5:28,1528,1528,Temi Carda made Three Point Jumper. Assisted by Carly Bachelor.,22,20,2,21,0.5657991774203687,Nebraska,Creighton,4,4,0,0,NA,401177305,2019-11-24,Creighton
117,2,5:07,1507,1507,Leigha Brown missed Jumper.,22,20,2,1,0.5664034965428087,Nebraska,Creighton,4,4,0,0,NA,401177305,2019-11-24,
118,2,5:06,1506,1506,Olivia Elger Defensive Rebound.,22,20,2,0,0.5664328016857153,Nebraska,Creighton,4,4,0,0,NA,401177305,2019-11-24,
119,2,5:06,1506,1506,Foul on Leigha Brown.,22,20,2,13,0.5664328016857153,Nebraska,Creighton,4,4,0,0,NA,401177305,2019-11-24,
120,2,4:53,1493,1493,Chloe Dworak missed Three Point Jumper.,22,20,2,3,0.5668187092109842,Nebraska,Creighton,4,4,0,0,NA,401177305,2019-11-24,
121,2,4:50,1490,1490,Carly Bachelor Offensive Rebound.,22,20,2,12,0.5669091410882443,Nebraska,Creighton,4,4,0,0,NA,401177305,2019-11-24,
122,2,4:38,1478,1478,Olivia Elger Turnover.,22,20,2,0,0.5672764819339084,Nebraska,Creighton,4,4,0,0,NA,401177305,2019-11-24,
123,2,4:38,1478,1478,Official TV Timeout,22,20,2,18,0.5672764819339084,Nebraska,Creighton,4,4,0,0,NA,401177305,2019-11-24,
124,2,4:20,1460,1460,Kate Cain made Jumper. Assisted by Hannah Whitish.,24,20,4,19,0.6332386340408158,Nebraska,Creighton,4,4,0,0,NA,401177305,2019-11-24,Nebraska
125,2,4:01,1441,1441,Carly Bachelor missed Three Point Jumper.,24,20,4,5,0.6344148763743745,Nebraska,Creighton,4,4,0,0,NA,401177305,2019-11-24,
126,2,3:56,1436,1436,Ashtyn Veerbeek Defensive Rebound.,24,20,4,6,0.6347198649195845,Nebraska,Creighton,4,4,0,0,NA,401177305,2019-11-24,
127,2,3:50,1430,1430,Kate Cain missed Jumper.,24,20,4,3,0.6350817452215533,Nebraska,Creighton,4,4,0,0,NA,401177305,2019-11-24,
128,2,3:47,1427,1427,Jaylyn Agnew Defensive Rebound.,24,20,4,18,0.6352611220582262,Nebraska,Creighton,4,4,0,0,NA,401177305,2019-11-24,
129,2,3:29,1409,1409,Jaylyn Agnew missed Three Point Jumper.,24,20,4,2,0.6363186320568165,Nebraska,Creighton,4,4,0,0,NA,401177305,2019-11-24,
130,2,3:27,1407,1407,Ashtyn Veerbeek Defensive Rebound.,24,20,4,12,0.6364344309856538,Nebraska,Creighton,4,4,0,0,NA,401177305,2019-11-24,
131,2,3:15,1395,1395,Kate Cain made Jumper. Assisted by Hannah Whitish.,26,20,6,17,0.6993811863096666,Nebraska,Creighton,4,4,0,0,NA,401177305,2019-11-24,Nebraska
132,2,2:58,1378,1378,Olivia Elger made Layup.,26,22,4,10,0.638088715639786,Nebraska,Creighton,4,4,0,0,NA,401177305,2019-11-24,Creighton
133,2,2:48,1368,1368,Ashtyn Veerbeek missed Three Point Jumper.,26,22,4,2,0.6386532651959881,Nebraska,Creighton,4,4,0,0,NA,401177305,2019-11-24,
134,2,2:46,1366,1366,Creighton Defensive Rebound.,26,22,4,11,0.6387661109601975,Nebraska,Creighton,4,4,0,0,NA,401177305,2019-11-24,
135,2,2:35,1355,1355,Jaylyn Agnew made Three Point Jumper.,26,25,1,8,0.5357331137677486,Nebraska,Creighton,4,4,0,0,NA,401177305,2019-11-24,Creighton
136,2,2:27,1347,1347,Hannah Whitish made Jumper.,28,25,3,12,0.6061136236669771,Nebraska,Creighton,4,4,0,0,NA,401177305,2019-11-24,Nebraska
137,2,2:15,1335,1335,Foul on Kayla Mershon.,28,25,3,0,0.6066459236719226,Nebraska,Creighton,4,4,0,0,NA,401177305,2019-11-24,
138,2,2:15,1335,1335,Olivia Elger made Free Throw.,28,26,2,0,0.5717080631534686,Nebraska,Creighton,4,4,0,0,NA,401177305,2019-11-24,Creighton
139,2,2:15,1335,1335,Olivia Elger made Free Throw.,28,27,1,17,0.5360403154048287,Nebraska,Creighton,4,4,0,0,NA,401177305,2019-11-24,Creighton
140,2,1:58,1318,1318,Isabelle Bourne made Three Point Jumper. Assisted by Hannah Whitish.,31,27,4,27,0.6415114165236879,Nebraska,Creighton,4,4,0,0,NA,401177305,2019-11-24,Nebraska
141,2,1:31,1291,1291,Olivia Elger missed Layup.,31,27,4,2,0.6431335997642977,Nebraska,Creighton,4,4,0,0,NA,401177305,2019-11-24,
142,2,1:29,1289,1289,Mykel Parham Offensive Rebound.,31,27,4,2,0.6432573242369848,Nebraska,Creighton,4,4,0,0,NA,401177305,2019-11-24,
143,2,1:27,1287,1287,Jaylyn Agnew made Three Point Jumper. Assisted by Mykel Parham.,31,30,1,5,0.5368127514661409,Nebraska,Creighton,4,4,0,0,NA,401177305,2019-11-24,Creighton
144,2,1:22,1282,1282,Foul on Taylor Kissinger.,31,30,1,0,0.5368976439240658,Nebraska,Creighton,4,4,0,0,NA,401177305,2019-11-24,
145,2,1:22,1282,1282,Taylor Kissinger Turnover.,31,30,1,6,0.5368976439240658,Nebraska,Creighton,4,4,0,0,NA,401177305,2019-11-24,
146,2,1:16,1276,1276,Temi Carda missed Three Point Jumper.,31,30,1,3,0.537000935470091,Nebraska,Creighton,4,4,0,0,NA,401177305,2019-11-24,
147,2,1:13,1273,1273,Sam Haiby Defensive Rebound.,31,30,1,4,0.5370531931747506,Nebraska,Creighton,4,4,0,0,NA,401177305,2019-11-24,
148,2,1:09,1269,1269,Taylor Kissinger missed Three Point Jumper.,31,30,1,3,0.5371235343452395,Nebraska,Creighton,4,4,0,0,NA,401177305,2019-11-24,
149,2,1:06,1266,1266,Temi Carda Defensive Rebound.,31,30,1,11,0.5371768054917166,Nebraska,Creighton,4,4,0,0,NA,401177305,2019-11-24,
150,2,0:55,1255,1255,Tatum Rembao missed Three Point Jumper.,31,30,1,2,0.5373761372922001,Nebraska,Creighton,4,4,0,0,NA,401177305,2019-11-24,
151,2,0:53,1253,1253,Isabelle Bourne Defensive Rebound.,31,30,1,6,0.5374130893377504,Nebraska,Creighton,4,4,0,0,NA,401177305,2019-11-24,
152,2,0:47,1247,1247,Foul on Mykel Parham.,31,30,1,0,0.5375253302688362,Nebraska,Creighton,4,4,0,0,NA,401177305,2019-11-24,
153,2,0:47,1247,1247,Sam Haiby made Free Throw.,32,30,2,1,0.574630297799361,Nebraska,Creighton,4,4,0,0,NA,401177305,2019-11-24,Nebraska
154,2,0:46,1246,1246,Sam Haiby missed Free Throw.,32,30,2,0,0.5746674920233126,Nebraska,Creighton,4,4,0,0,NA,401177305,2019-11-24,
155,2,0:46,1246,1246,Sam Haiby Offensive Rebound.,32,30,2,2,0.5746674920233126,Nebraska,Creighton,4,4,0,0,NA,401177305,2019-11-24,
156,2,0:44,1244,1244,Sam Haiby Turnover.,32,30,2,0,0.5747422362360166,Nebraska,Creighton,4,4,0,0,NA,401177305,2019-11-24,
157,2,0:44,1244,1244,Temi Carda Steal.,32,30,2,17,0.5747422362360166,Nebraska,Creighton,4,4,0,0,NA,401177305,2019-11-24,
158,2,0:27,1227,1227,Temi Carda made Layup.,32,32,0,18,0.5,Nebraska,Creighton,4,4,0,0,NA,401177305,2019-11-24,Creighton
159,2,0:09,1209,1209,Foul on Payton Brotzki.,32,32,0,3,0.5,Nebraska,Creighton,4,4,0,0,NA,401177305,2019-11-24,
160,2,0:06,1206,1206,Kate Cain Turnover.,32,32,0,4,0.5,Nebraska,Creighton,4,4,0,0,NA,401177305,2019-11-24,
161,2,0:02,1202,1202,Tatum Rembao missed Jumper.,32,32,0,0,0.5,Nebraska,Creighton,4,4,0,0,NA,401177305,2019-11-24,
162,2,0:02,1202,1202,Payton Brotzki Offensive Rebound.,32,32,0,2,0.5,Nebraska,Creighton,4,4,0,0,NA,401177305,2019-11-24,
163,2,0:00,1200,1200,End of 2nd Quarter,32,32,0,29,0.5,Nebraska,Creighton,4,4,0,0,NA,401177305,2019-11-24,
164,3,9:31,1171,1171,Temi Carda missed Three Point Jumper.,32,32,0,3,0.5,Nebraska,Creighton,5,5,0,0,NA,401177305,2019-11-24,
165,3,9:28,1168,1168,Sam Haiby Defensive Rebound.,32,32,0,11,0.5,Nebraska,Creighton,5,5,0,0,NA,401177305,2019-11-24,
166,3,9:17,1157,1157,Kate Cain missed Jumper.,32,32,0,3,0.5,Nebraska,Creighton,5,5,0,0,NA,401177305,2019-11-24,
167,3,9:14,1154,1154,Jaylyn Agnew Defensive Rebound.,32,32,0,9,0.5,Nebraska,Creighton,5,5,0,0,NA,401177305,2019-11-24,
168,3,9:05,1145,1145,Tatum Rembao made Three Point Jumper. Assisted by Jaylyn Agnew.,32,35,-3,13,0.3831764646085074,Nebraska,Creighton,5,5,0,0,NA,401177305,2019-11-24,Creighton
169,3,8:52,1132,1132,Foul on Nicea Eliely.,32,35,-3,0,0.38244582280404327,Nebraska,Creighton,5,5,0,0,NA,401177305,2019-11-24,
170,3,8:52,1132,1132,Nicea Eliely Turnover.,32,35,-3,27,0.38244582280404327,Nebraska,Creighton,5,5,0,0,NA,401177305,2019-11-24,
171,3,8:25,1105,1105,Temi Carda made Three Point Jumper. Assisted by Jaylyn Agnew.,32,38,-6,0,0.2746206395842522,Nebraska,Creighton,5,5,0,0,NA,401177305,2019-11-24,Creighton
172,3,8:25,1105,1105,Foul on Hannah Whitish.,32,38,-6,0,0.2746206395842522,Nebraska,Creighton,5,5,0,0,NA,401177305,2019-11-24,
173,3,8:25,1105,1105,Temi Carda missed Free Throw.,32,38,-6,0,0.2746206395842522,Nebraska,Creighton,5,5,0,0,NA,401177305,2019-11-24,
174,3,8:25,1105,1105,Sam Haiby Defensive Rebound.,32,38,-6,10,0.2746206395842522,Nebraska,Creighton,5,5,0,0,NA,401177305,2019-11-24,
175,3,8:15,1095,1095,Foul on Gracey Griglione.,32,38,-6,0,0.2736498486071143,Nebraska,Creighton,5,5,0,0,NA,401177305,2019-11-24,
176,3,8:15,1095,1095,Kate Cain missed Free Throw.,32,38,-6,0,0.2736498486071143,Nebraska,Creighton,5,5,0,0,NA,401177305,2019-11-24,
177,3,8:15,1095,1095,Nebraska Offensive Rebound.,32,38,-6,0,0.2736498486071143,Nebraska,Creighton,5,5,0,0,NA,401177305,2019-11-24,
178,3,8:15,1095,1095,Kate Cain missed Free Throw.,32,38,-6,2,0.2736498486071143,Nebraska,Creighton,5,5,0,0,NA,401177305,2019-11-24,
179,3,8:13,1093,1093,Tatum Rembao Defensive Rebound.,32,38,-6,14,0.2734543510180463,Nebraska,Creighton,5,5,0,0,NA,401177305,2019-11-24,
180,3,7:59,1079,1079,Jaylyn Agnew missed Three Point Jumper.,32,38,-6,0,0.2720703070136569,Nebraska,Creighton,5,5,0,0,NA,401177305,2019-11-24,
181,3,7:59,1079,1079,Nicea Eliely Block.,32,38,-6,3,0.2720703070136569,Nebraska,Creighton,5,5,0,0,NA,401177305,2019-11-24,
182,3,7:56,1076,1076,Kate Cain Defensive Rebound.,32,38,-6,21,0.2717696778476489,Nebraska,Creighton,5,5,0,0,NA,401177305,2019-11-24,
183,3,7:35,1055,1055,Ashtyn Veerbeek made Jumper. Assisted by Sam Haiby.,34,38,-4,21,0.3397556694736423,Nebraska,Creighton,5,5,0,0,NA,401177305,2019-11-24,Nebraska
184,3,7:14,1034,1034,Foul on Ashtyn Veerbeek.,34,38,-4,0,0.338035593656,Nebraska,Creighton,5,5,0,0,NA,401177305,2019-11-24,
185,3,7:14,1034,1034,Olivia Elger made Free Throw.,34,39,-5,0,0.3015188327741644,Nebraska,Creighton,5,5,0,0,NA,401177305,2019-11-24,Creighton
186,3,7:14,1034,1034,Olivia Elger made Free Throw.,34,40,-6,32,0.2673536335073025,Nebraska,Creighton,5,5,0,0,NA,401177305,2019-11-24,Creighton
187,3,6:42,1002,1002,Kate Cain made Jumper. Assisted by Ashtyn Veerbeek.,36,40,-4,11,0.33519934074930735,Nebraska,Creighton,5,5,0,0,NA,401177305,2019-11-24,Nebraska
188,3,6:31,991,991,Gracey Griglione missed Jumper.,36,40,-4,1,0.3341526371624293,Nebraska,Creighton,5,5,0,0,NA,401177305,2019-11-24,
189,3,6:30,990,990,Olivia Elger Offensive Rebound.,36,40,-4,9,0.3340554601971194,Nebraska,Creighton,5,5,0,0,NA,401177305,2019-11-24,
190,3,6:21,981,981,Foul on Kate Cain.,36,40,-4,0,0.33316498699790054,Nebraska,Creighton,5,5,0,0,NA,401177305,2019-11-24,
191,3,6:21,981,981,Olivia Elger made Free Throw.,36,41,-5,0,0.2957995444399577,Nebraska,Creighton,5,5,0,0,NA,401177305,2019-11-24,Creighton
192,3,6:21,981,981,Olivia Elger made Free Throw.,36,42,-6,15,0.2609846204061824,Nebraska,Creighton,5,5,0,0,NA,401177305,2019-11-24,Creighton
