play_id,period,time_remaining_period,secs_remaining,secs_remaining_absolute,description,home_score,away_score,score_diff,play_length,win_prob,home,away,home_time_out_remaining,away_time_out_remaining,home_timeout_ind,away_timeout_ind,home_favored_by,game_id,date,whichScored
186,3,8:56,1136,1136,Alanna Smith missed Free Throw.,30,28,2,0,0.579036349667416,San Francisco,Stanford,5,5,0,0,NA,400994381,2017-11-29,
187,3,8:56,1136,1136,Kaylee Johnson Offensive Rebound.,30,28,2,0,0.579036349667416,San Francisco,Stanford,5,5,0,0,NA,400994381,2017-11-29,
188,3,8:56,1136,1136,Kaylee Johnson made Layup.,30,30,0,26,0.5,San Francisco,Stanford,5,5,0,0,NA,400994381,2017-11-29,Stanford
189,3,8:30,1110,1110,San Francisco  Timeout,30,30,0,4,0.5,San Francisco,Stanford,4,5,1,0,NA,400994381,2017-11-29,
190,3,8:26,1106,1106,Michaela Rakova made Layup. Assisted by Anna Seilund.,32,30,2,17,0.5802029348486691,San Francisco,Stanford,4,5,1,0,NA,400994381,2017-11-29,San Francisco
191,3,8:09,1089,1089,Foul on Michaela Rakova.,32,30,2,5,0.5808785792082427,San Francisco,Stanford,4,5,1,0,NA,400994381,2017-11-29,
192,3,8:04,1084,1084,Kiana Williams made Three Point Jumper.,32,33,-1,12,0.4591896380002988,San Francisco,Stanford,4,5,1,0,NA,400994381,2017-11-29,Stanford
193,3,7:52,1072,1072,Anna Seilund missed Jumper.,32,33,-1,0,0.45893845488203483,San Francisco,Stanford,4,5,1,0,NA,400994381,2017-11-29,
194,3,7:52,1072,1072,Kaylee Johnson Defensive Rebound.,32,33,-1,5,0.45893845488203483,San Francisco,Stanford,4,5,1,0,NA,400994381,2017-11-29,
195,3,7:47,1067,1067,Marta Sniezek made Layup.,32,35,-3,19,0.3786840529510994,San Francisco,Stanford,4,5,1,0,NA,400994381,2017-11-29,Stanford
196,3,7:28,1048,1048,Foul on DiJonai Carrington.,32,35,-3,0,0.3775008421932302,San Francisco,Stanford,4,5,0,0,NA,400994381,2017-11-29,
197,3,7:28,1048,1048,Kalyn Simon made Free Throw.,33,35,-2,0,0.4174023181404662,San Francisco,Stanford,4,5,0,0,NA,400994381,2017-11-29,San Francisco
198,3,7:28,1048,1048,Kalyn Simon made Free Throw.,34,35,-1,16,0.45841549146052324,San Francisco,Stanford,4,5,0,0,NA,400994381,2017-11-29,San Francisco
199,3,7:12,1032,1032,DiJonai Carrington made Three Point Jumper. Assisted by Kaylee Johnson.,34,38,-4,16,0.3378664791475557,San Francisco,Stanford,4,5,0,0,NA,400994381,2017-11-29,Stanford
200,3,6:56,1016,1016,Ninni Salmi made Three Point Jumper. Assisted by Anna Seilund.,37,38,-1,17,0.457661740036354,San Francisco,Stanford,4,5,0,0,NA,400994381,2017-11-29,San Francisco
201,3,6:39,999,999,DiJonai Carrington missed Three Point Jumper.,37,38,-1,0,0.4572282070920055,San Francisco,Stanford,4,5,0,0,NA,400994381,2017-11-29,
202,3,6:39,999,999,Anna Pierce Defensive Rebound.,37,38,-1,7,0.4572282070920055,San Francisco,Stanford,4,5,0,0,NA,400994381,2017-11-29,
203,3,6:32,992,992,Anna Pierce Turnover.,37,38,-1,1,0.4570419578989788,San Francisco,Stanford,4,5,0,0,NA,400994381,2017-11-29,
204,3,6:31,991,991,Kiana Williams Steal.,37,38,-1,3,0.4570149600011894,San Francisco,Stanford,4,5,0,0,NA,400994381,2017-11-29,
205,3,6:28,988,988,Kiana Williams missed Layup.,37,38,-1,0,0.45693336515365407,San Francisco,Stanford,4,5,0,0,NA,400994381,2017-11-29,
206,3,6:28,988,988,Anna Pierce Block.,37,38,-1,1,0.45693336515365407,San Francisco,Stanford,4,5,0,0,NA,400994381,2017-11-29,
207,3,6:27,987,987,Marta Sniezek Offensive Rebound.,37,38,-1,1,0.4569059642369863,San Francisco,Stanford,4,5,0,0,NA,400994381,2017-11-29,
208,3,6:26,986,986,Marta Sniezek Turnover.,37,38,-1,17,0.4568784608786237,San Francisco,Stanford,4,5,0,0,NA,400994381,2017-11-29,
209,3,6:09,969,969,Ninni Salmi made Three Point Jumper. Assisted by Kalyn Simon.,40,38,2,17,0.5865522692152951,San Francisco,Stanford,4,5,0,0,NA,400994381,2017-11-29,San Francisco
210,3,5:52,952,952,Kiana Williams missed Three Point Jumper.,40,38,2,0,0.5874739850985888,San Francisco,Stanford,4,5,0,0,NA,400994381,2017-11-29,
211,3,5:52,952,952,Marta Sniezek Offensive Rebound.,40,38,2,8,0.5874739850985888,San Francisco,Stanford,4,5,0,0,NA,400994381,2017-11-29,
212,3,5:44,944,944,Alanna Smith missed Jumper.,40,38,2,0,0.5878792073916909,San Francisco,Stanford,4,5,0,0,NA,400994381,2017-11-29,
213,3,5:44,944,944,Anna Seilund Defensive Rebound.,40,38,2,18,0.5878792073916909,San Francisco,Stanford,4,5,0,0,NA,400994381,2017-11-29,
214,3,5:26,926,926,Shannon Powell missed Three Point Jumper.,40,38,2,0,0.5887373560939675,San Francisco,Stanford,4,5,0,0,NA,400994381,2017-11-29,
215,3,5:26,926,926,Alanna Smith Defensive Rebound.,40,38,2,8,0.5887373560939675,San Francisco,Stanford,4,5,0,0,NA,400994381,2017-11-29,
216,3,5:18,918,918,Marta Sniezek made Layup.,40,40,0,0,0.5,San Francisco,Stanford,4,5,0,0,NA,400994381,2017-11-29,Stanford
217,3,5:18,918,918,Foul on Anna Seilund.,40,40,0,0,0.5,San Francisco,Stanford,4,5,0,0,NA,400994381,2017-11-29,
218,3,5:18,918,918,Marta Sniezek made Free Throw.,40,41,-1,15,0.45509083002014566,San Francisco,Stanford,4,5,0,0,NA,400994381,2017-11-29,Stanford
219,3,5:03,903,903,Anna Seilund missed Three Point Jumper.,40,41,-1,0,0.45475451708460474,San Francisco,Stanford,4,5,0,0,NA,400994381,2017-11-29,
220,3,5:03,903,903,Marta Sniezek Defensive Rebound.,40,41,-1,10,0.45475451708460474,San Francisco,Stanford,4,5,0,0,NA,400994381,2017-11-29,
221,3,4:53,893,893,Foul on Bec Black.,40,41,-1,0,0.4545359084420879,San Francisco,Stanford,4,5,0,0,NA,400994381,2017-11-29,
222,3,4:53,893,893,Official TV Timeout,40,41,-1,0,0.4545359084420879,San Francisco,Stanford,4,5,0,0,NA,400994381,2017-11-29,
223,3,4:53,893,893,Alanna Smith made Free Throw.,40,42,-2,0,0.4098174403787906,San Francisco,Stanford,4,5,0,0,NA,400994381,2017-11-29,Stanford
224,3,4:53,893,893,Alanna Smith missed Free Throw.,40,42,-2,0,0.4098174403787906,San Francisco,Stanford,4,5,0,0,NA,400994381,2017-11-29,
225,3,4:53,893,893,Moa Lundqvist Defensive Rebound.,40,42,-2,18,0.4098174403787906,San Francisco,Stanford,4,5,0,0,NA,400994381,2017-11-29,
226,3,4:35,875,875,Bec Black missed Three Point Jumper.,40,42,-2,0,0.4090578488735066,San Francisco,Stanford,4,5,0,0,NA,400994381,2017-11-29,
227,3,4:35,875,875,DiJonai Carrington Defensive Rebound.,40,42,-2,9,0.4090578488735066,San Francisco,Stanford,4,5,0,0,NA,400994381,2017-11-29,
228,3,4:26,866,866,Marta Sniezek missed Three Point Jumper.,40,42,-2,0,0.4086762016868992,San Francisco,Stanford,4,5,0,0,NA,400994381,2017-11-29,
229,3,4:26,866,866,Alanna Smith Offensive Rebound.,40,42,-2,18,0.4086762016868992,San Francisco,Stanford,4,5,0,0,NA,400994381,2017-11-29,
230,3,4:08,848,848,Kiana Williams missed Jumper.,40,42,-2,0,0.40789506656782076,San Francisco,Stanford,4,5,0,0,NA,400994381,2017-11-29,
231,3,4:08,848,848,Moa Lundqvist Defensive Rebound.,40,42,-2,7,0.40789506656782076,San Francisco,Stanford,4,5,0,0,NA,400994381,2017-11-29,
232,3,4:01,841,841,Anna Pierce made Jumper.,42,42,0,22,0.5,San Francisco,Stanford,4,5,0,0,NA,400994381,2017-11-29,San Francisco
233,3,3:39,819,819,DiJonai Carrington made Three Point Jumper. Assisted by Alyssa Jerome.,42,45,-3,27,0.3618259181562054,San Francisco,Stanford,4,5,0,0,NA,400994381,2017-11-29,Stanford
234,3,3:12,792,792,Bec Black missed Three Point Jumper.,42,45,-3,0,0.3597512913638978,San Francisco,Stanford,4,5,0,0,NA,400994381,2017-11-29,
235,3,3:12,792,792,Alyssa Jerome Defensive Rebound.,42,45,-3,10,0.3597512913638978,San Francisco,Stanford,4,5,0,0,NA,400994381,2017-11-29,
236,3,3:02,782,782,Kiana Williams made Three Point Jumper. Assisted by Alyssa Jerome.,42,48,-6,10,0.23861175138943314,San Francisco,Stanford,4,5,0,0,NA,400994381,2017-11-29,Stanford
237,3,2:52,772,772,San Francisco  Timeout,42,48,-6,0,0.23717921034388964,San Francisco,Stanford,3,5,1,0,NA,400994381,2017-11-29,
238,3,2:52,772,772,Foul on Alanna Smith.,42,48,-6,0,0.23717921034388964,San Francisco,Stanford,3,5,1,0,NA,400994381,2017-11-29,
239,3,2:52,772,772,Kalyn Simon made Free Throw.,43,48,-5,0,0.27418224870844093,San Francisco,Stanford,3,5,1,0,NA,400994381,2017-11-29,San Francisco
240,3,2:52,772,772,Kalyn Simon made Free Throw.,44,48,-4,8,0.314577549028634,San Francisco,Stanford,3,5,1,0,NA,400994381,2017-11-29,San Francisco
241,3,2:44,764,764,Alexa Romano made Three Point Jumper. Assisted by Marta Sniezek.,44,51,-7,12,0.20250244555927355,San Francisco,Stanford,3,5,1,0,NA,400994381,2017-11-29,Stanford
242,3,2:32,752,752,Anna Pierce Turnover.,44,51,-7,0,0.20048566008143134,San Francisco,Stanford,3,5,1,0,NA,400994381,2017-11-29,
243,3,2:32,752,752,Foul on Moa Lundqvist.,44,51,-7,0,0.20048566008143134,San Francisco,Stanford,3,5,1,0,NA,400994381,2017-11-29,
244,3,2:32,752,752,DiJonai Carrington missed Free Throw.,44,51,-7,0,0.20048566008143134,San Francisco,Stanford,3,5,1,0,NA,400994381,2017-11-29,
245,3,2:32,752,752,Stanford Deadball Team Rebound.,44,51,-7,0,0.20048566008143134,San Francisco,Stanford,3,5,1,0,NA,400994381,2017-11-29,
246,3,2:32,752,752,DiJonai Carrington made Free Throw.,44,52,-8,23,0.17067222404956206,San Francisco,Stanford,3,5,1,0,NA,400994381,2017-11-29,Stanford
247,3,2:09,729,729,Anna Pierce missed Layup.,44,52,-8,0,0.1663412969406867,San Francisco,Stanford,3,5,1,0,NA,400994381,2017-11-29,
248,3,2:09,729,729,Alexa Romano Block.,44,52,-8,1,0.1663412969406867,San Francisco,Stanford,3,5,1,0,NA,400994381,2017-11-29,
249,3,2:08,728,728,San Francisco Offensive Rebound.,44,52,-8,6,0.16614375785108493,San Francisco,Stanford,3,5,1,0,NA,400994381,2017-11-29,
250,3,2:02,722,722,Ninni Salmi missed Three Point Jumper.,44,52,-8,0,0.16499392397846233,San Francisco,Stanford,3,5,1,0,NA,400994381,2017-11-29,
251,3,2:02,722,722,San Francisco Offensive Rebound.,44,52,-8,9,0.16499392397846233,San Francisco,Stanford,3,5,1,0,NA,400994381,2017-11-29,
252,3,1:53,713,713,Foul on Marta Sniezek.,44,52,-8,12,0.16337278310032413,San Francisco,Stanford,3,5,1,0,NA,400994381,2017-11-29,
253,3,1:41,701,701,Anna Seilund made Three Point Jumper. Assisted by Kalyn Simon.,47,52,-5,16,0.26307879416655316,San Francisco,Stanford,3,5,0,0,NA,400994381,2017-11-29,San Francisco
254,3,1:25,685,685,Foul on Ninni Salmi.,47,52,-5,0,0.26087741976786805,San Francisco,Stanford,3,5,0,0,NA,400994381,2017-11-29,
255,3,1:25,685,685,Alanna Smith made Free Throw.,47,53,-6,0,0.22275280741463427,San Francisco,Stanford,3,5,0,0,NA,400994381,2017-11-29,Stanford
256,3,1:25,685,685,Alanna Smith made Free Throw.,47,54,-7,7,0.18877671915894956,San Francisco,Stanford,3,5,0,0,NA,400994381,2017-11-29,Stanford
257,3,1:18,678,678,Moa Lundqvist made Layup. Assisted by Anna Seilund.,49,54,-5,30,0.25995790561811893,San Francisco,Stanford,3,5,0,0,NA,400994381,2017-11-29,San Francisco
258,3,0:48,648,648,Marta Sniezek missed Three Point Jumper.,49,54,-5,0,0.25610713262105644,San Francisco,Stanford,3,5,0,0,NA,400994381,2017-11-29,
259,3,0:48,648,648,San Francisco Defensive Rebound.,49,54,-5,18,0.25610713262105644,San Francisco,Stanford,3,5,0,0,NA,400994381,2017-11-29,
260,3,0:30,630,630,Foul on DiJonai Carrington.,49,54,-5,0,0.2537005980018918,San Francisco,Stanford,3,5,0,0,NA,400994381,2017-11-29,
261,3,0:30,630,630,Moa Lundqvist missed Free Throw.,49,54,-5,0,0.2537005980018918,San Francisco,Stanford,3,5,0,0,NA,400994381,2017-11-29,
262,3,0:30,630,630,San Francisco Deadball Team Rebound.,49,54,-5,0,0.2537005980018918,San Francisco,Stanford,3,5,0,0,NA,400994381,2017-11-29,
263,3,0:30,630,630,Moa Lundqvist missed Free Throw.,49,54,-5,0,0.2537005980018918,San Francisco,Stanford,3,5,0,0,NA,400994381,2017-11-29,
264,3,0:30,630,630,Kiana Williams Defensive Rebound.,49,54,-5,24,0.2537005980018918,San Francisco,Stanford,3,5,0,0,NA,400994381,2017-11-29,
265,3,0:06,606,606,Alexa Romano made Layup.,49,56,-7,6,0.17696258893763522,San Francisco,Stanford,3,5,0,0,NA,400994381,2017-11-29,Stanford
266,3,0:00,600,600,Official TV Timeout,49,56,-7,0,0.17589365087052686,San Francisco,Stanford,3,5,0,0,NA,400994381,2017-11-29,
267,3,0:00,600,600,End of 3rd Quarter,49,56,-7,13,0.17589365087052686,San Francisco,Stanford,3,5,0,0,NA,400994381,2017-11-29,
268,4,9:47,587,587,Kaylee Johnson made Layup.,49,58,-9,14,0.11838456378879646,San Francisco,Stanford,4,6,0,0,NA,400994381,2017-11-29,Stanford
269,4,9:33,573,573,Foul on Alanna Smith.,49,58,-9,0,0.11561992130227926,San Francisco,Stanford,4,6,0,0,NA,400994381,2017-11-29,
270,4,9:33,573,573,Anna Seilund made Free Throw.,50,58,-8,0,0.14081777490869418,San Francisco,Stanford,4,6,0,0,NA,400994381,2017-11-29,San Francisco
271,4,9:33,573,573,Anna Seilund made Free Throw.,51,58,-7,7,0.1704487731653004,San Francisco,Stanford,4,6,0,0,NA,400994381,2017-11-29,San Francisco
272,4,9:26,566,566,Alexa Romano made Three Point Jumper. Assisted by DiJonai Carrington.,51,61,-10,11,0.09304943067890033,San Francisco,Stanford,4,6,0,0,NA,400994381,2017-11-29,Stanford
273,4,9:15,555,555,Michaela Rakova made Layup. Assisted by Anna Seilund.,53,61,-8,29,0.13660011669716482,San Francisco,Stanford,4,6,0,0,NA,400994381,2017-11-29,San Francisco
274,4,8:46,526,526,Kiana Williams made Three Point Jumper. Assisted by Kaylee Johnson.,53,64,-11,14,0.06821387504040534,San Francisco,Stanford,4,6,0,0,NA,400994381,2017-11-29,Stanford
275,4,8:32,512,512,Foul on Kaylee Johnson.,53,64,-11,0,0.06621321537713819,San Francisco,Stanford,4,6,0,0,NA,400994381,2017-11-29,
276,4,8:32,512,512,Michaela Rakova missed Free Throw.,53,64,-11,0,0.06621321537713819,San Francisco,Stanford,4,6,0,0,NA,400994381,2017-11-29,
277,4,8:32,512,512,San Francisco Deadball Team Rebound.,53,64,-11,0,0.06621321537713819,San Francisco,Stanford,4,6,0,0,NA,400994381,2017-11-29,
278,4,8:32,512,512,Michaela Rakova made Free Throw.,54,64,-10,9,0.0827323091915809,San Francisco,Stanford,4,6,0,0,NA,400994381,2017-11-29,San Francisco
279,4,8:23,503,503,Kaylee Johnson Turnover.,54,64,-10,2,0.081380222972439,San Francisco,Stanford,4,6,0,0,NA,400994381,2017-11-29,
280,4,8:21,501,501,Anna Seilund Steal.,54,64,-10,3,0.08108269814395379,San Francisco,Stanford,4,6,0,0,NA,400994381,2017-11-29,
281,4,8:18,498,498,Michaela Rakova made Jumper. Assisted by Anna Seilund.,56,64,-8,29,0.1248824240608268,San Francisco,Stanford,4,6,0,0,NA,400994381,2017-11-29,San Francisco
282,4,7:49,469,469,Kiana Williams missed Three Point Jumper.,56,64,-8,0,0.11941405679873128,San Francisco,Stanford,4,6,0,0,NA,400994381,2017-11-29,
283,4,7:49,469,469,Alyssa Jerome Offensive Rebound.,56,64,-8,5,0.11941405679873128,San Francisco,Stanford,4,6,0,0,NA,400994381,2017-11-29,
284,4,7:44,464,464,Foul on Anna Pierce.,56,64,-8,4,0.1183366156996901,San Francisco,Stanford,4,6,0,0,NA,400994381,2017-11-29,
285,4,7:40,460,460,Alexa Romano made Jumper.,56,66,-10,8,0.07438483751470615,San Francisco,Stanford,4,6,0,0,NA,400994381,2017-11-29,Stanford
286,4,7:32,452,452,Kalyn Simon made Layup. Assisted by Anna Seilund.,58,66,-8,17,0.11550170991593979,San Francisco,Stanford,4,6,0,0,NA,400994381,2017-11-29,San Francisco
287,4,7:15,435,435,DiJonai Carrington missed Three Point Jumper.,58,66,-8,0,0.11075230330803064,San Francisco,Stanford,4,6,0,0,NA,400994381,2017-11-29,
288,4,7:15,435,435,Ninni Salmi Defensive Rebound.,58,66,-8,11,0.11075230330803064,San Francisco,Stanford,4,6,0,0,NA,400994381,2017-11-29,
289,4,7:04,424,424,Anna Seilund Turnover.,58,66,-8,14,0.10726832647286429,San Francisco,Stanford,4,6,0,0,NA,400994381,2017-11-29,
290,4,6:50,410,410,Alanna Smith made Three Point Jumper. Assisted by Alexa Romano.,58,69,-11,10,0.04866786543508057,San Francisco,Stanford,4,6,0,0,NA,400994381,2017-11-29,Stanford
291,4,6:40,400,400,Anna Seilund made Layup.,60,69,-9,14,0.07832157422212169,San Francisco,Stanford,4,6,0,0,NA,400994381,2017-11-29,San Francisco
292,4,6:26,386,386,Alexa Romano missed Three Point Jumper.,60,69,-9,0,0.07506788441723439,San Francisco,Stanford,4,6,0,0,NA,400994381,2017-11-29,
293,4,6:26,386,386,San Francisco Deadball Team Rebound.,60,69,-9,12,0.07506788441723439,San Francisco,Stanford,4,6,0,0,NA,400994381,2017-11-29,
294,4,6:14,374,374,Anna Seilund Turnover.,60,69,-9,11,0.07228373014696615,San Francisco,Stanford,4,6,0,0,NA,400994381,2017-11-29,
295,4,6:03,363,363,Alanna Smith made Three Point Jumper.,60,72,-12,11,0.030587069257452325,San Francisco,Stanford,4,6,0,0,NA,400994381,2017-11-29,Stanford
296,4,5:52,352,352,Shannon Powell missed Jumper.,60,72,-12,0,0.02890772072898622,San Francisco,Stanford,4,6,0,0,NA,400994381,2017-11-29,
297,4,5:52,352,352,Kaylee Johnson Defensive Rebound.,60,72,-12,13,0.02890772072898622,San Francisco,Stanford,4,6,0,0,NA,400994381,2017-11-29,
298,4,5:39,339,339,Alanna Smith Turnover.,60,72,-12,17,0.02681426147209008,San Francisco,Stanford,4,6,0,0,NA,400994381,2017-11-29,
299,4,5:22,322,322,Bec Black missed Jumper.,60,72,-12,0,0.023870563184410186,San Francisco,Stanford,4,6,0,0,NA,400994381,2017-11-29,
300,4,5:22,322,322,Kaylee Johnson Defensive Rebound.,60,72,-12,8,0.023870563184410186,San Francisco,Stanford,4,6,0,0,NA,400994381,2017-11-29,
301,4,5:14,314,314,DiJonai Carrington made Three Point Jumper. Assisted by Marta Sniezek.,60,75,-15,20,0.008839047893343051,San Francisco,Stanford,4,6,0,0,NA,400994381,2017-11-29,Stanford
302,4,4:54,294,294,Anna Pierce Turnover.,60,75,-15,1,0.007643698664979238,San Francisco,Stanford,4,6,0,0,NA,400994381,2017-11-29,
303,4,4:53,293,293,Alexa Romano Steal.,60,75,-15,2,0.00762756026850533,San Francisco,Stanford,4,6,0,0,NA,400994381,2017-11-29,
304,4,4:51,291,291,DiJonai Carrington made Layup. Assisted by Marta Sniezek.,60,77,-17,6,0.003986524109679315,San Francisco,Stanford,4,6,0,0,NA,400994381,2017-11-29,Stanford
305,4,4:45,285,285,San Francisco  Timeout,60,77,-17,0,0.0039869130799586785,San Francisco,Stanford,3,6,1,0,NA,400994381,2017-11-29,
306,4,4:45,285,285,Official TV Timeout,60,77,-17,11,0.0039869130799586785,San Francisco,Stanford,3,6,1,0,NA,400994381,2017-11-29,
307,4,4:34,274,274,Ninni Salmi missed Jumper.,60,77,-17,0,0.00411215223448737,San Francisco,Stanford,3,6,1,0,NA,400994381,2017-11-29,
308,4,4:34,274,274,Kaylee Johnson Block.,60,77,-17,3,0.00411215223448737,San Francisco,Stanford,3,6,1,0,NA,400994381,2017-11-29,
309,4,4:31,271,271,Anna Pierce Offensive Rebound.,60,77,-17,10,0.0041666435463935435,San Francisco,Stanford,3,6,1,0,NA,400994381,2017-11-29,
310,4,4:21,261,261,Anna Pierce missed Jumper.,60,77,-17,0,0.00438216046119229,San Francisco,Stanford,3,6,1,0,NA,400994381,2017-11-29,
311,4,4:21,261,261,Alanna Smith Defensive Rebound.,60,77,-17,18,0.00438216046119229,San Francisco,Stanford,3,6,1,0,NA,400994381,2017-11-29,
312,4,4:03,243,243,DiJonai Carrington missed Three Point Jumper.,60,77,-17,0,0.004726777108005116,San Francisco,Stanford,3,6,1,0,NA,400994381,2017-11-29,
313,4,4:03,243,243,Moa Lundqvist Defensive Rebound.,60,77,-17,3,0.004726777108005116,San Francisco,Stanford,3,6,1,0,NA,400994381,2017-11-29,
314,4,4:00,240,240,Foul on Alanna Smith.,60,77,-17,11,0.004753689235669755,San Francisco,Stanford,3,6,1,0,NA,400994381,2017-11-29,
315,4,3:49,229,229,Foul on Kaylee Johnson.,60,77,-17,0,0.004711572085606675,San Francisco,Stanford,3,6,1,0,NA,400994381,2017-11-29,
316,4,3:49,229,229,Moa Lundqvist missed Free Throw.,60,77,-17,0,0.004711572085606675,San Francisco,Stanford,3,6,1,0,NA,400994381,2017-11-29,
317,4,3:49,229,229,San Francisco Deadball Team Rebound.,60,77,-17,0,0.004711572085606675,San Francisco,Stanford,3,6,1,0,NA,400994381,2017-11-29,
318,4,3:49,229,229,Moa Lundqvist made Free Throw.,61,77,-16,6,0.006444083323599825,San Francisco,Stanford,3,6,1,0,NA,400994381,2017-11-29,San Francisco
319,4,3:43,223,223,Alexa Romano missed Three Point Jumper.,61,77,-16,0,0.006266034913779811,San Francisco,Stanford,3,6,0,0,NA,400994381,2017-11-29,
320,4,3:43,223,223,Moa Lundqvist Defensive Rebound.,61,77,-16,18,0.006266034913779811,San Francisco,Stanford,3,6,0,0,NA,400994381,2017-11-29,
321,4,3:25,205,205,Foul on DiJonai Carrington.,61,77,-16,0,0.00502684604221048,San Francisco,Stanford,3,6,0,0,NA,400994381,2017-11-29,
322,4,3:25,205,205,Kalyn Simon missed Free Throw.,61,77,-16,0,0.00502684604221048,San Francisco,Stanford,3,6,0,0,NA,400994381,2017-11-29,
323,4,3:25,205,205,San Francisco Deadball Team Rebound.,61,77,-16,0,0.00502684604221048,San Francisco,Stanford,3,6,0,0,NA,400994381,2017-11-29,
324,4,3:25,205,205,Kalyn Simon made Free Throw.,62,77,-15,25,0.006981899965433211,San Francisco,Stanford,3,6,0,0,NA,400994381,2017-11-29,San Francisco
325,4,3:00,180,180,Alexa Romano made Three Point Jumper. Assisted by Alanna Smith.,62,80,-18,18,0.0011537428855714705,San Francisco,Stanford,3,6,0,0,NA,400994381,2017-11-29,Stanford
326,4,2:42,162,162,Foul on Michaela Rakova.,62,80,-18,0,5.669085913475088e-4,San Francisco,Stanford,3,6,0,0,NA,400994381,2017-11-29,
327,4,2:42,162,162,Michaela Rakova Turnover.,62,80,-18,11,5.669085913475088e-4,San Francisco,Stanford,3,6,0,0,NA,400994381,2017-11-29,
328,4,2:31,151,151,DiJonai Carrington missed Layup.,62,80,-18,0,3.5307547427309373e-4,San Francisco,Stanford,3,6,0,0,NA,400994381,2017-11-29,
329,4,2:31,151,151,San Francisco Defensive Rebound.,62,80,-18,14,3.5307547427309373e-4,San Francisco,Stanford,3,6,0,0,NA,400994381,2017-11-29,
330,4,2:17,137,137,Ninni Salmi made Three Point Jumper.,65,80,-15,16,7.604786484688705e-4,San Francisco,Stanford,3,6,0,0,NA,400994381,2017-11-29,San Francisco
331,4,2:01,121,121,Foul on Moa Lundqvist.,65,80,-15,3,3.6435176701257846e-4,San Francisco,Stanford,3,6,0,0,NA,400994381,2017-11-29,
332,4,1:58,118,118,Alexa Romano missed Jumper.,65,80,-15,0,3.129205255227357e-4,San Francisco,Stanford,3,6,0,0,NA,400994381,2017-11-29,
333,4,1:58,118,118,Nadia Fingall Offensive Rebound.,65,80,-15,20,3.129205255227357e-4,San Francisco,Stanford,3,6,0,0,NA,400994381,2017-11-29,
334,4,1:38,98,98,Kiana Williams made Jumper.,65,82,-17,10,2.8935085522480387e-5,San Francisco,Stanford,3,6,0,0,NA,400994381,2017-11-29,Stanford
335,4,1:28,88,88,Foul on Maya Dodson.,65,82,-17,0,1.3649263935240546e-5,San Francisco,Stanford,3,6,0,0,NA,400994381,2017-11-29,
336,4,1:28,88,88,Moa Lundqvist made Free Throw.,66,82,-16,0,2.6379915453142924e-5,San Francisco,Stanford,3,6,0,0,NA,400994381,2017-11-29,San Francisco
337,4,1:28,88,88,Moa Lundqvist missed Free Throw.,66,82,-16,0,2.6379915453142924e-5,San Francisco,Stanford,3,6,0,0,NA,400994381,2017-11-29,
338,4,1:28,88,88,Maya Dodson Defensive Rebound.,66,82,-16,6,2.6379915453142924e-5,San Francisco,Stanford,3,6,0,0,NA,400994381,2017-11-29,
339,4,1:22,82,82,Kiana Williams missed Three Point Jumper.,66,82,-16,0,1.7016762906514886e-5,San Francisco,Stanford,3,6,0,0,NA,400994381,2017-11-29,
340,4,1:22,82,82,Nadia Fingall Offensive Rebound.,66,82,-16,6,1.7016762906514886e-5,San Francisco,Stanford,3,6,0,0,NA,400994381,2017-11-29,
341,4,1:16,76,76,Nadia Fingall missed Layup.,66,82,-16,6,1.0794949695033959e-5,San Francisco,Stanford,3,6,0,0,NA,400994381,2017-11-29,
342,4,1:10,70,70,Kiana Williams Offensive Rebound.,66,82,-16,5,6.694460696740673e-6,San Francisco,Stanford,3,6,0,0,NA,400994381,2017-11-29,
343,4,1:05,65,65,Maya Dodson made Layup.,66,84,-18,4,9.498883057161197e-7,San Francisco,Stanford,3,6,0,0,NA,400994381,2017-11-29,Stanford
344,4,1:01,61,61,Bec Black Turnover.,66,84,-18,0,6.504487995170566e-7,San Francisco,Stanford,3,6,0,0,NA,400994381,2017-11-29,
345,4,1:01,61,61,Nadia Fingall Steal.,66,84,-18,2,6.504487995170566e-7,San Francisco,Stanford,3,6,0,0,NA,400994381,2017-11-29,
346,4,0:59,59,59,Maya Dodson made Layup. Assisted by Nadia Fingall.,66,86,-20,34,1.0790403381682637e-7,San Francisco,Stanford,3,6,0,0,NA,400994381,2017-11-29,Stanford
347,4,0:25,25,25,Moa Lundqvist missed Layup.,66,86,-20,0,1.936602923741005e-9,San Francisco,Stanford,3,6,0,0,NA,400994381,2017-11-29,
348,4,0:25,25,25,Kiana Williams Block.,66,86,-20,1,1.936602923741005e-9,San Francisco,Stanford,3,6,0,0,NA,400994381,2017-11-29,
349,4,0:24,24,24,Stanford Defensive Rebound.,66,86,-20,24,1.7033211187696924e-9,San Francisco,Stanford,3,6,0,0,NA,400994381,2017-11-29,
350,4,0:00,0,0,Official TV Timeout,66,86,-20,0,1.9151695967140057e-174,San Francisco,Stanford,3,6,0,0,NA,400994381,2017-11-29,
351,4,0:00,0,0,End of Game,66,86,-20,0,1.9151695967140057e-174,San Francisco,Stanford,3,6,0,0,NA,400994381,2017-11-29,
