play_id,period,time_remaining_period,secs_remaining,secs_remaining_absolute,description,home_score,away_score,score_diff,play_length,win_prob,home,away,home_time_out_remaining,away_time_out_remaining,home_timeout_ind,away_timeout_ind,home_favored_by,game_id,date,whichScored
1,1,9:43,2383,2383,Brenna Chase Drollinger missed Layup.,0,0,0,4,0.5,Saint Mary's,BYU,4,4,0,0,NA,401174098,2020-01-18,NA
2,1,9:39,2379,2379,Madeline Holland Defensive Rebound.,0,0,0,7,0.5,Saint Mary's,BYU,4,4,0,0,NA,401174098,2020-01-18,
3,1,9:32,2372,2372,Madeline Holland made Three Point Jumper. Assisted by Sam Simons.,3,0,3,11,0.5667055204091812,Saint Mary's,BYU,4,4,0,0,NA,401174098,2020-01-18,Saint Mary's
4,1,9:21,2361,2361,Leilani Otuafi missed Three Point Jumper.,3,0,3,4,0.5670553232560631,Saint Mary's,BYU,4,4,0,0,NA,401174098,2020-01-18,
5,1,9:17,2357,2357,Sara Hamson Offensive Rebound.,3,0,3,8,0.5671831196943142,Saint Mary's,BYU,4,4,0,0,NA,401174098,2020-01-18,
6,1,9:09,2349,2349,Brenna Chase Drollinger missed Three Point Jumper.,3,0,3,2,0.5674396361560966,Saint Mary's,BYU,4,4,0,0,NA,401174098,2020-01-18,
7,1,9:07,2347,2347,Babalu Ugwu Offensive Rebound.,3,0,3,8,0.5675039540011753,Saint Mary's,BYU,4,4,0,0,NA,401174098,2020-01-18,
8,1,8:59,2339,2339,Leilani Otuafi missed Layup.,3,0,3,3,0.5677619613590958,Saint Mary's,BYU,4,4,0,0,NA,401174098,2020-01-18,
9,1,8:56,2336,2336,Madeline Holland Defensive Rebound.,3,0,3,7,0.567859012067762,Saint Mary's,BYU,4,4,0,0,NA,401174098,2020-01-18,
10,1,8:49,2329,2329,Brianna Simonich missed Layup.,3,0,3,0,0.5680860791706658,Saint Mary's,BYU,4,4,0,0,NA,401174098,2020-01-18,
11,1,8:49,2329,2329,Sara Hamson Block.,3,0,3,5,0.5680860791706658,Saint Mary's,BYU,4,4,0,0,NA,401174098,2020-01-18,
12,1,8:44,2324,2324,Sam Simons Offensive Rebound.,3,0,3,5,0.5682487856581603,Saint Mary's,BYU,4,4,0,0,NA,401174098,2020-01-18,
13,1,8:39,2319,2319,Sam Simons Turnover.,3,0,3,0,0.568411910727213,Saint Mary's,BYU,4,4,0,0,NA,401174098,2020-01-18,
14,1,8:39,2319,2319,Sara Hamson Steal.,3,0,3,14,0.568411910727213,Saint Mary's,BYU,4,4,0,0,NA,401174098,2020-01-18,
15,1,8:25,2305,2305,Babalu Ugwu missed Jumper.,3,0,3,3,0.5688708039301624,Saint Mary's,BYU,4,4,0,0,NA,401174098,2020-01-18,
16,1,8:22,2302,2302,Taycee Wedin Defensive Rebound.,3,0,3,6,0.5689695343354628,Saint Mary's,BYU,4,4,0,0,NA,401174098,2020-01-18,
17,1,8:16,2296,2296,Sam Simons missed Jumper.,3,0,3,3,0.5691673982971774,Saint Mary's,BYU,4,4,0,0,NA,401174098,2020-01-18,
18,1,8:13,2293,2293,Babalu Ugwu Defensive Rebound.,3,0,3,6,0.569266527603221,Saint Mary's,BYU,4,4,0,0,NA,401174098,2020-01-18,
19,1,8:07,2287,2287,Maria Albiero made Jumper.,3,2,1,13,0.5232889193593527,Saint Mary's,BYU,4,4,0,0,NA,401174098,2020-01-18,BYU
20,1,7:54,2274,2274,Madeline Holland missed Three Point Jumper.,3,2,1,4,0.523435477271786,Saint Mary's,BYU,4,4,0,0,NA,401174098,2020-01-18,
21,1,7:50,2270,2270,Babalu Ugwu Defensive Rebound.,3,2,1,9,0.5234807289117777,Saint Mary's,BYU,4,4,0,0,NA,401174098,2020-01-18,
22,1,7:41,2261,2261,Leilani Otuafi missed Three Point Jumper.,3,2,1,3,0.523582801702291,Saint Mary's,BYU,4,4,0,0,NA,401174098,2020-01-18,
23,1,7:38,2258,2258,Brianna Simonich Defensive Rebound.,3,2,1,12,0.5236169023910233,Saint Mary's,BYU,4,4,0,0,NA,401174098,2020-01-18,
24,1,7:26,2246,2246,Sam Simons missed Layup.,3,2,1,3,0.5237536683071837,Saint Mary's,BYU,4,4,0,0,NA,401174098,2020-01-18,
25,1,7:23,2243,2243,Babalu Ugwu Defensive Rebound.,3,2,1,16,0.5237879470207863,Saint Mary's,BYU,4,4,0,0,NA,401174098,2020-01-18,
26,1,7:07,2227,2227,Maria Albiero missed Layup.,3,2,1,4,0.5239713147776629,Saint Mary's,BYU,4,4,0,0,NA,401174098,2020-01-18,
27,1,7:03,2223,2223,Taycee Wedin Defensive Rebound.,3,2,1,8,0.5240172928383114,Saint Mary's,BYU,4,4,0,0,NA,401174098,2020-01-18,
28,1,6:55,2215,2215,Madeline Holland made Layup. Assisted by Brianna Simonich.,5,2,3,18,0.5718828628036017,Saint Mary's,BYU,4,4,0,0,NA,401174098,2020-01-18,Saint Mary's
29,1,6:37,2197,2197,Babalu Ugwu missed Jumper.,5,2,3,4,0.5724950544895695,Saint Mary's,BYU,4,4,0,0,NA,401174098,2020-01-18,
30,1,6:33,2193,2193,Sam Simons Defensive Rebound.,5,2,3,5,0.5726314110978687,Saint Mary's,BYU,4,4,0,0,NA,401174098,2020-01-18,
31,1,6:28,2188,2188,Taycee Wedin made Three Point Jumper. Assisted by Tyra Moe.,8,2,6,19,0.6425812066560147,Saint Mary's,BYU,4,4,0,0,NA,401174098,2020-01-18,Saint Mary's
32,1,6:09,2169,2169,Babalu Ugwu missed Three Point Jumper.,8,2,6,2,0.6437998226673888,Saint Mary's,BYU,4,4,0,0,NA,401174098,2020-01-18,
33,1,6:07,2167,2167,Madeline Holland Defensive Rebound.,8,2,6,4,0.6439282582920025,Saint Mary's,BYU,4,4,0,0,NA,401174098,2020-01-18,
34,1,6:03,2163,2163,Taycee Wedin made Three Point Jumper. Assisted by Madeline Holland.,11,2,9,5,0.7089654107492859,Saint Mary's,BYU,4,4,0,0,NA,401174098,2020-01-18,Saint Mary's
35,1,5:58,2158,2158,Official TV Timeout,11,2,9,0,0.70939967897369,Saint Mary's,BYU,4,4,1,0,NA,401174098,2020-01-18,
36,1,5:58,2158,2158,BYU  Timeout,11,2,9,18,0.70939967897369,Saint Mary's,BYU,3,4,1,0,NA,401174098,2020-01-18,
37,1,5:40,2140,2140,Maria Albiero missed Three Point Jumper.,11,2,9,2,0.7109660395429018,Saint Mary's,BYU,3,4,1,0,NA,401174098,2020-01-18,
38,1,5:38,2138,2138,Brianna Simonich Defensive Rebound.,11,2,9,10,0.7111403868416522,Saint Mary's,BYU,3,4,1,0,NA,401174098,2020-01-18,
39,1,5:28,2128,2128,Madeline Holland Turnover.,11,2,9,0,0.7120131088388882,Saint Mary's,BYU,3,4,1,0,NA,401174098,2020-01-18,
40,1,5:28,2128,2128,Maria Albiero Steal.,11,2,9,9,0.7120131088388882,Saint Mary's,BYU,3,4,1,0,NA,401174098,2020-01-18,
41,1,5:19,2119,2119,Foul on Claire Ferguson.,11,2,9,0,0.7128000260260877,Saint Mary's,BYU,3,4,1,0,NA,401174098,2020-01-18,
42,1,5:19,2119,2119,Jasmine Moody made Free Throw.,11,3,8,0,0.6916873545983454,Saint Mary's,BYU,3,4,1,0,NA,401174098,2020-01-18,BYU
43,1,5:19,2119,2119,Jasmine Moody missed Free Throw.,11,3,8,0,0.6916873545983454,Saint Mary's,BYU,3,4,1,0,NA,401174098,2020-01-18,
44,1,5:19,2119,2119,Brianna Simonich Defensive Rebound.,11,3,8,10,0.6916873545983454,Saint Mary's,BYU,3,4,1,0,NA,401174098,2020-01-18,
45,1,5:09,2109,2109,Madeline Holland missed Layup.,11,3,8,4,0.6924987241868642,Saint Mary's,BYU,3,4,1,0,NA,401174098,2020-01-18,
46,1,5:05,2105,2105,Brenna Chase Drollinger Defensive Rebound.,11,3,8,5,0.6928238468991776,Saint Mary's,BYU,3,4,1,0,NA,401174098,2020-01-18,
47,1,5:00,2100,2100,Kaylee Smiler made Three Point Jumper. Assisted by Brenna Chase Drollinger.,11,6,5,20,0.6246990685759959,Saint Mary's,BYU,3,4,1,0,NA,401174098,2020-01-18,BYU
48,1,4:40,2080,2080,Madeline Holland made Layup. Assisted by Brianna Simonich.,13,6,7,26,0.6726263510029253,Saint Mary's,BYU,3,4,0,0,NA,401174098,2020-01-18,Saint Mary's
49,1,4:14,2054,2054,Madeline Holland Turnover.,13,6,7,7,0.6745693092275206,Saint Mary's,BYU,3,4,0,0,NA,401174098,2020-01-18,
50,1,4:07,2047,2047,Jasmine Moody missed Jumper.,13,6,7,9,0.6750953845595119,Saint Mary's,BYU,3,4,0,0,NA,401174098,2020-01-18,
51,1,3:58,2038,2038,Saint Mary's Defensive Rebound.,13,6,7,1,0.6757737100202507,Saint Mary's,BYU,3,4,0,0,NA,401174098,2020-01-18,
52,1,3:57,2037,2037,Foul on Shalae Salmon.,13,6,7,14,0.6758492169697295,Saint Mary's,BYU,3,4,0,0,NA,401174098,2020-01-18,
53,1,3:43,2023,2023,Madeline Holland missed Three Point Jumper.,13,6,7,3,0.676909275410053,Saint Mary's,BYU,3,4,0,0,NA,401174098,2020-01-18,
54,1,3:40,2020,2020,Shalae Salmon Defensive Rebound.,13,6,7,6,0.6771371634502952,Saint Mary's,BYU,3,4,0,0,NA,401174098,2020-01-18,
55,1,3:34,2014,2014,Brenna Chase Drollinger made Three Point Jumper.,13,9,4,34,0.6045404929413596,Saint Mary's,BYU,3,4,0,0,NA,401174098,2020-01-18,BYU
56,1,3:00,1980,1980,Sam Simons missed Three Point Jumper.,13,9,4,3,0.6061737389347245,Saint Mary's,BYU,3,4,0,0,NA,401174098,2020-01-18,
57,1,2:57,1977,1977,BYU Defensive Rebound.,13,9,4,12,0.6063191827530989,Saint Mary's,BYU,3,4,0,0,NA,401174098,2020-01-18,
58,1,2:45,1965,1965,Kaylee Smiler made Layup.,13,11,2,27,0.554076840653077,Saint Mary's,BYU,3,4,0,0,NA,401174098,2020-01-18,BYU
59,1,2:18,1938,1938,Madeline Holland missed Layup.,13,11,2,0,0.5547646572326396,Saint Mary's,BYU,3,4,0,0,NA,401174098,2020-01-18,
60,1,2:18,1938,1938,Brenna Chase Drollinger Block.,13,11,2,0,0.5547646572326396,Saint Mary's,BYU,3,4,0,0,NA,401174098,2020-01-18,
61,1,2:18,1938,1938,Saint Mary's Offensive Rebound.,13,11,2,4,0.5547646572326396,Saint Mary's,BYU,3,4,0,0,NA,401174098,2020-01-18,
62,1,2:14,1934,1934,Madeline Holland missed Three Point Jumper.,13,11,2,3,0.5548674684087587,Saint Mary's,BYU,3,4,0,0,NA,401174098,2020-01-18,
63,1,2:11,1931,1931,Tyra Moe Offensive Rebound.,13,11,2,4,0.5549447352680729,Saint Mary's,BYU,3,4,0,0,NA,401174098,2020-01-18,
64,1,2:07,1927,1927,Sam Simons made Jumper.,15,11,4,11,0.6087772588415313,Saint Mary's,BYU,3,4,0,0,NA,401174098,2020-01-18,Saint Mary's
65,1,1:56,1916,1916,Shalae Salmon missed Layup.,15,11,4,3,0.6093235388069982,Saint Mary's,BYU,3,4,0,0,NA,401174098,2020-01-18,
66,1,1:53,1913,1913,Sam Simons Defensive Rebound.,15,11,4,5,0.6094723378662905,Saint Mary's,BYU,3,4,0,0,NA,401174098,2020-01-18,
67,1,1:48,1908,1908,Claire Ferguson made Layup. Assisted by Madeline Holland.,17,11,6,22,0.6613249759642308,Saint Mary's,BYU,3,4,0,0,NA,401174098,2020-01-18,Saint Mary's
68,1,1:26,1886,1886,Foul on Jasmine Moody.,17,11,6,18,0.6628620604607947,Saint Mary's,BYU,3,4,0,0,NA,401174098,2020-01-18,
69,1,1:08,1868,1868,Claire Ferguson Turnover.,17,11,6,15,0.6641184786207668,Saint Mary's,BYU,3,4,0,0,NA,401174098,2020-01-18,
70,1,0:53,1853,1853,Brenna Chase Drollinger made Three Point Jumper.,17,14,3,16,0.5849681404083931,Saint Mary's,BYU,3,4,0,0,NA,401174098,2020-01-18,BYU
71,1,0:37,1837,1837,Tyra Moe made Three Point Jumper. Assisted by Sam Simons.,20,14,6,12,0.6662871971245371,Saint Mary's,BYU,3,4,0,0,NA,401174098,2020-01-18,Saint Mary's
72,1,0:25,1825,1825,Brenna Chase Drollinger made Three Point Jumper. Assisted by Sara Hamson.,20,17,3,20,0.5860397319207126,Saint Mary's,BYU,3,4,0,0,NA,401174098,2020-01-18,BYU
73,1,0:05,1805,1805,Sam Simons Turnover.,20,17,3,0,0.5868121336014099,Saint Mary's,BYU,3,4,0,0,NA,401174098,2020-01-18,
74,1,0:05,1805,1805,Jasmine Moody Steal.,20,17,3,5,0.5868121336014099,Saint Mary's,BYU,3,4,0,0,NA,401174098,2020-01-18,
75,1,0:00,1800,1800,End of 1st Quarter,20,17,3,27,0.5870063911476985,Saint Mary's,BYU,3,4,0,0,NA,401174098,2020-01-18,
76,2,9:33,1773,1773,Brianna Simonich missed Jumper.,20,17,3,12,0.588065060293665,Saint Mary's,BYU,4,4,0,0,NA,401174098,2020-01-18,
77,2,9:21,1761,1761,Jasmine Moody Defensive Rebound.,20,17,3,1,0.5885415909795322,Saint Mary's,BYU,4,4,0,0,NA,401174098,2020-01-18,
78,2,9:20,1760,1760,Kaylee Smiler made Three Point Jumper.,20,20,0,9,0.5,Saint Mary's,BYU,4,4,0,0,NA,401174098,2020-01-18,BYU
79,2,9:11,1751,1751,Taycee Wedin missed Three Point Jumper.,20,20,0,5,0.5,Saint Mary's,BYU,4,4,0,0,NA,401174098,2020-01-18,
80,2,9:06,1746,1746,Brianna Simonich Offensive Rebound.,20,20,0,3,0.5,Saint Mary's,BYU,4,4,0,0,NA,401174098,2020-01-18,
81,2,9:03,1743,1743,Sam Simons made Three Point Jumper. Assisted by Madeline Holland.,23,20,3,25,0.5892644693788318,Saint Mary's,BYU,4,4,0,0,NA,401174098,2020-01-18,Saint Mary's
82,2,8:38,1718,1718,Brenna Chase Drollinger missed Three Point Jumper.,23,20,3,4,0.5902867531734868,Saint Mary's,BYU,4,4,0,0,NA,401174098,2020-01-18,
83,2,8:34,1714,1714,Tyra Moe Defensive Rebound.,23,20,3,26,0.5904524938423856,Saint Mary's,BYU,4,4,0,0,NA,401174098,2020-01-18,
84,2,8:08,1688,1688,Brianna Simonich missed Three Point Jumper.,23,20,3,0,0.591545789155677,Saint Mary's,BYU,4,4,0,0,NA,401174098,2020-01-18,
85,2,8:08,1688,1688,Sara Hamson Block.,23,20,3,0,0.591545789155677,Saint Mary's,BYU,4,4,0,0,NA,401174098,2020-01-18,
86,2,8:08,1688,1688,Saint Mary's Offensive Rebound.,23,20,3,1,0.591545789155677,Saint Mary's,BYU,4,4,0,0,NA,401174098,2020-01-18,
87,2,8:07,1687,1687,Madeline Holland Turnover.,23,20,3,16,0.5915881515660368,Saint Mary's,BYU,4,4,0,0,NA,401174098,2020-01-18,
88,2,7:51,1671,1671,Brenna Chase Drollinger missed Layup.,23,20,3,5,0.5922571926971131,Saint Mary's,BYU,4,4,0,0,NA,401174098,2020-01-18,
89,2,7:46,1666,1666,Taycee Wedin Defensive Rebound.,23,20,3,3,0.5924631970751515,Saint Mary's,BYU,4,4,0,0,NA,401174098,2020-01-18,
90,2,7:43,1663,1663,Claire Ferguson missed Layup.,23,20,3,0,0.5925861749141021,Saint Mary's,BYU,4,4,0,0,NA,401174098,2020-01-18,
91,2,7:43,1663,1663,BYU Defensive Rebound.,23,20,3,14,0.5925861749141021,Saint Mary's,BYU,4,4,0,0,NA,401174098,2020-01-18,
92,2,7:29,1649,1649,Kaylee Smiler made Layup.,23,22,1,9,0.5313771895809314,Saint Mary's,BYU,4,4,0,0,NA,401174098,2020-01-18,BYU
93,2,7:20,1640,1640,Sam Simons missed Three Point Jumper.,23,22,1,4,0.53150149162019,Saint Mary's,BYU,4,4,0,0,NA,401174098,2020-01-18,
94,2,7:16,1636,1636,Brenna Chase Drollinger Defensive Rebound.,23,22,1,14,0.5315564604334229,Saint Mary's,BYU,4,4,0,0,NA,401174098,2020-01-18,
95,2,7:02,1622,1622,Kaylee Smiler Turnover.,23,22,1,15,0.5317478226305178,Saint Mary's,BYU,4,4,0,0,NA,401174098,2020-01-18,
96,2,6:47,1607,1607,Taycee Wedin missed Jumper.,23,22,1,3,0.5319517350031371,Saint Mary's,BYU,4,4,0,0,NA,401174098,2020-01-18,
97,2,6:44,1604,1604,Leilani Otuafi Defensive Rebound.,23,22,1,17,0.5319924577111725,Saint Mary's,BYU,4,4,0,0,NA,401174098,2020-01-18,
98,2,6:27,1587,1587,Brenna Chase Drollinger made Layup.,23,24,-1,15,0.4677766120289617,Saint Mary's,BYU,4,4,0,0,NA,401174098,2020-01-18,BYU
99,2,6:12,1572,1572,Claire Ferguson Turnover.,23,24,-1,16,0.46757184386010237,Saint Mary's,BYU,4,4,0,0,NA,401174098,2020-01-18,
100,2,5:56,1556,1556,Babalu Ugwu Turnover.,23,24,-1,20,0.4673512956803404,Saint Mary's,BYU,4,4,0,0,NA,401174098,2020-01-18,
101,2,5:36,1536,1536,Claire Ferguson missed Jumper.,23,24,-1,4,0.46707084094761714,Saint Mary's,BYU,4,4,0,0,NA,401174098,2020-01-18,
102,2,5:32,1532,1532,Sam Simons Offensive Rebound.,23,24,-1,9,0.46701393848940426,Saint Mary's,BYU,4,4,0,0,NA,401174098,2020-01-18,
103,2,5:23,1523,1523,Brianna Simonich made Jumper. Assisted by Tyra Moe.,25,24,1,10,0.5331152575738887,Saint Mary's,BYU,4,4,0,0,NA,401174098,2020-01-18,Saint Mary's
104,2,5:13,1513,1513,Leilani Otuafi missed Three Point Jumper.,25,24,1,3,0.5332609012347075,Saint Mary's,BYU,4,4,0,0,NA,401174098,2020-01-18,
105,2,5:10,1510,1510,Tyra Moe Defensive Rebound.,25,24,1,9,0.5333050630530126,Saint Mary's,BYU,4,4,0,0,NA,401174098,2020-01-18,
106,2,5:01,1501,1501,Tyra Moe missed Three Point Jumper.,25,24,1,2,0.5334389550713015,Saint Mary's,BYU,4,4,0,0,NA,401174098,2020-01-18,
107,2,4:59,1499,1499,Brenna Chase Drollinger Defensive Rebound.,25,24,1,7,0.533469009447533,Saint Mary's,BYU,4,4,0,0,NA,401174098,2020-01-18,
108,2,4:52,1492,1492,Sara Hamson missed Layup.,25,24,1,3,0.5335751123634594,Saint Mary's,BYU,4,4,0,0,NA,401174098,2020-01-18,
109,2,4:49,1489,1489,Sam Simons Defensive Rebound.,25,24,1,8,0.5336210360573875,Saint Mary's,BYU,4,4,0,0,NA,401174098,2020-01-18,
110,2,4:41,1481,1481,Sam Simons Turnover.,25,24,1,0,0.5337448945696408,Saint Mary's,BYU,4,4,0,0,NA,401174098,2020-01-18,
111,2,4:41,1481,1481,Official TV Timeout,25,24,1,10,0.5337448945696408,Saint Mary's,BYU,4,4,0,0,NA,401174098,2020-01-18,
112,2,4:31,1471,1471,Maria Albiero made Three Point Jumper.,25,27,-2,32,0.4325048259203321,Saint Mary's,BYU,4,4,0,0,NA,401174098,2020-01-18,BYU
113,2,3:59,1439,1439,Tyra Moe Turnover.,25,27,-2,0,0.4314676099318083,Saint Mary's,BYU,4,4,0,0,NA,401174098,2020-01-18,
114,2,3:59,1439,1439,Brenna Chase Drollinger Steal.,25,27,-2,23,0.4314676099318083,Saint Mary's,BYU,4,4,0,0,NA,401174098,2020-01-18,
115,2,3:36,1416,1416,Malli Valgardson Perri missed Jumper.,25,27,-2,4,0.430740677327383,Saint Mary's,BYU,4,4,0,0,NA,401174098,2020-01-18,
116,2,3:32,1412,1412,Leilani Otuafi Offensive Rebound.,25,27,-2,8,0.4306170205298191,Saint Mary's,BYU,4,4,0,0,NA,401174098,2020-01-18,
117,2,3:24,1404,1404,Foul on Malli Valgardson Perri.,25,27,-2,17,0.4303716241730649,Saint Mary's,BYU,4,4,0,0,NA,401174098,2020-01-18,
118,2,3:07,1387,1387,Tyra Moe Turnover.,25,27,-2,0,0.4298566596111741,Saint Mary's,BYU,4,4,0,0,NA,401174098,2020-01-18,
119,2,3:07,1387,1387,Malli Valgardson Perri Steal.,25,27,-2,9,0.4298566596111741,Saint Mary's,BYU,4,4,0,0,NA,401174098,2020-01-18,
120,2,2:58,1378,1378,Brenna Chase Drollinger missed Three Point Jumper.,25,27,-2,3,0.4295863310634024,Saint Mary's,BYU,4,4,0,0,NA,401174098,2020-01-18,
121,2,2:55,1375,1375,Sam Simons Defensive Rebound.,25,27,-2,9,0.42949640742501055,Saint Mary's,BYU,4,4,0,0,NA,401174098,2020-01-18,
122,2,2:46,1366,1366,Tyra Moe missed Three Point Jumper.,25,27,-2,3,0.4292268295666444,Saint Mary's,BYU,4,4,0,0,NA,401174098,2020-01-18,
123,2,2:43,1363,1363,Kaylee Smiler Defensive Rebound.,25,27,-2,16,0.429136947864899,Saint Mary's,BYU,4,4,0,0,NA,401174098,2020-01-18,
124,2,2:27,1347,1347,Brenna Chase Drollinger Turnover.,25,27,-2,0,0.4286560225188059,Saint Mary's,BYU,4,4,0,0,NA,401174098,2020-01-18,
125,2,2:27,1347,1347,Taycee Wedin Steal.,25,27,-2,6,0.4286560225188059,Saint Mary's,BYU,4,4,0,0,NA,401174098,2020-01-18,
126,2,2:21,1341,1341,Taycee Wedin made Layup.,27,27,0,19,0.5,Saint Mary's,BYU,4,4,0,0,NA,401174098,2020-01-18,Saint Mary's
127,2,2:02,1322,1322,Shalae Salmon missed Layup.,27,27,0,3,0.5,Saint Mary's,BYU,4,4,0,0,NA,401174098,2020-01-18,
128,2,1:59,1319,1319,Shalae Salmon Offensive Rebound.,27,27,0,3,0.5,Saint Mary's,BYU,4,4,0,0,NA,401174098,2020-01-18,
129,2,1:56,1316,1316,Maria Albiero made Three Point Jumper. Assisted by Shalae Salmon.,27,30,-3,34,0.39249638063182773,Saint Mary's,BYU,4,4,0,0,NA,401174098,2020-01-18,BYU
130,2,1:22,1282,1282,Tyra Moe missed Three Point Jumper.,27,30,-3,2,0.3908887097156955,Saint Mary's,BYU,4,4,0,0,NA,401174098,2020-01-18,
131,2,1:20,1280,1280,BYU Defensive Rebound.,27,30,-3,0,0.3907903100928388,Saint Mary's,BYU,4,4,0,0,NA,401174098,2020-01-18,
132,2,1:20,1280,1280,Foul on Sam Simons.,27,30,-3,16,0.3907903100928388,Saint Mary's,BYU,4,4,0,0,NA,401174098,2020-01-18,
133,2,1:04,1264,1264,Jasmine Moody made Layup.,27,32,-5,14,0.321774204622241,Saint Mary's,BYU,4,4,0,0,NA,401174098,2020-01-18,BYU
134,2,0:50,1250,1250,Foul on Jasmine Moody.,27,32,-5,9,0.3206499647814015,Saint Mary's,BYU,4,4,0,0,NA,401174098,2020-01-18,
135,2,0:41,1241,1241,Taycee Wedin made Three Point Jumper. Assisted by Mia Grizelj.,30,32,-2,14,0.4251447437343249,Saint Mary's,BYU,4,4,0,0,NA,401174098,2020-01-18,Saint Mary's
136,2,0:27,1227,1227,Kaylee Smiler missed Layup.,30,32,-2,3,0.4246022601030206,Saint Mary's,BYU,4,4,0,0,NA,401174098,2020-01-18,
137,2,0:24,1224,1224,Sam Simons Defensive Rebound.,30,32,-2,8,0.42448262532549014,Saint Mary's,BYU,4,4,0,0,NA,401174098,2020-01-18,
138,2,0:16,1216,1216,Sam Simons Turnover.,30,32,-2,0,0.42415740411939645,Saint Mary's,BYU,4,4,0,0,NA,401174098,2020-01-18,
139,2,0:16,1216,1216,Kaylee Smiler Steal.,30,32,-2,13,0.42415740411939645,Saint Mary's,BYU,4,4,0,0,NA,401174098,2020-01-18,
140,2,0:03,1203,1203,Signe Glantz missed Three Point Jumper.,30,32,-2,3,0.42361474139265004,Saint Mary's,BYU,4,4,0,0,NA,401174098,2020-01-18,
141,2,0:00,1200,1200,Sam Simons Defensive Rebound.,30,32,-2,0,0.4234906714856242,Saint Mary's,BYU,4,4,0,0,NA,401174098,2020-01-18,
142,2,0:00,1200,1200,End of 2nd Quarter,30,32,-2,12,0.4234906714856242,Saint Mary's,BYU,4,4,0,0,NA,401174098,2020-01-18,
143,3,9:48,1188,1188,Tyra Moe missed Jumper.,30,32,-2,4,0.42300150680498616,Saint Mary's,BYU,5,5,0,0,NA,401174098,2020-01-18,
144,3,9:44,1184,1184,Jasmine Moody Defensive Rebound.,30,32,-2,13,0.42284071035005444,Saint Mary's,BYU,5,5,0,0,NA,401174098,2020-01-18,
145,3,9:31,1171,1171,Maria Albiero missed Three Point Jumper.,30,32,-2,3,0.42232449172321823,Saint Mary's,BYU,5,5,0,0,NA,401174098,2020-01-18,
146,3,9:28,1168,1168,Tyra Moe Defensive Rebound.,30,32,-2,17,0.4222065339985064,Saint Mary's,BYU,5,5,0,0,NA,401174098,2020-01-18,
147,3,9:11,1151,1151,Tyra Moe missed Jumper.,30,32,-2,0,0.42154389491380484,Saint Mary's,BYU,5,5,0,0,NA,401174098,2020-01-18,
148,3,9:11,1151,1151,Sara Hamson Block.,30,32,-2,6,0.42154389491380484,Saint Mary's,BYU,5,5,0,0,NA,401174098,2020-01-18,
149,3,9:05,1145,1145,Sara Hamson Defensive Rebound.,30,32,-2,5,0.4213115738206691,Saint Mary's,BYU,5,5,0,0,NA,401174098,2020-01-18,
150,3,9:00,1140,1140,Leilani Otuafi missed Three Point Jumper.,30,32,-2,3,0.4211182491416184,Saint Mary's,BYU,5,5,0,0,NA,401174098,2020-01-18,
151,3,8:57,1137,1137,Tyra Moe Defensive Rebound.,30,32,-2,12,0.4210023002827818,Saint Mary's,BYU,5,5,0,0,NA,401174098,2020-01-18,
152,3,8:45,1125,1125,Tyra Moe missed Three Point Jumper.,30,32,-2,3,0.42053805081396345,Saint Mary's,BYU,5,5,0,0,NA,401174098,2020-01-18,
153,3,8:42,1122,1122,Brianna Simonich Offensive Rebound.,30,32,-2,6,0.4204216953468045,Saint Mary's,BYU,5,5,0,0,NA,401174098,2020-01-18,
154,3,8:36,1116,1116,Sam Simons made Three Point Jumper. Assisted by Tyra Moe.,33,32,1,17,0.5401632959936455,Saint Mary's,BYU,5,5,0,0,NA,401174098,2020-01-18,Saint Mary's
155,3,8:19,1099,1099,Maria Albiero missed Jumper.,33,32,1,3,0.5405037062464352,Saint Mary's,BYU,5,5,0,0,NA,401174098,2020-01-18,
156,3,8:16,1096,1096,Madeline Holland Defensive Rebound.,33,32,1,19,0.5405644840260915,Saint Mary's,BYU,5,5,0,0,NA,401174098,2020-01-18,
157,3,7:57,1077,1077,Taycee Wedin made Three Point Jumper.,36,32,4,25,0.6585344821563752,Saint Mary's,BYU,5,5,0,0,NA,401174098,2020-01-18,Saint Mary's
158,3,7:32,1052,1052,Maria Albiero missed Layup.,36,32,4,3,0.6604842615281447,Saint Mary's,BYU,5,5,0,0,NA,401174098,2020-01-18,
159,3,7:29,1049,1049,Jasmine Moody Offensive Rebound.,36,32,4,4,0.6607260173755879,Saint Mary's,BYU,5,5,0,0,NA,401174098,2020-01-18,
160,3,7:25,1045,1045,Leilani Otuafi made Layup.,36,34,2,29,0.5827302172429701,Saint Mary's,BYU,5,5,0,0,NA,401174098,2020-01-18,BYU
161,3,6:56,1016,1016,Taycee Wedin missed Jumper.,36,34,2,3,0.5840737019814866,Saint Mary's,BYU,5,5,0,0,NA,401174098,2020-01-18,
162,3,6:53,1013,1013,Sara Hamson Defensive Rebound.,36,34,2,10,0.5842198644313131,Saint Mary's,BYU,5,5,0,0,NA,401174098,2020-01-18,
163,3,6:43,1003,1003,Leilani Otuafi missed Layup.,36,34,2,5,0.5847179899734061,Saint Mary's,BYU,5,5,0,0,NA,401174098,2020-01-18,
164,3,6:38,998,998,Brianna Simonich Defensive Rebound.,36,34,2,9,0.5849736454699718,Saint Mary's,BYU,5,5,0,0,NA,401174098,2020-01-18,
165,3,6:29,989,989,Madeline Holland missed Three Point Jumper.,36,34,2,0,0.5854455593029567,Saint Mary's,BYU,5,5,0,0,NA,401174098,2020-01-18,
166,3,6:29,989,989,Sara Hamson Block.,36,34,2,7,0.5854455593029567,Saint Mary's,BYU,5,5,0,0,NA,401174098,2020-01-18,
167,3,6:22,982,982,Taycee Wedin Offensive Rebound.,36,34,2,2,0.5858235445853781,Saint Mary's,BYU,5,5,0,0,NA,401174098,2020-01-18,
168,3,6:20,980,980,Taycee Wedin Turnover.,36,34,2,0,0.5859333690871245,Saint Mary's,BYU,5,5,0,0,NA,401174098,2020-01-18,
169,3,6:20,980,980,Maria Albiero Steal.,36,34,2,4,0.5859333690871245,Saint Mary's,BYU,5,5,0,0,NA,401174098,2020-01-18,
170,3,6:16,976,976,Maria Albiero made Three Point Jumper. Assisted by Leilani Otuafi.,36,37,-1,22,0.4565976445861564,Saint Mary's,BYU,5,5,0,0,NA,401174098,2020-01-18,BYU
171,3,5:54,954,954,Sam Simons missed Three Point Jumper.,36,37,-1,4,0.45597632757411394,Saint Mary's,BYU,5,5,0,0,NA,401174098,2020-01-18,
172,3,5:50,950,950,Jasmine Moody Defensive Rebound.,36,37,-1,4,0.45587047651856705,Saint Mary's,BYU,5,5,0,0,NA,401174098,2020-01-18,
173,3,5:46,946,946,Foul on Madeline Holland.,36,37,-1,0,0.4557667891265667,Saint Mary's,BYU,5,5,0,0,NA,401174098,2020-01-18,
174,3,5:46,946,946,Leilani Otuafi missed Free Throw.,36,37,-1,0,0.4557667891265667,Saint Mary's,BYU,5,5,0,0,NA,401174098,2020-01-18,
175,3,5:46,946,946,BYU Offensive Rebound.,36,37,-1,0,0.4557667891265667,Saint Mary's,BYU,5,5,0,0,NA,401174098,2020-01-18,
176,3,5:46,946,946,Leilani Otuafi made Free Throw.,36,38,-2,16,0.4122205671113835,Saint Mary's,BYU,5,5,0,0,NA,401174098,2020-01-18,BYU
177,3,5:30,930,930,Sam Simons missed Jumper.,36,38,-2,3,0.41144773350539,Saint Mary's,BYU,5,5,0,0,NA,401174098,2020-01-18,
178,3,5:27,927,927,Sara Hamson Defensive Rebound.,36,38,-2,21,0.41130864900301917,Saint Mary's,BYU,5,5,0,0,NA,401174098,2020-01-18,
179,3,5:06,906,906,Maria Albiero missed Three Point Jumper.,36,38,-2,3,0.41037340396657424,Saint Mary's,BYU,5,5,0,0,NA,401174098,2020-01-18,
180,3,5:03,903,903,Claire Ferguson Defensive Rebound.,36,38,-2,8,0.4102440113945977,Saint Mary's,BYU,5,5,0,0,NA,401174098,2020-01-18,
181,3,4:55,895,895,Foul on Sara Hamson.,36,38,-2,0,0.4099022856912607,Saint Mary's,BYU,5,5,0,0,NA,401174098,2020-01-18,
182,3,4:55,895,895,Official TV Timeout,36,38,-2,0,0.4099022856912607,Saint Mary's,BYU,5,5,0,0,NA,401174098,2020-01-18,
183,3,4:55,895,895,Madeline Holland made Free Throw.,37,38,-1,0,0.45457939400950875,Saint Mary's,BYU,5,5,0,0,NA,401174098,2020-01-18,Saint Mary's
184,3,4:55,895,895,Madeline Holland made Free Throw.,38,38,0,28,0.5,Saint Mary's,BYU,5,5,0,0,NA,401174098,2020-01-18,Saint Mary's
185,3,4:27,867,867,Brenna Chase Drollinger made Layup.,38,40,-2,31,0.4087188024279029,Saint Mary's,BYU,5,5,0,0,NA,401174098,2020-01-18,BYU
186,3,3:56,836,836,Taycee Wedin made Jumper. Assisted by Brianna Simonich.,40,40,0,16,0.5,Saint Mary's,BYU,5,5,0,0,NA,401174098,2020-01-18,Saint Mary's
187,3,3:40,820,820,Kaylee Smiler made Layup.,40,42,-2,22,0.40658700685279303,Saint Mary's,BYU,5,5,0,0,NA,401174098,2020-01-18,BYU
188,3,3:18,798,798,Foul on Jasmine Moody.,40,42,-2,0,0.4054317700764067,Saint Mary's,BYU,5,5,0,0,NA,401174098,2020-01-18,
189,3,3:18,798,798,Brianna Simonich missed Free Throw.,40,42,-2,0,0.4054317700764067,Saint Mary's,BYU,5,5,0,0,NA,401174098,2020-01-18,
190,3,3:18,798,798,Saint Mary's Offensive Rebound.,40,42,-2,0,0.4054317700764067,Saint Mary's,BYU,5,5,0,0,NA,401174098,2020-01-18,
191,3,3:18,798,798,Brianna Simonich made Free Throw.,41,42,-1,14,0.4522852790828817,Saint Mary's,BYU,5,5,0,0,NA,401174098,2020-01-18,Saint Mary's
192,3,3:04,784,784,Foul on Claire Ferguson.,41,42,-1,7,0.45186681480218693,Saint Mary's,BYU,5,5,0,0,NA,401174098,2020-01-18,
