play_id,period,time_remaining_period,secs_remaining,secs_remaining_absolute,description,home_score,away_score,score_diff,play_length,win_prob,home,away,home_time_out_remaining,away_time_out_remaining,home_timeout_ind,away_timeout_ind,home_favored_by,game_id,date,whichScored
1,1,9:49,2389,2389,Brittany Brewer missed Jumper.,0,0,0,4,0.5,TCU,Texas Tech,4,4,0,0,NA,401176901,2020-01-08,NA
2,1,9:45,2385,2385,Lauren Heard Defensive Rebound.,0,0,0,15,0.5,TCU,Texas Tech,4,4,0,0,NA,401176901,2020-01-08,
3,1,9:30,2370,2370,Adeola Akomolafe missed Jumper.,0,0,0,4,0.5,TCU,Texas Tech,4,4,0,0,NA,401176901,2020-01-08,
4,1,9:26,2366,2366,Jo'Nah Johnson Defensive Rebound.,0,0,0,3,0.5,TCU,Texas Tech,4,4,0,0,NA,401176901,2020-01-08,
5,1,9:23,2363,2363,Chrislyn Carr missed Three Point Jumper.,0,0,0,2,0.5,TCU,Texas Tech,4,4,0,0,NA,401176901,2020-01-08,
6,1,9:21,2361,2361,TCU Defensive Rebound.,0,0,0,14,0.5,TCU,Texas Tech,4,4,0,0,NA,401176901,2020-01-08,
7,1,9:07,2347,2347,Lauren Heard made Three Point Jumper. Assisted by Kianna Ray.,3,0,3,15,0.5675039540011753,TCU,Texas Tech,4,4,0,0,NA,401176901,2020-01-08,TCU
8,1,8:52,2332,2332,Jo'Nah Johnson made Three Point Jumper. Assisted by Chrislyn Carr.,3,3,0,14,0.5,TCU,Texas Tech,4,4,0,0,NA,401176901,2020-01-08,Texas Tech
9,1,8:38,2318,2318,Foul on Chrislyn Carr.,3,3,0,17,0.5,TCU,Texas Tech,4,4,0,0,NA,401176901,2020-01-08,
10,1,8:21,2301,2301,Jaycee Bradley missed Three Point Jumper.,3,3,0,0,0.5,TCU,Texas Tech,4,4,0,0,NA,401176901,2020-01-08,
11,1,8:21,2301,2301,Sydney Goodson Block.,3,3,0,1,0.5,TCU,Texas Tech,4,4,0,0,NA,401176901,2020-01-08,
12,1,8:20,2300,2300,TCU Offensive Rebound.,3,3,0,5,0.5,TCU,Texas Tech,4,4,0,0,NA,401176901,2020-01-08,
13,1,8:15,2295,2295,Lauren Heard missed Jumper.,3,3,0,3,0.5,TCU,Texas Tech,4,4,0,0,NA,401176901,2020-01-08,
14,1,8:12,2292,2292,Adeola Akomolafe Offensive Rebound.,3,3,0,3,0.5,TCU,Texas Tech,4,4,0,0,NA,401176901,2020-01-08,
15,1,8:09,2289,2289,Kianna Ray missed Jumper.,3,3,0,4,0.5,TCU,Texas Tech,4,4,0,0,NA,401176901,2020-01-08,
16,1,8:05,2285,2285,Brittany Brewer Defensive Rebound.,3,3,0,14,0.5,TCU,Texas Tech,4,4,0,0,NA,401176901,2020-01-08,
17,1,7:51,2271,2271,Lexi Gordon Turnover.,3,3,0,0,0.5,TCU,Texas Tech,4,4,0,0,NA,401176901,2020-01-08,
18,1,7:51,2271,2271,Kianna Ray Steal.,3,3,0,5,0.5,TCU,Texas Tech,4,4,0,0,NA,401176901,2020-01-08,
19,1,7:46,2266,2266,Jayde Woods made Layup. Assisted by Kianna Ray.,5,3,2,10,0.5469481643120951,TCU,Texas Tech,4,4,0,0,NA,401176901,2020-01-08,TCU
20,1,7:36,2256,2256,Chrislyn Carr Turnover.,5,3,2,14,0.5471738642773869,TCU,Texas Tech,4,4,0,0,NA,401176901,2020-01-08,
21,1,7:22,2242,2242,Lauren Heard made Layup.,7,3,4,13,0.5941330918732078,TCU,Texas Tech,4,4,0,0,NA,401176901,2020-01-08,TCU
22,1,7:09,2229,2229,Jo'Nah Johnson missed Three Point Jumper.,7,3,4,3,0.5947090144780959,TCU,Texas Tech,4,4,0,0,NA,401176901,2020-01-08,
23,1,7:06,2226,2226,Sydney Goodson Offensive Rebound.,7,3,4,3,0.5948422040029784,TCU,Texas Tech,4,4,0,0,NA,401176901,2020-01-08,
24,1,7:03,2223,2223,Foul on Lauren Heard.,7,3,4,0,0.5949754942321849,TCU,Texas Tech,4,4,0,0,NA,401176901,2020-01-08,
25,1,7:03,2223,2223,Jo'Nah Johnson made Free Throw.,7,4,3,0,0.5716116011849327,TCU,Texas Tech,4,4,0,0,NA,401176901,2020-01-08,Texas Tech
26,1,7:03,2223,2223,Jo'Nah Johnson missed Free Throw.,7,4,3,1,0.5716116011849327,TCU,Texas Tech,4,4,0,0,NA,401176901,2020-01-08,
27,1,7:02,2222,2222,Lauren Heard Defensive Rebound.,7,4,3,9,0.5716454788876979,TCU,Texas Tech,4,4,0,0,NA,401176901,2020-01-08,
28,1,6:53,2213,2213,Kianna Ray missed Three Point Jumper.,7,4,3,2,0.5719507615723202,TCU,Texas Tech,4,4,0,0,NA,401176901,2020-01-08,
29,1,6:51,2211,2211,Lexi Gordon Defensive Rebound.,7,4,3,0,0.572018692434103,TCU,Texas Tech,4,4,0,0,NA,401176901,2020-01-08,
30,1,6:51,2211,2211,Foul on Adeola Akomolafe.,7,4,3,12,0.572018692434103,TCU,Texas Tech,4,4,0,0,NA,401176901,2020-01-08,
31,1,6:39,2199,2199,Sydney Goodson made Jumper.,7,6,1,13,0.5242941748530289,TCU,Texas Tech,4,4,0,0,NA,401176901,2020-01-08,Texas Tech
32,1,6:26,2186,2186,Yummy Morris Turnover.,7,6,1,0,0.5244447916132549,TCU,Texas Tech,4,4,0,0,NA,401176901,2020-01-08,
33,1,6:26,2186,2186,Andrayah Adams Steal.,7,6,1,8,0.5244447916132549,TCU,Texas Tech,4,4,0,0,NA,401176901,2020-01-08,
34,1,6:18,2178,2178,Jo'Nah Johnson missed Three Point Jumper.,7,6,1,4,0.5245376688636048,TCU,Texas Tech,4,4,0,0,NA,401176901,2020-01-08,
35,1,6:14,2174,2174,Brittany Brewer Offensive Rebound.,7,6,1,0,0.5245841565133473,TCU,Texas Tech,4,4,0,0,NA,401176901,2020-01-08,
36,1,6:14,2174,2174,Sydney Goodson missed Three Point Jumper.,7,6,1,7,0.5245841565133473,TCU,Texas Tech,4,4,0,0,NA,401176901,2020-01-08,
37,1,6:07,2167,2167,Lauren Heard Defensive Rebound.,7,6,1,3,0.5246655909373422,TCU,Texas Tech,4,4,0,0,NA,401176901,2020-01-08,
38,1,6:04,2164,2164,Foul on Brittany Brewer.,7,6,1,0,0.5247005411416555,TCU,Texas Tech,4,4,0,0,NA,401176901,2020-01-08,
39,1,6:04,2164,2164,Lauren Heard made Free Throw.,8,6,2,0,0.5492808140862127,TCU,Texas Tech,4,4,0,0,NA,401176901,2020-01-08,TCU
40,1,6:04,2164,2164,Lauren Heard made Free Throw.,9,6,3,16,0.5736228816547175,TCU,Texas Tech,4,4,0,0,NA,401176901,2020-01-08,TCU
41,1,5:48,2148,2148,Brittany Brewer made Layup. Assisted by Lexi Gordon.,9,8,1,19,0.5248875332213728,TCU,Texas Tech,4,4,0,0,NA,401176901,2020-01-08,Texas Tech
42,1,5:29,2129,2129,Ryann Payne missed Three Point Jumper.,9,8,1,4,0.5251109509496074,TCU,Texas Tech,4,4,0,0,NA,401176901,2020-01-08,
43,1,5:25,2125,2125,Lexi Gordon Defensive Rebound.,9,8,1,11,0.5251581852517027,TCU,Texas Tech,4,4,0,0,NA,401176901,2020-01-08,
44,1,5:14,2114,2114,Jo'Nah Johnson missed Layup.,9,8,1,1,0.5252884524132849,TCU,Texas Tech,4,4,0,0,NA,401176901,2020-01-08,
45,1,5:13,2113,2113,Brittany Brewer Offensive Rebound.,9,8,1,0,0.525300322543142,TCU,Texas Tech,4,4,0,0,NA,401176901,2020-01-08,
46,1,5:13,2113,2113,Foul on Yummy Morris.,9,8,1,3,0.525300322543142,TCU,Texas Tech,4,4,0,0,NA,401176901,2020-01-08,
47,1,5:10,2110,2110,Lexi Gordon missed Layup.,9,8,1,4,0.5253359611048554,TCU,Texas Tech,4,4,0,0,NA,401176901,2020-01-08,
48,1,5:06,2106,2106,Becky Obinma Defensive Rebound.,9,8,1,6,0.525383545558661,TCU,Texas Tech,4,4,0,0,NA,401176901,2020-01-08,
49,1,5:00,2100,2100,Michelle Berry missed Three Point Jumper.,9,8,1,4,0.5254550666804201,TCU,Texas Tech,4,4,0,0,NA,401176901,2020-01-08,
50,1,4:56,2096,2096,Chrislyn Carr Defensive Rebound.,9,8,1,4,0.5255028453134436,TCU,Texas Tech,4,4,0,0,NA,401176901,2020-01-08,
51,1,4:52,2092,2092,Jo'Nah Johnson missed Three Point Jumper.,9,8,1,3,0.5255507035274625,TCU,Texas Tech,4,4,0,0,NA,401176901,2020-01-08,
52,1,4:49,2089,2089,TCU Defensive Rebound.,9,8,1,0,0.5255866500692816,TCU,Texas Tech,4,4,0,0,NA,401176901,2020-01-08,
53,1,4:49,2089,2089,Official TV Timeout,9,8,1,16,0.5255866500692816,TCU,Texas Tech,4,4,0,0,NA,401176901,2020-01-08,
54,1,4:33,2073,2073,Jaycee Bradley made Three Point Jumper. Assisted by Kianna Ray.,12,8,4,26,0.6017668572163569,TCU,Texas Tech,4,4,0,0,NA,401176901,2020-01-08,TCU
55,1,4:07,2047,2047,Sydney Goodson Turnover.,12,8,4,0,0.6029802658032427,TCU,Texas Tech,4,4,0,0,NA,401176901,2020-01-08,
56,1,4:07,2047,2047,Kianna Ray Steal.,12,8,4,8,0.6029802658032427,TCU,Texas Tech,4,4,0,0,NA,401176901,2020-01-08,
57,1,3:59,2039,2039,Jaycee Bradley missed Three Point Jumper.,12,8,4,4,0.6033563643423405,TCU,Texas Tech,4,4,0,0,NA,401176901,2020-01-08,
58,1,3:55,2035,2035,Andrayah Adams Defensive Rebound.,12,8,4,7,0.6035449164040675,TCU,Texas Tech,4,4,0,0,NA,401176901,2020-01-08,
59,1,3:48,2028,2028,Andrayah Adams missed Layup.,12,8,4,1,0.6038757041959505,TCU,Texas Tech,4,4,0,0,NA,401176901,2020-01-08,
60,1,3:47,2027,2027,Texas Tech Offensive Rebound.,12,8,4,5,0.6039230459556416,TCU,Texas Tech,4,4,0,0,NA,401176901,2020-01-08,
61,1,3:42,2022,2022,Sydney Goodson missed Three Point Jumper.,12,8,4,4,0.6041600826296327,TCU,Texas Tech,4,4,0,0,NA,401176901,2020-01-08,
62,1,3:38,2018,2018,Lexi Gordon Offensive Rebound.,12,8,4,4,0.6043501091286834,TCU,Texas Tech,4,4,0,0,NA,401176901,2020-01-08,
63,1,3:34,2014,2014,Chrislyn Carr missed Three Point Jumper.,12,8,4,4,0.6045404929413596,TCU,Texas Tech,4,4,0,0,NA,401176901,2020-01-08,
64,1,3:30,2010,2010,Michelle Berry Defensive Rebound.,12,8,4,8,0.604731238016845,TCU,Texas Tech,4,4,0,0,NA,401176901,2020-01-08,
65,1,3:22,2002,2002,Jayde Woods missed Layup.,12,8,4,1,0.6051138277338701,TCU,Texas Tech,4,4,0,0,NA,401176901,2020-01-08,
66,1,3:21,2001,2001,Texas Tech Defensive Rebound.,12,8,4,13,0.6051617557333803,TCU,Texas Tech,4,4,0,0,NA,401176901,2020-01-08,
67,1,3:08,1988,1988,Sydney Goodson missed Jumper.,12,8,4,3,0.605786969619049,TCU,Texas Tech,4,4,0,0,NA,401176901,2020-01-08,
68,1,3:05,1985,1985,Brittany Brewer Offensive Rebound.,12,8,4,0,0.6059318250976432,TCU,Texas Tech,4,4,0,0,NA,401176901,2020-01-08,
69,1,3:05,1985,1985,Foul on Jayde Woods.,12,8,4,0,0.6059318250976432,TCU,Texas Tech,4,4,0,0,NA,401176901,2020-01-08,
70,1,3:05,1985,1985,Brittany Brewer missed Free Throw.,12,8,4,0,0.6059318250976432,TCU,Texas Tech,4,4,0,0,NA,401176901,2020-01-08,
71,1,3:05,1985,1985,Texas Tech Deadball Team Rebound.,12,8,4,0,0.6059318250976432,TCU,Texas Tech,4,4,0,0,NA,401176901,2020-01-08,
72,1,3:05,1985,1985,Brittany Brewer made Free Throw.,12,9,3,17,0.5799778985854955,TCU,Texas Tech,4,4,0,0,NA,401176901,2020-01-08,Texas Tech
73,1,2:48,1968,1968,Foul on Brittany Brewer.,12,9,3,0,0.5806092812137804,TCU,Texas Tech,4,4,0,0,NA,401176901,2020-01-08,
74,1,2:48,1968,1968,Becky Obinma missed Free Throw.,12,9,3,0,0.5806092812137804,TCU,Texas Tech,4,4,0,0,NA,401176901,2020-01-08,
75,1,2:48,1968,1968,TCU Deadball Team Rebound.,12,9,3,0,0.5806092812137804,TCU,Texas Tech,4,4,0,0,NA,401176901,2020-01-08,
76,1,2:48,1968,1968,Becky Obinma made Free Throw.,13,9,4,9,0.6067568627313638,TCU,Texas Tech,4,4,0,0,NA,401176901,2020-01-08,TCU
77,1,2:39,1959,1959,Jo'Nah Johnson missed Jumper.,13,9,4,5,0.6071966000861357,TCU,Texas Tech,4,4,0,0,NA,401176901,2020-01-08,
78,1,2:34,1954,1954,Lexi Gordon Offensive Rebound.,13,9,4,1,0.6074418039486302,TCU,Texas Tech,4,4,0,0,NA,401176901,2020-01-08,
79,1,2:33,1953,1953,Foul on Becky Obinma.,13,9,4,0,0.6074909232330805,TCU,Texas Tech,4,4,0,0,NA,401176901,2020-01-08,
80,1,2:33,1953,1953,Alexis Tucker made Free Throw.,13,10,3,0,0.5811712110282169,TCU,Texas Tech,4,4,0,0,NA,401176901,2020-01-08,Texas Tech
81,1,2:33,1953,1953,Sydney Goodson Turnover.,13,10,3,0,0.5811712110282169,TCU,Texas Tech,4,4,0,0,NA,401176901,2020-01-08,
82,1,2:33,1953,1953,Alexis Tucker missed Free Throw.,13,10,3,0,0.5811712110282169,TCU,Texas Tech,4,4,0,0,NA,401176901,2020-01-08,
83,1,2:33,1953,1953,Texas Tech Deadball Team Rebound.,13,10,3,6,0.5811712110282169,TCU,Texas Tech,4,4,0,0,NA,401176901,2020-01-08,
84,1,2:27,1947,1947,Kianna Ray missed Jumper.,13,10,3,4,0.5813972885459624,TCU,Texas Tech,4,4,0,0,NA,401176901,2020-01-08,
85,1,2:23,1943,1943,Yummy Morris Offensive Rebound.,13,10,3,0,0.5815484293667335,TCU,Texas Tech,4,4,0,0,NA,401176901,2020-01-08,
86,1,2:23,1943,1943,Yummy Morris Turnover.,13,10,3,24,0.5815484293667335,TCU,Texas Tech,4,4,0,0,NA,401176901,2020-01-08,
87,1,1:59,1919,1919,Lexi Gordon made Jumper.,13,12,1,16,0.527711841063402,TCU,Texas Tech,4,4,0,0,NA,401176901,2020-01-08,Texas Tech
88,1,1:43,1903,1903,Ryann Payne missed Layup.,13,12,1,2,0.5279195116963304,TCU,Texas Tech,4,4,0,0,NA,401176901,2020-01-08,
89,1,1:41,1901,1901,Lexi Gordon Defensive Rebound.,13,12,1,17,0.5279454540636609,TCU,Texas Tech,4,4,0,0,NA,401176901,2020-01-08,
90,1,1:24,1884,1884,Alexis Tucker missed Jumper.,13,12,1,3,0.5281659628104325,TCU,Texas Tech,4,4,0,0,NA,401176901,2020-01-08,
91,1,1:21,1881,1881,Sydney Goodson Offensive Rebound.,13,12,1,0,0.5282048929463481,TCU,Texas Tech,4,4,0,0,NA,401176901,2020-01-08,
92,1,1:21,1881,1881,Foul on Jaycee Bradley.,13,12,1,0,0.5282048929463481,TCU,Texas Tech,4,4,0,0,NA,401176901,2020-01-08,
93,1,1:21,1881,1881,Sydney Goodson made Free Throw.,13,13,0,0,0.5,TCU,Texas Tech,4,4,0,0,NA,401176901,2020-01-08,Texas Tech
94,1,1:21,1881,1881,Sydney Goodson made Free Throw.,13,14,-1,13,0.4717951070536519,TCU,Texas Tech,4,4,0,0,NA,401176901,2020-01-08,Texas Tech
95,1,1:08,1868,1868,Jaycee Bradley missed Three Point Jumper.,13,14,-1,5,0.47162626263875645,TCU,Texas Tech,4,4,0,0,NA,401176901,2020-01-08,
96,1,1:03,1863,1863,Lexi Gordon Defensive Rebound.,13,14,-1,4,0.4715612343497867,TCU,Texas Tech,4,4,0,0,NA,401176901,2020-01-08,
97,1,0:59,1859,1859,Sydney Goodson made Three Point Jumper. Assisted by Chrislyn Carr.,13,17,-4,20,0.3878526135607772,TCU,Texas Tech,4,4,0,0,NA,401176901,2020-01-08,Texas Tech
98,1,0:39,1839,1839,Foul on Alexis Tucker.,13,17,-4,0,0.38685785938456985,TCU,Texas Tech,4,4,0,0,NA,401176901,2020-01-08,
99,1,0:39,1839,1839,Kianna Ray made Free Throw.,14,17,-3,0,0.4144972386217471,TCU,Texas Tech,4,4,0,0,NA,401176901,2020-01-08,TCU
100,1,0:39,1839,1839,Kianna Ray missed Free Throw.,14,17,-3,3,0.4144972386217471,TCU,Texas Tech,4,4,0,0,NA,401176901,2020-01-08,
101,1,0:36,1836,1836,Lexi Gordon Defensive Rebound.,14,17,-3,0,0.4143823923767152,TCU,Texas Tech,4,4,0,0,NA,401176901,2020-01-08,
102,1,0:36,1836,1836,Foul on Yummy Morris.,14,17,-3,0,0.4143823923767152,TCU,Texas Tech,4,4,0,0,NA,401176901,2020-01-08,
103,1,0:36,1836,1836,Lexi Gordon missed Free Throw.,14,17,-3,0,0.4143823923767152,TCU,Texas Tech,4,4,0,0,NA,401176901,2020-01-08,
104,1,0:36,1836,1836,Texas Tech Deadball Team Rebound.,14,17,-3,0,0.4143823923767152,TCU,Texas Tech,4,4,0,0,NA,401176901,2020-01-08,
105,1,0:36,1836,1836,Lexi Gordon made Free Throw.,14,18,-4,27,0.3867081999499275,TCU,Texas Tech,4,4,0,0,NA,401176901,2020-01-08,Texas Tech
106,1,0:09,1809,1809,Jaycee Bradley made Jumper. Assisted by Ryann Payne.,16,18,-2,8,0.4419031096968457,TCU,Texas Tech,4,4,0,0,NA,401176901,2020-01-08,TCU
107,1,0:01,1801,1801,Jo'Nah Johnson missed Layup.,16,18,-2,0,0.44169262416690125,TCU,Texas Tech,4,4,0,0,NA,401176901,2020-01-08,
108,1,0:01,1801,1801,Alexis Tucker Offensive Rebound.,16,18,-2,1,0.44169262416690125,TCU,Texas Tech,4,4,0,0,NA,401176901,2020-01-08,
109,1,0:00,1800,1800,End of 1st Quarter,16,17,-1,15,0.47073319422403154,TCU,Texas Tech,4,4,0,0,NA,401176901,2020-01-08,
110,2,9:45,1785,1785,Jayde Woods made Layup.,18,18,0,20,0.5,TCU,Texas Tech,4,4,0,0,NA,401176901,2020-01-08,TCU
111,2,9:25,1765,1765,Lexi Gordon Turnover.,18,18,0,0,0.5,TCU,Texas Tech,4,4,0,0,NA,401176901,2020-01-08,
112,2,9:25,1765,1765,Kianna Ray Steal.,18,18,0,8,0.5,TCU,Texas Tech,4,4,0,0,NA,401176901,2020-01-08,
113,2,9:17,1757,1757,Foul on Jayde Woods.,18,18,0,0,0.5,TCU,Texas Tech,4,4,0,0,NA,401176901,2020-01-08,
114,2,9:17,1757,1757,Jayde Woods Turnover.,18,18,0,13,0.5,TCU,Texas Tech,4,4,0,0,NA,401176901,2020-01-08,
115,2,9:04,1744,1744,Alexis Tucker made Layup. Assisted by Jo'Nah Johnson.,18,20,-2,17,0.4401617384653906,TCU,Texas Tech,4,4,0,0,NA,401176901,2020-01-08,Texas Tech
116,2,8:47,1727,1727,Alexandria Crain Turnover.,18,20,-2,0,0.4396919467375525,TCU,Texas Tech,4,4,0,0,NA,401176901,2020-01-08,
117,2,8:47,1727,1727,Sydney Goodson made Three Point Jumper. Assisted by Chrislyn Carr.,18,23,-5,0,0.3529651300992073,TCU,Texas Tech,4,4,0,0,NA,401176901,2020-01-08,Texas Tech
118,2,8:47,1727,1727,Kianna Ray Turnover.,18,23,-5,0,0.3529651300992073,TCU,Texas Tech,4,4,0,0,NA,401176901,2020-01-08,
119,2,8:47,1727,1727,Lexi Gordon Steal.,18,23,-5,0,0.3529651300992073,TCU,Texas Tech,4,4,0,0,NA,401176901,2020-01-08,
120,2,8:47,1727,1727,Jo'Nah Johnson made Layup. Assisted by Chrislyn Carr.,18,25,-7,1,0.2997595161039593,TCU,Texas Tech,4,4,0,0,NA,401176901,2020-01-08,Texas Tech
121,2,8:46,1726,1726,Lauren Heard made Layup.,20,25,-5,7,0.35290057037834716,TCU,Texas Tech,4,4,0,0,NA,401176901,2020-01-08,TCU
122,2,8:39,1719,1719,Foul on Alexis Tucker.,20,25,-5,25,0.35244708618493154,TCU,Texas Tech,4,4,0,0,NA,401176901,2020-01-08,
123,2,8:14,1694,1694,Lauren Heard made Free Throw.,21,25,-4,19,0.3793267351509305,TCU,Texas Tech,4,4,0,0,NA,401176901,2020-01-08,TCU
124,2,7:55,1675,1675,Chrislyn Carr Turnover.,21,25,-4,18,0.3782873739376207,TCU,Texas Tech,4,4,0,0,NA,401176901,2020-01-08,
125,2,7:37,1657,1657,Adeola Akomolafe missed Layup.,21,25,-4,4,0.3773275243156414,TCU,Texas Tech,4,4,0,0,NA,401176901,2020-01-08,
126,2,7:33,1653,1653,Lauren Heard Offensive Rebound.,21,25,-4,1,0.37711702446523265,TCU,Texas Tech,4,4,0,0,NA,401176901,2020-01-08,
127,2,7:32,1652,1652,Lauren Heard missed Jumper.,21,25,-4,3,0.37706453856596844,TCU,Texas Tech,4,4,0,0,NA,401176901,2020-01-08,
128,2,7:29,1649,1649,Chrislyn Carr Defensive Rebound.,21,25,-4,4,0.3769073979224373,TCU,Texas Tech,4,4,0,0,NA,401176901,2020-01-08,
129,2,7:25,1645,1645,Lexi Gordon missed Three Point Jumper.,21,25,-4,5,0.37669857792189887,TCU,Texas Tech,4,4,0,0,NA,401176901,2020-01-08,
130,2,7:20,1640,1640,Lauren Heard Defensive Rebound.,21,25,-4,3,0.37643858550300296,TCU,Texas Tech,4,4,0,0,NA,401176901,2020-01-08,
131,2,7:17,1637,1637,Foul on Lauren Heard.,21,25,-4,0,0.37628309077810496,TCU,Texas Tech,4,4,0,0,NA,401176901,2020-01-08,
132,2,7:17,1637,1637,Lauren Heard Turnover.,21,25,-4,14,0.37628309077810496,TCU,Texas Tech,4,4,0,0,NA,401176901,2020-01-08,
133,2,7:03,1623,1623,Alexis Tucker made Layup. Assisted by Jo'Nah Johnson.,21,27,-6,17,0.31807209586672486,TCU,Texas Tech,4,4,0,0,NA,401176901,2020-01-08,Texas Tech
134,2,6:46,1606,1606,Kianna Ray missed Three Point Jumper.,21,27,-6,3,0.31686532511991267,TCU,Texas Tech,4,4,0,0,NA,401176901,2020-01-08,
135,2,6:43,1603,1603,Alexis Tucker Defensive Rebound.,21,27,-6,8,0.3166529450913303,TCU,Texas Tech,4,4,0,0,NA,401176901,2020-01-08,
136,2,6:35,1595,1595,Alexis Tucker made Layup.,21,29,-8,1,0.26326150314227964,TCU,Texas Tech,4,4,0,0,NA,401176901,2020-01-08,Texas Tech
137,2,6:34,1594,1594,TCU  Timeout,21,29,-8,0,0.2631768587481767,TCU,Texas Tech,3,4,1,0,NA,401176901,2020-01-08,
138,2,6:34,1594,1594,Official TV Timeout,21,29,-8,16,0.2631768587481767,TCU,Texas Tech,3,4,1,0,NA,401176901,2020-01-08,
139,2,6:18,1578,1578,Jaycee Bradley missed Three Point Jumper.,21,29,-8,3,0.2618216574106478,TCU,Texas Tech,3,4,1,0,NA,401176901,2020-01-08,
140,2,6:15,1575,1575,Alexis Tucker Defensive Rebound.,21,29,-8,8,0.26156705001142033,TCU,Texas Tech,3,4,1,0,NA,401176901,2020-01-08,
141,2,6:07,1567,1567,Chrislyn Carr made Three Point Jumper. Assisted by Jo'Nah Johnson.,21,32,-11,20,0.192806356098903,TCU,Texas Tech,3,4,1,0,NA,401176901,2020-01-08,Texas Tech
142,2,5:47,1547,1547,Adeola Akomolafe missed Layup.,21,32,-11,7,0.19090617502262971,TCU,Texas Tech,3,4,1,0,NA,401176901,2020-01-08,
143,2,5:40,1540,1540,Adeola Akomolafe Offensive Rebound.,21,32,-11,0,0.19023535703396854,TCU,Texas Tech,3,4,1,0,NA,401176901,2020-01-08,
144,2,5:40,1540,1540,Adeola Akomolafe made Layup.,23,32,-9,5,0.2341326188832368,TCU,Texas Tech,3,4,1,0,NA,401176901,2020-01-08,TCU
145,2,5:35,1535,1535,Sydney Goodson missed Three Point Jumper.,23,32,-9,1,0.23367386772463247,TCU,Texas Tech,3,4,1,0,NA,401176901,2020-01-08,
146,2,5:34,1534,1534,Texas Tech Offensive Rebound.,23,32,-9,0,0.2335818365379713,TCU,Texas Tech,3,4,1,0,NA,401176901,2020-01-08,
147,2,5:34,1534,1534,Foul on Michelle Berry.,23,32,-9,7,0.2335818365379713,TCU,Texas Tech,3,4,1,0,NA,401176901,2020-01-08,
148,2,5:27,1527,1527,Chrislyn Carr made Jumper.,23,34,-11,15,0.18897860168151345,TCU,Texas Tech,3,4,0,0,NA,401176901,2020-01-08,Texas Tech
149,2,5:12,1512,1512,Adeola Akomolafe made Layup.,25,34,-9,10,0.23152952226604642,TCU,Texas Tech,3,4,0,0,NA,401176901,2020-01-08,TCU
150,2,5:02,1502,1502,Chrislyn Carr made Three Point Jumper. Assisted by Sydney Goodson.,25,37,-12,16,0.1670407752534067,TCU,Texas Tech,3,4,0,0,NA,401176901,2020-01-08,Texas Tech
151,2,4:46,1486,1486,Foul on Ryann Payne.,25,37,-12,0,0.1654150789256105,TCU,Texas Tech,3,4,0,0,NA,401176901,2020-01-08,
152,2,4:46,1486,1486,Ryann Payne Turnover.,25,37,-12,15,0.1654150789256105,TCU,Texas Tech,3,4,0,0,NA,401176901,2020-01-08,
153,2,4:31,1471,1471,Lexi Gordon Turnover.,25,37,-12,0,0.16385329930353112,TCU,Texas Tech,3,4,0,0,NA,401176901,2020-01-08,
154,2,4:31,1471,1471,Kianna Ray Steal.,25,37,-12,16,0.16385329930353112,TCU,Texas Tech,3,4,0,0,NA,401176901,2020-01-08,
155,2,4:15,1455,1455,Kianna Ray missed Three Point Jumper.,25,37,-12,4,0.16214143105998946,TCU,Texas Tech,3,4,0,0,NA,401176901,2020-01-08,
156,2,4:11,1451,1451,Lexi Gordon Defensive Rebound.,25,37,-12,6,0.1617053828254601,TCU,Texas Tech,3,4,0,0,NA,401176901,2020-01-08,
157,2,4:05,1445,1445,Lexi Gordon made Layup.,25,39,-14,12,0.12724992625329537,TCU,Texas Tech,3,4,0,0,NA,401176901,2020-01-08,Texas Tech
158,2,3:53,1433,1433,Foul on Chrislyn Carr.,25,39,-14,13,0.12602658990521967,TCU,Texas Tech,3,4,0,0,NA,401176901,2020-01-08,
159,2,3:40,1420,1420,Adeola Akomolafe made Layup.,27,39,-12,0,0.15843274830818868,TCU,Texas Tech,3,4,0,0,NA,401176901,2020-01-08,TCU
160,2,3:40,1420,1420,Foul on Andrayah Adams.,27,39,-12,0,0.15843274830818868,TCU,Texas Tech,3,4,0,0,NA,401176901,2020-01-08,
161,2,3:40,1420,1420,Adeola Akomolafe missed Free Throw.,27,39,-12,0,0.15843274830818868,TCU,Texas Tech,3,4,0,0,NA,401176901,2020-01-08,
162,2,3:40,1420,1420,Lauren Heard Offensive Rebound.,27,39,-12,0,0.15843274830818868,TCU,Texas Tech,3,4,0,0,NA,401176901,2020-01-08,
163,2,3:40,1420,1420,Lauren Heard missed Layup.,27,39,-12,0,0.15843274830818868,TCU,Texas Tech,3,4,0,0,NA,401176901,2020-01-08,
164,2,3:40,1420,1420,Alexis Tucker Defensive Rebound.,27,39,-12,0,0.15843274830818868,TCU,Texas Tech,3,4,0,0,NA,401176901,2020-01-08,
165,2,3:40,1420,1420,Andrayah Adams missed Three Point Jumper.,27,39,-12,0,0.15843274830818868,TCU,Texas Tech,3,4,0,0,NA,401176901,2020-01-08,
166,2,3:40,1420,1420,Kianna Ray Defensive Rebound.,27,39,-12,0,0.15843274830818868,TCU,Texas Tech,3,4,0,0,NA,401176901,2020-01-08,
167,2,3:40,1420,1420,Kianna Ray Turnover.,27,39,-12,0,0.15843274830818868,TCU,Texas Tech,3,4,0,0,NA,401176901,2020-01-08,
168,2,3:40,1420,1420,Andrayah Adams Steal.,27,39,-12,24,0.15843274830818868,TCU,Texas Tech,3,4,0,0,NA,401176901,2020-01-08,
169,2,3:16,1396,1396,Sydney Goodson Turnover.,27,39,-12,16,0.15604371411411455,TCU,Texas Tech,3,4,0,0,NA,401176901,2020-01-08,
170,2,3:00,1380,1380,Adeola Akomolafe missed Layup.,27,39,-12,2,0.1544958563308499,TCU,Texas Tech,3,4,0,0,NA,401176901,2020-01-08,
171,2,2:58,1378,1378,Lexi Gordon Defensive Rebound.,27,39,-12,8,0.15430408196123996,TCU,Texas Tech,3,4,0,0,NA,401176901,2020-01-08,
172,2,2:50,1370,1370,Andrayah Adams missed Three Point Jumper.,27,39,-12,4,0.15353968773483942,TCU,Texas Tech,3,4,0,0,NA,401176901,2020-01-08,
173,2,2:46,1366,1366,Lauren Heard Defensive Rebound.,27,39,-12,6,0.15315876505058182,TCU,Texas Tech,3,4,0,0,NA,401176901,2020-01-08,
174,2,2:40,1360,1360,Adeola Akomolafe missed Three Point Jumper.,27,39,-12,2,0.1525884211493031,TCU,Texas Tech,3,4,0,0,NA,401176901,2020-01-08,
175,2,2:38,1358,1358,Alexis Tucker Defensive Rebound.,27,39,-12,0,0.15239848658157332,TCU,Texas Tech,3,4,0,0,NA,401176901,2020-01-08,
176,2,2:38,1358,1358,Foul on Kianna Ray.,27,39,-12,0,0.15239848658157332,TCU,Texas Tech,3,4,0,0,NA,401176901,2020-01-08,
177,2,2:38,1358,1358,Alexis Tucker missed Free Throw.,27,39,-12,0,0.15239848658157332,TCU,Texas Tech,3,4,0,0,NA,401176901,2020-01-08,
178,2,2:38,1358,1358,Texas Tech Deadball Team Rebound.,27,39,-12,0,0.15239848658157332,TCU,Texas Tech,3,4,0,0,NA,401176901,2020-01-08,
179,2,2:38,1358,1358,Alexis Tucker made Free Throw.,27,40,-13,18,0.13483078578594937,TCU,Texas Tech,3,4,0,0,NA,401176901,2020-01-08,Texas Tech
180,2,2:20,1340,1340,Kianna Ray missed Jumper.,27,40,-13,5,0.13315889972847442,TCU,Texas Tech,3,4,0,0,NA,401176901,2020-01-08,
181,2,2:15,1335,1335,Jo'Nah Johnson Defensive Rebound.,27,40,-13,7,0.13269329537817132,TCU,Texas Tech,3,4,0,0,NA,401176901,2020-01-08,
182,2,2:08,1328,1328,Lexi Gordon missed Jumper.,27,40,-13,2,0.13203939588786756,TCU,Texas Tech,3,4,0,0,NA,401176901,2020-01-08,
183,2,2:06,1326,1326,Michelle Berry Defensive Rebound.,27,40,-13,0,0.13185201151091647,TCU,Texas Tech,3,4,0,0,NA,401176901,2020-01-08,
184,2,2:06,1326,1326,Foul on Andrayah Adams.,27,40,-13,18,0.13185201151091647,TCU,Texas Tech,3,4,0,0,NA,401176901,2020-01-08,
185,2,1:48,1308,1308,Tavy Diggs missed Layup.,27,40,-13,4,0.13015005439032876,TCU,Texas Tech,3,4,0,0,NA,401176901,2020-01-08,
186,2,1:44,1304,1304,Tavy Diggs Offensive Rebound.,27,40,-13,1,0.1297671219113676,TCU,Texas Tech,3,4,0,0,NA,401176901,2020-01-08,
187,2,1:43,1303,1303,Tavy Diggs Turnover.,27,40,-13,0,0.12967107079713847,TCU,Texas Tech,3,4,0,0,NA,401176901,2020-01-08,
188,2,1:43,1303,1303,Sydney Goodson Steal.,27,40,-13,17,0.12967107079713847,TCU,Texas Tech,3,4,0,0,NA,401176901,2020-01-08,
189,2,1:26,1286,1286,Alexis Tucker missed Jumper.,27,40,-13,4,0.12801590995365278,TCU,Texas Tech,3,4,0,0,NA,401176901,2020-01-08,
190,2,1:22,1282,1282,Nailah Dillard Offensive Rebound.,27,40,-13,2,0.1276195798240668,TCU,Texas Tech,3,4,0,0,NA,401176901,2020-01-08,
191,2,1:20,1280,1280,Lexi Gordon missed Three Point Jumper.,27,40,-13,4,0.12742032038300255,TCU,Texas Tech,3,4,0,0,NA,401176901,2020-01-08,
192,2,1:16,1276,1276,Nailah Dillard Offensive Rebound.,27,40,-13,12,0.12701951808009293,TCU,Texas Tech,3,4,0,0,NA,401176901,2020-01-08,
193,2,1:04,1264,1264,Jo'Nah Johnson made Layup.,27,42,-15,10,0.09648627095234502,TCU,Texas Tech,3,4,0,0,NA,401176901,2020-01-08,Texas Tech
194,2,0:54,1254,1254,Foul on Nailah Dillard.,27,42,-15,0,0.09553313931561862,TCU,Texas Tech,3,4,0,0,NA,401176901,2020-01-08,
195,2,0:54,1254,1254,Lauren Heard made Free Throw.,28,42,-14,0,0.10928997005856732,TCU,Texas Tech,3,4,0,0,NA,401176901,2020-01-08,TCU
196,2,0:54,1254,1254,Lauren Heard missed Free Throw.,28,42,-14,0,0.10928997005856732,TCU,Texas Tech,3,4,0,0,NA,401176901,2020-01-08,
197,2,0:54,1254,1254,Alexis Tucker Defensive Rebound.,28,42,-14,21,0.10928997005856732,TCU,Texas Tech,3,4,0,0,NA,401176901,2020-01-08,
198,2,0:33,1233,1233,Jo'Nah Johnson made Layup.,28,44,-16,0,0.08139407774220093,TCU,Texas Tech,3,4,0,0,NA,401176901,2020-01-08,Texas Tech
199,2,0:33,1233,1233,Foul on Michelle Berry.,28,44,-16,0,0.08139407774220093,TCU,Texas Tech,3,4,0,0,NA,401176901,2020-01-08,
