play_id,period,time_remaining_period,secs_remaining,secs_remaining_absolute,description,home_score,away_score,score_diff,play_length,win_prob,home,away,home_time_out_remaining,away_time_out_remaining,home_timeout_ind,away_timeout_ind,home_favored_by,game_id,date,whichScored
200,2,0:33,1233,1233,Jo'Nah Johnson missed Free Throw.,28,44,-16,3,0.08139407774220093,TCU,Texas Tech,3,4,0,0,NA,401176901,2020-01-08,
201,2,0:30,1230,1230,Kianna Ray Defensive Rebound.,28,44,-16,26,0.08110761629585338,TCU,Texas Tech,3,4,0,0,NA,401176901,2020-01-08,
202,2,0:04,1204,1204,Foul on Nailah Dillard.,28,44,-16,0,0.07854701915652318,TCU,Texas Tech,3,4,0,0,NA,401176901,2020-01-08,
203,2,0:04,1204,1204,Kianna Ray made Free Throw.,29,44,-15,0,0.09043266912528708,TCU,Texas Tech,3,4,0,0,NA,401176901,2020-01-08,TCU
204,2,0:04,1204,1204,Kianna Ray made Free Throw.,30,44,-14,4,0.10391401982336057,TCU,Texas Tech,3,4,0,0,NA,401176901,2020-01-08,TCU
205,2,0:00,1200,1200,End of 2nd Quarter,30,44,-14,10,0.10347276448009536,TCU,Texas Tech,3,4,0,0,NA,401176901,2020-01-08,
206,3,9:50,1190,1190,Kianna Ray missed Three Point Jumper.,30,44,-14,4,0.10239150530834973,TCU,Texas Tech,4,5,0,0,NA,401176901,2020-01-08,
207,3,9:46,1186,1186,Chrislyn Carr Defensive Rebound.,30,44,-14,9,0.10196705544310371,TCU,Texas Tech,4,5,0,0,NA,401176901,2020-01-08,
208,3,9:37,1177,1177,Lexi Gordon made Layup. Assisted by Sydney Goodson.,30,46,-16,11,0.07598930731082047,TCU,Texas Tech,4,5,0,0,NA,401176901,2020-01-08,Texas Tech
209,3,9:26,1166,1166,Kianna Ray Turnover.,30,46,-16,21,0.07499711629706038,TCU,Texas Tech,4,5,0,0,NA,401176901,2020-01-08,
210,3,9:05,1145,1145,Sydney Goodson missed Three Point Jumper.,30,46,-16,0,0.07315997153309828,TCU,Texas Tech,4,5,0,0,NA,401176901,2020-01-08,
211,3,9:05,1145,1145,Kianna Ray Block.,30,46,-16,1,0.07315997153309828,TCU,Texas Tech,4,5,0,0,NA,401176901,2020-01-08,
212,3,9:04,1144,1144,Texas Tech Offensive Rebound.,30,46,-16,2,0.07307395867983463,TCU,Texas Tech,4,5,0,0,NA,401176901,2020-01-08,
213,3,9:02,1142,1142,Sydney Goodson missed Three Point Jumper.,30,46,-16,3,0.07290225800293328,TCU,Texas Tech,4,5,0,0,NA,401176901,2020-01-08,
214,3,8:59,1139,1139,Lauren Heard Defensive Rebound.,30,46,-16,5,0.07264547342274381,TCU,Texas Tech,4,5,0,0,NA,401176901,2020-01-08,
215,3,8:54,1134,1134,Adeola Akomolafe made Layup. Assisted by Lauren Heard.,32,46,-14,17,0.09674279105249842,TCU,Texas Tech,4,5,0,0,NA,401176901,2020-01-08,TCU
216,3,8:37,1117,1117,Jo'Nah Johnson missed Jumper.,32,46,-14,3,0.09510118411472217,TCU,Texas Tech,4,5,0,0,NA,401176901,2020-01-08,
217,3,8:34,1114,1114,Kianna Ray Defensive Rebound.,32,46,-14,7,0.0948124299708865,TCU,Texas Tech,4,5,0,0,NA,401176901,2020-01-08,
218,3,8:27,1107,1107,Foul on Chrislyn Carr.,32,46,-14,0,0.09413877023618876,TCU,Texas Tech,4,5,0,0,NA,401176901,2020-01-08,
219,3,8:27,1107,1107,Lauren Heard made Free Throw.,33,46,-13,1,0.1088643963360058,TCU,Texas Tech,4,5,0,0,NA,401176901,2020-01-08,TCU
220,3,8:26,1106,1106,Lauren Heard missed Free Throw.,33,46,-13,1,0.10876269399629189,TCU,Texas Tech,4,5,0,0,NA,401176901,2020-01-08,
221,3,8:25,1105,1105,Texas Tech Defensive Rebound.,33,46,-13,0,0.1086609632424659,TCU,Texas Tech,4,5,0,0,NA,401176901,2020-01-08,
222,3,8:25,1105,1105,Alexis Tucker Turnover.,33,46,-13,16,0.1086609632424659,TCU,Texas Tech,4,5,0,0,NA,401176901,2020-01-08,
223,3,8:09,1089,1089,Foul on Sydney Goodson.,33,46,-13,11,0.10702682409925086,TCU,Texas Tech,4,5,0,0,NA,401176901,2020-01-08,
224,3,7:58,1078,1078,Kianna Ray made Three Point Jumper. Assisted by Lauren Heard.,36,46,-10,8,0.16231790696294093,TCU,Texas Tech,4,5,0,0,NA,401176901,2020-01-08,TCU
225,3,7:50,1070,1070,Texas Tech  Timeout,36,46,-10,0,0.1613957876933315,TCU,Texas Tech,4,4,0,1,NA,401176901,2020-01-08,
226,3,7:50,1070,1070,Official TV Timeout,36,46,-10,14,0.1613957876933315,TCU,Texas Tech,4,4,0,1,NA,401176901,2020-01-08,
227,3,7:36,1056,1056,Foul on Sydney Goodson.,36,46,-10,0,0.15975244121541854,TCU,Texas Tech,4,4,0,1,NA,401176901,2020-01-08,
228,3,7:36,1056,1056,Sydney Goodson Turnover.,36,46,-10,11,0.15975244121541854,TCU,Texas Tech,4,4,0,1,NA,401176901,2020-01-08,
229,3,7:25,1045,1045,Jayde Woods missed Layup.,36,46,-10,0,0.1584299409867017,TCU,Texas Tech,4,4,0,1,NA,401176901,2020-01-08,
230,3,7:25,1045,1045,Brittany Brewer Block.,36,46,-10,0,0.1584299409867017,TCU,Texas Tech,4,4,0,1,NA,401176901,2020-01-08,
231,3,7:25,1045,1045,TCU Offensive Rebound.,36,46,-10,10,0.1584299409867017,TCU,Texas Tech,4,4,0,1,NA,401176901,2020-01-08,
232,3,7:15,1035,1035,Lauren Heard missed Jumper.,36,46,-10,6,0.15719997928490656,TCU,Texas Tech,4,4,0,1,NA,401176901,2020-01-08,
233,3,7:09,1029,1029,Adeola Akomolafe Offensive Rebound.,36,46,-10,2,0.15644805489757058,TCU,Texas Tech,4,4,0,1,NA,401176901,2020-01-08,
234,3,7:07,1027,1027,Adeola Akomolafe Turnover.,36,46,-10,0,0.1561949493586287,TCU,Texas Tech,4,4,0,1,NA,401176901,2020-01-08,
235,3,7:07,1027,1027,Jo'Nah Johnson Steal.,36,46,-10,1,0.1561949493586287,TCU,Texas Tech,4,4,0,1,NA,401176901,2020-01-08,
236,3,7:06,1026,1026,Foul on Brittany Brewer.,36,46,-10,0,0.15606792173484274,TCU,Texas Tech,4,4,0,1,NA,401176901,2020-01-08,
237,3,7:06,1026,1026,Brittany Brewer Turnover.,36,46,-10,13,0.15606792173484274,TCU,Texas Tech,4,4,0,1,NA,401176901,2020-01-08,
238,3,6:53,1013,1013,Jaycee Bradley made Three Point Jumper. Assisted by Lauren Heard.,39,46,-7,15,0.23318333193117016,TCU,Texas Tech,4,4,0,1,NA,401176901,2020-01-08,TCU
239,3,6:38,998,998,Lexi Gordon missed Layup.,39,46,-7,4,0.2312463980657456,TCU,Texas Tech,4,4,0,0,NA,401176901,2020-01-08,
240,3,6:34,994,994,Sydney Goodson Offensive Rebound.,39,46,-7,0,0.2307141372814669,TCU,Texas Tech,4,4,0,0,NA,401176901,2020-01-08,
241,3,6:34,994,994,Foul on Jaycee Bradley.,39,46,-7,5,0.2307141372814669,TCU,Texas Tech,4,4,0,0,NA,401176901,2020-01-08,
242,3,6:29,989,989,Lexi Gordon made Layup. Assisted by Andrayah Adams.,39,48,-9,13,0.17461592041208182,TCU,Texas Tech,4,4,0,0,NA,401176901,2020-01-08,Texas Tech
243,3,6:16,976,976,Foul on Sydney Goodson.,39,48,-9,0,0.1727263328724527,TCU,Texas Tech,4,4,0,0,NA,401176901,2020-01-08,
244,3,6:16,976,976,Lauren Heard made Free Throw.,40,48,-8,0,0.19902813122648644,TCU,Texas Tech,4,4,0,0,NA,401176901,2020-01-08,TCU
245,3,6:16,976,976,Lauren Heard made Free Throw.,41,48,-7,14,0.2282300868728821,TCU,Texas Tech,4,4,0,0,NA,401176901,2020-01-08,TCU
246,3,6:02,962,962,Andrayah Adams missed Three Point Jumper.,41,48,-7,3,0.22623538300026788,TCU,Texas Tech,4,4,0,0,NA,401176901,2020-01-08,
247,3,5:59,959,959,Adeola Akomolafe Defensive Rebound.,41,48,-7,8,0.22582491466551136,TCU,Texas Tech,4,4,0,0,NA,401176901,2020-01-08,
248,3,5:51,951,951,Lauren Heard missed Jumper.,41,48,-7,3,0.22476527814568995,TCU,Texas Tech,4,4,0,0,NA,401176901,2020-01-08,
249,3,5:48,948,948,Adeola Akomolafe Offensive Rebound.,41,48,-7,1,0.2243801947437711,TCU,Texas Tech,4,4,0,0,NA,401176901,2020-01-08,
250,3,5:47,947,947,Kianna Ray missed Jumper.,41,48,-7,4,0.22425323710471215,TCU,Texas Tech,4,4,0,0,NA,401176901,2020-01-08,
251,3,5:43,943,943,Alexis Tucker Defensive Rebound.,41,48,-7,7,0.2237521427296982,TCU,Texas Tech,4,4,0,0,NA,401176901,2020-01-08,
252,3,5:36,936,936,Sydney Goodson missed Layup.,41,48,-7,0,0.22289954839452764,TCU,Texas Tech,4,4,0,0,NA,401176901,2020-01-08,
253,3,5:36,936,936,Adeola Akomolafe Block.,41,48,-7,5,0.22289954839452764,TCU,Texas Tech,4,4,0,0,NA,401176901,2020-01-08,
254,3,5:31,931,931,Kianna Ray Defensive Rebound.,41,48,-7,15,0.22230783984725208,TCU,Texas Tech,4,4,0,0,NA,401176901,2020-01-08,
255,3,5:16,916,916,Kianna Ray made Layup. Assisted by Lauren Heard.,43,48,-5,13,0.2887361098644227,TCU,Texas Tech,4,4,0,0,NA,401176901,2020-01-08,TCU
256,3,5:03,903,903,Jo'Nah Johnson Turnover.,43,48,-5,17,0.2875338416081643,TCU,Texas Tech,4,4,0,0,NA,401176901,2020-01-08,
257,3,4:46,886,886,Kianna Ray missed Three Point Jumper.,43,48,-5,3,0.2860067351453709,TCU,Texas Tech,4,4,0,0,NA,401176901,2020-01-08,
258,3,4:43,883,883,Kianna Ray Offensive Rebound.,43,48,-5,0,0.2857398165878924,TCU,Texas Tech,4,4,0,0,NA,401176901,2020-01-08,
259,3,4:43,883,883,Official TV Timeout,43,48,-5,1,0.2857398165878924,TCU,Texas Tech,4,4,0,0,NA,401176901,2020-01-08,
260,3,4:42,882,882,Jaycee Bradley missed Three Point Jumper.,43,48,-5,4,0.2856508998749513,TCU,Texas Tech,4,4,0,0,NA,401176901,2020-01-08,
261,3,4:38,878,878,Adeola Akomolafe Offensive Rebound.,43,48,-5,2,0.28529529522128244,TCU,Texas Tech,4,4,0,0,NA,401176901,2020-01-08,
262,3,4:36,876,876,Adeola Akomolafe made Layup.,45,48,-3,12,0.36550943166924993,TCU,Texas Tech,4,4,0,0,NA,401176901,2020-01-08,TCU
263,3,4:24,864,864,Nailah Dillard missed Three Point Jumper.,45,48,-3,6,0.3647767641484135,TCU,Texas Tech,4,4,0,0,NA,401176901,2020-01-08,
264,3,4:18,858,858,Kianna Ray Defensive Rebound.,45,48,-3,19,0.36440576060341545,TCU,Texas Tech,4,4,0,0,NA,401176901,2020-01-08,
265,3,3:59,839,839,Lauren Heard made Jumper. Assisted by Jaycee Bradley.,47,48,-1,21,0.4533421870319224,TCU,Texas Tech,4,4,0,0,NA,401176901,2020-01-08,TCU
266,3,3:38,818,818,Alexis Tucker made Layup. Assisted by Jo'Nah Johnson.,47,50,-3,13,0.36175424011469665,TCU,Texas Tech,4,4,0,0,NA,401176901,2020-01-08,Texas Tech
267,3,3:25,805,805,Michelle Berry made Three Point Jumper. Assisted by Lauren Heard.,50,50,0,18,0.5,TCU,Texas Tech,4,4,0,0,NA,401176901,2020-01-08,TCU
268,3,3:07,787,787,Foul on Adeola Akomolafe.,50,50,0,0,0.5,TCU,Texas Tech,4,4,0,0,NA,401176901,2020-01-08,
269,3,3:07,787,787,Jo'Nah Johnson missed Free Throw.,50,50,0,0,0.5,TCU,Texas Tech,4,4,0,0,NA,401176901,2020-01-08,
270,3,3:07,787,787,Texas Tech Deadball Team Rebound.,50,50,0,0,0.5,TCU,Texas Tech,4,4,0,0,NA,401176901,2020-01-08,
271,3,3:07,787,787,Jo'Nah Johnson made Free Throw.,50,51,-1,17,0.4519595206632,TCU,Texas Tech,4,4,0,0,NA,401176901,2020-01-08,Texas Tech
272,3,2:50,770,770,Kianna Ray missed Three Point Jumper.,50,51,-1,3,0.45141009693184303,TCU,Texas Tech,4,4,0,0,NA,401176901,2020-01-08,
273,3,2:47,767,767,Lexi Gordon Defensive Rebound.,50,51,-1,8,0.45130672970581426,TCU,Texas Tech,4,4,0,0,NA,401176901,2020-01-08,
274,3,2:39,759,759,Lexi Gordon missed Layup.,50,51,-1,0,0.4510208689918862,TCU,Texas Tech,4,4,0,0,NA,401176901,2020-01-08,
275,3,2:39,759,759,Kianna Ray Block.,50,51,-1,1,0.4510208689918862,TCU,Texas Tech,4,4,0,0,NA,401176901,2020-01-08,
276,3,2:38,758,758,Foul on Brittany Brewer.,50,51,-1,0,0.45098405608518105,TCU,Texas Tech,4,4,0,0,NA,401176901,2020-01-08,
277,3,2:38,758,758,Brittany Brewer Turnover.,50,51,-1,4,0.45098405608518105,TCU,Texas Tech,4,4,0,0,NA,401176901,2020-01-08,
278,3,2:34,754,754,Texas Tech Offensive Rebound.,50,51,-1,15,0.4508343180247939,TCU,Texas Tech,4,4,0,0,NA,401176901,2020-01-08,
279,3,2:19,739,739,Michelle Berry made Jumper. Assisted by Kianna Ray.,52,51,1,14,0.5497645093967024,TCU,Texas Tech,4,4,0,0,NA,401176901,2020-01-08,TCU
280,3,2:05,725,725,Alexis Tucker made Layup. Assisted by Jo'Nah Johnson.,52,53,-1,13,0.4496271916090662,TCU,Texas Tech,4,4,0,0,NA,401176901,2020-01-08,Texas Tech
281,3,1:52,712,712,Lauren Heard made Layup.,54,53,1,30,0.5509046344121711,TCU,Texas Tech,4,4,0,0,NA,401176901,2020-01-08,TCU
282,3,1:22,682,682,Jo'Nah Johnson made Three Point Jumper. Assisted by Lexi Gordon.,54,56,-2,14,0.39714190185185355,TCU,Texas Tech,4,4,0,0,NA,401176901,2020-01-08,Texas Tech
283,3,1:08,668,668,Lauren Heard missed Jumper.,54,56,-2,4,0.39623996559997604,TCU,Texas Tech,4,4,0,0,NA,401176901,2020-01-08,
284,3,1:04,664,664,Andrayah Adams Defensive Rebound.,54,56,-2,7,0.3959849322122027,TCU,Texas Tech,4,4,0,0,NA,401176901,2020-01-08,
285,3,0:57,657,657,Sydney Goodson made Layup.,54,58,-4,19,0.29981412096626897,TCU,Texas Tech,4,4,0,0,NA,401176901,2020-01-08,Texas Tech
286,3,0:38,638,638,Kianna Ray made Layup. Assisted by Lauren Heard.,56,58,-2,13,0.3942957913807102,TCU,Texas Tech,4,4,0,0,NA,401176901,2020-01-08,TCU
287,3,0:25,625,625,Sydney Goodson missed Three Point Jumper.,56,58,-2,4,0.3933926371899241,TCU,Texas Tech,4,4,0,0,NA,401176901,2020-01-08,
288,3,0:21,621,621,Kianna Ray Defensive Rebound.,56,58,-2,6,0.3931017836002959,TCU,Texas Tech,4,4,0,0,NA,401176901,2020-01-08,
289,3,0:15,615,615,Jaycee Bradley missed Jumper.,56,58,-2,3,0.3926516681343029,TCU,Texas Tech,4,4,0,0,NA,401176901,2020-01-08,
290,3,0:12,612,612,Alexis Tucker Defensive Rebound.,56,58,-2,11,0.39241977552599766,TCU,Texas Tech,4,4,0,0,NA,401176901,2020-01-08,
291,3,0:01,601,601,Lexi Gordon made Jumper.,56,60,-4,1,0.29280256210093664,TCU,Texas Tech,4,4,0,0,NA,401176901,2020-01-08,Texas Tech
292,3,0:00,600,600,End of 3rd Quarter,56,60,-4,14,0.2926546588354372,TCU,Texas Tech,4,4,0,0,NA,401176901,2020-01-08,
293,4,9:46,586,586,Lauren Heard made Layup.,58,60,-2,17,0.39017354540228394,TCU,Texas Tech,5,5,0,0,NA,401176901,2020-01-08,TCU
294,4,9:29,569,569,Chrislyn Carr missed Three Point Jumper.,58,60,-2,2,0.3884177886825351,TCU,Texas Tech,5,5,0,0,NA,401176901,2020-01-08,
295,4,9:27,567,567,Texas Tech Offensive Rebound.,58,60,-2,3,0.3881933868349289,TCU,Texas Tech,5,5,0,0,NA,401176901,2020-01-08,
296,4,9:24,564,564,Lexi Gordon missed Three Point Jumper.,58,60,-2,6,0.38784918204277036,TCU,Texas Tech,5,5,0,0,NA,401176901,2020-01-08,
297,4,9:18,558,558,Michelle Berry Defensive Rebound.,58,60,-2,23,0.3871324043241152,TCU,Texas Tech,5,5,0,0,NA,401176901,2020-01-08,
298,4,8:55,535,535,Adeola Akomolafe missed Layup.,58,60,-2,7,0.3843055920516561,TCU,Texas Tech,5,5,0,0,NA,401176901,2020-01-08,
299,4,8:48,528,528,Michelle Berry Offensive Rebound.,58,60,-2,0,0.38355546606232876,TCU,Texas Tech,5,5,0,0,NA,401176901,2020-01-08,
300,4,8:48,528,528,Michelle Berry made Layup.,60,60,0,10,0.5,TCU,Texas Tech,5,5,0,0,NA,401176901,2020-01-08,TCU
301,4,8:38,518,518,Jo'Nah Johnson missed Three Point Jumper.,60,60,0,5,0.5,TCU,Texas Tech,5,5,0,0,NA,401176901,2020-01-08,
302,4,8:33,513,513,Lexi Gordon Offensive Rebound.,60,60,0,0,0.5,TCU,Texas Tech,5,5,0,0,NA,401176901,2020-01-08,
303,4,8:33,513,513,Lexi Gordon made Layup.,60,62,-2,18,0.3820737276975581,TCU,Texas Tech,5,5,0,0,NA,401176901,2020-01-08,Texas Tech
304,4,8:15,495,495,Michelle Berry missed Jumper.,60,62,-2,4,0.3803748725830296,TCU,Texas Tech,5,5,0,0,NA,401176901,2020-01-08,
305,4,8:11,491,491,Lexi Gordon Defensive Rebound.,60,62,-2,7,0.3799890314077251,TCU,Texas Tech,5,5,0,0,NA,401176901,2020-01-08,
306,4,8:04,484,484,Lexi Gordon missed Layup.,60,62,-2,0,0.37929283567151445,TCU,Texas Tech,5,5,0,0,NA,401176901,2020-01-08,
307,4,8:04,484,484,Texas Tech Deadball Team Rebound.,60,62,-2,0,0.37929283567151445,TCU,Texas Tech,5,5,0,0,NA,401176901,2020-01-08,
308,4,8:04,484,484,Foul on Adeola Akomolafe.,60,62,-2,8,0.37929283567151445,TCU,Texas Tech,5,5,0,0,NA,401176901,2020-01-08,
309,4,7:56,476,476,Jo'Nah Johnson made Jumper.,60,64,-4,17,0.2704659252340227,TCU,Texas Tech,5,5,0,0,NA,401176901,2020-01-08,Texas Tech
310,4,7:39,459,459,Becky Obinma made Layup. Assisted by Jayde Woods.,62,64,-2,7,0.3764129572837046,TCU,Texas Tech,5,5,0,0,NA,401176901,2020-01-08,TCU
311,4,7:32,452,452,Jo'Nah Johnson Turnover.,62,64,-2,0,0.37544349823991974,TCU,Texas Tech,5,5,0,0,NA,401176901,2020-01-08,
312,4,7:32,452,452,Lauren Heard Steal.,62,64,-2,3,0.37544349823991974,TCU,Texas Tech,5,5,0,0,NA,401176901,2020-01-08,
313,4,7:29,449,449,Foul on Jo'Nah Johnson.,62,64,-2,0,0.3749998596063457,TCU,Texas Tech,5,5,0,0,NA,401176901,2020-01-08,
314,4,7:29,449,449,Lauren Heard missed Free Throw.,62,64,-2,0,0.3749998596063457,TCU,Texas Tech,5,5,0,0,NA,401176901,2020-01-08,
315,4,7:29,449,449,TCU Deadball Team Rebound.,62,64,-2,0,0.3749998596063457,TCU,Texas Tech,5,5,0,0,NA,401176901,2020-01-08,
316,4,7:29,449,449,Lauren Heard made Free Throw.,63,64,-1,12,0.43649159943509036,TCU,Texas Tech,5,5,0,0,NA,401176901,2020-01-08,TCU
317,4,7:17,437,437,Lexi Gordon Turnover.,63,64,-1,0,0.43545862184367645,TCU,Texas Tech,5,5,0,0,NA,401176901,2020-01-08,
318,4,7:17,437,437,Lauren Heard Steal.,63,64,-1,2,0.43545862184367645,TCU,Texas Tech,5,5,0,0,NA,401176901,2020-01-08,
319,4,7:15,435,435,Lauren Heard made Layup.,65,64,1,0,0.5647309191320259,TCU,Texas Tech,5,5,0,0,NA,401176901,2020-01-08,TCU
320,4,7:15,435,435,Foul on Chrislyn Carr.,65,64,1,0,0.5647309191320259,TCU,Texas Tech,5,5,0,0,NA,401176901,2020-01-08,
321,4,7:15,435,435,Lauren Heard made Free Throw.,66,64,2,19,0.6273277779049133,TCU,Texas Tech,5,5,0,0,NA,401176901,2020-01-08,TCU
322,4,6:56,416,416,Foul on Becky Obinma.,66,64,2,0,0.6308801499271423,TCU,Texas Tech,5,5,0,0,NA,401176901,2020-01-08,
323,4,6:56,416,416,Brittany Brewer made Free Throw.,66,65,1,0,0.5666011692470708,TCU,Texas Tech,5,5,0,0,NA,401176901,2020-01-08,Texas Tech
324,4,6:56,416,416,Brittany Brewer made Free Throw.,66,66,0,21,0.5,TCU,Texas Tech,5,5,0,0,NA,401176901,2020-01-08,Texas Tech
325,4,6:35,395,395,Kianna Ray missed Jumper.,66,66,0,4,0.5,TCU,Texas Tech,5,5,0,0,NA,401176901,2020-01-08,
326,4,6:31,391,391,Brittany Brewer Defensive Rebound.,66,66,0,9,0.5,TCU,Texas Tech,5,5,0,0,NA,401176901,2020-01-08,
327,4,6:22,382,382,Brittany Brewer missed Jumper.,66,66,0,4,0.5,TCU,Texas Tech,5,5,0,0,NA,401176901,2020-01-08,
328,4,6:18,378,378,Becky Obinma Defensive Rebound.,66,66,0,16,0.5,TCU,Texas Tech,5,5,0,0,NA,401176901,2020-01-08,
329,4,6:02,362,362,Adeola Akomolafe missed Layup.,66,66,0,0,0.5,TCU,Texas Tech,5,5,0,0,NA,401176901,2020-01-08,
330,4,6:02,362,362,Becky Obinma Offensive Rebound.,66,66,0,0,0.5,TCU,Texas Tech,5,5,0,0,NA,401176901,2020-01-08,
331,4,6:02,362,362,Foul on Andrayah Adams.,66,66,0,1,0.5,TCU,Texas Tech,5,5,0,0,NA,401176901,2020-01-08,
332,4,6:01,361,361,Foul on Becky Obinma.,66,66,0,0,0.5,TCU,Texas Tech,5,5,0,0,NA,401176901,2020-01-08,
333,4,6:01,361,361,Becky Obinma Turnover.,66,66,0,11,0.5,TCU,Texas Tech,5,5,0,0,NA,401176901,2020-01-08,
334,4,5:50,350,350,Lexi Gordon Turnover.,66,66,0,19,0.5,TCU,Texas Tech,5,5,0,0,NA,401176901,2020-01-08,
335,4,5:31,331,331,Lauren Heard missed Three Point Jumper.,66,66,0,4,0.5,TCU,Texas Tech,5,5,0,0,NA,401176901,2020-01-08,
336,4,5:27,327,327,Jo'Nah Johnson Defensive Rebound.,66,66,0,11,0.5,TCU,Texas Tech,5,5,0,0,NA,401176901,2020-01-08,
337,4,5:16,316,316,Foul on Kianna Ray.,66,66,0,20,0.5,TCU,Texas Tech,5,5,0,0,NA,401176901,2020-01-08,
338,4,4:56,296,296,Sydney Goodson missed Three Point Jumper.,66,66,0,4,0.5,TCU,Texas Tech,5,5,0,0,NA,401176901,2020-01-08,
339,4,4:52,292,292,Lauren Heard Defensive Rebound.,66,66,0,10,0.5,TCU,Texas Tech,5,5,0,0,NA,401176901,2020-01-08,
340,4,4:42,282,282,Lauren Heard missed Jumper.,66,66,0,4,0.5,TCU,Texas Tech,5,5,0,0,NA,401176901,2020-01-08,
341,4,4:38,278,278,Becky Obinma Offensive Rebound.,66,66,0,1,0.5,TCU,Texas Tech,5,5,0,0,NA,401176901,2020-01-08,
342,4,4:37,277,277,Becky Obinma missed Layup.,66,66,0,3,0.5,TCU,Texas Tech,5,5,0,0,NA,401176901,2020-01-08,
343,4,4:34,274,274,Lauren Heard Offensive Rebound.,66,66,0,1,0.5,TCU,Texas Tech,5,5,0,0,NA,401176901,2020-01-08,
344,4,4:33,273,273,Lauren Heard missed Layup.,66,66,0,0,0.5,TCU,Texas Tech,5,5,0,0,NA,401176901,2020-01-08,
345,4,4:33,273,273,Lexi Gordon Defensive Rebound.,66,66,0,0,0.5,TCU,Texas Tech,5,5,0,0,NA,401176901,2020-01-08,
346,4,4:33,273,273,Brittany Brewer Block.,66,66,0,19,0.5,TCU,Texas Tech,5,5,0,0,NA,401176901,2020-01-08,
347,4,4:14,254,254,Sydney Goodson made Three Point Jumper. Assisted by Jo'Nah Johnson.,66,69,-3,17,0.27862939480455234,TCU,Texas Tech,5,5,0,0,NA,401176901,2020-01-08,Texas Tech
348,4,3:57,237,237,Lauren Heard missed Layup.,66,69,-3,3,0.28037260169358347,TCU,Texas Tech,5,5,0,0,NA,401176901,2020-01-08,
349,4,3:54,234,234,Lexi Gordon Defensive Rebound.,66,69,-3,16,0.2803388643853599,TCU,Texas Tech,5,5,0,0,NA,401176901,2020-01-08,
350,4,3:38,218,218,Official TV Timeout,66,69,-3,8,0.27742226360008954,TCU,Texas Tech,5,5,0,0,NA,401176901,2020-01-08,
351,4,3:30,210,210,Jo'Nah Johnson made Layup.,66,71,-5,15,0.16439921313599767,TCU,Texas Tech,5,5,0,0,NA,401176901,2020-01-08,Texas Tech
352,4,3:15,195,195,Jayde Woods missed Layup.,66,71,-5,0,0.1511023522155627,TCU,Texas Tech,5,5,0,0,NA,401176901,2020-01-08,
353,4,3:15,195,195,Brittany Brewer Block.,66,71,-5,4,0.1511023522155627,TCU,Texas Tech,5,5,0,0,NA,401176901,2020-01-08,
354,4,3:11,191,191,Lexi Gordon Defensive Rebound.,66,71,-5,12,0.14631991722030271,TCU,Texas Tech,5,5,0,0,NA,401176901,2020-01-08,
355,4,2:59,179,179,Sydney Goodson Turnover.,66,71,-5,14,0.13131644412278606,TCU,Texas Tech,5,5,0,0,NA,401176901,2020-01-08,
356,4,2:45,165,165,Lauren Heard missed Three Point Jumper.,66,71,-5,3,0.11485064973591232,TCU,Texas Tech,5,5,0,0,NA,401176901,2020-01-08,
357,4,2:42,162,162,Texas Tech Defensive Rebound.,66,71,-5,15,0.11141996715172878,TCU,Texas Tech,5,5,0,0,NA,401176901,2020-01-08,
358,4,2:27,147,147,Chrislyn Carr missed Three Point Jumper.,66,71,-5,3,0.09460742290192886,TCU,Texas Tech,5,5,0,0,NA,401176901,2020-01-08,
359,4,2:24,144,144,Lauren Heard Defensive Rebound.,66,71,-5,6,0.09130221129211252,TCU,Texas Tech,5,5,0,0,NA,401176901,2020-01-08,
360,4,2:18,138,138,Kianna Ray missed Three Point Jumper.,66,71,-5,5,0.0847469889881244,TCU,Texas Tech,5,5,0,0,NA,401176901,2020-01-08,
361,4,2:13,133,133,Sydney Goodson Defensive Rebound.,66,71,-5,9,0.07934551404234692,TCU,Texas Tech,5,5,0,0,NA,401176901,2020-01-08,
362,4,2:04,124,124,Foul on Brittany Brewer.,66,71,-5,0,0.06979397361955415,TCU,Texas Tech,5,5,0,0,NA,401176901,2020-01-08,
363,4,2:04,124,124,Brittany Brewer Turnover.,66,71,-5,14,0.06979397361955415,TCU,Texas Tech,5,5,0,0,NA,401176901,2020-01-08,
364,4,1:50,110,110,Foul on Alexis Tucker.,66,71,-5,0,0.05554853897470652,TCU,Texas Tech,5,5,0,0,NA,401176901,2020-01-08,
365,4,1:50,110,110,Jayde Woods made Free Throw.,67,71,-4,0,0.09392056016255101,TCU,Texas Tech,5,5,0,0,NA,401176901,2020-01-08,TCU
366,4,1:50,110,110,Jayde Woods made Free Throw.,68,71,-3,9,0.15446418786755572,TCU,Texas Tech,5,5,0,0,NA,401176901,2020-01-08,TCU
367,4,1:41,101,101,Texas Tech  Timeout,68,71,-3,24,0.14107980589617802,TCU,Texas Tech,5,4,0,1,NA,401176901,2020-01-08,
368,4,1:17,77,77,Texas Tech  Turnover.,68,71,-3,13,0.10623023330074217,TCU,Texas Tech,5,4,0,1,NA,401176901,2020-01-08,
369,4,1:04,64,64,Lauren Heard made Layup.,70,71,-1,10,0.3152677899690926,TCU,Texas Tech,5,4,0,1,NA,401176901,2020-01-08,TCU
370,4,0:54,54,54,Chrislyn Carr made Three Point Jumper.,70,74,-4,11,0.03498561931302208,TCU,Texas Tech,5,4,0,1,NA,401176901,2020-01-08,Texas Tech
371,4,0:43,43,43,Lauren Heard missed Layup.,70,74,-4,3,0.02743885356912882,TCU,Texas Tech,5,4,0,1,NA,401176901,2020-01-08,
372,4,0:40,40,40,Alexis Tucker Defensive Rebound.,70,74,-4,1,0.025596908924922356,TCU,Texas Tech,5,4,0,0,NA,401176901,2020-01-08,
373,4,0:39,39,39,Foul on Jayde Woods.,70,74,-4,0,0.025003519105138164,TCU,Texas Tech,5,4,0,0,NA,401176901,2020-01-08,
374,4,0:39,39,39,Alexis Tucker missed Free Throw.,70,74,-4,0,0.025003519105138164,TCU,Texas Tech,5,4,0,0,NA,401176901,2020-01-08,
375,4,0:39,39,39,Texas Tech Deadball Team Rebound.,70,74,-4,0,0.025003519105138164,TCU,Texas Tech,5,4,0,0,NA,401176901,2020-01-08,
376,4,0:39,39,39,Alexis Tucker missed Free Throw.,70,74,-4,1,0.025003519105138164,TCU,Texas Tech,5,4,0,0,NA,401176901,2020-01-08,
377,4,0:38,38,38,Michelle Berry Defensive Rebound.,70,74,-4,0,0.024420448785884754,TCU,Texas Tech,5,4,1,0,NA,401176901,2020-01-08,
378,4,0:38,38,38,TCU  Timeout,70,74,-4,2,0.024420448785884754,TCU,Texas Tech,4,4,1,0,NA,401176901,2020-01-08,
379,4,0:36,36,36,Lauren Heard missed Jumper.,70,74,-4,2,0.023285253298483865,TCU,Texas Tech,4,4,1,0,NA,401176901,2020-01-08,
380,4,0:34,34,34,TCU Offensive Rebound.,70,74,-4,2,0.022191202811009055,TCU,Texas Tech,4,4,1,0,NA,401176901,2020-01-08,
381,4,0:32,32,32,Jaycee Bradley made Three Point Jumper. Assisted by Kianna Ray.,73,74,-1,8,0.27711268597415656,TCU,Texas Tech,4,4,1,0,NA,401176901,2020-01-08,TCU
382,4,0:24,24,24,Foul on Jayde Woods.,73,74,-1,0,0.26707099996022143,TCU,Texas Tech,4,4,1,0,NA,401176901,2020-01-08,
383,4,0:24,24,24,Lexi Gordon made Free Throw.,73,75,-2,0,0.11721533510379574,TCU,Texas Tech,4,4,1,0,NA,401176901,2020-01-08,Texas Tech
384,4,0:24,24,24,Lexi Gordon made Free Throw.,73,76,-3,1,0.04615028973410084,TCU,Texas Tech,4,4,1,0,NA,401176901,2020-01-08,Texas Tech
385,4,0:23,23,23,TCU  Timeout,73,76,-3,4,0.04530748007934808,TCU,Texas Tech,3,4,1,0,NA,401176901,2020-01-08,
386,4,0:19,19,19,Foul on Sydney Goodson.,73,76,-3,0,0.04202372636616275,TCU,Texas Tech,3,4,1,1,NA,401176901,2020-01-08,
387,4,0:19,19,19,Jayde Woods missed Free Throw.,73,76,-3,0,0.04202372636616275,TCU,Texas Tech,3,4,1,1,NA,401176901,2020-01-08,
388,4,0:19,19,19,TCU Deadball Team Rebound.,73,76,-3,0,0.04202372636616275,TCU,Texas Tech,3,4,1,1,NA,401176901,2020-01-08,
389,4,0:19,19,19,Jayde Woods made Free Throw.,74,76,-2,0,0.11062307552550993,TCU,Texas Tech,3,4,1,1,NA,401176901,2020-01-08,TCU
390,4,0:19,19,19,Texas Tech  Timeout,74,76,-2,3,0.11062307552550993,TCU,Texas Tech,3,3,1,1,NA,401176901,2020-01-08,
391,4,0:16,16,16,Foul on Jayde Woods.,74,76,-2,0,0.10671073666192735,TCU,Texas Tech,3,3,1,1,NA,401176901,2020-01-08,
392,4,0:16,16,16,Jo'Nah Johnson made Free Throw.,74,77,-3,0,0.039650907899848264,TCU,Texas Tech,3,3,1,1,NA,401176901,2020-01-08,Texas Tech
393,4,0:16,16,16,Jo'Nah Johnson made Free Throw.,74,78,-4,5,0.014069488685686617,TCU,Texas Tech,3,3,1,1,NA,401176901,2020-01-08,Texas Tech
394,4,0:11,11,11,Foul on Lauren Heard.,74,78,-4,0,0.012275550504750075,TCU,Texas Tech,3,3,1,1,NA,401176901,2020-01-08,
395,4,0:11,11,11,Lauren Heard Turnover.,74,78,-4,0,0.012275550504750075,TCU,Texas Tech,3,3,1,1,NA,401176901,2020-01-08,
396,4,0:11,11,11,Texas Tech  Timeout,74,78,-4,1,0.012275550504750075,TCU,Texas Tech,3,2,1,1,NA,401176901,2020-01-08,
397,4,0:10,10,10,Foul on Lauren Heard.,74,78,-4,0,0.0119391858379318,TCU,Texas Tech,3,2,1,1,NA,401176901,2020-01-08,
398,4,0:10,10,10,Chrislyn Carr made Free Throw.,74,79,-5,0,0.003990270855850142,TCU,Texas Tech,3,2,1,1,NA,401176901,2020-01-08,Texas Tech
399,4,0:10,10,10,Chrislyn Carr made Free Throw.,74,80,-6,0,0.0013265086209420347,TCU,Texas Tech,3,2,1,1,NA,401176901,2020-01-08,Texas Tech
400,4,0:10,10,10,TCU  Timeout,74,80,-6,4,0.0013265086209420347,TCU,Texas Tech,2,2,1,1,NA,401176901,2020-01-08,
