play_id,period,time_remaining_period,secs_remaining,secs_remaining_absolute,description,home_score,away_score,score_diff,play_length,win_prob,home,away,home_time_out_remaining,away_time_out_remaining,home_timeout_ind,away_timeout_ind,home_favored_by,game_id,date,whichScored
1,1,9:42,2682,2682,Haley Green missed Layup.,0,0,0,0,NA,Brown,Maine,4,4,0,0,NA,401175503,2019-11-11,NA
2,1,9:42,2682,2682,Blanca Millan Defensive Rebound.,0,0,0,18,NA,Brown,Maine,4,4,0,0,NA,401175503,2019-11-11,
3,1,9:24,2664,2664,Foul on Maddie Mullin.,0,0,0,20,NA,Brown,Maine,4,4,0,0,NA,401175503,2019-11-11,
4,1,9:04,2644,2644,Blanca Millan missed Three Point Jumper.,0,0,0,0,NA,Brown,Maine,4,4,0,0,NA,401175503,2019-11-11,
5,1,9:04,2644,2644,Fiona Finn Defensive Rebound.,0,0,0,9,NA,Brown,Maine,4,4,0,0,NA,401175503,2019-11-11,
6,1,8:55,2635,2635,Justine Gaziano missed Layup.,0,0,0,0,NA,Brown,Maine,4,4,0,0,NA,401175503,2019-11-11,
7,1,8:55,2635,2635,Maeve Carroll Defensive Rebound.,0,0,0,3,NA,Brown,Maine,4,4,0,0,NA,401175503,2019-11-11,
8,1,8:52,2632,2632,Maeve Carroll Turnover.,0,0,0,0,NA,Brown,Maine,4,4,0,0,NA,401175503,2019-11-11,
9,1,8:52,2632,2632,Dominique Leonidas Steal.,0,0,0,1,NA,Brown,Maine,4,4,0,0,NA,401175503,2019-11-11,
10,1,8:51,2631,2631,Foul on Maeve Carroll.,0,0,0,0,NA,Brown,Maine,4,4,0,0,NA,401175503,2019-11-11,
11,1,8:51,2631,2631,Dominique Leonidas made Free Throw.,1,0,1,0,NA,Brown,Maine,4,4,0,0,NA,401175503,2019-11-11,Brown
12,1,8:51,2631,2631,Dominique Leonidas made Free Throw.,2,0,2,24,NA,Brown,Maine,4,4,0,0,NA,401175503,2019-11-11,Brown
13,1,8:27,2607,2607,Anne Simon missed Three Point Jumper.,2,0,2,0,NA,Brown,Maine,4,4,0,0,NA,401175503,2019-11-11,
14,1,8:27,2607,2607,Maddy McVicar Offensive Rebound.,2,0,2,13,NA,Brown,Maine,4,4,0,0,NA,401175503,2019-11-11,
15,1,8:14,2594,2594,Anne Simon made Layup. Assisted by Maeve Carroll.,2,2,0,26,NA,Brown,Maine,4,4,0,0,NA,401175503,2019-11-11,Maine
16,1,7:48,2568,2568,Justine Gaziano missed Layup.,2,2,0,0,NA,Brown,Maine,4,4,0,0,NA,401175503,2019-11-11,
17,1,7:48,2568,2568,Anne Simon Defensive Rebound.,2,2,0,9,NA,Brown,Maine,4,4,0,0,NA,401175503,2019-11-11,
18,1,7:39,2559,2559,Dor Saar missed Three Point Jumper.,2,2,0,0,NA,Brown,Maine,4,4,0,0,NA,401175503,2019-11-11,
19,1,7:39,2559,2559,Haley Green Defensive Rebound.,2,2,0,19,NA,Brown,Maine,4,4,0,0,NA,401175503,2019-11-11,
20,1,7:20,2540,2540,Justine Gaziano missed Jumper.,2,2,0,0,NA,Brown,Maine,4,4,0,0,NA,401175503,2019-11-11,
21,1,7:20,2540,2540,Blanca Millan Defensive Rebound.,2,2,0,19,NA,Brown,Maine,4,4,0,0,NA,401175503,2019-11-11,
22,1,7:01,2521,2521,Maddy McVicar missed Three Point Jumper.,2,2,0,0,NA,Brown,Maine,4,4,0,0,NA,401175503,2019-11-11,
23,1,7:01,2521,2521,Fiona Finn Defensive Rebound.,2,2,0,19,NA,Brown,Maine,4,4,0,0,NA,401175503,2019-11-11,
24,1,6:42,2502,2502,Maddie Mullin missed Three Point Jumper.,2,2,0,0,NA,Brown,Maine,4,4,0,0,NA,401175503,2019-11-11,
25,1,6:42,2502,2502,Maine Defensive Rebound.,2,2,0,13,NA,Brown,Maine,4,4,0,0,NA,401175503,2019-11-11,
26,1,6:29,2489,2489,Anne Simon missed Three Point Jumper.,2,2,0,0,NA,Brown,Maine,4,4,0,0,NA,401175503,2019-11-11,
27,1,6:29,2489,2489,Haley Green Defensive Rebound.,2,2,0,19,NA,Brown,Maine,4,4,0,0,NA,401175503,2019-11-11,
28,1,6:10,2470,2470,Haley Green missed Layup.,2,2,0,0,NA,Brown,Maine,4,4,0,0,NA,401175503,2019-11-11,
29,1,6:10,2470,2470,Blanca Millan Defensive Rebound.,2,2,0,7,NA,Brown,Maine,4,4,0,0,NA,401175503,2019-11-11,
30,1,6:03,2463,2463,Dor Saar missed Three Point Jumper.,2,2,0,0,NA,Brown,Maine,4,4,0,0,NA,401175503,2019-11-11,
31,1,6:03,2463,2463,Dominique Leonidas Defensive Rebound.,2,2,0,13,NA,Brown,Maine,4,4,0,0,NA,401175503,2019-11-11,
32,1,5:50,2450,2450,Haley Green made Layup. Assisted by Dominique Leonidas.,4,2,2,22,NA,Brown,Maine,4,4,0,0,NA,401175503,2019-11-11,Brown
33,1,5:28,2428,2428,Kira Barra made Jumper.,4,4,0,35,NA,Brown,Maine,4,4,0,0,NA,401175503,2019-11-11,Maine
34,1,4:53,2393,2393,Haley Green made Jumper. Assisted by Fiona Finn.,6,4,2,11,0.5441731217270256,Brown,Maine,4,4,0,0,NA,401175503,2019-11-11,Brown
35,1,4:42,2382,2382,Foul on Haley Green.,6,4,2,0,0.5444053698559008,Brown,Maine,4,4,0,0,NA,401175503,2019-11-11,
36,1,4:42,2382,2382,Official TV Timeout,6,4,2,0,0.5444053698559008,Brown,Maine,4,4,0,0,NA,401175503,2019-11-11,
37,1,4:42,2382,2382,Blanca Millan made Free Throw.,6,5,1,0,0.5222466385109157,Brown,Maine,4,4,0,0,NA,401175503,2019-11-11,Maine
38,1,4:42,2382,2382,Blanca Millan missed Free Throw.,6,5,1,0,0.5222466385109157,Brown,Maine,4,4,0,0,NA,401175503,2019-11-11,
39,1,4:42,2382,2382,McKenna Dale Defensive Rebound.,6,5,1,30,0.5222466385109157,Brown,Maine,4,4,0,0,NA,401175503,2019-11-11,
40,1,4:12,2352,2352,McKenna Dale missed Jumper.,6,5,1,0,0.5225696534786984,Brown,Maine,4,4,0,0,NA,401175503,2019-11-11,
41,1,4:12,2352,2352,Kira Barra Defensive Rebound.,6,5,1,21,0.5225696534786984,Brown,Maine,4,4,0,0,NA,401175503,2019-11-11,
42,1,3:51,2331,2331,Dor Saar Turnover.,6,5,1,1,0.5227993357199084,Brown,Maine,4,4,0,0,NA,401175503,2019-11-11,
43,1,3:50,2330,2330,McKenna Dale Steal.,6,5,1,4,0.5228103413139579,Brown,Maine,4,4,0,0,NA,401175503,2019-11-11,
44,1,3:46,2326,2326,Ashley Ducharme made Layup. Assisted by McKenna Dale.,8,5,3,0,0.5681836522816094,Brown,Maine,4,4,0,0,NA,401175503,2019-11-11,Brown
45,1,3:46,2326,2326,Foul on Blanca Millan.,8,5,3,0,0.5681836522816094,Brown,Maine,4,4,0,0,NA,401175503,2019-11-11,
46,1,3:46,2326,2326,Ashley Ducharme missed Free Throw.,8,5,3,0,0.5681836522816094,Brown,Maine,4,4,0,0,NA,401175503,2019-11-11,
47,1,3:46,2326,2326,Anne Simon Defensive Rebound.,8,5,3,13,0.5681836522816094,Brown,Maine,4,4,0,0,NA,401175503,2019-11-11,
48,1,3:33,2313,2313,Blanca Millan missed Three Point Jumper.,8,5,3,0,0.5686081994672192,Brown,Maine,4,4,0,0,NA,401175503,2019-11-11,
49,1,3:33,2313,2313,Ashley Ducharme Defensive Rebound.,8,5,3,11,0.5686081994672192,Brown,Maine,4,4,0,0,NA,401175503,2019-11-11,
50,1,3:22,2302,2302,Sydney Rosant Turnover.,8,5,3,23,0.5689695343354628,Brown,Maine,4,4,0,0,NA,401175503,2019-11-11,
51,1,2:59,2279,2279,Maddy McVicar made Layup. Assisted by Kira Barra.,8,7,1,18,0.5233790149705406,Brown,Maine,4,4,0,0,NA,401175503,2019-11-11,Maine
52,1,2:41,2261,2261,McKenna Dale missed Jumper.,8,7,1,0,0.523582801702291,Brown,Maine,4,4,0,0,NA,401175503,2019-11-11,
53,1,2:41,2261,2261,Kelly Fogarty Defensive Rebound.,8,7,1,9,0.523582801702291,Brown,Maine,4,4,0,0,NA,401175503,2019-11-11,
54,1,2:32,2252,2252,Kelly Fogarty missed Three Point Jumper.,8,7,1,0,0.523685214139179,Brown,Maine,4,4,0,0,NA,401175503,2019-11-11,
55,1,2:32,2252,2252,Dani Short Defensive Rebound.,8,7,1,4,0.523685214139179,Brown,Maine,4,4,0,0,NA,401175503,2019-11-11,
56,1,2:28,2248,2248,Foul on Maddy McVicar.,8,7,1,16,0.5237308347779365,Brown,Maine,4,4,0,0,NA,401175503,2019-11-11,
57,1,2:12,2232,2232,Dani Short missed Layup.,8,7,1,0,0.5239139165975408,Brown,Maine,4,4,0,0,NA,401175503,2019-11-11,
58,1,2:12,2232,2232,Ashley Ducharme Offensive Rebound.,8,7,1,5,0.5239139165975408,Brown,Maine,4,4,0,0,NA,401175503,2019-11-11,
59,1,2:07,2227,2227,McKenna Dale made Layup.,10,7,3,31,0.5714761792196995,Brown,Maine,4,4,0,0,NA,401175503,2019-11-11,Brown
60,1,1:36,2196,2196,Maddy McVicar made Jumper.,10,9,1,8,0.5243288962666488,Brown,Maine,4,4,0,0,NA,401175503,2019-11-11,Maine
61,1,1:28,2188,2188,Foul on Kelly Fogarty.,10,9,1,22,0.5244215939560287,Brown,Maine,4,4,0,0,NA,401175503,2019-11-11,
62,1,1:06,2166,2166,Justine Gaziano missed Three Point Jumper.,10,9,1,0,0.5246772372197134,Brown,Maine,4,4,0,0,NA,401175503,2019-11-11,
63,1,1:06,2166,2166,Maddie Mullin Offensive Rebound.,10,9,1,4,0.5246772372197134,Brown,Maine,4,4,0,0,NA,401175503,2019-11-11,
64,1,1:02,2162,2162,Foul on Kelly Fogarty.,10,9,1,0,0.5247238603202675,Brown,Maine,4,4,0,0,NA,401175503,2019-11-11,
65,1,1:02,2162,2162,Maddie Mullin made Free Throw.,11,9,2,0,0.5493271120496106,Brown,Maine,4,4,0,0,NA,401175503,2019-11-11,Brown
66,1,1:02,2162,2162,Maddie Mullin made Free Throw.,12,9,3,19,0.5736914885964052,Brown,Maine,4,4,0,0,NA,401175503,2019-11-11,Brown
67,1,0:43,2143,2143,Blanca Millan made Layup.,12,11,1,17,0.5249461795358079,Brown,Maine,4,4,0,0,NA,401175503,2019-11-11,Maine
68,1,0:26,2126,2126,Dominique Leonidas Turnover.,12,11,1,2,0.5251463699997507,Brown,Maine,4,4,0,0,NA,401175503,2019-11-11,
69,1,0:24,2124,2124,Blanca Millan Steal.,12,11,1,3,0.5251700049830281,Brown,Maine,4,4,0,0,NA,401175503,2019-11-11,
70,1,0:21,2121,2121,Anne Simon made Layup. Assisted by Blanca Millan.,12,13,-1,20,0.4747945087762299,Brown,Maine,4,4,0,0,NA,401175503,2019-11-11,Maine
71,1,0:01,2101,2101,Maddie Mullin missed Three Point Jumper.,12,13,-1,0,0.47455686567115635,Brown,Maine,4,4,0,0,NA,401175503,2019-11-11,
72,1,0:01,2101,2101,Dor Saar Block.,12,13,-1,0,0.47455686567115635,Brown,Maine,4,4,0,0,NA,401175503,2019-11-11,
73,1,0:01,2101,2101,Brown Offensive Rebound.,12,13,-1,1,0.47455686567115635,Brown,Maine,4,4,0,0,NA,401175503,2019-11-11,
74,1,0:00,2100,2100,End of 1st Quarter,12,13,-1,12,0.4745449333195799,Brown,Maine,4,4,0,0,NA,401175503,2019-11-11,
75,2,9:48,2088,2088,Dor Saar missed Three Point Jumper.,12,13,-1,0,0.4744013575865731,Brown,Maine,4,4,0,0,NA,401175503,2019-11-11,
76,2,9:48,2088,2088,Alana Kelley Defensive Rebound.,12,13,-1,13,0.4744013575865731,Brown,Maine,4,4,0,0,NA,401175503,2019-11-11,
77,2,9:35,2075,2075,Alana Kelley Turnover.,12,13,-1,1,0.4742449858824665,Brown,Maine,4,4,0,0,NA,401175503,2019-11-11,
78,2,9:34,2074,2074,Anne Simon Steal.,12,13,-1,2,0.47423292044484744,Brown,Maine,4,4,0,0,NA,401175503,2019-11-11,
79,2,9:32,2072,2072,Anne Simon made Layup.,12,15,-3,26,0.42317096496634965,Brown,Maine,4,4,0,0,NA,401175503,2019-11-11,Maine
80,2,9:06,2046,2046,Alana Kelley missed Layup.,12,15,-3,0,0.4222433575306089,Brown,Maine,4,4,0,0,NA,401175503,2019-11-11,
81,2,9:06,2046,2046,Blanca Millan Block.,12,15,-3,3,0.4222433575306089,Brown,Maine,4,4,0,0,NA,401175503,2019-11-11,
82,2,9:03,2043,2043,Maddie Mullin Offensive Rebound.,12,15,-3,4,0.42213562993400006,Brown,Maine,4,4,0,0,NA,401175503,2019-11-11,
83,2,8:59,2039,2039,Dominique Leonidas made Three Point Jumper. Assisted by Haley Green.,15,15,0,17,0.5,Brown,Maine,4,4,0,0,NA,401175503,2019-11-11,Brown
84,2,8:42,2022,2022,Kira Barra missed Jumper.,15,15,0,0,0.5,Brown,Maine,4,4,0,0,NA,401175503,2019-11-11,
85,2,8:42,2022,2022,Alana Kelley Defensive Rebound.,15,15,0,8,0.5,Brown,Maine,4,4,0,0,NA,401175503,2019-11-11,
86,2,8:34,2014,2014,Justine Gaziano Turnover.,15,15,0,21,0.5,Brown,Maine,4,4,0,0,NA,401175503,2019-11-11,
87,2,8:13,1993,1993,Blanca Millan missed Layup.,15,15,0,0,0.5,Brown,Maine,4,4,0,0,NA,401175503,2019-11-11,
88,2,8:13,1993,1993,Justine Gaziano Block.,15,15,0,1,0.5,Brown,Maine,4,4,0,0,NA,401175503,2019-11-11,
89,2,8:12,1992,1992,Justine Gaziano Defensive Rebound.,15,15,0,14,0.5,Brown,Maine,4,4,0,0,NA,401175503,2019-11-11,
90,2,7:58,1978,1978,Haley Green missed Layup.,15,15,0,0,0.5,Brown,Maine,4,4,0,0,NA,401175503,2019-11-11,
91,2,7:58,1978,1978,Maddie Mullin Offensive Rebound.,15,15,0,13,0.5,Brown,Maine,4,4,0,0,NA,401175503,2019-11-11,
92,2,7:45,1965,1965,Dominique Leonidas made Three Point Jumper.,18,15,3,25,0.5807212993400245,Brown,Maine,4,4,0,0,NA,401175503,2019-11-11,Brown
93,2,7:20,1940,1940,Blanca Millan missed Jumper.,18,15,3,0,0.5816620089641811,Brown,Maine,4,4,0,0,NA,401175503,2019-11-11,
94,2,7:20,1940,1940,Dominique Leonidas Defensive Rebound.,18,15,3,12,0.5816620089641811,Brown,Maine,4,4,0,0,NA,401175503,2019-11-11,
95,2,7:08,1928,1928,Dominique Leonidas Turnover.,18,15,3,2,0.5821182135536915,Brown,Maine,4,4,0,0,NA,401175503,2019-11-11,
96,2,7:06,1926,1926,Blanca Millan Steal.,18,15,3,4,0.5821943825929489,Brown,Maine,4,4,0,0,NA,401175503,2019-11-11,
97,2,7:02,1922,1922,Blanca Millan Turnover.,18,15,3,0,0.5823466298874674,Brown,Maine,4,4,0,0,NA,401175503,2019-11-11,
98,2,7:02,1922,1922,Foul on Blanca Millan.,18,15,3,23,0.5823466298874674,Brown,Maine,4,4,0,0,NA,401175503,2019-11-11,
99,2,6:39,1899,1899,Justine Gaziano made Layup.,20,15,5,25,0.6364554532588337,Brown,Maine,4,4,0,0,NA,401175503,2019-11-11,Brown
100,2,6:14,1874,1874,Maddy McVicar missed Layup.,20,15,5,0,0.6379599759143958,Brown,Maine,4,4,0,0,NA,401175503,2019-11-11,
101,2,6:14,1874,1874,Dor Saar Offensive Rebound.,20,15,5,12,0.6379599759143958,Brown,Maine,4,4,0,0,NA,401175503,2019-11-11,
102,2,6:02,1862,1862,Dor Saar missed Three Point Jumper.,20,15,5,0,0.6386826300238404,Brown,Maine,4,4,0,0,NA,401175503,2019-11-11,
103,2,6:02,1862,1862,Brown Defensive Rebound.,20,15,5,21,0.6386826300238404,Brown,Maine,4,4,0,0,NA,401175503,2019-11-11,
104,2,5:41,1841,1841,Sydney Rosant missed Three Point Jumper.,20,15,5,0,0.6399504143194021,Brown,Maine,4,4,0,0,NA,401175503,2019-11-11,
105,2,5:41,1841,1841,Dor Saar Defensive Rebound.,20,15,5,8,0.6399504143194021,Brown,Maine,4,4,0,0,NA,401175503,2019-11-11,
106,2,5:33,1833,1833,Anne Simon made Three Point Jumper. Assisted by Blanca Millan.,20,18,2,19,0.5574701533934427,Brown,Maine,4,4,0,0,NA,401175503,2019-11-11,Maine
107,2,5:14,1814,1814,Dominique Leonidas missed Jumper.,20,18,2,0,0.5579657678184325,Brown,Maine,4,4,0,0,NA,401175503,2019-11-11,
108,2,5:14,1814,1814,Blanca Millan Defensive Rebound.,20,18,2,2,0.5579657678184325,Brown,Maine,4,4,0,0,NA,401175503,2019-11-11,
109,2,5:12,1812,1812,Foul on Ashley Ducharme.,20,18,2,16,0.5580181787143008,Brown,Maine,4,4,0,0,NA,401175503,2019-11-11,
110,2,4:56,1796,1796,Blanca Millan missed Jumper.,20,18,2,0,0.5584393901063835,Brown,Maine,4,4,0,0,NA,401175503,2019-11-11,
111,2,4:56,1796,1796,Anne Simon Offensive Rebound.,20,18,2,3,0.5584393901063835,Brown,Maine,4,4,0,0,NA,401175503,2019-11-11,
112,2,4:53,1793,1793,Anne Simon made Layup.,20,20,0,19,0.5,Brown,Maine,4,4,0,0,NA,401175503,2019-11-11,Maine
113,2,4:34,1774,1774,Traiva Breedlove made Jumper.,22,20,2,0,0.5590249941065785,Brown,Maine,4,4,0,0,NA,401175503,2019-11-11,Brown
114,2,4:34,1774,1774,Foul on Blanca Millan.,22,20,2,0,0.5590249941065785,Brown,Maine,4,4,0,0,NA,401175503,2019-11-11,
115,2,4:34,1774,1774,Official TV Timeout,22,20,2,0,0.5590249941065785,Brown,Maine,4,4,0,0,NA,401175503,2019-11-11,
116,2,4:34,1774,1774,Traiva Breedlove made Free Throw.,23,20,3,19,0.588025528980471,Brown,Maine,4,4,0,0,NA,401175503,2019-11-11,Brown
117,2,4:15,1755,1755,Maddy McVicar Turnover.,23,20,3,0,0.5887814245953087,Brown,Maine,4,4,0,0,NA,401175503,2019-11-11,
118,2,4:15,1755,1755,Foul on Maddy McVicar.,23,20,3,14,0.5887814245953087,Brown,Maine,4,4,0,0,NA,401175503,2019-11-11,
119,2,4:01,1741,1741,Justine Gaziano missed Three Point Jumper.,23,20,3,0,0.5893454354779577,Brown,Maine,4,4,0,0,NA,401175503,2019-11-11,
120,2,4:01,1741,1741,Dani Short Offensive Rebound.,23,20,3,13,0.5893454354779577,Brown,Maine,4,4,0,0,NA,401175503,2019-11-11,
121,2,3:48,1728,1728,Traiva Breedlove missed Jumper.,23,20,3,0,0.589875104555613,Brown,Maine,4,4,0,0,NA,401175503,2019-11-11,
122,2,3:48,1728,1728,Anna Kahelin Defensive Rebound.,23,20,3,16,0.589875104555613,Brown,Maine,4,4,0,0,NA,401175503,2019-11-11,
123,2,3:32,1712,1712,Anne Simon missed Layup.,23,20,3,0,0.5905356029662491,Brown,Maine,4,4,0,0,NA,401175503,2019-11-11,
124,2,3:32,1712,1712,Justine Gaziano Defensive Rebound.,23,20,3,18,0.5905356029662491,Brown,Maine,4,4,0,0,NA,401175503,2019-11-11,
125,2,3:14,1694,1694,Sydney Rosant missed Jumper.,23,20,3,0,0.5912910677892184,Brown,Maine,4,4,0,0,NA,401175503,2019-11-11,
126,2,3:14,1694,1694,Anna Kahelin Defensive Rebound.,23,20,3,22,0.5912910677892184,Brown,Maine,4,4,0,0,NA,401175503,2019-11-11,
127,2,2:52,1672,1672,Maddy McVicar missed Three Point Jumper.,23,20,3,0,0.5922158283952779,Brown,Maine,4,4,0,0,NA,401175503,2019-11-11,
128,2,2:52,1672,1672,Maeve Carroll Offensive Rebound.,23,20,3,24,0.5922158283952779,Brown,Maine,4,4,0,0,NA,401175503,2019-11-11,
129,2,2:28,1648,1648,Maeve Carroll Turnover.,23,20,3,21,0.5931948659768457,Brown,Maine,4,4,0,0,NA,401175503,2019-11-11,
130,2,2:07,1627,1627,McKenna Dale made Jumper. Assisted by Haley Green.,25,20,5,17,0.6534961239306544,Brown,Maine,4,4,0,0,NA,401175503,2019-11-11,Brown
131,2,1:50,1610,1610,Maeve Carroll made Jumper. Assisted by Anne Simon.,25,22,3,14,0.5947057086200391,Brown,Maine,4,4,0,0,NA,401175503,2019-11-11,Maine
132,2,1:36,1596,1596,McKenna Dale missed Layup.,25,22,3,0,0.5952575645806943,Brown,Maine,4,4,0,0,NA,401175503,2019-11-11,
133,2,1:36,1596,1596,Maeve Carroll Defensive Rebound.,25,22,3,22,0.5952575645806943,Brown,Maine,4,4,0,0,NA,401175503,2019-11-11,
134,2,1:14,1574,1574,Anna Kahelin missed Jumper.,25,22,3,0,0.5961273640994997,Brown,Maine,4,4,0,0,NA,401175503,2019-11-11,
135,2,1:14,1574,1574,Fiona Finn Defensive Rebound.,25,22,3,7,0.5961273640994997,Brown,Maine,4,4,0,0,NA,401175503,2019-11-11,
136,2,1:07,1567,1567,McKenna Dale missed Three Point Jumper.,25,22,3,0,0.5964059410488348,Brown,Maine,4,4,0,0,NA,401175503,2019-11-11,
137,2,1:07,1567,1567,Dor Saar Defensive Rebound.,25,22,3,4,0.5964059410488348,Brown,Maine,4,4,0,0,NA,401175503,2019-11-11,
138,2,1:03,1563,1563,Foul on Maddie Mullin.,25,22,3,8,0.5965657150536677,Brown,Maine,4,4,0,0,NA,401175503,2019-11-11,
139,2,0:55,1555,1555,Foul on Dominique Leonidas.,25,22,3,4,0.5968867852149757,Brown,Maine,4,4,0,0,NA,401175503,2019-11-11,
140,2,0:51,1551,1551,Maeve Carroll missed Jumper.,25,22,3,0,0.5970481827825538,Brown,Maine,4,4,0,0,NA,401175503,2019-11-11,
141,2,0:51,1551,1551,Anna Kahelin Offensive Rebound.,25,22,3,6,0.5970481827825538,Brown,Maine,4,4,0,0,NA,401175503,2019-11-11,
142,2,0:45,1545,1545,Anna Kahelin made Layup.,25,24,1,25,0.5328021763907467,Brown,Maine,4,4,0,0,NA,401175503,2019-11-11,Maine
143,2,0:20,1520,1520,McKenna Dale Turnover.,25,24,1,16,0.5331587078810258,Brown,Maine,4,4,0,0,NA,401175503,2019-11-11,
144,2,0:04,1504,1504,Dor Saar made Jumper.,25,26,-1,4,0.46660591743049,Brown,Maine,4,4,0,0,NA,401175503,2019-11-11,Maine
145,2,0:00,1500,1500,End of 2nd Quarter,25,26,-1,19,0.4665460318608259,Brown,Maine,4,4,0,0,NA,401175503,2019-11-11,
146,3,9:41,1481,1481,Ashley Ducharme Turnover.,25,26,-1,11,0.4662551054303592,Brown,Maine,5,5,0,0,NA,401175503,2019-11-11,
147,3,9:30,1470,1470,Blanca Millan missed Layup.,25,26,-1,0,0.4660812760896584,Brown,Maine,5,5,0,0,NA,401175503,2019-11-11,
148,3,9:30,1470,1470,Haley Green Defensive Rebound.,25,26,-1,25,0.4660812760896584,Brown,Maine,5,5,0,0,NA,401175503,2019-11-11,
149,3,9:05,1445,1445,Ashley Ducharme missed Layup.,25,26,-1,0,0.4656702381832101,Brown,Maine,5,5,0,0,NA,401175503,2019-11-11,
150,3,9:05,1445,1445,Maeve Carroll Defensive Rebound.,25,26,-1,16,0.4656702381832101,Brown,Maine,5,5,0,0,NA,401175503,2019-11-11,
151,3,8:49,1429,1429,Maeve Carroll made Layup.,25,28,-3,9,0.39753319380561847,Brown,Maine,5,5,0,0,NA,401175503,2019-11-11,Maine
152,3,8:40,1420,1420,Foul on Anne Simon.,25,28,-3,1,0.3971189796612946,Brown,Maine,5,5,0,0,NA,401175503,2019-11-11,
153,3,8:39,1419,1419,Maddie Mullin made Three Point Jumper. Assisted by Dominique Leonidas.,28,28,0,14,0.5,Brown,Maine,5,5,0,0,NA,401175503,2019-11-11,Brown
154,3,8:25,1405,1405,Maeve Carroll missed Layup.,28,28,0,0,0.5,Brown,Maine,5,5,0,0,NA,401175503,2019-11-11,
155,3,8:25,1405,1405,Haley Green Defensive Rebound.,28,28,0,10,0.5,Brown,Maine,5,5,0,0,NA,401175503,2019-11-11,
156,3,8:15,1395,1395,Foul on Dor Saar.,28,28,0,10,0.5,Brown,Maine,5,5,0,0,NA,401175503,2019-11-11,
157,3,8:05,1385,1385,Justine Gaziano missed Three Point Jumper.,28,28,0,0,0.5,Brown,Maine,5,5,0,0,NA,401175503,2019-11-11,
158,3,8:05,1385,1385,Maeve Carroll Defensive Rebound.,28,28,0,14,0.5,Brown,Maine,5,5,0,0,NA,401175503,2019-11-11,
159,3,7:51,1371,1371,Foul on McKenna Dale.,28,28,0,1,0.5,Brown,Maine,5,5,0,0,NA,401175503,2019-11-11,
160,3,7:50,1370,1370,Foul on Justine Gaziano.,28,28,0,19,0.5,Brown,Maine,5,5,0,0,NA,401175503,2019-11-11,
161,3,7:31,1351,1351,Blanca Millan missed Jumper.,28,28,0,0,0.5,Brown,Maine,5,5,0,0,NA,401175503,2019-11-11,
162,3,7:31,1351,1351,Maddy McVicar Offensive Rebound.,28,28,0,11,0.5,Brown,Maine,5,5,0,0,NA,401175503,2019-11-11,
163,3,7:20,1340,1340,Maeve Carroll Turnover.,28,28,0,20,0.5,Brown,Maine,5,5,0,0,NA,401175503,2019-11-11,
164,3,7:00,1320,1320,Dominique Leonidas made Layup.,30,28,2,16,0.5721700508603711,Brown,Maine,5,5,0,0,NA,401175503,2019-11-11,Brown
165,3,6:44,1304,1304,Maddy McVicar Turnover.,30,28,2,2,0.5726746804509937,Brown,Maine,5,5,0,0,NA,401175503,2019-11-11,
166,3,6:42,1302,1302,McKenna Dale Steal.,30,28,2,2,0.572738808810413,Brown,Maine,5,5,0,0,NA,401175503,2019-11-11,
167,3,6:40,1300,1300,McKenna Dale Turnover.,30,28,2,1,0.5728031960130557,Brown,Maine,5,5,0,0,NA,401175503,2019-11-11,
168,3,6:39,1299,1299,Maeve Carroll Steal.,30,28,2,7,0.5728354890781201,Brown,Maine,5,5,0,0,NA,401175503,2019-11-11,
169,3,6:32,1292,1292,Blanca Millan made Layup.,30,30,0,0,0.5,Brown,Maine,5,5,0,0,NA,401175503,2019-11-11,Maine
170,3,6:32,1292,1292,Foul on McKenna Dale.,30,30,0,0,0.5,Brown,Maine,5,5,0,0,NA,401175503,2019-11-11,
171,3,6:32,1292,1292,Blanca Millan made Free Throw.,30,31,-1,22,0.46327112992974984,Brown,Maine,5,5,0,0,NA,401175503,2019-11-11,Maine
172,3,6:10,1270,1270,Dominique Leonidas Turnover.,30,31,-1,2,0.46289412358034326,Brown,Maine,5,5,0,0,NA,401175503,2019-11-11,
173,3,6:08,1268,1268,Blanca Millan Steal.,30,31,-1,9,0.46285875849315894,Brown,Maine,5,5,0,0,NA,401175503,2019-11-11,
174,3,5:59,1259,1259,Maeve Carroll missed Layup.,30,31,-1,0,0.4626970978351408,Brown,Maine,5,5,0,0,NA,401175503,2019-11-11,
175,3,5:59,1259,1259,McKenna Dale Block.,30,31,-1,2,0.4626970978351408,Brown,Maine,5,5,0,0,NA,401175503,2019-11-11,
176,3,5:57,1257,1257,Maddie Mullin Defensive Rebound.,30,31,-1,11,0.4626605904634737,Brown,Maine,5,5,0,0,NA,401175503,2019-11-11,
177,3,5:46,1246,1246,McKenna Dale missed Three Point Jumper.,30,31,-1,0,0.4624557558345676,Brown,Maine,5,5,0,0,NA,401175503,2019-11-11,
178,3,5:46,1246,1246,Maeve Carroll Defensive Rebound.,30,31,-1,7,0.4624557558345676,Brown,Maine,5,5,0,0,NA,401175503,2019-11-11,
179,3,5:39,1239,1239,Blanca Millan missed Layup.,30,31,-1,0,0.46232163818367367,Brown,Maine,5,5,0,0,NA,401175503,2019-11-11,
180,3,5:39,1239,1239,McKenna Dale Block.,30,31,-1,1,0.46232163818367367,Brown,Maine,5,5,0,0,NA,401175503,2019-11-11,
181,3,5:38,1238,1238,Blanca Millan Offensive Rebound.,30,31,-1,5,0.4623022268951036,Brown,Maine,5,5,0,0,NA,401175503,2019-11-11,
182,3,5:33,1233,1233,Maine  Timeout,30,31,-1,18,0.4622041951435076,Brown,Maine,4,5,1,0,NA,401175503,2019-11-11,
183,3,5:15,1215,1215,Kelly Fogarty made Three Point Jumper. Assisted by Dor Saar.,30,34,-4,21,0.3516492336814199,Brown,Maine,4,5,1,0,NA,401175503,2019-11-11,Maine
184,3,4:54,1194,1194,Sydney Rosant made Three Point Jumper.,33,34,-1,23,0.4613935684682938,Brown,Maine,4,5,1,0,NA,401175503,2019-11-11,Brown
185,3,4:31,1171,1171,Kelly Fogarty made Three Point Jumper. Assisted by Dor Saar.,33,37,-4,19,0.3483098638399503,Brown,Maine,4,5,0,0,NA,401175503,2019-11-11,Maine
186,3,4:12,1152,1152,Dani Short Turnover.,33,37,-4,0,0.34693040760898664,Brown,Maine,4,5,0,0,NA,401175503,2019-11-11,
187,3,4:12,1152,1152,Official TV Timeout,33,37,-4,23,0.34693040760898664,Brown,Maine,4,5,0,0,NA,401175503,2019-11-11,
188,3,3:49,1129,1129,Dor Saar missed Three Point Jumper.,33,37,-4,0,0.3452784691257881,Brown,Maine,4,5,0,0,NA,401175503,2019-11-11,
189,3,3:49,1129,1129,Fiona Finn Defensive Rebound.,33,37,-4,19,0.3452784691257881,Brown,Maine,4,5,0,0,NA,401175503,2019-11-11,
190,3,3:30,1110,1110,Fiona Finn Turnover.,33,37,-4,11,0.3439085831984986,Brown,Maine,4,5,0,0,NA,401175503,2019-11-11,
191,3,3:19,1099,1099,Maeve Carroll made Layup.,33,39,-6,12,0.2740394283659989,Brown,Maine,4,5,0,0,NA,401175503,2019-11-11,Maine
192,3,3:07,1087,1087,Foul on Maeve Carroll.,33,39,-6,7,0.27286472463102956,Brown,Maine,4,5,0,0,NA,401175503,2019-11-11,
193,3,3:00,1080,1080,Foul on Maeve Carroll.,33,39,-6,15,0.2721701722024392,Brown,Maine,4,5,0,0,NA,401175503,2019-11-11,
194,3,2:45,1065,1065,Haley Green missed Layup.,33,39,-6,0,0.27065291500993977,Brown,Maine,4,5,0,0,NA,401175503,2019-11-11,
195,3,2:45,1065,1065,Haley Green Offensive Rebound.,33,39,-6,5,0.27065291500993977,Brown,Maine,4,5,0,0,NA,401175503,2019-11-11,
196,3,2:40,1060,1060,Haley Green missed Layup.,33,39,-6,0,0.27013700637518107,Brown,Maine,4,5,0,0,NA,401175503,2019-11-11,
197,3,2:40,1060,1060,Haley Green Offensive Rebound.,33,39,-6,4,0.27013700637518107,Brown,Maine,4,5,0,0,NA,401175503,2019-11-11,
198,3,2:36,1056,1056,McKenna Dale made Three Point Jumper. Assisted by Haley Green.,36,39,-3,12,0.37800577002886815,Brown,Maine,4,5,0,0,NA,401175503,2019-11-11,Brown
199,3,2:24,1044,1044,Blanca Millan missed Layup.,36,39,-3,0,0.37724435703477627,Brown,Maine,4,5,0,0,NA,401175503,2019-11-11,
200,3,2:24,1044,1044,Justine Gaziano Defensive Rebound.,36,39,-3,5,0.37724435703477627,Brown,Maine,4,5,0,0,NA,401175503,2019-11-11,
201,3,2:19,1039,1039,McKenna Dale missed Three Point Jumper.,36,39,-3,0,0.3769197399246155,Brown,Maine,4,5,0,0,NA,401175503,2019-11-11,
202,3,2:19,1039,1039,Haley Green Offensive Rebound.,36,39,-3,6,0.3769197399246155,Brown,Maine,4,5,0,0,NA,401175503,2019-11-11,
203,3,2:13,1033,1033,Haley Green Turnover.,36,39,-3,1,0.3765240061528634,Brown,Maine,4,5,0,0,NA,401175503,2019-11-11,
204,3,2:12,1032,1032,Blanca Millan Steal.,36,39,-3,12,0.3764573673210853,Brown,Maine,4,5,0,0,NA,401175503,2019-11-11,
205,3,2:00,1020,1020,Anne Simon missed Jumper.,36,39,-3,0,0.3756415481784224,Brown,Maine,4,5,0,0,NA,401175503,2019-11-11,
206,3,2:00,1020,1020,Justine Gaziano Defensive Rebound.,36,39,-3,23,0.3756415481784224,Brown,Maine,4,5,0,0,NA,401175503,2019-11-11,
207,3,1:37,997,997,Maddie Mullin missed Three Point Jumper.,36,39,-3,0,0.37398551027969906,Brown,Maine,4,5,0,0,NA,401175503,2019-11-11,
208,3,1:37,997,997,Maeve Carroll Defensive Rebound.,36,39,-3,10,0.37398551027969906,Brown,Maine,4,5,0,0,NA,401175503,2019-11-11,
209,3,1:27,987,987,Dor Saar Turnover.,36,39,-3,1,0.3732230178718783,Brown,Maine,4,5,0,0,NA,401175503,2019-11-11,
210,3,1:26,986,986,Dominique Leonidas Steal.,36,39,-3,5,0.3731452374410186,Brown,Maine,4,5,0,0,NA,401175503,2019-11-11,
