play_id,period,time_remaining_period,secs_remaining,secs_remaining_absolute,description,home_score,away_score,score_diff,play_length,win_prob,home,away,home_time_out_remaining,away_time_out_remaining,home_timeout_ind,away_timeout_ind,home_favored_by,game_id,date,whichScored
1,1,9:51,2391,2391,Ruthy Hebard made Jumper. Assisted by Satou Sabally.,0,0,0,26,0.5,Oregon,Oklahoma State,4,4,0,0,NA,401176856,2019-11-28,NA
2,1,9:25,2365,2365,Kassidy De Lapp Turnover.,2,0,2,21,0.5447677378565356,Oregon,Oklahoma State,4,4,0,0,NA,401176856,2019-11-28,Oregon
3,1,9:04,2344,2344,Ruthy Hebard missed Layup.,2,0,2,0,0.5452207909535292,Oregon,Oklahoma State,4,4,0,0,NA,401176856,2019-11-28,
4,1,9:04,2344,2344,Ruthy Hebard Offensive Rebound.,2,0,2,5,0.5452207909535292,Oregon,Oklahoma State,4,4,0,0,NA,401176856,2019-11-28,
5,1,8:59,2339,2339,Foul on Kassidy De Lapp.,2,0,2,0,0.5453294949396444,Oregon,Oklahoma State,4,4,0,0,NA,401176856,2019-11-28,
6,1,8:59,2339,2339,Ruthy Hebard made Free Throw.,3,0,3,0,0.5677619613590958,Oregon,Oklahoma State,4,4,0,0,NA,401176856,2019-11-28,Oregon
7,1,8:59,2339,2339,Ruthy Hebard made Free Throw.,4,0,4,9,0.5899199332321196,Oregon,Oklahoma State,4,4,0,0,NA,401176856,2019-11-28,Oregon
8,1,8:50,2330,2330,Foul on Satou Sabally.,4,0,4,3,0.5903032103461621,Oregon,Oklahoma State,4,4,0,0,NA,401176856,2019-11-28,
9,1,8:47,2327,2327,Ja'Mee Asberry missed Jumper.,4,0,4,0,0.5904313697666148,Oregon,Oklahoma State,4,4,0,0,NA,401176856,2019-11-28,
10,1,8:47,2327,2327,Ruthy Hebard Defensive Rebound.,4,0,4,6,0.5904313697666148,Oregon,Oklahoma State,4,4,0,0,NA,401176856,2019-11-28,
11,1,8:41,2321,2321,Minyon Moore made Three Point Jumper. Assisted by Sabrina Ionescu.,7,0,7,14,0.6551873324125271,Oregon,Oklahoma State,4,4,0,0,NA,401176856,2019-11-28,Oregon
12,1,8:27,2307,2307,Natasha Mack missed Layup.,7,0,7,0,0.6561718622156223,Oregon,Oklahoma State,4,4,0,0,NA,401176856,2019-11-28,
13,1,8:27,2307,2307,Ruthy Hebard Defensive Rebound.,7,0,7,8,0.6561718622156223,Oregon,Oklahoma State,4,4,0,0,NA,401176856,2019-11-28,
14,1,8:19,2299,2299,Sabrina Ionescu made Three Point Jumper. Assisted by Minyon Moore.,10,0,10,17,0.7164332495540904,Oregon,Oklahoma State,4,4,0,0,NA,401176856,2019-11-28,Oregon
15,1,8:02,2282,2282,Vivian Gray made Jumper.,10,2,8,18,0.6786532913689665,Oregon,Oklahoma State,4,4,0,0,NA,401176856,2019-11-28,Oklahoma State
16,1,7:44,2264,2264,Foul on Lauren Fields.,10,2,8,5,0.6800752317082251,Oregon,Oklahoma State,4,4,0,0,NA,401176856,2019-11-28,
17,1,7:39,2259,2259,Satou Sabally Turnover.,10,2,8,0,0.6804713917793598,Oregon,Oklahoma State,4,4,0,0,NA,401176856,2019-11-28,
18,1,7:39,2259,2259,Lauren Fields Steal.,10,2,8,3,0.6804713917793598,Oregon,Oklahoma State,4,4,0,0,NA,401176856,2019-11-28,
19,1,7:36,2256,2256,Lauren Fields missed Layup.,10,2,8,0,0.6807093127250899,Oregon,Oklahoma State,4,4,0,0,NA,401176856,2019-11-28,
20,1,7:36,2256,2256,Erin Boley Defensive Rebound.,10,2,8,6,0.6807093127250899,Oregon,Oklahoma State,4,4,0,0,NA,401176856,2019-11-28,
21,1,7:30,2250,2250,Satou Sabally missed Three Point Jumper.,10,2,8,0,0.6811856357089305,Oregon,Oklahoma State,4,4,0,0,NA,401176856,2019-11-28,
22,1,7:30,2250,2250,Natasha Mack Defensive Rebound.,10,2,8,11,0.6811856357089305,Oregon,Oklahoma State,4,4,0,0,NA,401176856,2019-11-28,
23,1,7:19,2239,2239,Lauren Fields missed Three Point Jumper.,10,2,8,0,0.6820604374842874,Oregon,Oklahoma State,4,4,0,0,NA,401176856,2019-11-28,
24,1,7:19,2239,2239,Sabrina Ionescu Defensive Rebound.,10,2,8,14,0.6820604374842874,Oregon,Oklahoma State,4,4,0,0,NA,401176856,2019-11-28,
25,1,7:05,2225,2225,Sabrina Ionescu missed Jumper.,10,2,8,0,0.6831763539262857,Oregon,Oklahoma State,4,4,0,0,NA,401176856,2019-11-28,
26,1,7:05,2225,2225,Ruthy Hebard Offensive Rebound.,10,2,8,1,0.6831763539262857,Oregon,Oklahoma State,4,4,0,0,NA,401176856,2019-11-28,
27,1,7:04,2224,2224,Oregon  Timeout,10,2,8,3,0.683256158040496,Oregon,Oklahoma State,3,4,1,0,NA,401176856,2019-11-28,
28,1,7:01,2221,2221,Ruthy Hebard made Two Point Tip Shot.,12,2,10,16,0.7235928825137501,Oregon,Oklahoma State,3,4,1,0,NA,401176856,2019-11-28,Oregon
29,1,6:45,2205,2205,Vivian Gray missed Jumper.,12,2,10,0,0.7250699311612518,Oregon,Oklahoma State,3,4,1,0,NA,401176856,2019-11-28,
30,1,6:45,2205,2205,Minyon Moore Defensive Rebound.,12,2,10,6,0.7250699311612518,Oregon,Oklahoma State,3,4,1,0,NA,401176856,2019-11-28,
31,1,6:39,2199,2199,Minyon Moore made Layup.,14,2,12,10,0.7626094501426782,Oregon,Oklahoma State,3,4,1,0,NA,401176856,2019-11-28,Oregon
32,1,6:29,2189,2189,Foul on Minyon Moore.,14,2,12,2,0.763616844104864,Oregon,Oklahoma State,3,4,1,0,NA,401176856,2019-11-28,
33,1,6:27,2187,2187,Ja'Mee Asberry made Free Throw.,14,3,11,0,0.74572060856757,Oregon,Oklahoma State,3,4,1,0,NA,401176856,2019-11-28,Oklahoma State
34,1,6:27,2187,2187,Ja'Mee Asberry made Free Throw.,14,4,10,5,0.7267323849025615,Oregon,Oklahoma State,3,4,1,0,NA,401176856,2019-11-28,Oklahoma State
35,1,6:22,2182,2182,Ruthy Hebard made Layup. Assisted by Sabrina Ionescu.,16,4,12,13,0.7643214732595295,Oregon,Oklahoma State,3,4,1,0,NA,401176856,2019-11-28,Oregon
36,1,6:09,2169,2169,Bigue Sarr missed Jumper.,16,4,12,0,0.7656285623671056,Oregon,Oklahoma State,3,4,1,0,NA,401176856,2019-11-28,
37,1,6:09,2169,2169,Ruthy Hebard Defensive Rebound.,16,4,12,6,0.7656285623671056,Oregon,Oklahoma State,3,4,1,0,NA,401176856,2019-11-28,
38,1,6:03,2163,2163,Erin Boley made Three Point Jumper. Assisted by Minyon Moore.,19,4,15,22,0.8151671116321443,Oregon,Oklahoma State,3,4,0,0,NA,401176856,2019-11-28,Oregon
39,1,5:41,2141,2141,Bigue Sarr made Layup. Assisted by Ja'Mee Asberry.,19,6,13,20,0.7857514454970972,Oregon,Oklahoma State,3,4,0,0,NA,401176856,2019-11-28,Oklahoma State
40,1,5:21,2121,2121,Sabrina Ionescu missed Three Point Jumper.,19,6,13,0,0.7878137883883297,Oregon,Oklahoma State,3,4,0,0,NA,401176856,2019-11-28,
41,1,5:21,2121,2121,Ruthy Hebard Offensive Rebound.,19,6,13,4,0.7878137883883297,Oregon,Oklahoma State,3,4,0,0,NA,401176856,2019-11-28,
42,1,5:17,2117,2117,Erin Boley missed Three Point Jumper.,19,6,13,0,0.7882263851563834,Oregon,Oklahoma State,3,4,0,0,NA,401176856,2019-11-28,
43,1,5:17,2117,2117,Ruthy Hebard Offensive Rebound.,19,6,13,12,0.7882263851563834,Oregon,Oklahoma State,3,4,0,0,NA,401176856,2019-11-28,
44,1,5:05,2105,2105,Ruthy Hebard made Layup. Assisted by Satou Sabally.,21,6,15,15,0.8212793758764305,Oregon,Oklahoma State,3,4,0,0,NA,401176856,2019-11-28,Oregon
45,1,4:50,2090,2090,Oklahoma State  Timeout,21,6,15,21,0.822856264574008,Oregon,Oklahoma State,3,3,0,1,NA,401176856,2019-11-28,
46,1,4:29,2069,2069,Ja'Mee Asberry missed Three Point Jumper.,21,6,15,0,0.825062406583435,Oregon,Oklahoma State,3,3,0,1,NA,401176856,2019-11-28,
47,1,4:29,2069,2069,Oregon Defensive Rebound.,21,6,15,11,0.825062406583435,Oregon,Oklahoma State,3,3,0,1,NA,401176856,2019-11-28,
48,1,4:18,2058,2058,Sabrina Ionescu missed Three Point Jumper.,21,6,15,0,0.8262175581332915,Oregon,Oklahoma State,3,3,0,1,NA,401176856,2019-11-28,
49,1,4:18,2058,2058,Natasha Mack Defensive Rebound.,21,6,15,19,0.8262175581332915,Oregon,Oklahoma State,3,3,0,1,NA,401176856,2019-11-28,
50,1,3:59,2039,2039,Sara Rodridues missed Layup.,21,6,15,0,0.8282125190995004,Oregon,Oklahoma State,3,3,0,1,NA,401176856,2019-11-28,
51,1,3:59,2039,2039,Ruthy Hebard Defensive Rebound.,21,6,15,19,0.8282125190995004,Oregon,Oklahoma State,3,3,0,1,NA,401176856,2019-11-28,
52,1,3:40,2020,2020,Minyon Moore missed Three Point Jumper.,21,6,15,0,0.8302075849461229,Oregon,Oklahoma State,3,3,0,0,NA,401176856,2019-11-28,
53,1,3:40,2020,2020,Sara Rodridues Defensive Rebound.,21,6,15,14,0.8302075849461229,Oregon,Oklahoma State,3,3,0,0,NA,401176856,2019-11-28,
54,1,3:26,2006,2006,Vivian Gray made Three Point Jumper. Assisted by Sara Rodridues.,21,9,12,12,0.7821182233524054,Oregon,Oklahoma State,3,3,0,0,NA,401176856,2019-11-28,Oklahoma State
55,1,3:14,1994,1994,Minyon Moore Turnover.,21,9,12,0,0.7833472116604949,Oregon,Oklahoma State,3,3,0,0,NA,401176856,2019-11-28,
56,1,3:14,1994,1994,Natasha Mack Steal.,21,9,12,3,0.7833472116604949,Oregon,Oklahoma State,3,3,0,0,NA,401176856,2019-11-28,
57,1,3:11,1991,1991,Natasha Mack made Layup.,21,11,10,13,0.7450869256171502,Oregon,Oklahoma State,3,3,0,0,NA,401176856,2019-11-28,Oklahoma State
58,1,2:58,1978,1978,Satou Sabally missed Jumper.,21,11,10,0,0.7463344539219667,Oregon,Oklahoma State,3,3,0,0,NA,401176856,2019-11-28,
59,1,2:58,1978,1978,Ruthy Hebard Offensive Rebound.,21,11,10,7,0.7463344539219667,Oregon,Oklahoma State,3,3,0,0,NA,401176856,2019-11-28,
60,1,2:51,1971,1971,Erin Boley made Three Point Jumper. Assisted by Ruthy Hebard.,24,11,13,18,0.8033768652329223,Oregon,Oklahoma State,3,3,0,0,NA,401176856,2019-11-28,Oregon
61,1,2:33,1953,1953,Sara Rodridues missed Jumper.,24,11,13,0,0.8052642710322878,Oregon,Oklahoma State,3,3,0,0,NA,401176856,2019-11-28,
62,1,2:33,1953,1953,Ruthy Hebard Defensive Rebound.,24,11,13,16,0.8052642710322878,Oregon,Oklahoma State,3,3,0,0,NA,401176856,2019-11-28,
63,1,2:17,1937,1937,Erin Boley missed Three Point Jumper.,24,11,13,0,0.8069468350777564,Oregon,Oklahoma State,3,3,0,0,NA,401176856,2019-11-28,
64,1,2:17,1937,1937,Natasha Mack Defensive Rebound.,24,11,13,10,0.8069468350777564,Oregon,Oklahoma State,3,3,0,0,NA,401176856,2019-11-28,
65,1,2:07,1927,1927,Vivian Gray missed Three Point Jumper.,24,11,13,0,0.8080005134873177,Oregon,Oklahoma State,3,3,0,0,NA,401176856,2019-11-28,
66,1,2:07,1927,1927,Sabrina Ionescu Block.,24,11,13,2,0.8080005134873177,Oregon,Oklahoma State,3,3,0,0,NA,401176856,2019-11-28,
67,1,2:05,1925,1925,Erin Boley Defensive Rebound.,24,11,13,4,0.8082108909380359,Oregon,Oklahoma State,3,3,0,0,NA,401176856,2019-11-28,
68,1,2:01,1921,1921,Minyon Moore made Layup. Assisted by Sabrina Ionescu.,26,11,15,19,0.8406205093474723,Oregon,Oklahoma State,3,3,0,0,NA,401176856,2019-11-28,Oregon
69,1,1:42,1902,1902,Natasha Mack missed Layup.,26,11,15,0,0.842599168722023,Oregon,Oklahoma State,3,3,0,0,NA,401176856,2019-11-28,
70,1,1:42,1902,1902,Natasha Mack Offensive Rebound.,26,11,15,3,0.842599168722023,Oregon,Oklahoma State,3,3,0,0,NA,401176856,2019-11-28,
71,1,1:39,1899,1899,Natasha Mack missed Two Point Tip Shot.,26,11,15,0,0.8429095322472709,Oregon,Oklahoma State,3,3,0,0,NA,401176856,2019-11-28,
72,1,1:39,1899,1899,Erin Boley Defensive Rebound.,26,11,15,5,0.8429095322472709,Oregon,Oklahoma State,3,3,0,0,NA,401176856,2019-11-28,
73,1,1:34,1894,1894,Satou Sabally made Three Point Jumper. Assisted by Sabrina Ionescu.,29,11,18,28,0.8829563836337652,Oregon,Oklahoma State,3,3,0,0,NA,401176856,2019-11-28,Oregon
74,1,1:06,1866,1866,Natasha Mack made Jumper.,29,13,16,12,0.8605111465929545,Oregon,Oklahoma State,3,3,0,0,NA,401176856,2019-11-28,Oklahoma State
75,1,0:54,1854,1854,Ruthy Hebard made Layup. Assisted by Minyon Moore.,31,13,18,17,0.8867806599106263,Oregon,Oklahoma State,3,3,0,0,NA,401176856,2019-11-28,Oregon
76,1,0:37,1837,1837,Vivian Gray missed Jumper.,31,13,18,0,0.8883820650253608,Oregon,Oklahoma State,3,3,0,0,NA,401176856,2019-11-28,
77,1,0:37,1837,1837,Minyon Moore Defensive Rebound.,31,13,18,24,0.8883820650253608,Oregon,Oklahoma State,3,3,0,0,NA,401176856,2019-11-28,
78,1,0:13,1813,1813,Sabrina Ionescu made Three Point Jumper. Assisted by Ruthy Hebard.,34,13,21,12,0.9203178392335243,Oregon,Oklahoma State,3,3,0,0,NA,401176856,2019-11-28,Oregon
79,1,0:01,1801,1801,Vivian Gray missed Three Point Jumper.,34,13,21,0,0.9212970705930965,Oregon,Oklahoma State,3,3,0,0,NA,401176856,2019-11-28,
80,1,0:01,1801,1801,Sabrina Ionescu Defensive Rebound.,34,13,21,1,0.9212970705930965,Oregon,Oklahoma State,3,3,0,0,NA,401176856,2019-11-28,
81,1,0:00,1800,1800,End of 1st Quarter,34,13,21,29,0.9213784571510705,Oregon,Oklahoma State,3,3,0,0,NA,401176856,2019-11-28,
82,2,9:31,1771,1771,Lauren Fields missed Jumper.,34,13,21,0,0.9237266205176025,Oregon,Oklahoma State,4,4,0,0,NA,401176856,2019-11-28,
83,2,9:31,1771,1771,Sabrina Ionescu Defensive Rebound.,34,13,21,6,0.9237266205176025,Oregon,Oklahoma State,4,4,0,0,NA,401176856,2019-11-28,
84,2,9:25,1765,1765,Foul on Lydia Giomi.,34,13,21,0,0.9242100133094796,Oregon,Oklahoma State,4,4,0,0,NA,401176856,2019-11-28,
85,2,9:25,1765,1765,Lydia Giomi Turnover.,34,13,21,16,0.9242100133094796,Oregon,Oklahoma State,4,4,0,0,NA,401176856,2019-11-28,
86,2,9:09,1749,1749,Natasha Mack made Jumper. Assisted by Kassidy De Lapp.,34,15,19,22,0.9071672495945724,Oregon,Oklahoma State,4,4,0,0,NA,401176856,2019-11-28,Oklahoma State
87,2,8:47,1727,1727,Taylor Cahvez missed Three Point Jumper.,34,15,19,0,0.9091183758398653,Oregon,Oklahoma State,4,4,0,0,NA,401176856,2019-11-28,
88,2,8:47,1727,1727,Lydia Giomi Offensive Rebound.,34,15,19,18,0.9091183758398653,Oregon,Oklahoma State,4,4,0,0,NA,401176856,2019-11-28,
89,2,8:29,1709,1709,Erin Boley missed Three Point Jumper.,34,15,19,0,0.9107163504266763,Oregon,Oklahoma State,4,4,0,0,NA,401176856,2019-11-28,
90,2,8:29,1709,1709,Micah Dennis Defensive Rebound.,34,15,19,14,0.9107163504266763,Oregon,Oklahoma State,4,4,0,0,NA,401176856,2019-11-28,
91,2,8:15,1695,1695,Lauren Fields Turnover.,34,15,19,1,0.9119614678797562,Oregon,Oklahoma State,4,4,0,0,NA,401176856,2019-11-28,
92,2,8:14,1694,1694,Lydia Giomi Steal.,34,15,19,4,0.9120505039074143,Oregon,Oklahoma State,4,4,0,0,NA,401176856,2019-11-28,
93,2,8:10,1690,1690,Erin Boley missed Layup.,34,15,19,0,0.9124067974010169,Oregon,Oklahoma State,4,4,0,0,NA,401176856,2019-11-28,
94,2,8:10,1690,1690,Natasha Mack Defensive Rebound.,34,15,19,12,0.9124067974010169,Oregon,Oklahoma State,4,4,0,0,NA,401176856,2019-11-28,
95,2,7:58,1678,1678,Lauren Fields missed Jumper.,34,15,19,0,0.9134602789794151,Oregon,Oklahoma State,4,4,0,0,NA,401176856,2019-11-28,
96,2,7:58,1678,1678,Lydia Giomi Defensive Rebound.,34,15,19,12,0.9134602789794151,Oregon,Oklahoma State,4,4,0,0,NA,401176856,2019-11-28,
97,2,7:46,1666,1666,Sabrina Ionescu made Jumper.,36,15,21,19,0.9320809174034282,Oregon,Oklahoma State,4,4,0,0,NA,401176856,2019-11-28,Oregon
98,2,7:27,1647,1647,Natasha Mack made Jumper. Assisted by Lauren Fields.,36,17,19,26,0.9160552654771595,Oregon,Oklahoma State,4,4,0,0,NA,401176856,2019-11-28,Oklahoma State
99,2,7:01,1621,1621,Jaz Shelley missed Jumper.,36,17,19,0,0.9181238343098934,Oregon,Oklahoma State,4,4,0,0,NA,401176856,2019-11-28,
100,2,7:01,1621,1621,Lauren Fields Defensive Rebound.,36,17,19,10,0.9181238343098934,Oregon,Oklahoma State,4,4,0,0,NA,401176856,2019-11-28,
101,2,6:51,1611,1611,Natasha Mack missed Three Point Jumper.,36,17,19,0,0.9189004755703926,Oregon,Oklahoma State,4,4,0,0,NA,401176856,2019-11-28,
102,2,6:51,1611,1611,Sabrina Ionescu Defensive Rebound.,36,17,19,22,0.9189004755703926,Oregon,Oklahoma State,4,4,0,0,NA,401176856,2019-11-28,
103,2,6:29,1589,1589,Taylor Cahvez made Jumper.,38,17,21,18,0.9375103227065541,Oregon,Oklahoma State,4,4,0,0,NA,401176856,2019-11-28,Oregon
104,2,6:11,1571,1571,Natasha Mack missed Layup.,38,17,21,0,0.9387134871559611,Oregon,Oklahoma State,4,4,0,0,NA,401176856,2019-11-28,
105,2,6:11,1571,1571,Lydia Giomi Defensive Rebound.,38,17,21,18,0.9387134871559611,Oregon,Oklahoma State,4,4,0,0,NA,401176856,2019-11-28,
106,2,5:53,1553,1553,Jaz Shelley missed Three Point Jumper.,38,17,21,0,0.9399085815908396,Oregon,Oklahoma State,4,4,0,0,NA,401176856,2019-11-28,
107,2,5:53,1553,1553,Natasha Mack Defensive Rebound.,38,17,21,27,0.9399085815908396,Oregon,Oklahoma State,4,4,0,0,NA,401176856,2019-11-28,
108,2,5:26,1526,1526,Natasha Mack Turnover.,38,17,21,2,0.9417014137116081,Oregon,Oklahoma State,4,4,0,0,NA,401176856,2019-11-28,
109,2,5:24,1524,1524,Minyon Moore made Layup.,40,17,23,8,0.9547711199295977,Oregon,Oklahoma State,4,4,0,0,NA,401176856,2019-11-28,Oregon
110,2,5:16,1516,1516,Foul on Kassidy De Lapp.,40,17,23,0,0.9552323228533589,Oregon,Oklahoma State,4,4,0,0,NA,401176856,2019-11-28,
111,2,5:16,1516,1516,Minyon Moore missed Free Throw.,40,17,23,0,0.9552323228533589,Oregon,Oklahoma State,4,4,0,0,NA,401176856,2019-11-28,
112,2,5:16,1516,1516,Natasha Mack Defensive Rebound.,40,17,23,4,0.9552323228533589,Oregon,Oklahoma State,4,4,0,0,NA,401176856,2019-11-28,
113,2,5:12,1512,1512,Clitan de Sousa missed Jumper.,40,17,23,0,0.9554634622049801,Oregon,Oklahoma State,4,4,0,0,NA,401176856,2019-11-28,
114,2,5:12,1512,1512,Taylor Cahvez Defensive Rebound.,40,17,23,8,0.9554634622049801,Oregon,Oklahoma State,4,4,0,0,NA,401176856,2019-11-28,
115,2,5:04,1504,1504,Jaz Shelley made Three Point Jumper. Assisted by Minyon Moore.,43,17,26,17,0.9700599953298992,Oregon,Oklahoma State,4,4,0,0,NA,401176856,2019-11-28,Oregon
116,2,4:47,1487,1487,Vivian Gray made Jumper.,43,19,24,12,0.9621472824028923,Oregon,Oklahoma State,4,4,0,0,NA,401176856,2019-11-28,Oklahoma State
117,2,4:35,1475,1475,Jaz Shelley missed Three Point Jumper.,43,19,24,0,0.9627999430144135,Oregon,Oklahoma State,4,4,0,0,NA,401176856,2019-11-28,
118,2,4:35,1475,1475,Satou Sabally Offensive Rebound.,43,19,24,10,0.9627999430144135,Oregon,Oklahoma State,4,4,0,0,NA,401176856,2019-11-28,
119,2,4:25,1465,1465,Lydia Giomi missed Layup.,43,19,24,0,0.9633486535430781,Oregon,Oklahoma State,4,4,0,0,NA,401176856,2019-11-28,
120,2,4:25,1465,1465,Sara Rodridues Defensive Rebound.,43,19,24,23,0.9633486535430781,Oregon,Oklahoma State,4,4,0,0,NA,401176856,2019-11-28,
121,2,4:02,1442,1442,Foul on Sara Rodridues.,43,19,24,0,0.9646216420420688,Oregon,Oklahoma State,4,4,0,0,NA,401176856,2019-11-28,
122,2,4:02,1442,1442,Sara Rodridues Turnover.,43,19,24,0,0.9646216420420688,Oregon,Oklahoma State,4,4,0,0,NA,401176856,2019-11-28,
123,2,4:02,1442,1442,Official TV Timeout,43,19,24,23,0.9646216420420688,Oregon,Oklahoma State,4,4,0,0,NA,401176856,2019-11-28,
124,2,3:39,1419,1419,Satou Sabally missed Three Point Jumper.,43,19,24,0,0.9658219731082752,Oregon,Oklahoma State,4,4,0,0,NA,401176856,2019-11-28,
125,2,3:39,1419,1419,Oklahoma State Defensive Rebound.,43,19,24,14,0.9658219731082752,Oregon,Oklahoma State,4,4,0,0,NA,401176856,2019-11-28,
126,2,3:25,1405,1405,Sara Rodridues made Jumper. Assisted by Vivian Gray.,43,21,22,20,0.9561573514283995,Oregon,Oklahoma State,4,4,0,0,NA,401176856,2019-11-28,Oklahoma State
127,2,3:05,1385,1385,Minyon Moore missed Three Point Jumper.,43,21,22,0,0.9572827744264745,Oregon,Oklahoma State,4,4,0,0,NA,401176856,2019-11-28,
128,2,3:05,1385,1385,Sara Rodridues Defensive Rebound.,43,21,22,8,0.9572827744264745,Oregon,Oklahoma State,4,4,0,0,NA,401176856,2019-11-28,
129,2,2:57,1377,1377,Ja'Mee Asberry missed Jumper.,43,21,22,0,0.9577214084172072,Oregon,Oklahoma State,4,4,0,0,NA,401176856,2019-11-28,
130,2,2:57,1377,1377,Kassidy De Lapp Offensive Rebound.,43,21,22,10,0.9577214084172072,Oregon,Oklahoma State,4,4,0,0,NA,401176856,2019-11-28,
131,2,2:47,1367,1367,Vivian Gray missed Layup.,43,21,22,0,0.9582626348486223,Oregon,Oklahoma State,4,4,0,0,NA,401176856,2019-11-28,
132,2,2:47,1367,1367,Ruthy Hebard Defensive Rebound.,43,21,22,8,0.9582626348486223,Oregon,Oklahoma State,4,4,0,0,NA,401176856,2019-11-28,
133,2,2:39,1359,1359,Satou Sabally missed Three Point Jumper.,43,21,22,0,0.9586911054546121,Oregon,Oklahoma State,4,4,0,0,NA,401176856,2019-11-28,
134,2,2:39,1359,1359,Ja'Mee Asberry Defensive Rebound.,43,21,22,18,0.9586911054546121,Oregon,Oklahoma State,4,4,0,0,NA,401176856,2019-11-28,
135,2,2:21,1341,1341,Lauren Fields missed Jumper.,43,21,22,0,0.959645381416383,Oregon,Oklahoma State,4,4,0,0,NA,401176856,2019-11-28,
136,2,2:21,1341,1341,Sabrina Ionescu Defensive Rebound.,43,21,22,17,0.959645381416383,Oregon,Oklahoma State,4,4,0,0,NA,401176856,2019-11-28,
137,2,2:04,1324,1324,Satou Sabally Turnover.,43,21,22,1,0.9605411377867693,Oregon,Oklahoma State,4,4,0,0,NA,401176856,2019-11-28,
138,2,2:03,1323,1323,Natasha Mack Steal.,43,21,22,4,0.9605938286325549,Oregon,Oklahoma State,4,4,0,0,NA,401176856,2019-11-28,
139,2,1:59,1319,1319,Bryn Gerlich missed Three Point Jumper.,43,21,22,0,0.9608046978002793,Oregon,Oklahoma State,4,4,0,0,NA,401176856,2019-11-28,
140,2,1:59,1319,1319,Ruthy Hebard Defensive Rebound.,43,21,22,12,0.9608046978002793,Oregon,Oklahoma State,4,4,0,0,NA,401176856,2019-11-28,
141,2,1:47,1307,1307,Ruthy Hebard made Layup. Assisted by Holly Winterburn.,45,21,24,11,0.9709307084042859,Oregon,Oklahoma State,4,4,0,0,NA,401176856,2019-11-28,Oregon
142,2,1:36,1296,1296,Ja'Mee Asberry missed Three Point Jumper.,45,21,24,0,0.9714164408372326,Oregon,Oklahoma State,4,4,0,0,NA,401176856,2019-11-28,
143,2,1:36,1296,1296,Ruthy Hebard Defensive Rebound.,45,21,24,11,0.9714164408372326,Oregon,Oklahoma State,4,4,0,0,NA,401176856,2019-11-28,
144,2,1:25,1285,1285,Sabrina Ionescu Turnover.,45,21,24,1,0.9719058139761177,Oregon,Oklahoma State,4,4,0,0,NA,401176856,2019-11-28,
145,2,1:24,1284,1284,Bryn Gerlich Steal.,45,21,24,3,0.9719505264476682,Oregon,Oklahoma State,4,4,0,0,NA,401176856,2019-11-28,
146,2,1:21,1281,1281,Vivian Gray made Layup. Assisted by Ja'Mee Asberry.,45,23,22,20,0.9628316004054432,Oregon,Oklahoma State,4,4,0,0,NA,401176856,2019-11-28,Oklahoma State
147,2,1:01,1261,1261,Sabrina Ionescu missed Three Point Jumper.,45,23,22,0,0.9639299172732949,Oregon,Oklahoma State,4,4,0,0,NA,401176856,2019-11-28,
148,2,1:01,1261,1261,Natasha Mack Defensive Rebound.,45,23,22,15,0.9639299172732949,Oregon,Oklahoma State,4,4,0,0,NA,401176856,2019-11-28,
149,2,0:46,1246,1246,Vivian Gray made Layup.,45,25,20,10,0.9529881889291324,Oregon,Oklahoma State,4,4,0,0,NA,401176856,2019-11-28,Oklahoma State
150,2,0:36,1236,1236,Holly Winterburn missed Three Point Jumper.,45,25,20,4,0.953677379991418,Oregon,Oklahoma State,4,4,0,0,NA,401176856,2019-11-28,
151,2,0:32,1232,1232,Satou Sabally Offensive Rebound.,45,25,20,7,0.953956737392845,Oregon,Oklahoma State,4,4,0,0,NA,401176856,2019-11-28,
152,2,0:25,1225,1225,Satou Sabally made Layup.,47,25,22,15,0.965992664240434,Oregon,Oklahoma State,4,4,0,0,NA,401176856,2019-11-28,Oregon
153,2,0:10,1210,1210,Natasha Mack made Layup. Assisted by Bryn Gerlich.,47,27,20,4,0.9555335910360512,Oregon,Oklahoma State,4,4,0,0,NA,401176856,2019-11-28,Oklahoma State
154,2,0:06,1206,1206,Satou Sabally missed Three Point Jumper.,47,27,20,0,0.9558245624886899,Oregon,Oklahoma State,4,4,0,0,NA,401176856,2019-11-28,
155,2,0:06,1206,1206,Holly Winterburn Offensive Rebound.,47,27,20,5,0.9558245624886899,Oregon,Oklahoma State,4,4,0,0,NA,401176856,2019-11-28,
156,2,0:01,1201,1201,Holly Winterburn missed Jumper.,47,27,20,1,0.9561822652880921,Oregon,Oklahoma State,4,4,0,0,NA,401176856,2019-11-28,
157,2,0:00,1200,1200,Oregon Deadball Team Rebound.,47,27,20,0,0.9562530359229152,Oregon,Oklahoma State,4,4,0,0,NA,401176856,2019-11-28,
158,2,0:00,1200,1200,End of 2nd Quarter,47,27,20,0,0.9562530359229152,Oregon,Oklahoma State,4,4,0,0,NA,401176856,2019-11-28,
159,2,0:00,1200,1200,End of Game,47,27,20,5,0.9562530359229152,Oregon,Oklahoma State,4,4,0,0,NA,401176856,2019-11-28,
160,3,9:55,1195,1195,Satou Sabally missed Jumper.,47,27,20,0,0.9566032096871918,Oregon,Oklahoma State,5,5,0,0,NA,401176856,2019-11-28,
161,3,9:55,1195,1195,Vivian Gray Defensive Rebound.,47,27,20,22,0.9566032096871918,Oregon,Oklahoma State,5,5,0,0,NA,401176856,2019-11-28,
162,3,9:33,1173,1173,Vivian Gray missed Jumper.,47,27,20,0,0.9580793183500143,Oregon,Oklahoma State,5,5,0,0,NA,401176856,2019-11-28,
163,3,9:33,1173,1173,Ruthy Hebard Defensive Rebound.,47,27,20,21,0.9580793183500143,Oregon,Oklahoma State,5,5,0,0,NA,401176856,2019-11-28,
164,3,9:12,1152,1152,Ja'Mee Asberry missed Layup.,47,27,20,0,0.9594100263400667,Oregon,Oklahoma State,5,5,0,0,NA,401176856,2019-11-28,
165,3,9:12,1152,1152,Oklahoma State Offensive Rebound.,47,27,20,16,0.9594100263400667,Oregon,Oklahoma State,5,5,0,0,NA,401176856,2019-11-28,
166,3,8:56,1136,1136,Satou Sabally missed Jumper.,47,27,20,0,0.9603873305541153,Oregon,Oklahoma State,5,5,0,0,NA,401176856,2019-11-28,
167,3,8:56,1136,1136,Vivian Gray Defensive Rebound.,47,27,20,4,0.9603873305541153,Oregon,Oklahoma State,5,5,0,0,NA,401176856,2019-11-28,
168,3,8:52,1132,1132,Lauren Fields missed Jumper.,47,27,20,0,0.9606279867556272,Oregon,Oklahoma State,5,5,0,0,NA,401176856,2019-11-28,
169,3,8:52,1132,1132,Sabrina Ionescu Defensive Rebound.,47,27,20,16,0.9606279867556272,Oregon,Oklahoma State,5,5,0,0,NA,401176856,2019-11-28,
170,3,8:36,1116,1116,Erin Boley made Three Point Jumper. Assisted by Sabrina Ionescu.,50,27,23,17,0.9759435442367659,Oregon,Oklahoma State,5,5,0,0,NA,401176856,2019-11-28,Oregon
171,3,8:19,1099,1099,Natasha Mack made Layup.,50,29,21,7,0.9680088826457722,Oregon,Oklahoma State,5,5,0,0,NA,401176856,2019-11-28,Oklahoma State
172,3,8:12,1092,1092,Satou Sabally made Layup. Assisted by Minyon Moore.,52,29,23,3,0.9769708314278509,Oregon,Oklahoma State,5,5,0,0,NA,401176856,2019-11-28,Oregon
173,3,8:09,1089,1089,Foul on Natasha Mack.,52,29,23,0,0.9770984420883693,Oregon,Oklahoma State,5,5,0,0,NA,401176856,2019-11-28,
174,3,8:09,1089,1089,Satou Sabally made Free Throw.,53,29,24,14,0.9804794323792312,Oregon,Oklahoma State,5,5,0,0,NA,401176856,2019-11-28,Oregon
175,3,7:55,1075,1075,Vivian Gray missed Jumper.,53,29,24,0,0.9810102307981687,Oregon,Oklahoma State,5,5,0,0,NA,401176856,2019-11-28,
176,3,7:55,1075,1075,Natasha Mack Offensive Rebound.,53,29,24,4,0.9810102307981687,Oregon,Oklahoma State,5,5,0,0,NA,401176856,2019-11-28,
177,3,7:51,1071,1071,Natasha Mack missed Two Point Tip Shot.,53,29,24,0,0.9811618959441957,Oregon,Oklahoma State,5,5,0,0,NA,401176856,2019-11-28,
178,3,7:51,1071,1071,Ruthy Hebard Defensive Rebound.,53,29,24,8,0.9811618959441957,Oregon,Oklahoma State,5,5,0,0,NA,401176856,2019-11-28,
179,3,7:43,1063,1063,Ruthy Hebard missed Layup.,53,29,24,0,0.9814656121766702,Oregon,Oklahoma State,5,5,0,0,NA,401176856,2019-11-28,
180,3,7:43,1063,1063,Ruthy Hebard Offensive Rebound.,53,29,24,3,0.9814656121766702,Oregon,Oklahoma State,5,5,0,0,NA,401176856,2019-11-28,
181,3,7:40,1060,1060,Ruthy Hebard made Two Point Tip Shot.,55,29,26,18,0.9867054776028086,Oregon,Oklahoma State,5,5,0,0,NA,401176856,2019-11-28,Oregon
182,3,7:22,1042,1042,Natasha Mack made Layup. Assisted by Lauren Fields.,55,31,24,12,0.9822679766593234,Oregon,Oklahoma State,5,5,0,0,NA,401176856,2019-11-28,Oklahoma State
