play_id,period,time_remaining_period,secs_remaining,secs_remaining_absolute,description,home_score,away_score,score_diff,play_length,win_prob,home,away,home_time_out_remaining,away_time_out_remaining,home_timeout_ind,away_timeout_ind,home_favored_by,game_id,date,whichScored
195,2,0:00,1200,1200,Eleanna Christinaki missed Layup.,26,30,-4,0,0.3504822574627354,Florida,Temple,4,3,0,0,NA,400911649,2016-11-19,
196,2,0:00,1200,1200,Temple Defensive Rebound.,26,30,-4,0,0.3504822574627354,Florida,Temple,4,3,0,0,NA,400911649,2016-11-19,
197,2,0:00,1200,1200,End of 2nd Quarter,26,30,-4,9,0.3504822574627354,Florida,Temple,4,3,0,0,NA,400911649,2016-11-19,
198,3,9:51,1191,1191,Foul on Feyonda Fitzgerald.,26,30,-4,9,0.34979647943582354,Florida,Temple,5,4,0,0,NA,400911649,2016-11-19,
199,3,9:42,1182,1182,Ronni Williams made Layup. Assisted by Delicia Washington.,28,30,-2,17,0.4227606874112476,Florida,Temple,5,4,0,0,NA,400911649,2016-11-19,Florida
200,3,9:25,1165,1165,Alliya Butts missed Three Point Jumper.,28,30,-2,0,0.4220889387542729,Florida,Temple,5,4,0,0,NA,400911649,2016-11-19,
201,3,9:25,1165,1165,Ronni Williams Defensive Rebound.,28,30,-2,7,0.4220889387542729,Florida,Temple,5,4,0,0,NA,400911649,2016-11-19,
202,3,9:18,1158,1158,Eleanna Christinaki made Three Point Jumper. Assisted by Ronni Williams.,31,30,1,21,0.5393340497150618,Florida,Temple,5,4,0,0,NA,400911649,2016-11-19,Florida
203,3,8:57,1137,1137,Khadijah Berger missed Three Point Jumper.,31,30,1,0,0.5397484732883293,Florida,Temple,5,4,0,0,NA,400911649,2016-11-19,
204,3,8:57,1137,1137,Delicia Washington Defensive Rebound.,31,30,1,9,0.5397484732883293,Florida,Temple,5,4,0,0,NA,400911649,2016-11-19,
205,3,8:48,1128,1128,Delicia Washington missed Layup.,31,30,1,0,0.539925839200829,Florida,Temple,5,4,0,0,NA,400911649,2016-11-19,
206,3,8:48,1128,1128,Safiya Martin Block.,31,30,1,3,0.539925839200829,Florida,Temple,5,4,0,0,NA,400911649,2016-11-19,
207,3,8:45,1125,1125,Alliya Butts Defensive Rebound.,31,30,1,5,0.5399850629576317,Florida,Temple,5,4,0,0,NA,400911649,2016-11-19,
208,3,8:40,1120,1120,Alliya Butts missed Three Point Jumper.,31,30,1,0,0.5400839591935629,Florida,Temple,5,4,0,0,NA,400911649,2016-11-19,
209,3,8:40,1120,1120,Ronni Williams Defensive Rebound.,31,30,1,15,0.5400839591935629,Florida,Temple,5,4,0,0,NA,400911649,2016-11-19,
210,3,8:25,1105,1105,Dyandria Anderson made Layup.,33,30,3,2,0.6190816353442952,Florida,Temple,5,4,0,0,NA,400911649,2016-11-19,Florida
211,3,8:23,1103,1103,Temple  Timeout,33,30,3,18,0.6191960983582185,Florida,Temple,5,3,0,1,NA,400911649,2016-11-19,
212,3,8:05,1085,1085,Tanaya Atkinson missed Jumper.,33,30,3,0,0.6202398615766812,Florida,Temple,5,3,0,1,NA,400911649,2016-11-19,
213,3,8:05,1085,1085,Dyandria Anderson Block.,33,30,3,1,0.6202398615766812,Florida,Temple,5,3,0,1,NA,400911649,2016-11-19,
214,3,8:04,1084,1084,Safiya Martin Offensive Rebound.,33,30,3,0,0.6202986933233271,Florida,Temple,5,3,0,1,NA,400911649,2016-11-19,
215,3,8:04,1084,1084,Safiya Martin made Layup.,33,32,1,0,0.5408103619997011,Florida,Temple,5,3,0,1,NA,400911649,2016-11-19,Temple
216,3,8:04,1084,1084,Foul on Haley Lorenzen.,33,32,1,0,0.5408103619997011,Florida,Temple,5,3,0,1,NA,400911649,2016-11-19,
217,3,8:04,1084,1084,Safiya Martin missed Free Throw.,33,32,1,0,0.5408103619997011,Florida,Temple,5,3,0,1,NA,400911649,2016-11-19,
218,3,8:04,1084,1084,Haley Lorenzen Defensive Rebound.,33,32,1,9,0.5408103619997011,Florida,Temple,5,3,0,1,NA,400911649,2016-11-19,
219,3,7:55,1075,1075,Delicia Washington missed Jumper.,33,32,1,0,0.5409981879589641,Florida,Temple,5,3,0,1,NA,400911649,2016-11-19,
220,3,7:55,1075,1075,Delicia Washington Offensive Rebound.,33,32,1,4,0.5409981879589641,Florida,Temple,5,3,0,1,NA,400911649,2016-11-19,
221,3,7:51,1071,1071,Delicia Washington missed Jumper.,33,32,1,0,0.5410827532086655,Florida,Temple,5,3,0,1,NA,400911649,2016-11-19,
222,3,7:51,1071,1071,Khadijah Berger Defensive Rebound.,33,32,1,26,0.5410827532086655,Florida,Temple,5,3,0,1,NA,400911649,2016-11-19,
223,3,7:25,1045,1045,Feyonda Fitzgerald made Jumper.,33,34,-1,24,0.458347833579721,Florida,Temple,5,3,0,1,NA,400911649,2016-11-19,Temple
224,3,7:01,1021,1021,Eleanna Christinaki missed Jumper.,33,34,-1,0,0.45778454385997147,Florida,Temple,5,3,0,0,NA,400911649,2016-11-19,
225,3,7:01,1021,1021,Delicia Washington Offensive Rebound.,33,34,-1,5,0.45778454385997147,Florida,Temple,5,3,0,0,NA,400911649,2016-11-19,
226,3,6:56,1016,1016,Delicia Washington missed Jumper.,33,34,-1,0,0.457661740036354,Florida,Temple,5,3,0,0,NA,400911649,2016-11-19,
227,3,6:56,1016,1016,Feyonda Fitzgerald Defensive Rebound.,33,34,-1,7,0.457661740036354,Florida,Temple,5,3,0,0,NA,400911649,2016-11-19,
228,3,6:49,1009,1009,Alliya Butts missed Layup.,33,34,-1,0,0.457486315700301,Florida,Temple,5,3,0,0,NA,400911649,2016-11-19,
229,3,6:49,1009,1009,Ronni Williams Defensive Rebound.,33,34,-1,6,0.457486315700301,Florida,Temple,5,3,0,0,NA,400911649,2016-11-19,
230,3,6:43,1003,1003,Eleanna Christinaki missed Three Point Jumper.,33,34,-1,0,0.4573325448241188,Florida,Temple,5,3,0,0,NA,400911649,2016-11-19,
231,3,6:43,1003,1003,Eleanna Christinaki Offensive Rebound.,33,34,-1,3,0.4573325448241188,Florida,Temple,5,3,0,0,NA,400911649,2016-11-19,
232,3,6:40,1000,1000,Foul on Khadijah Berger.,33,34,-1,0,0.45725443135011873,Florida,Temple,5,3,0,0,NA,400911649,2016-11-19,
233,3,6:40,1000,1000,Eleanna Christinaki made Free Throw.,34,34,0,0,0.5,Florida,Temple,5,3,0,0,NA,400911649,2016-11-19,Florida
234,3,6:40,1000,1000,Eleanna Christinaki made Free Throw.,35,34,1,20,0.5427455686498812,Florida,Temple,5,3,0,0,NA,400911649,2016-11-19,Florida
235,3,6:20,980,980,Alliya Butts made Three Point Jumper. Assisted by Feyonda Fitzgerald.,35,37,-2,16,0.4140666309128756,Florida,Temple,5,3,0,0,NA,400911649,2016-11-19,Temple
236,3,6:04,964,964,Foul on Donnaizha Fountain.,35,37,-2,5,0.41316729448422695,Florida,Temple,5,3,0,0,NA,400911649,2016-11-19,
237,3,5:59,959,959,Ronni Williams missed Jumper.,35,37,-2,0,0.412894873608177,Florida,Temple,5,3,0,0,NA,400911649,2016-11-19,
238,3,5:59,959,959,Tanaya Atkinson Defensive Rebound.,35,37,-2,10,0.412894873608177,Florida,Temple,5,3,0,0,NA,400911649,2016-11-19,
239,3,5:49,949,949,Donnaizha Fountain made Three Point Jumper.,35,40,-5,22,0.29205599971405155,Florida,Temple,5,3,0,0,NA,400911649,2016-11-19,Temple
240,3,5:27,927,927,Foul on Safiya Martin.,35,40,-5,0,0.2897918268542308,Florida,Temple,5,3,0,0,NA,400911649,2016-11-19,
241,3,5:27,927,927,Tyshara Fleming missed Free Throw.,35,40,-5,0,0.2897918268542308,Florida,Temple,5,3,0,0,NA,400911649,2016-11-19,
242,3,5:27,927,927,Florida Deadball Team Rebound.,35,40,-5,0,0.2897918268542308,Florida,Temple,5,3,0,0,NA,400911649,2016-11-19,
243,3,5:27,927,927,Tyshara Fleming made Free Throw.,36,40,-4,17,0.3280283220147901,Florida,Temple,5,3,0,0,NA,400911649,2016-11-19,Florida
244,3,5:10,910,910,Tanaya Atkinson made Jumper. Assisted by Feyonda Fitzgerald.,36,42,-6,8,0.2525401150187362,Florida,Temple,5,3,0,0,NA,400911649,2016-11-19,Temple
245,3,5:02,902,902,Tyshara Fleming made Layup. Assisted by Dyandria Anderson.,38,42,-4,24,0.3260140856347752,Florida,Temple,5,3,0,0,NA,400911649,2016-11-19,Florida
246,3,4:38,878,878,Foul on Tyshara Fleming.,38,42,-4,0,0.3241695057197205,Florida,Temple,5,3,0,1,NA,400911649,2016-11-19,
247,3,4:38,878,878,Temple  Timeout,38,42,-4,0,0.3241695057197205,Florida,Temple,5,2,0,1,NA,400911649,2016-11-19,
248,3,4:38,878,878,Feyonda Fitzgerald missed Free Throw.,38,42,-4,0,0.3241695057197205,Florida,Temple,5,2,0,1,NA,400911649,2016-11-19,
249,3,4:38,878,878,Temple Deadball Team Rebound.,38,42,-4,0,0.3241695057197205,Florida,Temple,5,2,0,1,NA,400911649,2016-11-19,
250,3,4:38,878,878,Feyonda Fitzgerald made Free Throw.,38,43,-5,9,0.28529529522128244,Florida,Temple,5,2,0,1,NA,400911649,2016-11-19,Temple
251,3,4:29,869,869,Ronni Williams made Layup.,40,43,-3,13,0.3650831984953505,Florida,Temple,5,2,0,1,NA,400911649,2016-11-19,Florida
252,3,4:16,856,856,Donnaizha Fountain made Jumper. Assisted by Feyonda Fitzgerald.,40,45,-5,19,0.28332027694895123,Florida,Temple,5,2,0,1,NA,400911649,2016-11-19,Temple
253,3,3:57,837,837,Ronni Williams made Layup. Assisted by Eleanna Christinaki.,42,45,-3,24,0.3630622686816518,Florida,Temple,5,2,0,1,NA,400911649,2016-11-19,Florida
254,3,3:33,813,813,Feyonda Fitzgerald made Three Point Jumper. Assisted by Alliya Butts.,42,48,-6,11,0.24256492739138438,Florida,Temple,5,2,0,0,NA,400911649,2016-11-19,Temple
255,3,3:22,802,802,Foul on Ruth Sherrill.,42,48,-6,0,0.24123792109675085,Florida,Temple,5,2,0,0,NA,400911649,2016-11-19,
256,3,3:22,802,802,Ronni Williams made Free Throw.,43,48,-5,0,0.2778963486779885,Florida,Temple,5,2,0,0,NA,400911649,2016-11-19,Florida
257,3,3:22,802,802,Ronni Williams missed Free Throw.,43,48,-5,0,0.2778963486779885,Florida,Temple,5,2,0,0,NA,400911649,2016-11-19,
258,3,3:22,802,802,Donnaizha Fountain Defensive Rebound.,43,48,-5,5,0.2778963486779885,Florida,Temple,5,2,0,0,NA,400911649,2016-11-19,
259,3,3:17,797,797,Donnaizha Fountain made Jumper.,43,50,-7,18,0.20736174191189158,Florida,Temple,5,2,0,0,NA,400911649,2016-11-19,Temple
260,3,2:59,779,779,Delicia Washington made Jumper.,45,50,-5,16,0.2751092587036344,Florida,Temple,5,2,0,0,NA,400911649,2016-11-19,Florida
261,3,2:43,763,763,Tanaya Atkinson missed Layup.,45,50,-5,0,0.27292956203632324,Florida,Temple,5,2,0,0,NA,400911649,2016-11-19,
262,3,2:43,763,763,Haley Lorenzen Block.,45,50,-5,1,0.27292956203632324,Florida,Temple,5,2,0,0,NA,400911649,2016-11-19,
263,3,2:42,762,762,Tanaya Atkinson Offensive Rebound.,45,50,-5,3,0.2727859494617145,Florida,Temple,5,2,0,0,NA,400911649,2016-11-19,
264,3,2:39,759,759,Tanaya Atkinson made Layup.,45,52,-7,25,0.20167992244813343,Florida,Temple,5,2,0,0,NA,400911649,2016-11-19,Temple
265,3,2:14,734,734,Delicia Washington made Jumper.,47,52,-5,21,0.2683698556640987,Florida,Temple,5,2,0,0,NA,400911649,2016-11-19,Florida
266,3,1:53,713,713,Feyonda Fitzgerald Turnover.,47,52,-5,1,0.2648638123812629,Florida,Temple,5,2,0,0,NA,400911649,2016-11-19,
267,3,1:52,712,712,Delicia Washington Steal.,47,52,-5,3,0.26470957397812633,Florida,Temple,5,2,0,0,NA,400911649,2016-11-19,
268,3,1:49,709,709,Delicia Washington made Layup.,49,52,-3,30,0.3510591211545016,Florida,Temple,5,2,0,0,NA,400911649,2016-11-19,Florida
269,3,1:19,679,679,Tanaya Atkinson missed Layup.,49,52,-3,0,0.3481215611979649,Florida,Temple,5,2,0,0,NA,400911649,2016-11-19,
270,3,1:19,679,679,Tanaya Atkinson Offensive Rebound.,49,52,-3,8,0.3481215611979649,Florida,Temple,5,2,0,0,NA,400911649,2016-11-19,
271,3,1:11,671,671,Donnaizha Fountain made Jumper. Assisted by Alliya Butts.,49,54,-5,16,0.2590543237601971,Florida,Temple,5,2,0,0,NA,400911649,2016-11-19,Temple
272,3,0:55,655,655,Delicia Washington Turnover.,49,54,-5,0,0.2570096171387623,Florida,Temple,5,2,0,0,NA,400911649,2016-11-19,
273,3,0:55,655,655,Foul on Delicia Washington.,49,54,-5,24,0.2570096171387623,Florida,Temple,5,2,0,0,NA,400911649,2016-11-19,
274,3,0:31,631,631,Alliya Butts missed Three Point Jumper.,49,54,-5,0,0.2538389268211075,Florida,Temple,5,2,0,0,NA,400911649,2016-11-19,
275,3,0:31,631,631,Tanaya Atkinson Offensive Rebound.,49,54,-5,6,0.2538389268211075,Florida,Temple,5,2,0,0,NA,400911649,2016-11-19,
276,3,0:25,625,625,Feyonda Fitzgerald missed Three Point Jumper.,49,54,-5,0,0.252998457595903,Florida,Temple,5,2,0,0,NA,400911649,2016-11-19,
277,3,0:25,625,625,Ronni Williams Defensive Rebound.,49,54,-5,10,0.252998457595903,Florida,Temple,5,2,0,0,NA,400911649,2016-11-19,
278,3,0:15,615,615,Haley Lorenzen missed Layup.,49,54,-5,0,0.2515337352051444,Florida,Temple,5,2,0,0,NA,400911649,2016-11-19,
279,3,0:15,615,615,Tanaya Atkinson Defensive Rebound.,49,54,-5,7,0.2515337352051444,Florida,Temple,5,2,0,0,NA,400911649,2016-11-19,
280,3,0:08,608,608,Alliya Butts made Layup. Assisted by Tanaya Atkinson.,49,56,-7,8,0.1773092327864468,Florida,Temple,5,2,0,0,NA,400911649,2016-11-19,Temple
281,3,0:00,600,600,Haley Lorenzen missed Jumper.,49,56,-7,0,0.17589365087052686,Florida,Temple,5,2,0,0,NA,400911649,2016-11-19,
282,3,0:00,600,600,Alliya Butts Defensive Rebound.,49,56,-7,0,0.17589365087052686,Florida,Temple,5,2,0,0,NA,400911649,2016-11-19,
283,3,0:00,600,600,End of 3rd Quarter,49,56,-7,11,0.17589365087052686,Florida,Temple,5,2,0,0,NA,400911649,2016-11-19,
284,4,9:49,589,589,Feyonda Fitzgerald Turnover.,49,56,-7,4,0.17380971289112346,Florida,Temple,6,3,0,0,NA,400911649,2016-11-19,
285,4,9:45,585,585,Delicia Washington Steal.,49,56,-7,1,0.17300820799357508,Florida,Temple,6,3,0,0,NA,400911649,2016-11-19,
286,4,9:44,584,584,Delicia Washington made Layup.,51,56,-5,5,0.2462917463255321,Florida,Temple,6,3,0,0,NA,400911649,2016-11-19,Florida
287,4,9:39,579,579,Alliya Butts Turnover.,51,56,-5,1,0.24532098281640785,Florida,Temple,6,3,0,0,NA,400911649,2016-11-19,
288,4,9:38,578,578,Dyandria Anderson Steal.,51,56,-5,2,0.2451219822746585,Florida,Temple,6,3,0,0,NA,400911649,2016-11-19,
289,4,9:36,576,576,Ronni Williams made Layup. Assisted by Dyandria Anderson.,53,56,-3,10,0.3371127271294198,Florida,Temple,6,3,0,0,NA,400911649,2016-11-19,Florida
290,4,9:26,566,566,Donnaizha Fountain made Layup. Assisted by Alliya Butts.,53,58,-5,27,0.24259981193743613,Florida,Temple,6,3,0,0,NA,400911649,2016-11-19,Temple
291,4,8:59,539,539,Dyandria Anderson made Layup.,55,58,-3,11,0.33090360352942777,Florida,Temple,6,3,0,0,NA,400911649,2016-11-19,Florida
292,4,8:48,528,528,Donnaizha Fountain Turnover.,55,58,-3,3,0.329217533829972,Florida,Temple,6,3,0,0,NA,400911649,2016-11-19,
293,4,8:45,525,525,Ronni Williams Steal.,55,58,-3,7,0.3287863556023158,Florida,Temple,6,3,0,0,NA,400911649,2016-11-19,
294,4,8:38,518,518,Haley Lorenzen made Jumper. Assisted by Ronni Williams.,57,58,-1,25,0.44044378525562455,Florida,Temple,6,3,0,0,NA,400911649,2016-11-19,Florida
295,4,8:13,493,493,Alliya Butts missed Three Point Jumper.,57,58,-1,0,0.4392057357724939,Florida,Temple,6,3,0,0,NA,400911649,2016-11-19,
296,4,8:13,493,493,Eleanna Christinaki Defensive Rebound.,57,58,-1,9,0.4392057357724939,Florida,Temple,6,3,0,0,NA,400911649,2016-11-19,
297,4,8:04,484,484,Eleanna Christinaki made Layup.,59,58,1,2,0.5612595454176645,Florida,Temple,6,3,0,0,NA,400911649,2016-11-19,Florida
298,4,8:02,482,482,Temple  Timeout,59,58,1,18,0.5613668924363601,Florida,Temple,6,2,0,1,NA,400911649,2016-11-19,
299,4,7:44,464,464,Tanaya Atkinson missed Jumper.,59,58,1,0,0.5624311438485884,Florida,Temple,6,2,0,1,NA,400911649,2016-11-19,
300,4,7:44,464,464,Delicia Washington Defensive Rebound.,59,58,1,8,0.5624311438485884,Florida,Temple,6,2,0,1,NA,400911649,2016-11-19,
301,4,7:36,456,456,Foul on Feyonda Fitzgerald.,59,58,1,0,0.5629794882160335,Florida,Temple,6,2,0,1,NA,400911649,2016-11-19,
302,4,7:36,456,456,Delicia Washington missed Free Throw.,59,58,1,0,0.5629794882160335,Florida,Temple,6,2,0,1,NA,400911649,2016-11-19,
303,4,7:36,456,456,Florida Deadball Team Rebound.,59,58,1,0,0.5629794882160335,Florida,Temple,6,2,0,1,NA,400911649,2016-11-19,
304,4,7:36,456,456,Delicia Washington missed Free Throw.,59,58,1,0,0.5629794882160335,Florida,Temple,6,2,0,1,NA,400911649,2016-11-19,
305,4,7:36,456,456,Safiya Martin Defensive Rebound.,59,58,1,20,0.5629794882160335,Florida,Temple,6,2,0,1,NA,400911649,2016-11-19,
306,4,7:16,436,436,Foul on Delicia Washington.,59,58,1,0,0.5646354866983602,Florida,Temple,6,2,0,1,NA,400911649,2016-11-19,
307,4,7:16,436,436,Donnaizha Fountain missed Free Throw.,59,58,1,0,0.5646354866983602,Florida,Temple,6,2,0,1,NA,400911649,2016-11-19,
308,4,7:16,436,436,Temple Deadball Team Rebound.,59,58,1,0,0.5646354866983602,Florida,Temple,6,2,0,1,NA,400911649,2016-11-19,
309,4,7:16,436,436,Donnaizha Fountain missed Free Throw.,59,58,1,0,0.5646354866983602,Florida,Temple,6,2,0,1,NA,400911649,2016-11-19,
310,4,7:16,436,436,Tyshara Fleming Defensive Rebound.,59,58,1,12,0.5646354866983602,Florida,Temple,6,2,0,1,NA,400911649,2016-11-19,
311,4,7:04,424,424,Eleanna Christinaki made Jumper.,61,58,3,12,0.6888197371497181,Florida,Temple,6,2,0,1,NA,400911649,2016-11-19,Florida
312,4,6:52,412,412,Foul on Sydney Searcy.,61,58,3,13,0.691796977868209,Florida,Temple,6,2,0,0,NA,400911649,2016-11-19,
313,4,6:39,399,399,Donnaizha Fountain missed Jumper.,61,58,3,0,0.69484777439807,Florida,Temple,6,2,0,0,NA,400911649,2016-11-19,
314,4,6:39,399,399,Tyshara Fleming Defensive Rebound.,61,58,3,7,0.69484777439807,Florida,Temple,6,2,0,0,NA,400911649,2016-11-19,
315,4,6:32,392,392,Eleanna Christinaki made Layup. Assisted by Tyshara Fleming.,63,58,5,17,0.799663494872302,Florida,Temple,6,2,0,0,NA,400911649,2016-11-19,Florida
316,4,6:15,375,375,Feyonda Fitzgerald Turnover.,63,58,5,2,0.8046962260576186,Florida,Temple,6,2,0,0,NA,400911649,2016-11-19,
317,4,6:13,373,373,Sydney Searcy Steal.,63,58,5,3,0.8053069420869444,Florida,Temple,6,2,0,0,NA,400911649,2016-11-19,
318,4,6:10,370,370,Sydney Searcy missed Jumper.,63,58,5,0,0.8062344498554065,Florida,Temple,6,2,0,0,NA,400911649,2016-11-19,
319,4,6:10,370,370,Donnaizha Fountain Block.,63,58,5,0,0.8062344498554065,Florida,Temple,6,2,0,0,NA,400911649,2016-11-19,
320,4,6:10,370,370,Florida Offensive Rebound.,63,58,5,2,0.8062344498554065,Florida,Temple,6,2,0,0,NA,400911649,2016-11-19,
321,4,6:08,368,368,Haley Lorenzen made Jumper. Assisted by Eleanna Christinaki.,65,58,7,16,0.8809691611822218,Florida,Temple,6,2,0,0,NA,400911649,2016-11-19,Florida
322,4,5:52,352,352,Donnaizha Fountain missed Jumper.,65,58,7,0,0.8859492144097023,Florida,Temple,6,2,0,0,NA,400911649,2016-11-19,
323,4,5:52,352,352,Tyshara Fleming Defensive Rebound.,65,58,7,9,0.8859492144097023,Florida,Temple,6,2,0,0,NA,400911649,2016-11-19,
324,4,5:43,343,343,Haley Lorenzen made Jumper. Assisted by Sydney Searcy.,67,58,9,3,0.9355374836659114,Florida,Temple,6,2,0,0,NA,400911649,2016-11-19,Florida
325,4,5:40,340,340,Temple  Timeout,67,58,9,4,0.9363733145523959,Florida,Temple,6,1,0,1,NA,400911649,2016-11-19,
326,4,5:36,336,336,Tanaya Atkinson made Layup.,67,60,7,13,0.8915287941694973,Florida,Temple,6,1,0,1,NA,400911649,2016-11-19,Temple
327,4,5:23,323,323,Haley Lorenzen missed Layup.,67,60,7,0,0.8966217085527304,Florida,Temple,6,1,0,1,NA,400911649,2016-11-19,
328,4,5:23,323,323,Tanaya Atkinson Defensive Rebound.,67,60,7,8,0.8966217085527304,Florida,Temple,6,1,0,1,NA,400911649,2016-11-19,
329,4,5:15,315,315,Alliya Butts missed Three Point Jumper.,67,60,7,0,0.9000340814886642,Florida,Temple,6,1,0,1,NA,400911649,2016-11-19,
330,4,5:15,315,315,Tyshara Fleming Defensive Rebound.,67,60,7,16,0.9000340814886642,Florida,Temple,6,1,0,1,NA,400911649,2016-11-19,
331,4,4:59,299,299,Eleanna Christinaki made Jumper.,69,60,9,19,0.9483003945831495,Florida,Temple,6,1,0,1,NA,400911649,2016-11-19,Florida
332,4,4:40,280,280,Donnaizha Fountain missed Three Point Jumper.,69,60,9,0,0.948701907699884,Florida,Temple,6,1,0,1,NA,400911649,2016-11-19,
333,4,4:40,280,280,Tanaya Atkinson Offensive Rebound.,69,60,9,18,0.948701907699884,Florida,Temple,6,1,0,1,NA,400911649,2016-11-19,
334,4,4:22,262,262,Foul on Tyshara Fleming.,69,60,9,0,0.9466102025357178,Florida,Temple,6,1,0,0,NA,400911649,2016-11-19,
335,4,4:22,262,262,Tanaya Atkinson missed Free Throw.,69,60,9,0,0.9466102025357178,Florida,Temple,6,1,0,0,NA,400911649,2016-11-19,
336,4,4:22,262,262,Temple Deadball Team Rebound.,69,60,9,0,0.9466102025357178,Florida,Temple,6,1,0,0,NA,400911649,2016-11-19,
337,4,4:22,262,262,Tanaya Atkinson made Free Throw.,69,61,8,10,0.9279617666027425,Florida,Temple,6,1,0,0,NA,400911649,2016-11-19,Temple
338,4,4:12,252,252,Delicia Washington made Layup.,71,61,10,13,0.9595154709472178,Florida,Temple,6,1,0,0,NA,400911649,2016-11-19,Florida
339,4,3:59,239,239,Donnaizha Fountain missed Three Point Jumper.,71,61,10,0,0.9586259315596799,Florida,Temple,6,1,0,0,NA,400911649,2016-11-19,
340,4,3:59,239,239,Alliya Butts Offensive Rebound.,71,61,10,21,0.9586259315596799,Florida,Temple,6,1,0,0,NA,400911649,2016-11-19,
341,4,3:38,218,218,Foul on Dyandria Anderson.,71,61,10,0,0.960492190243706,Florida,Temple,6,1,0,0,NA,400911649,2016-11-19,
342,4,3:38,218,218,Tanaya Atkinson made Free Throw.,71,62,9,0,0.9464373477073275,Florida,Temple,6,1,0,0,NA,400911649,2016-11-19,Temple
343,4,3:38,218,218,Tanaya Atkinson made Free Throw.,71,63,8,9,0.9277585802924826,Florida,Temple,6,1,0,0,NA,400911649,2016-11-19,Temple
344,4,3:29,209,209,Eleanna Christinaki made Layup. Assisted by Haley Lorenzen.,73,63,10,9,0.9630792072815901,Florida,Temple,6,1,0,0,NA,400911649,2016-11-19,Florida
345,4,3:20,200,200,Tanaya Atkinson Turnover.,73,63,10,0,0.9667961314836587,Florida,Temple,6,1,0,0,NA,400911649,2016-11-19,
346,4,3:20,200,200,Foul on Tanaya Atkinson.,73,63,10,22,0.9667961314836587,Florida,Temple,6,1,0,0,NA,400911649,2016-11-19,
347,4,2:58,178,178,Eleanna Christinaki missed Jumper.,73,63,10,0,0.978118486875403,Florida,Temple,6,1,0,0,NA,400911649,2016-11-19,
348,4,2:58,178,178,Haley Lorenzen Offensive Rebound.,73,63,10,4,0.978118486875403,Florida,Temple,6,1,0,0,NA,400911649,2016-11-19,
349,4,2:54,174,174,Ronni Williams made Jumper. Assisted by Eleanna Christinaki.,75,63,12,13,0.9906488882857094,Florida,Temple,6,1,0,0,NA,400911649,2016-11-19,Florida
350,4,2:41,161,161,Feyonda Fitzgerald made Three Point Jumper. Assisted by Alliya Butts.,75,66,9,8,0.9772048769097361,Florida,Temple,6,1,0,0,NA,400911649,2016-11-19,Temple
351,4,2:33,153,153,Haley Lorenzen made Layup. Assisted by Dyandria Anderson.,77,66,11,15,0.9918614322871996,Florida,Temple,6,1,0,0,NA,400911649,2016-11-19,Florida
352,4,2:18,138,138,Feyonda Fitzgerald missed Jumper.,77,66,11,0,0.9947012247873853,Florida,Temple,6,1,0,0,NA,400911649,2016-11-19,
353,4,2:18,138,138,Feyonda Fitzgerald Offensive Rebound.,77,66,11,6,0.9947012247873853,Florida,Temple,6,1,0,0,NA,400911649,2016-11-19,
354,4,2:12,132,132,Feyonda Fitzgerald made Jumper.,77,68,9,7,0.9883288140829114,Florida,Temple,6,1,0,0,NA,400911649,2016-11-19,Temple
355,4,2:05,125,125,Florida  Timeout,77,68,9,0,0.9903668965961143,Florida,Temple,5,1,1,0,NA,400911649,2016-11-19,
356,4,2:05,125,125,Eleanna Christinaki missed Jumper.,77,68,9,0,0.9903668965961143,Florida,Temple,5,1,1,0,NA,400911649,2016-11-19,
357,4,2:05,125,125,Donnaizha Fountain Defensive Rebound.,77,68,9,3,0.9903668965961143,Florida,Temple,5,1,1,0,NA,400911649,2016-11-19,
358,4,2:02,122,122,Foul on Delicia Washington.,77,68,9,0,0.9911672207564786,Florida,Temple,5,1,1,0,NA,400911649,2016-11-19,
359,4,2:02,122,122,Donnaizha Fountain made Free Throw.,77,69,8,0,0.9851665091255679,Florida,Temple,5,1,1,0,NA,400911649,2016-11-19,Temple
360,4,2:02,122,122,Donnaizha Fountain made Free Throw.,77,70,7,26,0.975191142692732,Florida,Temple,5,1,1,0,NA,400911649,2016-11-19,Temple
361,4,1:36,96,96,Foul on Tanaya Atkinson.,77,70,7,0,0.9874278281128186,Florida,Temple,5,1,1,0,NA,400911649,2016-11-19,
362,4,1:36,96,96,Haley Lorenzen made Free Throw.,78,70,8,0,0.9932201109391972,Florida,Temple,5,1,1,0,NA,400911649,2016-11-19,Florida
363,4,1:36,96,96,Haley Lorenzen made Free Throw.,79,70,9,5,0.9963536133449915,Florida,Temple,5,1,1,0,NA,400911649,2016-11-19,Florida
364,4,1:31,91,91,Foul on Ronni Williams.,79,70,9,0,0.9970100530965321,Florida,Temple,5,1,1,0,NA,400911649,2016-11-19,
365,4,1:31,91,91,Feyonda Fitzgerald made Free Throw.,79,71,8,0,0.9943137659597828,Florida,Temple,5,1,1,0,NA,400911649,2016-11-19,Temple
366,4,1:31,91,91,Feyonda Fitzgerald made Free Throw.,79,72,7,14,0.9892123180292359,Florida,Temple,5,1,1,0,NA,400911649,2016-11-19,Temple
367,4,1:17,77,77,Dyandria Anderson Turnover.,79,72,7,1,0.9931021612701197,Florida,Temple,5,1,1,0,NA,400911649,2016-11-19,
368,4,1:16,76,76,Tanaya Atkinson Steal.,79,72,7,2,0.993329942154931,Florida,Temple,5,1,1,0,NA,400911649,2016-11-19,
369,4,1:14,74,74,Tanaya Atkinson made Layup.,79,74,5,8,0.9739865913149823,Florida,Temple,5,1,1,0,NA,400911649,2016-11-19,Temple
370,4,1:06,66,66,Florida  Timeout,79,74,5,21,0.9786671027881189,Florida,Temple,4,1,1,0,NA,400911649,2016-11-19,
371,4,0:45,45,45,Eleanna Christinaki made Jumper.,81,74,7,15,0.997896221785585,Florida,Temple,4,1,1,0,NA,400911649,2016-11-19,Florida
372,4,0:30,30,30,Alliya Butts missed Jumper.,81,74,7,0,0.9988869369386704,Florida,Temple,4,1,1,0,NA,400911649,2016-11-19,
373,4,0:30,30,30,Ronni Williams Defensive Rebound.,81,74,7,3,0.9988869369386704,Florida,Temple,4,1,1,0,NA,400911649,2016-11-19,
374,4,0:27,27,27,Foul on Donnaizha Fountain.,81,74,7,2,0.9990253104137609,Florida,Temple,4,1,1,0,NA,400911649,2016-11-19,
375,4,0:25,25,25,Foul on Feyonda Fitzgerald.,81,74,7,0,0.999108591239572,Florida,Temple,4,1,1,0,NA,400911649,2016-11-19,
376,4,0:25,25,25,Eleanna Christinaki missed Free Throw.,81,74,7,0,0.999108591239572,Florida,Temple,4,1,1,0,NA,400911649,2016-11-19,
377,4,0:25,25,25,Florida Deadball Team Rebound.,81,74,7,0,0.999108591239572,Florida,Temple,4,1,1,0,NA,400911649,2016-11-19,
378,4,0:25,25,25,Eleanna Christinaki made Free Throw.,82,74,8,6,0.9996729048122958,Florida,Temple,4,1,1,0,NA,400911649,2016-11-19,Florida
379,4,0:19,19,19,Feyonda Fitzgerald missed Jumper.,82,74,8,0,0.9997607039400961,Florida,Temple,4,1,1,0,NA,400911649,2016-11-19,
380,4,0:19,19,19,Donnaizha Fountain Offensive Rebound.,82,74,8,5,0.9997607039400961,Florida,Temple,4,1,1,0,NA,400911649,2016-11-19,
381,4,0:14,14,14,Tanaya Atkinson missed Jumper.,82,74,8,0,0.9998175257600757,Florida,Temple,4,1,1,0,NA,400911649,2016-11-19,
382,4,0:14,14,14,Donnaizha Fountain Offensive Rebound.,82,74,8,3,0.9998175257600757,Florida,Temple,4,1,1,0,NA,400911649,2016-11-19,
383,4,0:11,11,11,Donnaizha Fountain made Layup.,82,76,6,5,0.9986164130417434,Florida,Temple,4,1,1,0,NA,400911649,2016-11-19,Temple
384,4,0:06,6,6,Foul on Tanaya Atkinson.,82,76,6,0,0.9988815889344047,Florida,Temple,4,1,1,0,NA,400911649,2016-11-19,
385,4,0:06,6,6,Ronni Williams made Free Throw.,83,76,7,0,0.9996393283371705,Florida,Temple,4,1,1,0,NA,400911649,2016-11-19,Florida
386,4,0:06,6,6,Ronni Williams missed Free Throw.,83,76,7,0,0.9996393283371705,Florida,Temple,4,1,1,0,NA,400911649,2016-11-19,
