play_id,period,time_remaining_period,secs_remaining,secs_remaining_absolute,description,home_score,away_score,score_diff,play_length,win_prob,home,away,home_time_out_remaining,away_time_out_remaining,home_timeout_ind,away_timeout_ind,home_favored_by,game_id,date,whichScored
1,1,9:48,2388,2388,Tia Hay Turnover.,0,0,0,13,0.5,UC Davis,Santa Clara,4,4,0,0,NA,401177498,2019-11-16,NA
2,1,9:35,2375,2375,Kayla Konrad missed Jumper.,0,0,0,6,0.5,UC Davis,Santa Clara,4,4,0,0,NA,401177498,2019-11-16,
3,1,9:29,2369,2369,Lindsey VanAllen Defensive Rebound.,0,0,0,17,0.5,UC Davis,Santa Clara,4,4,0,0,NA,401177498,2019-11-16,
4,1,9:12,2352,2352,Foul on Kayla Konrad.,0,0,0,19,0.5,UC Davis,Santa Clara,4,4,0,0,NA,401177498,2019-11-16,
5,1,8:53,2333,2333,Mackenzie Trpcic made Jumper. Assisted by Katie Toole.,2,2,0,5,0.5,UC Davis,Santa Clara,4,4,0,0,NA,401177498,2019-11-16,UC Davis
6,1,8:48,2328,2328,Ashlyn Herlihy made Free Throw.,2,1,1,9,0.522832370508976,UC Davis,Santa Clara,4,4,0,0,NA,401177498,2019-11-16,
7,1,8:39,2319,2319,Foul on Ashlyn Herlihy.,2,2,0,0,0.5,UC Davis,Santa Clara,4,4,0,0,NA,401177498,2019-11-16,Santa Clara
8,1,8:39,2319,2319,Ashlyn Herlihy Turnover.,2,2,0,1,0.5,UC Davis,Santa Clara,4,4,0,0,NA,401177498,2019-11-16,
9,1,8:38,2318,2318,Ashlyn Herlihy made Free Throw.,2,2,0,14,0.5,UC Davis,Santa Clara,4,4,0,0,NA,401177498,2019-11-16,
10,1,8:24,2304,2304,Foul on Lauren Yearwood.,2,2,0,0,0.5,UC Davis,Santa Clara,4,4,0,0,NA,401177498,2019-11-16,
11,1,8:24,2304,2304,Katie Toole made Free Throw.,3,2,1,0,0.5230985195738199,UC Davis,Santa Clara,4,4,0,0,NA,401177498,2019-11-16,UC Davis
12,1,8:24,2304,2304,Katie Toole made Free Throw.,4,2,2,14,0.5460986569417104,UC Davis,Santa Clara,4,4,0,0,NA,401177498,2019-11-16,UC Davis
13,1,8:10,2290,2290,Ashlyn Herlihy made Jumper.,4,4,0,18,0.5,UC Davis,Santa Clara,4,4,0,0,NA,401177498,2019-11-16,Santa Clara
14,1,7:52,2272,2272,Mackenzie Trpcic missed Three Point Jumper.,4,4,0,5,0.5,UC Davis,Santa Clara,4,4,0,0,NA,401177498,2019-11-16,
15,1,7:47,2267,2267,Lindsey VanAllen Defensive Rebound.,4,4,0,4,0.5,UC Davis,Santa Clara,4,4,0,0,NA,401177498,2019-11-16,
16,1,7:43,2263,2263,Lindsey VanAllen made Layup.,4,6,-2,0,0.45298421201451977,UC Davis,Santa Clara,4,4,0,0,NA,401177498,2019-11-16,Santa Clara
17,1,7:43,2263,2263,Foul on Mackenzie Trpcic.,4,6,-2,2,0.45298421201451977,UC Davis,Santa Clara,4,4,0,0,NA,401177498,2019-11-16,
18,1,7:41,2261,2261,Lindsey VanAllen made Free Throw.,4,7,-3,6,0.4296685097944087,UC Davis,Santa Clara,4,4,0,0,NA,401177498,2019-11-16,Santa Clara
19,1,7:35,2255,2255,Katie Toole missed Three Point Jumper.,4,7,-3,5,0.42946740801801747,UC Davis,Santa Clara,4,4,0,0,NA,401177498,2019-11-16,
20,1,7:30,2250,2250,Lauren Yearwood Defensive Rebound.,4,7,-3,9,0.42929951130972055,UC Davis,Santa Clara,4,4,0,0,NA,401177498,2019-11-16,
21,1,7:21,2241,2241,Merle Wiehl Turnover.,4,7,-3,0,0.42899661567395236,UC Davis,Santa Clara,4,4,0,0,NA,401177498,2019-11-16,
22,1,7:21,2241,2241,Cierra Hall Steal.,4,7,-3,23,0.42899661567395236,UC Davis,Santa Clara,4,4,0,0,NA,401177498,2019-11-16,
23,1,6:58,2218,2218,Katie Toole made Jumper. Assisted by Mackenzie Trpcic.,6,7,-1,16,0.4759251629552016,UC Davis,Santa Clara,4,4,0,0,NA,401177498,2019-11-16,UC Davis
24,1,6:42,2202,2202,Merle Wiehl missed Three Point Jumper.,6,7,-1,4,0.47574052351671575,UC Davis,Santa Clara,4,4,0,0,NA,401177498,2019-11-16,
25,1,6:38,2198,2198,Katie Toole Defensive Rebound.,6,7,-1,1,0.4756942538677578,UC Davis,Santa Clara,4,4,0,0,NA,401177498,2019-11-16,
26,1,6:37,2197,2197,Katie Toole made Layup.,8,7,1,0,0.524317319945558,UC Davis,Santa Clara,4,4,0,0,NA,401177498,2019-11-16,UC Davis
27,1,6:37,2197,2197,Foul on Lindsey VanAllen.,8,7,1,0,0.524317319945558,UC Davis,Santa Clara,4,4,0,0,NA,401177498,2019-11-16,
28,1,6:37,2197,2197,Katie Toole made Free Throw.,9,7,2,31,0.5485198744639151,UC Davis,Santa Clara,4,4,0,0,NA,401177498,2019-11-16,UC Davis
29,1,6:06,2166,2166,Tia Hay missed Three Point Jumper.,9,7,2,5,0.5492345457745712,UC Davis,Santa Clara,4,4,0,0,NA,401177498,2019-11-16,
30,1,6:01,2161,2161,Nina Bessolo Defensive Rebound.,9,7,2,10,0.5493502722348179,UC Davis,Santa Clara,4,4,0,0,NA,401177498,2019-11-16,
31,1,5:51,2151,2151,Nina Bessolo missed Three Point Jumper.,9,7,2,9,0.5495822928983269,UC Davis,Santa Clara,4,4,0,0,NA,401177498,2019-11-16,
32,1,5:42,2142,2142,Ashlyn Herlihy Defensive Rebound.,9,7,2,1,0.5497917817235468,UC Davis,Santa Clara,4,4,0,0,NA,401177498,2019-11-16,
33,1,5:41,2141,2141,Foul on Katie Toole.,9,7,2,0,0.5498150985748921,UC Davis,Santa Clara,4,4,0,0,NA,401177498,2019-11-16,
34,1,5:41,2141,2141,Tia Hay made Free Throw.,9,8,1,1,0.524969667148936,UC Davis,Santa Clara,4,4,0,0,NA,401177498,2019-11-16,Santa Clara
35,1,5:40,2140,2140,Tia Hay made Free Throw.,9,9,0,5,0.5,UC Davis,Santa Clara,4,4,0,0,NA,401177498,2019-11-16,Santa Clara
36,1,5:35,2135,2135,Kayla Konrad made Jumper. Assisted by Mackenzie Trpcic.,11,9,2,24,0.5499551727708791,UC Davis,Santa Clara,4,4,0,0,NA,401177498,2019-11-16,UC Davis
37,1,5:11,2111,2111,Lauren Yearwood missed Three Point Jumper.,11,9,2,6,0.5505185617369068,UC Davis,Santa Clara,4,4,0,0,NA,401177498,2019-11-16,
38,1,5:05,2105,2105,Lana Hollingsworth Offensive Rebound.,11,9,2,3,0.5506602182867172,UC Davis,Santa Clara,4,4,0,0,NA,401177498,2019-11-16,
39,1,5:02,2102,2102,Merle Wiehl missed Three Point Jumper.,11,9,2,9,0.5507311729416302,UC Davis,Santa Clara,4,4,0,0,NA,401177498,2019-11-16,
40,1,4:53,2093,2093,Katie Toole Defensive Rebound.,11,9,2,9,0.550944553294396,UC Davis,Santa Clara,4,4,0,0,NA,401177498,2019-11-16,
41,1,4:44,2084,2084,Katie Toole made Three Point Jumper. Assisted by Mackenzie Trpcic.,14,9,5,24,0.6255993843299188,UC Davis,Santa Clara,4,4,0,0,NA,401177498,2019-11-16,UC Davis
42,1,4:20,2060,2060,Tia Hay made Layup.,14,11,3,20,0.5772558407813325,UC Davis,Santa Clara,4,4,0,0,NA,401177498,2019-11-16,Santa Clara
43,1,4:00,2040,2040,Sage Stobbart made Layup. Assisted by Mackenzie Trpcic.,16,11,5,25,0.6281039472021778,UC Davis,Santa Clara,4,4,0,0,NA,401177498,2019-11-16,UC Davis
44,1,3:35,2015,2015,Lana Hollingsworth made Layup.,16,13,3,16,0.5788771723151209,UC Davis,Santa Clara,4,4,0,0,NA,401177498,2019-11-16,Santa Clara
45,1,3:19,1999,1999,Kayla Konrad missed Jumper.,16,13,3,4,0.5794621409675412,UC Davis,Santa Clara,4,4,0,0,NA,401177498,2019-11-16,
46,1,3:15,1995,1995,Sage Stobbart Offensive Rebound.,16,13,3,2,0.5796091214569224,UC Davis,Santa Clara,4,4,0,0,NA,401177498,2019-11-16,
47,1,3:13,1993,1993,Sophia Song made Three Point Jumper. Assisted by Sage Stobbart.,19,13,6,28,0.6554182383225687,UC Davis,Santa Clara,4,4,0,0,NA,401177498,2019-11-16,UC Davis
48,1,2:45,1965,1965,Lana Hollingsworth missed Three Point Jumper.,19,13,6,5,0.657341690079042,UC Davis,Santa Clara,4,4,0,0,NA,401177498,2019-11-16,
49,1,2:40,1960,1960,Sage Stobbart Defensive Rebound.,19,13,6,3,0.6576878009899739,UC Davis,Santa Clara,4,4,0,0,NA,401177498,2019-11-16,
50,1,2:37,1957,1957,Foul on Addi Walters.,19,13,6,0,0.6578958625578378,UC Davis,Santa Clara,4,4,0,0,NA,401177498,2019-11-16,
51,1,2:37,1957,1957,Official TV Timeout,19,13,6,0,0.6578958625578378,UC Davis,Santa Clara,4,4,0,0,NA,401177498,2019-11-16,
52,1,2:37,1957,1957,Mackenzie Trpcic missed Free Throw.,19,13,6,0,0.6578958625578378,UC Davis,Santa Clara,4,4,0,0,NA,401177498,2019-11-16,
53,1,2:37,1957,1957,UC Davis Offensive Rebound.,19,13,6,0,0.6578958625578378,UC Davis,Santa Clara,4,4,0,0,NA,401177498,2019-11-16,
54,1,2:37,1957,1957,Mackenzie Trpcic missed Free Throw.,19,13,6,4,0.6578958625578378,UC Davis,Santa Clara,4,4,0,0,NA,401177498,2019-11-16,
55,1,2:33,1953,1953,Lexie Pritchard Defensive Rebound.,19,13,6,6,0.6581737432465339,UC Davis,Santa Clara,4,4,0,0,NA,401177498,2019-11-16,
56,1,2:27,1947,1947,Lexie Pritchard missed Layup.,19,13,6,4,0.6585915714764586,UC Davis,Santa Clara,4,4,0,0,NA,401177498,2019-11-16,
57,1,2:23,1943,1943,Cierra Hall Defensive Rebound.,19,13,6,1,0.658870802398035,UC Davis,Santa Clara,4,4,0,0,NA,401177498,2019-11-16,
58,1,2:22,1942,1942,Foul on Lexie Pritchard.,19,13,6,0,0.6589406956900598,UC Davis,Santa Clara,4,4,0,0,NA,401177498,2019-11-16,
59,1,2:22,1942,1942,Mackenzie Trpcic made Free Throw.,20,13,7,1,0.6831616983921132,UC Davis,Santa Clara,4,4,0,0,NA,401177498,2019-11-16,UC Davis
60,1,2:21,1941,1941,Mackenzie Trpcic missed Free Throw.,20,13,7,2,0.6832402714070321,UC Davis,Santa Clara,4,4,0,0,NA,401177498,2019-11-16,
61,1,2:19,1939,1939,Lana Hollingsworth Defensive Rebound.,20,13,7,21,0.6833975256337543,UC Davis,Santa Clara,4,4,0,0,NA,401177498,2019-11-16,
62,1,1:58,1918,1918,Foul on Sophia Song.,20,13,7,8,0.6850531095927159,UC Davis,Santa Clara,4,4,0,0,NA,401177498,2019-11-16,
63,1,1:50,1910,1910,Ashlyn Herlihy missed Layup.,20,13,7,0,0.6856821536646851,UC Davis,Santa Clara,4,4,0,0,NA,401177498,2019-11-16,
64,1,1:50,1910,1910,Sage Stobbart Block.,20,13,7,9,0.6856821536646851,UC Davis,Santa Clara,4,4,0,0,NA,401177498,2019-11-16,
65,1,1:41,1901,1901,Sage Stobbart Defensive Rebound.,20,13,7,14,0.686388536624581,UC Davis,Santa Clara,4,4,0,0,NA,401177498,2019-11-16,
66,1,1:27,1887,1887,Cierra Hall Turnover.,20,13,7,0,0.6874854152216447,UC Davis,Santa Clara,4,4,0,0,NA,401177498,2019-11-16,
67,1,1:27,1887,1887,Addi Walters Steal.,20,13,7,5,0.6874854152216447,UC Davis,Santa Clara,4,4,0,0,NA,401177498,2019-11-16,
68,1,1:22,1882,1882,Addi Walters missed Layup.,20,13,7,0,0.6878767919843071,UC Davis,Santa Clara,4,4,0,0,NA,401177498,2019-11-16,
69,1,1:22,1882,1882,Santa Clara Offensive Rebound.,20,13,7,2,0.6878767919843071,UC Davis,Santa Clara,4,4,0,0,NA,401177498,2019-11-16,
70,1,1:20,1880,1880,Foul on Lana Hollingsworth.,20,13,7,0,0.6880333115507471,UC Davis,Santa Clara,4,4,0,0,NA,401177498,2019-11-16,
71,1,1:20,1880,1880,Lana Hollingsworth Turnover.,20,13,7,14,0.6880333115507471,UC Davis,Santa Clara,4,4,0,0,NA,401177498,2019-11-16,
72,1,1:06,1866,1866,Cierra Hall missed Jumper.,20,13,7,8,0.6891288123549588,UC Davis,Santa Clara,4,4,0,0,NA,401177498,2019-11-16,
73,1,0:58,1858,1858,Emily Wolph Defensive Rebound.,20,13,7,2,0.6897550296265001,UC Davis,Santa Clara,4,4,0,0,NA,401177498,2019-11-16,
74,1,0:56,1856,1856,Emily Wolph Turnover.,20,13,7,0,0.6899116452420059,UC Davis,Santa Clara,4,4,0,0,NA,401177498,2019-11-16,
75,1,0:56,1856,1856,Campbell Gray Steal.,20,13,7,3,0.6899116452420059,UC Davis,Santa Clara,4,4,0,0,NA,401177498,2019-11-16,
76,1,0:53,1853,1853,Foul on Nina Bessolo.,20,13,7,0,0.6901466294742135,UC Davis,Santa Clara,4,4,0,0,NA,401177498,2019-11-16,
77,1,0:53,1853,1853,Nina Bessolo Turnover.,20,13,7,19,0.6901466294742135,UC Davis,Santa Clara,4,4,0,0,NA,401177498,2019-11-16,
78,1,0:34,1834,1834,Emily Wolph missed Three Point Jumper.,20,13,7,0,0.6916373171924827,UC Davis,Santa Clara,4,4,0,0,NA,401177498,2019-11-16,
79,1,0:34,1834,1834,Nina Bessolo Block.,20,13,7,1,0.6916373171924827,UC Davis,Santa Clara,4,4,0,0,NA,401177498,2019-11-16,
80,1,0:33,1833,1833,Santa Clara Offensive Rebound.,20,13,7,8,0.6917159265760751,UC Davis,Santa Clara,4,4,0,0,NA,401177498,2019-11-16,
81,1,0:25,1825,1825,Ashlyn Herlihy made Layup. Assisted by Emily Wolph.,20,15,5,23,0.6409207392310161,UC Davis,Santa Clara,4,4,0,0,NA,401177498,2019-11-16,Santa Clara
82,1,0:02,1802,1802,Cierra Hall missed Three Point Jumper.,20,15,5,2,0.6423253977468899,UC Davis,Santa Clara,4,4,0,0,NA,401177498,2019-11-16,
83,1,0:00,1800,1800,Ashlyn Herlihy Defensive Rebound.,20,15,5,0,0.6424482088636343,UC Davis,Santa Clara,4,4,0,0,NA,401177498,2019-11-16,
84,1,0:00,1800,1800,End of 1st Quarter,20,15,5,9,0.6424482088636343,UC Davis,Santa Clara,4,4,0,0,NA,401177498,2019-11-16,
85,2,9:51,1791,1791,Nina Bessolo made Layup. Assisted by Mackenzie Trpcic.,22,15,7,25,0.6950396242988275,UC Davis,Santa Clara,4,4,0,0,NA,401177498,2019-11-16,UC Davis
86,2,9:26,1766,1766,Ashlyn Herlihy made Layup. Assisted by Tia Hay.,22,17,5,0,0.6445565143700558,UC Davis,Santa Clara,4,4,0,0,NA,401177498,2019-11-16,Santa Clara
87,2,9:26,1766,1766,Foul on Cierra Hall.,22,17,5,0,0.6445565143700558,UC Davis,Santa Clara,4,4,0,0,NA,401177498,2019-11-16,
88,2,9:26,1766,1766,Ashlyn Herlihy made Free Throw.,22,18,4,15,0.6168399947991066,UC Davis,Santa Clara,4,4,0,0,NA,401177498,2019-11-16,Santa Clara
89,2,9:11,1751,1751,Foul on Kayla Konrad.,22,18,4,0,0.6176197497490395,UC Davis,Santa Clara,4,4,0,0,NA,401177498,2019-11-16,
90,2,9:11,1751,1751,Kayla Konrad Turnover.,22,18,4,11,0.6176197497490395,UC Davis,Santa Clara,4,4,0,0,NA,401177498,2019-11-16,
91,2,9:00,1740,1740,Lauren Yearwood made Three Point Jumper. Assisted by Tia Hay.,22,21,1,20,0.5300825886464002,UC Davis,Santa Clara,4,4,0,0,NA,401177498,2019-11-16,Santa Clara
92,2,8:40,1720,1720,Katie Toole Turnover.,22,21,1,0,0.5303633642745524,UC Davis,Santa Clara,4,4,0,0,NA,401177498,2019-11-16,
93,2,8:40,1720,1720,Tia Hay Steal.,22,21,1,13,0.5303633642745524,UC Davis,Santa Clara,4,4,0,0,NA,401177498,2019-11-16,
94,2,8:27,1707,1707,Foul on Ashlyn Herlihy.,22,21,1,0,0.5305487560888571,UC Davis,Santa Clara,4,4,0,0,NA,401177498,2019-11-16,
95,2,8:27,1707,1707,Ashlyn Herlihy Turnover.,22,21,1,17,0.5305487560888571,UC Davis,Santa Clara,4,4,0,0,NA,401177498,2019-11-16,
96,2,8:10,1690,1690,Sage Stobbart missed Layup.,22,21,1,4,0.5307949536065145,UC Davis,Santa Clara,4,4,0,0,NA,401177498,2019-11-16,
97,2,8:06,1686,1686,Tia Hay Defensive Rebound.,22,21,1,5,0.530853221960762,UC Davis,Santa Clara,4,4,0,0,NA,401177498,2019-11-16,
98,2,8:01,1681,1681,Ashlyn Herlihy missed Three Point Jumper.,22,21,1,2,0.530925546049774,UC Davis,Santa Clara,4,4,0,0,NA,401177498,2019-11-16,
99,2,7:59,1679,1679,Santa Clara Offensive Rebound.,22,21,1,0,0.5309543236525619,UC Davis,Santa Clara,4,4,0,0,NA,401177498,2019-11-16,
100,2,7:59,1679,1679,Foul on Mackenzie Trpcic.,22,21,1,10,0.5309543236525619,UC Davis,Santa Clara,4,4,0,0,NA,401177498,2019-11-16,
101,2,7:49,1669,1669,Tia Hay missed Three Point Jumper.,22,21,1,4,0.5310970019770784,UC Davis,Santa Clara,4,4,0,0,NA,401177498,2019-11-16,
102,2,7:45,1665,1665,Lana Hollingsworth Offensive Rebound.,22,21,1,1,0.5311535498262757,UC Davis,Santa Clara,4,4,0,0,NA,401177498,2019-11-16,
103,2,7:44,1664,1664,Lana Hollingsworth missed Jumper.,22,21,1,3,0.5311676434843852,UC Davis,Santa Clara,4,4,0,0,NA,401177498,2019-11-16,
104,2,7:41,1661,1661,Katie Toole Defensive Rebound.,22,21,1,2,0.531209824925366,UC Davis,Santa Clara,4,4,0,0,NA,401177498,2019-11-16,
105,2,7:39,1659,1659,Nina Bessolo Turnover.,22,21,1,0,0.5312378656894079,UC Davis,Santa Clara,4,4,0,0,NA,401177498,2019-11-16,
106,2,7:39,1659,1659,Naomi Jimenez Steal.,22,21,1,10,0.5312378656894079,UC Davis,Santa Clara,4,4,0,0,NA,401177498,2019-11-16,
107,2,7:29,1649,1649,Tia Hay made Layup.,22,23,-1,1,0.46862281041906856,UC Davis,Santa Clara,4,4,0,0,NA,401177498,2019-11-16,Santa Clara
108,2,7:28,1648,1648,UC Davis  Timeout,22,23,-1,14,0.4686089521417577,UC Davis,Santa Clara,3,4,1,0,NA,401177498,2019-11-16,
109,2,7:14,1634,1634,Nina Bessolo made Three Point Jumper. Assisted by Campbell Gray.,25,23,2,20,0.5629167301903858,UC Davis,Santa Clara,3,4,1,0,NA,401177498,2019-11-16,UC Davis
110,2,6:54,1614,1614,Lauren Yearwood missed Layup.,25,23,2,5,0.5634557355551298,UC Davis,Santa Clara,3,4,1,0,NA,401177498,2019-11-16,
111,2,6:49,1609,1609,Lauren Yearwood Offensive Rebound.,25,23,2,1,0.5635899247872772,UC Davis,Santa Clara,3,4,1,0,NA,401177498,2019-11-16,
112,2,6:48,1608,1608,Lana Hollingsworth missed Three Point Jumper.,25,23,2,5,0.5636167497625443,UC Davis,Santa Clara,3,4,1,0,NA,401177498,2019-11-16,
113,2,6:43,1603,1603,Lindsey VanAllen Offensive Rebound.,25,23,2,4,0.5637508401185388,UC Davis,Santa Clara,3,4,1,0,NA,401177498,2019-11-16,
114,2,6:39,1599,1599,Foul on Campbell Gray.,25,23,2,17,0.5638581035199477,UC Davis,Santa Clara,3,4,1,0,NA,401177498,2019-11-16,
115,2,6:22,1582,1582,Naomi Jimenez made Layup.,25,25,0,28,0.5,UC Davis,Santa Clara,3,4,0,0,NA,401177498,2019-11-16,Santa Clara
116,2,5:54,1554,1554,Sage Stobbart missed Three Point Jumper.,25,25,0,3,0.5,UC Davis,Santa Clara,3,4,0,0,NA,401177498,2019-11-16,
117,2,5:51,1551,1551,Santa Clara Defensive Rebound.,25,25,0,21,0.5,UC Davis,Santa Clara,3,4,0,0,NA,401177498,2019-11-16,
118,2,5:30,1530,1530,Lana Hollingsworth missed Three Point Jumper.,25,25,0,5,0.5,UC Davis,Santa Clara,3,4,0,0,NA,401177498,2019-11-16,
119,2,5:25,1525,1525,Sage Stobbart Defensive Rebound.,25,25,0,5,0.5,UC Davis,Santa Clara,3,4,0,0,NA,401177498,2019-11-16,
120,2,5:20,1520,1520,Katie Toole made Three Point Jumper. Assisted by Campbell Gray.,28,25,3,21,0.5983246601700475,UC Davis,Santa Clara,3,4,0,0,NA,401177498,2019-11-16,UC Davis
121,2,4:59,1499,1499,Tia Hay missed Three Point Jumper.,28,25,3,4,0.5992232248521422,UC Davis,Santa Clara,3,4,0,0,NA,401177498,2019-11-16,
122,2,4:55,1495,1495,Sage Stobbart Defensive Rebound.,28,25,3,4,0.5993982149926522,UC Davis,Santa Clara,3,4,0,0,NA,401177498,2019-11-16,
123,2,4:51,1491,1491,Nina Bessolo missed Three Point Jumper.,28,25,3,6,0.5995745537783187,UC Davis,Santa Clara,3,4,0,0,NA,401177498,2019-11-16,
124,2,4:45,1485,1485,Cierra Hall Offensive Rebound.,28,25,3,1,0.5998417004353702,UC Davis,Santa Clara,3,4,0,0,NA,401177498,2019-11-16,
125,2,4:44,1484,1484,Katie Toole made Three Point Jumper. Assisted by Cierra Hall.,31,25,6,2,0.6921062618248628,UC Davis,Santa Clara,3,4,0,0,NA,401177498,2019-11-16,UC Davis
126,2,4:42,1482,1482,Santa Clara  Timeout,31,25,6,23,0.6922659874375408,UC Davis,Santa Clara,3,3,0,1,NA,401177498,2019-11-16,
127,2,4:19,1459,1459,Lauren Yearwood missed Jumper.,31,25,6,5,0.694151261457709,UC Davis,Santa Clara,3,3,0,1,NA,401177498,2019-11-16,
128,2,4:14,1454,1454,Lana Hollingsworth Offensive Rebound.,31,25,6,1,0.6945738189221338,UC Davis,Santa Clara,3,3,0,1,NA,401177498,2019-11-16,
129,2,4:13,1453,1453,Merle Wiehl missed Layup.,31,25,6,3,0.6946589133799638,UC Davis,Santa Clara,3,3,0,1,NA,401177498,2019-11-16,
130,2,4:10,1450,1450,Cierra Hall Defensive Rebound.,31,25,6,2,0.6949153861211657,UC Davis,Santa Clara,3,3,0,1,NA,401177498,2019-11-16,
131,2,4:08,1448,1448,Foul on Nina Bessolo.,31,25,6,0,0.6950865428613526,UC Davis,Santa Clara,3,3,0,1,NA,401177498,2019-11-16,
132,2,4:08,1448,1448,Nina Bessolo Turnover.,31,25,6,22,0.6950865428613526,UC Davis,Santa Clara,3,3,0,1,NA,401177498,2019-11-16,
133,2,3:46,1426,1426,Addi Walters missed Layup.,31,25,6,4,0.6969186267793595,UC Davis,Santa Clara,3,3,0,1,NA,401177498,2019-11-16,
134,2,3:42,1422,1422,Evanne Turner Defensive Rebound.,31,25,6,17,0.697243006394298,UC Davis,Santa Clara,3,3,0,1,NA,401177498,2019-11-16,
135,2,3:25,1405,1405,Sage Stobbart missed Jumper.,31,25,6,4,0.6985981969545999,UC Davis,Santa Clara,3,3,0,0,NA,401177498,2019-11-16,
136,2,3:21,1401,1401,Lauren Yearwood Defensive Rebound.,31,25,6,7,0.6989124413264148,UC Davis,Santa Clara,3,3,0,0,NA,401177498,2019-11-16,
137,2,3:14,1394,1394,Foul on Lana Hollingsworth.,31,25,6,0,0.6994590368706968,UC Davis,Santa Clara,3,3,0,0,NA,401177498,2019-11-16,
138,2,3:14,1394,1394,Lana Hollingsworth Turnover.,31,25,6,11,0.6994590368706968,UC Davis,Santa Clara,3,3,0,0,NA,401177498,2019-11-16,
139,2,3:03,1383,1383,Foul on Lauren Yearwood.,31,25,6,12,0.7003112255277626,UC Davis,Santa Clara,3,3,0,0,NA,401177498,2019-11-16,
140,2,2:51,1371,1371,Foul on Merle Wiehl.,31,25,6,5,0.7012349250339023,UC Davis,Santa Clara,3,3,0,0,NA,401177498,2019-11-16,
141,2,2:46,1366,1366,Evanne Turner made Three Point Jumper. Assisted by Katie Toole.,34,25,9,28,0.7828798972970277,UC Davis,Santa Clara,3,3,0,0,NA,401177498,2019-11-16,UC Davis
142,2,2:18,1338,1338,Merle Wiehl missed Three Point Jumper.,34,25,9,5,0.7855025173782676,UC Davis,Santa Clara,3,3,0,0,NA,401177498,2019-11-16,
143,2,2:13,1333,1333,Evanne Turner Defensive Rebound.,34,25,9,5,0.7859743500004238,UC Davis,Santa Clara,3,3,0,0,NA,401177498,2019-11-16,
144,2,2:08,1328,1328,Campbell Gray missed Jumper.,34,25,9,4,0.7864481654897975,UC Davis,Santa Clara,3,3,0,0,NA,401177498,2019-11-16,
145,2,2:04,1324,1324,Sage Stobbart Offensive Rebound.,34,25,9,10,0.7868288861348979,UC Davis,Santa Clara,3,3,0,0,NA,401177498,2019-11-16,
146,2,1:54,1314,1314,Foul on Erica Meyer.,34,25,9,0,0.7877884344985194,UC Davis,Santa Clara,3,3,0,0,NA,401177498,2019-11-16,
147,2,1:54,1314,1314,Cierra Hall made Free Throw.,35,25,10,1,0.8111322795091142,UC Davis,Santa Clara,3,3,0,0,NA,401177498,2019-11-16,UC Davis
148,2,1:53,1313,1313,Cierra Hall missed Free Throw.,35,25,10,3,0.8112306750377754,UC Davis,Santa Clara,3,3,0,0,NA,401177498,2019-11-16,
149,2,1:50,1310,1310,Tia Hay Defensive Rebound.,35,25,10,22,0.8115266639019376,UC Davis,Santa Clara,3,3,0,0,NA,401177498,2019-11-16,
150,2,1:28,1288,1288,Foul on Erica Meyer.,35,25,10,0,0.8137406354821364,UC Davis,Santa Clara,3,3,0,0,NA,401177498,2019-11-16,
151,2,1:28,1288,1288,Erica Meyer Turnover.,35,25,10,19,0.8137406354821364,UC Davis,Santa Clara,3,3,0,0,NA,401177498,2019-11-16,
152,2,1:09,1269,1269,Katie Toole missed Layup.,35,25,10,3,0.8157296592252005,UC Davis,Santa Clara,3,3,0,0,NA,401177498,2019-11-16,
153,2,1:06,1266,1266,Tia Hay Defensive Rebound.,35,25,10,0,0.8160515170268027,UC Davis,Santa Clara,3,3,0,0,NA,401177498,2019-11-16,
154,2,1:06,1266,1266,Tia Hay Turnover.,35,25,10,26,0.8160515170268027,UC Davis,Santa Clara,3,3,0,0,NA,401177498,2019-11-16,
155,2,0:40,1240,1240,Campbell Gray made Layup.,37,25,12,28,0.8594902366963237,UC Davis,Santa Clara,3,3,0,0,NA,401177498,2019-11-16,UC Davis
156,2,0:12,1212,1212,Lexie Pritchard made Three Point Jumper. Assisted by Emily Wolph.,37,28,9,12,0.798805313088401,UC Davis,Santa Clara,3,3,0,0,NA,401177498,2019-11-16,Santa Clara
157,2,0:00,1200,1200,End of 2nd Quarter,37,28,9,18,0.8002839754918194,UC Davis,Santa Clara,3,3,0,0,NA,401177498,2019-11-16,
158,3,9:42,1182,1182,Kayla Konrad missed Three Point Jumper.,37,28,9,2,0.8024262463396806,UC Davis,Santa Clara,4,4,0,0,NA,401177498,2019-11-16,
159,3,9:40,1180,1180,Santa Clara Defensive Rebound.,37,28,9,14,0.8026594021707583,UC Davis,Santa Clara,4,4,0,0,NA,401177498,2019-11-16,
160,3,9:26,1166,1166,Ashlyn Herlihy made Layup.,37,30,7,17,0.7501011627861318,UC Davis,Santa Clara,4,4,0,0,NA,401177498,2019-11-16,Santa Clara
161,3,9:09,1149,1149,Katie Toole missed Layup.,37,30,7,3,0.7518769725276063,UC Davis,Santa Clara,4,4,0,0,NA,401177498,2019-11-16,
162,3,9:06,1146,1146,Cierra Hall Offensive Rebound.,37,30,7,0,0.7521878516945639,UC Davis,Santa Clara,4,4,0,0,NA,401177498,2019-11-16,
163,3,9:06,1146,1146,Foul on Tia Hay.,37,30,7,0,0.7521878516945639,UC Davis,Santa Clara,4,4,0,0,NA,401177498,2019-11-16,
164,3,9:06,1146,1146,Cierra Hall missed Free Throw.,37,30,7,0,0.7521878516945639,UC Davis,Santa Clara,4,4,0,0,NA,401177498,2019-11-16,
165,3,9:06,1146,1146,UC Davis Offensive Rebound.,37,30,7,0,0.7521878516945639,UC Davis,Santa Clara,4,4,0,0,NA,401177498,2019-11-16,
166,3,9:06,1146,1146,Cierra Hall made Free Throw.,38,30,8,21,0.7805597913751694,UC Davis,Santa Clara,4,4,0,0,NA,401177498,2019-11-16,UC Davis
167,3,8:45,1125,1125,Lauren Yearwood missed Jumper.,38,30,8,4,0.7828342562379843,UC Davis,Santa Clara,4,4,0,0,NA,401177498,2019-11-16,
168,3,8:41,1121,1121,Cierra Hall Defensive Rebound.,38,30,8,4,0.7832670071917562,UC Davis,Santa Clara,4,4,0,0,NA,401177498,2019-11-16,
169,3,8:37,1117,1117,Katie Toole Turnover.,38,30,8,12,0.7837001723369337,UC Davis,Santa Clara,4,4,0,0,NA,401177498,2019-11-16,
170,3,8:25,1105,1105,Merle Wiehl made Layup.,38,32,6,20,0.7253793604157478,UC Davis,Santa Clara,4,4,0,0,NA,401177498,2019-11-16,Santa Clara
171,3,8:05,1085,1085,Foul on Tia Hay.,38,32,6,0,0.7273329458538029,UC Davis,Santa Clara,4,4,0,0,NA,401177498,2019-11-16,
172,3,8:05,1085,1085,Cierra Hall made Free Throw.,39,32,7,0,0.7585332811520077,UC Davis,Santa Clara,4,4,0,0,NA,401177498,2019-11-16,UC Davis
173,3,8:05,1085,1085,Cierra Hall made Free Throw.,40,32,8,15,0.7872079702595427,UC Davis,Santa Clara,4,4,0,0,NA,401177498,2019-11-16,UC Davis
174,3,7:50,1070,1070,Lindsey VanAllen missed Three Point Jumper.,40,32,8,5,0.7888992914513211,UC Davis,Santa Clara,4,4,0,0,NA,401177498,2019-11-16,
175,3,7:45,1065,1065,Katie Toole Defensive Rebound.,40,32,8,21,0.7894727105191516,UC Davis,Santa Clara,4,4,0,0,NA,401177498,2019-11-16,
176,3,7:24,1044,1044,Nina Bessolo Turnover.,40,32,8,0,0.7919461081901698,UC Davis,Santa Clara,4,4,0,0,NA,401177498,2019-11-16,
177,3,7:24,1044,1044,Ashlyn Herlihy Steal.,40,32,8,6,0.7919461081901698,UC Davis,Santa Clara,4,4,0,0,NA,401177498,2019-11-16,
178,3,7:18,1038,1038,Ashlyn Herlihy Turnover.,40,32,8,14,0.792674887379898,UC Davis,Santa Clara,4,4,0,0,NA,401177498,2019-11-16,
179,3,7:04,1024,1024,Cierra Hall missed Three Point Jumper.,40,32,8,4,0.7944195961038963,UC Davis,Santa Clara,4,4,0,0,NA,401177498,2019-11-16,
180,3,7:00,1020,1020,Ashlyn Herlihy Defensive Rebound.,40,32,8,6,0.7949303401689005,UC Davis,Santa Clara,4,4,0,0,NA,401177498,2019-11-16,
181,3,6:54,1014,1014,Tia Hay missed Layup.,40,32,8,4,0.7957073915864381,UC Davis,Santa Clara,4,4,0,0,NA,401177498,2019-11-16,
182,3,6:50,1010,1010,Katie Toole Defensive Rebound.,40,32,8,27,0.7962329913915521,UC Davis,Santa Clara,4,4,0,0,NA,401177498,2019-11-16,
183,3,6:23,983,983,Kayla Konrad made Jumper. Assisted by Mackenzie Trpcic.,42,32,10,11,0.849732864310152,UC Davis,Santa Clara,4,4,0,0,NA,401177498,2019-11-16,UC Davis
184,3,6:12,972,972,Foul on Kayla Konrad.,42,32,10,13,0.851336775857542,UC Davis,Santa Clara,4,4,0,0,NA,401177498,2019-11-16,
185,3,5:59,959,959,Lana Hollingsworth missed Three Point Jumper.,42,32,10,5,0.853216471725807,UC Davis,Santa Clara,4,4,0,0,NA,401177498,2019-11-16,
186,3,5:54,954,954,Campbell Gray Defensive Rebound.,42,32,10,17,0.8538994875440735,UC Davis,Santa Clara,4,4,0,0,NA,401177498,2019-11-16,
187,3,5:37,937,937,Foul on Emily Wolph.,42,32,10,0,0.8560767167783749,UC Davis,Santa Clara,4,4,0,0,NA,401177498,2019-11-16,
188,3,5:37,937,937,Katie Toole made Free Throw.,43,32,11,0,0.8766830388996601,UC Davis,Santa Clara,4,4,0,0,NA,401177498,2019-11-16,UC Davis
189,3,5:37,937,937,Katie Toole made Free Throw.,44,32,12,13,0.8947019278781463,UC Davis,Santa Clara,4,4,0,0,NA,401177498,2019-11-16,UC Davis
