play_id,period,time_remaining_period,secs_remaining,secs_remaining_absolute,description,home_score,away_score,score_diff,play_length,win_prob,home,away,home_time_out_remaining,away_time_out_remaining,home_timeout_ind,away_timeout_ind,home_favored_by,game_id,date,whichScored
1,1,9:55,2395,2395,Digna Strautmane made Three Point Jumper. Assisted by Tiana Mangakahia.,0,0,0,16,0.5,Syracuse,Wake Forest,4,4,0,0,NA,401092108,2019-02-17,NA
2,1,9:39,2379,2379,Ivana Raca missed Three Point Jumper.,3,0,3,0,0.5664842054392724,Syracuse,Wake Forest,4,4,0,0,NA,401092108,2019-02-17,Syracuse
3,1,9:39,2379,2379,Raegyn Branch Offensive Rebound.,3,0,3,3,0.5664842054392724,Syracuse,Wake Forest,4,4,0,0,NA,401092108,2019-02-17,
4,1,9:36,2376,2376,Raegyn Branch made Layup.,3,2,1,8,0.522310732801701,Syracuse,Wake Forest,4,4,0,0,NA,401092108,2019-02-17,Wake Forest
5,1,9:28,2368,2368,Miranda Drummond made Three Point Jumper. Assisted by Tiana Mangakahia.,6,2,4,28,0.5886979756226692,Syracuse,Wake Forest,4,4,0,0,NA,401092108,2019-02-17,Syracuse
6,1,9:00,2340,2340,Gina Conti missed Three Point Jumper.,6,2,4,0,0.589877460375824,Syracuse,Wake Forest,4,4,0,0,NA,401092108,2019-02-17,
7,1,9:00,2340,2340,Digna Strautmane Defensive Rebound.,6,2,4,11,0.589877460375824,Syracuse,Wake Forest,4,4,0,0,NA,401092108,2019-02-17,
8,1,8:49,2329,2329,Miranda Drummond made Three Point Jumper. Assisted by Tiana Mangakahia.,9,2,7,13,0.6546273513514834,Syracuse,Wake Forest,4,4,0,0,NA,401092108,2019-02-17,Syracuse
9,1,8:36,2316,2316,Wake Forest  Timeout,9,2,7,16,0.6555383010482628,Syracuse,Wake Forest,3,4,1,0,NA,401092108,2019-02-17,
10,1,8:20,2300,2300,Ivana Raca missed Jumper.,9,2,7,0,0.6566661774165383,Syracuse,Wake Forest,3,4,1,0,NA,401092108,2019-02-17,
11,1,8:20,2300,2300,Maya Banks Offensive Rebound.,9,2,7,4,0.6566661774165383,Syracuse,Wake Forest,3,4,1,0,NA,401092108,2019-02-17,
12,1,8:16,2296,2296,Maya Banks missed Jumper.,9,2,7,0,0.6569492241301105,Syracuse,Wake Forest,3,4,1,0,NA,401092108,2019-02-17,
13,1,8:16,2296,2296,Amaya Finklea-Guity Block.,9,2,7,2,0.6569492241301105,Syracuse,Wake Forest,3,4,1,0,NA,401092108,2019-02-17,
14,1,8:14,2294,2294,Amaya Finklea-Guity Defensive Rebound.,9,2,7,9,0.6570909012663833,Syracuse,Wake Forest,3,4,1,0,NA,401092108,2019-02-17,
15,1,8:05,2285,2285,Digna Strautmane missed Jumper.,9,2,7,0,0.6577296729329493,Syracuse,Wake Forest,3,4,1,0,NA,401092108,2019-02-17,
16,1,8:05,2285,2285,Amaya Finklea-Guity Offensive Rebound.,9,2,7,3,0.6577296729329493,Syracuse,Wake Forest,3,4,1,0,NA,401092108,2019-02-17,
17,1,8:02,2282,2282,Amaya Finklea-Guity missed Layup.,9,2,7,0,0.6579430271585934,Syracuse,Wake Forest,3,4,1,0,NA,401092108,2019-02-17,
18,1,8:02,2282,2282,Maya Banks Defensive Rebound.,9,2,7,29,0.6579430271585934,Syracuse,Wake Forest,3,4,1,0,NA,401092108,2019-02-17,
19,1,7:33,2253,2253,Ivana Raca Turnover.,9,2,7,13,0.6600154193704477,Syracuse,Wake Forest,3,4,0,0,NA,401092108,2019-02-17,
20,1,7:20,2240,2240,Isis Young made Three Point Jumper. Assisted by Tiana Mangakahia.,12,2,10,17,0.7218410746707823,Syracuse,Wake Forest,3,4,0,0,NA,401092108,2019-02-17,Syracuse
21,1,7:03,2223,2223,Gina Conti missed Layup.,12,2,10,0,0.7234083463148663,Syracuse,Wake Forest,3,4,0,0,NA,401092108,2019-02-17,
22,1,7:03,2223,2223,Amaya Finklea-Guity Defensive Rebound.,12,2,10,23,0.7234083463148663,Syracuse,Wake Forest,3,4,0,0,NA,401092108,2019-02-17,
23,1,6:40,2200,2200,Amaya Finklea-Guity missed Jumper.,12,2,10,0,0.7255316934145811,Syracuse,Wake Forest,3,4,0,0,NA,401092108,2019-02-17,
24,1,6:40,2200,2200,Wake Forest Defensive Rebound.,12,2,10,1,0.7255316934145811,Syracuse,Wake Forest,3,4,0,0,NA,401092108,2019-02-17,
25,1,6:39,2199,2199,Foul on Amaya Finklea-Guity.,12,2,10,12,0.7256240513947673,Syracuse,Wake Forest,3,4,0,0,NA,401092108,2019-02-17,
26,1,6:27,2187,2187,Lindsey Jarosinski missed Layup.,12,2,10,0,0.7267323849025615,Syracuse,Wake Forest,3,4,0,0,NA,401092108,2019-02-17,
27,1,6:27,2187,2187,Lindsey Jarosinski Offensive Rebound.,12,2,10,5,0.7267323849025615,Syracuse,Wake Forest,3,4,0,0,NA,401092108,2019-02-17,
28,1,6:22,2182,2182,Gina Conti missed Three Point Jumper.,12,2,10,0,0.7271941535845079,Syracuse,Wake Forest,3,4,0,0,NA,401092108,2019-02-17,
29,1,6:22,2182,2182,Raegyn Branch Offensive Rebound.,12,2,10,14,0.7271941535845079,Syracuse,Wake Forest,3,4,0,0,NA,401092108,2019-02-17,
30,1,6:08,2168,2168,Lindsey Jarosinski Turnover.,12,2,10,18,0.7284867130689837,Syracuse,Wake Forest,3,4,0,0,NA,401092108,2019-02-17,
31,1,5:50,2150,2150,Maeva Djaldi-Tabdi missed Layup.,12,2,10,0,0.7301502816612053,Syracuse,Wake Forest,3,4,0,0,NA,401092108,2019-02-17,
32,1,5:50,2150,2150,Raegyn Branch Defensive Rebound.,12,2,10,20,0.7301502816612053,Syracuse,Wake Forest,3,4,0,0,NA,401092108,2019-02-17,
33,1,5:30,2130,2130,Foul on Maeva Djaldi-Tabdi.,12,2,10,11,0.7320033682647233,Syracuse,Wake Forest,3,4,0,0,NA,401092108,2019-02-17,
34,1,5:19,2119,2119,Lindsey Jarosinski missed Layup.,12,2,10,0,0.7330249691494297,Syracuse,Wake Forest,3,4,0,0,NA,401092108,2019-02-17,
35,1,5:19,2119,2119,Miranda Drummond Defensive Rebound.,12,2,10,10,0.7330249691494297,Syracuse,Wake Forest,3,4,0,0,NA,401092108,2019-02-17,
36,1,5:09,2109,2109,Maeva Djaldi-Tabdi missed Layup.,12,2,10,0,0.7339553315513319,Syracuse,Wake Forest,3,4,0,0,NA,401092108,2019-02-17,
37,1,5:09,2109,2109,Ivana Raca Block.,12,2,10,2,0.7339553315513319,Syracuse,Wake Forest,3,4,0,0,NA,401092108,2019-02-17,
38,1,5:07,2107,2107,Maeva Djaldi-Tabdi Offensive Rebound.,12,2,10,4,0.7341416005767136,Syracuse,Wake Forest,3,4,0,0,NA,401092108,2019-02-17,
39,1,5:03,2103,2103,Maeva Djaldi-Tabdi missed Layup.,12,2,10,0,0.7345143419088191,Syracuse,Wake Forest,3,4,0,0,NA,401092108,2019-02-17,
40,1,5:03,2103,2103,Ivana Raca Block.,12,2,10,4,0.7345143419088191,Syracuse,Wake Forest,3,4,0,0,NA,401092108,2019-02-17,
41,1,4:59,2099,2099,Ellen Hahne Defensive Rebound.,12,2,10,2,0.7348873598610655,Syracuse,Wake Forest,3,4,0,0,NA,401092108,2019-02-17,
42,1,4:57,2097,2097,Alex Sharp made Three Point Jumper. Assisted by Ellen Hahne.,12,5,7,8,0.6713648038315527,Syracuse,Wake Forest,3,4,0,0,NA,401092108,2019-02-17,Wake Forest
43,1,4:49,2089,2089,Maeva Djaldi-Tabdi missed Layup.,12,5,7,0,0.6719576399916065,Syracuse,Wake Forest,3,4,0,0,NA,401092108,2019-02-17,
44,1,4:49,2089,2089,Alex Sharp Defensive Rebound.,12,5,7,20,0.6719576399916065,Syracuse,Wake Forest,3,4,0,0,NA,401092108,2019-02-17,
45,1,4:29,2069,2069,Ivana Raca missed Three Point Jumper.,12,5,7,0,0.6734463042478809,Syracuse,Wake Forest,3,4,0,0,NA,401092108,2019-02-17,
46,1,4:29,2069,2069,Alex Sharp Offensive Rebound.,12,5,7,3,0.6734463042478809,Syracuse,Wake Forest,3,4,0,0,NA,401092108,2019-02-17,
47,1,4:26,2066,2066,Alex Sharp made Layup.,12,7,5,12,0.6266186945781196,Syracuse,Wake Forest,3,4,0,0,NA,401092108,2019-02-17,Wake Forest
48,1,4:14,2054,2054,Miranda Drummond made Three Point Jumper. Assisted by Raven Fox.,15,7,8,21,0.6970009388520297,Syracuse,Wake Forest,3,4,0,0,NA,401092108,2019-02-17,Syracuse
49,1,3:53,2033,2033,Alex Sharp made Three Point Jumper. Assisted by Ivana Raca.,15,10,5,20,0.6285065758106235,Syracuse,Wake Forest,3,4,0,0,NA,401092108,2019-02-17,Wake Forest
50,1,3:33,2013,2013,Maeva Djaldi-Tabdi Turnover.,15,10,5,24,0.6296637285287112,Syracuse,Wake Forest,3,4,0,0,NA,401092108,2019-02-17,
51,1,3:09,1989,1989,Ivana Raca missed Jumper.,15,10,5,0,0.6310662345388074,Syracuse,Wake Forest,3,4,0,0,NA,401092108,2019-02-17,
52,1,3:09,1989,1989,Miranda Drummond Defensive Rebound.,15,10,5,7,0.6310662345388074,Syracuse,Wake Forest,3,4,0,0,NA,401092108,2019-02-17,
53,1,3:02,1982,1982,Raven Fox missed Three Point Jumper.,15,10,5,0,0.6314782934151979,Syracuse,Wake Forest,3,4,0,0,NA,401092108,2019-02-17,
54,1,3:02,1982,1982,Alex Sharp Defensive Rebound.,15,10,5,9,0.6314782934151979,Syracuse,Wake Forest,3,4,0,0,NA,401092108,2019-02-17,
55,1,2:53,1973,1973,Alex Sharp missed Three Point Jumper.,15,10,5,0,0.6320101397408582,Syracuse,Wake Forest,3,4,0,0,NA,401092108,2019-02-17,
56,1,2:53,1973,1973,Maya Banks Offensive Rebound.,15,10,5,5,0.6320101397408582,Syracuse,Wake Forest,3,4,0,0,NA,401092108,2019-02-17,
57,1,2:48,1968,1968,Ivana Raca missed Jumper.,15,10,5,0,0.632306627093513,Syracuse,Wake Forest,3,4,0,0,NA,401092108,2019-02-17,
58,1,2:48,1968,1968,Alex Sharp Offensive Rebound.,15,10,5,2,0.632306627093513,Syracuse,Wake Forest,3,4,0,0,NA,401092108,2019-02-17,
59,1,2:46,1966,1966,Alex Sharp missed Layup.,15,10,5,0,0.6324254281385384,Syracuse,Wake Forest,3,4,0,0,NA,401092108,2019-02-17,
60,1,2:46,1966,1966,Gabrielle Cooper Defensive Rebound.,15,10,5,7,0.6324254281385384,Syracuse,Wake Forest,3,4,0,0,NA,401092108,2019-02-17,
61,1,2:39,1959,1959,Foul on Gina Conti.,15,10,5,8,0.6328421697502168,Syracuse,Wake Forest,3,4,0,0,NA,401092108,2019-02-17,
62,1,2:31,1951,1951,Amaya Finklea-Guity Turnover.,15,10,5,13,0.6333202566542294,Syracuse,Wake Forest,3,4,0,0,NA,401092108,2019-02-17,
63,1,2:18,1938,1938,Ellen Hahne Turnover.,15,10,5,12,0.6341013577639057,Syracuse,Wake Forest,3,4,0,0,NA,401092108,2019-02-17,
64,1,2:06,1926,1926,Miranda Drummond missed Three Point Jumper.,15,10,5,0,0.6348267311951653,Syracuse,Wake Forest,3,4,0,0,NA,401092108,2019-02-17,
65,1,2:06,1926,1926,Ellen Hahne Defensive Rebound.,15,10,5,12,0.6348267311951653,Syracuse,Wake Forest,3,4,0,0,NA,401092108,2019-02-17,
66,1,1:54,1914,1914,Raegyn Branch missed Layup.,15,10,5,0,0.6355515312027009,Syracuse,Wake Forest,3,4,0,0,NA,401092108,2019-02-17,
67,1,1:54,1914,1914,Tiana Mangakahia Defensive Rebound.,15,10,5,13,0.6355515312027009,Syracuse,Wake Forest,3,4,0,0,NA,401092108,2019-02-17,
68,1,1:41,1901,1901,Foul on Digna Strautmane.,15,10,5,0,0.6363350246852372,Syracuse,Wake Forest,3,4,0,0,NA,401092108,2019-02-17,
69,1,1:41,1901,1901,Digna Strautmane Turnover.,15,10,5,17,0.6363350246852372,Syracuse,Wake Forest,3,4,0,0,NA,401092108,2019-02-17,
70,1,1:24,1884,1884,Gina Conti missed Three Point Jumper.,15,10,5,0,0.637358200059722,Syracuse,Wake Forest,3,4,0,0,NA,401092108,2019-02-17,
71,1,1:24,1884,1884,Tiana Mangakahia Defensive Rebound.,15,10,5,9,0.637358200059722,Syracuse,Wake Forest,3,4,0,0,NA,401092108,2019-02-17,
72,1,1:15,1875,1875,Maeva Djaldi-Tabdi made Layup. Assisted by Tiana Mangakahia.,17,10,7,10,0.6884245649873151,Syracuse,Wake Forest,3,4,0,0,NA,401092108,2019-02-17,Syracuse
73,1,1:05,1865,1865,Foul on Gabrielle Cooper.,17,10,7,9,0.6892070728610808,Syracuse,Wake Forest,3,4,0,0,NA,401092108,2019-02-17,
74,1,0:56,1856,1856,Raegyn Branch made Layup. Assisted by Alex Sharp.,17,12,5,22,0.6390443505328853,Syracuse,Wake Forest,3,4,0,0,NA,401092108,2019-02-17,Wake Forest
75,1,0:34,1834,1834,Emily Engstler Turnover.,17,12,5,2,0.6403743600729814,Syracuse,Wake Forest,3,4,0,0,NA,401092108,2019-02-17,
76,1,0:32,1832,1832,Lindsey Jarosinski Steal.,17,12,5,19,0.640495643290806,Syracuse,Wake Forest,3,4,0,0,NA,401092108,2019-02-17,
77,1,0:13,1813,1813,Tiana Mangakahia Steal.,17,12,5,2,0.6416519439139304,Syracuse,Wake Forest,3,4,0,0,NA,401092108,2019-02-17,
78,1,0:11,1811,1811,Ivana Raca Turnover.,17,12,5,3,0.6417741489199523,Syracuse,Wake Forest,3,4,0,0,NA,401092108,2019-02-17,
79,1,0:08,1808,1808,Gabrielle Cooper made Layup. Assisted by Tiana Mangakahia.,19,12,7,8,0.693688296650932,Syracuse,Wake Forest,3,4,0,0,NA,401092108,2019-02-17,Syracuse
80,1,0:00,1800,1800,End of 1st Quarter,19,12,7,22,0.6943230201027285,Syracuse,Wake Forest,3,4,0,0,NA,401092108,2019-02-17,
81,2,9:38,1778,1778,Emily Engstler Turnover.,19,12,7,2,0.6960800953347475,Syracuse,Wake Forest,4,4,0,0,NA,401092108,2019-02-17,
82,2,9:36,1776,1776,Lindsey Jarosinski Steal.,19,12,7,3,0.6962407841046182,Syracuse,Wake Forest,4,4,0,0,NA,401092108,2019-02-17,
83,2,9:33,1773,1773,Lindsey Jarosinski missed Layup.,19,12,7,0,0.6964821449619643,Syracuse,Wake Forest,4,4,0,0,NA,401092108,2019-02-17,
84,2,9:33,1773,1773,Raegyn Branch Offensive Rebound.,19,12,7,5,0.6964821449619643,Syracuse,Wake Forest,4,4,0,0,NA,401092108,2019-02-17,
85,2,9:28,1768,1768,Raegyn Branch missed Layup.,19,12,7,0,0.6968853157798519,Syracuse,Wake Forest,4,4,0,0,NA,401092108,2019-02-17,
86,2,9:28,1768,1768,Lindsey Jarosinski Offensive Rebound.,19,12,7,3,0.6968853157798519,Syracuse,Wake Forest,4,4,0,0,NA,401092108,2019-02-17,
87,2,9:25,1765,1765,Lindsey Jarosinski made Layup.,19,14,5,7,0.644619184781419,Syracuse,Wake Forest,4,4,0,0,NA,401092108,2019-02-17,Wake Forest
88,2,9:18,1758,1758,Foul on Lindsey Jarosinski.,19,14,5,3,0.6450590711866201,Syracuse,Wake Forest,4,4,0,0,NA,401092108,2019-02-17,
89,2,9:15,1755,1755,Kiara Lewis missed Free Throw.,19,14,5,0,0.6452482522171972,Syracuse,Wake Forest,4,4,0,0,NA,401092108,2019-02-17,
90,2,9:15,1755,1755,Syracuse Deadball Team Rebound.,19,14,5,0,0.6452482522171972,Syracuse,Wake Forest,4,4,0,0,NA,401092108,2019-02-17,
91,2,9:15,1755,1755,Kiara Lewis made Free Throw.,20,14,6,26,0.6721356588119094,Syracuse,Wake Forest,4,4,0,0,NA,401092108,2019-02-17,Syracuse
92,2,8:49,1729,1729,Gina Conti missed Jumper.,20,14,6,0,0.6740498420550047,Syracuse,Wake Forest,4,4,0,0,NA,401092108,2019-02-17,
93,2,8:49,1729,1729,Syracuse Defensive Rebound.,20,14,6,13,0.6740498420550047,Syracuse,Wake Forest,4,4,0,0,NA,401092108,2019-02-17,
94,2,8:36,1716,1716,Foul on Maeva Djaldi-Tabdi.,20,14,6,0,0.6750217212444001,Syracuse,Wake Forest,4,4,0,0,NA,401092108,2019-02-17,
95,2,8:36,1716,1716,Maeva Djaldi-Tabdi Turnover.,20,14,6,29,0.6750217212444001,Syracuse,Wake Forest,4,4,0,0,NA,401092108,2019-02-17,
96,2,8:07,1687,1687,Gina Conti made Three Point Jumper. Assisted by Ivana Raca.,20,17,3,26,0.5915881515660368,Syracuse,Wake Forest,4,4,0,0,NA,401092108,2019-02-17,Wake Forest
97,2,7:41,1661,1661,Raven Fox missed Layup.,20,17,3,0,0.5926679131946108,Syracuse,Wake Forest,4,4,0,0,NA,401092108,2019-02-17,
98,2,7:41,1661,1661,Lindsey Jarosinski Block.,20,17,3,0,0.5926679131946108,Syracuse,Wake Forest,4,4,0,0,NA,401092108,2019-02-17,
99,2,7:41,1661,1661,Syracuse Offensive Rebound.,20,17,3,8,0.5926679131946108,Syracuse,Wake Forest,4,4,0,0,NA,401092108,2019-02-17,
100,2,7:33,1653,1653,Isis Young made Three Point Jumper.,23,17,6,20,0.6797677469392925,Syracuse,Wake Forest,4,4,0,0,NA,401092108,2019-02-17,Syracuse
101,2,7:13,1633,1633,Lindsey Jarosinski made Jumper. Assisted by Alex Sharp.,23,19,4,8,0.623923709604715,Syracuse,Wake Forest,4,4,0,0,NA,401092108,2019-02-17,Wake Forest
102,2,7:05,1625,1625,Gabrielle Cooper missed Three Point Jumper.,23,19,4,0,0.6243357566577541,Syracuse,Wake Forest,4,4,0,0,NA,401092108,2019-02-17,
103,2,7:05,1625,1625,Gabrielle Cooper Offensive Rebound.,23,19,4,5,0.6243357566577541,Syracuse,Wake Forest,4,4,0,0,NA,401092108,2019-02-17,
104,2,7:00,1620,1620,Isis Young missed Jumper.,23,19,4,0,0.6245924252701283,Syracuse,Wake Forest,4,4,0,0,NA,401092108,2019-02-17,
105,2,7:00,1620,1620,Alex Sharp Defensive Rebound.,23,19,4,23,0.6245924252701283,Syracuse,Wake Forest,4,4,0,0,NA,401092108,2019-02-17,
106,2,6:37,1597,1597,Lindsey Jarosinski missed Layup.,23,19,4,0,0.6257685752249849,Syracuse,Wake Forest,4,4,0,0,NA,401092108,2019-02-17,
107,2,6:37,1597,1597,Raegyn Branch Offensive Rebound.,23,19,4,8,0.6257685752249849,Syracuse,Wake Forest,4,4,0,0,NA,401092108,2019-02-17,
108,2,6:29,1589,1589,Raegyn Branch made Layup.,23,21,2,9,0.5641264678520037,Syracuse,Wake Forest,4,4,0,0,NA,401092108,2019-02-17,Wake Forest
109,2,6:20,1580,1580,Gabrielle Cooper missed Three Point Jumper.,23,21,2,0,0.5643686024277282,Syracuse,Wake Forest,4,4,0,0,NA,401092108,2019-02-17,
110,2,6:20,1580,1580,Raegyn Branch Defensive Rebound.,23,21,2,11,0.5643686024277282,Syracuse,Wake Forest,4,4,0,0,NA,401092108,2019-02-17,
111,2,6:09,1569,1569,Lindsey Jarosinski made Layup. Assisted by Alex Sharp.,23,23,0,18,0.5,Syracuse,Wake Forest,4,4,0,0,NA,401092108,2019-02-17,Wake Forest
112,2,5:51,1551,1551,Raven Fox made Jumper. Assisted by Marie-Paule Foppossi.,25,23,2,16,0.5651574981270215,Syracuse,Wake Forest,4,4,0,0,NA,401092108,2019-02-17,Syracuse
113,2,5:35,1535,1535,Ivana Raca Turnover.,25,23,2,6,0.5656019310056535,Syracuse,Wake Forest,4,4,0,0,NA,401092108,2019-02-17,
114,2,5:29,1529,1529,Miranda Drummond missed Three Point Jumper.,25,23,2,0,0.5657708828687078,Syracuse,Wake Forest,4,4,0,0,NA,401092108,2019-02-17,
115,2,5:29,1529,1529,Gina Conti Defensive Rebound.,25,23,2,9,0.5657708828687078,Syracuse,Wake Forest,4,4,0,0,NA,401092108,2019-02-17,
116,2,5:20,1520,1520,Foul on Kiara Lewis.,25,23,2,6,0.5660270289131002,Syracuse,Wake Forest,4,4,0,0,NA,401092108,2019-02-17,
117,2,5:14,1514,1514,Alex Sharp missed Layup.,25,23,2,0,0.5661997751161628,Syracuse,Wake Forest,4,4,0,0,NA,401092108,2019-02-17,
118,2,5:14,1514,1514,Maya Banks Offensive Rebound.,25,23,2,3,0.5661997751161628,Syracuse,Wake Forest,4,4,0,0,NA,401092108,2019-02-17,
119,2,5:11,1511,1511,Maya Banks Turnover.,25,23,2,2,0.5662867865672899,Syracuse,Wake Forest,4,4,0,0,NA,401092108,2019-02-17,
120,2,5:09,1509,1509,Miranda Drummond Steal.,25,23,2,7,0.5663450405139698,Syracuse,Wake Forest,4,4,0,0,NA,401092108,2019-02-17,
121,2,5:02,1502,1502,Gabrielle Cooper missed Three Point Jumper.,25,23,2,0,0.5665505490234393,Syracuse,Wake Forest,4,4,0,0,NA,401092108,2019-02-17,
122,2,5:02,1502,1502,Emily Engstler Offensive Rebound.,25,23,2,7,0.5665505490234393,Syracuse,Wake Forest,4,4,0,0,NA,401092108,2019-02-17,
123,2,4:55,1495,1495,Emily Engstler missed Three Point Jumper.,25,23,2,0,0.5667587178944022,Syracuse,Wake Forest,4,4,0,0,NA,401092108,2019-02-17,
124,2,4:55,1495,1495,Gabrielle Cooper Offensive Rebound.,25,23,2,3,0.5667587178944022,Syracuse,Wake Forest,4,4,0,0,NA,401092108,2019-02-17,
125,2,4:52,1492,1492,Gabrielle Cooper missed Layup.,25,23,2,0,0.5668487933113459,Syracuse,Wake Forest,4,4,0,0,NA,401092108,2019-02-17,
126,2,4:52,1492,1492,Miranda Drummond Offensive Rebound.,25,23,2,7,0.5668487933113459,Syracuse,Wake Forest,4,4,0,0,NA,401092108,2019-02-17,
127,2,4:45,1485,1485,Kiara Lewis made Three Point Jumper. Assisted by Tiana Mangakahia.,28,23,5,17,0.6625493906594335,Syracuse,Wake Forest,4,4,0,0,NA,401092108,2019-02-17,Syracuse
128,2,4:28,1468,1468,Maya Banks made Layup. Assisted by Gina Conti.,28,25,3,30,0.6006171876053443,Syracuse,Wake Forest,4,4,0,0,NA,401092108,2019-02-17,Wake Forest
129,2,3:58,1438,1438,Kiara Lewis missed Three Point Jumper.,28,25,3,0,0.602045666267193,Syracuse,Wake Forest,4,4,0,0,NA,401092108,2019-02-17,
130,2,3:58,1438,1438,Maya Banks Defensive Rebound.,28,25,3,12,0.602045666267193,Syracuse,Wake Forest,4,4,0,0,NA,401092108,2019-02-17,
131,2,3:46,1426,1426,Ellen Hahne missed Layup.,28,25,3,0,0.602605595882817,Syracuse,Wake Forest,4,4,0,0,NA,401092108,2019-02-17,
132,2,3:46,1426,1426,Emily Engstler Defensive Rebound.,28,25,3,7,0.602605595882817,Syracuse,Wake Forest,4,4,0,0,NA,401092108,2019-02-17,
133,2,3:39,1419,1419,Gabrielle Cooper missed Three Point Jumper.,28,25,3,0,0.6029266616607172,Syracuse,Wake Forest,4,4,0,0,NA,401092108,2019-02-17,
134,2,3:39,1419,1419,Syracuse Offensive Rebound.,28,25,3,5,0.6029266616607172,Syracuse,Wake Forest,4,4,0,0,NA,401092108,2019-02-17,
135,2,3:34,1414,1414,Official TV Timeout,28,25,3,17,0.6031538274386591,Syracuse,Wake Forest,4,4,0,0,NA,401092108,2019-02-17,
136,2,3:17,1397,1397,Emily Engstler made Layup.,30,25,5,9,0.6688546682123504,Syracuse,Wake Forest,4,4,0,0,NA,401092108,2019-02-17,Syracuse
137,2,3:08,1388,1388,Foul on Gabrielle Cooper.,30,25,5,9,0.6694686591249911,Syracuse,Wake Forest,4,4,0,0,NA,401092108,2019-02-17,
138,2,2:59,1379,1379,Alex Sharp missed Jumper.,30,25,5,0,0.6700788716237577,Syracuse,Wake Forest,4,4,0,0,NA,401092108,2019-02-17,
139,2,2:59,1379,1379,Tiana Mangakahia Defensive Rebound.,30,25,5,6,0.6700788716237577,Syracuse,Wake Forest,4,4,0,0,NA,401092108,2019-02-17,
140,2,2:53,1373,1373,Tiana Mangakahia missed Three Point Jumper.,30,25,5,0,0.6704843670956382,Syracuse,Wake Forest,4,4,0,0,NA,401092108,2019-02-17,
141,2,2:53,1373,1373,Wake Forest Defensive Rebound.,30,25,5,2,0.6704843670956382,Syracuse,Wake Forest,4,4,0,0,NA,401092108,2019-02-17,
142,2,2:51,1371,1371,Foul on Emily Engstler.,30,25,5,17,0.6706193975995367,Syracuse,Wake Forest,4,4,0,0,NA,401092108,2019-02-17,
143,2,2:34,1354,1354,Maya Banks missed Jumper.,30,25,5,0,0.671767359680788,Syracuse,Wake Forest,4,4,0,0,NA,401092108,2019-02-17,
144,2,2:34,1354,1354,Emily Engstler Block.,30,25,5,3,0.671767359680788,Syracuse,Wake Forest,4,4,0,0,NA,401092108,2019-02-17,
145,2,2:31,1351,1351,Emily Engstler Defensive Rebound.,30,25,5,6,0.6719704550017853,Syracuse,Wake Forest,4,4,0,0,NA,401092108,2019-02-17,
146,2,2:25,1345,1345,Isis Young missed Three Point Jumper.,30,25,5,0,0.6723776129426199,Syracuse,Wake Forest,4,4,0,0,NA,401092108,2019-02-17,
147,2,2:25,1345,1345,Maya Banks Defensive Rebound.,30,25,5,18,0.6723776129426199,Syracuse,Wake Forest,4,4,0,0,NA,401092108,2019-02-17,
148,2,2:07,1327,1327,Alex Sharp made Jumper.,30,27,3,27,0.6070044234060387,Syracuse,Wake Forest,4,4,0,0,NA,401092108,2019-02-17,Wake Forest
149,2,1:40,1300,1300,Tiana Mangakahia made Three Point Jumper.,33,27,6,18,0.7067998749163121,Syracuse,Wake Forest,4,4,0,0,NA,401092108,2019-02-17,Syracuse
150,2,1:22,1282,1282,Foul on Tiana Mangakahia.,33,27,6,0,0.7083029653362832,Syracuse,Wake Forest,4,4,0,0,NA,401092108,2019-02-17,
151,2,1:22,1282,1282,Alex Sharp missed Free Throw.,33,27,6,0,0.7083029653362832,Syracuse,Wake Forest,4,4,0,0,NA,401092108,2019-02-17,
152,2,1:22,1282,1282,Wake Forest Deadball Team Rebound.,33,27,6,0,0.7083029653362832,Syracuse,Wake Forest,4,4,0,0,NA,401092108,2019-02-17,
153,2,1:22,1282,1282,Alex Sharp missed Free Throw.,33,27,6,0,0.7083029653362832,Syracuse,Wake Forest,4,4,0,0,NA,401092108,2019-02-17,
154,2,1:22,1282,1282,Isis Young Defensive Rebound.,33,27,6,5,0.7083029653362832,Syracuse,Wake Forest,4,4,0,0,NA,401092108,2019-02-17,
155,2,1:17,1277,1277,Miranda Drummond made Three Point Jumper. Assisted by Isis Young.,36,27,9,9,0.7914761004563403,Syracuse,Wake Forest,4,4,0,0,NA,401092108,2019-02-17,Syracuse
156,2,1:08,1268,1268,Tiana Mangakahia Steal.,36,27,9,3,0.792416285121646,Syracuse,Wake Forest,4,4,0,0,NA,401092108,2019-02-17,
157,2,1:05,1265,1265,Gina Conti Turnover.,36,27,9,2,0.7927342128460216,Syracuse,Wake Forest,4,4,0,0,NA,401092108,2019-02-17,
158,2,1:03,1263,1263,Tiana Mangakahia made Layup.,38,27,11,9,0.8376955853427241,Syracuse,Wake Forest,4,4,0,0,NA,401092108,2019-02-17,Syracuse
159,2,0:54,1254,1254,Gina Conti missed Layup.,38,27,11,0,0.8386800749681648,Syracuse,Wake Forest,4,4,0,0,NA,401092108,2019-02-17,
160,2,0:54,1254,1254,Ivana Raca Offensive Rebound.,38,27,11,4,0.8386800749681648,Syracuse,Wake Forest,4,4,0,0,NA,401092108,2019-02-17,
161,2,0:50,1250,1250,Alex Sharp made Three Point Jumper. Assisted by Ivana Raca.,38,30,8,11,0.7687485516544399,Syracuse,Wake Forest,4,4,0,0,NA,401092108,2019-02-17,Wake Forest
162,2,0:39,1239,1239,Foul on Lindsey Jarosinski.,38,30,8,0,0.7699444634715304,Syracuse,Wake Forest,4,4,0,0,NA,401092108,2019-02-17,
163,2,0:39,1239,1239,Amaya Finklea-Guity missed Free Throw.,38,30,8,0,0.7699444634715304,Syracuse,Wake Forest,4,4,0,0,NA,401092108,2019-02-17,
164,2,0:39,1239,1239,Syracuse Deadball Team Rebound.,38,30,8,0,0.7699444634715304,Syracuse,Wake Forest,4,4,0,0,NA,401092108,2019-02-17,
165,2,0:39,1239,1239,Amaya Finklea-Guity made Free Throw.,39,30,9,9,0.7955966924038704,Syracuse,Wake Forest,4,4,0,0,NA,401092108,2019-02-17,Syracuse
166,2,0:30,1230,1230,Ivana Raca missed Jumper.,39,30,9,0,0.7966372468835887,Syracuse,Wake Forest,4,4,0,0,NA,401092108,2019-02-17,
167,2,0:30,1230,1230,Syracuse Defensive Rebound.,39,30,9,29,0.7966372468835887,Syracuse,Wake Forest,4,4,0,0,NA,401092108,2019-02-17,
168,2,0:01,1201,1201,Miranda Drummond missed Layup.,39,30,9,0,0.8001623663834582,Syracuse,Wake Forest,4,4,0,0,NA,401092108,2019-02-17,
169,2,0:01,1201,1201,Ivana Raca Defensive Rebound.,39,30,9,1,0.8001623663834582,Syracuse,Wake Forest,4,4,0,0,NA,401092108,2019-02-17,
170,2,0:00,1200,1200,End of 2nd Quarter,39,30,9,9,0.8002839754918194,Syracuse,Wake Forest,4,4,0,0,NA,401092108,2019-02-17,
171,3,9:51,1191,1191,Amaya Finklea-Guity missed Layup.,39,30,9,0,0.8013656010554591,Syracuse,Wake Forest,5,5,0,0,NA,401092108,2019-02-17,
172,3,9:51,1191,1191,Ivana Raca Block.,39,30,9,2,0.8013656010554591,Syracuse,Wake Forest,5,5,0,0,NA,401092108,2019-02-17,
173,3,9:49,1189,1189,Ivana Raca Defensive Rebound.,39,30,9,6,0.8016030055689454,Syracuse,Wake Forest,5,5,0,0,NA,401092108,2019-02-17,
174,3,9:43,1183,1183,Ivana Raca missed Three Point Jumper.,39,30,9,0,0.8023093382025254,Syracuse,Wake Forest,5,5,0,0,NA,401092108,2019-02-17,
175,3,9:43,1183,1183,Tiana Mangakahia Defensive Rebound.,39,30,9,10,0.8023093382025254,Syracuse,Wake Forest,5,5,0,0,NA,401092108,2019-02-17,
176,3,9:33,1173,1173,Miranda Drummond missed Three Point Jumper.,39,30,9,0,0.8034689443884587,Syracuse,Wake Forest,5,5,0,0,NA,401092108,2019-02-17,
177,3,9:33,1173,1173,Amaya Finklea-Guity Offensive Rebound.,39,30,9,8,0.8034689443884587,Syracuse,Wake Forest,5,5,0,0,NA,401092108,2019-02-17,
178,3,9:25,1165,1165,Gabrielle Cooper missed Three Point Jumper.,39,30,9,0,0.8043831346457402,Syracuse,Wake Forest,5,5,0,0,NA,401092108,2019-02-17,
179,3,9:25,1165,1165,Wake Forest Defensive Rebound.,39,30,9,11,0.8043831346457402,Syracuse,Wake Forest,5,5,0,0,NA,401092108,2019-02-17,
180,3,9:14,1154,1154,Maya Banks made Layup. Assisted by Alex Sharp.,39,32,7,10,0.7513574636738318,Syracuse,Wake Forest,5,5,0,0,NA,401092108,2019-02-17,Wake Forest
181,3,9:04,1144,1144,Foul on Maya Banks.,39,32,7,1,0.7523948201093629,Syracuse,Wake Forest,5,5,0,0,NA,401092108,2019-02-17,
182,3,9:03,1143,1143,Miranda Drummond missed Three Point Jumper.,39,32,7,0,0.7524982297504593,Syracuse,Wake Forest,5,5,0,0,NA,401092108,2019-02-17,
183,3,9:03,1143,1143,Wake Forest Defensive Rebound.,39,32,7,16,0.7524982297504593,Syracuse,Wake Forest,5,5,0,0,NA,401092108,2019-02-17,
184,3,8:47,1127,1127,Alex Sharp missed Jumper.,39,32,7,0,0.7541490887973739,Syracuse,Wake Forest,5,5,0,0,NA,401092108,2019-02-17,
185,3,8:47,1127,1127,Tiana Mangakahia Defensive Rebound.,39,32,7,4,0.7541490887973739,Syracuse,Wake Forest,5,5,0,0,NA,401092108,2019-02-17,
