play_id,period,time_remaining_period,secs_remaining,secs_remaining_absolute,description,home_score,away_score,score_diff,play_length,win_prob,home,away,home_time_out_remaining,away_time_out_remaining,home_timeout_ind,away_timeout_ind,home_favored_by,game_id,date,whichScored
1,1,9:58,2398,2398,Foul on Michaela Onyenwere.,0,0,0,26,0.5,UCLA,Arizona State,4,4,0,0,NA,401172110,2020-01-03,NA
2,1,9:32,2372,2372,Jayde Van Hyfte missed Three Point Jumper.,0,0,0,3,0.5,UCLA,Arizona State,4,4,0,0,NA,401172110,2020-01-03,
3,1,9:29,2369,2369,Kiara Russell Offensive Rebound.,0,0,0,17,0.5,UCLA,Arizona State,4,4,0,0,NA,401172110,2020-01-03,
4,1,9:12,2352,2352,Ja'Tavia Tapley missed Jumper.,0,0,0,4,0.5,UCLA,Arizona State,4,4,0,0,NA,401172110,2020-01-03,
5,1,9:08,2348,2348,Lauryn Miller Defensive Rebound.,0,0,0,11,0.5,UCLA,Arizona State,4,4,0,0,NA,401172110,2020-01-03,
6,1,8:57,2337,2337,Japreece Dean missed Jumper.,0,0,0,4,0.5,UCLA,Arizona State,4,4,0,0,NA,401172110,2020-01-03,
7,1,8:53,2333,2333,Lauryn Miller Offensive Rebound.,0,0,0,0,0.5,UCLA,Arizona State,4,4,0,0,NA,401172110,2020-01-03,
8,1,8:53,2333,2333,Lauryn Miller made Layup.,2,0,2,21,0.5454603446991073,UCLA,Arizona State,4,4,0,0,NA,401172110,2020-01-03,UCLA
9,1,8:32,2312,2312,Robbi Ryan made Jumper.,2,2,0,23,0.5,UCLA,Arizona State,4,4,0,0,NA,401172110,2020-01-03,Arizona State
10,1,8:09,2289,2289,Lindsey Corsaro made Jumper. Assisted by Michaela Onyenwere.,4,2,2,32,0.5464323470136655,UCLA,Arizona State,4,4,0,0,NA,401172110,2020-01-03,UCLA
11,1,7:37,2257,2257,Kiara Russell missed Three Point Jumper.,4,2,2,4,0.5471512577612353,UCLA,Arizona State,4,4,0,0,NA,401172110,2020-01-03,
12,1,7:33,2253,2253,Michaela Onyenwere Defensive Rebound.,4,2,2,15,0.5472417311522229,UCLA,Arizona State,4,4,0,0,NA,401172110,2020-01-03,
13,1,7:18,2238,2238,Japreece Dean made Three Point Jumper. Assisted by Lindsey Corsaro.,7,2,5,16,0.6171018578559682,UCLA,Arizona State,4,4,0,0,NA,401172110,2020-01-03,UCLA
14,1,7:02,2222,2222,Kiara Russell missed Jumper.,7,2,5,4,0.617971326071389,UCLA,Arizona State,4,4,0,0,NA,401172110,2020-01-03,
15,1,6:58,2218,2218,Lindsey Corsaro Defensive Rebound.,7,2,5,3,0.6181891993142843,UCLA,Arizona State,4,4,0,0,NA,401172110,2020-01-03,
16,1,6:55,2215,2215,Charisma Osborne Turnover.,7,2,5,16,0.6183527268036805,UCLA,Arizona State,4,4,0,0,NA,401172110,2020-01-03,
17,1,6:39,2199,2199,Sara Bejedi missed Three Point Jumper.,7,2,5,4,0.6192264985012372,UCLA,Arizona State,4,4,0,0,NA,401172110,2020-01-03,
18,1,6:35,2195,2195,Charisma Osborne Defensive Rebound.,7,2,5,17,0.6194453299023808,UCLA,Arizona State,4,4,0,0,NA,401172110,2020-01-03,
19,1,6:18,2178,2178,Japreece Dean missed Jumper.,7,2,5,4,0.6203768162487642,UCLA,Arizona State,4,4,0,0,NA,401172110,2020-01-03,
20,1,6:14,2174,2174,Natalie Chou Offensive Rebound.,7,2,5,2,0.6205962868326589,UCLA,Arizona State,4,4,0,0,NA,401172110,2020-01-03,
21,1,6:12,2172,2172,Natalie Chou made Three Point Jumper.,10,2,8,17,0.6874176003840284,UCLA,Arizona State,4,4,0,0,NA,401172110,2020-01-03,UCLA
22,1,5:55,2155,2155,Sara Bejedi missed Jumper.,10,2,8,4,0.6887820419147419,UCLA,Arizona State,4,4,0,0,NA,401172110,2020-01-03,
23,1,5:51,2151,2151,Charisma Osborne Defensive Rebound.,10,2,8,5,0.6891037377947551,UCLA,Arizona State,4,4,0,0,NA,401172110,2020-01-03,
24,1,5:46,2146,2146,Charisma Osborne made Three Point Jumper. Assisted by Japreece Dean.,13,2,11,4,0.7496959516880632,UCLA,Arizona State,4,4,0,0,NA,401172110,2020-01-03,UCLA
25,1,5:42,2142,2142,Arizona State  Timeout,13,2,11,0,0.7500843013813518,UCLA,Arizona State,3,4,1,0,NA,401172110,2020-01-03,
26,1,5:42,2142,2142,Official TV Timeout,13,2,11,27,0.7500843013813518,UCLA,Arizona State,3,4,1,0,NA,401172110,2020-01-03,
27,1,5:15,2115,2115,Reili Richardson missed Jumper.,13,2,11,4,0.7527100781491605,UCLA,Arizona State,3,4,1,0,NA,401172110,2020-01-03,
28,1,5:11,2111,2111,Lauryn Miller Defensive Rebound.,13,2,11,11,0.753099815174024,UCLA,Arizona State,3,4,1,0,NA,401172110,2020-01-03,
29,1,5:00,2100,2100,Lauryn Miller missed Jumper.,13,2,11,2,0.7541726911413651,UCLA,Arizona State,3,4,1,0,NA,401172110,2020-01-03,
30,1,4:58,2098,2098,Ja'Tavia Tapley Defensive Rebound.,13,2,11,7,0.7543679404591507,UCLA,Arizona State,3,4,1,0,NA,401172110,2020-01-03,
31,1,4:51,2091,2091,Ja'Tavia Tapley missed Layup.,13,2,11,2,0.7550517734721365,UCLA,Arizona State,3,4,1,0,NA,401172110,2020-01-03,
32,1,4:49,2089,2089,Lauryn Miller Defensive Rebound.,13,2,11,0,0.75524728929128,UCLA,Arizona State,3,4,1,0,NA,401172110,2020-01-03,
33,1,4:49,2089,2089,Foul on Ja'Tavia Tapley.,13,2,11,34,0.75524728929128,UCLA,Arizona State,3,4,1,0,NA,401172110,2020-01-03,
34,1,4:15,2055,2055,Japreece Dean missed Jumper.,13,2,11,3,0.7585811270123443,UCLA,Arizona State,3,4,0,0,NA,401172110,2020-01-03,
35,1,4:12,2052,2052,Robbi Ryan Defensive Rebound.,13,2,11,5,0.7588762742267343,UCLA,Arizona State,3,4,0,0,NA,401172110,2020-01-03,
36,1,4:07,2047,2047,Robbi Ryan made Layup.,13,4,9,12,0.7191545128377829,UCLA,Arizona State,3,4,0,0,NA,401172110,2020-01-03,Arizona State
37,1,3:55,2035,2035,Charisma Osborne missed Three Point Jumper.,13,4,9,4,0.720225382286153,UCLA,Arizona State,3,4,0,0,NA,401172110,2020-01-03,
38,1,3:51,2031,2031,Robbi Ryan Defensive Rebound.,13,4,9,16,0.7205831787469349,UCLA,Arizona State,3,4,0,0,NA,401172110,2020-01-03,
39,1,3:35,2015,2015,Iris Mbulito missed Three Point Jumper.,13,4,9,4,0.7220187258276203,UCLA,Arizona State,3,4,0,0,NA,401172110,2020-01-03,
40,1,3:31,2011,2011,Chantel Horvat Defensive Rebound.,13,4,9,5,0.7223787328228459,UCLA,Arizona State,3,4,0,0,NA,401172110,2020-01-03,
41,1,3:26,2006,2006,Charisma Osborne missed Layup.,13,4,9,4,0.7228293890612827,UCLA,Arizona State,3,4,0,0,NA,401172110,2020-01-03,
42,1,3:22,2002,2002,Lauryn Miller Offensive Rebound.,13,4,9,0,0.7231904392050105,UCLA,Arizona State,3,4,0,0,NA,401172110,2020-01-03,
43,1,3:22,2002,2002,Lauryn Miller missed Layup.,13,4,9,2,0.7231904392050105,UCLA,Arizona State,3,4,0,0,NA,401172110,2020-01-03,
44,1,3:20,2000,2000,Charisma Osborne Offensive Rebound.,13,4,9,3,0.7233711413366952,UCLA,Arizona State,3,4,0,0,NA,401172110,2020-01-03,
45,1,3:17,1997,1997,Natalie Chou missed Three Point Jumper.,13,4,9,5,0.7236424179039431,UCLA,Arizona State,3,4,0,0,NA,401172110,2020-01-03,
46,1,3:12,1992,1992,Japreece Dean Offensive Rebound.,13,4,9,9,0.724095147199298,UCLA,Arizona State,3,4,0,0,NA,401172110,2020-01-03,
47,1,3:03,1983,1983,Chantel Horvat missed Jumper.,13,4,9,0,0.7249119873197418,UCLA,Arizona State,3,4,0,0,NA,401172110,2020-01-03,
48,1,3:03,1983,1983,Iris Mbulito Defensive Rebound.,13,4,9,0,0.7249119873197418,UCLA,Arizona State,3,4,0,0,NA,401172110,2020-01-03,
49,1,3:03,1983,1983,Foul on Lauryn Miller.,13,4,9,11,0.7249119873197418,UCLA,Arizona State,3,4,0,0,NA,401172110,2020-01-03,
50,1,2:52,1972,1972,Sara Bejedi made Three Point Jumper. Assisted by Iris Mbulito.,13,7,6,10,0.6568585008040426,UCLA,Arizona State,3,4,0,0,NA,401172110,2020-01-03,Arizona State
51,1,2:42,1962,1962,Natalie Chou missed Three Point Jumper.,13,7,6,3,0.6575492582642859,UCLA,Arizona State,3,4,0,0,NA,401172110,2020-01-03,
52,1,2:39,1959,1959,Iris Mbulito Defensive Rebound.,13,7,6,0,0.6577571217699562,UCLA,Arizona State,3,4,0,0,NA,401172110,2020-01-03,
53,1,2:39,1959,1959,Foul on Lindsey Corsaro.,13,7,6,17,0.6577571217699562,UCLA,Arizona State,3,4,0,0,NA,401172110,2020-01-03,
54,1,2:22,1942,1942,Sara Bejedi missed Three Point Jumper.,13,7,6,3,0.6589406956900598,UCLA,Arizona State,3,4,0,0,NA,401172110,2020-01-03,
55,1,2:19,1939,1939,Natalie Chou Defensive Rebound.,13,7,6,10,0.6591505821602417,UCLA,Arizona State,3,4,0,0,NA,401172110,2020-01-03,
56,1,2:09,1929,1929,Michaela Onyenwere missed Jumper.,13,7,6,3,0.6598524372106777,UCLA,Arizona State,3,4,0,0,NA,401172110,2020-01-03,
57,1,2:06,1926,1926,Jamie Ruden Defensive Rebound.,13,7,6,6,0.6600632688505107,UCLA,Arizona State,3,4,0,0,NA,401172110,2020-01-03,
58,1,2:00,1920,1920,Iris Mbulito missed Jumper.,13,7,6,4,0.6604844178015479,UCLA,Arizona State,3,4,0,0,NA,401172110,2020-01-03,
59,1,1:56,1916,1916,Eboni Walker Offensive Rebound.,13,7,6,0,0.6607648392197709,UCLA,Arizona State,3,4,0,0,NA,401172110,2020-01-03,
60,1,1:56,1916,1916,Eboni Walker missed Layup.,13,7,6,2,0.6607648392197709,UCLA,Arizona State,3,4,0,0,NA,401172110,2020-01-03,
61,1,1:54,1914,1914,Chantel Horvat Defensive Rebound.,13,7,6,5,0.6609049566389436,UCLA,Arizona State,3,4,0,0,NA,401172110,2020-01-03,
62,1,1:49,1909,1909,Michaela Onyenwere missed Jumper.,13,7,6,4,0.6612550049820762,UCLA,Arizona State,3,4,0,0,NA,401172110,2020-01-03,
63,1,1:45,1905,1905,Iris Mbulito Defensive Rebound.,13,7,6,4,0.6615348190639374,UCLA,Arizona State,3,4,0,0,NA,401172110,2020-01-03,
64,1,1:41,1901,1901,Eboni Walker missed Layup.,13,7,6,2,0.66181446247740106,UCLA,Arizona State,3,4,0,0,NA,401172110,2020-01-03,
65,1,1:39,1899,1899,Eboni Walker Offensive Rebound.,13,7,6,0,0.6619542285275407,UCLA,Arizona State,3,4,0,0,NA,401172110,2020-01-03,
66,1,1:39,1899,1899,Foul on Chantel Horvat.,13,7,6,0,0.6619542285275407,UCLA,Arizona State,3,4,0,0,NA,401172110,2020-01-03,
67,1,1:39,1899,1899,Eboni Walker made Free Throw.,13,8,5,0,0.6364554532588337,UCLA,Arizona State,3,4,0,0,NA,401172110,2020-01-03,Arizona State
68,1,1:39,1899,1899,Eboni Walker made Free Throw.,13,9,4,15,0.6101660066232518,UCLA,Arizona State,3,4,0,0,NA,401172110,2020-01-03,Arizona State
69,1,1:24,1884,1884,Charisma Osborne made Dunk. Assisted by Lindsey Corsaro.,15,9,6,29,0.6630016626182395,UCLA,Arizona State,3,4,0,0,NA,401172110,2020-01-03,UCLA
70,1,0:55,1855,1855,Kiara Russell made Jumper. Assisted by Robbi Ryan.,15,11,4,26,0.6123459826550677,UCLA,Arizona State,3,4,0,0,NA,401172110,2020-01-03,Arizona State
71,1,0:29,1829,1829,Michaela Onyenwere Turnover.,15,11,4,0,0.6136415605331016,UCLA,Arizona State,3,4,0,0,NA,401172110,2020-01-03,
72,1,0:29,1829,1829,Robbi Ryan Steal.,15,11,4,7,0.6136415605331016,UCLA,Arizona State,3,4,0,0,NA,401172110,2020-01-03,
73,1,0:22,1822,1822,Robbi Ryan made Jumper.,15,13,2,14,0.557756605665876,UCLA,Arizona State,3,4,0,0,NA,401172110,2020-01-03,Arizona State
74,1,0:08,1808,1808,Japreece Dean made Three Point Jumper.,18,13,5,8,0.6419576521423381,UCLA,Arizona State,3,4,0,0,NA,401172110,2020-01-03,UCLA
75,1,0:00,1800,1800,Reili Richardson missed Three Point Jumper.,18,13,5,0,0.6424482088636343,UCLA,Arizona State,3,4,0,0,NA,401172110,2020-01-03,
76,1,0:00,1800,1800,Michaela Onyenwere Defensive Rebound.,18,13,5,0,0.6424482088636343,UCLA,Arizona State,3,4,0,0,NA,401172110,2020-01-03,
77,1,0:00,1800,1800,End of 1st Quarter,18,13,5,15,0.6424482088636343,UCLA,Arizona State,3,4,0,0,NA,401172110,2020-01-03,
78,2,9:45,1785,1785,Charisma Osborne Turnover.,18,13,5,19,0.643373286315047,UCLA,Arizona State,4,4,0,0,NA,401172110,2020-01-03,
79,2,9:26,1766,1766,Kiara Russell missed Jumper.,18,13,5,3,0.6445565143700558,UCLA,Arizona State,4,4,0,0,NA,401172110,2020-01-03,
80,2,9:23,1763,1763,Lindsey Corsaro Defensive Rebound.,18,13,5,20,0.6447446517627107,UCLA,Arizona State,4,4,0,0,NA,401172110,2020-01-03,
81,2,9:03,1743,1743,Lindsey Corsaro missed Three Point Jumper.,18,13,5,4,0.6460091523158173,UCLA,Arizona State,4,4,0,0,NA,401172110,2020-01-03,
82,2,8:59,1739,1739,Ja'Tavia Tapley Defensive Rebound.,18,13,5,14,0.6462643397772988,UCLA,Arizona State,4,4,0,0,NA,401172110,2020-01-03,
83,2,8:45,1725,1725,Robbi Ryan missed Three Point Jumper.,18,13,5,4,0.6471640445992196,UCLA,Arizona State,4,4,0,0,NA,401172110,2020-01-03,
84,2,8:41,1721,1721,Japreece Dean Defensive Rebound.,18,13,5,5,0.6474230638492782,UCLA,Arizona State,4,4,0,0,NA,401172110,2020-01-03,
85,2,8:36,1716,1716,Michaela Onyenwere missed Layup.,18,13,5,2,0.6477481217944275,UCLA,Arizona State,4,4,0,0,NA,401172110,2020-01-03,
86,2,8:34,1714,1714,Charisma Osborne Offensive Rebound.,18,13,5,0,0.6478785530729694,UCLA,Arizona State,4,4,0,0,NA,401172110,2020-01-03,
87,2,8:34,1714,1714,Foul on Kiara Russell.,18,13,5,0,0.6478785530729694,UCLA,Arizona State,4,4,0,0,NA,401172110,2020-01-03,
88,2,8:34,1714,1714,Lauryn Miller Turnover.,18,13,5,0,0.6478785530729694,UCLA,Arizona State,4,4,0,0,NA,401172110,2020-01-03,
89,2,8:34,1714,1714,Sara Bejedi Steal.,18,13,5,0,0.6478785530729694,UCLA,Arizona State,4,4,0,0,NA,401172110,2020-01-03,
90,2,8:34,1714,1714,Foul on Michaela Onyenwere.,18,13,5,12,0.6478785530729694,UCLA,Arizona State,4,4,0,0,NA,401172110,2020-01-03,
91,2,8:22,1702,1702,Ja'Tavia Tapley missed Jumper.,18,13,5,5,0.6486662172130523,UCLA,Arizona State,4,4,0,0,NA,401172110,2020-01-03,
92,2,8:17,1697,1697,Lindsey Corsaro Defensive Rebound.,18,13,5,8,0.6489970695135515,UCLA,Arizona State,4,4,0,0,NA,401172110,2020-01-03,
93,2,8:09,1689,1689,Japreece Dean missed Jumper.,18,13,5,3,0.6495297406413132,UCLA,Arizona State,4,4,0,0,NA,401172110,2020-01-03,
94,2,8:06,1686,1686,Charisma Osborne Offensive Rebound.,18,13,5,4,0.64972927692674,UCLA,Arizona State,4,4,0,0,NA,401172110,2020-01-03,
95,2,8:02,1682,1682,Chantel Horvat missed Layup.,18,13,5,0,0.6499937939172042,UCLA,Arizona State,4,4,0,0,NA,401172110,2020-01-03,
96,2,8:02,1682,1682,Japreece Dean Offensive Rebound.,18,13,5,0,0.6499937939172042,UCLA,Arizona State,4,4,0,0,NA,401172110,2020-01-03,
97,2,8:02,1682,1682,Japreece Dean missed Layup.,18,13,5,0,0.6499937939172042,UCLA,Arizona State,4,4,0,0,NA,401172110,2020-01-03,
98,2,8:02,1682,1682,Chantel Horvat Offensive Rebound.,18,13,5,0,0.6499937939172042,UCLA,Arizona State,4,4,0,0,NA,401172110,2020-01-03,
99,2,8:02,1682,1682,Foul on Reili Richardson.,18,13,5,17,0.6499937939172042,UCLA,Arizona State,4,4,0,0,NA,401172110,2020-01-03,
100,2,7:45,1665,1665,Charisma Osborne made Three Point Jumper. Assisted by Japreece Dean.,21,13,8,16,0.7307058428757237,UCLA,Arizona State,4,4,0,0,NA,401172110,2020-01-03,UCLA
101,2,7:29,1649,1649,Taya Hanson made Jumper.,21,15,6,10,0.680059102721806,UCLA,Arizona State,4,4,0,0,NA,401172110,2020-01-03,Arizona State
102,2,7:19,1639,1639,Natalie Chou made Three Point Jumper. Assisted by Japreece Dean.,24,15,9,12,0.7569545954159205,UCLA,Arizona State,4,4,0,0,NA,401172110,2020-01-03,UCLA
103,2,7:07,1627,1627,Foul on Japreece Dean.,24,15,9,0,0.7580460421887995,UCLA,Arizona State,4,4,0,0,NA,401172110,2020-01-03,
104,2,7:07,1627,1627,Sara Bejedi made Free Throw.,24,16,8,0,0.7340186327310533,UCLA,Arizona State,4,4,0,0,NA,401172110,2020-01-03,Arizona State
105,2,7:07,1627,1627,Sara Bejedi made Free Throw.,24,17,7,14,0.7085226312687589,UCLA,Arizona State,4,4,0,0,NA,401172110,2020-01-03,Arizona State
106,2,6:53,1613,1613,Foul on Japreece Dean.,24,17,7,0,0.7096281032822275,UCLA,Arizona State,4,4,0,0,NA,401172110,2020-01-03,
107,2,6:53,1613,1613,Japreece Dean Turnover.,24,17,7,17,0.7096281032822275,UCLA,Arizona State,4,4,0,0,NA,401172110,2020-01-03,
108,2,6:36,1596,1596,Jayde Van Hyfte made Layup. Assisted by Iris Mbulito.,24,19,5,11,0.6554099536886788,UCLA,Arizona State,4,4,0,0,NA,401172110,2020-01-03,Arizona State
109,2,6:25,1585,1585,Foul on Taya Hanson.,24,19,5,7,0.6560879762157026,UCLA,Arizona State,4,4,0,0,NA,401172110,2020-01-03,
110,2,6:18,1578,1578,Japreece Dean missed Jumper.,24,19,5,3,0.6565204286867146,UCLA,Arizona State,4,4,0,0,NA,401172110,2020-01-03,
111,2,6:15,1575,1575,Taya Hanson Defensive Rebound.,24,19,5,4,0.6567061294429569,UCLA,Arizona State,4,4,0,0,NA,401172110,2020-01-03,
112,2,6:11,1571,1571,Sara Bejedi Turnover.,24,19,5,14,0.6569541507530707,UCLA,Arizona State,4,4,0,0,NA,401172110,2020-01-03,
113,2,5:57,1557,1557,Japreece Dean missed Jumper.,24,19,5,3,0.6578270932265411,UCLA,Arizona State,4,4,0,0,NA,401172110,2020-01-03,
114,2,5:54,1554,1554,Taya Hanson Defensive Rebound.,24,19,5,5,0.6580153566356547,UCLA,Arizona State,4,4,0,0,NA,401172110,2020-01-03,
115,2,5:49,1549,1549,Iris Mbulito Turnover.,24,19,5,0,0.6583302531657537,UCLA,Arizona State,4,4,0,0,NA,401172110,2020-01-03,
116,2,5:49,1549,1549,Natalie Chou Steal.,24,19,5,7,0.6583302531657537,UCLA,Arizona State,4,4,0,0,NA,401172110,2020-01-03,
117,2,5:42,1542,1542,Natalie Chou missed Layup.,24,19,5,2,0.6587737255780219,UCLA,Arizona State,4,4,0,0,NA,401172110,2020-01-03,
118,2,5:40,1540,1540,Charisma Osborne Offensive Rebound.,24,19,5,3,0.6589010440387655,UCLA,Arizona State,4,4,0,0,NA,401172110,2020-01-03,
119,2,5:37,1537,1537,Japreece Dean Turnover.,24,19,5,0,0.6590925682978487,UCLA,Arizona State,4,4,0,0,NA,401172110,2020-01-03,
120,2,5:37,1537,1537,Jamie Ruden Steal.,24,19,5,12,0.6590925682978487,UCLA,Arizona State,4,4,0,0,NA,401172110,2020-01-03,
121,2,5:25,1525,1525,Sara Bejedi made Three Point Jumper.,24,22,2,22,0.5658843048578295,UCLA,Arizona State,4,4,0,0,NA,401172110,2020-01-03,Arizona State
122,2,5:03,1503,1503,Charisma Osborne missed Three Point Jumper.,24,22,2,2,0.5665210320962585,UCLA,Arizona State,4,4,0,0,NA,401172110,2020-01-03,
123,2,5:01,1501,1501,Chantel Horvat Offensive Rebound.,24,22,2,0,0.566580120243879,UCLA,Arizona State,4,4,0,0,NA,401172110,2020-01-03,
124,2,5:01,1501,1501,Foul on Jayde Van Hyfte.,24,22,2,2,0.566580120243879,UCLA,Arizona State,4,4,0,0,NA,401172110,2020-01-03,
125,2,4:59,1499,1499,Official TV Timeout,24,22,2,9,0.5666394277196649,UCLA,Arizona State,4,4,0,0,NA,401172110,2020-01-03,
126,2,4:50,1490,1490,Michaela Onyenwere made Layup. Assisted by Japreece Dean.,26,22,4,21,0.6314641106168378,UCLA,Arizona State,4,4,0,0,NA,401172110,2020-01-03,UCLA
127,2,4:29,1469,1469,Kiara Russell made Layup. Assisted by Reili Richardson.,26,24,2,11,0.5675582882649438,UCLA,Arizona State,4,4,0,0,NA,401172110,2020-01-03,Arizona State
128,2,4:18,1458,1458,Michaela Onyenwere missed Layup.,26,24,2,1,0.5679106830810422,UCLA,Arizona State,4,4,0,0,NA,401172110,2020-01-03,
129,2,4:17,1457,1457,Arizona State Defensive Rebound.,26,24,2,25,0.5679431759795737,UCLA,Arizona State,4,4,0,0,NA,401172110,2020-01-03,
130,2,3:52,1432,1432,Kiara Russell missed Jumper.,26,24,2,2,0.568756860435449,UCLA,Arizona State,4,4,0,0,NA,401172110,2020-01-03,
131,2,3:50,1430,1430,Arizona State Offensive Rebound.,26,24,2,4,0.5688204350588157,UCLA,Arizona State,4,4,0,0,NA,401172110,2020-01-03,
132,2,3:46,1426,1426,Ja'Tavia Tapley made Three Point Jumper.,26,27,-1,12,0.46536110356949495,UCLA,Arizona State,4,4,0,0,NA,401172110,2020-01-03,Arizona State
133,2,3:34,1414,1414,Lindsey Corsaro made Three Point Jumper. Assisted by Chantel Horvat.,29,27,2,16,0.5693212374018192,UCLA,Arizona State,4,4,0,0,NA,401172110,2020-01-03,UCLA
134,2,3:18,1398,1398,Taya Hanson missed Three Point Jumper.,29,27,2,3,0.5698109890819198,UCLA,Arizona State,4,4,0,0,NA,401172110,2020-01-03,
135,2,3:15,1395,1395,Lindsey Corsaro Defensive Rebound.,29,27,2,8,0.5699019086909004,UCLA,Arizona State,4,4,0,0,NA,401172110,2020-01-03,
136,2,3:07,1387,1387,Charisma Osborne made Layup.,31,27,4,15,0.6375790760231219,UCLA,Arizona State,4,4,0,0,NA,401172110,2020-01-03,UCLA
137,2,2:52,1372,1372,Eboni Walker made Layup. Assisted by Ja'Tavia Tapley.,31,29,2,31,0.570593466680972,UCLA,Arizona State,4,4,0,0,NA,401172110,2020-01-03,Arizona State
138,2,2:21,1341,1341,Chantel Horvat missed Layup.,31,29,2,3,0.5715255298805451,UCLA,Arizona State,4,4,0,0,NA,401172110,2020-01-03,
139,2,2:18,1338,1338,Reili Richardson Defensive Rebound.,31,29,2,6,0.57161666092055,UCLA,Arizona State,4,4,0,0,NA,401172110,2020-01-03,
140,2,2:12,1332,1332,Ja'Tavia Tapley made Layup. Assisted by Reili Richardson.,31,31,0,22,0.5,UCLA,Arizona State,4,4,0,0,NA,401172110,2020-01-03,Arizona State
141,2,1:50,1310,1310,Foul on Eboni Walker.,31,31,0,0,0.5,UCLA,Arizona State,4,4,0,0,NA,401172110,2020-01-03,
142,2,1:50,1310,1310,Lindsey Corsaro made Free Throw.,32,31,1,0,0.5364343244612586,UCLA,Arizona State,4,4,0,0,NA,401172110,2020-01-03,UCLA
143,2,1:50,1310,1310,Lindsey Corsaro made Free Throw.,33,31,2,24,0.5724837716925382,UCLA,Arizona State,4,4,0,0,NA,401172110,2020-01-03,UCLA
144,2,1:26,1286,1286,Reili Richardson Turnover.,33,31,2,0,0.5732617983107366,UCLA,Arizona State,4,4,0,0,NA,401172110,2020-01-03,
145,2,1:26,1286,1286,Lauryn Miller Steal.,33,31,2,7,0.5732617983107366,UCLA,Arizona State,4,4,0,0,NA,401172110,2020-01-03,
146,2,1:19,1279,1279,Lauryn Miller made Layup. Assisted by Lindsey Corsaro.,35,31,4,2,0.6438847015337722,UCLA,Arizona State,4,4,0,0,NA,401172110,2020-01-03,UCLA
147,2,1:17,1277,1277,Arizona State  Timeout,35,31,4,10,0.6440120269472533,UCLA,Arizona State,3,4,1,0,NA,401172110,2020-01-03,
148,2,1:07,1267,1267,Sara Bejedi Turnover.,35,31,4,15,0.6446586795451911,UCLA,Arizona State,3,4,1,0,NA,401172110,2020-01-03,
149,2,0:52,1252,1252,Foul on Sara Bejedi.,35,31,4,0,0.6456629519977736,UCLA,Arizona State,3,4,1,0,NA,401172110,2020-01-03,
150,2,0:52,1252,1252,Japreece Dean made Free Throw.,36,31,5,0,0.679186610981001,UCLA,Arizona State,3,4,1,0,NA,401172110,2020-01-03,UCLA
151,2,0:52,1252,1252,Japreece Dean made Free Throw.,37,31,6,7,0.7109584567037899,UCLA,Arizona State,3,4,1,0,NA,401172110,2020-01-03,UCLA
152,2,0:45,1245,1245,Foul on Sara Bejedi.,37,31,6,0,0.7116105710313356,UCLA,Arizona State,3,4,1,0,NA,401172110,2020-01-03,
153,2,0:45,1245,1245,Sara Bejedi Turnover.,37,31,6,27,0.7116105710313356,UCLA,Arizona State,3,4,1,0,NA,401172110,2020-01-03,
154,2,0:18,1218,1218,Japreece Dean missed Three Point Jumper.,37,31,6,4,0.7142631130038221,UCLA,Arizona State,3,4,1,0,NA,401172110,2020-01-03,
155,2,0:14,1214,1214,Lauryn Miller Offensive Rebound.,37,31,6,2,0.7146763546575762,UCLA,Arizona State,3,4,0,0,NA,401172110,2020-01-03,
156,2,0:12,1212,1212,Lauryn Miller missed Layup.,37,31,6,3,0.7148850811987035,UCLA,Arizona State,3,4,0,0,NA,401172110,2020-01-03,
157,2,0:09,1209,1209,Kiara Russell Defensive Rebound.,37,31,6,9,0.7152005402381141,UCLA,Arizona State,3,4,0,0,NA,401172110,2020-01-03,
158,2,0:00,1200,1200,Eboni Walker made Jumper. Assisted by Iris Mbulito.,37,33,4,0,0.6495177425372646,UCLA,Arizona State,3,4,0,0,NA,401172110,2020-01-03,Arizona State
159,2,0:00,1200,1200,End of 2nd Quarter,37,33,4,29,0.6495177425372646,UCLA,Arizona State,3,4,0,0,NA,401172110,2020-01-03,
160,3,9:31,1171,1171,Ja'Tavia Tapley made Jumper. Assisted by Kiara Russell.,37,35,2,18,0.5776755082767817,UCLA,Arizona State,4,5,0,0,NA,401172110,2020-01-03,Arizona State
161,3,9:13,1153,1153,Japreece Dean made Jumper. Assisted by Lauryn Miller.,39,35,4,11,0.6529975022286455,UCLA,Arizona State,4,5,0,0,NA,401172110,2020-01-03,UCLA
162,3,9:02,1142,1142,Robbi Ryan made Three Point Jumper. Assisted by Kiara Russell.,39,38,1,24,0.5396500000301686,UCLA,Arizona State,4,5,0,0,NA,401172110,2020-01-03,Arizona State
163,3,8:38,1118,1118,Charisma Osborne missed Jumper.,39,38,1,4,0.5401236000051486,UCLA,Arizona State,4,5,0,0,NA,401172110,2020-01-03,
164,3,8:34,1114,1114,Ja'Tavia Tapley Defensive Rebound.,39,38,1,4,0.5402030525843314,UCLA,Arizona State,4,5,0,0,NA,401172110,2020-01-03,
165,3,8:30,1110,1110,Robbi Ryan missed Three Point Jumper.,39,38,1,4,0.5402827692719411,UCLA,Arizona State,4,5,0,0,NA,401172110,2020-01-03,
166,3,8:26,1106,1106,Lauryn Miller Defensive Rebound.,39,38,1,10,0.5403627934644206,UCLA,Arizona State,4,5,0,0,NA,401172110,2020-01-03,
167,3,8:16,1096,1096,UCLA  Turnover.,39,38,1,12,0.5405644840260915,UCLA,Arizona State,4,5,0,0,NA,401172110,2020-01-03,
168,3,8:04,1084,1084,Kiara Russell made Layup. Assisted by Eboni Walker.,39,40,-1,13,0.4591896380002988,UCLA,Arizona State,4,5,0,0,NA,401172110,2020-01-03,Arizona State
169,3,7:51,1071,1071,Lauryn Miller missed Layup.,39,40,-1,1,0.45891724679133455,UCLA,Arizona State,4,5,0,0,NA,401172110,2020-01-03,
170,3,7:50,1070,1070,UCLA Offensive Rebound.,39,40,-1,13,0.4588959930529921,UCLA,Arizona State,4,5,0,0,NA,401172110,2020-01-03,
171,3,7:37,1057,1057,Lindsey Corsaro made Layup. Assisted by Lauryn Miller.,41,40,1,21,0.5413847675952427,UCLA,Arizona State,4,5,0,0,NA,401172110,2020-01-03,UCLA
172,3,7:16,1036,1036,Reili Richardson made Three Point Jumper. Assisted by Kiara Russell.,41,43,-2,22,0.416865398353292,UCLA,Arizona State,4,5,0,0,NA,401172110,2020-01-03,Arizona State
173,3,6:54,1014,1014,Michaela Onyenwere missed Jumper.,41,43,-2,3,0.41582901954603163,UCLA,Arizona State,4,5,0,0,NA,401172110,2020-01-03,
174,3,6:51,1011,1011,Kiara Russell Defensive Rebound.,41,43,-2,7,0.41568187158524655,UCLA,Arizona State,4,5,0,0,NA,401172110,2020-01-03,
175,3,6:44,1004,1004,Kiara Russell Turnover.,41,43,-2,21,0.41533260194554855,UCLA,Arizona State,4,5,0,0,NA,401172110,2020-01-03,
176,3,6:23,983,983,Michaela Onyenwere missed Jumper.,41,43,-2,3,0.4142310589789473,UCLA,Arizona State,4,5,0,0,NA,401172110,2020-01-03,
177,3,6:20,980,980,Sara Bejedi Defensive Rebound.,41,43,-2,3,0.4140666309128756,UCLA,Arizona State,4,5,0,0,NA,401172110,2020-01-03,
178,3,6:17,977,977,Sara Bejedi Turnover.,41,43,-2,0,0.4139003312316972,UCLA,Arizona State,4,5,0,0,NA,401172110,2020-01-03,
179,3,6:17,977,977,Natalie Chou Steal.,41,43,-2,7,0.4139003312316972,UCLA,Arizona State,4,5,0,0,NA,401172110,2020-01-03,
180,3,6:10,970,970,Lindsey Corsaro made Three Point Jumper. Assisted by Natalie Chou.,44,43,1,18,0.5435760753608833,UCLA,Arizona State,4,5,0,0,NA,401172110,2020-01-03,UCLA
181,3,5:52,952,952,Iris Mbulito missed Layup.,44,43,1,2,0.5440768763980777,UCLA,Arizona State,4,5,0,0,NA,401172110,2020-01-03,
182,3,5:50,950,950,Natalie Chou Defensive Rebound.,44,43,1,0,0.544129523481433,UCLA,Arizona State,4,5,0,0,NA,401172110,2020-01-03,
183,3,5:50,950,950,Foul on Iris Mbulito.,44,43,1,15,0.544129523481433,UCLA,Arizona State,4,5,0,0,NA,401172110,2020-01-03,
184,3,5:35,935,935,Chantel Horvat Turnover.,44,43,1,0,0.5445082378506136,UCLA,Arizona State,4,5,0,0,NA,401172110,2020-01-03,
185,3,5:35,935,935,Ja'Tavia Tapley Steal.,44,43,1,22,0.5445082378506136,UCLA,Arizona State,4,5,0,0,NA,401172110,2020-01-03,
186,3,5:13,913,913,Taya Hanson made Jumper.,44,45,-1,29,0.454977273495301,UCLA,Arizona State,4,5,0,0,NA,401172110,2020-01-03,Arizona State
187,3,4:44,884,884,Michaela Onyenwere missed Jumper.,44,45,-1,3,0.45434105999932367,UCLA,Arizona State,4,5,0,0,NA,401172110,2020-01-03,
188,3,4:41,881,881,Ja'Tavia Tapley Defensive Rebound.,44,45,-1,4,0.45427624740315753,UCLA,Arizona State,4,5,0,0,NA,401172110,2020-01-03,
189,3,4:37,877,877,Foul on Japreece Dean.,44,45,-1,0,0.4541897883512107,UCLA,Arizona State,4,5,0,0,NA,401172110,2020-01-03,
