play_id,period,time_remaining_period,secs_remaining,secs_remaining_absolute,description,home_score,away_score,score_diff,play_length,win_prob,home,away,home_time_out_remaining,away_time_out_remaining,home_timeout_ind,away_timeout_ind,home_favored_by,game_id,date,whichScored
190,3,4:37,877,877,Official TV Timeout,44,45,-1,12,0.4541897883512107,UCLA,Arizona State,4,5,0,0,NA,401172110,2020-01-03,
191,3,4:25,865,865,Foul on Chantel Horvat.,44,45,-1,13,0.45392891067405794,UCLA,Arizona State,4,5,0,0,NA,401172110,2020-01-03,
192,3,4:12,852,852,Ja'Tavia Tapley made Layup. Assisted by Kiara Russell.,44,47,-3,20,0.3640300429325168,UCLA,Arizona State,4,5,0,0,NA,401172110,2020-01-03,Arizona State
193,3,3:52,832,832,Lindsey Corsaro missed Layup.,44,47,-3,4,0.36272824079949506,UCLA,Arizona State,4,5,0,0,NA,401172110,2020-01-03,
194,3,3:48,828,828,Michaela Onyenwere Offensive Rebound.,44,47,-3,0,0.362456107533965,UCLA,Arizona State,4,5,0,0,NA,401172110,2020-01-03,
195,3,3:48,828,828,Michaela Onyenwere made Layup.,46,47,-1,0,0.4530784922319024,UCLA,Arizona State,4,5,0,0,NA,401172110,2020-01-03,UCLA
196,3,3:48,828,828,Foul on Eboni Walker.,46,47,-1,0,0.4530784922319024,UCLA,Arizona State,4,5,0,0,NA,401172110,2020-01-03,
197,3,3:48,828,828,Michaela Onyenwere missed Free Throw.,46,47,-1,1,0.4530784922319024,UCLA,Arizona State,4,5,0,0,NA,401172110,2020-01-03,
198,3,3:47,827,827,Reili Richardson Defensive Rebound.,46,47,-1,18,0.45305391284461793,UCLA,Arizona State,4,5,0,0,NA,401172110,2020-01-03,
199,3,3:29,809,809,Robbi Ryan made Three Point Jumper. Assisted by Kiara Russell.,46,50,-4,22,0.31846542253684457,UCLA,Arizona State,4,5,0,0,NA,401172110,2020-01-03,Arizona State
200,3,3:07,787,787,Japreece Dean made Three Point Jumper. Assisted by Lauryn Miller.,49,50,-1,17,0.4519595206632,UCLA,Arizona State,4,5,0,0,NA,401172110,2020-01-03,UCLA
201,3,2:50,770,770,Foul on Michaela Onyenwere.,49,50,-1,11,0.45141009693184303,UCLA,Arizona State,4,5,0,0,NA,401172110,2020-01-03,
202,3,2:39,759,759,Jamie Ruden missed Jumper.,49,50,-1,5,0.4510208689918862,UCLA,Arizona State,4,5,0,0,NA,401172110,2020-01-03,
203,3,2:34,754,754,Jayde Van Hyfte Offensive Rebound.,49,50,-1,2,0.4508343180247939,UCLA,Arizona State,4,5,0,0,NA,401172110,2020-01-03,
204,3,2:32,752,752,Sara Bejedi missed Three Point Jumper.,49,50,-1,4,0.45075792944845605,UCLA,Arizona State,4,5,0,0,NA,401172110,2020-01-03,
205,3,2:28,748,748,Michaela Onyenwere Defensive Rebound.,49,50,-1,7,0.4506020341242074,UCLA,Arizona State,4,5,0,0,NA,401172110,2020-01-03,
206,3,2:21,741,741,Japreece Dean made Layup. Assisted by Michaela Onyenwere.,51,50,1,24,0.5496811164949055,UCLA,Arizona State,4,5,0,0,NA,401172110,2020-01-03,UCLA
207,3,1:57,717,717,Taya Hanson made Three Point Jumper. Assisted by Iris Mbulito.,51,53,-2,12,0.3996205048315022,UCLA,Arizona State,4,5,0,0,NA,401172110,2020-01-03,Arizona State
208,3,1:45,705,705,Japreece Dean Turnover.,51,53,-2,13,0.3987166292380952,UCLA,Arizona State,4,5,0,0,NA,401172110,2020-01-03,
209,3,1:32,692,692,Sara Bejedi Turnover.,51,53,-2,15,0.39780685432681395,UCLA,Arizona State,4,5,0,0,NA,401172110,2020-01-03,
210,3,1:17,677,677,Michaela Onyenwere made Jumper. Assisted by Japreece Dean.,53,53,0,0,0.5,UCLA,Arizona State,4,5,0,0,NA,401172110,2020-01-03,UCLA
211,3,1:17,677,677,Foul on Eboni Walker.,53,53,0,0,0.5,UCLA,Arizona State,4,5,0,0,NA,401172110,2020-01-03,
212,3,1:17,677,677,Michaela Onyenwere made Free Throw.,54,53,1,16,0.5521527523682312,UCLA,Arizona State,4,5,0,0,NA,401172110,2020-01-03,UCLA
213,3,1:01,661,661,Foul on Lindsey Corsaro.,54,53,1,0,0.5526815889280128,UCLA,Arizona State,4,5,0,0,NA,401172110,2020-01-03,
214,3,1:01,661,661,Ja'Tavia Tapley made Free Throw.,54,54,0,0,0.5,UCLA,Arizona State,4,5,0,0,NA,401172110,2020-01-03,Arizona State
215,3,1:01,661,661,Ja'Tavia Tapley missed Free Throw.,54,54,0,1,0.5,UCLA,Arizona State,4,5,0,0,NA,401172110,2020-01-03,
216,3,1:00,660,660,Lauryn Miller Defensive Rebound.,54,54,0,16,0.5,UCLA,Arizona State,4,5,0,0,NA,401172110,2020-01-03,
217,3,0:44,644,644,Japreece Dean made Jumper.,56,54,2,23,0.6053045257692152,UCLA,Arizona State,4,5,0,0,NA,401172110,2020-01-03,UCLA
218,3,0:21,621,621,Robbi Ryan made Jumper.,56,56,0,13,0.5,UCLA,Arizona State,4,5,0,0,NA,401172110,2020-01-03,Arizona State
219,3,0:08,608,608,Japreece Dean missed Three Point Jumper.,56,56,0,5,0.5,UCLA,Arizona State,4,5,0,0,NA,401172110,2020-01-03,
220,3,0:03,603,603,Reili Richardson Defensive Rebound.,56,56,0,2,0.5,UCLA,Arizona State,4,5,0,0,NA,401172110,2020-01-03,
221,3,0:01,601,601,Reili Richardson missed Three Point Jumper.,56,56,0,1,0.5,UCLA,Arizona State,4,5,0,0,NA,401172110,2020-01-03,
222,3,0:00,600,600,Reili Richardson Offensive Rebound.,56,56,0,0,0.5,UCLA,Arizona State,4,5,0,0,NA,401172110,2020-01-03,
223,3,0:00,600,600,End of 3rd Quarter,56,56,0,18,0.5,UCLA,Arizona State,4,5,0,0,NA,401172110,2020-01-03,
224,4,9:42,582,582,Michaela Onyenwere missed Jumper.,56,56,0,5,0.5,UCLA,Arizona State,5,6,0,0,NA,401172110,2020-01-03,
225,4,9:37,577,577,Lauryn Miller Offensive Rebound.,56,56,0,0,0.5,UCLA,Arizona State,5,6,0,0,NA,401172110,2020-01-03,
226,4,9:37,577,577,Lauryn Miller made Layup.,58,56,2,29,0.6107233890979671,UCLA,Arizona State,5,6,0,0,NA,401172110,2020-01-03,UCLA
227,4,9:08,548,548,Robbi Ryan Turnover.,58,56,2,0,0.6141456814240812,UCLA,Arizona State,5,6,0,0,NA,401172110,2020-01-03,
228,4,9:08,548,548,Lauryn Miller Steal.,58,56,2,5,0.6141456814240812,UCLA,Arizona State,5,6,0,0,NA,401172110,2020-01-03,
229,4,9:03,543,543,Foul on Jayde Van Hyfte.,58,56,2,9,0.6147690364960745,UCLA,Arizona State,5,6,0,0,NA,401172110,2020-01-03,
230,4,8:54,534,534,Michaela Onyenwere missed Jumper.,58,56,2,1,0.6158046364254884,UCLA,Arizona State,5,6,0,0,NA,401172110,2020-01-03,
231,4,8:53,533,533,Lauryn Miller Offensive Rebound.,58,56,2,0,0.6159137801060506,UCLA,Arizona State,5,6,0,0,NA,401172110,2020-01-03,
232,4,8:53,533,533,Lauryn Miller made Layup.,60,56,4,0,0.7200036786200243,UCLA,Arizona State,5,6,0,0,NA,401172110,2020-01-03,UCLA
233,4,8:53,533,533,Foul on Jayde Van Hyfte.,60,56,4,0,0.7200036786200243,UCLA,Arizona State,5,6,0,0,NA,401172110,2020-01-03,
234,4,8:53,533,533,Lauryn Miller missed Free Throw.,60,56,4,2,0.7200036786200243,UCLA,Arizona State,5,6,0,0,NA,401172110,2020-01-03,
235,4,8:51,531,531,Robbi Ryan Defensive Rebound.,60,56,4,20,0.7203703247597191,UCLA,Arizona State,5,6,0,0,NA,401172110,2020-01-03,
236,4,8:31,511,511,Foul on Lauryn Miller.,60,56,4,12,0.7237456508971063,UCLA,Arizona State,5,6,0,0,NA,401172110,2020-01-03,
237,4,8:19,499,499,Kiara Russell missed Jumper.,60,56,4,4,0.7256554013873981,UCLA,Arizona State,5,6,0,0,NA,401172110,2020-01-03,
238,4,8:15,495,495,Eboni Walker Offensive Rebound.,60,56,4,2,0.7262968672654663,UCLA,Arizona State,5,6,0,0,NA,401172110,2020-01-03,
239,4,8:13,493,493,Eboni Walker missed Layup.,60,56,4,1,0.7266207461760726,UCLA,Arizona State,5,6,0,0,NA,401172110,2020-01-03,
240,4,8:12,492,492,Eboni Walker Offensive Rebound.,60,56,4,12,0.7267836874445508,UCLA,Arizona State,5,6,0,0,NA,401172110,2020-01-03,
241,4,8:00,480,480,Reili Richardson missed Jumper.,60,56,4,3,0.7288148874715404,UCLA,Arizona State,5,6,0,0,NA,401172110,2020-01-03,
242,4,7:57,477,477,Arizona State Offensive Rebound.,60,56,4,9,0.7293518527508529,UCLA,Arizona State,5,6,0,0,NA,401172110,2020-01-03,
243,4,7:48,468,468,Foul on Jayde Van Hyfte.,60,56,4,0,0.7310586042487764,UCLA,Arizona State,5,6,0,0,NA,401172110,2020-01-03,
244,4,7:48,468,468,Jayde Van Hyfte Turnover.,60,56,4,12,0.7310586042487764,UCLA,Arizona State,5,6,0,0,NA,401172110,2020-01-03,
245,4,7:36,456,456,Foul on Taya Hanson.,60,56,4,3,0.7336170546716553,UCLA,Arizona State,5,6,0,0,NA,401172110,2020-01-03,
246,4,7:33,453,453,Lauryn Miller Turnover.,60,56,4,0,0.7343175274278637,UCLA,Arizona State,5,6,0,0,NA,401172110,2020-01-03,
247,4,7:33,453,453,Eboni Walker Steal.,60,56,4,7,0.7343175274278637,UCLA,Arizona State,5,6,0,0,NA,401172110,2020-01-03,
248,4,7:26,446,446,Eboni Walker made Layup.,60,58,2,13,0.6254620679063724,UCLA,Arizona State,5,6,0,0,NA,401172110,2020-01-03,Arizona State
249,4,7:13,433,433,Charisma Osborne missed Three Point Jumper.,60,58,2,7,0.6276984814851125,UCLA,Arizona State,5,6,0,0,NA,401172110,2020-01-03,
250,4,7:06,426,426,Iris Mbulito Defensive Rebound.,60,58,2,5,0.6290452079598317,UCLA,Arizona State,5,6,0,0,NA,401172110,2020-01-03,
251,4,7:01,421,421,Iris Mbulito missed Layup.,60,58,2,3,0.6299774633162504,UCLA,Arizona State,5,6,0,0,NA,401172110,2020-01-03,
252,4,6:58,418,418,Ja'Tavia Tapley Offensive Rebound.,60,58,2,3,0.6305222425767422,UCLA,Arizona State,5,6,0,0,NA,401172110,2020-01-03,
253,4,6:55,415,415,Eboni Walker missed Jumper.,60,58,2,6,0.6310576624810864,UCLA,Arizona State,5,6,0,0,NA,401172110,2020-01-03,
254,4,6:49,409,409,Iris Mbulito Offensive Rebound.,60,58,2,0,0.6321055477745573,UCLA,Arizona State,5,6,0,0,NA,401172110,2020-01-03,
255,4,6:49,409,409,Iris Mbulito missed Layup.,60,58,2,2,0.6321055477745573,UCLA,Arizona State,5,6,0,0,NA,401172110,2020-01-03,
256,4,6:47,407,407,Charisma Osborne Defensive Rebound.,60,58,2,1,0.6324494291705011,UCLA,Arizona State,5,6,0,0,NA,401172110,2020-01-03,
257,4,6:46,406,406,Foul on Lauryn Miller.,60,58,2,0,0.6326205671677834,UCLA,Arizona State,5,6,0,0,NA,401172110,2020-01-03,
258,4,6:46,406,406,Lauryn Miller Turnover.,60,58,2,2,0.6326205671677834,UCLA,Arizona State,5,6,0,0,NA,401172110,2020-01-03,
259,4,6:44,404,404,Foul on Ja'Tavia Tapley.,60,58,2,0,0.6329614732173021,UCLA,Arizona State,5,6,0,0,NA,401172110,2020-01-03,
260,4,6:44,404,404,Ja'Tavia Tapley Turnover.,60,58,2,16,0.6329614732173021,UCLA,Arizona State,5,6,0,0,NA,401172110,2020-01-03,
261,4,6:28,388,388,Charisma Osborne missed Three Point Jumper.,60,58,2,5,0.6356657370325778,UCLA,Arizona State,5,6,0,0,NA,401172110,2020-01-03,
262,4,6:23,383,383,Eboni Walker Defensive Rebound.,60,58,2,4,0.6365212285935643,UCLA,Arizona State,5,6,0,0,NA,401172110,2020-01-03,
263,4,6:19,379,379,Iris Mbulito missed Three Point Jumper.,60,58,2,4,0.6372161548664818,UCLA,Arizona State,5,6,0,0,NA,401172110,2020-01-03,
264,4,6:15,375,375,Taya Hanson Offensive Rebound.,60,58,2,14,0.6379236431056533,UCLA,Arizona State,5,6,0,0,NA,401172110,2020-01-03,
265,4,6:01,361,361,Foul on Ja'Tavia Tapley.,60,58,2,0,0.6405411426305286,UCLA,Arizona State,5,6,0,0,NA,401172110,2020-01-03,
266,4,6:01,361,361,Ja'Tavia Tapley Turnover.,60,58,2,18,0.6405411426305286,UCLA,Arizona State,5,6,0,0,NA,401172110,2020-01-03,
267,4,5:43,343,343,Japreece Dean made Three Point Jumper. Assisted by Charisma Osborne.,63,58,5,26,0.8154969719579099,UCLA,Arizona State,5,6,0,0,NA,401172110,2020-01-03,UCLA
268,4,5:17,317,317,Robbi Ryan made Three Point Jumper. Assisted by Kiara Russell.,63,61,2,26,0.6513828149768269,UCLA,Arizona State,5,6,0,0,NA,401172110,2020-01-03,Arizona State
269,4,4:51,291,291,Charisma Osborne Turnover.,63,61,2,0,0.6569001951928126,UCLA,Arizona State,5,6,0,0,NA,401172110,2020-01-03,
270,4,4:51,291,291,Eboni Walker Steal.,63,61,2,23,0.6569001951928126,UCLA,Arizona State,5,6,0,0,NA,401172110,2020-01-03,
271,4,4:28,268,268,Reili Richardson made Layup.,63,63,0,31,0.5,UCLA,Arizona State,5,6,0,0,NA,401172110,2020-01-03,Arizona State
272,4,3:57,237,237,Japreece Dean missed Jumper.,63,63,0,4,0.5,UCLA,Arizona State,5,6,0,0,NA,401172110,2020-01-03,
273,4,3:53,233,233,Ja'Tavia Tapley Defensive Rebound.,63,63,0,17,0.5,UCLA,Arizona State,5,6,0,0,NA,401172110,2020-01-03,
274,4,3:36,216,216,Arizona State  Timeout,63,63,0,13,0.5,UCLA,Arizona State,4,6,1,0,NA,401172110,2020-01-03,
275,4,3:23,203,203,Kiara Russell Turnover.,63,63,0,0,0.5,UCLA,Arizona State,4,6,1,0,NA,401172110,2020-01-03,
276,4,3:23,203,203,Michaela Onyenwere Steal.,63,63,0,5,0.5,UCLA,Arizona State,4,6,1,0,NA,401172110,2020-01-03,
277,4,3:18,198,198,Michaela Onyenwere made Layup.,65,63,2,15,0.6638190777825296,UCLA,Arizona State,4,6,1,0,NA,401172110,2020-01-03,UCLA
278,4,3:03,183,183,Foul on Charisma Osborne.,65,63,2,0,0.6767470652547874,UCLA,Arizona State,4,6,1,0,NA,401172110,2020-01-03,
279,4,3:03,183,183,Official TV Timeout,65,63,2,19,0.6767470652547874,UCLA,Arizona State,4,6,1,0,NA,401172110,2020-01-03,
280,4,2:44,164,164,Robbi Ryan missed Jumper.,65,63,2,3,0.6945293753945777,UCLA,Arizona State,4,6,1,0,NA,401172110,2020-01-03,
281,4,2:41,161,161,Kiara Russell Offensive Rebound.,65,63,2,15,0.697441582179661,UCLA,Arizona State,4,6,1,0,NA,401172110,2020-01-03,
282,4,2:26,146,146,Kiara Russell made Jumper. Assisted by Robbi Ryan.,65,65,0,27,0.5,UCLA,Arizona State,4,6,0,0,NA,401172110,2020-01-03,Arizona State
283,4,1:59,119,119,Japreece Dean made Three Point Jumper. Assisted by Charisma Osborne.,68,65,3,0,0.8325199589119695,UCLA,Arizona State,4,6,0,1,NA,401172110,2020-01-03,UCLA
284,4,1:59,119,119,UCLA  Timeout,68,65,3,16,0.8325199589119695,UCLA,Arizona State,4,5,0,1,NA,401172110,2020-01-03,
285,4,1:43,103,103,Robbi Ryan missed Jumper.,68,65,3,2,0.8559195714926925,UCLA,Arizona State,4,5,0,1,NA,401172110,2020-01-03,
286,4,1:41,101,101,Kiara Russell Offensive Rebound.,68,65,3,0,0.858920194103822,UCLA,Arizona State,4,5,0,1,NA,401172110,2020-01-03,
287,4,1:41,101,101,Foul on Michaela Onyenwere.,68,65,3,19,0.858920194103822,UCLA,Arizona State,4,5,0,1,NA,401172110,2020-01-03,
288,4,1:22,82,82,Robbi Ryan missed Jumper.,68,65,3,2,0.8868531364565443,UCLA,Arizona State,4,5,0,1,NA,401172110,2020-01-03,
289,4,1:20,80,80,Kiara Russell Offensive Rebound.,68,65,3,0,0.889636422761292,UCLA,Arizona State,4,5,0,1,NA,401172110,2020-01-03,
290,4,1:20,80,80,Foul on Lauryn Miller.,68,65,3,0,0.889636422761292,UCLA,Arizona State,4,5,0,1,NA,401172110,2020-01-03,
291,4,1:20,80,80,Kiara Russell missed Free Throw.,68,65,3,0,0.889636422761292,UCLA,Arizona State,4,5,0,1,NA,401172110,2020-01-03,
292,4,1:20,80,80,Arizona State Offensive Rebound.,68,65,3,0,0.889636422761292,UCLA,Arizona State,4,5,0,1,NA,401172110,2020-01-03,
293,4,1:20,80,80,Kiara Russell made Free Throw.,68,66,2,17,0.8008084946039894,UCLA,Arizona State,4,5,0,1,NA,401172110,2020-01-03,Arizona State
294,4,1:03,63,63,UCLA  Timeout,68,66,2,13,0.8265976357461318,UCLA,Arizona State,4,4,0,1,NA,401172110,2020-01-03,
295,4,0:50,50,50,Japreece Dean missed Three Point Jumper.,68,66,2,4,0.8459567642953214,UCLA,Arizona State,4,4,0,1,NA,401172110,2020-01-03,
296,4,0:46,46,46,Ja'Tavia Tapley Defensive Rebound.,68,66,2,21,0.8518188381895048,UCLA,Arizona State,4,4,0,1,NA,401172110,2020-01-03,
297,4,0:25,25,25,Kiara Russell missed Jumper.,68,66,2,4,0.8814499561627452,UCLA,Arizona State,4,4,0,1,NA,401172110,2020-01-03,
298,4,0:21,21,21,Jayde Van Hyfte Offensive Rebound.,68,66,2,1,0.8867491291822237,UCLA,Arizona State,4,4,0,1,NA,401172110,2020-01-03,
299,4,0:20,20,20,Jayde Van Hyfte missed Layup.,68,66,2,0,0.8880646474908184,UCLA,Arizona State,4,4,1,1,NA,401172110,2020-01-03,
300,4,0:20,20,20,Arizona State  Timeout,68,66,2,1,0.8880646474908184,UCLA,Arizona State,3,4,1,1,NA,401172110,2020-01-03,
301,4,0:19,19,19,Arizona State Offensive Rebound.,68,66,2,4,0.88937692447449,UCLA,Arizona State,3,4,1,1,NA,401172110,2020-01-03,
302,4,0:15,15,15,Reili Richardson missed Jumper.,68,66,2,3,0.8945836042239772,UCLA,Arizona State,3,4,1,1,NA,401172110,2020-01-03,
303,4,0:12,12,12,Reili Richardson Offensive Rebound.,68,66,2,3,0.8984309706555195,UCLA,Arizona State,3,4,1,1,NA,401172110,2020-01-03,
304,4,0:09,9,9,Reili Richardson missed Three Point Jumper.,68,66,2,6,0.9022161211088555,UCLA,Arizona State,3,4,1,1,NA,401172110,2020-01-03,
305,4,0:03,3,3,Jayde Van Hyfte Offensive Rebound.,68,66,2,1,0.9095600412345216,UCLA,Arizona State,3,4,1,1,NA,401172110,2020-01-03,
306,4,0:02,2,2,Jayde Van Hyfte missed Layup.,68,66,2,2,0.910750940927652,UCLA,Arizona State,3,4,1,0,NA,401172110,2020-01-03,
307,4,0:00,0,0,Jayde Van Hyfte Offensive Rebound.,68,66,2,0,1,UCLA,Arizona State,3,4,1,0,NA,401172110,2020-01-03,
308,4,0:00,0,0,End of 4th Quarter,68,66,2,0,1,UCLA,Arizona State,3,4,1,0,NA,401172110,2020-01-03,
309,4,0:00,0,0,End of Game,68,66,2,0,1,UCLA,Arizona State,3,4,1,0,NA,401172110,2020-01-03,
