play_id,period,time_remaining_period,secs_remaining,secs_remaining_absolute,description,home_score,away_score,score_diff,play_length,win_prob,home,away,home_time_out_remaining,away_time_out_remaining,home_timeout_ind,away_timeout_ind,home_favored_by,game_id,date,whichScored
198,3,8:45,1125,1125,Ashiala Jackson made Jumper.,52,33,19,23,0.9545821205574373,UAB,Tuskegee,5,5,0,0,NA,401177720,2019-12-30,Tuskegee
199,3,8:22,1102,1102,Trista Magee missed Three Point Jumper.,52,33,19,0,0.956077427599845,UAB,Tuskegee,5,5,0,0,NA,401177720,2019-12-30,
200,3,8:22,1102,1102,UAB Offensive Rebound.,52,33,19,5,0.956077427599845,UAB,Tuskegee,5,5,0,0,NA,401177720,2019-12-30,
201,3,8:17,1097,1097,Rachael Childress made Three Point Jumper. Assisted by Angela Vendrell.,55,33,22,15,0.9727676683342531,UAB,Tuskegee,5,5,0,0,NA,401177720,2019-12-30,UAB
202,3,8:02,1082,1082,Normesha Pitts made Layup.,55,35,20,12,0.9635768430940815,UAB,Tuskegee,5,5,0,0,NA,401177720,2019-12-30,Tuskegee
203,3,7:50,1070,1070,Sam Mitchell missed Three Point Jumper.,55,35,20,0,0.96428301196965,UAB,Tuskegee,5,5,0,0,NA,401177720,2019-12-30,
204,3,7:50,1070,1070,Angela Vendrell Offensive Rebound.,55,35,20,7,0.96428301196965,UAB,Tuskegee,5,5,0,0,NA,401177720,2019-12-30,
205,3,7:43,1063,1063,Rachael Childress made Three Point Jumper. Assisted by Sam Mitchell.,58,35,23,6,0.9782047447981279,UAB,Tuskegee,5,5,0,0,NA,401177720,2019-12-30,UAB
206,3,7:37,1057,1057,Tuskegee  Timeout,58,35,23,0,0.978461282826728,UAB,Tuskegee,5,4,0,1,NA,401177720,2019-12-30,
207,3,7:37,1057,1057,Official TV Timeout,58,35,23,9,0.978461282826728,UAB,Tuskegee,5,4,0,1,NA,401177720,2019-12-30,
208,3,7:28,1048,1048,Breanna Stephens missed Three Point Jumper.,58,35,23,0,0.9788478082977728,UAB,Tuskegee,5,4,0,1,NA,401177720,2019-12-30,
209,3,7:28,1048,1048,Teja Finley Offensive Rebound.,58,35,23,12,0.9788478082977728,UAB,Tuskegee,5,4,0,1,NA,401177720,2019-12-30,
210,3,7:16,1036,1036,Ashiala Jackson made Jumper. Assisted by India Blakely.,58,37,21,16,0.9713733796796544,UAB,Tuskegee,5,4,0,1,NA,401177720,2019-12-30,Tuskegee
211,3,7:00,1020,1020,Foul on Teja Finley.,58,37,21,0,0.9722566867291085,UAB,Tuskegee,5,4,0,1,NA,401177720,2019-12-30,
212,3,7:00,1020,1020,Katelynn Thomas missed Free Throw.,58,37,21,0,0.9722566867291085,UAB,Tuskegee,5,4,0,1,NA,401177720,2019-12-30,
213,3,7:00,1020,1020,UAB Deadball Team Rebound.,58,37,21,0,0.9722566867291085,UAB,Tuskegee,5,4,0,1,NA,401177720,2019-12-30,
214,3,7:00,1020,1020,Katelynn Thomas made Free Throw.,59,37,22,7,0.976477357575328,UAB,Tuskegee,5,4,0,1,NA,401177720,2019-12-30,UAB
215,3,6:53,1013,1013,India Blakely Turnover.,59,37,22,0,0.9768271574315215,UAB,Tuskegee,5,4,0,1,NA,401177720,2019-12-30,
216,3,6:53,1013,1013,Trista Magee Steal.,59,37,22,0,0.9768271574315215,UAB,Tuskegee,5,4,0,1,NA,401177720,2019-12-30,
217,3,6:53,1013,1013,Foul on Breanna Stephens.,59,37,22,9,0.9768271574315215,UAB,Tuskegee,5,4,0,1,NA,401177720,2019-12-30,
218,3,6:44,1004,1004,Rachael Childress made Jumper.,61,37,24,13,0.9837545223628487,UAB,Tuskegee,5,4,0,1,NA,401177720,2019-12-30,UAB
219,3,6:31,991,991,India Blakely made Jumper.,61,39,22,15,0.9779478049332508,UAB,Tuskegee,5,4,0,0,NA,401177720,2019-12-30,Tuskegee
220,3,6:16,976,976,Foul on Katelynn Thomas.,61,39,22,0,0.9787317871184278,UAB,Tuskegee,5,4,0,0,NA,401177720,2019-12-30,
221,3,6:16,976,976,Katelynn Thomas Turnover.,61,39,22,23,0.9787317871184278,UAB,Tuskegee,5,4,0,0,NA,401177720,2019-12-30,
222,3,5:53,953,953,India Blakely missed Layup.,61,39,22,0,0.9798955854410956,UAB,Tuskegee,5,4,0,0,NA,401177720,2019-12-30,
223,3,5:53,953,953,Zakyia Weathersby Defensive Rebound.,61,39,22,12,0.9798955854410956,UAB,Tuskegee,5,4,0,0,NA,401177720,2019-12-30,
224,3,5:41,941,941,Trista Magee missed Layup.,61,39,22,0,0.9804295196865905,UAB,Tuskegee,5,4,0,0,NA,401177720,2019-12-30,
225,3,5:41,941,941,Zakyia Weathersby Offensive Rebound.,61,39,22,4,0.9804295196865905,UAB,Tuskegee,5,4,0,0,NA,401177720,2019-12-30,
226,3,5:37,937,937,Zakyia Weathersby made Jumper.,63,39,24,24,0.986338137216643,UAB,Tuskegee,5,4,0,0,NA,401177720,2019-12-30,UAB
227,3,5:13,913,913,Teja Finley missed Jumper.,63,39,24,0,0.9870537789062744,UAB,Tuskegee,5,4,0,0,NA,401177720,2019-12-30,
228,3,5:13,913,913,Rachael Childress Defensive Rebound.,63,39,24,18,0.9870537789062744,UAB,Tuskegee,5,4,0,0,NA,401177720,2019-12-30,
229,3,4:55,895,895,Angela Vendrell made Jumper.,65,39,26,15,0.9913095435828108,UAB,Tuskegee,5,4,0,0,NA,401177720,2019-12-30,UAB
230,3,4:40,880,880,India Blakely missed Jumper.,65,39,26,0,0.9915980893706294,UAB,Tuskegee,5,4,0,0,NA,401177720,2019-12-30,
231,3,4:40,880,880,Angela Vendrell Defensive Rebound.,65,39,26,26,0.9915980893706294,UAB,Tuskegee,5,4,0,0,NA,401177720,2019-12-30,
232,3,4:14,854,854,Foul on Teja Finley.,65,39,26,0,0.9920810981841662,UAB,Tuskegee,5,4,0,0,NA,401177720,2019-12-30,
233,3,4:14,854,854,Official TV Timeout,65,39,26,0,0.9920810981841662,UAB,Tuskegee,5,4,0,0,NA,401177720,2019-12-30,
234,3,4:14,854,854,Zakyia Weathersby missed Free Throw.,65,39,26,0,0.9920810981841662,UAB,Tuskegee,5,4,0,0,NA,401177720,2019-12-30,
235,3,4:14,854,854,UAB Deadball Team Rebound.,65,39,26,0,0.9920810981841662,UAB,Tuskegee,5,4,0,0,NA,401177720,2019-12-30,
236,3,4:14,854,854,Zakyia Weathersby made Free Throw.,66,39,27,14,0.9934149255973296,UAB,Tuskegee,5,4,0,0,NA,401177720,2019-12-30,UAB
237,3,4:00,840,840,Lena Yoonis missed Layup.,66,39,27,0,0.9936390470961037,UAB,Tuskegee,5,4,0,0,NA,401177720,2019-12-30,
238,3,4:00,840,840,Zakyia Weathersby Defensive Rebound.,66,39,27,15,0.9936390470961037,UAB,Tuskegee,5,4,0,0,NA,401177720,2019-12-30,
239,3,3:45,825,825,Zakyia Weathersby made Jumper. Assisted by Audrey Jordan.,68,39,29,0,0.9957965025962092,UAB,Tuskegee,5,4,0,0,NA,401177720,2019-12-30,UAB
240,3,3:45,825,825,Foul on Christina Massey.,68,39,29,0,0.9957965025962092,UAB,Tuskegee,5,4,0,0,NA,401177720,2019-12-30,
241,3,3:45,825,825,Zakyia Weathersby made Free Throw.,69,39,30,24,0.9965162802371312,UAB,Tuskegee,5,4,0,0,NA,401177720,2019-12-30,UAB
242,3,3:21,801,801,India Blakely made Jumper.,69,41,28,25,0.9952777125693698,UAB,Tuskegee,5,4,0,0,NA,401177720,2019-12-30,Tuskegee
243,3,2:56,776,776,Zakyia Weathersby made Layup. Assisted by Lea Kerstein.,71,41,30,12,0.9970556754993861,UAB,Tuskegee,5,4,0,0,NA,401177720,2019-12-30,UAB
244,3,2:44,764,764,India Blakely missed Jumper.,71,41,30,0,0.9971977975596465,UAB,Tuskegee,5,4,0,0,NA,401177720,2019-12-30,
245,3,2:44,764,764,Christina Massey Offensive Rebound.,71,41,30,3,0.9971977975596465,UAB,Tuskegee,5,4,0,0,NA,401177720,2019-12-30,
246,3,2:41,761,761,Christina Massey made Jumper.,71,43,28,17,0.9959098202519792,UAB,Tuskegee,5,4,0,0,NA,401177720,2019-12-30,Tuskegee
247,3,2:24,744,744,Audrey Jordan made Layup.,73,43,30,0,0.9974435218085607,UAB,Tuskegee,5,4,0,0,NA,401177720,2019-12-30,UAB
248,3,2:24,744,744,Foul on Sharai Lay.,73,43,30,0,0.9974435218085607,UAB,Tuskegee,5,4,0,0,NA,401177720,2019-12-30,
249,3,2:24,744,744,Audrey Jordan missed Free Throw.,73,43,30,0,0.9974435218085607,UAB,Tuskegee,5,4,0,0,NA,401177720,2019-12-30,
250,3,2:24,744,744,Lea Kerstein Offensive Rebound.,73,43,30,12,0.9974435218085607,UAB,Tuskegee,5,4,0,0,NA,401177720,2019-12-30,
251,3,2:12,732,732,Sam Mitchell Turnover.,73,43,30,2,0.9975956133947309,UAB,Tuskegee,5,4,0,0,NA,401177720,2019-12-30,
252,3,2:10,730,730,Christina Massey Steal.,73,43,30,4,0.9976212464050119,UAB,Tuskegee,5,4,0,0,NA,401177720,2019-12-30,
253,3,2:06,726,726,Foul on Lea Kerstein.,73,43,30,0,0.9976712504874998,UAB,Tuskegee,5,4,0,1,NA,401177720,2019-12-30,
254,3,2:06,726,726,Morgan Kirk made Free Throw.,73,44,29,0,0.9971514407104081,UAB,Tuskegee,5,4,0,1,NA,401177720,2019-12-30,Tuskegee
255,3,2:06,726,726,Morgan Kirk made Free Throw.,73,45,28,0,0.9965160072378396,UAB,Tuskegee,5,4,0,1,NA,401177720,2019-12-30,Tuskegee
256,3,2:06,726,726,Tuskegee  Timeout,73,45,28,17,0.9965160072378396,UAB,Tuskegee,5,3,0,1,NA,401177720,2019-12-30,
257,3,1:49,709,709,Audrey Jordan Turnover.,73,45,28,1,0.9967772053643611,UAB,Tuskegee,5,3,0,1,NA,401177720,2019-12-30,
258,3,1:48,708,708,India Blakely Steal.,73,45,28,5,0.9967910649386873,UAB,Tuskegee,5,3,0,1,NA,401177720,2019-12-30,
259,3,1:43,703,703,India Blakely missed Layup.,73,45,28,0,0.9968582591340306,UAB,Tuskegee,5,3,0,1,NA,401177720,2019-12-30,
260,3,1:43,703,703,Lea Kerstein Defensive Rebound.,73,45,28,21,0.9968582591340306,UAB,Tuskegee,5,3,0,1,NA,401177720,2019-12-30,
261,3,1:22,682,682,Lea Kerstein missed Three Point Jumper.,73,45,28,0,0.9971095102868995,UAB,Tuskegee,5,3,0,1,NA,401177720,2019-12-30,
262,3,1:22,682,682,Zakyia Weathersby Offensive Rebound.,73,45,28,0,0.9971095102868995,UAB,Tuskegee,5,3,0,1,NA,401177720,2019-12-30,
263,3,1:22,682,682,Foul on Normesha Pitts.,73,45,28,0,0.9971095102868995,UAB,Tuskegee,5,3,0,1,NA,401177720,2019-12-30,
264,3,1:22,682,682,Zakyia Weathersby made Free Throw.,74,45,29,0,0.9976526748770145,UAB,Tuskegee,5,3,0,1,NA,401177720,2019-12-30,UAB
265,3,1:22,682,682,Zakyia Weathersby made Free Throw.,75,45,30,26,0.9980939661383412,UAB,Tuskegee,5,3,0,1,NA,401177720,2019-12-30,UAB
266,3,0:56,656,656,Foul on Lea Kerstein.,75,45,30,0,0.9982828877900639,UAB,Tuskegee,5,3,0,0,NA,401177720,2019-12-30,
267,3,0:56,656,656,Normesha Pitts made Free Throw.,75,46,29,0,0.997877875097799,UAB,Tuskegee,5,3,0,0,NA,401177720,2019-12-30,Tuskegee
268,3,0:56,656,656,Normesha Pitts made Free Throw.,75,47,28,27,0.9973775836164006,UAB,Tuskegee,5,3,0,0,NA,401177720,2019-12-30,Tuskegee
269,3,0:29,629,629,Sam Mitchell Turnover.,75,47,28,1,0.9976391158496987,UAB,Tuskegee,5,3,0,0,NA,401177720,2019-12-30,
270,3,0:28,628,628,Normesha Pitts Steal.,75,47,28,7,0.9976488326970278,UAB,Tuskegee,5,3,0,0,NA,401177720,2019-12-30,
271,3,0:21,621,621,Christina Massey missed Jumper.,75,47,28,0,0.9977172642958734,UAB,Tuskegee,5,3,0,0,NA,401177720,2019-12-30,
272,3,0:21,621,621,Audrey Jordan Defensive Rebound.,75,47,28,9,0.9977172642958734,UAB,Tuskegee,5,3,0,0,NA,401177720,2019-12-30,
273,3,0:12,612,612,Foul on Morgan Kirk.,75,47,28,0,0.9978066498731237,UAB,Tuskegee,5,3,0,0,NA,401177720,2019-12-30,
274,3,0:12,612,612,Sam Mitchell made Free Throw.,76,47,29,0,0.9982365276474423,UAB,Tuskegee,5,3,0,0,NA,401177720,2019-12-30,UAB
275,3,0:12,612,612,Sam Mitchell made Free Throw.,77,47,30,5,0.9985822727819534,UAB,Tuskegee,5,3,0,0,NA,401177720,2019-12-30,UAB
276,3,0:07,607,607,Morgan Kirk missed Three Point Jumper.,77,47,30,0,0.998617252301935,UAB,Tuskegee,5,3,0,0,NA,401177720,2019-12-30,
277,3,0:07,607,607,Zakyia Weathersby Defensive Rebound.,77,47,30,7,0.998617252301935,UAB,Tuskegee,5,3,0,0,NA,401177720,2019-12-30,
278,3,0:00,600,600,End of 3rd Quarter,77,47,30,8,0.9986669382797198,UAB,Tuskegee,5,3,0,0,NA,401177720,2019-12-30,
279,4,9:52,592,592,Morgan Kirk made Three Point Jumper. Assisted by India Blakely.,77,50,27,23,0.9975201146714879,UAB,Tuskegee,6,4,0,0,NA,401177720,2019-12-30,Tuskegee
280,4,9:29,569,569,Katelynn Thomas missed Jumper.,77,50,27,0,0.997825036391035,UAB,Tuskegee,6,4,0,0,NA,401177720,2019-12-30,
281,4,9:29,569,569,Teja Finley Block.,77,50,27,2,0.997825036391035,UAB,Tuskegee,6,4,0,0,NA,401177720,2019-12-30,
282,4,9:27,567,567,Sharai Lay Defensive Rebound.,77,50,27,9,0.9978525408956196,UAB,Tuskegee,6,4,0,0,NA,401177720,2019-12-30,
283,4,9:18,558,558,Teja Finley missed Jumper.,77,50,27,0,0.9979780302044541,UAB,Tuskegee,6,4,0,0,NA,401177720,2019-12-30,
284,4,9:18,558,558,Teja Finley Offensive Rebound.,77,50,27,4,0.9979780302044541,UAB,Tuskegee,6,4,0,0,NA,401177720,2019-12-30,
285,4,9:14,554,554,Morgan Kirk missed Three Point Jumper.,77,50,27,0,0.9980346167019883,UAB,Tuskegee,6,4,0,0,NA,401177720,2019-12-30,
286,4,9:14,554,554,India Blakely Offensive Rebound.,77,50,27,21,0.9980346167019883,UAB,Tuskegee,6,4,0,0,NA,401177720,2019-12-30,
287,4,8:53,533,533,Sharai Lay made Jumper.,77,52,25,17,0.9972761981031407,UAB,Tuskegee,6,4,0,0,NA,401177720,2019-12-30,Tuskegee
288,4,8:36,516,516,Rachael Childress Turnover.,77,52,25,20,0.9975131731643045,UAB,Tuskegee,6,4,0,0,NA,401177720,2019-12-30,
289,4,8:16,496,496,India Blakely missed Jumper.,77,52,25,0,0.9977496227623821,UAB,Tuskegee,6,4,0,0,NA,401177720,2019-12-30,
290,4,8:16,496,496,Trista Magee Defensive Rebound.,77,52,25,15,0.9977496227623821,UAB,Tuskegee,6,4,0,0,NA,401177720,2019-12-30,
291,4,8:01,481,481,Rachael Childress made Three Point Jumper. Assisted by Miyah Barnes.,80,52,28,22,0.9990073073270075,UAB,Tuskegee,6,4,0,0,NA,401177720,2019-12-30,UAB
292,4,7:39,459,459,Normesha Pitts missed Jumper.,80,52,28,0,0.9991481274396576,UAB,Tuskegee,6,4,0,0,NA,401177720,2019-12-30,
293,4,7:39,459,459,Angela Vendrell Defensive Rebound.,80,52,28,10,0.9991481274396576,UAB,Tuskegee,6,4,0,0,NA,401177720,2019-12-30,
294,4,7:29,449,449,Foul on Sharai Lay.,80,52,28,4,0.9992169785338544,UAB,Tuskegee,6,4,0,0,NA,401177720,2019-12-30,
295,4,7:25,445,445,Rachael Childress made Three Point Jumper. Assisted by Angela Vendrell.,83,52,31,25,0.9996505608340347,UAB,Tuskegee,6,4,0,0,NA,401177720,2019-12-30,UAB
296,4,7:00,420,420,India Blakely Turnover.,83,52,31,1,0.999741411114776,UAB,Tuskegee,6,4,0,0,NA,401177720,2019-12-30,
297,4,6:59,419,419,Miyah Barnes Steal.,83,52,31,8,0.9997445146127274,UAB,Tuskegee,6,4,0,0,NA,401177720,2019-12-30,
298,4,6:51,411,411,Trista Magee missed Three Point Jumper.,83,52,31,0,0.999767515603597,UAB,Tuskegee,6,4,0,0,NA,401177720,2019-12-30,
299,4,6:51,411,411,Angela Vendrell Offensive Rebound.,83,52,31,6,0.999767515603597,UAB,Tuskegee,6,4,0,0,NA,401177720,2019-12-30,
300,4,6:45,405,405,Foul on Morgan Kirk.,83,52,31,0,0.9997829694610683,UAB,Tuskegee,6,4,0,0,NA,401177720,2019-12-30,
301,4,6:45,405,405,Foul on Teja Finley.,83,52,31,12,0.9997829694610683,UAB,Tuskegee,6,4,0,0,NA,401177720,2019-12-30,
302,4,6:33,393,393,Katelynn Thomas made Jumper. Assisted by Angela Vendrell.,85,52,33,14,0.9998909566103276,UAB,Tuskegee,6,4,0,0,NA,401177720,2019-12-30,UAB
303,4,6:19,379,379,Normesha Pitts missed Three Point Jumper.,85,52,33,0,0.9999080780456825,UAB,Tuskegee,6,4,0,0,NA,401177720,2019-12-30,
304,4,6:19,379,379,Trista Magee Defensive Rebound.,85,52,33,15,0.9999080780456825,UAB,Tuskegee,6,4,0,0,NA,401177720,2019-12-30,
305,4,6:04,364,364,Katelynn Thomas made Layup. Assisted by Trista Magee.,87,52,35,18,0.9999574879823665,UAB,Tuskegee,6,4,0,0,NA,401177720,2019-12-30,UAB
306,4,5:46,346,346,Ashiala Jackson missed Jumper.,87,52,35,0,0.9999680209979649,UAB,Tuskegee,6,4,0,0,NA,401177720,2019-12-30,
307,4,5:46,346,346,Katelynn Thomas Block.,87,52,35,2,0.9999680209979649,UAB,Tuskegee,6,4,0,0,NA,401177720,2019-12-30,
308,4,5:44,344,344,Angela Vendrell Defensive Rebound.,87,52,35,13,0.9999691156601543,UAB,Tuskegee,6,4,0,0,NA,401177720,2019-12-30,
309,4,5:31,331,331,Miyah Barnes made Three Point Jumper. Assisted by Trista Magee.,90,52,38,20,0.9999902888568353,UAB,Tuskegee,6,4,0,0,NA,401177720,2019-12-30,UAB
310,4,5:11,311,311,Breanna Stephens missed Three Point Jumper.,90,52,38,0,0.9999940887377664,UAB,Tuskegee,6,4,0,0,NA,401177720,2019-12-30,
311,4,5:11,311,311,Angela Vendrell Defensive Rebound.,90,52,38,25,0.9999940887377664,UAB,Tuskegee,6,4,0,0,NA,401177720,2019-12-30,
312,4,4:46,286,286,Trista Magee made Jumper.,92,52,40,3,0.9999977222768784,UAB,Tuskegee,6,4,0,0,NA,401177720,2019-12-30,UAB
313,4,4:43,283,283,Official TV Timeout,92,52,40,21,0.9999977004842752,UAB,Tuskegee,6,4,0,0,NA,401177720,2019-12-30,
314,4,4:22,262,262,Foul on Katelynn Thomas.,92,52,40,0,0.9999971805549772,UAB,Tuskegee,6,4,0,0,NA,401177720,2019-12-30,
315,4,4:22,262,262,Ashiala Jackson made Free Throw.,92,53,39,0,0.9999961193091352,UAB,Tuskegee,6,4,0,0,NA,401177720,2019-12-30,Tuskegee
316,4,4:22,262,262,Ashiala Jackson made Free Throw.,92,54,38,12,0.9999946586099566,UAB,Tuskegee,6,4,0,0,NA,401177720,2019-12-30,Tuskegee
317,4,4:10,250,250,Margaret Whitley missed Three Point Jumper.,92,54,38,0,0.9999939161049484,UAB,Tuskegee,6,4,0,0,NA,401177720,2019-12-30,
318,4,4:10,250,250,Tamia Willingham-King Defensive Rebound.,92,54,38,9,0.9999939161049484,UAB,Tuskegee,6,4,0,0,NA,401177720,2019-12-30,
319,4,4:01,241,241,Tamia Willingham-King missed Jumper.,92,54,38,0,0.9999935349266097,UAB,Tuskegee,6,4,0,0,NA,401177720,2019-12-30,
320,4,4:01,241,241,Morgan Kirk Offensive Rebound.,92,54,38,8,0.9999935349266097,UAB,Tuskegee,6,4,0,0,NA,401177720,2019-12-30,
321,4,3:53,233,233,Ashiala Jackson Turnover.,92,54,38,2,0.9999935053338186,UAB,Tuskegee,6,4,0,0,NA,401177720,2019-12-30,
322,4,3:51,231,231,Margaret Whitley Steal.,92,54,38,18,0.9999935592741298,UAB,Tuskegee,6,4,0,0,NA,401177720,2019-12-30,
323,4,3:33,213,213,Zakyia Weathersby made Jumper. Assisted by Lea Kerstein.,94,54,40,11,0.9999975077593228,UAB,Tuskegee,6,4,0,0,NA,401177720,2019-12-30,UAB
324,4,3:22,202,202,Morgan Kirk Turnover.,94,54,40,22,0.9999984426146777,UAB,Tuskegee,6,4,0,0,NA,401177720,2019-12-30,
325,4,3:00,180,180,Margaret Whitley made Jumper.,96,54,42,0,0.9999998600119874,UAB,Tuskegee,6,4,0,0,NA,401177720,2019-12-30,UAB
326,4,3:00,180,180,Foul on India Blakely.,96,54,42,0,0.9999998600119874,UAB,Tuskegee,6,4,0,0,NA,401177720,2019-12-30,
327,4,3:00,180,180,Margaret Whitley made Free Throw.,97,54,43,16,0.9999999038603459,UAB,Tuskegee,6,4,0,0,NA,401177720,2019-12-30,UAB
328,4,2:44,164,164,Tamia Willingham-King missed Three Point Jumper.,97,54,43,0,0.9999999785960012,UAB,Tuskegee,6,4,0,0,NA,401177720,2019-12-30,
329,4,2:44,164,164,Ashiala Jackson Offensive Rebound.,97,54,43,5,0.9999999785960012,UAB,Tuskegee,6,4,0,0,NA,401177720,2019-12-30,
330,4,2:39,159,159,Ashiala Jackson made Layup.,97,56,41,12,0.9999999696862389,UAB,Tuskegee,6,4,0,0,NA,401177720,2019-12-30,Tuskegee
331,4,2:27,147,147,Lea Kerstein Turnover.,97,56,41,2,0.9999999909525974,UAB,Tuskegee,6,4,0,0,NA,401177720,2019-12-30,
332,4,2:25,145,145,India Blakely Steal.,97,56,41,5,0.9999999926909968,UAB,Tuskegee,6,4,0,0,NA,401177720,2019-12-30,
333,4,2:20,140,140,India Blakely Turnover.,97,56,41,9,0.9999999957852483,UAB,Tuskegee,6,4,0,0,NA,401177720,2019-12-30,
334,4,2:11,131,131,Margaret Whitley Turnover.,97,56,41,12,0.9999999985388279,UAB,Tuskegee,6,4,0,0,NA,401177720,2019-12-30,
335,4,1:59,119,119,Tamia Willingham-King Turnover.,97,56,41,2,0.99999999969654,UAB,Tuskegee,6,4,0,0,NA,401177720,2019-12-30,
336,4,1:57,117,117,Zakyia Weathersby Steal.,97,56,41,17,0.9999999997710759,UAB,Tuskegee,6,4,0,0,NA,401177720,2019-12-30,
337,4,1:40,100,100,Foul on Morgan Kirk.,97,56,41,0,0.9999999999839818,UAB,Tuskegee,6,4,0,0,NA,401177720,2019-12-30,
338,4,1:40,100,100,Margaret Whitley made Free Throw.,98,56,42,0,0.999999999991264,UAB,Tuskegee,6,4,0,0,NA,401177720,2019-12-30,UAB
339,4,1:40,100,100,Margaret Whitley made Free Throw.,99,56,43,12,0.9999999999952356,UAB,Tuskegee,6,4,0,0,NA,401177720,2019-12-30,UAB
340,4,1:28,88,88,Sharai Lay missed Jumper.,99,56,43,0,0.9999999999995048,UAB,Tuskegee,6,4,0,0,NA,401177720,2019-12-30,
341,4,1:28,88,88,Lea Kerstein Defensive Rebound.,99,56,43,25,0.9999999999995048,UAB,Tuskegee,6,4,0,0,NA,401177720,2019-12-30,
342,4,1:03,63,63,Zakyia Weathersby made Jumper. Assisted by Lea Kerstein.,101,56,45,14,0.9999999999999994,UAB,Tuskegee,6,4,0,0,NA,401177720,2019-12-30,UAB
343,4,0:49,49,49,Tamia Willingham-King made Jumper.,101,58,43,27,0.9999999999999998,UAB,Tuskegee,6,4,0,0,NA,401177720,2019-12-30,Tuskegee
344,4,0:22,22,22,Zakyia Weathersby made Jumper.,103,58,45,22,1,UAB,Tuskegee,6,4,0,0,NA,401177720,2019-12-30,UAB
345,4,0:00,0,0,Ashiala Jackson made Jumper. Assisted by Tamia Willingham-King.,103,60,43,0,1,UAB,Tuskegee,6,4,0,0,NA,401177720,2019-12-30,Tuskegee
346,4,0:00,0,0,End of Game,103,60,43,0,1,UAB,Tuskegee,6,4,0,0,NA,401177720,2019-12-30,
