play_id,period,time_remaining_period,secs_remaining,secs_remaining_absolute,description,home_score,away_score,score_diff,play_length,win_prob,home,away,home_time_out_remaining,away_time_out_remaining,home_timeout_ind,away_timeout_ind,home_favored_by,game_id,date,whichScored
1,1,10:00,2400,2400,Jump Ball won by Connecticut,0,0,0,9,0.5,UCLA,UConn,4,4,0,0,NA,400994360,2017-11-21,NA
2,1,9:51,2391,2391,Kia Nurse missed Three Point Jumper.,0,0,0,0,0.5,UCLA,UConn,4,4,0,0,NA,400994360,2017-11-21,
3,1,9:51,2391,2391,Monique Billings Defensive Rebound.,0,0,0,15,0.5,UCLA,UConn,4,4,0,0,NA,400994360,2017-11-21,
4,1,9:36,2376,2376,Kelli Hayes Turnover.,0,0,0,0,0.5,UCLA,UConn,4,4,0,0,NA,400994360,2017-11-21,
5,1,9:36,2376,2376,Napheesa Collier Steal.,0,0,0,7,0.5,UCLA,UConn,4,4,0,0,NA,400994360,2017-11-21,
6,1,9:29,2369,2369,Gabby Williams made Layup.,0,2,-2,19,0.4553178899358536,UCLA,UConn,4,4,0,0,NA,400994360,2017-11-21,UConn
7,1,9:10,2350,2350,Kennedy Burke made Layup. Assisted by Kelli Hayes.,2,2,0,25,0.5,UCLA,UConn,4,4,0,0,NA,400994360,2017-11-21,UCLA
8,1,8:45,2325,2325,Gabby Williams Turnover.,2,2,0,7,0.5,UCLA,UConn,4,4,0,0,NA,400994360,2017-11-21,
9,1,8:38,2318,2318,Monique Billings missed Layup.,2,2,0,0,0.5,UCLA,UConn,4,4,0,0,NA,400994360,2017-11-21,
10,1,8:38,2318,2318,Azura Stevens Block.,2,2,0,0,0.5,UCLA,UConn,4,4,0,0,NA,400994360,2017-11-21,
11,1,8:38,2318,2318,Napheesa Collier Defensive Rebound.,2,2,0,19,0.5,UCLA,UConn,4,4,0,0,NA,400994360,2017-11-21,
12,1,8:19,2299,2299,Crystal Dangerfield Turnover.,2,2,0,12,0.5,UCLA,UConn,4,4,0,0,NA,400994360,2017-11-21,
13,1,8:07,2287,2287,Monique Billings missed Jumper.,2,2,0,0,0.5,UCLA,UConn,4,4,0,0,NA,400994360,2017-11-21,
14,1,8:07,2287,2287,Gabby Williams Defensive Rebound.,2,2,0,12,0.5,UCLA,UConn,4,4,0,0,NA,400994360,2017-11-21,
15,1,7:55,2275,2275,Azura Stevens Turnover.,2,2,0,0,0.5,UCLA,UConn,4,4,0,0,NA,400994360,2017-11-21,
16,1,7:55,2275,2275,Jordin Canada Steal.,2,2,0,3,0.5,UCLA,UConn,4,4,0,0,NA,400994360,2017-11-21,
17,1,7:52,2272,2272,Kennedy Burke missed Three Point Jumper.,2,2,0,0,0.5,UCLA,UConn,4,4,0,0,NA,400994360,2017-11-21,
18,1,7:52,2272,2272,Gabby Williams Defensive Rebound.,2,2,0,9,0.5,UCLA,UConn,4,4,0,0,NA,400994360,2017-11-21,
19,1,7:43,2263,2263,Gabby Williams missed Layup.,2,2,0,0,0.5,UCLA,UConn,4,4,0,0,NA,400994360,2017-11-21,
20,1,7:43,2263,2263,Kennedy Burke Block.,2,2,0,0,0.5,UCLA,UConn,4,4,0,0,NA,400994360,2017-11-21,
21,1,7:43,2263,2263,Jordin Canada Defensive Rebound.,2,2,0,8,0.5,UCLA,UConn,4,4,0,0,NA,400994360,2017-11-21,
22,1,7:35,2255,2255,Kelli Hayes made Three Point Jumper. Assisted by Jordin Canada.,5,2,3,11,0.5705325919819826,UCLA,UConn,4,4,0,0,NA,400994360,2017-11-21,UCLA
23,1,7:24,2244,2244,Napheesa Collier made Layup. Assisted by Crystal Dangerfield.,5,4,1,25,0.523776517028738,UCLA,UConn,4,4,0,0,NA,400994360,2017-11-21,UConn
24,1,6:59,2219,2219,Kennedy Burke missed Three Point Jumper.,5,4,1,0,0.5240633219767713,UCLA,UConn,4,4,0,0,NA,400994360,2017-11-21,
25,1,6:59,2219,2219,Gabby Williams Defensive Rebound.,5,4,1,10,0.5240633219767713,UCLA,UConn,4,4,0,0,NA,400994360,2017-11-21,
26,1,6:49,2209,2209,Crystal Dangerfield missed Layup.,5,4,1,0,0.5241786072287725,UCLA,UConn,4,4,0,0,NA,400994360,2017-11-21,
27,1,6:49,2209,2209,Kia Nurse Offensive Rebound.,5,4,1,6,0.5241786072287725,UCLA,UConn,4,4,0,0,NA,400994360,2017-11-21,
28,1,6:43,2203,2203,Foul on Monique Billings.,5,4,1,0,0.524247915603762,UCLA,UConn,4,4,0,0,NA,400994360,2017-11-21,
29,1,6:43,2203,2203,Kia Nurse made Free Throw.,5,5,0,0,0.5,UCLA,UConn,4,4,0,0,NA,400994360,2017-11-21,UConn
30,1,6:43,2203,2203,Kia Nurse made Free Throw.,5,6,-1,18,0.47575208439623795,UCLA,UConn,4,4,0,0,NA,400994360,2017-11-21,UConn
31,1,6:25,2185,2185,Kelli Hayes missed Three Point Jumper.,5,6,-1,0,0.4755436062176915,UCLA,UConn,4,4,0,0,NA,400994360,2017-11-21,
32,1,6:25,2185,2185,Gabby Williams Defensive Rebound.,5,6,-1,13,0.4755436062176915,UCLA,UConn,4,4,0,0,NA,400994360,2017-11-21,
33,1,6:12,2172,2172,Napheesa Collier made Layup. Assisted by Kia Nurse.,5,8,-3,26,0.4266511374356508,UCLA,UConn,4,4,0,0,NA,400994360,2017-11-21,UConn
34,1,5:46,2146,2146,Jordin Canada made Layup.,7,8,-1,17,0.47508902063357916,UCLA,UConn,4,4,0,0,NA,400994360,2017-11-21,UCLA
35,1,5:29,2129,2129,Napheesa Collier made Jumper. Assisted by Crystal Dangerfield.,7,10,-3,12,0.4251700286336206,UCLA,UConn,4,4,0,0,NA,400994360,2017-11-21,UConn
36,1,5:17,2117,2117,Monique Billings made Layup. Assisted by Jordin Canada.,9,10,-1,15,0.4747471300428469,UCLA,UConn,4,4,0,0,NA,400994360,2017-11-21,UCLA
37,1,5:02,2102,2102,Kia Nurse missed Three Point Jumper.,9,10,-1,0,0.47456879313415556,UCLA,UConn,4,4,0,0,NA,400994360,2017-11-21,
38,1,5:02,2102,2102,Gabby Williams Offensive Rebound.,9,10,-1,5,0.47456879313415556,UCLA,UConn,4,4,0,0,NA,400994360,2017-11-21,
39,1,4:57,2097,2097,Gabby Williams missed Jumper.,9,10,-1,0,0.47450910676291413,UCLA,UConn,4,4,0,0,NA,400994360,2017-11-21,
40,1,4:57,2097,2097,Lajahna Drummer Defensive Rebound.,9,10,-1,7,0.47450910676291413,UCLA,UConn,4,4,0,0,NA,400994360,2017-11-21,
41,1,4:50,2090,2090,Jordin Canada missed Three Point Jumper.,9,10,-1,0,0.47442533718173074,UCLA,UConn,4,4,0,0,NA,400994360,2017-11-21,
42,1,4:50,2090,2090,Connecticut Defensive Rebound.,9,10,-1,5,0.47442533718173074,UCLA,UConn,4,4,0,0,NA,400994360,2017-11-21,
43,1,4:45,2085,2085,Official TV Timeout,9,10,-1,10,0.4743653498248922,UCLA,UConn,4,4,0,0,NA,400994360,2017-11-21,
44,1,4:35,2075,2075,Napheesa Collier missed Jumper.,9,10,-1,0,0.4742449858824665,UCLA,UConn,4,4,0,0,NA,400994360,2017-11-21,
45,1,4:35,2075,2075,Azura Stevens Offensive Rebound.,9,10,-1,0,0.4742449858824665,UCLA,UConn,4,4,0,0,NA,400994360,2017-11-21,
46,1,4:35,2075,2075,Azura Stevens made Two Point Tip Shot.,9,12,-3,20,0.4232773232300356,UCLA,UConn,4,4,0,0,NA,400994360,2017-11-21,UConn
47,1,4:15,2055,2055,Lauryn Miller Turnover.,9,12,-3,0,0.4225656614594239,UCLA,UConn,4,4,0,0,NA,400994360,2017-11-21,
48,1,4:15,2055,2055,Napheesa Collier Steal.,9,12,-3,9,0.4225656614594239,UCLA,UConn,4,4,0,0,NA,400994360,2017-11-21,
49,1,4:06,2046,2046,Crystal Dangerfield Turnover.,9,12,-3,0,0.4222433575306089,UCLA,UConn,4,4,0,0,NA,400994360,2017-11-21,
50,1,4:06,2046,2046,Jordin Canada Steal.,9,12,-3,6,0.4222433575306089,UCLA,UConn,4,4,0,0,NA,400994360,2017-11-21,
51,1,4:00,2040,2040,Chantel Horvat made Layup. Assisted by Kennedy Burke.,11,12,-1,24,0.47381940151492263,UCLA,UConn,4,4,0,0,NA,400994360,2017-11-21,UCLA
52,1,3:36,2016,2016,Azura Stevens missed Three Point Jumper.,11,12,-1,0,0.47352341939653925,UCLA,UConn,4,4,0,0,NA,400994360,2017-11-21,
53,1,3:36,2016,2016,Jordin Canada Defensive Rebound.,11,12,-1,25,0.47352341939653925,UCLA,UConn,4,4,0,0,NA,400994360,2017-11-21,
54,1,3:11,1991,1991,Kelli Hayes missed Three Point Jumper.,11,12,-1,0,0.47321121992794035,UCLA,UConn,4,4,0,0,NA,400994360,2017-11-21,
55,1,3:11,1991,1991,Gabby Williams Defensive Rebound.,11,12,-1,11,0.47321121992794035,UCLA,UConn,4,4,0,0,NA,400994360,2017-11-21,
56,1,3:00,1980,1980,Crystal Dangerfield made Three Point Jumper. Assisted by Azura Stevens.,11,15,-4,33,0.3938262610652755,UCLA,UConn,4,4,0,0,NA,400994360,2017-11-21,UConn
57,1,2:27,1947,1947,Kennedy Burke missed Jumper.,11,15,-4,0,0.39221380637635567,UCLA,UConn,4,4,0,0,NA,400994360,2017-11-21,
58,1,2:27,1947,1947,Azura Stevens Defensive Rebound.,11,15,-4,16,0.39221380637635567,UCLA,UConn,4,4,0,0,NA,400994360,2017-11-21,
59,1,2:11,1931,1931,Napheesa Collier made Layup. Assisted by Azura Stevens.,11,17,-6,34,0.3402881918903782,UCLA,UConn,4,4,0,0,NA,400994360,2017-11-21,UConn
60,1,1:37,1897,1897,Jordin Canada missed Jumper.,11,17,-6,0,0.33790603808191105,UCLA,UConn,4,4,0,0,NA,400994360,2017-11-21,
61,1,1:37,1897,1897,Gabby Williams Defensive Rebound.,11,17,-6,8,0.33790603808191105,UCLA,UConn,4,4,0,0,NA,400994360,2017-11-21,
62,1,1:29,1889,1889,Napheesa Collier made Jumper. Assisted by Kia Nurse.,11,19,-8,5,0.28901274990521925,UCLA,UConn,4,4,0,0,NA,400994360,2017-11-21,UConn
63,1,1:24,1884,1884,UCLA  Timeout,11,19,-8,15,0.28858505604975987,UCLA,UConn,3,4,1,0,NA,400994360,2017-11-21,
64,1,1:09,1869,1869,Chantel Horvat Turnover.,11,19,-8,0,0.2873030314906793,UCLA,UConn,3,4,1,0,NA,400994360,2017-11-21,
65,1,1:09,1869,1869,Napheesa Collier Steal.,11,19,-8,15,0.2873030314906793,UCLA,UConn,3,4,1,0,NA,400994360,2017-11-21,
66,1,0:54,1854,1854,Crystal Dangerfield missed Jumper.,11,19,-8,0,0.28602127601613614,UCLA,UConn,3,4,1,0,NA,400994360,2017-11-21,
67,1,0:54,1854,1854,Lajahna Drummer Defensive Rebound.,11,19,-8,8,0.28602127601613614,UCLA,UConn,3,4,1,0,NA,400994360,2017-11-21,
68,1,0:46,1846,1846,Jordin Canada Turnover.,11,19,-8,0,0.28533720326629153,UCLA,UConn,3,4,1,0,NA,400994360,2017-11-21,
69,1,0:46,1846,1846,Kia Nurse Steal.,11,19,-8,5,0.28533720326629153,UCLA,UConn,3,4,1,0,NA,400994360,2017-11-21,
70,1,0:41,1841,1841,Kia Nurse made Layup.,11,21,-10,13,0.24043467980728972,UCLA,UConn,3,4,1,0,NA,400994360,2017-11-21,UConn
71,1,0:28,1828,1828,Foul on Gabby Williams.,11,21,-10,3,0.23918713089756236,UCLA,UConn,3,4,1,0,NA,400994360,2017-11-21,
72,1,0:25,1825,1825,Kennedy Burke missed Three Point Jumper.,11,21,-10,0,0.23889898146131283,UCLA,UConn,3,4,1,0,NA,400994360,2017-11-21,
73,1,0:25,1825,1825,Napheesa Collier Defensive Rebound.,11,21,-10,5,0.23889898146131283,UCLA,UConn,3,4,1,0,NA,400994360,2017-11-21,
74,1,0:20,1820,1820,Foul on Lajahna Drummer.,11,21,-10,16,0.2384184465039811,UCLA,UConn,3,4,0,0,NA,400994360,2017-11-21,
75,1,0:04,1804,1804,Gabby Williams missed Jumper.,11,21,-10,0,0.23687762470135645,UCLA,UConn,3,4,0,0,NA,400994360,2017-11-21,
76,1,0:04,1804,1804,Gabby Williams Offensive Rebound.,11,21,-10,4,0.23687762470135645,UCLA,UConn,3,4,0,0,NA,400994360,2017-11-21,
77,1,0:00,1800,1800,End of 1st Quarter,11,21,-10,0,0.23649150459798127,UCLA,UConn,3,4,0,0,NA,400994360,2017-11-21,
78,2,10:00,1800,1800,Jump Ball won by UCLA,11,21,-10,27,0.23649150459798127,UCLA,UConn,4,4,0,0,NA,400994360,2017-11-21,
79,2,9:33,1773,1773,Chantel Horvat made Jumper.,13,21,-8,18,0.27903384602357606,UCLA,UConn,4,4,0,0,NA,400994360,2017-11-21,UCLA
80,2,9:15,1755,1755,Napheesa Collier missed Jumper.,13,21,-8,0,0.2774497725957903,UCLA,UConn,4,4,0,0,NA,400994360,2017-11-21,
81,2,9:15,1755,1755,Lajahna Drummer Defensive Rebound.,13,21,-8,10,0.2774497725957903,UCLA,UConn,4,4,0,0,NA,400994360,2017-11-21,
82,2,9:05,1745,1745,Foul on Gabby Williams.,13,21,-8,10,0.27656244185661866,UCLA,UConn,4,4,0,0,NA,400994360,2017-11-21,
83,2,8:55,1735,1735,Kennedy Burke missed Three Point Jumper.,13,21,-8,0,0.27566932974183916,UCLA,UConn,4,4,0,0,NA,400994360,2017-11-21,
84,2,8:55,1735,1735,Napheesa Collier Defensive Rebound.,13,21,-8,11,0.27566932974183916,UCLA,UConn,4,4,0,0,NA,400994360,2017-11-21,
85,2,8:44,1724,1724,Crystal Dangerfield missed Jumper.,13,21,-8,0,0.27467969435799766,UCLA,UConn,4,4,0,0,NA,400994360,2017-11-21,
86,2,8:44,1724,1724,Napheesa Collier Offensive Rebound.,13,21,-8,6,0.27467969435799766,UCLA,UConn,4,4,0,0,NA,400994360,2017-11-21,
87,2,8:38,1718,1718,Kia Nurse missed Three Point Jumper.,13,21,-8,0,0.2741365050543845,UCLA,UConn,4,4,0,0,NA,400994360,2017-11-21,
88,2,8:38,1718,1718,UCLA Deadball Team Rebound.,13,21,-8,4,0.2741365050543845,UCLA,UConn,4,4,0,0,NA,400994360,2017-11-21,
89,2,8:34,1714,1714,Kennedy Burke missed Layup.,13,21,-8,0,0.27377298854661114,UCLA,UConn,4,4,0,0,NA,400994360,2017-11-21,
90,2,8:34,1714,1714,Connecticut Defensive Rebound.,13,21,-8,21,0.27377298854661114,UCLA,UConn,4,4,0,0,NA,400994360,2017-11-21,
91,2,8:13,1693,1693,Foul on Lajahna Drummer.,13,21,-8,23,0.2718450991822878,UCLA,UConn,4,4,0,0,NA,400994360,2017-11-21,
92,2,7:50,1670,1670,Azura Stevens Turnover.,13,21,-8,16,0.26974149223922556,UCLA,UConn,4,4,0,0,NA,400994360,2017-11-21,
93,2,7:34,1654,1654,Foul on Napheesa Collier.,13,21,-8,0,0.26832079895128713,UCLA,UConn,4,4,0,0,NA,400994360,2017-11-21,
94,2,7:34,1654,1654,Monique Billings missed Free Throw.,13,21,-8,0,0.26832079895128713,UCLA,UConn,4,4,0,0,NA,400994360,2017-11-21,
95,2,7:34,1654,1654,UCLA Deadball Team Rebound.,13,21,-8,0,0.26832079895128713,UCLA,UConn,4,4,0,0,NA,400994360,2017-11-21,
96,2,7:34,1654,1654,Monique Billings made Free Throw.,14,21,-7,12,0.29364134084939264,UCLA,UConn,4,4,0,0,NA,400994360,2017-11-21,UCLA
97,2,7:22,1642,1642,Megan Walker made Jumper. Assisted by Azura Stevens.,14,23,-9,18,0.24332014028031854,UCLA,UConn,4,4,0,0,NA,400994360,2017-11-21,UConn
98,2,7:04,1624,1624,Kennedy Burke made Three Point Jumper. Assisted by Jordin Canada.,17,23,-6,18,0.3181433467676124,UCLA,UConn,4,4,0,0,NA,400994360,2017-11-21,UCLA
99,2,6:46,1606,1606,Azura Stevens Turnover.,17,23,-6,10,0.31686532511991267,UCLA,UConn,4,4,0,0,NA,400994360,2017-11-21,
100,2,6:36,1596,1596,Foul on Kia Nurse.,17,23,-6,26,0.31615761663962944,UCLA,UConn,4,4,0,0,NA,400994360,2017-11-21,
101,2,6:10,1570,1570,Chantel Horvat missed Jumper.,17,23,-6,0,0.3143132562904294,UCLA,UConn,4,4,0,0,NA,400994360,2017-11-21,
102,2,6:10,1570,1570,Connecticut Defensive Rebound.,17,23,-6,9,0.3143132562904294,UCLA,UConn,4,4,0,0,NA,400994360,2017-11-21,
103,2,6:01,1561,1561,Napheesa Collier made Three Point Jumper. Assisted by Megan Walker.,17,26,-9,35,0.23603796300240673,UCLA,UConn,4,4,0,0,NA,400994360,2017-11-21,UConn
104,2,5:26,1526,1526,Kennedy Burke missed Three Point Jumper.,17,26,-9,0,0.2328419344268865,UCLA,UConn,4,4,0,0,NA,400994360,2017-11-21,
105,2,5:26,1526,1526,Monique Billings Offensive Rebound.,17,26,-9,13,0.2328419344268865,UCLA,UConn,4,4,0,0,NA,400994360,2017-11-21,
106,2,5:13,1513,1513,UCLA  Turnover.,17,26,-9,20,0.23162408308103755,UCLA,UConn,4,4,0,0,NA,400994360,2017-11-21,
107,2,4:53,1493,1493,Crystal Dangerfield Turnover.,17,26,-9,0,0.22970558860672102,UCLA,UConn,4,4,0,0,NA,400994360,2017-11-21,
108,2,4:53,1493,1493,Official TV Timeout,17,26,-9,17,0.22970558860672102,UCLA,UConn,4,4,0,0,NA,400994360,2017-11-21,
109,2,4:36,1476,1476,Michaela Onyenwere made Layup.,19,26,-7,27,0.27918591192979325,UCLA,UConn,4,4,0,0,NA,400994360,2017-11-21,UCLA
110,2,4:09,1449,1449,Foul on Azura Stevens.,19,26,-7,0,0.276703512264308,UCLA,UConn,4,4,0,0,NA,400994360,2017-11-21,
111,2,4:09,1449,1449,Azura Stevens Turnover.,19,26,-7,15,0.276703512264308,UCLA,UConn,4,4,0,0,NA,400994360,2017-11-21,
112,2,3:54,1434,1434,Monique Billings made Jumper. Assisted by Jordin Canada.,21,26,-5,12,0.33374350547552023,UCLA,UConn,4,4,0,0,NA,400994360,2017-11-21,UCLA
113,2,3:42,1422,1422,Megan Walker made Three Point Jumper. Assisted by Napheesa Collier.,21,29,-8,32,0.24744768094043454,UCLA,UConn,4,4,0,0,NA,400994360,2017-11-21,UConn
114,2,3:10,1390,1390,Jordin Canada missed Three Point Jumper.,21,29,-8,0,0.24448071225736148,UCLA,UConn,4,4,0,0,NA,400994360,2017-11-21,
115,2,3:10,1390,1390,Kia Nurse Defensive Rebound.,21,29,-8,13,0.24448071225736148,UCLA,UConn,4,4,0,0,NA,400994360,2017-11-21,
116,2,2:57,1377,1377,Megan Walker made Three Point Jumper. Assisted by Napheesa Collier.,21,32,-11,18,0.1736268399634494,UCLA,UConn,4,4,0,0,NA,400994360,2017-11-21,UConn
117,2,2:39,1359,1359,Michaela Onyenwere made Three Point Jumper. Assisted by Monique Billings.,24,32,-8,22,0.24168726140795416,UCLA,UConn,4,4,0,0,NA,400994360,2017-11-21,UCLA
118,2,2:17,1337,1337,Kia Nurse missed Three Point Jumper.,24,32,-8,0,0.23970495408191747,UCLA,UConn,4,4,0,0,NA,400994360,2017-11-21,
119,2,2:17,1337,1337,Megan Walker Offensive Rebound.,24,32,-8,9,0.23970495408191747,UCLA,UConn,4,4,0,0,NA,400994360,2017-11-21,
120,2,2:08,1328,1328,Megan Walker made Three Point Jumper. Assisted by Crystal Dangerfield.,24,35,-11,24,0.16891357303304852,UCLA,UConn,4,4,0,0,NA,400994360,2017-11-21,UConn
121,2,1:44,1304,1304,Chantel Horvat missed Jumper.,24,35,-11,0,0.1665543006935271,UCLA,UConn,4,4,0,0,NA,400994360,2017-11-21,
122,2,1:44,1304,1304,UCLA Offensive Rebound.,24,35,-11,10,0.1665543006935271,UCLA,UConn,4,4,0,0,NA,400994360,2017-11-21,
123,2,1:34,1294,1294,Kennedy Burke missed Jumper.,24,35,-11,0,0.1655479877779725,UCLA,UConn,4,4,0,0,NA,400994360,2017-11-21,
124,2,1:34,1294,1294,Jordin Canada Offensive Rebound.,24,35,-11,9,0.1655479877779725,UCLA,UConn,4,4,0,0,NA,400994360,2017-11-21,
125,2,1:25,1285,1285,Foul on Megan Walker.,24,35,-11,0,0.164627262520925,UCLA,UConn,4,4,0,0,NA,400994360,2017-11-21,
126,2,1:25,1285,1285,Monique Billings made Free Throw.,25,35,-10,0,0.18595058508350096,UCLA,UConn,4,4,0,0,NA,400994360,2017-11-21,UCLA
127,2,1:25,1285,1285,Monique Billings made Free Throw.,26,35,-9,14,0.20934367814108912,UCLA,UConn,4,4,0,0,NA,400994360,2017-11-21,UCLA
128,2,1:11,1271,1271,Megan Walker Turnover.,26,35,-9,0,0.20789932953859933,UCLA,UConn,4,4,0,0,NA,400994360,2017-11-21,
129,2,1:11,1271,1271,Kennedy Burke Steal.,26,35,-9,3,0.20789932953859933,UCLA,UConn,4,4,0,0,NA,400994360,2017-11-21,
130,2,1:08,1268,1268,Kennedy Burke Turnover.,26,35,-9,0,0.20758371487835395,UCLA,UConn,4,4,0,0,NA,400994360,2017-11-21,
131,2,1:08,1268,1268,Napheesa Collier Steal.,26,35,-9,3,0.20758371487835395,UCLA,UConn,4,4,0,0,NA,400994360,2017-11-21,
132,2,1:05,1265,1265,Foul on Kennedy Burke.,26,35,-9,0,0.20726578715397845,UCLA,UConn,4,4,0,0,NA,400994360,2017-11-21,
133,2,1:05,1265,1265,Azura Stevens made Free Throw.,26,36,-10,0,0.1838406846671988,UCLA,UConn,4,4,0,0,NA,400994360,2017-11-21,UConn
134,2,1:05,1265,1265,Azura Stevens made Free Throw.,26,37,-11,11,0.16252030910898216,UCLA,UConn,4,4,0,0,NA,400994360,2017-11-21,UConn
135,2,0:54,1254,1254,Kennedy Burke made Jumper.,28,37,-9,0,0.2060791452238799,UCLA,UConn,4,4,0,0,NA,400994360,2017-11-21,UCLA
136,2,0:54,1254,1254,Foul on Azura Stevens.,28,37,-9,0,0.2060791452238799,UCLA,UConn,4,4,0,0,NA,400994360,2017-11-21,
137,2,0:54,1254,1254,Kennedy Burke made Free Throw.,29,37,-8,16,0.23167713173355406,UCLA,UConn,4,4,0,0,NA,400994360,2017-11-21,UCLA
138,2,0:38,1238,1238,Crystal Dangerfield made Three Point Jumper. Assisted by Azura Stevens.,29,40,-11,30,0.15951304353086024,UCLA,UConn,4,4,0,0,NA,400994360,2017-11-21,UConn
139,2,0:08,1208,1208,Kelli Hayes missed Three Point Jumper.,29,40,-11,0,0.1559023888998007,UCLA,UConn,4,4,0,0,NA,400994360,2017-11-21,
140,2,0:08,1208,1208,Crystal Dangerfield Defensive Rebound.,29,40,-11,8,0.1559023888998007,UCLA,UConn,4,4,0,0,NA,400994360,2017-11-21,
141,2,0:00,1200,1200,End of 2nd Quarter,29,40,-11,0,0.15491898598161316,UCLA,UConn,4,4,0,0,NA,400994360,2017-11-21,
142,3,10:00,1200,1200,Jump Ball won by Connecticut,29,40,-11,7,0.15491898598161316,UCLA,UConn,5,5,0,0,NA,400994360,2017-11-21,
143,3,9:53,1193,1193,Napheesa Collier missed Jumper.,29,40,-11,0,0.15407537862527118,UCLA,UConn,5,5,0,0,NA,400994360,2017-11-21,
144,3,9:53,1193,1193,Lajahna Drummer Defensive Rebound.,29,40,-11,11,0.15407537862527118,UCLA,UConn,5,5,0,0,NA,400994360,2017-11-21,
145,3,9:42,1182,1182,Jordin Canada missed Layup.,29,40,-11,0,0.15277776881978625,UCLA,UConn,5,5,0,0,NA,400994360,2017-11-21,
146,3,9:42,1182,1182,Monique Billings Offensive Rebound.,29,40,-11,6,0.15277776881978625,UCLA,UConn,5,5,0,0,NA,400994360,2017-11-21,
147,3,9:36,1176,1176,Monique Billings made Layup.,31,40,-9,4,0.1968768127320971,UCLA,UConn,5,5,0,0,NA,400994360,2017-11-21,UCLA
148,3,9:32,1172,1172,Azura Stevens Turnover.,31,40,-9,0,0.19641617799963507,UCLA,UConn,5,5,0,0,NA,400994360,2017-11-21,
149,3,9:32,1172,1172,Jordin Canada Steal.,31,40,-9,6,0.19641617799963507,UCLA,UConn,5,5,0,0,NA,400994360,2017-11-21,
150,3,9:26,1166,1166,Jordin Canada Turnover.,31,40,-9,0,0.19573056354921622,UCLA,UConn,5,5,0,0,NA,400994360,2017-11-21,
151,3,9:26,1166,1166,Gabby Williams Steal.,31,40,-9,8,0.19573056354921622,UCLA,UConn,5,5,0,0,NA,400994360,2017-11-21,
152,3,9:18,1158,1158,Jump Ball won by UCLA,31,40,-9,0,0.19482502124191095,UCLA,UConn,5,5,0,0,NA,400994360,2017-11-21,
153,3,9:18,1158,1158,Gabby Williams Turnover.,31,40,-9,0,0.19482502124191095,UCLA,UConn,5,5,0,0,NA,400994360,2017-11-21,
154,3,9:18,1158,1158,Jordin Canada Steal.,31,40,-9,14,0.19482502124191095,UCLA,UConn,5,5,0,0,NA,400994360,2017-11-21,
155,3,9:04,1144,1144,Monique Billings missed Jumper.,31,40,-9,0,0.1932582906197909,UCLA,UConn,5,5,0,0,NA,400994360,2017-11-21,
156,3,9:04,1144,1144,Azura Stevens Block.,31,40,-9,0,0.1932582906197909,UCLA,UConn,5,5,0,0,NA,400994360,2017-11-21,
157,3,9:04,1144,1144,Azura Stevens Defensive Rebound.,31,40,-9,15,0.1932582906197909,UCLA,UConn,5,5,0,0,NA,400994360,2017-11-21,
158,3,8:49,1129,1129,Azura Stevens made Layup. Assisted by Kia Nurse.,31,42,-11,23,0.14683899442999424,UCLA,UConn,5,5,0,0,NA,400994360,2017-11-21,UConn
159,3,8:26,1106,1106,Jordin Canada made Three Point Jumper. Assisted by Lajahna Drummer.,34,42,-8,19,0.21510459732987042,UCLA,UConn,5,5,0,0,NA,400994360,2017-11-21,UCLA
160,3,8:07,1087,1087,Azura Stevens missed Layup.,34,42,-8,0,0.2130146818501415,UCLA,UConn,5,5,0,0,NA,400994360,2017-11-21,
161,3,8:07,1087,1087,UCLA Defensive Rebound.,34,42,-8,28,0.2130146818501415,UCLA,UConn,5,5,0,0,NA,400994360,2017-11-21,
162,3,7:39,1059,1059,Kelli Hayes Turnover.,34,42,-8,0,0.20983186509558083,UCLA,UConn,5,5,0,0,NA,400994360,2017-11-21,
163,3,7:39,1059,1059,Azura Stevens Steal.,34,42,-8,12,0.20983186509558083,UCLA,UConn,5,5,0,0,NA,400994360,2017-11-21,
164,3,7:27,1047,1047,Gabby Williams made Jumper.,34,44,-10,25,0.15867265970417518,UCLA,UConn,5,5,0,0,NA,400994360,2017-11-21,UConn
165,3,7:02,1022,1022,Kennedy Burke made Layup. Assisted by Kelli Hayes.,36,44,-8,14,0.20532574501526119,UCLA,UConn,5,5,0,0,NA,400994360,2017-11-21,UCLA
166,3,6:48,1008,1008,Foul on Kennedy Burke.,36,44,-8,0,0.2035018690924031,UCLA,UConn,5,5,0,0,NA,400994360,2017-11-21,
167,3,6:48,1008,1008,Kia Nurse made Free Throw.,36,45,-9,0,0.1772460523682573,UCLA,UConn,5,5,0,0,NA,400994360,2017-11-21,UConn
168,3,6:48,1008,1008,Kia Nurse made Free Throw.,36,46,-10,17,0.15372397000165308,UCLA,UConn,5,5,0,0,NA,400994360,2017-11-21,UConn
169,3,6:31,991,991,Kennedy Burke missed Three Point Jumper.,36,46,-10,0,0.15140079124606315,UCLA,UConn,5,5,0,0,NA,400994360,2017-11-21,
170,3,6:31,991,991,Azura Stevens Defensive Rebound.,36,46,-10,12,0.15140079124606315,UCLA,UConn,5,5,0,0,NA,400994360,2017-11-21,
171,3,6:19,979,979,Napheesa Collier missed Layup.,36,46,-10,0,0.1496900665735688,UCLA,UConn,5,5,0,0,NA,400994360,2017-11-21,
172,3,6:19,979,979,Lajahna Drummer Defensive Rebound.,36,46,-10,11,0.1496900665735688,UCLA,UConn,5,5,0,0,NA,400994360,2017-11-21,
173,3,6:08,968,968,Jordin Canada missed Layup.,36,46,-10,0,0.14806945452219114,UCLA,UConn,5,5,0,0,NA,400994360,2017-11-21,
174,3,6:08,968,968,UCLA Offensive Rebound.,36,46,-10,6,0.14806945452219114,UCLA,UConn,5,5,0,0,NA,400994360,2017-11-21,
175,3,6:02,962,962,Monique Billings missed Jumper.,36,46,-10,0,0.14720381137946995,UCLA,UConn,5,5,0,0,NA,400994360,2017-11-21,
176,3,6:02,962,962,Gabby Williams Defensive Rebound.,36,46,-10,22,0.14720381137946995,UCLA,UConn,5,5,0,0,NA,400994360,2017-11-21,
177,3,5:40,940,940,Azura Stevens missed Jumper.,36,46,-10,0,0.14429273780026897,UCLA,UConn,5,5,0,0,NA,400994360,2017-11-21,
178,3,5:40,940,940,Jordin Canada Defensive Rebound.,36,46,-10,5,0.14429273780026897,UCLA,UConn,5,5,0,0,NA,400994360,2017-11-21,
179,3,5:35,935,935,Foul on Azura Stevens.,36,46,-10,20,0.14368013919569883,UCLA,UConn,5,5,0,0,NA,400994360,2017-11-21,
180,3,5:15,915,915,Chantel Horvat made Jumper. Assisted by Lajahna Drummer.,38,46,-8,15,0.1910532054286195,UCLA,UConn,5,5,0,0,NA,400994360,2017-11-21,UCLA
181,3,5:00,900,900,Gabby Williams missed Layup.,38,46,-8,0,0.1893937746843732,UCLA,UConn,5,5,0,0,NA,400994360,2017-11-21,
182,3,5:00,900,900,Kennedy Burke Block.,38,46,-8,0,0.1893937746843732,UCLA,UConn,5,5,0,0,NA,400994360,2017-11-21,
183,3,5:00,900,900,Connecticut Offensive Rebound.,38,46,-8,9,0.1893937746843732,UCLA,UConn,5,5,0,0,NA,400994360,2017-11-21,
184,3,4:51,891,891,Official TV Timeout,38,46,-8,3,0.18842437448943297,UCLA,UConn,5,5,0,0,NA,400994360,2017-11-21,
185,3,4:48,888,888,Crystal Dangerfield made Layup. Assisted by Napheesa Collier.,38,48,-10,7,0.13848008026368872,UCLA,UConn,5,5,0,0,NA,400994360,2017-11-21,UConn
186,3,4:41,881,881,Chantel Horvat missed Jumper.,38,48,-10,0,0.1377536437528479,UCLA,UConn,5,5,0,0,NA,400994360,2017-11-21,
187,3,4:41,881,881,Connecticut Deadball Team Rebound.,38,48,-10,5,0.1377536437528479,UCLA,UConn,5,5,0,0,NA,400994360,2017-11-21,
188,3,4:36,876,876,Jump Ball won by Connecticut,38,48,-10,16,0.13723655121304904,UCLA,UConn,5,5,0,0,NA,400994360,2017-11-21,
189,3,4:20,860,860,Foul on Chantel Horvat.,38,48,-10,0,0.13557709942084498,UCLA,UConn,5,5,0,0,NA,400994360,2017-11-21,
190,3,4:20,860,860,Kia Nurse missed Free Throw.,38,48,-10,0,0.13557709942084498,UCLA,UConn,5,5,0,0,NA,400994360,2017-11-21,
191,3,4:20,860,860,Connecticut Deadball Team Rebound.,38,48,-10,0,0.13557709942084498,UCLA,UConn,5,5,0,0,NA,400994360,2017-11-21,
192,3,4:20,860,860,Kia Nurse made Free Throw.,38,49,-11,21,0.11529361191900542,UCLA,UConn,5,5,0,0,NA,400994360,2017-11-21,UConn
193,3,3:59,839,839,Jordin Canada missed Jumper.,38,49,-11,0,0.11315276048020667,UCLA,UConn,5,5,0,0,NA,400994360,2017-11-21,
194,3,3:59,839,839,Napheesa Collier Defensive Rebound.,38,49,-11,0,0.11315276048020667,UCLA,UConn,5,5,0,0,NA,400994360,2017-11-21,
195,3,3:59,839,839,Foul on Chantel Horvat.,38,49,-11,16,0.11315276048020667,UCLA,UConn,5,5,0,0,NA,400994360,2017-11-21,
196,3,3:43,823,823,Crystal Dangerfield missed Three Point Jumper.,38,49,-11,0,0.11143718093939822,UCLA,UConn,5,5,0,0,NA,400994360,2017-11-21,
197,3,3:43,823,823,Gabby Williams Offensive Rebound.,38,49,-11,12,0.11143718093939822,UCLA,UConn,5,5,0,0,NA,400994360,2017-11-21,
198,3,3:31,811,811,Napheesa Collier missed Jumper.,38,49,-11,0,0.11008116928957927,UCLA,UConn,5,5,0,0,NA,400994360,2017-11-21,
199,3,3:31,811,811,Monique Billings Defensive Rebound.,38,49,-11,22,0.11008116928957927,UCLA,UConn,5,5,0,0,NA,400994360,2017-11-21,
200,3,3:09,789,789,Kennedy Burke missed Three Point Jumper.,38,49,-11,0,0.10739607279602002,UCLA,UConn,5,5,0,0,NA,400994360,2017-11-21,
201,3,3:09,789,789,Kia Nurse Defensive Rebound.,38,49,-11,8,0.10739607279602002,UCLA,UConn,5,5,0,0,NA,400994360,2017-11-21,
