play_id,period,time_remaining_period,secs_remaining,secs_remaining_absolute,description,home_score,away_score,score_diff,play_length,win_prob,home,away,home_time_out_remaining,away_time_out_remaining,home_timeout_ind,away_timeout_ind,home_favored_by,game_id,date,whichScored
1,1,9:44,2384,2384,Jordan McLemore missed Three Point Jumper.,0,0,0,7,0.5,UMass Lowell,Hartford,4,4,0,0,NA,401175458,2020-02-15,NA
2,1,9:37,2377,2377,Sierra Smith Offensive Rebound.,0,0,0,0,0.5,UMass Lowell,Hartford,4,4,0,0,NA,401175458,2020-02-15,
3,1,9:37,2377,2377,Sierra Smith missed Layup.,0,0,0,0,0.5,UMass Lowell,Hartford,4,4,0,0,NA,401175458,2020-02-15,
4,1,9:37,2377,2377,Azariah Wade Offensive Rebound.,0,0,0,0,0.5,UMass Lowell,Hartford,4,4,0,0,NA,401175458,2020-02-15,
5,1,9:37,2377,2377,Azariah Wade missed Layup.,0,0,0,0,0.5,UMass Lowell,Hartford,4,4,0,0,NA,401175458,2020-02-15,
6,1,9:37,2377,2377,UMass Lowell Defensive Rebound.,0,0,0,21,0.5,UMass Lowell,Hartford,4,4,0,0,NA,401175458,2020-02-15,
7,1,9:16,2356,2356,Kharis Idom missed Three Point Jumper.,0,0,0,4,0.5,UMass Lowell,Hartford,4,4,0,0,NA,401175458,2020-02-15,
8,1,9:12,2352,2352,Brianne Stiers Offensive Rebound.,0,0,0,2,0.5,UMass Lowell,Hartford,4,4,0,0,NA,401175458,2020-02-15,
9,1,9:10,2350,2350,Jaliena Sanchez missed Three Point Jumper.,0,0,0,4,0.5,UMass Lowell,Hartford,4,4,0,0,NA,401175458,2020-02-15,
10,1,9:06,2346,2346,UMass Lowell Offensive Rebound.,0,0,0,8,0.5,UMass Lowell,Hartford,4,4,0,0,NA,401175458,2020-02-15,
11,1,8:58,2338,2338,Brianne Stiers missed Jumper.,0,0,0,3,0.5,UMass Lowell,Hartford,4,4,0,0,NA,401175458,2020-02-15,
12,1,8:55,2335,2335,Sierra Smith Defensive Rebound.,0,0,0,10,0.5,UMass Lowell,Hartford,4,4,0,0,NA,401175458,2020-02-15,
13,1,8:45,2325,2325,Sierra Smith made Jumper. Assisted by Azariah Wade.,0,2,-2,17,0.4543645204002807,UMass Lowell,Hartford,4,4,0,0,NA,401175458,2020-02-15,Hartford
14,1,8:28,2308,2308,Brianne Stiers Turnover.,0,2,-2,0,0.4539899374231114,UMass Lowell,Hartford,4,4,0,0,NA,401175458,2020-02-15,
15,1,8:28,2308,2308,Kaela Dothard Steal.,0,2,-2,16,0.4539899374231114,UMass Lowell,Hartford,4,4,0,0,NA,401175458,2020-02-15,
16,1,8:12,2292,2292,Foul on Sierra Smith.,0,2,-2,0,0.45363457052289796,UMass Lowell,Hartford,4,4,0,0,NA,401175458,2020-02-15,
17,1,8:12,2292,2292,Sierra Smith Turnover.,0,2,-2,17,0.45363457052289796,UMass Lowell,Hartford,4,4,0,0,NA,401175458,2020-02-15,
18,1,7:55,2275,2275,Felicia Korte missed Jumper.,0,2,-2,3,0.4532542448184906,UMass Lowell,Hartford,4,4,0,0,NA,401175458,2020-02-15,
19,1,7:52,2272,2272,Carmen Villalobos Defensive Rebound.,0,2,-2,5,0.45318685350934135,UMass Lowell,Hartford,4,4,0,0,NA,401175458,2020-02-15,
20,1,7:47,2267,2267,Kaela Dothard missed Three Point Jumper.,0,2,-2,6,0.453074360085721,UMass Lowell,Hartford,4,4,0,0,NA,401175458,2020-02-15,
21,1,7:41,2261,2261,Jaliena Sanchez Defensive Rebound.,0,2,-2,21,0.4529390880246341,UMass Lowell,Hartford,4,4,0,0,NA,401175458,2020-02-15,
22,1,7:20,2240,2240,Felicia Korte made Layup.,2,2,0,20,0.5,UMass Lowell,Hartford,4,4,0,0,NA,401175458,2020-02-15,UMass Lowell
23,1,7:00,2220,2220,Azariah Wade missed Jumper.,2,2,0,4,0.5,UMass Lowell,Hartford,4,4,0,0,NA,401175458,2020-02-15,
24,1,6:56,2216,2216,Jada Lucas Offensive Rebound.,2,2,0,0,0.5,UMass Lowell,Hartford,4,4,0,0,NA,401175458,2020-02-15,
25,1,6:56,2216,2216,Jada Lucas missed Layup.,2,2,0,2,0.5,UMass Lowell,Hartford,4,4,0,0,NA,401175458,2020-02-15,
26,1,6:54,2214,2214,Carmen Villalobos Offensive Rebound.,2,2,0,2,0.5,UMass Lowell,Hartford,4,4,0,0,NA,401175458,2020-02-15,
27,1,6:52,2212,2212,Azariah Wade missed Layup.,2,2,0,4,0.5,UMass Lowell,Hartford,4,4,0,0,NA,401175458,2020-02-15,
28,1,6:48,2208,2208,Denise Solis Defensive Rebound.,2,2,0,3,0.5,UMass Lowell,Hartford,4,4,0,0,NA,401175458,2020-02-15,
29,1,6:45,2205,2205,Jaliena Sanchez missed Layup.,2,2,0,4,0.5,UMass Lowell,Hartford,4,4,0,0,NA,401175458,2020-02-15,
30,1,6:41,2201,2201,Brianne Stiers Offensive Rebound.,2,2,0,0,0.5,UMass Lowell,Hartford,4,4,0,0,NA,401175458,2020-02-15,
31,1,6:41,2201,2201,Brianne Stiers missed Layup.,2,2,0,2,0.5,UMass Lowell,Hartford,4,4,0,0,NA,401175458,2020-02-15,
32,1,6:39,2199,2199,Azariah Wade Defensive Rebound.,2,2,0,8,0.5,UMass Lowell,Hartford,4,4,0,0,NA,401175458,2020-02-15,
33,1,6:31,2191,2191,Foul on Brianne Stiers.,2,2,0,0,0.5,UMass Lowell,Hartford,4,4,0,0,NA,401175458,2020-02-15,
34,1,6:31,2191,2191,Carmen Villalobos made Free Throw.,2,3,-1,0,0.4756131854327252,UMass Lowell,Hartford,4,4,0,0,NA,401175458,2020-02-15,Hartford
35,1,6:31,2191,2191,Carmen Villalobos made Free Throw.,2,4,-2,17,0.4513421214820302,UMass Lowell,Hartford,4,4,0,0,NA,401175458,2020-02-15,Hartford
36,1,6:14,2174,2174,Brianne Stiers made Layup.,4,4,0,20,0.5,UMass Lowell,Hartford,4,4,0,0,NA,401175458,2020-02-15,UMass Lowell
37,1,5:54,2154,2154,Carmen Villalobos missed Jumper.,4,4,0,4,0.5,UMass Lowell,Hartford,4,4,0,0,NA,401175458,2020-02-15,
38,1,5:50,2150,2150,Jaliena Sanchez Defensive Rebound.,4,4,0,5,0.5,UMass Lowell,Hartford,4,4,0,0,NA,401175458,2020-02-15,
39,1,5:45,2145,2145,Foul on Carmen Villalobos.,4,4,0,2,0.5,UMass Lowell,Hartford,4,4,0,0,NA,401175458,2020-02-15,
40,1,5:43,2143,2143,Foul on Denise Solis.,4,4,0,0,0.5,UMass Lowell,Hartford,4,4,0,0,NA,401175458,2020-02-15,
41,1,5:43,2143,2143,Denise Solis Turnover.,4,4,0,15,0.5,UMass Lowell,Hartford,4,4,0,0,NA,401175458,2020-02-15,
42,1,5:28,2128,2128,Jordan McLemore Turnover.,4,4,0,19,0.5,UMass Lowell,Hartford,4,4,0,0,NA,401175458,2020-02-15,
43,1,5:09,2109,2109,Jaliena Sanchez missed Three Point Jumper.,4,4,0,4,0.5,UMass Lowell,Hartford,4,4,0,0,NA,401175458,2020-02-15,
44,1,5:05,2105,2105,Kaylen Banwareesingh Offensive Rebound.,4,4,0,0,0.5,UMass Lowell,Hartford,4,4,0,0,NA,401175458,2020-02-15,
45,1,5:05,2105,2105,Kaylen Banwareesingh made Layup.,6,4,2,0,0.5506602182867172,UMass Lowell,Hartford,4,4,0,0,NA,401175458,2020-02-15,UMass Lowell
46,1,5:05,2105,2105,Foul on Kaela Dothard.,6,4,2,0,0.5506602182867172,UMass Lowell,Hartford,4,4,0,0,NA,401175458,2020-02-15,
47,1,5:05,2105,2105,Kaylen Banwareesingh made Free Throw.,7,4,3,13,0.5756662813686515,UMass Lowell,Hartford,4,4,0,0,NA,401175458,2020-02-15,UMass Lowell
48,1,4:52,2092,2092,Jada Lucas made Three Point Jumper. Assisted by Jordan McLemore.,7,7,0,19,0.5,UMass Lowell,Hartford,4,4,0,0,NA,401175458,2020-02-15,Hartford
49,1,4:33,2073,2073,Jaliena Sanchez Turnover.,7,7,0,0,0.5,UMass Lowell,Hartford,4,4,0,0,NA,401175458,2020-02-15,
50,1,4:33,2073,2073,Official TV Timeout,7,7,0,20,0.5,UMass Lowell,Hartford,4,4,0,0,NA,401175458,2020-02-15,
51,1,4:13,2053,2053,Carmen Villalobos made Jumper.,7,9,-2,25,0.4480971487316694,UMass Lowell,Hartford,4,4,0,0,NA,401175458,2020-02-15,Hartford
52,1,3:48,2028,2028,Kharis Idom made Jumper. Assisted by Kaylen Banwareesingh.,9,9,0,28,0.5,UMass Lowell,Hartford,4,4,0,0,NA,401175458,2020-02-15,UMass Lowell
53,1,3:20,2000,2000,Azariah Wade made Layup. Assisted by Jordan McLemore.,9,11,-2,15,0.44679960004646263,UMass Lowell,Hartford,4,4,0,0,NA,401175458,2020-02-15,Hartford
54,1,3:05,1985,1985,Jaliena Sanchez Turnover.,9,11,-2,11,0.4464260020688232,UMass Lowell,Hartford,4,4,0,0,NA,401175458,2020-02-15,
55,1,2:54,1974,1974,Sierra Smith missed Jumper.,9,11,-2,0,0.44615011928619763,UMass Lowell,Hartford,4,4,0,0,NA,401175458,2020-02-15,
56,1,2:54,1974,1974,Chasidey Willis Block.,9,11,-2,5,0.44615011928619763,UMass Lowell,Hartford,4,4,0,0,NA,401175458,2020-02-15,
57,1,2:49,1969,1969,Kaylen Banwareesingh Defensive Rebound.,9,11,-2,0,0.4460241697248791,UMass Lowell,Hartford,4,4,1,0,NA,401175458,2020-02-15,
58,1,2:49,1969,1969,UMass Lowell  Timeout,9,11,-2,22,0.4460241697248791,UMass Lowell,Hartford,3,4,1,0,NA,401175458,2020-02-15,
59,1,2:27,1947,1947,Kaylen Banwareesingh missed Three Point Jumper.,9,11,-2,4,0.4454657953323223,UMass Lowell,Hartford,3,4,1,0,NA,401175458,2020-02-15,
60,1,2:23,1943,1943,Sierra Smith Defensive Rebound.,9,11,-2,16,0.445363520132641,UMass Lowell,Hartford,3,4,1,0,NA,401175458,2020-02-15,
61,1,2:07,1927,1927,Azariah Wade Turnover.,9,11,-2,9,0.444952121893725,UMass Lowell,Hartford,3,4,1,0,NA,401175458,2020-02-15,
62,1,1:58,1918,1918,Jaliena Sanchez missed Three Point Jumper.,9,11,-2,4,0.44472030526328493,UMass Lowell,Hartford,3,4,1,0,NA,401175458,2020-02-15,
63,1,1:54,1914,1914,Tiahna Sears Offensive Rebound.,9,11,-2,16,0.4446173765687488,UMass Lowell,Hartford,3,4,1,0,NA,401175458,2020-02-15,
64,1,1:38,1898,1898,Chasidey Willis missed Layup.,9,11,-2,3,0.4442060448263449,UMass Lowell,Hartford,3,4,0,0,NA,401175458,2020-02-15,
65,1,1:35,1895,1895,Azariah Wade Defensive Rebound.,9,11,-2,13,0.4441289547419797,UMass Lowell,Hartford,3,4,0,0,NA,401175458,2020-02-15,
66,1,1:22,1882,1882,Kaela Dothard made Three Point Jumper. Assisted by Jada Lucas.,9,14,-5,10,0.36252145744399744,UMass Lowell,Hartford,3,4,0,0,NA,401175458,2020-02-15,Hartford
67,1,1:12,1872,1872,Kaylen Banwareesingh made Three Point Jumper. Assisted by Jaliena Sanchez.,12,14,-2,17,0.4435376503691006,UMass Lowell,Hartford,3,4,0,0,NA,401175458,2020-02-15,UMass Lowell
68,1,0:55,1855,1855,Carmen Villalobos missed Three Point Jumper.,12,14,-2,3,0.4430995317453636,UMass Lowell,Hartford,3,4,0,0,NA,401175458,2020-02-15,
69,1,0:52,1852,1852,Hartford Offensive Rebound.,12,14,-2,7,0.44302205646961973,UMass Lowell,Hartford,3,4,0,0,NA,401175458,2020-02-15,
70,1,0:45,1845,1845,Jordan McLemore Turnover.,12,14,-2,0,0.4428410455580461,UMass Lowell,Hartford,3,4,0,0,NA,401175458,2020-02-15,
71,1,0:45,1845,1845,Kaylen Banwareesingh Steal.,12,14,-2,6,0.4428410455580461,UMass Lowell,Hartford,3,4,0,0,NA,401175458,2020-02-15,
72,1,0:39,1839,1839,Kharis Idom made Three Point Jumper. Assisted by Jaliena Sanchez.,15,14,1,26,0.5287519611525135,UMass Lowell,Hartford,3,4,0,0,NA,401175458,2020-02-15,UMass Lowell
73,1,0:13,1813,1813,Kaela Dothard missed Three Point Jumper.,15,14,1,4,0.5290941604500136,UMass Lowell,Hartford,3,4,0,0,NA,401175458,2020-02-15,
74,1,0:09,1809,1809,Kaylen Banwareesingh Defensive Rebound.,15,14,1,7,0.5291471583727971,UMass Lowell,Hartford,3,4,0,0,NA,401175458,2020-02-15,
75,1,0:02,1802,1802,Foul on Kaela Dothard.,15,14,1,0,0.5292401673615074,UMass Lowell,Hartford,3,4,0,0,NA,401175458,2020-02-15,
76,1,0:02,1802,1802,Jaliena Sanchez missed Free Throw.,15,14,1,0,0.5292401673615074,UMass Lowell,Hartford,3,4,0,0,NA,401175458,2020-02-15,
77,1,0:02,1802,1802,UMass Lowell Deadball Team Rebound.,15,14,1,0,0.5292401673615074,UMass Lowell,Hartford,3,4,0,0,NA,401175458,2020-02-15,
78,1,0:02,1802,1802,Jaliena Sanchez missed Free Throw.,15,14,1,2,0.5292401673615074,UMass Lowell,Hartford,3,4,0,0,NA,401175458,2020-02-15,
79,1,0:00,1800,1800,Azariah Wade Defensive Rebound.,15,14,1,0,0.5292668057759684,UMass Lowell,Hartford,3,4,0,0,NA,401175458,2020-02-15,
80,1,0:00,1800,1800,End of 1st Quarter,15,14,1,13,0.5292668057759684,UMass Lowell,Hartford,3,4,0,0,NA,401175458,2020-02-15,
81,2,9:47,1787,1787,Jada Lucas missed Three Point Jumper.,15,14,1,7,0.529440708783451,UMass Lowell,Hartford,4,4,0,0,NA,401175458,2020-02-15,
82,2,9:40,1780,1780,Chasidey Willis Defensive Rebound.,15,14,1,21,0.5295349295148085,UMass Lowell,Hartford,4,4,0,0,NA,401175458,2020-02-15,
83,2,9:19,1759,1759,Tiahna Sears missed Layup.,15,14,1,4,0.5298203419958217,UMass Lowell,Hartford,4,4,0,0,NA,401175458,2020-02-15,
84,2,9:15,1755,1755,Carmen Villalobos Defensive Rebound.,15,14,1,14,0.5298752153615465,UMass Lowell,Hartford,4,4,0,0,NA,401175458,2020-02-15,
85,2,9:01,1741,1741,Azariah Wade missed Layup.,15,14,1,4,0.5300686819994131,UMass Lowell,Hartford,4,4,0,0,NA,401175458,2020-02-15,
86,2,8:57,1737,1737,Carmen Villalobos Offensive Rebound.,15,14,1,5,0.5301243814583058,UMass Lowell,Hartford,4,4,0,0,NA,401175458,2020-02-15,
87,2,8:52,1732,1732,Jada Lucas missed Three Point Jumper.,15,14,1,5,0.530194283697205,UMass Lowell,Hartford,4,4,0,0,NA,401175458,2020-02-15,
88,2,8:47,1727,1727,Carmen Villalobos Offensive Rebound.,15,14,1,6,0.5302645037705677,UMass Lowell,Hartford,4,4,0,0,NA,401175458,2020-02-15,
89,2,8:41,1721,1721,Foul on Chasidey Willis.,15,14,1,1,0.5303492010359951,UMass Lowell,Hartford,4,4,0,0,NA,401175458,2020-02-15,
90,2,8:40,1720,1720,Azariah Wade missed Free Throw.,15,14,1,0,0.5303633642745524,UMass Lowell,Hartford,4,4,0,0,NA,401175458,2020-02-15,
91,2,8:40,1720,1720,Hartford Deadball Team Rebound.,15,14,1,0,0.5303633642745524,UMass Lowell,Hartford,4,4,0,0,NA,401175458,2020-02-15,
92,2,8:40,1720,1720,Azariah Wade made Free Throw.,15,15,0,18,0.5,UMass Lowell,Hartford,4,4,0,0,NA,401175458,2020-02-15,Hartford
93,2,8:22,1702,1702,Kharis Idom missed Jumper.,15,15,0,4,0.5,UMass Lowell,Hartford,4,4,0,0,NA,401175458,2020-02-15,
94,2,8:18,1698,1698,Chasidey Willis Offensive Rebound.,15,15,0,0,0.5,UMass Lowell,Hartford,4,4,0,0,NA,401175458,2020-02-15,
95,2,8:18,1698,1698,Chasidey Willis made Layup.,17,15,2,22,0.5611269645663569,UMass Lowell,Hartford,4,4,0,0,NA,401175458,2020-02-15,UMass Lowell
96,2,7:56,1676,1676,Carmen Villalobos made Jumper.,17,17,0,22,0.5,UMass Lowell,Hartford,4,4,0,0,NA,401175458,2020-02-15,Hartford
97,2,7:34,1654,1654,Kaylen Banwareesingh made Layup.,19,17,2,25,0.5623708690959547,UMass Lowell,Hartford,4,4,0,0,NA,401175458,2020-02-15,UMass Lowell
98,2,7:09,1629,1629,Carmen Villalobos made Three Point Jumper. Assisted by Azariah Wade.,19,20,-1,18,0.46834768312718367,UMass Lowell,Hartford,4,4,0,0,NA,401175458,2020-02-15,Hartford
99,2,6:51,1611,1611,Kaylen Banwareesingh missed Three Point Jumper.,19,20,-1,4,0.4681025788353944,UMass Lowell,Hartford,4,4,0,0,NA,401175458,2020-02-15,
100,2,6:47,1607,1607,Jada Lucas Defensive Rebound.,19,20,-1,10,0.468048264996863,UMass Lowell,Hartford,4,4,0,0,NA,401175458,2020-02-15,
101,2,6:37,1597,1597,Azariah Wade Turnover.,19,20,-1,0,0.4679125200273822,UMass Lowell,Hartford,4,4,0,0,NA,401175458,2020-02-15,
102,2,6:37,1597,1597,Jaliena Sanchez Steal.,19,20,-1,16,0.4679125200273822,UMass Lowell,Hartford,4,4,0,0,NA,401175458,2020-02-15,
103,2,6:21,1581,1581,Kharis Idom missed Jumper.,19,20,-1,3,0.467694874775941,UMass Lowell,Hartford,4,4,0,0,NA,401175458,2020-02-15,
104,2,6:18,1578,1578,Azariah Wade Defensive Rebound.,19,20,-1,8,0.46765392855276183,UMass Lowell,Hartford,4,4,0,0,NA,401175458,2020-02-15,
105,2,6:10,1570,1570,Jordan McLemore missed Jumper.,19,20,-1,2,0.46754441728349994,UMass Lowell,Hartford,4,4,0,0,NA,401175458,2020-02-15,
106,2,6:08,1568,1568,Azariah Wade Offensive Rebound.,19,20,-1,3,0.4675169545415558,UMass Lowell,Hartford,4,4,0,0,NA,401175458,2020-02-15,
107,2,6:05,1565,1565,Foul on Shamyjha Price.,19,20,-1,9,0.46747568781622056,UMass Lowell,Hartford,4,4,0,0,NA,401175458,2020-02-15,
108,2,5:56,1556,1556,Foul on Brianne Stiers.,19,20,-1,1,0.4673512956803404,UMass Lowell,Hartford,4,4,0,0,NA,401175458,2020-02-15,
109,2,5:55,1555,1555,Carmen Villalobos made Free Throw.,19,21,-2,0,0.43495240982014094,UMass Lowell,Hartford,4,4,0,0,NA,401175458,2020-02-15,Hartford
110,2,5:55,1555,1555,Carmen Villalobos made Free Throw.,19,22,-3,12,0.40311321478502427,UMass Lowell,Hartford,4,4,0,0,NA,401175458,2020-02-15,Hartford
111,2,5:43,1543,1543,Foul on Jada Lucas.,19,22,-3,1,0.4026270437906609,UMass Lowell,Hartford,4,4,0,0,NA,401175458,2020-02-15,
112,2,5:42,1542,1542,Chasidey Willis missed Free Throw.,19,22,-3,0,0.40258624622230027,UMass Lowell,Hartford,4,4,0,0,NA,401175458,2020-02-15,
113,2,5:42,1542,1542,UMass Lowell Deadball Team Rebound.,19,22,-3,0,0.40258624622230027,UMass Lowell,Hartford,4,4,0,0,NA,401175458,2020-02-15,
114,2,5:42,1542,1542,Chasidey Willis made Free Throw.,20,22,-2,10,0.43459352736753437,UMass Lowell,Hartford,4,4,0,0,NA,401175458,2020-02-15,UMass Lowell
115,2,5:32,1532,1532,Jada Lucas missed Jumper.,20,22,-2,4,0.43431376456176324,UMass Lowell,Hartford,4,4,0,0,NA,401175458,2020-02-15,
116,2,5:28,1528,1528,Jaliena Sanchez Defensive Rebound.,20,22,-2,8,0.43420082257963133,UMass Lowell,Hartford,4,4,0,0,NA,401175458,2020-02-15,
117,2,5:20,1520,1520,Chasidey Willis made Layup.,22,22,0,17,0.5,UMass Lowell,Hartford,4,4,0,0,NA,401175458,2020-02-15,UMass Lowell
118,2,5:03,1503,1503,Jordan McLemore missed Layup.,22,22,0,0,0.5,UMass Lowell,Hartford,4,4,0,0,NA,401175458,2020-02-15,
119,2,5:03,1503,1503,Chasidey Willis Block.,22,22,0,5,0.5,UMass Lowell,Hartford,4,4,0,0,NA,401175458,2020-02-15,
120,2,4:58,1498,1498,Brianne Stiers Defensive Rebound.,22,22,0,3,0.5,UMass Lowell,Hartford,4,4,0,0,NA,401175458,2020-02-15,
121,2,4:55,1495,1495,Jaliena Sanchez made Layup.,24,22,2,0,0.5667587178944022,UMass Lowell,Hartford,4,4,0,0,NA,401175458,2020-02-15,UMass Lowell
122,2,4:55,1495,1495,Official TV Timeout,24,22,2,9,0.5667587178944022,UMass Lowell,Hartford,4,4,0,0,NA,401175458,2020-02-15,
123,2,4:46,1486,1486,Foul on Shamyjha Price.,24,22,2,1,0.5670305700193528,UMass Lowell,Hartford,4,4,0,0,NA,401175458,2020-02-15,
124,2,4:45,1485,1485,Sierra Smith missed Layup.,24,22,2,4,0.5670610831786758,UMass Lowell,Hartford,4,4,0,0,NA,401175458,2020-02-15,
125,2,4:41,1481,1481,Shamyjha Price Defensive Rebound.,24,22,2,7,0.5671837756649672,UMass Lowell,Hartford,4,4,0,0,NA,401175458,2020-02-15,
126,2,4:34,1474,1474,Shamyjha Price Turnover.,24,22,2,19,0.5674010337726881,UMass Lowell,Hartford,4,4,0,0,NA,401175458,2020-02-15,
127,2,4:15,1455,1455,Irene Primo made Three Point Jumper. Assisted by Carmen Villalobos.,24,25,-1,17,0.4658370549734992,UMass Lowell,Hartford,4,4,0,0,NA,401175458,2020-02-15,Hartford
128,2,3:58,1438,1438,Chasidey Willis missed Layup.,24,25,-1,4,0.4655549758090917,UMass Lowell,Hartford,4,4,0,0,NA,401175458,2020-02-15,
129,2,3:54,1434,1434,Carmen Villalobos Defensive Rebound.,24,25,-1,11,0.46548985831507333,UMass Lowell,Hartford,4,4,0,0,NA,401175458,2020-02-15,
130,2,3:43,1423,1423,Carmen Villalobos missed Jumper.,24,25,-1,4,0.46531328895126245,UMass Lowell,Hartford,4,4,0,0,NA,401175458,2020-02-15,
131,2,3:39,1419,1419,Shamyjha Price Defensive Rebound.,24,25,-1,9,0.4652498992724654,UMass Lowell,Hartford,4,4,0,0,NA,401175458,2020-02-15,
132,2,3:30,1410,1410,Chasidey Willis Turnover.,24,25,-1,12,0.4651086370861724,UMass Lowell,Hartford,4,4,0,0,NA,401175458,2020-02-15,
133,2,3:18,1398,1398,Irene Primo Turnover.,24,25,-1,4,0.4649227123277354,UMass Lowell,Hartford,4,4,0,0,NA,401175458,2020-02-15,
134,2,3:14,1394,1394,Foul on Azariah Wade.,24,25,-1,13,0.4648612226383159,UMass Lowell,Hartford,4,4,0,0,NA,401175458,2020-02-15,
135,2,3:01,1381,1381,Kaylen Banwareesingh missed Three Point Jumper.,24,25,-1,5,0.4646625336674999,UMass Lowell,Hartford,4,4,0,0,NA,401175458,2020-02-15,
136,2,2:56,1376,1376,Shamyjha Price Offensive Rebound.,24,25,-1,2,0.4645864226199349,UMass Lowell,Hartford,4,4,0,0,NA,401175458,2020-02-15,
137,2,2:54,1374,1374,Brianne Stiers made Jumper. Assisted by Shamyjha Price.,26,25,1,29,0.5354439967662104,UMass Lowell,Hartford,4,4,0,0,NA,401175458,2020-02-15,UMass Lowell
138,2,2:25,1345,1345,Foul on Jaliena Sanchez.,26,25,1,0,0.5358861104097971,UMass Lowell,Hartford,4,4,0,0,NA,401175458,2020-02-15,
139,2,2:25,1345,1345,Irene Primo made Free Throw.,26,26,0,0,0.5,UMass Lowell,Hartford,4,4,0,0,NA,401175458,2020-02-15,Hartford
140,2,2:25,1345,1345,Irene Primo made Free Throw.,26,27,-1,12,0.46411388959020294,UMass Lowell,Hartford,4,4,0,0,NA,401175458,2020-02-15,Hartford
141,2,2:13,1333,1333,Foul on Denise Solis.,26,27,-1,0,0.4639286555442341,UMass Lowell,Hartford,4,4,0,0,NA,401175458,2020-02-15,
142,2,2:13,1333,1333,Denise Solis Turnover.,26,27,-1,17,0.4639286555442341,UMass Lowell,Hartford,4,4,0,0,NA,401175458,2020-02-15,
143,2,1:56,1316,1316,Foul on Jordan McLemore.,26,27,-1,0,0.4636616141633348,UMass Lowell,Hartford,4,4,0,0,NA,401175458,2020-02-15,
144,2,1:56,1316,1316,Jordan McLemore Turnover.,26,27,-1,15,0.4636616141633348,UMass Lowell,Hartford,4,4,0,0,NA,401175458,2020-02-15,
145,2,1:41,1301,1301,Jaliena Sanchez missed Three Point Jumper.,26,27,-1,6,0.46341976354906605,UMass Lowell,Hartford,4,4,0,0,NA,401175458,2020-02-15,
146,2,1:35,1295,1295,Kaylen Banwareesingh Offensive Rebound.,26,27,-1,0,0.4633209988679359,UMass Lowell,Hartford,4,4,0,0,NA,401175458,2020-02-15,
147,2,1:35,1295,1295,Kaylen Banwareesingh made Layup.,28,27,1,15,0.5366790011320641,UMass Lowell,Hartford,4,4,0,0,NA,401175458,2020-02-15,UMass Lowell
148,2,1:20,1280,1280,Jada Lucas made Jumper.,28,29,-1,21,0.4630681023140931,UMass Lowell,Hartford,4,4,0,0,NA,401175458,2020-02-15,Hartford
149,2,0:59,1259,1259,Foul on Sierra Smith.,28,29,-1,0,0.4626970978351408,UMass Lowell,Hartford,4,4,0,0,NA,401175458,2020-02-15,
150,2,0:59,1259,1259,Denise Solis missed Free Throw.,28,29,-1,0,0.4626970978351408,UMass Lowell,Hartford,4,4,0,0,NA,401175458,2020-02-15,
151,2,0:59,1259,1259,UMass Lowell Deadball Team Rebound.,28,29,-1,0,0.4626970978351408,UMass Lowell,Hartford,4,4,0,0,NA,401175458,2020-02-15,
152,2,0:59,1259,1259,Denise Solis made Free Throw.,29,29,0,18,0.5,UMass Lowell,Hartford,4,4,0,0,NA,401175458,2020-02-15,UMass Lowell
153,2,0:41,1241,1241,Carmen Villalobos missed Jumper.,29,29,0,4,0.5,UMass Lowell,Hartford,4,4,0,0,NA,401175458,2020-02-15,
154,2,0:37,1237,1237,Kharis Idom Defensive Rebound.,29,29,0,10,0.5,UMass Lowell,Hartford,4,4,0,0,NA,401175458,2020-02-15,
155,2,0:27,1227,1227,Kaylen Banwareesingh Turnover.,29,29,0,0,0.5,UMass Lowell,Hartford,4,4,0,0,NA,401175458,2020-02-15,
156,2,0:27,1227,1227,Carmen Villalobos Steal.,29,29,0,14,0.5,UMass Lowell,Hartford,4,4,0,0,NA,401175458,2020-02-15,
157,2,0:13,1213,1213,Foul on Kharis Idom.,29,29,0,0,0.5,UMass Lowell,Hartford,4,4,0,0,NA,401175458,2020-02-15,
158,2,0:13,1213,1213,Jordan McLemore made Free Throw.,29,30,-1,0,0.46179475602345627,UMass Lowell,Hartford,4,4,0,0,NA,401175458,2020-02-15,Hartford
159,2,0:13,1213,1213,Jordan McLemore made Free Throw.,29,31,-2,11,0.42403304984617596,UMass Lowell,Hartford,4,4,0,0,NA,401175458,2020-02-15,Hartford
160,2,0:02,1202,1202,Jaliena Sanchez missed Three Point Jumper.,29,31,-2,0,0.4235732994515121,UMass Lowell,Hartford,4,4,0,0,NA,401175458,2020-02-15,
161,2,0:02,1202,1202,Hartford Deadball Team Rebound.,29,31,-2,2,0.4235732994515121,UMass Lowell,Hartford,4,4,0,0,NA,401175458,2020-02-15,
162,2,0:00,1200,1200,End of 2nd Quarter,29,31,-2,11,0.4234906714856242,UMass Lowell,Hartford,4,4,0,0,NA,401175458,2020-02-15,
163,3,9:49,1189,1189,Felicia Korte missed Three Point Jumper.,29,31,-2,0,0.42304187009185584,UMass Lowell,Hartford,5,5,0,0,NA,401175458,2020-02-15,
164,3,9:49,1189,1189,Carmen Villalobos Block.,29,31,-2,1,0.42304187009185584,UMass Lowell,Hartford,5,5,0,0,NA,401175458,2020-02-15,
165,3,9:48,1188,1188,UMass Lowell Offensive Rebound.,29,31,-2,19,0.42300150680498616,UMass Lowell,Hartford,5,5,0,0,NA,401175458,2020-02-15,
166,3,9:29,1169,1169,Jaliena Sanchez missed Layup.,29,31,-2,7,0.4222458111841209,UMass Lowell,Hartford,5,5,0,0,NA,401175458,2020-02-15,
167,3,9:22,1162,1162,Sierra Smith Defensive Rebound.,29,31,-2,12,0.4219716699447861,UMass Lowell,Hartford,5,5,0,0,NA,401175458,2020-02-15,
168,3,9:10,1150,1150,Sierra Smith made Layup.,29,33,-4,12,0.34678634598821395,UMass Lowell,Hartford,5,5,0,0,NA,401175458,2020-02-15,Hartford
169,3,8:58,1138,1138,Chasidey Willis missed Jumper.,29,33,-4,5,0.3459242587367687,UMass Lowell,Hartford,5,5,0,0,NA,401175458,2020-02-15,
170,3,8:53,1133,1133,Sierra Smith Defensive Rebound.,29,33,-4,6,0.34556554453054034,UMass Lowell,Hartford,5,5,0,0,NA,401175458,2020-02-15,
171,3,8:47,1127,1127,Carmen Villalobos missed Three Point Jumper.,29,33,-4,3,0.34513484255265464,UMass Lowell,Hartford,5,5,0,0,NA,401175458,2020-02-15,
172,3,8:44,1124,1124,UMass Lowell Deadball Team Rebound.,29,33,-4,24,0.34491923625887044,UMass Lowell,Hartford,5,5,0,0,NA,401175458,2020-02-15,
173,3,8:20,1100,1100,Chasidey Willis missed Layup.,29,33,-4,3,0.34317951743952047,UMass Lowell,Hartford,5,5,0,0,NA,401175458,2020-02-15,
174,3,8:17,1097,1097,Kharis Idom Offensive Rebound.,29,33,-4,6,0.3429592043869802,UMass Lowell,Hartford,5,5,0,0,NA,401175458,2020-02-15,
175,3,8:11,1091,1091,Brianne Stiers Turnover.,29,33,-4,0,0.3425159565078259,UMass Lowell,Hartford,5,5,0,0,NA,401175458,2020-02-15,
176,3,8:11,1091,1091,Carmen Villalobos Steal.,29,33,-4,17,0.3425159565078259,UMass Lowell,Hartford,5,5,0,0,NA,401175458,2020-02-15,
177,3,7:54,1074,1074,Kaela Dothard missed Three Point Jumper.,29,33,-4,3,0.34123700228733395,UMass Lowell,Hartford,5,5,0,0,NA,401175458,2020-02-15,
178,3,7:51,1071,1071,Felicia Korte Defensive Rebound.,29,33,-4,6,0.34100713471164035,UMass Lowell,Hartford,5,5,0,0,NA,401175458,2020-02-15,
179,3,7:45,1065,1065,Kharis Idom made Three Point Jumper. Assisted by Jaliena Sanchez.,32,33,-1,21,0.4587890159439579,UMass Lowell,Hartford,5,5,0,0,NA,401175458,2020-02-15,UMass Lowell
180,3,7:24,1044,1044,Kaela Dothard missed Three Point Jumper.,32,33,-1,5,0.4583251553583368,UMass Lowell,Hartford,5,5,0,0,NA,401175458,2020-02-15,
181,3,7:19,1039,1039,Carmen Villalobos Offensive Rebound.,32,33,-1,11,0.45821079184598656,UMass Lowell,Hartford,5,5,0,0,NA,401175458,2020-02-15,
182,3,7:08,1028,1028,Carmen Villalobos Turnover.,32,33,-1,0,0.457953150009164,UMass Lowell,Hartford,5,5,0,0,NA,401175458,2020-02-15,
183,3,7:08,1028,1028,Jaliena Sanchez Steal.,32,33,-1,6,0.457953150009164,UMass Lowell,Hartford,5,5,0,0,NA,401175458,2020-02-15,
184,3,7:02,1022,1022,Kharis Idom made Three Point Jumper. Assisted by Jaliena Sanchez.,35,33,2,3,0.5837856881015432,UMass Lowell,Hartford,5,5,0,0,NA,401175458,2020-02-15,UMass Lowell
185,3,6:59,1019,1019,Hartford  Timeout,35,33,2,17,0.5839289883310537,UMass Lowell,Hartford,5,4,0,1,NA,401175458,2020-02-15,
186,3,6:42,1002,1002,Jada Lucas made Jumper. Assisted by Jordan McLemore.,35,35,0,25,0.5,UMass Lowell,Hartford,5,4,0,1,NA,401175458,2020-02-15,Hartford
187,3,6:17,977,977,Kharis Idom made Jumper.,37,35,2,14,0.5860996687683028,UMass Lowell,Hartford,5,4,0,1,NA,401175458,2020-02-15,UMass Lowell
188,3,6:03,963,963,Jada Lucas Turnover.,37,35,2,18,0.586887815195561,UMass Lowell,Hartford,5,4,0,1,NA,401175458,2020-02-15,
189,3,5:45,945,945,Jaliena Sanchez Turnover.,37,35,2,14,0.5878294431560722,UMass Lowell,Hartford,5,4,0,0,NA,401175458,2020-02-15,
