play_id,period,time_remaining_period,secs_remaining,secs_remaining_absolute,description,home_score,away_score,score_diff,play_length,win_prob,home,away,home_time_out_remaining,away_time_out_remaining,home_timeout_ind,away_timeout_ind,home_favored_by,game_id,date,whichScored
198,3,2:56,776,776,Mary Kate Ulasewicz Defensive Rebound.,32,27,5,30,0.7252831498480766,Holy Cross,Navy,5,5,0,0,NA,401179274,2020-01-29,
199,3,2:26,746,746,Mary Kate Ulasewicz missed Layup.,32,27,5,2,0.7296404458325784,Holy Cross,Navy,5,5,0,0,NA,401179274,2020-01-29,
200,3,2:24,744,744,Megan Swords Defensive Rebound.,32,27,5,7,0.7299615464195964,Holy Cross,Navy,5,5,0,0,NA,401179274,2020-01-29,
201,3,2:17,737,737,Lauren Manis made Layup. Assisted by Addisyn Cross.,34,27,7,30,0.8022513841185037,Holy Cross,Navy,5,5,0,0,NA,401179274,2020-01-29,Holy Cross
202,3,1:47,707,707,Montana Braxton missed Jumper.,34,27,7,3,0.8077917303160994,Holy Cross,Navy,5,5,0,0,NA,401179274,2020-01-29,
203,3,1:44,704,704,Lauren Manis Defensive Rebound.,34,27,7,7,0.8082856246551913,Holy Cross,Navy,5,5,0,0,NA,401179274,2020-01-29,
204,3,1:37,697,697,Foul on Jasmine Bishop.,34,27,7,0,0.8094026206235951,Holy Cross,Navy,5,5,0,0,NA,401179274,2020-01-29,
205,3,1:37,697,697,Addisyn Cross made Free Throw.,35,27,8,0,0.8392588251531121,Holy Cross,Navy,5,5,0,0,NA,401179274,2020-01-29,Holy Cross
206,3,1:37,697,697,Addisyn Cross made Free Throw.,36,27,9,20,0.8652169867083822,Holy Cross,Navy,5,5,0,0,NA,401179274,2020-01-29,Holy Cross
207,3,1:17,677,677,Foul on Oluchi Ezemma.,36,27,9,0,0.8681102890207785,Holy Cross,Navy,5,5,0,0,NA,401179274,2020-01-29,
208,3,1:17,677,677,Mary Kate Ulasewicz made Free Throw.,36,28,8,0,0.8422386812001943,Holy Cross,Navy,5,5,0,0,NA,401179274,2020-01-29,Navy
209,3,1:17,677,677,Mary Kate Ulasewicz made Free Throw.,36,29,7,13,0.8123888551626656,Holy Cross,Navy,5,5,0,0,NA,401179274,2020-01-29,Navy
210,3,1:04,664,664,Lauren Manis missed Three Point Jumper.,36,29,7,3,0.8142370956433438,Holy Cross,Navy,5,5,0,0,NA,401179274,2020-01-29,
211,3,1:01,661,661,Megan Swords Offensive Rebound.,36,29,7,4,0.8146601158824072,Holy Cross,Navy,5,5,0,0,NA,401179274,2020-01-29,
212,3,0:57,657,657,Lauren Manis missed Layup.,36,29,7,3,0.815224283271291,Holy Cross,Navy,5,5,0,0,NA,401179274,2020-01-29,
213,3,0:54,654,654,Sophie Gatzounas Defensive Rebound.,36,29,7,16,0.8156483206659235,Holy Cross,Navy,5,5,0,0,NA,401179274,2020-01-29,
214,3,0:38,638,638,Sophie Gatzounas made Three Point Jumper. Assisted by Montana Braxton.,36,32,4,32,0.7023640555034405,Holy Cross,Navy,5,5,0,0,NA,401179274,2020-01-29,Navy
215,3,0:06,606,606,Avery LaBarbera missed Layup.,36,32,4,1,0.7064743549129108,Holy Cross,Navy,5,5,0,0,NA,401179274,2020-01-29,
216,3,0:05,605,605,Holy Cross Offensive Rebound.,36,32,4,3,0.706616837956274,Holy Cross,Navy,5,5,0,0,NA,401179274,2020-01-29,
217,3,0:02,602,602,Foul on Jasmine Bishop.,36,32,4,0,0.7070506531833336,Holy Cross,Navy,5,5,0,0,NA,401179274,2020-01-29,
218,3,0:02,602,602,Jenay Faulkner made Free Throw.,37,32,5,1,0.7505182572354953,Holy Cross,Navy,5,5,0,0,NA,401179274,2020-01-29,Holy Cross
219,3,0:01,601,601,Jenay Faulkner missed Free Throw.,37,32,5,1,0.7506841071132255,Holy Cross,Navy,5,5,0,0,NA,401179274,2020-01-29,
220,3,0:00,600,600,Morgan Taylor Defensive Rebound.,37,32,5,0,0.7508511955786001,Holy Cross,Navy,5,5,0,0,NA,401179274,2020-01-29,
221,3,0:00,600,600,End of 3rd Quarter,37,32,5,14,0.7508511955786001,Holy Cross,Navy,5,5,0,0,NA,401179274,2020-01-29,
222,4,9:46,586,586,Foul on Mary Kate Ulasewicz.,37,32,5,7,0.7533309293646677,Holy Cross,Navy,6,6,0,0,NA,401179274,2020-01-29,
223,4,9:39,579,579,Megan Swords made Layup. Assisted by Kathryn Pedi.,39,32,7,27,0.8282414548387923,Holy Cross,Navy,6,6,0,0,NA,401179274,2020-01-29,Holy Cross
224,4,9:12,552,552,Mary Kate Ulasewicz made Three Point Jumper.,39,35,4,27,0.7160888345818271,Holy Cross,Navy,6,6,0,0,NA,401179274,2020-01-29,Navy
225,4,8:45,525,525,Avery LaBarbera Turnover.,39,35,4,0,0.7214312953635538,Holy Cross,Navy,6,6,0,0,NA,401179274,2020-01-29,
226,4,8:45,525,525,Mary Kate Ulasewicz Steal.,39,35,4,5,0.7214312953635538,Holy Cross,Navy,6,6,0,0,NA,401179274,2020-01-29,
227,4,8:40,520,520,Mary Kate Ulasewicz missed Layup.,39,35,4,0,0.7222784835391659,Holy Cross,Navy,6,6,0,0,NA,401179274,2020-01-29,
228,4,8:40,520,520,Megan Swords Block.,39,35,4,4,0.7222784835391659,Holy Cross,Navy,6,6,0,0,NA,401179274,2020-01-29,
229,4,8:36,516,516,Madalyn Smith Defensive Rebound.,39,35,4,3,0.722937818613092,Holy Cross,Navy,6,6,0,0,NA,401179274,2020-01-29,
230,4,8:33,513,513,Avery LaBarbera missed Layup.,39,35,4,0,0.7234242526632252,Holy Cross,Navy,6,6,0,0,NA,401179274,2020-01-29,
231,4,8:33,513,513,Nyah Garrison Block.,39,35,4,0,0.7234242526632252,Holy Cross,Navy,6,6,0,0,NA,401179274,2020-01-29,
232,4,8:33,513,513,Holy Cross Offensive Rebound.,39,35,4,12,0.7234242526632252,Holy Cross,Navy,6,6,0,0,NA,401179274,2020-01-29,
233,4,8:21,501,501,Foul on Morgan Taylor.,39,35,4,0,0.7253368267247017,Holy Cross,Navy,6,6,0,0,NA,401179274,2020-01-29,
234,4,8:21,501,501,Madalyn Smith missed Free Throw.,39,35,4,0,0.7253368267247017,Holy Cross,Navy,6,6,0,0,NA,401179274,2020-01-29,
235,4,8:21,501,501,Holy Cross Offensive Rebound.,39,35,4,0,0.7253368267247017,Holy Cross,Navy,6,6,0,0,NA,401179274,2020-01-29,
236,4,8:21,501,501,Madalyn Smith missed Free Throw.,39,35,4,4,0.7253368267247017,Holy Cross,Navy,6,6,0,0,NA,401179274,2020-01-29,
237,4,8:17,497,497,Avery LaBarbera Offensive Rebound.,39,35,4,17,0.7259752500374926,Holy Cross,Navy,6,6,0,0,NA,401179274,2020-01-29,
238,4,8:00,480,480,Lauren Manis missed Jumper.,39,35,4,3,0.7288148874715404,Holy Cross,Navy,6,6,0,0,NA,401179274,2020-01-29,
239,4,7:57,477,477,Mary Kate Ulasewicz Defensive Rebound.,39,35,4,3,0.7293518527508529,Holy Cross,Navy,6,6,0,0,NA,401179274,2020-01-29,
240,4,7:54,474,474,Foul on Madalyn Smith.,39,35,4,0,0.7299037265679399,Holy Cross,Navy,6,6,0,0,NA,401179274,2020-01-29,
241,4,7:54,474,474,Sophie Gatzounas made Free Throw.,39,36,3,0,0.678219344933511,Holy Cross,Navy,6,6,0,0,NA,401179274,2020-01-29,Navy
242,4,7:54,474,474,Sophie Gatzounas missed Free Throw.,39,36,3,2,0.678219344933511,Holy Cross,Navy,6,6,0,0,NA,401179274,2020-01-29,
243,4,7:52,472,472,Madalyn Smith Defensive Rebound.,39,36,3,7,0.6785323980344573,Holy Cross,Navy,6,6,0,0,NA,401179274,2020-01-29,
244,4,7:45,465,465,Lauren Manis made Layup.,41,36,5,0,0.7779667797537851,Holy Cross,Navy,6,6,0,0,NA,401179274,2020-01-29,Holy Cross
245,4,7:45,465,465,Foul on Nyah Garrison.,41,36,5,0,0.7779667797537851,Holy Cross,Navy,6,6,0,0,NA,401179274,2020-01-29,
246,4,7:45,465,465,Lauren Manis made Free Throw.,42,36,6,19,0.8182637377376852,Holy Cross,Navy,6,6,0,0,NA,401179274,2020-01-29,Holy Cross
247,4,7:26,446,446,Morgan Taylor made Three Point Jumper. Assisted by Sophie Gatzounas.,42,39,3,15,0.6833470333217594,Holy Cross,Navy,6,6,0,0,NA,401179274,2020-01-29,Navy
248,4,7:11,431,431,Lauren Manis made Jumper.,44,39,5,5,0.7875076950743103,Holy Cross,Navy,6,6,0,0,NA,401179274,2020-01-29,Holy Cross
249,4,7:06,426,426,Sophie Gatzounas Turnover.,44,39,5,0,0.7892328311961248,Holy Cross,Navy,6,6,0,0,NA,401179274,2020-01-29,
250,4,7:06,426,426,Avery LaBarbera Steal.,44,39,5,5,0.7892328311961248,Holy Cross,Navy,6,6,0,0,NA,401179274,2020-01-29,
251,4,7:01,421,421,Avery LaBarbera missed Layup.,44,39,5,2,0.7908903087546636,Holy Cross,Navy,6,6,0,0,NA,401179274,2020-01-29,
252,4,6:59,419,419,Sophie Gatzounas Defensive Rebound.,44,39,5,22,0.7915358414514974,Holy Cross,Navy,6,6,0,0,NA,401179274,2020-01-29,
253,4,6:37,397,397,Morgan Taylor missed Three Point Jumper.,44,39,5,3,0.7982034442477217,Holy Cross,Navy,6,6,0,0,NA,401179274,2020-01-29,
254,4,6:34,394,394,Lauren Manis Defensive Rebound.,44,39,5,7,0.7990798691425827,Holy Cross,Navy,6,6,0,0,NA,401179274,2020-01-29,
255,4,6:27,387,387,Foul on Montana Braxton.,44,39,5,5,0.8011249085717479,Holy Cross,Navy,6,6,0,0,NA,401179274,2020-01-29,
256,4,6:22,382,382,Avery LaBarbera missed Three Point Jumper.,44,39,5,3,0.8025975179628169,Holy Cross,Navy,6,6,0,0,NA,401179274,2020-01-29,
257,4,6:19,379,379,Morgan Taylor Defensive Rebound.,44,39,5,12,0.8034904634498314,Holy Cross,Navy,6,6,0,0,NA,401179274,2020-01-29,
258,4,6:07,367,367,Mary Kate Ulasewicz Turnover.,44,39,5,17,0.8071773978104729,Holy Cross,Navy,6,6,0,0,NA,401179274,2020-01-29,
259,4,5:50,350,350,Megan Swords missed Layup.,44,39,5,3,0.8129021184114177,Holy Cross,Navy,6,6,0,0,NA,401179274,2020-01-29,
260,4,5:47,347,347,Morgan Taylor Defensive Rebound.,44,39,5,25,0.8139947494593756,Holy Cross,Navy,6,6,0,0,NA,401179274,2020-01-29,
261,4,5:22,322,322,Morgan Taylor made Jumper.,44,41,3,20,0.7166160054695517,Holy Cross,Navy,6,6,0,0,NA,401179274,2020-01-29,Navy
262,4,5:02,302,302,Jenay Faulkner made Jumper.,46,41,5,23,0.8335144406752024,Holy Cross,Navy,6,6,0,0,NA,401179274,2020-01-29,Holy Cross
263,4,4:39,279,279,Morgan Taylor Turnover.,46,41,5,0,0.8347878609041741,Holy Cross,Navy,6,6,0,0,NA,401179274,2020-01-29,
264,4,4:39,279,279,Addisyn Cross Steal.,46,41,5,4,0.8347878609041741,Holy Cross,Navy,6,6,0,0,NA,401179274,2020-01-29,
265,4,4:35,275,275,Foul on Mary Kate Ulasewicz.,46,41,5,0,0.8342161475611947,Holy Cross,Navy,6,6,0,0,NA,401179274,2020-01-29,
266,4,4:35,275,275,Official TV Timeout,46,41,5,0,0.8342161475611947,Holy Cross,Navy,6,6,0,0,NA,401179274,2020-01-29,
267,4,4:35,275,275,Addisyn Cross made Free Throw.,47,41,6,1,0.8742388589940389,Holy Cross,Navy,6,6,0,0,NA,401179274,2020-01-29,Holy Cross
268,4,4:34,274,274,Addisyn Cross missed Free Throw.,47,41,6,1,0.8740813049350525,Holy Cross,Navy,6,6,0,0,NA,401179274,2020-01-29,
269,4,4:33,273,273,Sophie Gatzounas Defensive Rebound.,47,41,6,26,0.8739164054646431,Holy Cross,Navy,6,6,0,0,NA,401179274,2020-01-29,
270,4,4:07,247,247,Sophie Gatzounas missed Three Point Jumper.,47,41,6,3,0.8690167721899124,Holy Cross,Navy,6,6,0,0,NA,401179274,2020-01-29,
271,4,4:04,244,244,Avery LaBarbera Defensive Rebound.,47,41,6,22,0.8686466222101092,Holy Cross,Navy,6,6,0,0,NA,401179274,2020-01-29,
272,4,3:42,222,222,Jenay Faulkner Turnover.,47,41,6,0,0.8701581443680735,Holy Cross,Navy,6,6,0,0,NA,401179274,2020-01-29,
273,4,3:42,222,222,Mary Kate Ulasewicz Steal.,47,41,6,9,0.8701581443680735,Holy Cross,Navy,6,6,0,0,NA,401179274,2020-01-29,
274,4,3:33,213,213,Jasmine Bishop made Layup. Assisted by Sophie Gatzounas.,47,43,4,7,0.7841865546690908,Holy Cross,Navy,6,6,0,0,NA,401179274,2020-01-29,Navy
275,4,3:26,206,206,Official TV Timeout,47,43,4,13,0.7887347862550862,Holy Cross,Navy,6,6,0,0,NA,401179274,2020-01-29,
276,4,3:13,193,193,Avery LaBarbera missed Three Point Jumper.,47,43,4,4,0.8014511399616482,Holy Cross,Navy,6,6,0,0,NA,401179274,2020-01-29,
277,4,3:09,189,189,Jenay Faulkner Offensive Rebound.,47,43,4,8,0.8065182385751074,Holy Cross,Navy,6,6,0,0,NA,401179274,2020-01-29,
278,4,3:01,181,181,Avery LaBarbera made Three Point Jumper.,50,43,7,25,0.931852092833149,Holy Cross,Navy,6,6,0,0,NA,401179274,2020-01-29,Holy Cross
279,4,2:36,156,156,Mary Kate Ulasewicz missed Three Point Jumper.,50,43,7,5,0.9528211522163565,Holy Cross,Navy,6,6,0,0,NA,401179274,2020-01-29,
280,4,2:31,151,151,Avery LaBarbera Defensive Rebound.,50,43,7,16,0.9565230442441285,Holy Cross,Navy,6,6,0,0,NA,401179274,2020-01-29,
281,4,2:15,135,135,Avery LaBarbera made Three Point Jumper.,53,43,10,18,0.9921884291235502,Holy Cross,Navy,6,6,0,0,NA,401179274,2020-01-29,Holy Cross
282,4,1:57,117,117,Sophie Gatzounas missed Three Point Jumper.,53,43,10,4,0.9955662069413507,Holy Cross,Navy,6,6,0,0,NA,401179274,2020-01-29,
283,4,1:53,113,113,Megan Swords Defensive Rebound.,53,43,10,26,0.9961509401879491,Holy Cross,Navy,6,6,0,0,NA,401179274,2020-01-29,
284,4,1:27,87,87,Avery LaBarbera missed Layup.,53,43,10,3,0.9986873679623053,Holy Cross,Navy,6,6,0,0,NA,401179274,2020-01-29,
285,4,1:24,84,84,Mary Kate Ulasewicz Defensive Rebound.,53,43,10,6,0.9988547692655355,Holy Cross,Navy,6,6,0,0,NA,401179274,2020-01-29,
286,4,1:18,78,78,Mary Kate Ulasewicz missed Jumper.,53,43,10,3,0.9991346804655409,Holy Cross,Navy,6,6,0,0,NA,401179274,2020-01-29,
287,4,1:15,75,75,Holy Cross Defensive Rebound.,53,43,10,19,0.9992513270545244,Holy Cross,Navy,6,6,0,0,NA,401179274,2020-01-29,
288,4,0:56,56,56,Megan Swords made Jumper.,55,43,12,14,0.9999456486257016,Holy Cross,Navy,6,6,0,0,NA,401179274,2020-01-29,Holy Cross
289,4,0:42,42,42,Sophie Gatzounas missed Three Point Jumper.,55,43,12,4,0.9999790820957565,Holy Cross,Navy,6,6,0,0,NA,401179274,2020-01-29,
290,4,0:38,38,38,Megan Swords Defensive Rebound.,55,43,12,25,0.9999843156673341,Holy Cross,Navy,6,6,0,0,NA,401179274,2020-01-29,
291,4,0:13,13,13,Megan Swords made Layup. Assisted by Avery LaBarbera.,57,43,14,9,0.9999997398562088,Holy Cross,Navy,6,6,0,0,NA,401179274,2020-01-29,Holy Cross
292,4,0:04,4,4,Mimi Schrader missed Layup.,57,43,14,2,0.9999998936301184,Holy Cross,Navy,6,6,0,0,NA,401179274,2020-01-29,
293,4,0:02,2,2,Kathryn Pedi Defensive Rebound.,57,43,14,2,0.9999999132183136,Holy Cross,Navy,6,6,0,0,NA,401179274,2020-01-29,
294,4,0:00,0,0,End of 4th Quarter,57,43,14,0,1,Holy Cross,Navy,6,6,0,0,NA,401179274,2020-01-29,
295,4,0:00,0,0,End of Game,57,43,14,0,1,Holy Cross,Navy,6,6,0,0,NA,401179274,2020-01-29,
