play_id,period,time_remaining_period,secs_remaining,secs_remaining_absolute,description,home_score,away_score,score_diff,play_length,win_prob,home,away,home_time_out_remaining,away_time_out_remaining,home_timeout_ind,away_timeout_ind,home_favored_by,game_id,date,whichScored
1,1,9:46,2386,2386,Victoria Cardaci missed Three Point Jumper.,0,0,0,4,0.5,Seton Hall,St. John's,4,4,0,0,NA,401121509,2019-03-09,NA
2,1,9:42,2382,2382,Shadeen Samuels Offensive Rebound.,0,0,0,4,0.5,Seton Hall,St. John's,4,4,0,0,NA,401121509,2019-03-09,
3,1,9:38,2378,2378,Nicole Jimenez missed Three Point Jumper.,0,0,0,4,0.5,Seton Hall,St. John's,4,4,0,0,NA,401121509,2019-03-09,
4,1,9:34,2374,2374,Selena Philoxy Offensive Rebound.,0,0,0,5,0.5,Seton Hall,St. John's,4,4,0,0,NA,401121509,2019-03-09,
5,1,9:29,2369,2369,Inja Butina made Three Point Jumper. Assisted by Nicole Jimenez.,3,0,3,24,0.5668006792331098,Seton Hall,St. John's,4,4,0,0,NA,401121509,2019-03-09,Seton Hall
6,1,9:05,2345,2345,Curteeona Brelove made Layup. Assisted by Tiana England.,3,2,1,19,0.5226459033254919,Seton Hall,St. John's,4,4,0,0,NA,401121509,2019-03-09,St. John's
7,1,8:46,2326,2326,Victoria Cardaci missed Three Point Jumper.,3,2,1,4,0.5228544235375375,Seton Hall,St. John's,4,4,0,0,NA,401121509,2019-03-09,
8,1,8:42,2322,2322,Alisha Kebbe Defensive Rebound.,3,2,1,17,0.5228986002520256,Seton Hall,St. John's,4,4,0,0,NA,401121509,2019-03-09,
9,1,8:25,2305,2305,Curteeona Brelove missed Jumper.,3,2,1,6,0.5230873662555565,Seton Hall,St. John's,4,4,0,0,NA,401121509,2019-03-09,
10,1,8:19,2299,2299,Shadeen Samuels Defensive Rebound.,3,2,1,7,0.5231543655278497,Seton Hall,St. John's,4,4,0,0,NA,401121509,2019-03-09,
11,1,8:12,2292,2292,Selena Philoxy made Layup. Assisted by Inja Butina.,5,2,3,24,0.5692995994139594,Seton Hall,St. John's,4,4,0,0,NA,401121509,2019-03-09,Seton Hall
12,1,7:48,2268,2268,Curteeona Brelove Turnover.,5,2,3,16,0.5700974089447075,Seton Hall,St. John's,4,4,0,0,NA,401121509,2019-03-09,
13,1,7:32,2252,2252,Inja Butina missed Layup.,5,2,3,0,0.5706332966885354,Seton Hall,St. John's,4,4,0,0,NA,401121509,2019-03-09,
14,1,7:32,2252,2252,Seton Hall Offensive Rebound.,5,2,3,6,0.5706332966885354,Seton Hall,St. John's,4,4,0,0,NA,401121509,2019-03-09,
15,1,7:26,2246,2246,Foul on Akina Wellere.,5,2,3,0,0.5708350031423882,Seton Hall,St. John's,4,4,0,0,NA,401121509,2019-03-09,
16,1,7:26,2246,2246,Nicole Jimenez made Three Point Jumper. Assisted by Inja Butina.,8,2,6,4,0.6388825786720808,Seton Hall,St. John's,4,4,0,0,NA,401121509,2019-03-09,Seton Hall
17,1,7:22,2242,2242,Foul on Victoria Cardaci.,8,2,6,20,0.6391362268834194,Seton Hall,St. John's,4,4,0,0,NA,401121509,2019-03-09,
18,1,7:02,2222,2222,Qadashah Hoppie missed Three Point Jumper.,8,2,6,3,0.6404080576134128,Seton Hall,St. John's,4,4,0,0,NA,401121509,2019-03-09,
19,1,6:59,2219,2219,Nicole Jimenez Defensive Rebound.,8,2,6,4,0.640599301012273,Seton Hall,St. John's,4,4,0,0,NA,401121509,2019-03-09,
20,1,6:55,2215,2215,Nicole Jimenez missed Three Point Jumper.,8,2,6,4,0.6408544633201061,Seton Hall,St. John's,4,4,0,0,NA,401121509,2019-03-09,
21,1,6:51,2211,2211,Inja Butina Offensive Rebound.,8,2,6,3,0.641109812296154,Seton Hall,St. John's,4,4,0,0,NA,401121509,2019-03-09,
22,1,6:48,2208,2208,Nicole Jimenez Turnover.,8,2,6,0,0.6413014407038973,Seton Hall,St. John's,4,4,0,0,NA,401121509,2019-03-09,
23,1,6:48,2208,2208,Alisha Kebbe Steal.,8,2,6,0,0.6413014407038973,Seton Hall,St. John's,4,4,0,0,NA,401121509,2019-03-09,
24,1,6:48,2208,2208,Foul on Shadeen Samuels.,8,2,6,12,0.6413014407038973,Seton Hall,St. John's,4,4,0,0,NA,401121509,2019-03-09,
25,1,6:36,2196,2196,Curteeona Brelove made Layup. Assisted by Qadashah Hoppie.,8,4,4,27,0.5961791766315144,Seton Hall,St. John's,4,4,0,0,NA,401121509,2019-03-09,St. John's
26,1,6:09,2169,2169,Victoria Cardaci missed Three Point Jumper.,8,4,4,4,0.5973887576949446,Seton Hall,St. John's,4,4,0,0,NA,401121509,2019-03-09,
27,1,6:05,2165,2165,Tiana England Defensive Rebound.,8,4,4,14,0.5975684241257823,Seton Hall,St. John's,4,4,0,0,NA,401121509,2019-03-09,
28,1,5:51,2151,2151,Qadashah Hoppie made Layup. Assisted by Curteeona Brelove.,8,6,2,13,0.5495822928983269,Seton Hall,St. John's,4,4,0,0,NA,401121509,2019-03-09,St. John's
29,1,5:38,2138,2138,Foul on Inja Butina.,8,6,2,0,0.549885098381004,Seton Hall,St. John's,4,4,0,0,NA,401121509,2019-03-09,
30,1,5:38,2138,2138,Inja Butina Turnover.,8,6,2,12,0.549885098381004,Seton Hall,St. John's,4,4,0,0,NA,401121509,2019-03-09,
31,1,5:26,2126,2126,Qadashah Hoppie made Layup.,8,8,0,0,0.5,Seton Hall,St. John's,4,4,0,0,NA,401121509,2019-03-09,St. John's
32,1,5:26,2126,2126,Foul on Nicole Jimenez.,8,8,0,0,0.5,Seton Hall,St. John's,4,4,0,0,NA,401121509,2019-03-09,
33,1,5:26,2126,2126,Qadashah Hoppie made Free Throw.,8,9,-1,13,0.47485363000024927,Seton Hall,St. John's,4,4,0,0,NA,401121509,2019-03-09,St. John's
34,1,5:13,2113,2113,Selena Philoxy Turnover.,8,9,-1,0,0.47469967745685804,Seton Hall,St. John's,4,4,0,0,NA,401121509,2019-03-09,
35,1,5:13,2113,2113,Qadashah Hoppie Steal.,8,9,-1,5,0.47469967745685804,Seton Hall,St. John's,4,4,0,0,NA,401121509,2019-03-09,
36,1,5:08,2108,2108,Qadashah Hoppie missed Layup.,8,9,-1,0,0.47464025620671896,Seton Hall,St. John's,4,4,0,0,NA,401121509,2019-03-09,
37,1,5:08,2108,2108,Seton Hall Defensive Rebound.,8,9,-1,13,0.47464025620671896,Seton Hall,St. John's,4,4,0,0,NA,401121509,2019-03-09,
38,1,4:55,2095,2095,Foul on Qadashah Hoppie.,8,9,-1,0,0.47448519763638625,Seton Hall,St. John's,4,4,0,0,NA,401121509,2019-03-09,
39,1,4:55,2095,2095,Official TV Timeout,8,9,-1,0,0.47448519763638625,Seton Hall,St. John's,4,4,0,0,NA,401121509,2019-03-09,
40,1,4:55,2095,2095,Selena Philoxy missed Free Throw.,8,9,-1,0,0.47448519763638625,Seton Hall,St. John's,4,4,0,0,NA,401121509,2019-03-09,
41,1,4:55,2095,2095,Seton Hall Offensive Rebound.,8,9,-1,0,0.47448519763638625,Seton Hall,St. John's,4,4,0,0,NA,401121509,2019-03-09,
42,1,4:55,2095,2095,Selena Philoxy made Free Throw.,9,9,0,18,0.5,Seton Hall,St. John's,4,4,0,0,NA,401121509,2019-03-09,Seton Hall
43,1,4:37,2077,2077,Tiana England missed Jumper.,9,9,0,6,0.5,Seton Hall,St. John's,4,4,0,0,NA,401121509,2019-03-09,
44,1,4:31,2071,2071,Shadeen Samuels Defensive Rebound.,9,9,0,6,0.5,Seton Hall,St. John's,4,4,0,0,NA,401121509,2019-03-09,
45,1,4:25,2065,2065,Inja Butina made Layup.,11,9,2,23,0.5516135883166307,Seton Hall,St. John's,4,4,0,0,NA,401121509,2019-03-09,Seton Hall
46,1,4:02,2042,2042,Kadaja Bailey missed Layup.,11,9,2,5,0.552169416407975,Seton Hall,St. John's,4,4,0,0,NA,401121509,2019-03-09,
47,1,3:57,2037,2037,Kadaja Bailey Offensive Rebound.,11,9,2,0,0.5522910399063109,Seton Hall,St. John's,4,4,0,0,NA,401121509,2019-03-09,
48,1,3:57,2037,2037,Kadaja Bailey missed Layup.,11,9,2,1,0.5522910399063109,Seton Hall,St. John's,4,4,0,0,NA,401121509,2019-03-09,
49,1,3:56,2036,2036,Kaity Healy Defensive Rebound.,11,9,2,10,0.5523153994888015,Seton Hall,St. John's,4,4,0,0,NA,401121509,2019-03-09,
50,1,3:46,2026,2026,Shadeen Samuels made Three Point Jumper. Assisted by Inja Butina.,14,9,5,23,0.6289104202996048,Seton Hall,St. John's,4,4,0,0,NA,401121509,2019-03-09,Seton Hall
51,1,3:23,2003,2003,Foul on Nicole Jimenez.,14,9,5,0,0.6302462094067853,Seton Hall,St. John's,4,4,0,0,NA,401121509,2019-03-09,
52,1,3:23,2003,2003,Akina Wellere made Free Throw.,14,10,4,0,0.6050659230523384,Seton Hall,St. John's,4,4,0,0,NA,401121509,2019-03-09,St. John's
53,1,3:23,2003,2003,Akina Wellere made Free Throw.,14,11,3,15,0.5793154589040159,Seton Hall,St. John's,4,4,0,0,NA,401121509,2019-03-09,St. John's
54,1,3:08,1988,1988,Desiree Elmore missed Layup.,14,11,3,3,0.5798670647020376,Seton Hall,St. John's,4,4,0,0,NA,401121509,2019-03-09,
55,1,3:05,1985,1985,Kayla Charles Defensive Rebound.,14,11,3,4,0.5799778985854955,Seton Hall,St. John's,4,4,0,0,NA,401121509,2019-03-09,
56,1,3:01,1981,1981,Tiana England made Layup.,14,13,1,7,0.5269148283875164,Seton Hall,St. John's,4,4,0,0,NA,401121509,2019-03-09,St. John's
57,1,2:54,1974,1974,Foul on Kayla Charles.,14,13,1,7,0.5270034736865027,Seton Hall,St. John's,4,4,0,0,NA,401121509,2019-03-09,
58,1,2:47,1967,1967,Kaela Hilaire Turnover.,14,13,1,16,0.5270924645208734,Seton Hall,St. John's,4,4,0,0,NA,401121509,2019-03-09,
59,1,2:31,1951,1951,Alisha Kebbe missed Three Point Jumper.,14,13,1,4,0.5272972009707604,Seton Hall,St. John's,4,4,0,0,NA,401121509,2019-03-09,
60,1,2:27,1947,1947,Inja Butina Defensive Rebound.,14,13,1,7,0.5273486800835742,Seton Hall,St. John's,4,4,0,0,NA,401121509,2019-03-09,
61,1,2:20,1940,1940,Desiree Elmore missed Three Point Jumper.,14,13,1,4,0.5274390583629032,Seton Hall,St. John's,4,4,0,0,NA,401121509,2019-03-09,
62,1,2:16,1936,1936,Qadashah Hoppie Defensive Rebound.,14,13,1,20,0.5274908705830678,Seton Hall,St. John's,4,4,0,0,NA,401121509,2019-03-09,
63,1,1:56,1916,1916,Curteeona Brelove missed Jumper.,14,13,1,3,0.5277508047131695,Seton Hall,St. John's,4,4,0,0,NA,401121509,2019-03-09,
64,1,1:53,1913,1913,Shadeen Samuels Defensive Rebound.,14,13,1,4,0.5277897543069698,Seton Hall,St. John's,4,4,0,0,NA,401121509,2019-03-09,
65,1,1:49,1909,1909,Kaela Hilaire missed Jumper.,14,13,1,3,0.5278416688584938,Seton Hall,St. John's,4,4,0,0,NA,401121509,2019-03-09,
66,1,1:46,1906,1906,Curteeona Brelove Defensive Rebound.,14,13,1,6,0.5278805938103491,Seton Hall,St. John's,4,4,0,0,NA,401121509,2019-03-09,
67,1,1:40,1900,1900,Qadashah Hoppie missed Three Point Jumper.,14,13,1,2,0.5279584246133091,Seton Hall,St. John's,4,4,0,0,NA,401121509,2019-03-09,
68,1,1:38,1898,1898,Kaela Hilaire Defensive Rebound.,14,13,1,0,0.5279843648328633,Seton Hall,St. John's,4,4,0,0,NA,401121509,2019-03-09,
69,1,1:38,1898,1898,Foul on Alisha Kebbe.,14,13,1,15,0.5279843648328633,Seton Hall,St. John's,4,4,0,0,NA,401121509,2019-03-09,
70,1,1:23,1883,1883,Inja Butina missed Jumper.,14,13,1,4,0.5281789384956048,Seton Hall,St. John's,4,4,0,0,NA,401121509,2019-03-09,
71,1,1:19,1879,1879,Curteeona Brelove Defensive Rebound.,14,13,1,5,0.5282308520218978,Seton Hall,St. John's,4,4,0,0,NA,401121509,2019-03-09,
72,1,1:14,1874,1874,Qadashah Hoppie missed Layup.,14,13,1,3,0.528295774020342,Seton Hall,St. John's,4,4,0,0,NA,401121509,2019-03-09,
73,1,1:11,1871,1871,Kaela Hilaire Defensive Rebound.,14,13,1,18,0.5283347469942727,Seton Hall,St. John's,4,4,0,0,NA,401121509,2019-03-09,
74,1,0:53,1853,1853,Kaela Hilaire missed Three Point Jumper.,14,13,1,3,0.5285690234491967,Seton Hall,St. John's,4,4,0,0,NA,401121509,2019-03-09,
75,1,0:50,1850,1850,Alisha Kebbe Defensive Rebound.,14,13,1,0,0.5286081621878321,Seton Hall,St. John's,4,4,0,0,NA,401121509,2019-03-09,
76,1,0:50,1850,1850,Foul on Whitney Howell.,14,13,1,0,0.5286081621878321,Seton Hall,St. John's,4,4,0,0,NA,401121509,2019-03-09,
77,1,0:50,1850,1850,Alisha Kebbe made Free Throw.,14,14,0,0,0.5,Seton Hall,St. John's,4,4,0,0,NA,401121509,2019-03-09,St. John's
78,1,0:50,1850,1850,Alisha Kebbe made Free Throw.,14,15,-1,3,0.47139183781216787,Seton Hall,St. John's,4,4,0,0,NA,401121509,2019-03-09,St. John's
79,1,0:47,1847,1847,Inja Butina Turnover.,14,15,-1,0,0.47135266701007056,Seton Hall,St. John's,4,4,0,0,NA,401121509,2019-03-09,
80,1,0:47,1847,1847,Alisha Kebbe Steal.,14,15,-1,5,0.47135266701007056,Seton Hall,St. John's,4,4,0,0,NA,401121509,2019-03-09,
81,1,0:42,1842,1842,Tiana England made Layup. Assisted by Alisha Kebbe.,14,17,-3,25,0.41461197697464103,Seton Hall,St. John's,4,4,0,0,NA,401121509,2019-03-09,St. John's
82,1,0:17,1817,1817,Foul on Alisha Kebbe.,14,17,-3,0,0.41365213495932324,Seton Hall,St. John's,4,4,0,0,NA,401121509,2019-03-09,
83,1,0:17,1817,1817,Selena Philoxy made Free Throw.,15,17,-2,1,0.4421127563427323,Seton Hall,St. John's,4,4,0,0,NA,401121509,2019-03-09,Seton Hall
84,1,0:16,1816,1816,Selena Philoxy made Free Throw.,16,17,-1,5,0.4709455201683656,Seton Hall,St. John's,4,4,0,0,NA,401121509,2019-03-09,Seton Hall
85,1,0:11,1811,1811,Foul on Curteeona Brelove.,16,17,-1,0,0.4708793537659739,Seton Hall,St. John's,4,4,0,0,NA,401121509,2019-03-09,
86,1,0:11,1811,1811,Curteeona Brelove Turnover.,16,17,-1,7,0.4708793537659739,Seton Hall,St. John's,4,4,0,0,NA,401121509,2019-03-09,
87,1,0:04,1804,1804,Inja Butina missed Jumper.,16,17,-1,2,0.4707864419057754,Seton Hall,St. John's,4,4,0,0,NA,401121509,2019-03-09,
88,1,0:02,1802,1802,Qadashah Hoppie Defensive Rebound.,16,17,-1,2,0.4707598326384926,Seton Hall,St. John's,4,4,0,0,NA,401121509,2019-03-09,
89,1,0:00,1800,1800,End of 1st Quarter,16,17,-1,18,0.47073319422403154,Seton Hall,St. John's,4,4,0,0,NA,401121509,2019-03-09,
90,2,9:42,1782,1782,Desiree Elmore made Layup. Assisted by Nicole Jimenez.,18,17,1,14,0.5295079655044297,Seton Hall,St. John's,4,4,0,0,NA,401121509,2019-03-09,Seton Hall
91,2,9:28,1768,1768,Kayla Charles missed Layup.,18,17,1,2,0.5296974906908206,Seton Hall,St. John's,4,4,0,0,NA,401121509,2019-03-09,
92,2,9:26,1766,1766,Curteeona Brelove Offensive Rebound.,18,17,1,10,0.529724719528124,Seton Hall,St. John's,4,4,0,0,NA,401121509,2019-03-09,
93,2,9:16,1756,1756,Tiana England made Three Point Jumper. Assisted by Qadashah Hoppie.,18,20,-2,18,0.4404893030322197,Seton Hall,St. John's,4,4,0,0,NA,401121509,2019-03-09,St. John's
94,2,8:58,1738,1738,Desiree Elmore made Jumper. Assisted by Nicole Jimenez.,20,20,0,23,0.5,Seton Hall,St. John's,4,4,0,0,NA,401121509,2019-03-09,Seton Hall
95,2,8:35,1715,1715,Kayla Charles missed Layup.,20,20,0,2,0.5,Seton Hall,St. John's,4,4,0,0,NA,401121509,2019-03-09,
96,2,8:33,1713,1713,Desiree Elmore Defensive Rebound.,20,20,0,18,0.5,Seton Hall,St. John's,4,4,0,0,NA,401121509,2019-03-09,
97,2,8:15,1695,1695,Selena Philoxy made Layup. Assisted by Desiree Elmore.,22,20,2,27,0.5612130583715181,Seton Hall,St. John's,4,4,0,0,NA,401121509,2019-03-09,Seton Hall
98,2,7:48,1668,1668,Kayla Charles missed Jumper.,22,20,2,1,0.561982358897591,Seton Hall,St. John's,4,4,0,0,NA,401121509,2019-03-09,
99,2,7:47,1667,1667,Seton Hall Defensive Rebound.,22,20,2,0,0.5620103235065229,Seton Hall,St. John's,4,4,0,0,NA,401121509,2019-03-09,
100,2,7:47,1667,1667,Foul on Curteeona Brelove.,22,20,2,32,0.5620103235065229,Seton Hall,St. John's,4,4,0,0,NA,401121509,2019-03-09,
101,2,7:15,1635,1635,Qadashah Hoppie Turnover.,22,20,2,0,0.5628896360842337,Seton Hall,St. John's,4,4,0,0,NA,401121509,2019-03-09,
102,2,7:15,1635,1635,Kaela Hilaire Steal.,22,20,2,6,0.5628896360842337,Seton Hall,St. John's,4,4,0,0,NA,401121509,2019-03-09,
103,2,7:09,1629,1629,Kaela Hilaire Turnover.,22,20,2,22,0.5630519545099658,Seton Hall,St. John's,4,4,0,0,NA,401121509,2019-03-09,
104,2,6:47,1607,1607,Akina Wellere missed Jumper.,22,20,2,3,0.5636435717132413,Seton Hall,St. John's,4,4,0,0,NA,401121509,2019-03-09,
105,2,6:44,1604,1604,Kayla Charles Offensive Rebound.,22,20,2,2,0.5637240248420919,Seton Hall,St. John's,4,4,0,0,NA,401121509,2019-03-09,
106,2,6:42,1602,1602,Jasmine Sina made Three Point Jumper. Assisted by Tiana England.,22,23,-1,11,0.46798039573200534,Seton Hall,St. John's,4,4,0,0,NA,401121509,2019-03-09,St. John's
107,2,6:31,1591,1591,Nicole Jimenez Turnover.,22,23,-1,0,0.46783101236166724,Seton Hall,St. John's,4,4,0,0,NA,401121509,2019-03-09,
108,2,6:31,1591,1591,Kayla Charles Steal.,22,23,-1,3,0.46783101236166724,Seton Hall,St. John's,4,4,0,0,NA,401121509,2019-03-09,
109,2,6:28,1588,1588,Foul on Desiree Elmore.,22,23,-1,0,0.4677902179891035,Seton Hall,St. John's,4,4,0,0,NA,401121509,2019-03-09,
110,2,6:28,1588,1588,Akina Wellere missed Free Throw.,22,23,-1,0,0.4677902179891035,Seton Hall,St. John's,4,4,0,0,NA,401121509,2019-03-09,
111,2,6:28,1588,1588,St. John's Offensive Rebound.,22,23,-1,0,0.4677902179891035,Seton Hall,St. John's,4,4,0,0,NA,401121509,2019-03-09,
112,2,6:28,1588,1588,Akina Wellere made Free Throw.,22,24,-2,20,0.4358466646362419,Seton Hall,St. John's,4,4,0,0,NA,401121509,2019-03-09,St. John's
113,2,6:08,1568,1568,Shadeen Samuels missed Three Point Jumper.,22,24,-2,4,0.4353069521061968,Seton Hall,St. John's,4,4,0,0,NA,401121509,2019-03-09,
114,2,6:04,1564,1564,Kayla Charles Defensive Rebound.,22,24,-2,20,0.43519825304482407,Seton Hall,St. John's,4,4,0,0,NA,401121509,2019-03-09,
115,2,5:44,1544,1544,Akina Wellere Turnover.,22,24,-2,10,0.4346490701294855,Seton Hall,St. John's,4,4,0,0,NA,401121509,2019-03-09,
116,2,5:34,1534,1534,Foul on Tiana England.,22,24,-2,0,0.4343700047276928,Seton Hall,St. John's,4,4,0,0,NA,401121509,2019-03-09,
117,2,5:34,1534,1534,Selena Philoxy made Free Throw.,23,24,-1,0,0.46704242755452935,Seton Hall,St. John's,4,4,0,0,NA,401121509,2019-03-09,Seton Hall
118,2,5:34,1534,1534,Selena Philoxy missed Free Throw.,23,24,-1,1,0.46704242755452935,Seton Hall,St. John's,4,4,0,0,NA,401121509,2019-03-09,
119,2,5:33,1533,1533,Shadeen Samuels Offensive Rebound.,23,24,-1,12,0.4670281926181073,Seton Hall,St. John's,4,4,0,0,NA,401121509,2019-03-09,
120,2,5:21,1521,1521,Inja Butina made Layup.,25,24,1,0,0.5331442020535577,Seton Hall,St. John's,4,4,0,0,NA,401121509,2019-03-09,Seton Hall
121,2,5:21,1521,1521,Foul on Kayla Charles.,25,24,1,1,0.5331442020535577,Seton Hall,St. John's,4,4,0,0,NA,401121509,2019-03-09,
122,2,5:20,1520,1520,Kaela Hilaire Turnover.,25,24,1,14,0.5331587078810258,Seton Hall,St. John's,4,4,0,0,NA,401121509,2019-03-09,
123,2,5:06,1506,1506,Akina Wellere made Jumper. Assisted by Tiana England.,25,26,-1,18,0.46663569625467993,Seton Hall,St. John's,4,4,0,0,NA,401121509,2019-03-09,St. John's
124,2,4:48,1488,1488,Shadeen Samuels missed Layup.,25,26,-1,5,0.4663635938994422,Seton Hall,St. John's,4,4,0,0,NA,401121509,2019-03-09,
125,2,4:43,1483,1483,Shadeen Samuels Offensive Rebound.,25,26,-1,0,0.4662862652629678,Seton Hall,St. John's,4,4,0,0,NA,401121509,2019-03-09,
126,2,4:43,1483,1483,Shadeen Samuels made Layup.,27,26,1,21,0.5337137347370322,Seton Hall,St. John's,4,4,0,0,NA,401121509,2019-03-09,Seton Hall
127,2,4:22,1462,1462,Tiana England missed Layup.,27,26,1,0,0.53404789546587506,Seton Hall,St. John's,4,4,0,0,NA,401121509,2019-03-09,
128,2,4:22,1462,1462,Shadeen Samuels Block.,27,26,1,4,0.53404789546587506,Seton Hall,St. John's,4,4,0,0,NA,401121509,2019-03-09,
129,2,4:18,1458,1458,Selena Philoxy Defensive Rebound.,27,26,1,4,0.5341134001333621,Seton Hall,St. John's,4,4,0,0,NA,401121509,2019-03-09,
130,2,4:14,1454,1454,Selena Philoxy missed Layup.,27,26,1,2,0.5341795407642489,Seton Hall,St. John's,4,4,0,0,NA,401121509,2019-03-09,
131,2,4:12,1452,1452,Kayla Charles Defensive Rebound.,27,26,1,25,0.5342128550427648,Seton Hall,St. John's,4,4,0,0,NA,401121509,2019-03-09,
132,2,3:47,1427,1427,Jasmine Sina made Three Point Jumper. Assisted by Akina Wellere.,27,29,-2,20,0.4310846404310986,Seton Hall,St. John's,4,4,0,0,NA,401121509,2019-03-09,St. John's
133,2,3:27,1407,1407,Selena Philoxy made Layup. Assisted by Kaela Hilaire.,29,29,0,26,0.5,Seton Hall,St. John's,4,4,0,0,NA,401121509,2019-03-09,Seton Hall
134,2,3:01,1381,1381,Qadashah Hoppie missed Jumper.,29,29,0,4,0.5,Seton Hall,St. John's,4,4,0,0,NA,401121509,2019-03-09,
135,2,2:57,1377,1377,Shadeen Samuels Defensive Rebound.,29,29,0,4,0.5,Seton Hall,St. John's,4,4,0,0,NA,401121509,2019-03-09,
136,2,2:53,1373,1373,Foul on Qadashah Hoppie.,29,29,0,0,0.5,Seton Hall,St. John's,4,4,0,0,NA,401121509,2019-03-09,
137,2,2:53,1373,1373,Official TV Timeout,29,29,0,0,0.5,Seton Hall,St. John's,4,4,0,0,NA,401121509,2019-03-09,
138,2,2:53,1373,1373,Inja Butina made Free Throw.,30,29,1,0,0.5354592030530729,Seton Hall,St. John's,4,4,0,0,NA,401121509,2019-03-09,Seton Hall
139,2,2:53,1373,1373,Inja Butina made Free Throw.,31,29,2,16,0.5705635125419892,Seton Hall,St. John's,4,4,0,0,NA,401121509,2019-03-09,Seton Hall
140,2,2:37,1357,1357,Tiana England made Layup.,31,31,0,17,0.5,Seton Hall,St. John's,4,4,0,0,NA,401121509,2019-03-09,St. John's
141,2,2:20,1340,1340,Desiree Elmore missed Jumper.,31,31,0,3,0.5,Seton Hall,St. John's,4,4,0,0,NA,401121509,2019-03-09,
142,2,2:17,1337,1337,Kayla Charles Defensive Rebound.,31,31,0,25,0.5,Seton Hall,St. John's,4,4,0,0,NA,401121509,2019-03-09,
143,2,1:52,1312,1312,Qadashah Hoppie made Three Point Jumper. Assisted by Tiana England.,31,34,-3,15,0.3923127362311123,Seton Hall,St. John's,4,4,0,0,NA,401121509,2019-03-09,St. John's
144,2,1:37,1297,1297,Foul on Kayla Charles.,31,34,-3,0,0.3916120160448172,Seton Hall,St. John's,4,4,0,0,NA,401121509,2019-03-09,
145,2,1:37,1297,1297,Desiree Elmore made Free Throw.,32,34,-2,0,0.42709972106994226,Seton Hall,St. John's,4,4,0,0,NA,401121509,2019-03-09,Seton Hall
146,2,1:37,1297,1297,Desiree Elmore missed Free Throw.,32,34,-2,3,0.42709972106994226,Seton Hall,St. John's,4,4,0,0,NA,401121509,2019-03-09,
147,2,1:34,1294,1294,Kadaja Bailey Defensive Rebound.,32,34,-2,4,0.42700201260712484,Seton Hall,St. John's,4,4,0,0,NA,401121509,2019-03-09,
148,2,1:30,1290,1290,Kadaja Bailey made Layup.,32,36,-4,19,0.3568046077130908,Seton Hall,St. John's,4,4,0,0,NA,401121509,2019-03-09,St. John's
149,2,1:11,1271,1271,Desiree Elmore Turnover.,32,36,-4,0,0.35560204291601344,Seton Hall,St. John's,4,4,0,0,NA,401121509,2019-03-09,
150,2,1:11,1271,1271,Kadaja Bailey Steal.,32,36,-4,7,0.35560204291601344,Seton Hall,St. John's,4,4,0,0,NA,401121509,2019-03-09,
151,2,1:04,1264,1264,Jasmine Sina missed Three Point Jumper.,32,36,-4,3,0.3551438949163887,Seton Hall,St. John's,4,4,0,0,NA,401121509,2019-03-09,
152,2,1:01,1261,1261,Desiree Elmore Defensive Rebound.,32,36,-4,5,0.3549448021619414,Seton Hall,St. John's,4,4,0,0,NA,401121509,2019-03-09,
153,2,0:56,1256,1256,Kaela Hilaire missed Layup.,32,36,-4,4,0.3546091475610365,Seton Hall,St. John's,4,4,0,0,NA,401121509,2019-03-09,
154,2,0:52,1252,1252,Akina Wellere Defensive Rebound.,32,36,-4,14,0.3543370480022264,Seton Hall,St. John's,4,4,0,0,NA,401121509,2019-03-09,
155,2,0:38,1238,1238,Foul on Nicole Jimenez.,32,36,-4,7,0.35335798486345965,Seton Hall,St. John's,4,4,0,0,NA,401121509,2019-03-09,
156,2,0:31,1231,1231,Foul on Inja Butina.,32,36,-4,0,0.3528518062551774,Seton Hall,St. John's,4,4,0,0,NA,401121509,2019-03-09,
157,2,0:31,1231,1231,Qadashah Hoppie made Free Throw.,32,37,-5,0,0.31904611166647573,Seton Hall,St. John's,4,4,0,0,NA,401121509,2019-03-09,St. John's
158,2,0:31,1231,1231,Qadashah Hoppie made Free Throw.,32,38,-6,28,0.28704266043560267,Seton Hall,St. John's,4,4,0,0,NA,401121509,2019-03-09,St. John's
159,2,0:03,1203,1203,Desiree Elmore made Jumper. Assisted by Kaela Hilaire.,34,38,-4,3,0.35071365163007,Seton Hall,St. John's,4,4,0,0,NA,401121509,2019-03-09,Seton Hall
160,2,0:00,1200,1200,End of 2nd Quarter,34,38,-4,32,0.3504822574627354,Seton Hall,St. John's,4,4,0,0,NA,401121509,2019-03-09,
161,3,9:28,1168,1168,Nicole Jimenez missed Three Point Jumper.,34,38,-4,2,0.3480903885335947,Seton Hall,St. John's,5,5,0,0,NA,401121509,2019-03-09,
162,3,9:26,1166,1166,Alisha Kebbe Defensive Rebound.,34,38,-4,25,0.34794447704125403,Seton Hall,St. John's,5,5,0,0,NA,401121509,2019-03-09,
163,3,9:01,1141,1141,Akina Wellere made Three Point Jumper. Assisted by Tiana England.,34,41,-7,11,0.24729508223535773,Seton Hall,St. John's,5,5,0,0,NA,401121509,2019-03-09,St. John's
164,3,8:50,1130,1130,Victoria Cardaci missed Three Point Jumper.,34,41,-7,4,0.24616023986226804,Seton Hall,St. John's,5,5,0,0,NA,401121509,2019-03-09,
165,3,8:46,1126,1126,Curteeona Brelove Defensive Rebound.,34,41,-7,28,0.2457477829716883,Seton Hall,St. John's,5,5,0,0,NA,401121509,2019-03-09,
166,3,8:18,1098,1098,Akina Wellere missed Three Point Jumper.,34,41,-7,4,0.2428413318170781,Seton Hall,St. John's,5,5,0,0,NA,401121509,2019-03-09,
167,3,8:14,1094,1094,Selena Philoxy Defensive Rebound.,34,41,-7,12,0.2424207278029496,Seton Hall,St. John's,5,5,0,0,NA,401121509,2019-03-09,
168,3,8:02,1082,1082,Shadeen Samuels made Jumper.,36,41,-5,24,0.3060053062866715,Seton Hall,St. John's,5,5,0,0,NA,401121509,2019-03-09,Seton Hall
169,3,7:38,1058,1058,Akina Wellere made Layup. Assisted by Curteeona Brelove.,36,43,-7,16,0.23851960443318834,Seton Hall,St. John's,5,5,0,0,NA,401121509,2019-03-09,St. John's
170,3,7:22,1042,1042,Seton Hall  Timeout,36,43,-7,17,0.23669352179074754,Seton Hall,St. John's,4,5,1,0,NA,401121509,2019-03-09,
171,3,7:05,1025,1025,Shadeen Samuels missed Jumper.,36,43,-7,3,0.23467059410415056,Seton Hall,St. John's,4,5,1,0,NA,401121509,2019-03-09,
172,3,7:02,1022,1022,Alisha Kebbe Defensive Rebound.,36,43,-7,16,0.234303651503528,Seton Hall,St. John's,4,5,1,0,NA,401121509,2019-03-09,
173,3,6:46,1006,1006,Alisha Kebbe missed Jumper.,36,43,-7,3,0.23229071115130434,Seton Hall,St. John's,4,5,1,0,NA,401121509,2019-03-09,
174,3,6:43,1003,1003,Curteeona Brelove Offensive Rebound.,36,43,-7,23,0.23190218745654426,Seton Hall,St. John's,4,5,1,0,NA,401121509,2019-03-09,
175,3,6:20,980,980,Akina Wellere missed Three Point Jumper.,36,43,-7,2,0.22879512593977883,Seton Hall,St. John's,4,5,0,0,NA,401121509,2019-03-09,
176,3,6:18,978,978,Selena Philoxy Defensive Rebound.,36,43,-7,24,0.228513565697516,Seton Hall,St. John's,4,5,0,0,NA,401121509,2019-03-09,
177,3,5:54,954,954,Foul on Akina Wellere.,36,43,-7,6,0.22515689993201046,Seton Hall,St. John's,4,5,0,0,NA,401121509,2019-03-09,
178,3,5:48,948,948,Foul on Alisha Kebbe.,36,43,-7,12,0.2243801947437711,Seton Hall,St. John's,4,5,0,0,NA,401121509,2019-03-09,
179,3,5:36,936,936,Selena Philoxy made Layup.,38,43,-5,24,0.2906901404976607,Seton Hall,St. John's,4,5,0,0,NA,401121509,2019-03-09,Seton Hall
180,3,5:12,912,912,Curteeona Brelove made Layup.,38,45,-7,17,0.22016658485865662,Seton Hall,St. John's,4,5,0,0,NA,401121509,2019-03-09,St. John's
181,3,4:55,895,895,Inja Butina missed Jumper.,38,45,-7,12,0.21835257901649063,Seton Hall,St. John's,4,5,0,0,NA,401121509,2019-03-09,
182,3,4:43,883,883,Selena Philoxy Offensive Rebound.,38,45,-7,15,0.2171025511400549,Seton Hall,St. John's,4,5,0,0,NA,401121509,2019-03-09,
183,3,4:28,868,868,Nicole Jimenez made Three Point Jumper. Assisted by Selena Philoxy.,41,45,-4,5,0.3234030114508319,Seton Hall,St. John's,4,5,0,0,NA,401121509,2019-03-09,Seton Hall
184,3,4:23,863,863,Curteeona Brelove made Layup. Assisted by Qadashah Hoppie.,41,47,-6,5,0.24788707172232397,Seton Hall,St. John's,4,5,0,0,NA,401121509,2019-03-09,St. John's
