play_id,period,time_remaining_period,secs_remaining,secs_remaining_absolute,description,home_score,away_score,score_diff,play_length,win_prob,home,away,home_time_out_remaining,away_time_out_remaining,home_timeout_ind,away_timeout_ind,home_favored_by,game_id,date,whichScored
1,1,9:46,2386,2386,Nausia Woolfolk made Three Point Jumper. Assisted by Nicki Ekhomu.,0,0,0,14,0.5,Georgia Tech,Florida State,4,4,0,0,NA,401092132,2019-03-03,NA
2,1,9:32,2372,2372,Liz Dixon missed Jumper.,0,3,-3,3,0.4332944795908188,Georgia Tech,Florida State,4,4,0,0,NA,401092132,2019-03-03,Florida State
3,1,9:29,2369,2369,Lotta-Maj Lahtinen Offensive Rebound.,0,3,-3,12,0.43319932076689005,Georgia Tech,Florida State,4,4,0,0,NA,401092132,2019-03-03,
4,1,9:17,2357,2357,Lotta-Maj Lahtinen Turnover.,0,3,-3,0,0.4328168803056858,Georgia Tech,Florida State,4,4,0,0,NA,401092132,2019-03-03,
5,1,9:17,2357,2357,Nausia Woolfolk Steal.,0,3,-3,5,0.4328168803056858,Georgia Tech,Florida State,4,4,0,0,NA,401092132,2019-03-03,
6,1,9:12,2352,2352,Morgan Jones missed Layup.,0,3,-3,4,0.4326567000509638,Georgia Tech,Florida State,4,4,0,0,NA,401092132,2019-03-03,
7,1,9:08,2348,2348,Liz Dixon Defensive Rebound.,0,3,-3,5,0.43252821423945154,Georgia Tech,Florida State,4,4,0,0,NA,401092132,2019-03-03,
8,1,9:03,2343,2343,Elizabeth Balogun missed Three Point Jumper.,0,3,-3,2,0.4323671882528801,Georgia Tech,Florida State,4,4,0,0,NA,401092132,2019-03-03,
9,1,9:01,2341,2341,Georgia Tech Offensive Rebound.,0,3,-3,3,0.43230264961455184,Georgia Tech,Florida State,4,4,0,0,NA,401092132,2019-03-03,
10,1,8:58,2338,2338,Elizabeth Balogun missed Layup.,0,3,-3,1,0.4322057062255591,Georgia Tech,Florida State,4,4,0,0,NA,401092132,2019-03-03,
11,1,8:57,2337,2337,Elizabeth Balogun Offensive Rebound.,0,3,-3,0,0.43217335596304424,Georgia Tech,Florida State,4,4,0,0,NA,401092132,2019-03-03,
12,1,8:57,2337,2337,Foul on Kiah Gillespie.,0,3,-3,0,0.43217335596304424,Georgia Tech,Florida State,4,4,0,0,NA,401092132,2019-03-03,
13,1,8:57,2337,2337,Elizabeth Balogun missed Free Throw.,0,3,-3,0,0.43217335596304424,Georgia Tech,Florida State,4,4,0,0,NA,401092132,2019-03-03,
14,1,8:57,2337,2337,Georgia Tech Offensive Rebound.,0,3,-3,0,0.43217335596304424,Georgia Tech,Florida State,4,4,0,0,NA,401092132,2019-03-03,
15,1,8:57,2337,2337,Elizabeth Balogun made Free Throw.,1,3,-2,15,0.4546269370703341,Georgia Tech,Florida State,4,4,0,0,NA,401092132,2019-03-03,Georgia Tech
16,1,8:42,2322,2322,Nicki Ekhomu missed Three Point Jumper.,1,3,-2,3,0.45429865275097875,Georgia Tech,Florida State,4,4,0,0,NA,401092132,2019-03-03,
17,1,8:39,2319,2319,Georgia Tech Defensive Rebound.,1,3,-2,13,0.45423268255208255,Georgia Tech,Florida State,4,4,0,0,NA,401092132,2019-03-03,
18,1,8:26,2306,2306,Lorela Cubaj made Layup. Assisted by Elizabeth Balogun.,3,3,0,33,0.5,Georgia Tech,Florida State,4,4,0,0,NA,401092132,2019-03-03,Georgia Tech
19,1,7:53,2273,2273,Nicki Ekhomu missed Three Point Jumper.,3,3,0,4,0.5,Georgia Tech,Florida State,4,4,0,0,NA,401092132,2019-03-03,
20,1,7:49,2269,2269,Morgan Jones Offensive Rebound.,3,3,0,7,0.5,Georgia Tech,Florida State,4,4,0,0,NA,401092132,2019-03-03,
21,1,7:42,2262,2262,Kiah Gillespie missed Three Point Jumper.,3,3,0,3,0.5,Georgia Tech,Florida State,4,4,0,0,NA,401092132,2019-03-03,
22,1,7:39,2259,2259,Savannah Wilkinson Offensive Rebound.,3,3,0,5,0.5,Georgia Tech,Florida State,4,4,0,0,NA,401092132,2019-03-03,
23,1,7:34,2254,2254,Nausia Woolfolk made Three Point Jumper. Assisted by Nicki Ekhomu.,3,6,-3,15,0.42943385099328796,Georgia Tech,Florida State,4,4,0,0,NA,401092132,2019-03-03,Florida State
24,1,7:19,2239,2239,Lotta-Maj Lahtinen Turnover.,3,6,-3,0,0.42892919113244343,Georgia Tech,Florida State,4,4,0,0,NA,401092132,2019-03-03,
25,1,7:19,2239,2239,Morgan Jones Steal.,3,6,-3,9,0.42892919113244343,Georgia Tech,Florida State,4,4,0,0,NA,401092132,2019-03-03,
26,1,7:10,2230,2230,Nausia Woolfolk missed Three Point Jumper.,3,6,-3,4,0.42862529177258624,Georgia Tech,Florida State,4,4,0,0,NA,401092132,2019-03-03,
27,1,7:06,2226,2226,Lotta-Maj Lahtinen Defensive Rebound.,3,6,-3,9,0.4284899787725355,Georgia Tech,Florida State,4,4,0,0,NA,401092132,2019-03-03,
28,1,6:57,2217,2217,Chanin Scott Turnover.,3,6,-3,12,0.42818500324584097,Georgia Tech,Florida State,4,4,0,0,NA,401092132,2019-03-03,
29,1,6:45,2205,2205,Nausia Woolfolk missed Layup.,3,6,-3,4,0.42777732868292595,Georgia Tech,Florida State,4,4,0,0,NA,401092132,2019-03-03,
30,1,6:41,2201,2201,Nausia Woolfolk Offensive Rebound.,3,6,-3,2,0.4276411937721093,Georgia Tech,Florida State,4,4,0,0,NA,401092132,2019-03-03,
31,1,6:39,2199,2199,Nicki Ekhomu Turnover.,3,6,-3,0,0.427573083497328,Georgia Tech,Florida State,4,4,0,0,NA,401092132,2019-03-03,
32,1,6:39,2199,2199,Liz Dixon Steal.,3,6,-3,7,0.427573083497328,Georgia Tech,Florida State,4,4,0,0,NA,401092132,2019-03-03,
33,1,6:32,2192,2192,Elizabeth Balogun missed Three Point Jumper.,3,6,-3,3,0.4273344834071913,Georgia Tech,Florida State,4,4,0,0,NA,401092132,2019-03-03,
34,1,6:29,2189,2189,Nicki Ekhomu Defensive Rebound.,3,6,-3,18,0.4272321289499767,Georgia Tech,Florida State,4,4,0,0,NA,401092132,2019-03-03,
35,1,6:11,2171,2171,Savannah Wilkinson made Jumper. Assisted by Kiah Gillespie.,3,8,-5,22,0.379239046569857,Georgia Tech,Florida State,4,4,0,0,NA,401092132,2019-03-03,Florida State
36,1,5:49,2149,2149,Foul on Nausia Woolfolk.,3,8,-5,0,0.3780278551535392,Georgia Tech,Florida State,4,4,0,0,NA,401092132,2019-03-03,
37,1,5:49,2149,2149,Elizabeth Balogun made Free Throw.,4,8,-4,2,0.4017107717729217,Georgia Tech,Florida State,4,4,0,0,NA,401092132,2019-03-03,Georgia Tech
38,1,5:47,2147,2147,Elizabeth Balogun missed Free Throw.,4,8,-4,1,0.40162042230284645,Georgia Tech,Florida State,4,4,0,0,NA,401092132,2019-03-03,
39,1,5:46,2146,2146,Kourtney Weber Defensive Rebound.,4,8,-4,16,0.4015752262181732,Georgia Tech,Florida State,4,4,0,0,NA,401092132,2019-03-03,
40,1,5:30,2130,2130,Kiah Gillespie made Layup. Assisted by Nicki Ekhomu.,4,10,-6,14,0.35368360391478065,Georgia Tech,Florida State,4,4,0,0,NA,401092132,2019-03-03,Florida State
41,1,5:16,2116,2116,Liz Dixon missed Jumper.,4,10,-6,3,0.3527734613975927,Georgia Tech,Florida State,4,4,0,0,NA,401092132,2019-03-03,
42,1,5:13,2113,2113,Elizabeth Balogun Offensive Rebound.,4,10,-6,0,0.35257792542632643,Georgia Tech,Florida State,4,4,0,0,NA,401092132,2019-03-03,
43,1,5:13,2113,2113,Elizabeth Balogun missed Layup.,4,10,-6,0,0.35257792542632643,Georgia Tech,Florida State,4,4,0,0,NA,401092132,2019-03-03,
44,1,5:13,2113,2113,Georgia Tech Offensive Rebound.,4,10,-6,4,0.35257792542632643,Georgia Tech,Florida State,4,4,0,0,NA,401092132,2019-03-03,
45,1,5:09,2109,2109,Lorela Cubaj made Layup. Assisted by Lotta-Maj Lahtinen.,6,10,-4,14,0.39989237163380015,Georgia Tech,Florida State,4,4,0,0,NA,401092132,2019-03-03,Georgia Tech
46,1,4:55,2095,2095,Sayawni Lassiter Turnover.,6,10,-4,0,0.3992498423360428,Georgia Tech,Florida State,4,4,0,0,NA,401092132,2019-03-03,
47,1,4:55,2095,2095,Lorela Cubaj Steal.,6,10,-4,5,0.3992498423360428,Georgia Tech,Florida State,4,4,0,0,NA,401092132,2019-03-03,
48,1,4:50,2090,2090,Elizabeth Balogun missed Jumper.,6,10,-4,1,0.3990195435539744,Georgia Tech,Florida State,4,4,0,0,NA,401092132,2019-03-03,
49,1,4:49,2089,2089,Georgia Tech Offensive Rebound.,6,10,-4,0,0.3989734304972276,Georgia Tech,Florida State,4,4,0,0,NA,401092132,2019-03-03,
50,1,4:49,2089,2089,Official TV Timeout,6,10,-4,8,0.3989734304972276,Georgia Tech,Florida State,4,4,0,0,NA,401092132,2019-03-03,
51,1,4:41,2081,2081,Liz Dixon Turnover.,6,10,-4,0,0.3986038759027661,Georgia Tech,Florida State,4,4,0,0,NA,401092132,2019-03-03,
52,1,4:41,2081,2081,Kourtney Weber Steal.,6,10,-4,26,0.3986038759027661,Georgia Tech,Florida State,4,4,0,0,NA,401092132,2019-03-03,
53,1,4:15,2055,2055,Kiah Gillespie missed Three Point Jumper.,6,10,-4,3,0.39739451845744256,Georgia Tech,Florida State,4,4,0,0,NA,401092132,2019-03-03,
54,1,4:12,2052,2052,Lorela Cubaj Defensive Rebound.,6,10,-4,8,0.3972541263561349,Georgia Tech,Florida State,4,4,0,0,NA,401092132,2019-03-03,
55,1,4:04,2044,2044,Liz Dixon Turnover.,6,10,-4,0,0.3968788529705244,Georgia Tech,Florida State,4,4,0,0,NA,401092132,2019-03-03,
56,1,4:04,2044,2044,Valencia Myers Steal.,6,10,-4,2,0.3968788529705244,Georgia Tech,Florida State,4,4,0,0,NA,401092132,2019-03-03,
57,1,4:02,2042,2042,Florida State  Timeout,6,10,-4,20,0.3967848286462354,Georgia Tech,Florida State,4,3,0,1,NA,401092132,2019-03-03,
58,1,3:42,2022,2022,Valencia Myers missed Layup.,6,10,-4,3,0.3958399173703674,Georgia Tech,Florida State,4,3,0,1,NA,401092132,2019-03-03,
59,1,3:39,2019,2019,Lorela Cubaj Defensive Rebound.,6,10,-4,14,0.39569743083988324,Georgia Tech,Florida State,4,3,0,1,NA,401092132,2019-03-03,
60,1,3:25,2005,2005,Lotta-Maj Lahtinen missed Layup.,6,10,-4,2,0.3950298166028172,Georgia Tech,Florida State,4,3,0,1,NA,401092132,2019-03-03,
61,1,3:23,2003,2003,Valencia Myers Defensive Rebound.,6,10,-4,22,0.39493407694766164,Georgia Tech,Florida State,4,3,0,1,NA,401092132,2019-03-03,
62,1,3:01,1981,1981,Nausia Woolfolk missed Three Point Jumper.,6,10,-4,1,0.3938746929222732,Georgia Tech,Florida State,4,3,0,0,NA,401092132,2019-03-03,
63,1,3:00,1980,1980,Morgan Jones Offensive Rebound.,6,10,-4,0,0.3938262610652755,Georgia Tech,Florida State,4,3,0,0,NA,401092132,2019-03-03,
64,1,3:00,1980,1980,Foul on Lorela Cubaj.,6,10,-4,14,0.3938262610652755,Georgia Tech,Florida State,4,3,0,0,NA,401092132,2019-03-03,
65,1,2:46,1966,1966,Valencia Myers made Layup.,6,12,-6,17,0.3427274340574811,Georgia Tech,Florida State,4,3,0,0,NA,401092132,2019-03-03,Florida State
66,1,2:29,1949,1949,Elizabeth Balogun missed Jumper.,6,12,-6,3,0.3415478397286148,Georgia Tech,Florida State,4,3,0,0,NA,401092132,2019-03-03,
67,1,2:26,1946,1946,D'asia Gregg Offensive Rebound.,6,12,-6,1,0.34133867197417334,Georgia Tech,Florida State,4,3,0,0,NA,401092132,2019-03-03,
68,1,2:25,1945,1945,D'asia Gregg missed Jumper.,6,12,-6,4,0.34126888135613076,Georgia Tech,Florida State,4,3,0,0,NA,401092132,2019-03-03,
69,1,2:21,1941,1941,Nausia Woolfolk Defensive Rebound.,6,12,-6,1,0.3409893766374379,Georgia Tech,Florida State,4,3,0,0,NA,401092132,2019-03-03,
70,1,2:20,1940,1940,Nausia Woolfolk Turnover.,6,12,-6,0,0.34091941450663477,Georgia Tech,Florida State,4,3,0,0,NA,401092132,2019-03-03,
71,1,2:20,1940,1940,Elizabeth Balogun Steal.,6,12,-6,23,0.34091941450663477,Georgia Tech,Florida State,4,3,0,0,NA,401092132,2019-03-03,
72,1,1:57,1917,1917,Lorela Cubaj missed Jumper.,6,12,-6,3,0.33930524218318436,Georgia Tech,Florida State,4,3,0,0,NA,401092132,2019-03-03,
73,1,1:54,1914,1914,Kiah Gillespie Defensive Rebound.,6,12,-6,5,0.33909504336105645,Georgia Tech,Florida State,4,3,0,0,NA,401092132,2019-03-03,
74,1,1:49,1909,1909,Kiah Gillespie missed Jumper.,6,12,-6,3,0.33874499501792377,Georgia Tech,Florida State,4,3,0,0,NA,401092132,2019-03-03,
75,1,1:46,1906,1906,Chanin Scott Defensive Rebound.,6,12,-6,23,0.3385351174126266,Georgia Tech,Florida State,4,3,0,0,NA,401092132,2019-03-03,
76,1,1:23,1883,1883,Lorela Cubaj made Layup. Assisted by D'asia Gregg.,8,12,-4,31,0.3890419137563819,Georgia Tech,Florida State,4,3,0,0,NA,401092132,2019-03-03,Georgia Tech
77,1,0:52,1852,1852,Valencia Myers missed Jumper.,8,12,-4,0,0.38750496715803057,Georgia Tech,Florida State,4,3,0,0,NA,401092132,2019-03-03,
78,1,0:52,1852,1852,Kiah Gillespie Offensive Rebound.,8,12,-4,0,0.38750496715803057,Georgia Tech,Florida State,4,3,0,0,NA,401092132,2019-03-03,
79,1,0:52,1852,1852,Foul on Chanin Scott.,8,12,-4,4,0.38750496715803057,Georgia Tech,Florida State,4,3,0,0,NA,401092132,2019-03-03,
80,1,0:48,1848,1848,Nicki Ekhomu missed Layup.,8,12,-4,3,0.38730608115812526,Georgia Tech,Florida State,4,3,0,0,NA,401092132,2019-03-03,
81,1,0:45,1845,1845,Kiah Gillespie Offensive Rebound.,8,12,-4,1,0.38715679209039233,Georgia Tech,Florida State,4,3,0,0,NA,401092132,2019-03-03,
82,1,0:44,1844,1844,Kiah Gillespie missed Jumper.,8,12,-4,3,0.3871070037788293,Georgia Tech,Florida State,4,3,0,0,NA,401092132,2019-03-03,
83,1,0:41,1841,1841,D'asia Gregg Defensive Rebound.,8,12,-4,5,0.38695755887973676,Georgia Tech,Florida State,4,3,0,0,NA,401092132,2019-03-03,
84,1,0:36,1836,1836,Elizabeth Balogun missed Three Point Jumper.,8,12,-4,3,0.3867081999499275,Georgia Tech,Florida State,4,3,0,0,NA,401092132,2019-03-03,
85,1,0:33,1833,1833,Lorela Cubaj Offensive Rebound.,8,12,-4,2,0.3865584012710176,Georgia Tech,Florida State,4,3,0,0,NA,401092132,2019-03-03,
86,1,0:31,1831,1831,Jasmine Carson made Three Point Jumper. Assisted by Lorela Cubaj.,11,12,-1,31,0.47114312804382774,Georgia Tech,Florida State,4,3,0,0,NA,401092132,2019-03-03,Georgia Tech
87,1,0:00,1800,1800,Nicki Ekhomu missed Three Point Jumper.,11,12,-1,0,0.47073319422403154,Georgia Tech,Florida State,4,3,0,0,NA,401092132,2019-03-03,
88,1,0:00,1800,1800,Florida State Offensive Rebound.,11,12,-1,0,0.47073319422403154,Georgia Tech,Florida State,4,3,0,0,NA,401092132,2019-03-03,
89,1,0:00,1800,1800,End of 1st Quarter,11,12,-1,19,0.47073319422403154,Georgia Tech,Florida State,4,3,0,0,NA,401092132,2019-03-03,
90,2,9:41,1781,1781,Liz Dixon made Jumper.,13,12,1,26,0.529521443051936,Georgia Tech,Florida State,4,4,0,0,NA,401092132,2019-03-03,Georgia Tech
91,2,9:15,1755,1755,Kiah Gillespie missed Three Point Jumper.,13,12,1,3,0.5298752153615465,Georgia Tech,Florida State,4,4,0,0,NA,401092132,2019-03-03,
92,2,9:12,1752,1752,Georgia Tech Defensive Rebound.,13,12,1,21,0.5299164848900471,Georgia Tech,Florida State,4,4,0,0,NA,401092132,2019-03-03,
93,2,8:51,1731,1731,Liz Dixon made Jumper. Assisted by Jasmine Carson.,15,12,3,28,0.5897523384320297,Georgia Tech,Florida State,4,4,0,0,NA,401092132,2019-03-03,Georgia Tech
94,2,8:23,1703,1703,Nausia Woolfolk missed Layup.,15,12,3,4,0.590911618888767,Georgia Tech,Florida State,4,4,0,0,NA,401092132,2019-03-03,
95,2,8:19,1699,1699,Liz Dixon Defensive Rebound.,15,12,3,8,0.5910798294314633,Georgia Tech,Florida State,4,4,0,0,NA,401092132,2019-03-03,
96,2,8:11,1691,1691,Jasmine Carson made Three Point Jumper.,18,12,6,18,0.6769223026662567,Georgia Tech,Florida State,4,4,0,0,NA,401092132,2019-03-03,Georgia Tech
97,2,7:53,1673,1673,Nicki Ekhomu made Three Point Jumper. Assisted by Nausia Woolfolk.,18,15,3,17,0.592174407743181,Georgia Tech,Florida State,4,4,0,0,NA,401092132,2019-03-03,Florida State
98,2,7:36,1656,1656,Liz Dixon made Jumper. Assisted by Chanin Scott.,20,15,5,25,0.6516759707504919,Georgia Tech,Florida State,4,4,0,0,NA,401092132,2019-03-03,Georgia Tech
99,2,7:11,1631,1631,Nicki Ekhomu missed Jumper.,20,15,5,0,0.6532475126566645,Georgia Tech,Florida State,4,4,0,0,NA,401092132,2019-03-03,
100,2,7:11,1631,1631,Valencia Myers Offensive Rebound.,20,15,5,0,0.6532475126566645,Georgia Tech,Florida State,4,4,0,0,NA,401092132,2019-03-03,
101,2,7:11,1631,1631,Foul on Lorela Cubaj.,20,15,5,0,0.6532475126566645,Georgia Tech,Florida State,4,4,0,0,NA,401092132,2019-03-03,
102,2,7:11,1631,1631,Valencia Myers missed Free Throw.,20,15,5,0,0.6532475126566645,Georgia Tech,Florida State,4,4,0,0,NA,401092132,2019-03-03,
103,2,7:11,1631,1631,Florida State Offensive Rebound.,20,15,5,0,0.6532475126566645,Georgia Tech,Florida State,4,4,0,0,NA,401092132,2019-03-03,
104,2,7:11,1631,1631,Valencia Myers made Free Throw.,20,16,4,13,0.6240269031165463,Georgia Tech,Florida State,4,4,0,0,NA,401092132,2019-03-03,Florida State
105,2,6:58,1618,1618,Jasmine Carson made Three Point Jumper. Assisted by Lotta-Maj Lahtinen.,23,16,7,28,0.7092341573492061,Georgia Tech,Florida State,4,4,0,0,NA,401092132,2019-03-03,Georgia Tech
106,2,6:30,1590,1590,Valencia Myers made Layup. Assisted by Kiah Gillespie.,23,18,5,14,0.6557796242350777,Georgia Tech,Florida State,4,4,0,0,NA,401092132,2019-03-03,Florida State
107,2,6:16,1576,1576,Liz Dixon missed Jumper.,23,18,5,0,0.6566442012234069,Georgia Tech,Florida State,4,4,0,0,NA,401092132,2019-03-03,
108,2,6:16,1576,1576,Valencia Myers Block.,23,18,5,5,0.6566442012234069,Georgia Tech,Florida State,4,4,0,0,NA,401092132,2019-03-03,
109,2,6:11,1571,1571,Kiah Gillespie Defensive Rebound.,23,18,5,4,0.6569541507530707,Georgia Tech,Florida State,4,4,0,0,NA,401092132,2019-03-03,
110,2,6:07,1567,1567,Morgan Jones made Layup. Assisted by Nicki Ekhomu.,23,20,3,20,0.5964059410488348,Georgia Tech,Florida State,4,4,0,0,NA,401092132,2019-03-03,Florida State
111,2,5:47,1547,1547,Jasmine Carson missed Three Point Jumper.,23,20,3,2,0.5972102229022763,Georgia Tech,Florida State,4,4,0,0,NA,401092132,2019-03-03,
112,2,5:45,1545,1545,Liz Dixon Offensive Rebound.,23,20,3,5,0.5972914997438118,Georgia Tech,Florida State,4,4,0,0,NA,401092132,2019-03-03,
113,2,5:40,1540,1540,Foul on Valencia Myers.,23,20,3,19,0.5974954915378169,Georgia Tech,Florida State,4,4,0,0,NA,401092132,2019-03-03,
114,2,5:21,1521,1521,Liz Dixon made Jumper. Assisted by Lotta-Maj Lahtinen.,25,20,5,18,0.660126399732964,Georgia Tech,Florida State,4,4,0,0,NA,401092132,2019-03-03,Georgia Tech
115,2,5:03,1503,1503,Nicki Ekhomu made Three Point Jumper. Assisted by Nausia Woolfolk.,25,23,2,26,0.5665210320962585,Georgia Tech,Florida State,4,4,0,0,NA,401092132,2019-03-03,Florida State
116,2,4:37,1477,1477,Liz Dixon missed Layup.,25,23,2,3,0.5673075177309964,Georgia Tech,Florida State,4,4,0,0,NA,401092132,2019-03-03,
117,2,4:34,1474,1474,Kiah Gillespie Defensive Rebound.,25,23,2,8,0.5674010337726881,Georgia Tech,Florida State,4,4,0,0,NA,401092132,2019-03-03,
118,2,4:26,1466,1466,Valencia Myers Turnover.,25,23,2,0,0.567653501260949,Georgia Tech,Florida State,4,4,0,0,NA,401092132,2019-03-03,
119,2,4:26,1466,1466,Liz Dixon Steal.,25,23,2,6,0.567653501260949,Georgia Tech,Florida State,4,4,0,0,NA,401092132,2019-03-03,
120,2,4:20,1460,1460,Lotta-Maj Lahtinen missed Jumper.,25,23,2,3,0.5678459306191607,Georgia Tech,Florida State,4,4,0,0,NA,401092132,2019-03-03,
121,2,4:17,1457,1457,Morgan Jones Defensive Rebound.,25,23,2,19,0.5679431759795737,Georgia Tech,Florida State,4,4,0,0,NA,401092132,2019-03-03,
122,2,3:58,1438,1438,Kiah Gillespie made Jumper. Assisted by Nicki Ekhomu.,25,25,0,15,0.5,Georgia Tech,Florida State,4,4,0,0,NA,401092132,2019-03-03,Florida State
123,2,3:43,1423,1423,Elizabeth Balogun missed Three Point Jumper.,25,25,0,3,0.5,Georgia Tech,Florida State,4,4,0,0,NA,401092132,2019-03-03,
124,2,3:40,1420,1420,Morgan Jones Defensive Rebound.,25,25,0,8,0.5,Georgia Tech,Florida State,4,4,0,0,NA,401092132,2019-03-03,
125,2,3:32,1412,1412,Nausia Woolfolk missed Three Point Jumper.,25,25,0,9,0.5,Georgia Tech,Florida State,4,4,0,0,NA,401092132,2019-03-03,
126,2,3:23,1403,1403,Kiah Gillespie Offensive Rebound.,25,25,0,16,0.5,Georgia Tech,Florida State,4,4,0,0,NA,401092132,2019-03-03,
127,2,3:07,1387,1387,Nicki Ekhomu made Jumper.,25,27,-2,24,0.4298566596111741,Georgia Tech,Florida State,4,4,0,0,NA,401092132,2019-03-03,Florida State
128,2,2:43,1363,1363,Anne Francoise Diouf made Jumper. Assisted by Lotta-Maj Lahtinen.,27,27,0,22,0.5,Georgia Tech,Florida State,4,4,0,0,NA,401092132,2019-03-03,Georgia Tech
129,2,2:21,1341,1341,Kiah Gillespie missed Three Point Jumper.,27,27,0,3,0.5,Georgia Tech,Florida State,4,4,0,0,NA,401092132,2019-03-03,
130,2,2:18,1338,1338,Elizabeth Balogun Defensive Rebound.,27,27,0,6,0.5,Georgia Tech,Florida State,4,4,0,0,NA,401092132,2019-03-03,
131,2,2:12,1332,1332,Elizabeth Balogun made Jumper.,29,27,2,35,0.5717997625465888,Georgia Tech,Florida State,4,4,0,0,NA,401092132,2019-03-03,Georgia Tech
132,2,1:37,1297,1297,Nicki Ekhomu missed Jumper.,29,27,2,5,0.5729002789300577,Georgia Tech,Florida State,4,4,0,0,NA,401092132,2019-03-03,
133,2,1:32,1292,1292,Kiah Gillespie missed Jumper.,29,27,2,0,0.5730634866740758,Georgia Tech,Florida State,4,4,0,0,NA,401092132,2019-03-03,
134,2,1:32,1292,1292,Liz Dixon Block.,29,27,2,3,0.5730634866740758,Georgia Tech,Florida State,4,4,0,0,NA,401092132,2019-03-03,
135,2,1:29,1289,1289,Kiah Gillespie Offensive Rebound.,29,27,2,1,0.5731622952208199,Georgia Tech,Florida State,4,4,0,0,NA,401092132,2019-03-03,
136,2,1:28,1288,1288,Morgan Jones Offensive Rebound.,29,27,2,0,0.573195384468774,Georgia Tech,Florida State,4,4,0,0,NA,401092132,2019-03-03,
137,2,1:28,1288,1288,Valencia Myers Turnover.,29,27,2,0,0.573195384468774,Georgia Tech,Florida State,4,4,0,0,NA,401092132,2019-03-03,
138,2,1:28,1288,1288,Official TV Timeout,29,27,2,2,0.573195384468774,Georgia Tech,Florida State,4,4,0,0,NA,401092132,2019-03-03,
139,2,1:26,1286,1286,Official TV Timeout,29,27,2,0,0.5732617983107366,Georgia Tech,Florida State,4,4,0,0,NA,401092132,2019-03-03,
140,2,1:26,1286,1286,Official TV Timeout,29,27,2,13,0.5732617983107366,Georgia Tech,Florida State,4,4,0,0,NA,401092132,2019-03-03,
141,2,1:13,1273,1273,Elizabeth Balogun made Three Point Jumper. Assisted by D'asia Gregg.,32,27,5,16,0.67752589431979,Georgia Tech,Florida State,4,4,0,0,NA,401092132,2019-03-03,Georgia Tech
142,2,0:57,1257,1257,Morgan Jones made Layup.,32,29,3,0,0.6103797289867393,Georgia Tech,Florida State,4,4,0,0,NA,401092132,2019-03-03,Florida State
143,2,0:57,1257,1257,Foul on D'asia Gregg.,32,29,3,0,0.6103797289867393,Georgia Tech,Florida State,4,4,0,0,NA,401092132,2019-03-03,
144,2,0:57,1257,1257,Morgan Jones made Free Throw.,32,30,2,16,0.5742646506108325,Georgia Tech,Florida State,4,4,0,0,NA,401092132,2019-03-03,Florida State
145,2,0:41,1241,1241,Anne Francoise Diouf made Jumper. Assisted by D'asia Gregg.,34,30,4,28,0.6464285741138138,Georgia Tech,Florida State,4,4,0,0,NA,401092132,2019-03-03,Georgia Tech
146,2,0:13,1213,1213,Nausia Woolfolk made Layup. Assisted by Savannah Wilkinson.,34,32,2,13,0.575966950153824,Georgia Tech,Florida State,4,4,0,0,NA,401092132,2019-03-03,Florida State
147,2,0:00,1200,1200,Anne Francoise Diouf missed Jumper.,34,32,2,0,0.5765093285143758,Georgia Tech,Florida State,4,4,0,0,NA,401092132,2019-03-03,
148,2,0:00,1200,1200,D'asia Gregg Offensive Rebound.,34,32,2,0,0.5765093285143758,Georgia Tech,Florida State,4,4,0,0,NA,401092132,2019-03-03,
149,2,0:00,1200,1200,D'asia Gregg made Layup.,36,32,4,0,0.6495177425372646,Georgia Tech,Florida State,4,4,0,0,NA,401092132,2019-03-03,Georgia Tech
150,2,0:00,1200,1200,End of 2nd Quarter,34,32,2,20,0.5765093285143758,Georgia Tech,Florida State,4,4,0,0,NA,401092132,2019-03-03,
151,3,9:40,1180,1180,Nausia Woolfolk Turnover.,36,32,4,0,0.651026701809749,Georgia Tech,Florida State,5,5,0,0,NA,401092132,2019-03-03,Georgia Tech
152,3,9:40,1180,1180,Lorela Cubaj Steal.,36,32,4,19,0.651026701809749,Georgia Tech,Florida State,5,5,0,0,NA,401092132,2019-03-03,
153,3,9:21,1161,1161,Chanin Scott Turnover.,36,32,4,0,0.6524190285069774,Georgia Tech,Florida State,5,5,0,0,NA,401092132,2019-03-03,
154,3,9:21,1161,1161,Nicki Ekhomu Steal.,36,32,4,7,0.6524190285069774,Georgia Tech,Florida State,5,5,0,0,NA,401092132,2019-03-03,
155,3,9:14,1154,1154,Nicki Ekhomu Turnover.,36,32,4,0,0.6529253691876516,Georgia Tech,Florida State,5,5,0,0,NA,401092132,2019-03-03,
156,3,9:14,1154,1154,Lorela Cubaj Steal.,36,32,4,17,0.6529253691876516,Georgia Tech,Florida State,5,5,0,0,NA,401092132,2019-03-03,
157,3,8:57,1137,1137,Elizabeth Balogun missed Jumper.,36,32,4,9,0.6541474856946272,Georgia Tech,Florida State,5,5,0,0,NA,401092132,2019-03-03,
158,3,8:48,1128,1128,Savannah Wilkinson Defensive Rebound.,36,32,4,22,0.6547933347042283,Georgia Tech,Florida State,5,5,0,0,NA,401092132,2019-03-03,
159,3,8:26,1106,1106,Nicki Ekhomu missed Jumper.,36,32,4,2,0.6563821502419633,Georgia Tech,Florida State,5,5,0,0,NA,401092132,2019-03-03,
160,3,8:24,1104,1104,Elizabeth Balogun Defensive Rebound.,36,32,4,10,0.6565279439025301,Georgia Tech,Florida State,5,5,0,0,NA,401092132,2019-03-03,
161,3,8:14,1094,1094,Elizabeth Balogun made Three Point Jumper. Assisted by Lotta-Maj Lahtinen.,39,32,7,20,0.7575792721970503,Georgia Tech,Florida State,5,5,0,0,NA,401092132,2019-03-03,Georgia Tech
162,3,7:54,1074,1074,Kiah Gillespie missed Jumper.,39,32,7,2,0.7597166172153388,Georgia Tech,Florida State,5,5,0,0,NA,401092132,2019-03-03,
163,3,7:52,1072,1072,Florida State Offensive Rebound.,39,32,7,13,0.75993413249074,Georgia Tech,Florida State,5,5,0,0,NA,401092132,2019-03-03,
164,3,7:39,1059,1059,Valencia Myers made Layup. Assisted by Nausia Woolfolk.,39,34,5,13,0.696082518048732,Georgia Tech,Florida State,5,5,0,0,NA,401092132,2019-03-03,Florida State
165,3,7:26,1046,1046,Foul on Valencia Myers.,39,34,5,6,0.6973104299386256,Georgia Tech,Florida State,5,5,0,0,NA,401092132,2019-03-03,
166,3,7:20,1040,1040,Liz Dixon missed Layup.,39,34,5,0,0.6978910136804309,Georgia Tech,Florida State,5,5,0,0,NA,401092132,2019-03-03,
167,3,7:20,1040,1040,Georgia Tech Offensive Rebound.,39,34,5,7,0.6978910136804309,Georgia Tech,Florida State,5,5,0,0,NA,401092132,2019-03-03,
168,3,7:13,1033,1033,Lorela Cubaj missed Layup.,39,34,5,3,0.6985804977034019,Georgia Tech,Florida State,5,5,0,0,NA,401092132,2019-03-03,
169,3,7:10,1030,1030,Nausia Woolfolk Defensive Rebound.,39,34,5,4,0.698880208710297,Georgia Tech,Florida State,5,5,0,0,NA,401092132,2019-03-03,
170,3,7:06,1026,1026,Nausia Woolfolk made Layup.,39,36,3,13,0.6239467358408677,Georgia Tech,Florida State,5,5,0,0,NA,401092132,2019-03-03,Florida State
171,3,6:53,1013,1013,Elizabeth Balogun missed Jumper.,39,36,3,3,0.6248489481661141,Georgia Tech,Florida State,5,5,0,0,NA,401092132,2019-03-03,
172,3,6:50,1010,1010,Savannah Wilkinson Defensive Rebound.,39,36,3,10,0.6250626600471884,Georgia Tech,Florida State,5,5,0,0,NA,401092132,2019-03-03,
173,3,6:40,1000,1000,Kourtney Weber Turnover.,39,36,3,0,0.6257910028167197,Georgia Tech,Florida State,5,5,0,0,NA,401092132,2019-03-03,
174,3,6:40,1000,1000,Elizabeth Balogun Steal.,39,36,3,4,0.6257910028167197,Georgia Tech,Florida State,5,5,0,0,NA,401092132,2019-03-03,
175,3,6:36,996,996,Elizabeth Balogun missed Jumper.,39,36,3,4,0.6260895138383642,Georgia Tech,Florida State,5,5,0,0,NA,401092132,2019-03-03,
176,3,6:32,992,992,Morgan Jones Defensive Rebound.,39,36,3,2,0.6263923020379903,Georgia Tech,Florida State,5,5,0,0,NA,401092132,2019-03-03,
177,3,6:30,990,990,Morgan Jones made Layup.,39,38,1,16,0.5430121376390545,Georgia Tech,Florida State,5,5,0,0,NA,401092132,2019-03-03,Florida State
