play_id,period,time_remaining_period,secs_remaining,secs_remaining_absolute,description,home_score,away_score,score_diff,play_length,win_prob,home,away,home_time_out_remaining,away_time_out_remaining,home_timeout_ind,away_timeout_ind,home_favored_by,game_id,date,whichScored
1,1,10:00,2400,2400,Jump Ball won by UConn,0,0,0,5,0.5,SMU,UConn,4,4,0,0,NA,401169291,2020-01-05,NA
2,1,9:55,2395,2395,Christyn Williams made Three Point Jumper. Assisted by Kyla Irwin.,0,3,-3,27,0.43401773415255346,SMU,UConn,4,4,0,0,NA,401169291,2020-01-05,UConn
3,1,9:28,2368,2368,Paige Bayliss Turnover.,0,3,-3,18,0.4331675604648531,SMU,UConn,4,4,0,0,NA,401169291,2020-01-05,
4,1,9:10,2350,2350,Megan Walker missed Three Point Jumper.,0,3,-3,0,0.4325924947332577,SMU,UConn,4,4,0,0,NA,401169291,2020-01-05,
5,1,9:10,2350,2350,Johnasia Cash Defensive Rebound.,0,3,-3,20,0.4325924947332577,SMU,UConn,4,4,0,0,NA,401169291,2020-01-05,
6,1,8:50,2330,2330,Kayla White made Jumper. Assisted by Reagan Bradley.,2,3,-1,23,0.4771896586860421,SMU,UConn,4,4,0,0,NA,401169291,2020-01-05,SMU
7,1,8:27,2307,2307,Crystal Dangerfield missed Three Point Jumper.,2,3,-1,0,0.47693492429764117,SMU,UConn,4,4,0,0,NA,401169291,2020-01-05,
8,1,8:27,2307,2307,Olivia Nelson-Ododa Offensive Rebound.,2,3,-1,8,0.47693492429764117,SMU,UConn,4,4,0,0,NA,401169291,2020-01-05,
9,1,8:19,2299,2299,Kyla Irwin made Three Point Jumper. Assisted by Olivia Nelson-Ododa.,2,6,-4,11,0.4083634282815735,SMU,UConn,4,4,0,0,NA,401169291,2020-01-05,UConn
10,1,8:08,2288,2288,Reagan Bradley missed Jumper.,2,6,-4,0,0.4078857987708193,SMU,UConn,4,4,0,0,NA,401169291,2020-01-05,
11,1,8:08,2288,2288,Crystal Dangerfield Defensive Rebound.,2,6,-4,14,0.4078857987708193,SMU,UConn,4,4,0,0,NA,401169291,2020-01-05,
12,1,7:54,2274,2274,Kyla Irwin made Three Point Jumper. Assisted by Crystal Dangerfield.,2,9,-7,27,0.3414870284385306,SMU,UConn,4,4,0,0,NA,401169291,2020-01-05,UConn
13,1,7:27,2247,2247,Reagan Bradley made Three Point Jumper. Assisted by JaQuia White.,5,9,-4,17,0.406087851051211,SMU,UConn,4,4,0,0,NA,401169291,2020-01-05,SMU
14,1,7:10,2230,2230,Megan Walker missed Jumper.,5,9,-4,0,0.40533535916766966,SMU,UConn,4,4,0,0,NA,401169291,2020-01-05,
15,1,7:10,2230,2230,Johnasia Cash Defensive Rebound.,5,9,-4,9,0.40533535916766966,SMU,UConn,4,4,0,0,NA,401169291,2020-01-05,
16,1,7:01,2221,2221,JaQuia White missed Jumper.,5,9,-4,0,0.4049355910500379,SMU,UConn,4,4,0,0,NA,401169291,2020-01-05,
17,1,7:01,2221,2221,Crystal Dangerfield Defensive Rebound.,5,9,-4,14,0.4049355910500379,SMU,UConn,4,4,0,0,NA,401169291,2020-01-05,
18,1,6:47,2207,2207,Christyn Williams missed Three Point Jumper.,5,9,-4,0,0.40431203923558967,SMU,UConn,4,4,0,0,NA,401169291,2020-01-05,
19,1,6:47,2207,2207,JaQuia White Defensive Rebound.,5,9,-4,8,0.40431203923558967,SMU,UConn,4,4,0,0,NA,401169291,2020-01-05,
20,1,6:39,2199,2199,Foul on JaQuia White.,5,9,-4,0,0.4039548941433866,SMU,UConn,4,4,0,0,NA,401169291,2020-01-05,
21,1,6:39,2199,2199,JaQuia White Turnover.,5,9,-4,13,0.4039548941433866,SMU,UConn,4,4,0,0,NA,401169291,2020-01-05,
22,1,6:26,2186,2186,Crystal Dangerfield missed Three Point Jumper.,5,9,-4,0,0.40337341088223816,SMU,UConn,4,4,0,0,NA,401169291,2020-01-05,
23,1,6:26,2186,2186,Christyn Williams Offensive Rebound.,5,9,-4,10,0.40337341088223816,SMU,UConn,4,4,0,0,NA,401169291,2020-01-05,
24,1,6:16,2176,2176,Megan Walker made Layup. Assisted by Olivia Nelson-Ododa.,5,11,-6,20,0.3566493983999426,SMU,UConn,4,4,0,0,NA,401169291,2020-01-05,UConn
25,1,5:56,2156,2156,Reagan Bradley missed Jumper.,5,11,-6,0,0.35536420267106944,SMU,UConn,4,4,0,0,NA,401169291,2020-01-05,
26,1,5:56,2156,2156,UConn Defensive Rebound.,5,11,-6,11,0.35536420267106944,SMU,UConn,4,4,0,0,NA,401169291,2020-01-05,
27,1,5:45,2145,2145,Olivia Nelson-Ododa made Layup. Assisted by Kyla Irwin.,5,13,-8,0,0.310413221410914,SMU,UConn,4,4,0,0,NA,401169291,2020-01-05,UConn
28,1,5:45,2145,2145,Foul on JaQuia White.,5,13,-8,0,0.310413221410914,SMU,UConn,4,4,0,0,NA,401169291,2020-01-05,
29,1,5:45,2145,2145,Olivia Nelson-Ododa missed Free Throw.,5,13,-8,0,0.310413221410914,SMU,UConn,4,4,0,0,NA,401169291,2020-01-05,
30,1,5:45,2145,2145,Amber Bacon Defensive Rebound.,5,13,-8,26,0.310413221410914,SMU,UConn,4,4,0,0,NA,401169291,2020-01-05,
31,1,5:19,2119,2119,Foul on Johnasia Cash.,5,13,-8,0,0.3083126454016546,SMU,UConn,4,4,0,0,NA,401169291,2020-01-05,
32,1,5:19,2119,2119,Johnasia Cash Turnover.,5,13,-8,21,0.3083126454016546,SMU,UConn,4,4,0,0,NA,401169291,2020-01-05,
33,1,4:58,2098,2098,Olivia Nelson-Ododa Turnover.,5,13,-8,0,0.30660637120990175,SMU,UConn,4,4,0,0,NA,401169291,2020-01-05,
34,1,4:58,2098,2098,Official TV Timeout,5,13,-8,8,0.30660637120990175,SMU,UConn,4,4,0,0,NA,401169291,2020-01-05,
35,1,4:50,2090,2090,Reagan Bradley missed Three Point Jumper.,5,13,-8,0,0.30595388102367654,SMU,UConn,4,4,0,0,NA,401169291,2020-01-05,
36,1,4:50,2090,2090,Olivia Nelson-Ododa Defensive Rebound.,5,13,-8,19,0.30595388102367654,SMU,UConn,4,4,0,0,NA,401169291,2020-01-05,
37,1,4:31,2071,2071,Megan Walker Turnover.,5,13,-8,0,0.30439832886364065,SMU,UConn,4,4,0,0,NA,401169291,2020-01-05,
38,1,4:31,2071,2071,Johnasia Cash Steal.,5,13,-8,5,0.30439832886364065,SMU,UConn,4,4,0,0,NA,401169291,2020-01-05,
39,1,4:26,2066,2066,Reagan Bradley missed Jumper.,5,13,-8,0,0.3039875337302463,SMU,UConn,4,4,0,0,NA,401169291,2020-01-05,
40,1,4:26,2066,2066,Megan Walker Defensive Rebound.,5,13,-8,14,0.3039875337302463,SMU,UConn,4,4,0,0,NA,401169291,2020-01-05,
41,1,4:12,2052,2052,Olivia Nelson-Ododa made Layup. Assisted by Kyla Irwin.,5,15,-10,17,0.260706702510604,SMU,UConn,4,4,0,0,NA,401169291,2020-01-05,UConn
42,1,3:55,2035,2035,Reagan Bradley Turnover.,5,15,-10,0,0.2591014006350586,SMU,UConn,4,4,0,0,NA,401169291,2020-01-05,
43,1,3:55,2035,2035,Megan Walker Steal.,5,15,-10,5,0.2591014006350586,SMU,UConn,4,4,0,0,NA,401169291,2020-01-05,
44,1,3:50,2030,2030,Christyn Williams made Layup.,5,17,-12,16,0.2203316960718625,SMU,UConn,4,4,0,0,NA,401169291,2020-01-05,UConn
45,1,3:34,2014,2014,Johnasia Cash missed Jumper.,5,17,-12,0,0.21869957346231297,SMU,UConn,4,4,0,0,NA,401169291,2020-01-05,
46,1,3:34,2014,2014,SMU Offensive Rebound.,5,17,-12,8,0.21869957346231297,SMU,UConn,4,4,0,0,NA,401169291,2020-01-05,
47,1,3:26,2006,2006,Kayla White missed Jumper.,5,17,-12,0,0.21788177664759456,SMU,UConn,4,4,0,0,NA,401169291,2020-01-05,
48,1,3:26,2006,2006,Olivia Nelson-Ododa Defensive Rebound.,5,17,-12,2,0.21788177664759456,SMU,UConn,4,4,0,0,NA,401169291,2020-01-05,
49,1,3:24,2004,2004,Foul on Paige Bayliss.,5,17,-12,12,0.2176771391718732,SMU,UConn,4,4,0,0,NA,401169291,2020-01-05,
50,1,3:12,1992,1992,Crystal Dangerfield missed Three Point Jumper.,5,17,-12,0,0.21644768081161955,SMU,UConn,4,4,0,0,NA,401169291,2020-01-05,
51,1,3:12,1992,1992,Paige Bayliss Defensive Rebound.,5,17,-12,16,0.21644768081161955,SMU,UConn,4,4,0,0,NA,401169291,2020-01-05,
52,1,2:56,1976,1976,Foul on Christyn Williams.,5,17,-12,0,0.2148038622775711,SMU,UConn,4,4,0,0,NA,401169291,2020-01-05,
53,1,2:56,1976,1976,Amber Bacon missed Free Throw.,5,17,-12,0,0.2148038622775711,SMU,UConn,4,4,0,0,NA,401169291,2020-01-05,
54,1,2:56,1976,1976,SMU Deadball Team Rebound.,5,17,-12,0,0.2148038622775711,SMU,UConn,4,4,0,0,NA,401169291,2020-01-05,
55,1,2:56,1976,1976,Amber Bacon made Free Throw.,6,17,-11,10,0.2335826568981359,SMU,UConn,4,4,0,0,NA,401169291,2020-01-05,SMU
56,1,2:46,1966,1966,Christyn Williams missed Three Point Jumper.,6,17,-11,1,0.23258010179573016,SMU,UConn,4,4,0,0,NA,401169291,2020-01-05,
57,1,2:45,1965,1965,Kayla White Defensive Rebound.,6,17,-11,15,0.2324797008027692,SMU,UConn,4,4,0,0,NA,401169291,2020-01-05,
58,1,2:30,1950,1950,Kayla White missed Jumper.,6,17,-11,2,0.23097042781979107,SMU,UConn,4,4,0,0,NA,401169291,2020-01-05,
59,1,2:28,1948,1948,Megan Walker Defensive Rebound.,6,17,-11,2,0.23076872176376592,SMU,UConn,4,4,0,0,NA,401169291,2020-01-05,
60,1,2:26,1946,1946,Megan Walker Turnover.,6,17,-11,0,0.2305669032132902,SMU,UConn,4,4,0,0,NA,401169291,2020-01-05,
61,1,2:26,1946,1946,Reagan Bradley Steal.,6,17,-11,3,0.2305669032132902,SMU,UConn,4,4,0,0,NA,401169291,2020-01-05,
62,1,2:23,1943,1943,Foul on Megan Walker.,6,17,-11,0,0.23026396310655123,SMU,UConn,4,4,0,0,NA,401169291,2020-01-05,
63,1,2:23,1943,1943,Reagan Bradley missed Free Throw.,6,17,-11,0,0.23026396310655123,SMU,UConn,4,4,0,0,NA,401169291,2020-01-05,
64,1,2:23,1943,1943,SMU Deadball Team Rebound.,6,17,-11,0,0.23026396310655123,SMU,UConn,4,4,0,0,NA,401169291,2020-01-05,
65,1,2:23,1943,1943,Reagan Bradley made Free Throw.,7,17,-10,10,0.25028172855825204,SMU,UConn,4,4,0,0,NA,401169291,2020-01-05,SMU
66,1,2:13,1933,1933,Megan Walker made Jumper. Assisted by Christyn Williams.,7,19,-12,24,0.21035802736657255,SMU,UConn,4,4,0,0,NA,401169291,2020-01-05,UConn
67,1,1:49,1909,1909,Alexis Leggett missed Jumper.,7,19,-12,0,0.20787473001222892,SMU,UConn,4,4,0,0,NA,401169291,2020-01-05,
68,1,1:49,1909,1909,Johnasia Cash Offensive Rebound.,7,19,-12,10,0.20787473001222892,SMU,UConn,4,4,0,0,NA,401169291,2020-01-05,
69,1,1:39,1899,1899,Johnasia Cash missed Layup.,7,19,-12,0,0.2068480724283177,SMU,UConn,4,4,0,0,NA,401169291,2020-01-05,
70,1,1:39,1899,1899,Anna Makurat Defensive Rebound.,7,19,-12,0,0.2068480724283177,SMU,UConn,4,4,0,0,NA,401169291,2020-01-05,
71,1,1:39,1899,1899,Anna Makurat Turnover.,7,19,-12,13,0.2068480724283177,SMU,UConn,4,4,0,0,NA,401169291,2020-01-05,
72,1,1:26,1886,1886,Jump Ball won by SMU,7,19,-12,11,0.20551917631320937,SMU,UConn,4,4,0,0,NA,401169291,2020-01-05,
73,1,1:15,1875,1875,Reagan Bradley missed Layup.,7,19,-12,0,0.20439889782080203,SMU,UConn,4,4,0,0,NA,401169291,2020-01-05,
74,1,1:15,1875,1875,Anna Makurat Defensive Rebound.,7,19,-12,10,0.20439889782080203,SMU,UConn,4,4,0,0,NA,401169291,2020-01-05,
75,1,1:05,1865,1865,Megan Walker missed Three Point Jumper.,7,19,-12,0,0.20338306718798177,SMU,UConn,4,4,0,0,NA,401169291,2020-01-05,
76,1,1:05,1865,1865,Johnasia Cash Defensive Rebound.,7,19,-12,9,0.20338306718798177,SMU,UConn,4,4,0,0,NA,401169291,2020-01-05,
77,1,0:56,1856,1856,Reagan Bradley missed Layup.,7,19,-12,0,0.202470435223622,SMU,UConn,4,4,0,0,NA,401169291,2020-01-05,
78,1,0:56,1856,1856,Crystal Dangerfield Block.,7,19,-12,0,0.202470435223622,SMU,UConn,4,4,0,0,NA,401169291,2020-01-05,
79,1,0:56,1856,1856,Alexis Leggett Offensive Rebound.,7,19,-12,12,0.202470435223622,SMU,UConn,4,4,0,0,NA,401169291,2020-01-05,
80,1,0:44,1844,1844,Amber Bacon made Jumper. Assisted by Alexis Leggett.,9,19,-10,11,0.2407224037664307,SMU,UConn,4,4,0,0,NA,401169291,2020-01-05,SMU
81,1,0:33,1833,1833,Olivia Nelson-Ododa missed Layup.,9,19,-10,0,0.2396671401436841,SMU,UConn,4,4,0,0,NA,401169291,2020-01-05,
82,1,0:33,1833,1833,Alexis Leggett Block.,9,19,-10,0,0.2396671401436841,SMU,UConn,4,4,0,0,NA,401169291,2020-01-05,
83,1,0:33,1833,1833,Johnasia Cash Defensive Rebound.,9,19,-10,13,0.2396671401436841,SMU,UConn,4,4,0,0,NA,401169291,2020-01-05,
84,1,0:20,1820,1820,Kayla White missed Layup.,9,19,-10,0,0.2384184465039811,SMU,UConn,4,4,0,0,NA,401169291,2020-01-05,
85,1,0:20,1820,1820,Megan Walker Defensive Rebound.,9,19,-10,18,0.2384184465039811,SMU,UConn,4,4,0,0,NA,401169291,2020-01-05,
86,1,0:02,1802,1802,Megan Walker missed Three Point Jumper.,9,19,-10,0,0.23668461660837106,SMU,UConn,4,4,0,0,NA,401169291,2020-01-05,
87,1,0:02,1802,1802,UConn Deadball Team Rebound.,9,19,-10,2,0.23668461660837106,SMU,UConn,4,4,0,0,NA,401169291,2020-01-05,
88,1,0:00,1800,1800,End of 1st Quarter,9,19,-10,0,0.23649150459798127,SMU,UConn,4,4,0,0,NA,401169291,2020-01-05,
89,2,10:00,1800,1800,Jump Ball won by UConn,9,19,-10,19,0.23649150459798127,SMU,UConn,4,4,0,0,NA,401169291,2020-01-05,
90,2,9:41,1781,1781,Megan Walker made Three Point Jumper. Assisted by Olivia Nelson-Ododa.,9,22,-13,18,0.17698599465545078,SMU,UConn,4,4,0,0,NA,401169291,2020-01-05,UConn
91,2,9:23,1763,1763,Reagan Bradley made Jumper. Assisted by Amber Bacon.,11,22,-11,22,0.212279661771573,SMU,UConn,4,4,0,0,NA,401169291,2020-01-05,SMU
92,2,9:01,1741,1741,Crystal Dangerfield Turnover.,11,22,-11,0,0.21005060942874076,SMU,UConn,4,4,0,0,NA,401169291,2020-01-05,
93,2,9:01,1741,1741,Alexis Leggett Steal.,11,22,-11,5,0.21005060942874076,SMU,UConn,4,4,0,0,NA,401169291,2020-01-05,
94,2,8:56,1736,1736,Amber Bacon made Layup.,13,22,-9,25,0.2523162160830852,SMU,UConn,4,4,0,0,NA,401169291,2020-01-05,SMU
95,2,8:31,1711,1711,Christyn Williams missed Three Point Jumper.,13,22,-9,0,0.24991677102264576,SMU,UConn,4,4,0,0,NA,401169291,2020-01-05,
96,2,8:31,1711,1711,Reagan Bradley Defensive Rebound.,13,22,-9,22,0.24991677102264576,SMU,UConn,4,4,0,0,NA,401169291,2020-01-05,
97,2,8:09,1689,1689,Kayla White missed Jumper.,13,22,-9,0,0.2477681805706114,SMU,UConn,4,4,0,0,NA,401169291,2020-01-05,
98,2,8:09,1689,1689,Paige Bayliss Offensive Rebound.,13,22,-9,4,0.2477681805706114,SMU,UConn,4,4,0,0,NA,401169291,2020-01-05,
99,2,8:05,1685,1685,Paige Bayliss missed Layup.,13,22,-9,0,0.2473765611722114,SMU,UConn,4,4,0,0,NA,401169291,2020-01-05,
100,2,8:05,1685,1685,SMU Offensive Rebound.,13,22,-9,7,0.2473765611722114,SMU,UConn,4,4,0,0,NA,401169291,2020-01-05,
101,2,7:58,1678,1678,Alexis Leggett missed Jumper.,13,22,-9,0,0.24669797201833138,SMU,UConn,4,4,0,0,NA,401169291,2020-01-05,
102,2,7:58,1678,1678,Megan Walker Defensive Rebound.,13,22,-9,10,0.24669797201833138,SMU,UConn,4,4,0,0,NA,401169291,2020-01-05,
103,2,7:48,1668,1668,Megan Walker made Three Point Jumper. Assisted by Crystal Dangerfield.,13,25,-12,22,0.18313239940275017,SMU,UConn,4,4,0,0,NA,401169291,2020-01-05,UConn
104,2,7:26,1646,1646,Kayla White missed Jumper.,13,25,-12,0,0.18092566726522732,SMU,UConn,4,4,0,0,NA,401169291,2020-01-05,
105,2,7:26,1646,1646,Aubrey Griffin Defensive Rebound.,13,25,-12,16,0.18092566726522732,SMU,UConn,4,4,0,0,NA,401169291,2020-01-05,
106,2,7:10,1630,1630,Christyn Williams made Jumper. Assisted by Megan Walker.,13,27,-14,15,0.14502889927951054,SMU,UConn,4,4,0,0,NA,401169291,2020-01-05,UConn
107,2,6:55,1615,1615,Paige Bayliss made Jumper. Assisted by Kayla White.,15,27,-12,16,0.17791484541180178,SMU,UConn,4,4,0,0,NA,401169291,2020-01-05,SMU
108,2,6:39,1599,1599,Foul on Johnasia Cash.,15,27,-12,10,0.1763885077956501,SMU,UConn,4,4,0,0,NA,401169291,2020-01-05,
109,2,6:29,1589,1589,Aubrey Griffin missed Layup.,15,27,-12,0,0.17543925790854867,SMU,UConn,4,4,0,0,NA,401169291,2020-01-05,
110,2,6:29,1589,1589,Paige Bayliss Block.,15,27,-12,0,0.17543925790854867,SMU,UConn,4,4,0,0,NA,401169291,2020-01-05,
111,2,6:29,1589,1589,Aubrey Griffin Offensive Rebound.,15,27,-12,2,0.17543925790854867,SMU,UConn,4,4,0,0,NA,401169291,2020-01-05,
112,2,6:27,1587,1587,Foul on Paige Bayliss.,15,27,-12,0,0.17524962855946224,SMU,UConn,4,4,0,0,NA,401169291,2020-01-05,
113,2,6:27,1587,1587,Aubrey Griffin made Free Throw.,15,28,-13,0,0.15736820084881087,SMU,UConn,4,4,0,0,NA,401169291,2020-01-05,UConn
114,2,6:27,1587,1587,Aubrey Griffin made Free Throw.,15,29,-14,13,0.14099936839113225,SMU,UConn,4,4,0,0,NA,401169291,2020-01-05,UConn
115,2,6:14,1574,1574,Kayla White Turnover.,15,29,-14,11,0.13979556928399417,SMU,UConn,4,4,0,0,NA,401169291,2020-01-05,
116,2,6:03,1563,1563,Kyla Irwin made Jumper. Assisted by Megan Walker.,15,31,-16,17,0.11043839709924988,SMU,UConn,4,4,0,0,NA,401169291,2020-01-05,UConn
117,2,5:46,1546,1546,Paige Bayliss made Jumper. Assisted by Amber Bacon.,17,31,-14,14,0.1371962140910604,SMU,UConn,4,4,0,0,NA,401169291,2020-01-05,SMU
118,2,5:32,1532,1532,Christyn Williams made Three Point Jumper. Assisted by Kyla Irwin.,17,34,-17,18,0.09566781115023576,SMU,UConn,4,4,0,0,NA,401169291,2020-01-05,UConn
119,2,5:14,1514,1514,Amber Bacon Turnover.,17,34,-17,0,0.09414148672381976,SMU,UConn,4,4,0,0,NA,401169291,2020-01-05,
120,2,5:14,1514,1514,Kyla Irwin Steal.,17,34,-17,5,0.09414148672381976,SMU,UConn,4,4,0,0,NA,401169291,2020-01-05,
121,2,5:09,1509,1509,Aubrey Griffin made Layup. Assisted by Crystal Dangerfield.,17,36,-19,22,0.0733681821621403,SMU,UConn,4,4,0,0,NA,401169291,2020-01-05,UConn
122,2,4:47,1487,1487,Johnasia Cash missed Jumper.,17,36,-19,0,0.07166370747140917,SMU,UConn,4,4,0,0,NA,401169291,2020-01-05,
123,2,4:47,1487,1487,Kyla Irwin Defensive Rebound.,17,36,-19,9,0.07166370747140917,SMU,UConn,4,4,0,0,NA,401169291,2020-01-05,
124,2,4:38,1478,1478,Christyn Williams made Jumper. Assisted by Crystal Dangerfield.,17,38,-21,22,0.05505198463861135,SMU,UConn,4,4,0,0,NA,401169291,2020-01-05,UConn
125,2,4:16,1456,1456,Amber Bacon made Jumper. Assisted by Kayla White.,19,38,-19,14,0.06919176481422346,SMU,UConn,4,4,0,0,NA,401169291,2020-01-05,SMU
126,2,4:02,1442,1442,Aubrey Griffin made Layup. Assisted by Kyla Irwin.,19,40,-21,25,0.05252898618539238,SMU,UConn,4,4,0,0,NA,401169291,2020-01-05,UConn
127,2,3:37,1417,1417,Paige Bayliss Turnover.,19,40,-21,0,0.050864568764919585,SMU,UConn,4,4,0,0,NA,401169291,2020-01-05,
128,2,3:37,1417,1417,Megan Walker Steal.,19,40,-21,5,0.050864568764919585,SMU,UConn,4,4,0,0,NA,401169291,2020-01-05,
129,2,3:32,1412,1412,Christyn Williams made Layup. Assisted by Crystal Dangerfield.,19,42,-23,0,0.03870386817019719,SMU,UConn,4,4,1,0,NA,401169291,2020-01-05,UConn
130,2,3:32,1412,1412,SMU  Timeout,19,42,-23,2,0.03870386817019719,SMU,UConn,3,4,1,0,NA,401169291,2020-01-05,
131,2,3:30,1410,1410,Paige Bayliss Turnover.,19,42,-23,0,0.03859655270743077,SMU,UConn,3,4,1,0,NA,401169291,2020-01-05,
132,2,3:30,1410,1410,Aubrey Griffin Steal.,19,42,-23,2,0.03859655270743077,SMU,UConn,3,4,1,0,NA,401169291,2020-01-05,
133,2,3:28,1408,1408,Aubrey Griffin made Layup.,19,44,-25,15,0.02937067409592808,SMU,UConn,3,4,1,0,NA,401169291,2020-01-05,UConn
134,2,3:13,1393,1393,Foul on Aubrey Griffin.,19,44,-25,4,0.028714404889821313,SMU,UConn,3,4,1,0,NA,401169291,2020-01-05,
135,2,3:09,1389,1389,Alexis Leggett Turnover.,19,44,-25,0,0.02854320792578874,SMU,UConn,3,4,1,0,NA,401169291,2020-01-05,
136,2,3:09,1389,1389,Molly Bent Steal.,19,44,-25,8,0.02854320792578874,SMU,UConn,3,4,1,0,NA,401169291,2020-01-05,
137,2,3:01,1381,1381,Megan Walker missed Jumper.,19,44,-25,0,0.0282049357405259,SMU,UConn,3,4,1,0,NA,401169291,2020-01-05,
138,2,3:01,1381,1381,Alexis Leggett Block.,19,44,-25,0,0.0282049357405259,SMU,UConn,3,4,1,0,NA,401169291,2020-01-05,
139,2,3:01,1381,1381,UConn Offensive Rebound.,19,44,-25,3,0.0282049357405259,SMU,UConn,3,4,1,0,NA,401169291,2020-01-05,
140,2,2:58,1378,1378,Megan Walker Turnover.,19,44,-25,0,0.02807937423629528,SMU,UConn,3,4,1,0,NA,401169291,2020-01-05,
141,2,2:58,1378,1378,Reagan Bradley Steal.,19,44,-25,4,0.02807937423629528,SMU,UConn,3,4,1,0,NA,401169291,2020-01-05,
142,2,2:54,1374,1374,Reagan Bradley made Three Point Jumper. Assisted by JaQuia White.,22,44,-22,35,0.04211547101396884,SMU,UConn,3,4,1,0,NA,401169291,2020-01-05,SMU
143,2,2:19,1339,1339,Crystal Dangerfield missed Jumper.,22,44,-22,0,0.04024911476819257,SMU,UConn,3,4,0,0,NA,401169291,2020-01-05,
144,2,2:19,1339,1339,Reagan Bradley Defensive Rebound.,22,44,-22,18,0.04024911476819257,SMU,UConn,3,4,0,0,NA,401169291,2020-01-05,
145,2,2:01,1321,1321,Foul on Aubrey Griffin.,22,44,-22,0,0.03930076076480902,SMU,UConn,3,4,0,0,NA,401169291,2020-01-05,
146,2,2:01,1321,1321,Reagan Bradley missed Free Throw.,22,44,-22,0,0.03930076076480902,SMU,UConn,3,4,0,0,NA,401169291,2020-01-05,
147,2,2:01,1321,1321,SMU Deadball Team Rebound.,22,44,-22,0,0.03930076076480902,SMU,UConn,3,4,0,0,NA,401169291,2020-01-05,
148,2,2:01,1321,1321,Reagan Bradley missed Free Throw.,22,44,-22,0,0.03930076076480902,SMU,UConn,3,4,0,0,NA,401169291,2020-01-05,
149,2,2:01,1321,1321,Olivia Nelson-Ododa Defensive Rebound.,22,44,-22,12,0.03930076076480902,SMU,UConn,3,4,0,0,NA,401169291,2020-01-05,
150,2,1:49,1309,1309,Anna Makurat missed Jumper.,22,44,-22,0,0.03866690318575736,SMU,UConn,3,4,0,0,NA,401169291,2020-01-05,
151,2,1:49,1309,1309,Reagan Bradley Defensive Rebound.,22,44,-22,8,0.03866690318575736,SMU,UConn,3,4,0,0,NA,401169291,2020-01-05,
152,2,1:41,1301,1301,Kayla White Turnover.,22,44,-22,25,0.038242215392295595,SMU,UConn,3,4,0,0,NA,401169291,2020-01-05,
153,2,1:16,1276,1276,Olivia Nelson-Ododa missed Layup.,22,44,-22,0,0.036896447518451295,SMU,UConn,3,4,0,0,NA,401169291,2020-01-05,
154,2,1:16,1276,1276,Alexis Leggett Block.,22,44,-22,0,0.036896447518451295,SMU,UConn,3,4,0,0,NA,401169291,2020-01-05,
155,2,1:16,1276,1276,Amber Bacon Defensive Rebound.,22,44,-22,10,0.036896447518451295,SMU,UConn,3,4,0,0,NA,401169291,2020-01-05,
156,2,1:06,1266,1266,JaQuia White missed Three Point Jumper.,22,44,-22,0,0.0363474114598526,SMU,UConn,3,4,0,0,NA,401169291,2020-01-05,
157,2,1:06,1266,1266,Amber Bacon Offensive Rebound.,22,44,-22,11,0.0363474114598526,SMU,UConn,3,4,0,0,NA,401169291,2020-01-05,
158,2,0:55,1255,1255,Kayla White missed Layup.,22,44,-22,0,0.03573460228497423,SMU,UConn,3,4,0,0,NA,401169291,2020-01-05,
159,2,0:55,1255,1255,Olivia Nelson-Ododa Defensive Rebound.,22,44,-22,14,0.03573460228497423,SMU,UConn,3,4,0,0,NA,401169291,2020-01-05,
160,2,0:41,1241,1241,Kyla Irwin made Three Point Jumper. Assisted by Crystal Dangerfield.,22,47,-25,21,0.022508260731429836,SMU,UConn,3,4,0,0,NA,401169291,2020-01-05,UConn
161,2,0:20,1220,1220,Reagan Bradley Turnover.,22,47,-25,0,0.021599657229846064,SMU,UConn,3,4,0,0,NA,401169291,2020-01-05,
162,2,0:20,1220,1220,Crystal Dangerfield Steal.,22,47,-25,4,0.021599657229846064,SMU,UConn,3,4,0,0,NA,401169291,2020-01-05,
163,2,0:16,1216,1216,Crystal Dangerfield made Layup.,22,49,-27,15,0.01586962696168999,SMU,UConn,3,4,0,0,NA,401169291,2020-01-05,UConn
164,2,0:01,1201,1201,Kayla White Turnover.,22,49,-27,1,0.015338553454794197,SMU,UConn,3,4,0,0,NA,401169291,2020-01-05,
165,2,0:00,1200,1200,End of 2nd Quarter,22,49,-27,0,0.015304124629781635,SMU,UConn,3,4,0,0,NA,401169291,2020-01-05,
166,3,10:00,1200,1200,Jump Ball won by SMU,22,49,-27,20,0.015304124629781635,SMU,UConn,4,5,0,0,NA,401169291,2020-01-05,
167,3,9:40,1180,1180,Reagan Bradley missed Layup.,22,49,-27,0,0.014643630272109213,SMU,UConn,4,5,0,0,NA,401169291,2020-01-05,
168,3,9:40,1180,1180,Olivia Nelson-Ododa Block.,22,49,-27,0,0.014643630272109213,SMU,UConn,4,5,0,0,NA,401169291,2020-01-05,
169,3,9:40,1180,1180,Olivia Nelson-Ododa Defensive Rebound.,22,49,-27,15,0.014643630272109213,SMU,UConn,4,5,0,0,NA,401169291,2020-01-05,
170,3,9:25,1165,1165,Kyla Irwin Turnover.,22,49,-27,0,0.014178436120880687,SMU,UConn,4,5,0,0,NA,401169291,2020-01-05,
171,3,9:25,1165,1165,Johnasia Cash Steal.,22,49,-27,6,0.014178436120880687,SMU,UConn,4,5,0,0,NA,401169291,2020-01-05,
172,3,9:19,1159,1159,Reagan Bradley Turnover.,22,49,-27,0,0.013998354479905524,SMU,UConn,4,5,0,0,NA,401169291,2020-01-05,
173,3,9:19,1159,1159,Olivia Nelson-Ododa Steal.,22,49,-27,19,0.013998354479905524,SMU,UConn,4,5,0,0,NA,401169291,2020-01-05,
174,3,9:00,1140,1140,Foul on Amber Bacon.,22,49,-27,12,0.01344659558028248,SMU,UConn,4,5,0,0,NA,401169291,2020-01-05,
175,3,8:48,1128,1128,Megan Walker missed Jumper.,22,49,-27,0,0.013109904191046573,SMU,UConn,4,5,0,0,NA,401169291,2020-01-05,
176,3,8:48,1128,1128,Reagan Bradley Defensive Rebound.,22,49,-27,25,0.013109904191046573,SMU,UConn,4,5,0,0,NA,401169291,2020-01-05,
177,3,8:23,1103,1103,Johnasia Cash missed Jumper.,22,49,-27,0,0.0124287384293215,SMU,UConn,4,5,0,0,NA,401169291,2020-01-05,
178,3,8:23,1103,1103,Paige Bayliss Offensive Rebound.,22,49,-27,6,0.0124287384293215,SMU,UConn,4,5,0,0,NA,401169291,2020-01-05,
179,3,8:17,1097,1097,Paige Bayliss made Layup.,24,49,-25,19,0.016900929153692644,SMU,UConn,4,5,0,0,NA,401169291,2020-01-05,SMU
180,3,7:58,1078,1078,Christyn Williams missed Jumper.,24,49,-25,0,0.01625918218399336,SMU,UConn,4,5,0,0,NA,401169291,2020-01-05,
181,3,7:58,1078,1078,Christyn Williams Offensive Rebound.,24,49,-25,17,0.01625918218399336,SMU,UConn,4,5,0,0,NA,401169291,2020-01-05,
182,3,7:41,1061,1061,Crystal Dangerfield missed Layup.,24,49,-25,0,0.015686017785327237,SMU,UConn,4,5,0,0,NA,401169291,2020-01-05,
183,3,7:41,1061,1061,Amber Bacon Defensive Rebound.,24,49,-25,12,0.015686017785327237,SMU,UConn,4,5,0,0,NA,401169291,2020-01-05,
184,3,7:29,1049,1049,Johnasia Cash missed Jumper.,24,49,-25,0,0.015279881604663571,SMU,UConn,4,5,0,0,NA,401169291,2020-01-05,
185,3,7:29,1049,1049,Amber Bacon Offensive Rebound.,24,49,-25,4,0.015279881604663571,SMU,UConn,4,5,0,0,NA,401169291,2020-01-05,
186,3,7:25,1045,1045,Amber Bacon made Jumper.,26,49,-23,18,0.021022803933350744,SMU,UConn,4,5,0,0,NA,401169291,2020-01-05,SMU
187,3,7:07,1027,1027,Megan Walker missed Jumper.,26,49,-23,0,0.020239378502227425,SMU,UConn,4,5,0,0,NA,401169291,2020-01-05,
188,3,7:07,1027,1027,Olivia Nelson-Ododa Offensive Rebound.,26,49,-23,5,0.020239378502227425,SMU,UConn,4,5,0,0,NA,401169291,2020-01-05,
189,3,7:02,1022,1022,Foul on Paige Bayliss.,26,49,-23,1,0.020019283899727968,SMU,UConn,4,5,0,0,NA,401169291,2020-01-05,
190,3,7:01,1021,1021,Crystal Dangerfield made Jumper. Assisted by Kyla Irwin.,26,51,-25,18,0.014320771417086552,SMU,UConn,4,5,0,0,NA,401169291,2020-01-05,UConn
191,3,6:43,1003,1003,Paige Bayliss missed Jumper.,26,51,-25,0,0.013692122515604855,SMU,UConn,4,5,0,0,NA,401169291,2020-01-05,
192,3,6:43,1003,1003,Olivia Nelson-Ododa Defensive Rebound.,26,51,-25,8,0.013692122515604855,SMU,UConn,4,5,0,0,NA,401169291,2020-01-05,
193,3,6:35,995,995,Megan Walker made Layup. Assisted by Crystal Dangerfield.,26,53,-27,0,0.009544621317110145,SMU,UConn,4,5,0,0,NA,401169291,2020-01-05,UConn
194,3,6:35,995,995,Foul on JaQuia White.,26,53,-27,0,0.009544621317110145,SMU,UConn,4,5,0,0,NA,401169291,2020-01-05,
195,3,6:35,995,995,Megan Walker made Free Throw.,26,54,-28,14,0.008049047624732835,SMU,UConn,4,5,0,0,NA,401169291,2020-01-05,UConn
196,3,6:21,981,981,Reagan Bradley Turnover.,26,54,-28,0,0.007711249989662295,SMU,UConn,4,5,0,0,NA,401169291,2020-01-05,
197,3,6:21,981,981,Crystal Dangerfield Steal.,26,54,-28,5,0.007711249989662295,SMU,UConn,4,5,0,0,NA,401169291,2020-01-05,
198,3,6:16,976,976,Christyn Williams made Layup. Assisted by Crystal Dangerfield.,26,56,-30,17,0.005370636799225482,SMU,UConn,4,5,0,0,NA,401169291,2020-01-05,UConn
199,3,5:59,959,959,Johnasia Cash missed Layup.,26,56,-30,0,0.005065806903525963,SMU,UConn,4,5,0,0,NA,401169291,2020-01-05,
