play_id,period,time_remaining_period,secs_remaining,secs_remaining_absolute,description,home_score,away_score,score_diff,play_length,win_prob,home,away,home_time_out_remaining,away_time_out_remaining,home_timeout_ind,away_timeout_ind,home_favored_by,game_id,date,whichScored
1,1,9:43,2383,2383,Chennedy Carter Turnover.,0,0,0,10,0.5,Texas A&M,Little Rock,4,4,0,0,NA,401166791,2019-11-05,NA
2,1,9:33,2373,2373,Tori Lasker made Three Point Jumper. Assisted by Alayzha Knapp.,0,3,-3,16,0.4333261582413795,Texas A&M,Little Rock,4,4,0,0,NA,401166791,2019-11-05,Little Rock
3,1,9:17,2357,2357,Chennedy Carter missed Jumper.,0,3,-3,5,0.4328168803056858,Texas A&M,Little Rock,4,4,0,0,NA,401166791,2019-11-05,
4,1,9:12,2352,2352,Alayzha Knapp Defensive Rebound.,0,3,-3,9,0.4326567000509638,Texas A&M,Little Rock,4,4,0,0,NA,401166791,2019-11-05,
5,1,9:03,2343,2343,Krystan Vornes missed Jumper.,0,3,-3,4,0.4323671882528801,Texas A&M,Little Rock,4,4,0,0,NA,401166791,2019-11-05,
6,1,8:59,2339,2339,Chennedy Carter Defensive Rebound.,0,3,-3,14,0.4322380386409041,Texas A&M,Little Rock,4,4,0,0,NA,401166791,2019-11-05,
7,1,8:45,2325,2325,Chennedy Carter missed Three Point Jumper.,0,3,-3,4,0.4317837894411538,Texas A&M,Little Rock,4,4,0,0,NA,401166791,2019-11-05,
8,1,8:41,2321,2321,N'dea Jones Offensive Rebound.,0,3,-3,1,0.4316533888996481,Texas A&M,Little Rock,4,4,0,0,NA,401166791,2019-11-05,
9,1,8:40,2320,2320,Foul on Alayzha Knapp.,0,3,-3,3,0.4316207473002184,Texas A&M,Little Rock,4,4,0,0,NA,401166791,2019-11-05,
10,1,8:37,2317,2317,N'dea Jones made Free Throw.,1,3,-2,0,0.4541886461494085,Texas A&M,Little Rock,4,4,0,0,NA,401166791,2019-11-05,Texas A&M
11,1,8:37,2317,2317,N'dea Jones made Free Throw.,2,3,-1,22,0.47704604854630217,Texas A&M,Little Rock,4,4,0,0,NA,401166791,2019-11-05,Texas A&M
12,1,8:15,2295,2295,Alayzha Knapp made Jumper. Assisted by Tori Lasker.,2,5,-3,13,0.4307995730338573,Texas A&M,Little Rock,4,4,0,0,NA,401166791,2019-11-05,Little Rock
13,1,8:02,2282,2282,Foul on Krystan Vornes.,2,5,-3,6,0.43036891318128423,Texas A&M,Little Rock,4,4,0,0,NA,401166791,2019-11-05,
14,1,7:56,2276,2276,Chennedy Carter Turnover.,2,5,-3,18,0.4301693707440278,Texas A&M,Little Rock,4,4,0,0,NA,401166791,2019-11-05,
15,1,7:38,2258,2258,Kyra Collier missed Three Point Jumper.,2,5,-3,6,0.42956801088553537,Texas A&M,Little Rock,4,4,0,0,NA,401166791,2019-11-05,
16,1,7:32,2252,2252,Ciera Johnson Defensive Rebound.,2,5,-3,6,0.42936670331146465,Texas A&M,Little Rock,4,4,0,0,NA,401166791,2019-11-05,
17,1,7:26,2246,2246,Ciera Johnson made Layup. Assisted by Shambria Washington.,4,5,-1,11,0.4762463316928163,Texas A&M,Little Rock,4,4,0,0,NA,401166791,2019-11-05,Texas A&M
18,1,7:15,2235,2235,Alayzha Knapp missed Jumper.,4,5,-1,3,0.4761204813687841,Texas A&M,Little Rock,4,4,0,0,NA,401166791,2019-11-05,
19,1,7:12,2232,2232,Little Rock Offensive Rebound.,4,5,-1,7,0.4760860834024592,Texas A&M,Little Rock,4,4,0,0,NA,401166791,2019-11-05,
20,1,7:05,2225,2225,Krystan Vornes made Jumper. Assisted by Tori Lasker.,4,7,-3,26,0.4284561277235158,Texas A&M,Little Rock,4,4,0,0,NA,401166791,2019-11-05,Little Rock
21,1,6:39,2199,2199,Ciera Johnson Turnover.,4,7,-3,0,0.427573083497328,Texas A&M,Little Rock,4,4,0,0,NA,401166791,2019-11-05,
22,1,6:39,2199,2199,Krystan Vornes Steal.,4,7,-3,7,0.427573083497328,Texas A&M,Little Rock,4,4,0,0,NA,401166791,2019-11-05,
23,1,6:32,2192,2192,Kyra Collier made Layup.,4,9,-5,18,0.38039045484245276,Texas A&M,Little Rock,4,4,0,0,NA,401166791,2019-11-05,Little Rock
24,1,6:14,2174,2174,Foul on Krystan Vornes.,4,9,-5,5,0.37940371316734106,Texas A&M,Little Rock,4,4,0,0,NA,401166791,2019-11-05,
25,1,6:09,2169,2169,Foul on Teal Battle.,4,9,-5,1,0.3791292358749037,Texas A&M,Little Rock,4,4,0,0,NA,401166791,2019-11-05,
26,1,6:08,2168,2168,Ciera Johnson made Layup. Assisted by Shambria Washington.,6,9,-3,13,0.4265142055072612,Texas A&M,Little Rock,4,4,0,0,NA,401166791,2019-11-05,Texas A&M
27,1,5:55,2155,2155,Alayzha Knapp missed Jumper.,6,9,-3,6,0.4260680477365394,Texas A&M,Little Rock,4,4,0,0,NA,401166791,2019-11-05,
28,1,5:49,2149,2149,Ciera Johnson Defensive Rebound.,6,9,-3,3,0.42586150624207686,Texas A&M,Little Rock,4,4,0,0,NA,401166791,2019-11-05,
29,1,5:46,2146,2146,Foul on Nicole Hemphill.,6,9,-3,0,0.42575808317969266,Texas A&M,Little Rock,4,4,0,0,NA,401166791,2019-11-05,
30,1,5:46,2146,2146,N'dea Jones made Free Throw.,7,9,-2,0,0.4503014044912188,Texas A&M,Little Rock,4,4,0,0,NA,401166791,2019-11-05,Texas A&M
31,1,5:46,2146,2146,N'dea Jones made Free Throw.,8,9,-1,6,0.47508902063357916,Texas A&M,Little Rock,4,4,0,0,NA,401166791,2019-11-05,Texas A&M
32,1,5:40,2140,2140,Tori Lasker Turnover.,8,9,-1,0,0.4750185827432703,Texas A&M,Little Rock,4,4,0,0,NA,401166791,2019-11-05,
33,1,5:40,2140,2140,Chennedy Carter Steal.,8,9,-1,2,0.4750185827432703,Texas A&M,Little Rock,4,4,0,0,NA,401166791,2019-11-05,
34,1,5:38,2138,2138,Foul on Tori Lasker.,8,9,-1,0,0.4749950698399447,Texas A&M,Little Rock,4,4,0,0,NA,401166791,2019-11-05,
35,1,5:38,2138,2138,Chennedy Carter made Free Throw.,9,9,0,0,0.5,Texas A&M,Little Rock,4,4,0,0,NA,401166791,2019-11-05,Texas A&M
36,1,5:38,2138,2138,Chennedy Carter made Free Throw.,10,9,1,17,0.5250049301600552,Texas A&M,Little Rock,4,4,0,0,NA,401166791,2019-11-05,Texas A&M
37,1,5:21,2121,2121,Tori Lasker missed Three Point Jumper.,10,9,1,4,0.5252054912237701,Texas A&M,Little Rock,4,4,0,0,NA,401166791,2019-11-05,
38,1,5:17,2117,2117,N'dea Jones Defensive Rebound.,10,9,1,7,0.5252528699571531,Texas A&M,Little Rock,4,4,0,0,NA,401166791,2019-11-05,
39,1,5:10,2110,2110,Chennedy Carter missed Layup.,10,9,1,5,0.5253359611048554,Texas A&M,Little Rock,4,4,0,0,NA,401166791,2019-11-05,
40,1,5:05,2105,2105,Ciera Johnson Offensive Rebound.,10,9,1,1,0.525395453637831,Texas A&M,Little Rock,4,4,0,0,NA,401166791,2019-11-05,
41,1,5:04,2104,2104,Ciera Johnson made Layup.,12,9,3,26,0.5757012915759318,Texas A&M,Little Rock,4,4,0,0,NA,401166791,2019-11-05,Texas A&M
42,1,4:38,2078,2078,Alayzha Knapp missed Jumper.,12,9,3,5,0.5766164531407736,Texas A&M,Little Rock,4,4,0,0,NA,401166791,2019-11-05,
43,1,4:33,2073,2073,Chennedy Carter Defensive Rebound.,12,9,3,13,0.5767935672383472,Texas A&M,Little Rock,4,4,0,0,NA,401166791,2019-11-05,
44,1,4:20,2060,2060,Official TV Timeout,12,9,3,0,0.5772558407813325,Texas A&M,Little Rock,4,4,0,0,NA,401166791,2019-11-05,
45,1,4:20,2060,2060,Foul on Kyra Collier.,12,9,3,0,0.5772558407813325,Texas A&M,Little Rock,4,4,0,0,NA,401166791,2019-11-05,
46,1,4:20,2060,2060,Shambria Washington missed Free Throw.,12,9,3,0,0.5772558407813325,Texas A&M,Little Rock,4,4,0,0,NA,401166791,2019-11-05,
47,1,4:20,2060,2060,Texas A&M Deadball Team Rebound.,12,9,3,0,0.5772558407813325,Texas A&M,Little Rock,4,4,0,0,NA,401166791,2019-11-05,
48,1,4:20,2060,2060,Shambria Washington made Free Throw.,13,9,4,5,0.6023718946364318,Texas A&M,Little Rock,4,4,0,0,NA,401166791,2019-11-05,Texas A&M
49,1,4:15,2055,2055,Nicole Hemphill missed Jumper.,13,9,4,0,0.6026054815425574,Texas A&M,Little Rock,4,4,0,0,NA,401166791,2019-11-05,
50,1,4:15,2055,2055,Ciera Johnson Block.,13,9,4,11,0.6026054815425574,Texas A&M,Little Rock,4,4,0,0,NA,401166791,2019-11-05,
51,1,4:04,2044,2044,Chennedy Carter Defensive Rebound.,13,9,4,2,0.6031211470294757,Texas A&M,Little Rock,4,4,0,0,NA,401166791,2019-11-05,
52,1,4:02,2042,2042,Shambria Washington made Jumper. Assisted by Chennedy Carter.,15,9,6,18,0.65210837103598,Texas A&M,Little Rock,4,4,0,0,NA,401166791,2019-11-05,Texas A&M
53,1,3:44,2024,2024,Teal Battle made Layup. Assisted by Nicole Hemphill.,15,11,4,17,0.6040652021375604,Texas A&M,Little Rock,4,4,0,0,NA,401166791,2019-11-05,Little Rock
54,1,3:27,2007,2007,Ciera Johnson made Layup. Assisted by Chennedy Carter.,17,11,6,21,0.6544655436488609,Texas A&M,Little Rock,4,4,0,0,NA,401166791,2019-11-05,Texas A&M
55,1,3:06,1986,1986,Nicole Hemphill missed Jumper.,17,11,6,4,0.6558968022544622,Texas A&M,Little Rock,4,4,0,0,NA,401166791,2019-11-05,
56,1,3:02,1982,1982,Ciera Johnson Defensive Rebound.,17,11,6,9,0.6561709455488713,Texas A&M,Little Rock,4,4,0,0,NA,401166791,2019-11-05,
57,1,2:53,1973,1973,Ciera Johnson missed Jumper.,17,11,6,4,0.6567896024885955,Texas A&M,Little Rock,4,4,0,0,NA,401166791,2019-11-05,
58,1,2:49,1969,1969,Little Rock Defensive Rebound.,17,11,6,2,0.6570653882022971,Texas A&M,Little Rock,4,4,0,0,NA,401166791,2019-11-05,
59,1,2:47,1967,1967,Foul on Kayla Wells.,17,11,6,15,0.65720347430361,Texas A&M,Little Rock,4,4,0,0,NA,401166791,2019-11-05,
60,1,2:32,1952,1952,Alayzha Knapp missed Three Point Jumper.,17,11,6,6,0.6582432970252516,Texas A&M,Little Rock,4,4,0,0,NA,401166791,2019-11-05,
61,1,2:26,1946,1946,N'dea Jones Defensive Rebound.,17,11,6,9,0.6586613280258267,Texas A&M,Little Rock,4,4,0,0,NA,401166791,2019-11-05,
62,1,2:17,1937,1937,Chennedy Carter missed Jumper.,17,11,6,5,0.659290679413047,Texas A&M,Little Rock,4,4,0,0,NA,401166791,2019-11-05,
63,1,2:12,1932,1932,Krystan Vornes Defensive Rebound.,17,11,6,14,0.6596415323605215,Texas A&M,Little Rock,4,4,0,0,NA,401166791,2019-11-05,
64,1,1:58,1918,1918,Kyra Collier missed Jumper.,17,11,6,5,0.6606246607258441,Texas A&M,Little Rock,4,4,0,0,NA,401166791,2019-11-05,
65,1,1:53,1913,1913,Chennedy Carter Defensive Rebound.,17,11,6,18,0.6609749934934006,Texas A&M,Little Rock,4,4,0,0,NA,401166791,2019-11-05,
66,1,1:35,1895,1895,Anna Dreimane made Layup. Assisted by N'dea Jones.,19,11,8,18,0.7104736404425661,Texas A&M,Little Rock,4,4,0,0,NA,401166791,2019-11-05,Texas A&M
67,1,1:17,1877,1877,Foul on Anna Dreimane.,19,11,8,1,0.7120133629855722,Texas A&M,Little Rock,4,4,0,0,NA,401166791,2019-11-05,
68,1,1:16,1876,1876,Krystan Vornes missed Free Throw.,19,11,8,0,0.7120988266004088,Texas A&M,Little Rock,4,4,0,0,NA,401166791,2019-11-05,
69,1,1:16,1876,1876,Little Rock Deadball Team Rebound.,19,11,8,0,0.7120988266004088,Texas A&M,Little Rock,4,4,0,0,NA,401166791,2019-11-05,
70,1,1:16,1876,1876,Krystan Vornes made Free Throw.,19,12,7,5,0.6883463176509409,Texas A&M,Little Rock,4,4,0,0,NA,401166791,2019-11-05,Little Rock
71,1,1:11,1871,1871,Aahliyah Jackson missed Jumper.,19,12,7,3,0.6887375514072874,Texas A&M,Little Rock,4,4,0,0,NA,401166791,2019-11-05,
72,1,1:08,1868,1868,Little Rock Defensive Rebound.,19,12,7,11,0.6889723010360082,Texas A&M,Little Rock,4,4,0,0,NA,401166791,2019-11-05,
73,1,0:57,1857,1857,Krystan Vornes Turnover.,19,12,7,0,0.6898333336842516,Texas A&M,Little Rock,4,4,0,0,NA,401166791,2019-11-05,
74,1,0:57,1857,1857,Cheah Rael-Whitsitt Steal.,19,12,7,6,0.6898333336842516,Texas A&M,Little Rock,4,4,0,0,NA,401166791,2019-11-05,
75,1,0:51,1851,1851,Cheah Rael-Whitsitt made Layup.,21,12,9,7,0.7370222350866369,Texas A&M,Little Rock,4,4,0,0,NA,401166791,2019-11-05,Texas A&M
76,1,0:44,1844,1844,Foul on Chennedy Carter.,21,12,9,12,0.7376617585525029,Texas A&M,Little Rock,4,4,0,0,NA,401166791,2019-11-05,
77,1,0:32,1832,1832,Tori Lasker missed Three Point Jumper.,21,12,9,5,0.7387590856164756,Texas A&M,Little Rock,4,4,0,0,NA,401166791,2019-11-05,
78,1,0:27,1827,1827,Teal Battle Offensive Rebound.,21,12,9,13,0.7392168544554463,Texas A&M,Little Rock,4,4,0,0,NA,401166791,2019-11-05,
79,1,0:14,1814,1814,Kyra Collier missed Jumper.,21,12,9,3,0.7404091656828574,Texas A&M,Little Rock,4,4,0,0,NA,401166791,2019-11-05,
80,1,0:11,1811,1811,Texas A&M Defensive Rebound.,21,12,9,10,0.7406848331988772,Texas A&M,Little Rock,4,4,0,0,NA,401166791,2019-11-05,
81,1,0:01,1801,1801,Cheah Rael-Whitsitt missed Jumper.,21,12,9,1,0.741605414355601,Texas A&M,Little Rock,4,4,0,0,NA,401166791,2019-11-05,
82,1,0:00,1800,1800,Little Rock Defensive Rebound.,21,12,9,0,0.7416976282934893,Texas A&M,Little Rock,4,4,0,0,NA,401166791,2019-11-05,
83,1,0:00,1800,1800,End of 1st Quarter,21,12,9,27,0.7416976282934893,Texas A&M,Little Rock,4,4,0,0,NA,401166791,2019-11-05,
84,2,9:33,1773,1773,Alayzha Knapp missed Jumper.,21,12,9,5,0.7442004888989419,Texas A&M,Little Rock,4,4,0,0,NA,401166791,2019-11-05,
85,2,9:28,1768,1768,Cheah Rael-Whitsitt Defensive Rebound.,21,12,9,17,0.7446671822337125,Texas A&M,Little Rock,4,4,0,0,NA,401166791,2019-11-05,
86,2,9:11,1751,1751,Anna Dreimane missed Jumper.,21,12,9,4,0.746262897785954,Texas A&M,Little Rock,4,4,0,0,NA,401166791,2019-11-05,
87,2,9:07,1747,1747,Cheah Rael-Whitsitt Offensive Rebound.,21,12,9,16,0.7466405455796047,Texas A&M,Little Rock,4,4,0,0,NA,401166791,2019-11-05,
88,2,8:51,1731,1731,Aaliyah Wilson missed Three Point Jumper.,21,12,9,3,0.748160389416897,Texas A&M,Little Rock,4,4,0,0,NA,401166791,2019-11-05,
89,2,8:48,1728,1728,Little Rock Defensive Rebound.,21,12,9,23,0.7484471097092533,Texas A&M,Little Rock,4,4,0,0,NA,401166791,2019-11-05,
90,2,8:25,1705,1705,Alayzha Knapp made Jumper.,21,14,7,15,0.7020835959500056,Texas A&M,Little Rock,4,4,0,0,NA,401166791,2019-11-05,Little Rock
91,2,8:10,1690,1690,Chennedy Carter made Layup.,23,14,9,16,0.752133456945712,Texas A&M,Little Rock,4,4,0,0,NA,401166791,2019-11-05,Texas A&M
92,2,7:54,1674,1674,Alayzha Knapp missed Jumper.,23,14,9,3,0.753686154389053,Texas A&M,Little Rock,4,4,0,0,NA,401166791,2019-11-05,
93,2,7:51,1671,1671,Ciera Johnson Defensive Rebound.,23,14,9,8,0.7539726079532525,Texas A&M,Little Rock,4,4,0,0,NA,401166791,2019-11-05,
94,2,7:43,1663,1663,Ciera Johnson made Layup. Assisted by Chennedy Carter.,25,14,11,24,0.7979899432756671,Texas A&M,Little Rock,4,4,0,0,NA,401166791,2019-11-05,Texas A&M
95,2,7:19,1639,1639,Foul on Aaliyah Wilson.,25,14,11,0,0.800354532124145,Texas A&M,Little Rock,4,4,0,0,NA,401166791,2019-11-05,
96,2,7:19,1639,1639,Teal Battle Turnover.,25,14,11,13,0.800354532124145,Texas A&M,Little Rock,4,4,0,0,NA,401166791,2019-11-05,
97,2,7:06,1626,1626,Ciera Johnson made Layup. Assisted by Chennedy Carter.,27,14,13,13,0.83892664461866,Texas A&M,Little Rock,4,4,0,0,NA,401166791,2019-11-05,Texas A&M
98,2,6:53,1613,1613,Alayzha Knapp made Jumper. Assisted by Tori Lasker.,27,16,11,16,0.8028487016634318,Texas A&M,Little Rock,4,4,0,0,NA,401166791,2019-11-05,Little Rock
99,2,6:37,1597,1597,Chennedy Carter made Jumper.,29,16,13,18,0.8416884802100812,Texas A&M,Little Rock,4,4,0,0,NA,401166791,2019-11-05,Texas A&M
100,2,6:19,1579,1579,Tori Lasker missed Three Point Jumper.,29,16,13,3,0.8433852647085467,Texas A&M,Little Rock,4,4,0,0,NA,401166791,2019-11-05,
101,2,6:16,1576,1576,Texas A&M Defensive Rebound.,29,16,13,8,0.8436677562517574,Texas A&M,Little Rock,4,4,0,0,NA,401166791,2019-11-05,
102,2,6:08,1568,1568,Ciera Johnson made Jumper. Assisted by Chennedy Carter.,31,16,15,19,0.8756353374945339,Texas A&M,Little Rock,4,4,0,0,NA,401166791,2019-11-05,Texas A&M
103,2,5:49,1549,1549,Sydney Chastain missed Three Point Jumper.,31,16,15,4,0.8773516190393655,Texas A&M,Little Rock,4,4,0,0,NA,401166791,2019-11-05,
104,2,5:45,1545,1545,Kiana Anderson Offensive Rebound.,31,16,15,2,0.8777143463412824,Texas A&M,Little Rock,4,4,0,0,NA,401166791,2019-11-05,
105,2,5:43,1543,1543,Alayzha Knapp Turnover.,31,16,15,0,0.8778959747060889,Texas A&M,Little Rock,4,4,0,0,NA,401166791,2019-11-05,
106,2,5:43,1543,1543,Ciera Johnson Steal.,31,16,15,5,0.8778959747060889,Texas A&M,Little Rock,4,4,0,0,NA,401166791,2019-11-05,
107,2,5:38,1538,1538,Chennedy Carter made Layup. Assisted by Cheah Rael-Whitsitt.,33,16,17,2,0.9038273300189887,Texas A&M,Little Rock,4,4,0,0,NA,401166791,2019-11-05,Texas A&M
108,2,5:36,1536,1536,Little Rock  Timeout,33,16,17,16,0.9039954391464906,Texas A&M,Little Rock,3,4,1,0,NA,401166791,2019-11-05,
109,2,5:20,1520,1520,Krystan Vornes made Jumper. Assisted by Teal Battle.,33,18,15,22,0.8800017601890399,Texas A&M,Little Rock,3,4,1,0,NA,401166791,2019-11-05,Little Rock
110,2,4:58,1498,1498,Ciera Johnson made Layup. Assisted by Kayla Wells.,35,18,17,23,0.9072348543785803,Texas A&M,Little Rock,3,4,1,0,NA,401166791,2019-11-05,Texas A&M
111,2,4:35,1475,1475,Tori Lasker missed Jumper.,35,18,17,4,0.9092562652414119,Texas A&M,Little Rock,3,4,0,0,NA,401166791,2019-11-05,
112,2,4:31,1471,1471,Ciera Johnson Defensive Rebound.,35,18,17,11,0.9096138785538493,Texas A&M,Little Rock,3,4,0,0,NA,401166791,2019-11-05,
113,2,4:20,1460,1460,Kayla Wells made Three Point Jumper. Assisted by Cheah Rael-Whitsitt.,38,18,20,31,0.9388128908577216,Texas A&M,Little Rock,3,4,0,0,NA,401166791,2019-11-05,Texas A&M
114,2,3:49,1429,1429,Krystan Vornes missed Jumper.,38,18,20,5,0.9411269285569388,Texas A&M,Little Rock,3,4,0,0,NA,401166791,2019-11-05,
115,2,3:44,1424,1424,Cheah Rael-Whitsitt Defensive Rebound.,38,18,20,9,0.9414820828385427,Texas A&M,Little Rock,3,4,0,0,NA,401166791,2019-11-05,
116,2,3:35,1415,1415,Chennedy Carter made Layup.,40,18,22,20,0.9555753073272591,Texas A&M,Little Rock,3,4,0,0,NA,401166791,2019-11-05,Texas A&M
117,2,3:15,1395,1395,Krystan Vornes missed Jumper.,40,18,22,4,0.9567258115315318,Texas A&M,Little Rock,3,4,0,0,NA,401166791,2019-11-05,
118,2,3:11,1391,1391,Jasmine Williams Defensive Rebound.,40,18,22,21,0.9569498627279421,Texas A&M,Little Rock,3,4,0,0,NA,401166791,2019-11-05,
119,2,2:50,1370,1370,Chennedy Carter missed Three Point Jumper.,40,18,22,3,0.9581009939328683,Texas A&M,Little Rock,3,4,0,0,NA,401166791,2019-11-05,
120,2,2:47,1367,1367,Ciera Johnson Offensive Rebound.,40,18,22,0,0.9582626348486223,Texas A&M,Little Rock,3,4,0,0,NA,401166791,2019-11-05,
121,2,2:47,1367,1367,Ciera Johnson made Layup.,42,18,24,6,0.9682810845373494,Texas A&M,Little Rock,3,4,0,0,NA,401166791,2019-11-05,Texas A&M
122,2,2:41,1361,1361,Foul on Tori Lasker.,42,18,24,0,0.9685504412448035,Texas A&M,Little Rock,3,4,0,0,NA,401166791,2019-11-05,
123,2,2:41,1361,1361,Ciera Johnson missed Free Throw.,42,18,24,0,0.9685504412448035,Texas A&M,Little Rock,3,4,0,0,NA,401166791,2019-11-05,
124,2,2:41,1361,1361,Tori Lasker Defensive Rebound.,42,18,24,10,0.9685504412448035,Texas A&M,Little Rock,3,4,0,0,NA,401166791,2019-11-05,
125,2,2:31,1351,1351,Foul on Cheah Rael-Whitsitt.,42,18,24,0,0.9689956116071892,Texas A&M,Little Rock,3,4,0,0,NA,401166791,2019-11-05,
126,2,2:31,1351,1351,Krystan Vornes missed Layup.,42,18,24,0,0.9689956116071892,Texas A&M,Little Rock,3,4,0,0,NA,401166791,2019-11-05,
127,2,2:31,1351,1351,N'dea Jones Defensive Rebound.,42,18,24,30,0.9689956116071892,Texas A&M,Little Rock,3,4,0,0,NA,401166791,2019-11-05,
128,2,2:01,1321,1321,Foul on Teal Battle.,42,18,24,0,0.9703156346640174,Texas A&M,Little Rock,3,4,0,0,NA,401166791,2019-11-05,
129,2,2:01,1321,1321,N'dea Jones made Free Throw.,43,18,25,0,0.9742263905833429,Texas A&M,Little Rock,3,4,0,0,NA,401166791,2019-11-05,Texas A&M
130,2,2:01,1321,1321,N'dea Jones made Free Throw.,44,18,26,9,0.9776338014572825,Texas A&M,Little Rock,3,4,0,0,NA,401166791,2019-11-05,Texas A&M
131,2,1:52,1312,1312,Tori Lasker Turnover.,44,18,26,8,0.9779585505914709,Texas A&M,Little Rock,3,4,0,0,NA,401166791,2019-11-05,
132,2,1:44,1304,1304,Kayla Wells missed Jumper.,44,18,26,2,0.9782476009340081,Texas A&M,Little Rock,3,4,0,0,NA,401166791,2019-11-05,
133,2,1:42,1302,1302,Texas A&M Offensive Rebound.,44,18,26,0,0.978319975118403,Texas A&M,Little Rock,3,4,0,0,NA,401166791,2019-11-05,
134,2,1:42,1302,1302,Foul on Kyra Collier.,44,18,26,12,0.978319975118403,Texas A&M,Little Rock,3,4,0,0,NA,401166791,2019-11-05,
135,2,1:30,1290,1290,Jasmine Williams missed Jumper.,44,18,26,6,0.9787556606956954,Texas A&M,Little Rock,3,4,0,0,NA,401166791,2019-11-05,
136,2,1:24,1284,1284,Cheah Rael-Whitsitt Offensive Rebound.,44,18,26,2,0.9789747062277838,Texas A&M,Little Rock,3,4,0,0,NA,401166791,2019-11-05,
137,2,1:22,1282,1282,Kayla Wells missed Three Point Jumper.,44,18,26,5,0.9790479385648945,Texas A&M,Little Rock,3,4,0,0,NA,401166791,2019-11-05,
138,2,1:17,1277,1277,Teal Battle Defensive Rebound.,44,18,26,8,0.979231546576622,Texas A&M,Little Rock,3,4,0,0,NA,401166791,2019-11-05,
139,2,1:09,1269,1269,Kyra Collier missed Jumper.,44,18,26,4,0.9795270550299502,Texas A&M,Little Rock,3,4,0,0,NA,401166791,2019-11-05,
140,2,1:05,1265,1265,Kayla Wells Defensive Rebound.,44,18,26,10,0.9796756942655553,Texas A&M,Little Rock,3,4,0,0,NA,401166791,2019-11-05,
141,2,0:55,1255,1255,N'dea Jones missed Jumper.,44,18,26,4,0.9800501658479389,Texas A&M,Little Rock,3,4,0,0,NA,401166791,2019-11-05,
142,2,0:51,1251,1251,Texas A&M Offensive Rebound.,44,18,26,8,0.9802011916687027,Texas A&M,Little Rock,3,4,0,0,NA,401166791,2019-11-05,
143,2,0:43,1243,1243,Shambria Washington missed Jumper.,44,18,26,3,0.9805055315226864,Texas A&M,Little Rock,3,4,0,0,NA,401166791,2019-11-05,
144,2,0:40,1240,1240,Sydney Chastain Defensive Rebound.,44,18,26,12,0.9806204809737211,Texas A&M,Little Rock,3,4,0,0,NA,401166791,2019-11-05,
145,2,0:28,1228,1228,Foul on Mckinzie Green.,44,18,26,19,0.9810850242069455,Texas A&M,Little Rock,3,4,0,0,NA,401166791,2019-11-05,
146,2,0:09,1209,1209,Kyra Collier missed Three Point Jumper.,44,18,26,3,0.9818369631961185,Texas A&M,Little Rock,3,4,0,0,NA,401166791,2019-11-05,
147,2,0:06,1206,1206,Little Rock Deadball Team Rebound.,44,18,26,0,0.9819558904869026,Texas A&M,Little Rock,3,4,0,0,NA,401166791,2019-11-05,
148,2,0:06,1206,1206,Little Rock  Turnover.,44,18,26,6,0.9819558904869026,Texas A&M,Little Rock,3,4,0,0,NA,401166791,2019-11-05,
149,2,0:00,1200,1200,End of 2nd Quarter,44,18,26,15,0.9821892262712638,Texas A&M,Little Rock,3,4,0,0,NA,401166791,2019-11-05,
150,3,9:45,1185,1185,Ciera Johnson missed Jumper.,44,18,26,4,0.9827485929078728,Texas A&M,Little Rock,4,5,0,0,NA,401166791,2019-11-05,
151,3,9:41,1181,1181,N'dea Jones Offensive Rebound.,44,18,26,1,0.9828925437203083,Texas A&M,Little Rock,4,5,0,0,NA,401166791,2019-11-05,
152,3,9:40,1180,1180,N'dea Jones made Layup.,46,18,28,15,0.98744357336493,Texas A&M,Little Rock,4,5,0,0,NA,401166791,2019-11-05,Texas A&M
153,3,9:25,1165,1165,Kyra Collier Turnover.,46,18,28,9,0.9878578400315767,Texas A&M,Little Rock,4,5,0,0,NA,401166791,2019-11-05,
154,3,9:16,1156,1156,Foul on Alayzha Knapp.,46,18,28,0,0.9880971229527387,Texas A&M,Little Rock,4,5,0,0,NA,401166791,2019-11-05,
155,3,9:16,1156,1156,N'dea Jones made Free Throw.,47,18,29,0,0.9898172207414924,Texas A&M,Little Rock,4,5,0,0,NA,401166791,2019-11-05,Texas A&M
156,3,9:16,1156,1156,N'dea Jones made Free Throw.,48,18,30,22,0.9912909362344978,Texas A&M,Little Rock,4,5,0,0,NA,401166791,2019-11-05,Texas A&M
157,3,8:54,1134,1134,Alayzha Knapp missed Jumper.,48,18,30,3,0.9917318256062385,Texas A&M,Little Rock,4,5,0,0,NA,401166791,2019-11-05,
158,3,8:51,1131,1131,Krystan Vornes Offensive Rebound.,48,18,30,0,0.9917901608558616,Texas A&M,Little Rock,4,5,0,0,NA,401166791,2019-11-05,
159,3,8:51,1131,1131,Krystan Vornes Turnover.,48,18,30,15,0.9917901608558616,Texas A&M,Little Rock,4,5,0,0,NA,401166791,2019-11-05,
160,3,8:36,1116,1116,Shambria Washington Turnover.,48,18,30,0,0.9920767717096851,Texas A&M,Little Rock,4,5,0,0,NA,401166791,2019-11-05,
161,3,8:36,1116,1116,Kyra Collier Steal.,48,18,30,5,0.9920767717096851,Texas A&M,Little Rock,4,5,0,0,NA,401166791,2019-11-05,
162,3,8:31,1111,1111,Kyra Collier made Jumper.,48,20,28,11,0.989219956495463,Texas A&M,Little Rock,4,5,0,0,NA,401166791,2019-11-05,Little Rock
163,3,8:20,1100,1100,Foul on Tori Lasker.,48,20,28,4,0.9894820615028342,Texas A&M,Little Rock,4,5,0,0,NA,401166791,2019-11-05,
164,3,8:16,1096,1096,Ciera Johnson missed Layup.,48,20,28,2,0.9895766573192009,Texas A&M,Little Rock,4,5,0,0,NA,401166791,2019-11-05,
165,3,8:14,1094,1094,Teal Battle Defensive Rebound.,48,20,28,9,0.9896238362761144,Texas A&M,Little Rock,4,5,0,0,NA,401166791,2019-11-05,
166,3,8:05,1085,1085,Krystan Vornes Turnover.,48,20,28,0,0.9898353247092148,Texas A&M,Little Rock,4,5,0,0,NA,401166791,2019-11-05,
167,3,8:05,1085,1085,Foul on Krystan Vornes.,48,20,28,19,0.9898353247092148,Texas A&M,Little Rock,4,5,0,0,NA,401166791,2019-11-05,
168,3,7:46,1066,1066,Foul on Alayzha Knapp.,48,20,28,1,0.9902790301608925,Texas A&M,Little Rock,4,5,0,0,NA,401166791,2019-11-05,
169,3,7:45,1065,1065,Ciera Johnson missed Layup.,48,20,28,4,0.9903023329365782,Texas A&M,Little Rock,4,5,0,0,NA,401166791,2019-11-05,
170,3,7:41,1061,1061,Tori Lasker Defensive Rebound.,48,20,28,5,0.9903955343402026,Texas A&M,Little Rock,4,5,0,0,NA,401166791,2019-11-05,
171,3,7:36,1056,1056,Kyra Collier made Jumper. Assisted by Tori Lasker.,48,22,26,13,0.9868251750102942,Texas A&M,Little Rock,4,5,0,0,NA,401166791,2019-11-05,Little Rock
172,3,7:23,1043,1043,Chennedy Carter missed Three Point Jumper.,48,22,26,2,0.9872153680294821,Texas A&M,Little Rock,4,5,0,0,NA,401166791,2019-11-05,
173,3,7:21,1041,1041,Tori Lasker Defensive Rebound.,48,22,26,6,0.9872756059975323,Texas A&M,Little Rock,4,5,0,0,NA,401166791,2019-11-05,
174,3,7:15,1035,1035,Nicole Hemphill missed Jumper.,48,22,26,2,0.9874567309935981,Texas A&M,Little Rock,4,5,0,0,NA,401166791,2019-11-05,
175,3,7:13,1033,1033,Ciera Johnson Defensive Rebound.,48,22,26,0,0.9875172542047455,Texas A&M,Little Rock,4,5,0,0,NA,401166791,2019-11-05,
176,3,7:13,1033,1033,Foul on Krystan Vornes.,48,22,26,0,0.9875172542047455,Texas A&M,Little Rock,4,5,0,0,NA,401166791,2019-11-05,
177,3,7:13,1033,1033,Ciera Johnson made Free Throw.,49,22,27,0,0.9894283985107428,Texas A&M,Little Rock,4,5,0,0,NA,401166791,2019-11-05,Texas A&M
178,3,7:13,1033,1033,Ciera Johnson made Free Throw.,50,22,28,10,0.9910495931318655,Texas A&M,Little Rock,4,5,0,0,NA,401166791,2019-11-05,Texas A&M
179,3,7:03,1023,1023,Kyra Collier missed Jumper.,50,22,28,3,0.9912848286296975,Texas A&M,Little Rock,4,5,0,0,NA,401166791,2019-11-05,
180,3,7:00,1020,1020,Texas A&M Defensive Rebound.,50,22,28,20,0.9913556435613831,Texas A&M,Little Rock,4,5,0,0,NA,401166791,2019-11-05,
181,3,6:40,1000,1000,Chennedy Carter made Layup.,52,22,30,25,0.9941881062559128,Texas A&M,Little Rock,4,5,0,0,NA,401166791,2019-11-05,Texas A&M
182,3,6:15,975,975,Tori Lasker made Jumper.,52,24,28,17,0.9924345162462738,Texas A&M,Little Rock,4,5,0,0,NA,401166791,2019-11-05,Little Rock
183,3,5:58,958,958,Chennedy Carter made Layup. Assisted by N'dea Jones.,54,24,30,24,0.9949508717387824,Texas A&M,Little Rock,4,5,0,0,NA,401166791,2019-11-05,Texas A&M
184,3,5:34,934,934,Kyra Collier made Jumper.,54,26,28,15,0.9933131240485646,Texas A&M,Little Rock,4,5,0,0,NA,401166791,2019-11-05,Little Rock
