play_id,period,time_remaining_period,secs_remaining,secs_remaining_absolute,description,home_score,away_score,score_diff,play_length,win_prob,home,away,home_time_out_remaining,away_time_out_remaining,home_timeout_ind,away_timeout_ind,home_favored_by,game_id,date,whichScored
1,1,9:40,2380,2380,Dominique Wilson missed Three Point Jumper.,0,0,0,0,0.5,NC State,LSU,4,4,0,0,NA,400912001,2016-11-26,NA
2,1,9:40,2380,2380,Ayana Mitchell Defensive Rebound.,0,0,0,9,0.5,NC State,LSU,4,4,0,0,NA,400912001,2016-11-26,
3,1,9:31,2371,2371,Chelsea Nelson missed Jumper.,0,0,0,0,0.5,NC State,LSU,4,4,0,0,NA,400912001,2016-11-26,
4,1,9:31,2371,2371,Ayana Mitchell Defensive Rebound.,0,0,0,22,0.5,NC State,LSU,4,4,0,0,NA,400912001,2016-11-26,
5,1,9:09,2349,2349,Chloe Jackson missed Jumper.,0,0,0,0,0.5,NC State,LSU,4,4,0,0,NA,400912001,2016-11-26,
6,1,9:09,2349,2349,NC State Defensive Rebound.,0,0,0,10,0.5,NC State,LSU,4,4,0,0,NA,400912001,2016-11-26,
7,1,8:59,2339,2339,Chelsea Nelson made Layup. Assisted by Jennifer Mathurin.,2,0,2,14,0.5453294949396444,NC State,LSU,4,4,0,0,NA,400912001,2016-11-26,NC State
8,1,8:45,2325,2325,Raigyne Moncrief missed Jumper.,2,0,2,0,0.5456354795997193,NC State,LSU,4,4,0,0,NA,400912001,2016-11-26,
9,1,8:45,2325,2325,Chelsea Nelson Defensive Rebound.,2,0,2,20,0.5456354795997193,NC State,LSU,4,4,0,0,NA,400912001,2016-11-26,
10,1,8:25,2305,2305,Chelsea Nelson Turnover.,2,0,2,1,0.5460764925484636,NC State,LSU,4,4,0,0,NA,400912001,2016-11-26,
11,1,8:24,2304,2304,Ayana Mitchell Steal.,2,0,2,2,0.5460986569417104,NC State,LSU,4,4,0,0,NA,400912001,2016-11-26,
12,1,8:22,2302,2302,Shanice Norton Turnover.,2,0,2,1,0.5461430170165493,NC State,LSU,4,4,0,0,NA,400912001,2016-11-26,
13,1,8:21,2301,2301,Miah Spencer Steal.,2,0,2,2,0.5461652125929003,NC State,LSU,4,4,0,0,NA,400912001,2016-11-26,
14,1,8:19,2299,2299,Foul on Alexis Hyder.,2,0,2,1,0.5462096345603725,NC State,LSU,4,4,0,0,NA,400912001,2016-11-26,
15,1,8:18,2298,2298,Ashley Williams missed Three Point Jumper.,2,0,2,0,0.546231860846261,NC State,LSU,4,4,0,0,NA,400912001,2016-11-26,
16,1,8:18,2298,2298,Alexis Hyder Defensive Rebound.,2,0,2,17,0.546231860846261,NC State,LSU,4,4,0,0,NA,400912001,2016-11-26,
17,1,8:01,2281,2281,Chloe Jackson missed Three Point Jumper.,2,0,2,0,0.5466112148644995,NC State,LSU,4,4,0,0,NA,400912001,2016-11-26,
18,1,8:01,2281,2281,Ayana Mitchell Offensive Rebound.,2,0,2,2,0.5466112148644995,NC State,LSU,4,4,0,0,NA,400912001,2016-11-26,
19,1,7:59,2279,2279,Foul on Miah Spencer.,2,0,2,0,0.5466560252495682,NC State,LSU,4,4,0,0,NA,400912001,2016-11-26,
20,1,7:59,2279,2279,Ayana Mitchell made Free Throw.,2,1,1,0,0.5233790149705406,NC State,LSU,4,4,0,0,NA,400912001,2016-11-26,LSU
21,1,7:59,2279,2279,Ayana Mitchell made Free Throw.,2,2,0,13,0.5,NC State,LSU,4,4,0,0,NA,400912001,2016-11-26,LSU
22,1,7:46,2266,2266,Ashley Williams made Three Point Jumper. Assisted by Dominique Wilson.,5,2,3,25,0.5701642288016177,NC State,LSU,4,4,0,0,NA,400912001,2016-11-26,NC State
23,1,7:21,2241,2241,Shanice Norton missed Jumper.,5,2,3,0,0.5710033843260475,NC State,LSU,4,4,0,0,NA,400912001,2016-11-26,
24,1,7:21,2241,2241,NC State Deadball Team Rebound.,5,2,3,0,0.5710033843260475,NC State,LSU,4,4,0,0,NA,400912001,2016-11-26,
25,1,7:21,2241,2241,Foul on Shanice Norton.,5,2,3,17,0.5710033843260475,NC State,LSU,4,4,0,0,NA,400912001,2016-11-26,
26,1,7:04,2224,2224,Chelsea Nelson made Layup. Assisted by Jennifer Mathurin.,7,2,5,26,0.6178624617880859,NC State,LSU,4,4,0,0,NA,400912001,2016-11-26,NC State
27,1,6:38,2198,2198,Raigyne Moncrief missed Jumper.,7,2,5,0,0.6192811928684706,NC State,LSU,4,4,0,0,NA,400912001,2016-11-26,
28,1,6:38,2198,2198,NC State Deadball Team Rebound.,7,2,5,2,0.6192811928684706,NC State,LSU,4,4,0,0,NA,400912001,2016-11-26,
29,1,6:36,2196,2196,Foul on Alexis Hyder.,7,2,5,16,0.6193906086965474,NC State,LSU,4,4,0,0,NA,400912001,2016-11-26,
30,1,6:20,2180,2180,Chelsea Nelson Turnover.,7,2,5,20,0.6202671196187596,NC State,LSU,4,4,0,0,NA,400912001,2016-11-26,
31,1,6:00,2160,2160,Rina Hill made Jumper.,7,4,3,14,0.5737601383043379,NC State,LSU,4,4,0,0,NA,400912001,2016-11-26,LSU
32,1,5:46,2146,2146,Jennifer Mathurin Turnover.,7,4,3,1,0.5742419168203073,NC State,LSU,4,4,0,0,NA,400912001,2016-11-26,
33,1,5:45,2145,2145,Raigyne Moncrief Steal.,7,4,3,3,0.574276414067759,NC State,LSU,4,4,0,0,NA,400912001,2016-11-26,
34,1,5:42,2142,2142,Raigyne Moncrief made Layup.,7,6,1,14,0.5249579212476474,NC State,LSU,4,4,0,0,NA,400912001,2016-11-26,LSU
35,1,5:28,2128,2128,Jennifer Mathurin made Three Point Jumper. Assisted by Ashley Williams.,10,6,4,15,0.5992408130354591,NC State,LSU,4,4,0,0,NA,400912001,2016-11-26,NC State
36,1,5:13,2113,2113,Foul on Chelsea Nelson.,10,6,4,14,0.5999246557409755,NC State,LSU,4,4,0,0,NA,400912001,2016-11-26,
37,1,4:59,2099,2099,Rina Hill made Jumper.,10,8,2,12,0.5508022130575281,NC State,LSU,4,4,0,0,NA,400912001,2016-11-26,LSU
38,1,4:47,2087,2087,Dominique Wilson Turnover.,10,8,2,0,0.5510872462401781,NC State,LSU,4,4,0,0,NA,400912001,2016-11-26,
39,1,4:47,2087,2087,Official TV Timeout,10,8,2,14,0.5510872462401781,NC State,LSU,4,4,0,0,NA,400912001,2016-11-26,
40,1,4:33,2073,2073,Ayana Mitchell made Layup. Assisted by Jasmine Rhodes.,10,10,0,10,0.5,NC State,LSU,4,4,0,0,NA,400912001,2016-11-26,LSU
41,1,4:23,2063,2063,Foul on Raigyne Moncrief.,10,10,0,17,0.5,NC State,LSU,4,4,0,0,NA,400912001,2016-11-26,
42,1,4:06,2046,2046,Jennifer Mathurin Turnover.,10,10,0,1,0.5,NC State,LSU,4,4,0,0,NA,400912001,2016-11-26,
43,1,4:05,2045,2045,Ayana Mitchell Steal.,10,10,0,6,0.5,NC State,LSU,4,4,0,0,NA,400912001,2016-11-26,
44,1,3:59,2039,2039,Raigyne Moncrief missed Jumper.,10,10,0,0,0.5,NC State,LSU,4,4,0,0,NA,400912001,2016-11-26,
45,1,3:59,2039,2039,DD Rogers Defensive Rebound.,10,10,0,9,0.5,NC State,LSU,4,4,0,0,NA,400912001,2016-11-26,
46,1,3:50,2030,2030,Dominique Wilson missed Three Point Jumper.,10,10,0,0,0.5,NC State,LSU,4,4,0,0,NA,400912001,2016-11-26,
47,1,3:50,2030,2030,Ayana Mitchell Defensive Rebound.,10,10,0,22,0.5,NC State,LSU,4,4,0,0,NA,400912001,2016-11-26,
48,1,3:28,2008,2008,Ayana Mitchell made Layup. Assisted by Jasmine Rhodes.,10,12,-2,0,0.4469976576473915,NC State,LSU,4,4,0,0,NA,400912001,2016-11-26,LSU
49,1,3:28,2008,2008,Foul on Dominique Wilson.,10,12,-2,0,0.4469976576473915,NC State,LSU,4,4,0,0,NA,400912001,2016-11-26,
50,1,3:28,2008,2008,Ayana Mitchell missed Free Throw.,10,12,-2,0,0.4469976576473915,NC State,LSU,4,4,0,0,NA,400912001,2016-11-26,
51,1,3:28,2008,2008,Erika Cassell Defensive Rebound.,10,12,-2,11,0.4469976576473915,NC State,LSU,4,4,0,0,NA,400912001,2016-11-26,
52,1,3:17,1997,1997,DD Rogers missed Layup.,10,12,-2,0,0.44672511638844487,NC State,LSU,4,4,0,0,NA,400912001,2016-11-26,
53,1,3:17,1997,1997,Chloe Jackson Defensive Rebound.,10,12,-2,7,0.44672511638844487,NC State,LSU,4,4,0,0,NA,400912001,2016-11-26,
54,1,3:10,1990,1990,Jasmine Rhodes made Jumper. Assisted by Raigyne Moncrief.,10,14,-4,17,0.3943094797108874,NC State,LSU,4,4,0,0,NA,400912001,2016-11-26,LSU
55,1,2:53,1973,1973,Foul on Ayana Mitchell.,10,14,-4,0,0.3934865439634745,NC State,LSU,4,4,0,0,NA,400912001,2016-11-26,
56,1,2:53,1973,1973,Jennifer Mathurin made Free Throw.,11,14,-3,0,0.4195770133691546,NC State,LSU,4,4,0,0,NA,400912001,2016-11-26,NC State
57,1,2:53,1973,1973,Jennifer Mathurin made Free Throw.,12,14,-2,11,0.4461249570551584,NC State,LSU,4,4,0,0,NA,400912001,2016-11-26,NC State
58,1,2:42,1962,1962,Raigyne Moncrief Turnover.,12,14,-2,27,0.44584725390703656,NC State,LSU,4,4,0,0,NA,400912001,2016-11-26,
59,1,2:15,1935,1935,Miah Spencer made Layup.,14,14,0,27,0.5,NC State,LSU,4,4,0,0,NA,400912001,2016-11-26,NC State
60,1,1:48,1908,1908,Foul on Jasmine Rhodes.,14,14,0,0,0.5,NC State,LSU,4,4,0,0,NA,400912001,2016-11-26,
61,1,1:48,1908,1908,Jasmine Rhodes Turnover.,14,14,0,9,0.5,NC State,LSU,4,4,0,0,NA,400912001,2016-11-26,
62,1,1:39,1899,1899,Foul on Yasmine Bidikuindila.,14,14,0,0,0.5,NC State,LSU,4,4,0,0,NA,400912001,2016-11-26,
63,1,1:39,1899,1899,Miah Spencer made Free Throw.,15,14,1,0,0.527971394843824,NC State,LSU,4,4,0,0,NA,400912001,2016-11-26,NC State
64,1,1:39,1899,1899,Miah Spencer made Free Throw.,16,14,2,14,0.5557682575874999,NC State,LSU,4,4,0,0,NA,400912001,2016-11-26,NC State
65,1,1:25,1885,1885,Jasmine Rhodes missed Jumper.,16,14,2,0,0.5561280298710363,NC State,LSU,4,4,0,0,NA,400912001,2016-11-26,
66,1,1:25,1885,1885,Raigyne Moncrief Offensive Rebound.,16,14,2,23,0.5561280298710363,NC State,LSU,4,4,0,0,NA,400912001,2016-11-26,
67,1,1:02,1862,1862,Chloe Jackson missed Jumper.,16,14,2,0,0.5567198974471086,NC State,LSU,4,4,0,0,NA,400912001,2016-11-26,
68,1,1:02,1862,1862,NC State Defensive Rebound.,16,14,2,0,0.5567198974471086,NC State,LSU,4,4,0,0,NA,400912001,2016-11-26,
69,1,1:02,1862,1862,Foul on Yasmine Bidikuindila.,16,14,2,0,0.5567198974471086,NC State,LSU,4,4,0,0,NA,400912001,2016-11-26,
70,1,1:02,1862,1862,Erika Cassell missed Free Throw.,16,14,2,0,0.5567198974471086,NC State,LSU,4,4,0,0,NA,400912001,2016-11-26,
71,1,1:02,1862,1862,NC State Deadball Team Rebound.,16,14,2,0,0.5567198974471086,NC State,LSU,4,4,0,0,NA,400912001,2016-11-26,
72,1,1:02,1862,1862,Erika Cassell missed Free Throw.,16,14,2,0,0.5567198974471086,NC State,LSU,4,4,0,0,NA,400912001,2016-11-26,
73,1,1:02,1862,1862,Jasmine Rhodes Defensive Rebound.,16,14,2,22,0.5567198974471086,NC State,LSU,4,4,0,0,NA,400912001,2016-11-26,
74,1,0:40,1840,1840,Rina Hill missed Jumper.,16,14,2,0,0.5572884726183811,NC State,LSU,4,4,0,0,NA,400912001,2016-11-26,
75,1,0:40,1840,1840,Ayana Mitchell Offensive Rebound.,16,14,2,2,0.5572884726183811,NC State,LSU,4,4,0,0,NA,400912001,2016-11-26,
76,1,0:38,1838,1838,Ayana Mitchell made Two Point Tip Shot.,16,16,0,9,0.5,NC State,LSU,4,4,0,0,NA,400912001,2016-11-26,LSU
77,1,0:29,1829,1829,Aislinn Konig missed Three Point Jumper.,16,16,0,0,0.5,NC State,LSU,4,4,0,0,NA,400912001,2016-11-26,
78,1,0:29,1829,1829,Aislinn Konig Offensive Rebound.,16,16,0,3,0.5,NC State,LSU,4,4,0,0,NA,400912001,2016-11-26,
79,1,0:26,1826,1826,Aislinn Konig Turnover.,16,16,0,0,0.5,NC State,LSU,4,4,0,0,NA,400912001,2016-11-26,
80,1,0:26,1826,1826,Raigyne Moncrief Steal.,16,16,0,23,0.5,NC State,LSU,4,4,0,0,NA,400912001,2016-11-26,
81,1,0:03,1803,1803,Chloe Jackson made Three Point Jumper. Assisted by Raigyne Moncrief.,16,19,-3,3,0.41311022386360585,NC State,LSU,4,4,0,0,NA,400912001,2016-11-26,LSU
82,1,0:00,1800,1800,End of 1st Quarter,16,19,-3,15,0.4129936088523014,NC State,LSU,4,4,0,0,NA,400912001,2016-11-26,
83,2,9:45,1785,1785,Chloe Jackson Turnover.,16,19,-3,1,0.4124076101339598,NC State,LSU,4,4,0,0,NA,400912001,2016-11-26,
84,2,9:44,1784,1784,Chelsea Nelson Steal.,16,19,-3,24,0.41236835893979923,NC State,LSU,4,4,0,0,NA,400912001,2016-11-26,
85,2,9:20,1760,1760,Kaila Ealey Turnover.,16,19,-3,1,0.4114185117753196,NC State,LSU,4,4,0,0,NA,400912001,2016-11-26,
86,2,9:19,1759,1759,Ayana Mitchell Steal.,16,19,-3,7,0.4113785848180831,NC State,LSU,4,4,0,0,NA,400912001,2016-11-26,
87,2,9:12,1752,1752,Jasmine Rhodes Turnover.,16,19,-3,22,0.4110982454339451,NC State,LSU,4,4,0,0,NA,400912001,2016-11-26,
88,2,8:50,1730,1730,Kaila Ealey missed Three Point Jumper.,16,19,-3,0,0.4102067759952113,NC State,LSU,4,4,0,0,NA,400912001,2016-11-26,
89,2,8:50,1730,1730,Chelsea Nelson Offensive Rebound.,16,19,-3,5,0.4102067759952113,NC State,LSU,4,4,0,0,NA,400912001,2016-11-26,
90,2,8:45,1725,1725,Chelsea Nelson made Two Point Tip Shot.,18,19,-1,33,0.4697073170370531,NC State,LSU,4,4,0,0,NA,400912001,2016-11-26,NC State
91,2,8:12,1692,1692,Rina Hill made Jumper.,18,21,-3,13,0.4086241278038292,NC State,LSU,4,4,0,0,NA,400912001,2016-11-26,LSU
92,2,7:59,1679,1679,Jennifer Mathurin made Three Point Jumper. Assisted by Aislinn Konig.,21,21,0,21,0.5,NC State,LSU,4,4,0,0,NA,400912001,2016-11-26,NC State
93,2,7:38,1658,1658,Chloe Jackson missed Jumper.,21,21,0,0,0.5,NC State,LSU,4,4,0,0,NA,400912001,2016-11-26,
94,2,7:38,1658,1658,Jasmine Rhodes Offensive Rebound.,21,21,0,13,0.5,NC State,LSU,4,4,0,0,NA,400912001,2016-11-26,
95,2,7:25,1645,1645,Jasmine Rhodes made Jumper. Assisted by Raigyne Moncrief.,21,23,-2,16,0.43738236711303696,NC State,LSU,4,4,0,0,NA,400912001,2016-11-26,LSU
96,2,7:09,1629,1629,Chelsea Nelson missed Layup.,21,23,-2,0,0.4369480454900342,NC State,LSU,4,4,0,0,NA,400912001,2016-11-26,
97,2,7:09,1629,1629,LSU Deadball Team Rebound.,21,23,-2,1,0.4369480454900342,NC State,LSU,4,4,0,0,NA,400912001,2016-11-26,
98,2,7:08,1628,1628,Foul on Chelsea Nelson.,21,23,-2,13,0.4369210460663011,NC State,LSU,4,4,0,0,NA,400912001,2016-11-26,
99,2,6:55,1615,1615,Jasmine Rhodes Turnover.,21,23,-2,1,0.43657111896033335,NC State,LSU,4,4,0,0,NA,400912001,2016-11-26,
100,2,6:54,1614,1614,Kaila Ealey Steal.,21,23,-2,6,0.43654426444487016,NC State,LSU,4,4,0,0,NA,400912001,2016-11-26,
101,2,6:48,1608,1608,Miah Spencer made Layup. Assisted by Kaila Ealey.,23,23,0,25,0.5,NC State,LSU,4,4,0,0,NA,400912001,2016-11-26,NC State
102,2,6:23,1583,1583,Raigyne Moncrief missed Three Point Jumper.,23,23,0,0,0.5,NC State,LSU,4,4,0,0,NA,400912001,2016-11-26,
103,2,6:23,1583,1583,Aislinn Konig Defensive Rebound.,23,23,0,11,0.5,NC State,LSU,4,4,0,0,NA,400912001,2016-11-26,
104,2,6:12,1572,1572,Aislinn Konig made Jumper.,25,23,2,28,0.5645846472145819,NC State,LSU,4,4,0,0,NA,400912001,2016-11-26,NC State
105,2,5:44,1544,1544,Shanice Norton missed Jumper.,25,23,2,0,0.5653509298705144,NC State,LSU,4,4,0,0,NA,400912001,2016-11-26,
106,2,5:44,1544,1544,Jennifer Mathurin Defensive Rebound.,25,23,2,17,0.5653509298705144,NC State,LSU,4,4,0,0,NA,400912001,2016-11-26,
107,2,5:27,1527,1527,Foul on Kaila Ealey.,25,23,2,0,0.5658275122425703,NC State,LSU,4,4,0,0,NA,400912001,2016-11-26,
108,2,5:27,1527,1527,Kaila Ealey Turnover.,25,23,2,14,0.5658275122425703,NC State,LSU,4,4,0,0,NA,400912001,2016-11-26,
109,2,5:13,1513,1513,Shanice Norton Turnover.,25,23,2,17,0.5662287303896352,NC State,LSU,4,4,0,0,NA,400912001,2016-11-26,
110,2,4:56,1496,1496,Jennifer Mathurin made Three Point Jumper. Assisted by Kaila Ealey.,28,23,5,26,0.6617925456266601,NC State,LSU,4,4,0,0,NA,400912001,2016-11-26,NC State
111,2,4:30,1470,1470,Ayana Mitchell missed Layup.,28,23,5,0,0.6636087817760821,NC State,LSU,4,4,0,0,NA,400912001,2016-11-26,
112,2,4:30,1470,1470,NC State Defensive Rebound.,28,23,5,1,0.6636087817760821,NC State,LSU,4,4,0,0,NA,400912001,2016-11-26,
113,2,4:29,1469,1469,Official TV Timeout,28,23,5,6,0.6636806142595695,NC State,LSU,4,4,0,0,NA,400912001,2016-11-26,
114,2,4:23,1463,1463,Miah Spencer missed Three Point Jumper.,28,23,5,0,0.664114957375227,NC State,LSU,4,4,0,0,NA,400912001,2016-11-26,
115,2,4:23,1463,1463,Ayana Mitchell Defensive Rebound.,28,23,5,4,0.664114957375227,NC State,LSU,4,4,0,0,NA,400912001,2016-11-26,
116,2,4:19,1459,1459,Foul on Nae Nae Cole.,28,23,5,11,0.6644077942845474,NC State,LSU,4,4,0,0,NA,400912001,2016-11-26,
117,2,4:08,1448,1448,Foul on Kaila Ealey.,28,23,5,9,0.665226553848288,NC State,LSU,4,4,0,0,NA,400912001,2016-11-26,
118,2,3:59,1439,1439,Shanice Norton missed Jumper.,28,23,5,0,0.6658923125143953,NC State,LSU,4,4,0,0,NA,400912001,2016-11-26,
119,2,3:59,1439,1439,Jennifer Mathurin Defensive Rebound.,28,23,5,28,0.6658923125143953,NC State,LSU,4,4,0,0,NA,400912001,2016-11-26,
120,2,3:31,1411,1411,Dominique Wilson missed Jumper.,28,23,5,0,0.667888295504758,NC State,LSU,4,4,0,0,NA,400912001,2016-11-26,
121,2,3:31,1411,1411,Jenna Deemer Defensive Rebound.,28,23,5,25,0.667888295504758,NC State,LSU,4,4,0,0,NA,400912001,2016-11-26,
122,2,3:06,1386,1386,Shanice Norton missed Jumper.,28,23,5,0,0.6696045322993648,NC State,LSU,4,4,0,0,NA,400912001,2016-11-26,
123,2,3:06,1386,1386,Ayana Mitchell Offensive Rebound.,28,23,5,13,0.6696045322993648,NC State,LSU,4,4,0,0,NA,400912001,2016-11-26,
124,2,2:53,1373,1373,Chloe Jackson missed Jumper.,28,23,5,0,0.6704843670956382,NC State,LSU,4,4,0,0,NA,400912001,2016-11-26,
125,2,2:53,1373,1373,NC State Defensive Rebound.,28,23,5,14,0.6704843670956382,NC State,LSU,4,4,0,0,NA,400912001,2016-11-26,
126,2,2:39,1359,1359,Foul on Jenna Deemer.,28,23,5,16,0.6714293828707002,NC State,LSU,4,4,0,0,NA,400912001,2016-11-26,
127,2,2:23,1343,1343,Miah Spencer missed Jumper.,28,23,5,0,0.6725136819649217,NC State,LSU,4,4,0,0,NA,400912001,2016-11-26,
128,2,2:23,1343,1343,Nae Nae Cole Offensive Rebound.,28,23,5,3,0.6725136819649217,NC State,LSU,4,4,0,0,NA,400912001,2016-11-26,
129,2,2:20,1340,1340,Nae Nae Cole made Two Point Tip Shot.,30,23,7,35,0.7327669817712784,NC State,LSU,4,4,0,0,NA,400912001,2016-11-26,NC State
130,2,1:45,1305,1305,Raigyne Moncrief missed Jumper.,30,23,7,0,0.7357987486017279,NC State,LSU,4,4,0,0,NA,400912001,2016-11-26,
131,2,1:45,1305,1305,NC State Defensive Rebound.,30,23,7,15,0.7357987486017279,NC State,LSU,4,4,0,0,NA,400912001,2016-11-26,
132,2,1:30,1290,1290,Foul on Raigyne Moncrief.,30,23,7,0,0.7371495247215187,NC State,LSU,4,4,0,0,NA,400912001,2016-11-26,
133,2,1:30,1290,1290,Miah Spencer made Free Throw.,31,23,8,2,0.7646816776749923,NC State,LSU,4,4,0,0,NA,400912001,2016-11-26,NC State
134,2,1:28,1288,1288,Miah Spencer missed Free Throw.,31,23,8,0,0.7648760981249682,NC State,LSU,4,4,0,0,NA,400912001,2016-11-26,
135,2,1:28,1288,1288,Jennifer Mathurin Offensive Rebound.,31,23,8,2,0.7648760981249682,NC State,LSU,4,4,0,0,NA,400912001,2016-11-26,
136,2,1:26,1286,1286,Foul on Jennifer Mathurin.,31,23,8,0,0.7650713334339682,NC State,LSU,4,4,0,0,NA,400912001,2016-11-26,
137,2,1:26,1286,1286,Jennifer Mathurin Turnover.,31,23,8,14,0.7650713334339682,NC State,LSU,4,4,0,0,NA,400912001,2016-11-26,
138,2,1:12,1272,1272,Jasmine Rhodes made Jumper. Assisted by Alexis Hyder.,31,25,6,8,0.7091650887646833,NC State,LSU,4,4,0,0,NA,400912001,2016-11-26,LSU
139,2,1:04,1264,1264,Miah Spencer Turnover.,31,25,6,1,0.7098707155940871,NC State,LSU,4,4,0,0,NA,400912001,2016-11-26,
140,2,1:03,1263,1263,Chloe Jackson Steal.,31,25,6,9,0.7099599800344327,NC State,LSU,4,4,0,0,NA,400912001,2016-11-26,
141,2,0:54,1254,1254,Jasmine Rhodes missed Layup.,31,25,6,0,0.7107745880121765,NC State,LSU,4,4,0,0,NA,400912001,2016-11-26,
142,2,0:54,1254,1254,Jasmine Rhodes Offensive Rebound.,31,25,6,20,0.7107745880121765,NC State,LSU,4,4,0,0,NA,400912001,2016-11-26,
143,2,0:34,1234,1234,Chloe Jackson missed Jumper.,31,25,6,0,0.7126637505944637,NC State,LSU,4,4,0,0,NA,400912001,2016-11-26,
144,2,0:34,1234,1234,Alexis Hyder Offensive Rebound.,31,25,6,1,0.7126637505944637,NC State,LSU,4,4,0,0,NA,400912001,2016-11-26,
145,2,0:33,1233,1233,Foul on Nae Nae Cole.,31,25,6,0,0.712761301941654,NC State,LSU,4,4,0,0,NA,400912001,2016-11-26,
146,2,0:33,1233,1233,Alexis Hyder made Free Throw.,31,26,5,6,0.6807804706020477,NC State,LSU,4,4,0,0,NA,400912001,2016-11-26,LSU
147,2,0:27,1227,1227,Alexis Hyder missed Free Throw.,31,26,5,0,0.681304149634333,NC State,LSU,4,4,0,0,NA,400912001,2016-11-26,
148,2,0:27,1227,1227,Dominique Wilson Defensive Rebound.,31,26,5,26,0.681304149634333,NC State,LSU,4,4,0,0,NA,400912001,2016-11-26,
149,2,0:01,1201,1201,Dominique Wilson missed Three Point Jumper.,31,26,5,0,0.6836782407911076,NC State,LSU,4,4,0,0,NA,400912001,2016-11-26,
150,2,0:01,1201,1201,Erika Cassell Offensive Rebound.,31,26,5,1,0.6836782407911076,NC State,LSU,4,4,0,0,NA,400912001,2016-11-26,
151,2,0:00,1200,1200,End of 2nd Quarter,31,26,5,12,0.6837696278036713,NC State,LSU,4,4,0,0,NA,400912001,2016-11-26,
152,3,9:48,1188,1188,Ashley Williams missed Three Point Jumper.,31,26,5,0,0.6848518700290044,NC State,LSU,5,5,0,0,NA,400912001,2016-11-26,
153,3,9:48,1188,1188,NC State Offensive Rebound.,31,26,5,1,0.6848518700290044,NC State,LSU,5,5,0,0,NA,400912001,2016-11-26,
154,3,9:47,1187,1187,Foul on Shanice Norton.,31,26,5,0,0.684940948372053,NC State,LSU,5,5,0,0,NA,400912001,2016-11-26,
155,3,9:47,1187,1187,Jennifer Mathurin made Free Throw.,32,26,6,0,0.7174579700037191,NC State,LSU,5,5,0,0,NA,400912001,2016-11-26,NC State
156,3,9:47,1187,1187,Jennifer Mathurin made Free Throw.,33,26,7,16,0.7478543904370976,NC State,LSU,5,5,0,0,NA,400912001,2016-11-26,NC State
157,3,9:31,1171,1171,Chloe Jackson made Three Point Jumper. Assisted by Raigyne Moncrief.,33,29,4,27,0.6516901361600497,NC State,LSU,5,5,0,0,NA,400912001,2016-11-26,LSU
158,3,9:04,1144,1144,Jennifer Mathurin missed Jumper.,33,29,4,0,0.6536450678440313,NC State,LSU,5,5,0,0,NA,400912001,2016-11-26,
159,3,9:04,1144,1144,Chloe Jackson Defensive Rebound.,33,29,4,26,0.6536450678440313,NC State,LSU,5,5,0,0,NA,400912001,2016-11-26,
160,3,8:38,1118,1118,Chloe Jackson missed Three Point Jumper.,33,29,4,0,0.6555128186475119,NC State,LSU,5,5,0,0,NA,400912001,2016-11-26,
161,3,8:38,1118,1118,Alexis Hyder Offensive Rebound.,33,29,4,14,0.6555128186475119,NC State,LSU,5,5,0,0,NA,400912001,2016-11-26,
162,3,8:24,1104,1104,Chloe Jackson Turnover.,33,29,4,1,0.6565279439025301,NC State,LSU,5,5,0,0,NA,400912001,2016-11-26,
163,3,8:23,1103,1103,Jennifer Mathurin Steal.,33,29,4,11,0.6566009559980501,NC State,LSU,5,5,0,0,NA,400912001,2016-11-26,
164,3,8:12,1092,1092,Foul on Chloe Jackson.,33,29,4,0,0.6574099099169513,NC State,LSU,5,5,0,0,NA,400912001,2016-11-26,
165,3,8:12,1092,1092,Chelsea Nelson made Free Throw.,34,29,5,0,0.6931136171031165,NC State,LSU,5,5,0,0,NA,400912001,2016-11-26,NC State
166,3,8:12,1092,1092,Chelsea Nelson made Free Throw.,35,29,6,15,0.7266435857563123,NC State,LSU,5,5,0,0,NA,400912001,2016-11-26,NC State
167,3,7:57,1077,1077,Chloe Jackson missed Jumper.,35,29,6,0,0.7281299370592217,NC State,LSU,5,5,0,0,NA,400912001,2016-11-26,
168,3,7:57,1077,1077,Ayana Mitchell Offensive Rebound.,35,29,6,11,0.7281299370592217,NC State,LSU,5,5,0,0,NA,400912001,2016-11-26,
169,3,7:46,1066,1066,Shanice Norton Turnover.,35,29,6,2,0.7292445556117306,NC State,LSU,5,5,0,0,NA,400912001,2016-11-26,
170,3,7:44,1064,1064,Miah Spencer Steal.,35,29,6,2,0.729449827743825,NC State,LSU,5,5,0,0,NA,400912001,2016-11-26,
171,3,7:42,1062,1062,Miah Spencer made Layup.,37,29,8,10,0.7898193846756835,NC State,LSU,5,5,0,0,NA,400912001,2016-11-26,NC State
172,3,7:32,1052,1052,LSU  Timeout,37,29,8,17,0.790990455622846,NC State,LSU,4,5,1,0,NA,400912001,2016-11-26,
173,3,7:15,1035,1035,Foul on Alexis Hyder.,37,29,8,0,0.7930433880293271,NC State,LSU,4,5,1,0,NA,400912001,2016-11-26,
174,3,7:15,1035,1035,Alexis Hyder Turnover.,37,29,8,16,0.7930433880293271,NC State,LSU,4,5,1,0,NA,400912001,2016-11-26,
175,3,6:59,1019,1019,Ashley Williams made Three Point Jumper. Assisted by Miah Spencer.,40,29,11,18,0.8657716670829514,NC State,LSU,4,5,1,0,NA,400912001,2016-11-26,NC State
176,3,6:41,1001,1001,Foul on Miah Spencer.,40,29,11,0,0.8680984266980816,NC State,LSU,4,5,1,0,NA,400912001,2016-11-26,
177,3,6:41,1001,1001,Ayana Mitchell made Free Throw.,40,30,10,0,0.8472190056788539,NC State,LSU,4,5,1,0,NA,400912001,2016-11-26,LSU
178,3,6:41,1001,1001,Ayana Mitchell made Free Throw.,40,31,9,21,0.8237056736953667,NC State,LSU,4,5,1,0,NA,400912001,2016-11-26,LSU
179,3,6:20,980,980,Miah Spencer missed Three Point Jumper.,40,31,9,0,0.826684040128418,NC State,LSU,4,5,0,0,NA,400912001,2016-11-26,
180,3,6:20,980,980,Ayana Mitchell Defensive Rebound.,40,31,9,10,0.826684040128418,NC State,LSU,4,5,0,0,NA,400912001,2016-11-26,
181,3,6:10,970,970,Ayana Mitchell made Layup.,40,33,7,25,0.7726320724573263,NC State,LSU,4,5,0,0,NA,400912001,2016-11-26,LSU
182,3,5:45,945,945,Dominique Wilson missed Jumper.,40,33,7,0,0.7759986362801451,NC State,LSU,4,5,0,0,NA,400912001,2016-11-26,
183,3,5:45,945,945,Chelsea Nelson Offensive Rebound.,40,33,7,11,0.7759986362801451,NC State,LSU,4,5,0,0,NA,400912001,2016-11-26,
184,3,5:34,934,934,Miah Spencer Turnover.,40,33,7,1,0.7773387706934464,NC State,LSU,4,5,0,0,NA,400912001,2016-11-26,
185,3,5:33,933,933,Raigyne Moncrief Steal.,40,33,7,3,0.777457102105071,NC State,LSU,4,5,0,0,NA,400912001,2016-11-26,
186,3,5:30,930,930,Raigyne Moncrief made Layup.,40,35,5,14,0.7099125462282376,NC State,LSU,4,5,0,0,NA,400912001,2016-11-26,LSU
187,3,5:16,916,916,Miah Spencer Turnover.,40,35,5,7,0.7112638901355772,NC State,LSU,4,5,0,0,NA,400912001,2016-11-26,
188,3,5:09,909,909,Rina Hill Turnover.,40,35,5,1,0.7119163190932094,NC State,LSU,4,5,0,0,NA,400912001,2016-11-26,
189,3,5:08,908,908,Ashley Williams Steal.,40,35,5,9,0.7120085048744804,NC State,LSU,4,5,0,0,NA,400912001,2016-11-26,
190,3,4:59,899,899,Ashley Williams missed Layup.,40,35,5,1,0.7128288507324333,NC State,LSU,4,5,0,0,NA,400912001,2016-11-26,
191,3,4:58,898,898,Rina Hill Block.,40,35,5,0,0.7129191166608061,NC State,LSU,4,5,0,0,NA,400912001,2016-11-26,
192,3,4:58,898,898,NC State Offensive Rebound.,40,35,5,6,0.7129191166608061,NC State,LSU,4,5,0,0,NA,400912001,2016-11-26,
193,3,4:52,892,892,Miah Spencer missed Three Point Jumper.,40,35,5,0,0.7134579304921927,NC State,LSU,4,5,0,0,NA,400912001,2016-11-26,
194,3,4:52,892,892,Ayana Mitchell Defensive Rebound.,40,35,5,0,0.7134579304921927,NC State,LSU,4,5,0,0,NA,400912001,2016-11-26,
195,3,4:52,892,892,Official TV Timeout,40,35,5,19,0.7134579304921927,NC State,LSU,4,5,0,0,NA,400912001,2016-11-26,
196,3,4:33,873,873,Rina Hill missed Jumper.,40,35,5,0,0.7151496836859742,NC State,LSU,4,5,0,0,NA,400912001,2016-11-26,
197,3,4:33,873,873,Ayana Mitchell Offensive Rebound.,40,35,5,6,0.7151496836859742,NC State,LSU,4,5,0,0,NA,400912001,2016-11-26,
198,3,4:27,867,867,Rina Hill missed Jumper.,40,35,5,0,0.7156856968495351,NC State,LSU,4,5,0,0,NA,400912001,2016-11-26,
199,3,4:27,867,867,Ayana Mitchell Offensive Rebound.,40,35,5,10,0.7156856968495351,NC State,LSU,4,5,0,0,NA,400912001,2016-11-26,
200,3,4:17,857,857,Alexis Hyder missed Jumper.,40,35,5,0,0.7165885355264893,NC State,LSU,4,5,0,0,NA,400912001,2016-11-26,
201,3,4:17,857,857,Dominique Wilson Defensive Rebound.,40,35,5,9,0.7165885355264893,NC State,LSU,4,5,0,0,NA,400912001,2016-11-26,
202,3,4:08,848,848,Ashley Williams made Three Point Jumper. Assisted by Jennifer Mathurin.,43,35,8,32,0.8161826674138176,NC State,LSU,4,5,0,0,NA,400912001,2016-11-26,NC State
203,3,3:36,816,816,Raigyne Moncrief Turnover.,43,35,8,22,0.8199029777442649,NC State,LSU,4,5,0,0,NA,400912001,2016-11-26,
