play_id,period,time_remaining_period,secs_remaining,secs_remaining_absolute,description,home_score,away_score,score_diff,play_length,win_prob,home,away,home_time_out_remaining,away_time_out_remaining,home_timeout_ind,away_timeout_ind,home_favored_by,game_id,date,whichScored
203,3,1:01,661,661,Stephanie Lesko Turnover.,57,53,4,18,0.6997369402180723,Army,Bryant,5,5,0,0,NA,401179117,2019-12-29,
204,3,0:43,643,643,Foul on Stephanie Lesko.,57,53,4,0,0.7017796878718116,Army,Bryant,5,5,0,0,NA,401179117,2019-12-29,
205,3,0:43,643,643,Lindsey Scamman missed Free Throw.,57,53,4,0,0.7017796878718116,Army,Bryant,5,5,0,0,NA,401179117,2019-12-29,
206,3,0:43,643,643,Army Offensive Rebound.,57,53,4,0,0.7017796878718116,Army,Bryant,5,5,0,0,NA,401179117,2019-12-29,
207,3,0:43,643,643,Lindsey Scamman made Free Throw.,58,53,5,9,0.7445462801002132,Army,Bryant,5,5,0,0,NA,401179117,2019-12-29,Army
208,3,0:34,634,634,Masey Zegarowski made Three Point Jumper.,58,56,2,26,0.6059760560733396,Army,Bryant,5,5,0,0,NA,401179117,2019-12-29,Bryant
209,3,0:08,608,608,Kamryn Hall Turnover.,58,56,2,8,0.60789713332901,Army,Bryant,5,5,0,0,NA,401179117,2019-12-29,
210,3,0:00,600,600,Kandis Taylor missed Layup.,58,56,2,0,0.6085599051970726,Army,Bryant,5,5,0,0,NA,401179117,2019-12-29,
211,3,0:00,600,600,Trinity Bravo Offensive Rebound.,58,56,2,0,0.6085599051970726,Army,Bryant,5,5,0,0,NA,401179117,2019-12-29,
212,3,0:00,600,600,Trinity Bravo made Layup.,58,58,0,0,0.5,Army,Bryant,5,5,0,0,NA,401179117,2019-12-29,Bryant
213,3,0:00,600,600,End of 3rd Quarter,58,58,0,17,0.5,Army,Bryant,5,5,0,0,NA,401179117,2019-12-29,
214,4,9:43,583,583,Lindsey Scamman missed Layup.,58,58,0,5,0.5,Army,Bryant,6,6,0,0,NA,401179117,2019-12-29,
215,4,9:38,578,578,Kamryn Hall Offensive Rebound.,58,58,0,0,0.5,Army,Bryant,6,6,0,0,NA,401179117,2019-12-29,
216,4,9:38,578,578,Kamryn Hall made Layup.,60,58,2,12,0.6106202317801906,Army,Bryant,6,6,0,0,NA,401179117,2019-12-29,Army
217,4,9:26,566,566,Trinity Bravo made Jumper. Assisted by Masey Zegarowski.,60,60,0,22,0.5,Army,Bryant,6,6,0,0,NA,401179117,2019-12-29,Bryant
218,4,9:04,544,544,Alisa Fallon made Three Point Jumper. Assisted by Lindsey Scamman.,63,60,3,15,0.6682619890846144,Army,Bryant,6,6,0,0,NA,401179117,2019-12-29,Army
219,4,8:49,529,529,Sydney Holloway missed Layup.,63,60,3,5,0.670636362491879,Army,Bryant,6,6,0,0,NA,401179117,2019-12-29,
220,4,8:44,524,524,Hope Brown Defensive Rebound.,63,60,3,2,0.6713551681176607,Army,Bryant,6,6,0,0,NA,401179117,2019-12-29,
221,4,8:42,522,522,Lindsey Scamman made Layup.,65,60,5,15,0.7672147607205397,Army,Bryant,6,6,0,0,NA,401179117,2019-12-29,Army
222,4,8:27,507,507,Masey Zegarowski missed Three Point Jumper.,65,60,5,3,0.7699253823271995,Army,Bryant,6,6,0,0,NA,401179117,2019-12-29,
223,4,8:24,504,504,Bryant Offensive Rebound.,65,60,5,10,0.7704536931896873,Army,Bryant,6,6,0,0,NA,401179117,2019-12-29,
224,4,8:14,494,494,Sydney Holloway missed Jumper.,65,60,5,5,0.7722236478441535,Army,Bryant,6,6,0,0,NA,401179117,2019-12-29,
225,4,8:09,489,489,Masey Zegarowski Offensive Rebound.,65,60,5,8,0.7731291316240244,Army,Bryant,6,6,0,0,NA,401179117,2019-12-29,
226,4,8:01,481,481,Kandis Taylor Turnover.,65,60,5,0,0.7746331501808,Army,Bryant,6,6,0,0,NA,401179117,2019-12-29,
227,4,8:01,481,481,Lindsey Scamman Steal.,65,60,5,3,0.7746331501808,Army,Bryant,6,6,0,0,NA,401179117,2019-12-29,
228,4,7:58,478,478,Foul on Kandis Taylor.,65,60,5,0,0.7752205076858052,Army,Bryant,6,6,0,0,NA,401179117,2019-12-29,
229,4,7:58,478,478,Lindsey Scamman missed Free Throw.,65,60,5,0,0.7752205076858052,Army,Bryant,6,6,0,0,NA,401179117,2019-12-29,
230,4,7:58,478,478,Army Offensive Rebound.,65,60,5,0,0.7752205076858052,Army,Bryant,6,6,0,0,NA,401179117,2019-12-29,
231,4,7:58,478,478,Lindsey Scamman made Free Throw.,66,60,6,19,0.8154219278524143,Army,Bryant,6,6,0,0,NA,401179117,2019-12-29,Army
232,4,7:39,459,459,Kandis Taylor missed Layup.,66,60,6,3,0.8197130485914362,Army,Bryant,6,6,0,0,NA,401179117,2019-12-29,
233,4,7:36,456,456,Kamryn Hall Defensive Rebound.,66,60,6,3,0.8204763860005609,Army,Bryant,6,6,0,0,NA,401179117,2019-12-29,
234,4,7:33,453,453,Foul on Lindsey Scamman.,66,60,6,0,0.8212676279020021,Army,Bryant,6,6,0,0,NA,401179117,2019-12-29,
235,4,7:33,453,453,Lindsey Scamman Turnover.,66,60,6,19,0.8212676279020021,Army,Bryant,6,6,0,0,NA,401179117,2019-12-29,
236,4,7:14,434,434,Trinity Bravo missed Jumper.,66,60,6,3,0.8270227286046149,Army,Bryant,6,6,0,0,NA,401179117,2019-12-29,
237,4,7:11,431,431,Alisa Fallon Defensive Rebound.,66,60,6,15,0.8280629618573261,Army,Bryant,6,6,0,0,NA,401179117,2019-12-29,
238,4,6:56,416,416,Kamryn Hall missed Three Point Jumper.,66,60,6,5,0.8331312418070059,Army,Bryant,6,6,0,0,NA,401179117,2019-12-29,
239,4,6:51,411,411,Sydney Holloway Defensive Rebound.,66,60,6,14,0.8347004807837618,Army,Bryant,6,6,0,0,NA,401179117,2019-12-29,
240,4,6:37,397,397,Sydney Holloway missed Layup.,66,60,6,4,0.8389078304278192,Army,Bryant,6,6,0,0,NA,401179117,2019-12-29,
241,4,6:33,393,393,Alisa Fallon Defensive Rebound.,66,60,6,16,0.8400830958255573,Army,Bryant,6,6,0,0,NA,401179117,2019-12-29,
242,4,6:17,377,377,Foul on Kandis Taylor.,66,60,6,10,0.8448116391926007,Army,Bryant,6,6,0,0,NA,401179117,2019-12-29,
243,4,6:07,367,367,Alisa Fallon missed Three Point Jumper.,66,60,6,3,0.8478874807018262,Army,Bryant,6,6,0,0,NA,401179117,2019-12-29,
244,4,6:04,364,364,Lindsey Scamman Offensive Rebound.,66,60,6,13,0.8488417350827672,Army,Bryant,6,6,0,0,NA,401179117,2019-12-29,
245,4,5:51,351,351,Lindsey Scamman made Layup.,68,60,8,21,0.9126637758915124,Army,Bryant,6,6,0,0,NA,401179117,2019-12-29,Army
246,4,5:30,330,330,Taty LaFrance Boyce made Layup.,68,62,6,24,0.8612795856735871,Army,Bryant,6,6,0,0,NA,401179117,2019-12-29,Bryant
247,4,5:06,306,306,Alisa Fallon made Layup.,70,62,8,0,0.9283318810424046,Army,Bryant,6,6,0,0,NA,401179117,2019-12-29,Army
248,4,5:06,306,306,Foul on Masey Zegarowski.,70,62,8,0,0.9283318810424046,Army,Bryant,6,6,0,0,NA,401179117,2019-12-29,
249,4,5:06,306,306,Alisa Fallon missed Free Throw.,70,62,8,0,0.9283318810424046,Army,Bryant,6,6,0,0,NA,401179117,2019-12-29,
250,4,5:06,306,306,Masey Zegarowski Defensive Rebound.,70,62,8,19,0.9283318810424046,Army,Bryant,6,6,0,0,NA,401179117,2019-12-29,
251,4,4:47,287,287,Taty LaFrance Boyce made Layup. Assisted by Sydney Holloway.,70,64,6,16,0.875345284148925,Army,Bryant,6,6,0,0,NA,401179117,2019-12-29,Bryant
252,4,4:31,271,271,Morgann Yancey Turnover.,70,64,6,0,0.8735669060725605,Army,Bryant,6,6,0,0,NA,401179117,2019-12-29,
253,4,4:31,271,271,Taty LaFrance Boyce Steal.,70,64,6,8,0.8735669060725605,Army,Bryant,6,6,0,0,NA,401179117,2019-12-29,
254,4,4:23,263,263,Nicole Gallagher made Three Point Jumper. Assisted by Masey Zegarowski.,70,67,3,19,0.7229911854531289,Army,Bryant,6,6,0,0,NA,401179117,2019-12-29,Bryant
255,4,4:04,244,244,Alisa Fallon missed Jumper.,70,67,3,6,0.72001229182557,Army,Bryant,6,6,0,0,NA,401179117,2019-12-29,
256,4,3:58,238,238,Trinity Bravo Defensive Rebound.,70,67,3,6,0.7196448763710123,Army,Bryant,6,6,0,0,NA,401179117,2019-12-29,
257,4,3:52,232,232,Foul on Kamryn Hall.,70,67,3,0,0.7197609786510355,Army,Bryant,6,6,0,0,NA,401179117,2019-12-29,
258,4,3:52,232,232,Official TV Timeout,70,67,3,0,0.7197609786510355,Army,Bryant,6,6,0,0,NA,401179117,2019-12-29,
259,4,3:52,232,232,Nicole Gallagher missed Free Throw.,70,67,3,0,0.7197609786510355,Army,Bryant,6,6,0,0,NA,401179117,2019-12-29,
260,4,3:52,232,232,Bryant Offensive Rebound.,70,67,3,0,0.7197609786510355,Army,Bryant,6,6,0,0,NA,401179117,2019-12-29,
261,4,3:52,232,232,Nicole Gallagher made Free Throw.,70,68,2,30,0.6522288534713373,Army,Bryant,6,6,0,0,NA,401179117,2019-12-29,Bryant
262,4,3:22,202,202,Alisa Fallon made Layup.,72,68,4,0,0.7920373520715688,Army,Bryant,6,6,0,0,NA,401179117,2019-12-29,Army
263,4,3:22,202,202,Foul on Trinity Bravo.,72,68,4,0,0.7920373520715688,Army,Bryant,6,6,0,0,NA,401179117,2019-12-29,
264,4,3:22,202,202,Alisa Fallon made Free Throw.,73,68,5,14,0.8417840428025303,Army,Bryant,6,6,0,0,NA,401179117,2019-12-29,Army
265,4,3:08,188,188,Masey Zegarowski missed Three Point Jumper.,73,68,5,5,0.8575212470708322,Army,Bryant,6,6,0,0,NA,401179117,2019-12-29,
266,4,3:03,183,183,Kamryn Hall Defensive Rebound.,73,68,5,7,0.8637928669705727,Army,Bryant,6,6,0,0,NA,401179117,2019-12-29,
267,4,2:56,176,176,Lindsey Scamman missed Layup.,73,68,5,5,0.8722888451668948,Army,Bryant,6,6,0,0,NA,401179117,2019-12-29,
268,4,2:51,171,171,Sydney Holloway Defensive Rebound.,73,68,5,12,0.8781966349468286,Army,Bryant,6,6,0,0,NA,401179117,2019-12-29,
269,4,2:39,159,159,Nicole Gallagher made Layup.,73,70,3,0,0.7801785408861204,Army,Bryant,6,6,0,0,NA,401179117,2019-12-29,Bryant
270,4,2:39,159,159,Foul on Sarah Bohn.,73,70,3,0,0.7801785408861204,Army,Bryant,6,6,0,0,NA,401179117,2019-12-29,
271,4,2:39,159,159,Nicole Gallagher made Free Throw.,73,71,2,13,0.699406111450281,Army,Bryant,6,6,0,0,NA,401179117,2019-12-29,Bryant
272,4,2:26,146,146,Hope Brown missed Layup.,73,71,2,1,0.7127206434835947,Army,Bryant,6,6,0,0,NA,401179117,2019-12-29,
273,4,2:25,145,145,Bryant Defensive Rebound.,73,71,2,17,0.7137896765558924,Army,Bryant,6,6,0,0,NA,401179117,2019-12-29,
274,4,2:08,128,128,Nicole Gallagher missed Layup.,73,71,2,4,0.7331517607863052,Army,Bryant,6,6,0,0,NA,401179117,2019-12-29,
275,4,2:04,124,124,Sarah Bohn Defensive Rebound.,73,71,2,18,0.7380665186877399,Army,Bryant,6,6,0,0,NA,401179117,2019-12-29,
276,4,1:46,106,106,Alisa Fallon made Layup. Assisted by Kamryn Hall.,75,71,4,0,0.9111675095948524,Army,Bryant,6,6,0,0,NA,401179117,2019-12-29,Army
277,4,1:46,106,106,Foul on Sydney Holloway.,75,71,4,0,0.9111675095948524,Army,Bryant,6,6,0,0,NA,401179117,2019-12-29,
278,4,1:46,106,106,Alisa Fallon made Free Throw.,76,71,5,19,0.9483369899375026,Army,Bryant,6,6,0,0,NA,401179117,2019-12-29,Army
279,4,1:27,87,87,Masey Zegarowski Turnover.,76,71,5,10,0.9650143075541419,Army,Bryant,6,6,0,0,NA,401179117,2019-12-29,
280,4,1:17,77,77,Foul on Nicole Gallagher.,76,71,5,0,0.9720701627339999,Army,Bryant,6,6,0,0,NA,401179117,2019-12-29,
281,4,1:17,77,77,Lindsey Scamman made Free Throw.,77,71,6,0,0.9860699500085277,Army,Bryant,6,6,0,0,NA,401179117,2019-12-29,Army
282,4,1:17,77,77,Lindsey Scamman missed Free Throw.,77,71,6,2,0.9860699500085277,Army,Bryant,6,6,0,0,NA,401179117,2019-12-29,
283,4,1:15,75,75,Trinity Bravo Defensive Rebound.,77,71,6,14,0.9868471360308688,Army,Bryant,6,6,0,0,NA,401179117,2019-12-29,
284,4,1:01,61,61,Foul on Kamryn Hall.,77,71,6,12,0.9914100405717468,Army,Bryant,6,6,0,0,NA,401179117,2019-12-29,
285,4,0:49,49,49,Sydney Holloway made Layup.,77,73,4,1,0.9686021294784665,Army,Bryant,6,6,0,0,NA,401179117,2019-12-29,Bryant
286,4,0:48,48,48,Army  Turnover.,77,73,4,6,0.9692875630820613,Army,Bryant,6,6,0,0,NA,401179117,2019-12-29,
287,4,0:42,42,42,Masey Zegarowski missed Jumper.,77,73,4,2,0.9731853991727926,Army,Bryant,6,6,0,0,NA,401179117,2019-12-29,
288,4,0:40,40,40,Lindsey Scamman Defensive Rebound.,77,73,4,0,0.9744030910750776,Army,Bryant,6,6,0,0,NA,401179117,2019-12-29,
289,4,0:40,40,40,Foul on Taty LaFrance Boyce.,77,73,4,0,0.9744030910750776,Army,Bryant,6,6,0,0,NA,401179117,2019-12-29,
290,4,0:40,40,40,Lindsey Scamman made Free Throw.,78,73,5,0,0.9895349281097368,Army,Bryant,6,6,0,0,NA,401179117,2019-12-29,Army
291,4,0:40,40,40,Lindsey Scamman made Free Throw.,79,73,6,7,0.9957603681857803,Army,Bryant,6,6,0,0,NA,401179117,2019-12-29,Army
292,4,0:33,33,33,Masey Zegarowski missed Layup.,79,73,6,3,0.9967167021686995,Army,Bryant,6,6,0,0,NA,401179117,2019-12-29,
293,4,0:30,30,30,Taty LaFrance Boyce Offensive Rebound.,79,73,6,2,0.9970651653895116,Army,Bryant,6,6,0,0,NA,401179117,2019-12-29,
294,4,0:28,28,28,Trinity Bravo missed Three Point Jumper.,79,73,6,1,0.99727880563173,Army,Bryant,6,6,0,0,NA,401179117,2019-12-29,
295,4,0:27,27,27,Army Defensive Rebound.,79,73,6,0,0.9973802969153209,Army,Bryant,6,6,0,0,NA,401179117,2019-12-29,
296,4,0:27,27,27,Army Defensive Rebound.,79,73,6,11,0.9973802969153209,Army,Bryant,6,6,0,0,NA,401179117,2019-12-29,
297,4,0:16,16,16,Foul on Masey Zegarowski.,79,73,6,0,0.9982982008592165,Army,Bryant,6,6,0,0,NA,401179117,2019-12-29,
298,4,0:16,16,16,Hope Brown missed Free Throw.,79,73,6,0,0.9982982008592165,Army,Bryant,6,6,0,0,NA,401179117,2019-12-29,
299,4,0:16,16,16,Army Offensive Rebound.,79,73,6,0,0.9982982008592165,Army,Bryant,6,6,0,0,NA,401179117,2019-12-29,
300,4,0:16,16,16,Hope Brown made Free Throw.,80,73,7,3,0.9994111560645645,Army,Bryant,6,6,0,0,NA,401179117,2019-12-29,Army
301,4,0:13,13,13,Taty LaFrance Boyce made Layup. Assisted by Masey Zegarowski.,80,75,5,3,0.9955704200149512,Army,Bryant,6,6,0,0,NA,401179117,2019-12-29,Bryant
302,4,0:10,10,10,Foul on Trinity Bravo.,80,75,5,0,0.9960097291441499,Army,Bryant,6,6,0,0,NA,401179117,2019-12-29,
303,4,0:10,10,10,Alisa Fallon missed Free Throw.,80,75,5,0,0.9960097291441499,Army,Bryant,6,6,0,0,NA,401179117,2019-12-29,
304,4,0:10,10,10,Army Offensive Rebound.,80,75,5,0,0.9960097291441499,Army,Bryant,6,6,0,0,NA,401179117,2019-12-29,
305,4,0:10,10,10,Alisa Fallon made Free Throw.,81,75,6,4,0.9986734913790579,Army,Bryant,6,6,0,0,NA,401179117,2019-12-29,Army
306,4,0:06,6,6,Masey Zegarowski missed Three Point Jumper.,81,75,6,4,0.9988815889344047,Army,Bryant,6,6,0,0,NA,401179117,2019-12-29,
307,4,0:02,2,2,Army Defensive Rebound.,81,75,6,2,0.9990598361403993,Army,Bryant,6,6,0,0,NA,401179117,2019-12-29,
308,4,0:00,0,0,End of Game,81,75,6,0,1,Army,Bryant,6,6,0,0,NA,401179117,2019-12-29,
