play_id,period,time_remaining_period,secs_remaining,secs_remaining_absolute,description,home_score,away_score,score_diff,play_length,win_prob,home,away,home_time_out_remaining,away_time_out_remaining,home_timeout_ind,away_timeout_ind,home_favored_by,game_id,date,whichScored
1,1,10:00,2400,2400,Jump Ball won by Syracuse,0,0,0,14,0.5,Syracuse,Notre Dame,4,4,0,0,NA,400912203,2017-02-19,NA
2,1,9:46,2386,2386,Brittney Sykes made Three Point Jumper. Assisted by Alexis Peterson.,3,0,3,27,0.5662639236131425,Syracuse,Notre Dame,4,4,0,0,NA,400912203,2017-02-19,Syracuse
3,1,9:19,2359,2359,Brianna Turner made Jumper. Assisted by Marina Mabrey.,3,2,1,13,0.5224937265852554,Syracuse,Notre Dame,4,4,0,0,NA,400912203,2017-02-19,Notre Dame
4,1,9:06,2346,2346,Alexis Peterson made Layup.,5,2,3,15,0.5675361407990583,Syracuse,Notre Dame,4,4,0,0,NA,400912203,2017-02-19,Syracuse
5,1,8:51,2331,2331,Arike Ogunbowale missed Jumper.,5,2,3,0,0.5680211159857175,Syracuse,Notre Dame,4,4,0,0,NA,400912203,2017-02-19,
6,1,8:51,2331,2331,Kathryn Westbeld Offensive Rebound.,5,2,3,8,0.5680211159857175,Syracuse,Notre Dame,4,4,0,0,NA,400912203,2017-02-19,
7,1,8:43,2323,2323,Kathryn Westbeld Turnover.,5,2,3,15,0.5682813775007283,Syracuse,Notre Dame,4,4,0,0,NA,400912203,2017-02-19,
8,1,8:28,2308,2308,Brittney Sykes made Three Point Jumper. Assisted by Gabrielle Cooper.,8,2,6,30,0.6349906060408036,Syracuse,Notre Dame,4,4,0,0,NA,400912203,2017-02-19,Syracuse
9,1,7:58,2278,2278,Brianna Turner missed Layup.,8,2,6,0,0.6368636499266205,Syracuse,Notre Dame,4,4,0,0,NA,400912203,2017-02-19,
10,1,7:58,2278,2278,Brittney Sykes Defensive Rebound.,8,2,6,6,0.6368636499266205,Syracuse,Notre Dame,4,4,0,0,NA,400912203,2017-02-19,
11,1,7:52,2272,2272,Gabrielle Cooper made Three Point Jumper. Assisted by Brittney Sykes.,11,2,9,6,0.6995407308099254,Syracuse,Notre Dame,4,4,0,0,NA,400912203,2017-02-19,Syracuse
12,1,7:46,2266,2266,Notre Dame  Timeout,11,2,9,12,0.7000558223499709,Syracuse,Notre Dame,3,4,1,0,NA,400912203,2017-02-19,
13,1,7:34,2254,2254,Marina Mabrey made Three Point Jumper. Assisted by Kathryn Westbeld.,11,5,6,22,0.6383760782397434,Syracuse,Notre Dame,3,4,1,0,NA,400912203,2017-02-19,Notre Dame
14,1,7:12,2232,2232,Briana Day made Jumper.,13,5,8,0,0.6826180699972916,Syracuse,Notre Dame,3,4,1,0,NA,400912203,2017-02-19,Syracuse
15,1,7:12,2232,2232,Foul on Brianna Turner.,13,5,8,0,0.6826180699972916,Syracuse,Notre Dame,3,4,1,0,NA,400912203,2017-02-19,
16,1,7:12,2232,2232,Briana Day made Free Throw.,14,5,9,13,0.7029861328370819,Syracuse,Notre Dame,3,4,1,0,NA,400912203,2017-02-19,Syracuse
17,1,6:59,2219,2219,Kathryn Westbeld missed Jumper.,14,5,9,0,0.7041105229085929,Syracuse,Notre Dame,3,4,1,0,NA,400912203,2017-02-19,
18,1,6:59,2219,2219,Brittney Sykes Defensive Rebound.,14,5,9,16,0.7041105229085929,Syracuse,Notre Dame,3,4,1,0,NA,400912203,2017-02-19,
19,1,6:43,2203,2203,Briana Day made Layup. Assisted by Alexis Peterson.,16,5,11,16,0.7441680063330691,Syracuse,Notre Dame,3,4,0,0,NA,400912203,2017-02-19,Syracuse
20,1,6:27,2187,2187,Marina Mabrey made Three Point Jumper. Assisted by Kathryn Westbeld.,16,8,8,24,0.686215520435786,Syracuse,Notre Dame,3,4,0,0,NA,400912203,2017-02-19,Notre Dame
21,1,6:03,2163,2163,Briana Day made Layup. Assisted by Alexis Peterson.,18,8,10,23,0.7289484550610299,Syracuse,Notre Dame,3,4,0,0,NA,400912203,2017-02-19,Syracuse
22,1,5:40,2140,2140,Kathryn Westbeld Turnover.,18,8,10,11,0.7310761581842423,Syracuse,Notre Dame,3,4,0,0,NA,400912203,2017-02-19,
23,1,5:29,2129,2129,Foul on Lindsay Allen.,18,8,10,0,0.7320961668093973,Syracuse,Notre Dame,3,4,0,0,NA,400912203,2017-02-19,
24,1,5:29,2129,2129,Alexis Peterson made Free Throw.,19,8,11,0,0.751347547434899,Syracuse,Notre Dame,3,4,0,0,NA,400912203,2017-02-19,Syracuse
25,1,5:29,2129,2129,Alexis Peterson made Free Throw.,20,8,12,9,0.7696508120790829,Syracuse,Notre Dame,3,4,0,0,NA,400912203,2017-02-19,Syracuse
26,1,5:20,2120,2120,Foul on Marina Mabrey.,20,8,12,0,0.7705571189498738,Syracuse,Notre Dame,3,4,0,0,NA,400912203,2017-02-19,
27,1,5:20,2120,2120,Marina Mabrey Turnover.,20,8,12,10,0.7705571189498738,Syracuse,Notre Dame,3,4,0,0,NA,400912203,2017-02-19,
28,1,5:10,2110,2110,Brittney Sykes missed Jumper.,20,8,12,0,0.7715648916589817,Syracuse,Notre Dame,3,4,0,0,NA,400912203,2017-02-19,
29,1,5:10,2110,2110,Jackie Young Defensive Rebound.,20,8,12,11,0.7715648916589817,Syracuse,Notre Dame,3,4,0,0,NA,400912203,2017-02-19,
30,1,4:59,2099,2099,Erin Boley missed Three Point Jumper.,20,8,12,0,0.7726744945907883,Syracuse,Notre Dame,3,4,0,0,NA,400912203,2017-02-19,
31,1,4:59,2099,2099,Kathryn Westbeld Offensive Rebound.,20,8,12,0,0.7726744945907883,Syracuse,Notre Dame,3,4,0,0,NA,400912203,2017-02-19,
32,1,4:59,2099,2099,Kathryn Westbeld missed Two Point Tip Shot.,20,8,12,0,0.7726744945907883,Syracuse,Notre Dame,3,4,0,0,NA,400912203,2017-02-19,
33,1,4:59,2099,2099,Bria Day Block.,20,8,12,0,0.7726744945907883,Syracuse,Notre Dame,3,4,0,0,NA,400912203,2017-02-19,
34,1,4:59,2099,2099,Jackie Young Offensive Rebound.,20,8,12,0,0.7726744945907883,Syracuse,Notre Dame,3,4,0,0,NA,400912203,2017-02-19,
35,1,4:59,2099,2099,Jackie Young made Two Point Tip Shot.,20,10,10,22,0.7348873598610655,Syracuse,Notre Dame,3,4,0,0,NA,400912203,2017-02-19,Notre Dame
36,1,4:37,2077,2077,Alexis Peterson made Three Point Jumper.,23,10,13,17,0.79235667196337,Syracuse,Notre Dame,3,4,0,0,NA,400912203,2017-02-19,Syracuse
37,1,4:20,2060,2060,Erin Boley missed Three Point Jumper.,23,10,13,0,0.7941154117193865,Syracuse,Notre Dame,3,4,0,0,NA,400912203,2017-02-19,
38,1,4:20,2060,2060,Jackie Young Offensive Rebound.,23,10,13,6,0.7941154117193865,Syracuse,Notre Dame,3,4,0,0,NA,400912203,2017-02-19,
39,1,4:14,2054,2054,Kathryn Westbeld made Layup. Assisted by Jackie Young.,23,12,11,15,0.7586794905227267,Syracuse,Notre Dame,3,4,0,0,NA,400912203,2017-02-19,Notre Dame
40,1,3:59,2039,2039,Foul on Erin Boley.,23,12,11,2,0.7601572604655997,Syracuse,Notre Dame,3,4,0,0,NA,400912203,2017-02-19,
41,1,3:57,2037,2037,Brittney Sykes missed Three Point Jumper.,23,12,11,0,0.7603546344741351,Syracuse,Notre Dame,3,4,0,0,NA,400912203,2017-02-19,
42,1,3:57,2037,2037,Jackie Young Defensive Rebound.,23,12,11,7,0.7603546344741351,Syracuse,Notre Dame,3,4,0,0,NA,400912203,2017-02-19,
43,1,3:50,2030,2030,Foul on Abby Grant.,23,12,11,13,0.7610460936051172,Syracuse,Notre Dame,3,4,0,0,NA,400912203,2017-02-19,
44,1,3:37,2017,2017,Marina Mabrey made Three Point Jumper. Assisted by Erin Boley.,23,15,8,24,0.7000730587849326,Syracuse,Notre Dame,3,4,0,0,NA,400912203,2017-02-19,Notre Dame
45,1,3:13,1993,1993,Alexis Peterson Turnover.,23,15,8,0,0.7020870820538239,Syracuse,Notre Dame,3,4,0,0,NA,400912203,2017-02-19,
46,1,3:13,1993,1993,Lindsay Allen Steal.,23,15,8,3,0.7020870820538239,Syracuse,Notre Dame,3,4,0,0,NA,400912203,2017-02-19,
47,1,3:10,1990,1990,Foul on Abby Grant.,23,15,8,0,0.7023400918608192,Syracuse,Notre Dame,3,4,0,0,NA,400912203,2017-02-19,
48,1,3:10,1990,1990,Marina Mabrey made Free Throw.,23,16,7,0,0.6794309454619605,Syracuse,Notre Dame,3,4,0,0,NA,400912203,2017-02-19,Notre Dame
49,1,3:10,1990,1990,Marina Mabrey made Free Throw.,23,17,6,12,0.6556231534709471,Syracuse,Notre Dame,3,4,0,0,NA,400912203,2017-02-19,Notre Dame
50,1,2:58,1978,1978,Gabrielle Cooper missed Three Point Jumper.,23,17,6,0,0.6564455884686835,Syracuse,Notre Dame,3,4,0,0,NA,400912203,2017-02-19,
51,1,2:58,1978,1978,Jackie Young Defensive Rebound.,23,17,6,8,0.6564455884686835,Syracuse,Notre Dame,3,4,0,0,NA,400912203,2017-02-19,
52,1,2:50,1970,1970,Marina Mabrey missed Three Point Jumper.,23,17,6,0,0.6569963935816021,Syracuse,Notre Dame,3,4,0,0,NA,400912203,2017-02-19,
53,1,2:50,1970,1970,Syracuse Defensive Rebound.,23,17,6,14,0.6569963935816021,Syracuse,Notre Dame,3,4,0,0,NA,400912203,2017-02-19,
54,1,2:36,1956,1956,Isabella Slim made Three Point Jumper. Assisted by Alexis Peterson.,26,17,9,21,0.7273779640073724,Syracuse,Notre Dame,3,4,0,0,NA,400912203,2017-02-19,Syracuse
55,1,2:15,1935,1935,Jackie Young made Jumper.,26,19,7,17,0.683712469173118,Syracuse,Notre Dame,3,4,0,0,NA,400912203,2017-02-19,Notre Dame
56,1,1:58,1918,1918,Briana Day missed Layup.,26,19,7,0,0.6850531095927159,Syracuse,Notre Dame,3,4,0,0,NA,400912203,2017-02-19,
57,1,1:58,1918,1918,Brianna Turner Defensive Rebound.,26,19,7,11,0.6850531095927159,Syracuse,Notre Dame,3,4,0,0,NA,400912203,2017-02-19,
58,1,1:47,1907,1907,Marina Mabrey made Jumper.,26,21,5,19,0.6359735848978677,Syracuse,Notre Dame,3,4,0,0,NA,400912203,2017-02-19,Notre Dame
59,1,1:28,1888,1888,Foul on Jackie Young.,26,21,5,0,0.6371175140625175,Syracuse,Notre Dame,3,4,0,0,NA,400912203,2017-02-19,
60,1,1:28,1888,1888,Brittney Sykes made Free Throw.,27,21,6,0,0.6627224472421261,Syracuse,Notre Dame,3,4,0,0,NA,400912203,2017-02-19,Syracuse
61,1,1:28,1888,1888,Brittney Sykes missed Free Throw.,27,21,6,0,0.6627224472421261,Syracuse,Notre Dame,3,4,0,0,NA,400912203,2017-02-19,
62,1,1:28,1888,1888,Marina Mabrey Defensive Rebound.,27,21,6,13,0.6627224472421261,Syracuse,Notre Dame,3,4,0,0,NA,400912203,2017-02-19,
63,1,1:15,1875,1875,Brianna Turner made Jumper. Assisted by Lindsay Allen.,27,23,4,20,0.6113542113562502,Syracuse,Notre Dame,3,4,0,0,NA,400912203,2017-02-19,Notre Dame
64,1,0:55,1855,1855,Gabrielle Cooper made Three Point Jumper. Assisted by Alexis Peterson.,30,23,7,22,0.6899899647557876,Syracuse,Notre Dame,3,4,0,0,NA,400912203,2017-02-19,Syracuse
65,1,0:33,1833,1833,Foul on Bria Day.,30,23,7,0,0.6917159265760751,Syracuse,Notre Dame,3,4,0,0,NA,400912203,2017-02-19,
66,1,0:33,1833,1833,Brianna Turner missed Free Throw.,30,23,7,0,0.6917159265760751,Syracuse,Notre Dame,3,4,0,0,NA,400912203,2017-02-19,
67,1,0:33,1833,1833,Notre Dame Deadball Team Rebound.,30,23,7,0,0.6917159265760751,Syracuse,Notre Dame,3,4,0,0,NA,400912203,2017-02-19,
68,1,0:33,1833,1833,Brianna Turner made Free Throw.,30,24,6,31,0.666567988078285,Syracuse,Notre Dame,3,4,0,0,NA,400912203,2017-02-19,Notre Dame
69,1,0:02,1802,1802,Syracuse  Turnover.,30,24,6,2,0.6687563666720667,Syracuse,Notre Dame,3,4,0,0,NA,400912203,2017-02-19,
70,1,0:00,1800,1800,Lindsay Allen missed Jumper.,30,24,6,0,0.6688984611571205,Syracuse,Notre Dame,3,4,0,0,NA,400912203,2017-02-19,
71,1,0:00,1800,1800,Alexis Peterson Defensive Rebound.,30,24,6,0,0.6688984611571205,Syracuse,Notre Dame,3,4,0,0,NA,400912203,2017-02-19,
72,1,0:00,1800,1800,End of 1st Quarter,30,24,6,0,0.6688984611571205,Syracuse,Notre Dame,3,4,0,0,NA,400912203,2017-02-19,
73,2,10:00,1800,1800,Jump Ball won by Notre Dame,30,24,6,14,0.6688984611571205,Syracuse,Notre Dame,4,4,0,0,NA,400912203,2017-02-19,
74,2,9:46,1786,1786,Brianna Turner Turnover.,30,24,6,21,0.6698969083144077,Syracuse,Notre Dame,4,4,0,0,NA,400912203,2017-02-19,
75,2,9:25,1765,1765,Brittney Sykes missed Jumper.,30,24,6,0,0.6714087979959481,Syracuse,Notre Dame,4,4,0,0,NA,400912203,2017-02-19,
76,2,9:25,1765,1765,Briana Day Offensive Rebound.,30,24,6,5,0.6714087979959481,Syracuse,Notre Dame,4,4,0,0,NA,400912203,2017-02-19,
77,2,9:20,1760,1760,Briana Day missed Jumper.,30,24,6,0,0.6717716284060897,Syracuse,Notre Dame,4,4,0,0,NA,400912203,2017-02-19,
78,2,9:20,1760,1760,Marina Mabrey Defensive Rebound.,30,24,6,28,0.6717716284060897,Syracuse,Notre Dame,4,4,0,0,NA,400912203,2017-02-19,
79,2,8:52,1732,1732,Lindsay Allen missed Jumper.,30,24,6,0,0.6738270330398481,Syracuse,Notre Dame,4,4,0,0,NA,400912203,2017-02-19,
80,2,8:52,1732,1732,Jackie Young Offensive Rebound.,30,24,6,8,0.6738270330398481,Syracuse,Notre Dame,4,4,0,0,NA,400912203,2017-02-19,
81,2,8:44,1724,1724,Kathryn Westbeld missed Layup.,30,24,6,0,0.6744223956535,Syracuse,Notre Dame,4,4,0,0,NA,400912203,2017-02-19,
82,2,8:44,1724,1724,Briana Day Defensive Rebound.,30,24,6,22,0.6744223956535,Syracuse,Notre Dame,4,4,0,0,NA,400912203,2017-02-19,
83,2,8:22,1702,1702,Isabella Slim missed Three Point Jumper.,30,24,6,0,0.6760806642709845,Syracuse,Notre Dame,4,4,0,0,NA,400912203,2017-02-19,
84,2,8:22,1702,1702,Lindsay Allen Defensive Rebound.,30,24,6,11,0.6760806642709845,Syracuse,Notre Dame,4,4,0,0,NA,400912203,2017-02-19,
85,2,8:11,1691,1691,Marina Mabrey Turnover.,30,24,6,23,0.6769223026662567,Syracuse,Notre Dame,4,4,0,0,NA,400912203,2017-02-19,
86,2,7:48,1668,1668,Alexis Peterson missed Three Point Jumper.,30,24,6,0,0.6786629020563473,Syracuse,Notre Dame,4,4,0,0,NA,400912203,2017-02-19,
87,2,7:48,1668,1668,Arike Ogunbowale Defensive Rebound.,30,24,6,11,0.6786629020563473,Syracuse,Notre Dame,4,4,0,0,NA,400912203,2017-02-19,
88,2,7:37,1657,1657,Brianna Turner made Jumper. Assisted by Arike Ogunbowale.,30,26,4,20,0.6226724756843586,Syracuse,Notre Dame,4,4,0,0,NA,400912203,2017-02-19,Notre Dame
89,2,7:17,1637,1637,Brittney Sykes missed Layup.,30,26,4,0,0.623716909221895,Syracuse,Notre Dame,4,4,0,0,NA,400912203,2017-02-19,
90,2,7:17,1637,1637,Brianna Turner Block.,30,26,4,0,0.623716909221895,Syracuse,Notre Dame,4,4,0,0,NA,400912203,2017-02-19,
91,2,7:17,1637,1637,Jackie Young Defensive Rebound.,30,26,4,7,0.623716909221895,Syracuse,Notre Dame,4,4,0,0,NA,400912203,2017-02-19,
92,2,7:10,1630,1630,Marina Mabrey missed Jumper.,30,26,4,0,0.6240784518393223,Syracuse,Notre Dame,4,4,0,0,NA,400912203,2017-02-19,
93,2,7:10,1630,1630,Brittney Sykes Defensive Rebound.,30,26,4,8,0.6240784518393223,Syracuse,Notre Dame,4,4,0,0,NA,400912203,2017-02-19,
94,2,7:02,1622,1622,Gabrielle Cooper missed Three Point Jumper.,30,26,4,0,0.6244898258725878,Syracuse,Notre Dame,4,4,0,0,NA,400912203,2017-02-19,
95,2,7:02,1622,1622,Arike Ogunbowale Defensive Rebound.,30,26,4,18,0.6244898258725878,Syracuse,Notre Dame,4,4,0,0,NA,400912203,2017-02-19,
96,2,6:44,1604,1604,Jump Ball won by Syracuse,30,26,4,0,0.625410998167702,Syracuse,Notre Dame,4,4,0,0,NA,400912203,2017-02-19,
97,2,6:44,1604,1604,Jackie Young Turnover.,30,26,4,0,0.625410998167702,Syracuse,Notre Dame,4,4,0,0,NA,400912203,2017-02-19,
98,2,6:44,1604,1604,Brittney Sykes Steal.,30,26,4,11,0.625410998167702,Syracuse,Notre Dame,4,4,0,0,NA,400912203,2017-02-19,
99,2,6:33,1593,1593,Briana Day made Jumper. Assisted by Abby Grant.,32,26,6,22,0.6840546633369663,Syracuse,Notre Dame,4,4,0,0,NA,400912203,2017-02-19,Syracuse
100,2,6:11,1571,1571,Arike Ogunbowale made Jumper.,32,28,4,19,0.6271010210298308,Syracuse,Notre Dame,4,4,0,0,NA,400912203,2017-02-19,Notre Dame
101,2,5:52,1552,1552,Abby Grant missed Three Point Jumper.,32,28,4,0,0.6280866313511098,Syracuse,Notre Dame,4,4,0,0,NA,400912203,2017-02-19,
102,2,5:52,1552,1552,Erin Boley Defensive Rebound.,32,28,4,9,0.6280866313511098,Syracuse,Notre Dame,4,4,0,0,NA,400912203,2017-02-19,
103,2,5:43,1543,1543,Marina Mabrey Turnover.,32,28,4,13,0.6285593285136819,Syracuse,Notre Dame,4,4,0,0,NA,400912203,2017-02-19,
104,2,5:30,1530,1530,Briana Day made Layup. Assisted by Alexis Peterson.,34,28,6,13,0.6885835587192296,Syracuse,Notre Dame,4,4,0,0,NA,400912203,2017-02-19,Syracuse
105,2,5:17,1517,1517,Brianna Turner made Layup. Assisted by Arike Ogunbowale.,34,30,4,18,0.6299542910338278,Syracuse,Notre Dame,4,4,0,0,NA,400912203,2017-02-19,Notre Dame
106,2,4:59,1499,1499,Brittney Sykes missed Jumper.,34,30,4,0,0.6309527092928936,Syracuse,Notre Dame,4,4,0,0,NA,400912203,2017-02-19,
107,2,4:59,1499,1499,Briana Day Offensive Rebound.,34,30,4,13,0.6309527092928936,Syracuse,Notre Dame,4,4,0,0,NA,400912203,2017-02-19,
108,2,4:46,1486,1486,Foul on Mychal Johnson.,34,30,4,0,0.6316942791886947,Syracuse,Notre Dame,4,4,0,0,NA,400912203,2017-02-19,
109,2,4:46,1486,1486,Official TV Timeout,34,30,4,20,0.6316942791886947,Syracuse,Notre Dame,4,4,0,0,NA,400912203,2017-02-19,
110,2,4:26,1466,1466,Abby Grant missed Three Point Jumper.,34,30,4,0,0.6328743410874906,Syracuse,Notre Dame,4,4,0,0,NA,400912203,2017-02-19,
111,2,4:26,1466,1466,Brianna Turner Defensive Rebound.,34,30,4,0,0.6328743410874906,Syracuse,Notre Dame,4,4,0,0,NA,400912203,2017-02-19,
112,2,4:26,1466,1466,Foul on Briana Day.,34,30,4,13,0.6328743410874906,Syracuse,Notre Dame,4,4,0,0,NA,400912203,2017-02-19,
113,2,4:13,1453,1453,Kathryn Westbeld made Layup.,34,32,2,17,0.5680739378803993,Syracuse,Notre Dame,4,4,0,0,NA,400912203,2017-02-19,Notre Dame
114,2,3:56,1436,1436,Abby Grant missed Three Point Jumper.,34,32,2,0,0.5686289764534042,Syracuse,Notre Dame,4,4,0,0,NA,400912203,2017-02-19,
115,2,3:56,1436,1436,Brianna Turner Defensive Rebound.,34,32,2,10,0.5686289764534042,Syracuse,Notre Dame,4,4,0,0,NA,400912203,2017-02-19,
116,2,3:46,1426,1426,Arike Ogunbowale missed Three Point Jumper.,34,32,2,0,0.5689468882977077,Syracuse,Notre Dame,4,4,0,0,NA,400912203,2017-02-19,
117,2,3:46,1426,1426,Bria Day Defensive Rebound.,34,32,2,8,0.5689468882977077,Syracuse,Notre Dame,4,4,0,0,NA,400912203,2017-02-19,
118,2,3:38,1418,1418,Brittney Sykes made Layup. Assisted by Alexis Peterson.,36,32,4,11,0.6357935969085231,Syracuse,Notre Dame,4,4,0,0,NA,400912203,2017-02-19,Syracuse
119,2,3:27,1407,1407,Marina Mabrey missed Three Point Jumper.,36,32,4,0,0.6364344309856538,Syracuse,Notre Dame,4,4,0,0,NA,400912203,2017-02-19,
120,2,3:27,1407,1407,Brittney Sykes Defensive Rebound.,36,32,4,8,0.6364344309856538,Syracuse,Notre Dame,4,4,0,0,NA,400912203,2017-02-19,
121,2,3:19,1399,1399,Brittney Sykes made Layup.,38,32,6,0,0.6990690190802672,Syracuse,Notre Dame,4,4,0,0,NA,400912203,2017-02-19,Syracuse
122,2,3:19,1399,1399,Foul on Kathryn Westbeld.,38,32,6,0,0.6990690190802672,Syracuse,Notre Dame,4,4,0,0,NA,400912203,2017-02-19,
123,2,3:19,1399,1399,Brittney Sykes missed Free Throw.,38,32,6,0,0.6990690190802672,Syracuse,Notre Dame,4,4,0,0,NA,400912203,2017-02-19,
124,2,3:19,1399,1399,Kathryn Westbeld Defensive Rebound.,38,32,6,18,0.6990690190802672,Syracuse,Notre Dame,4,4,0,0,NA,400912203,2017-02-19,
125,2,3:01,1381,1381,Kathryn Westbeld Turnover.,38,32,6,13,0.7004654995518147,Syracuse,Notre Dame,4,4,0,0,NA,400912203,2017-02-19,
126,2,2:48,1368,1368,Brittney Sykes made Layup.,40,32,8,11,0.7575046992377154,Syracuse,Notre Dame,4,4,0,0,NA,400912203,2017-02-19,Syracuse
127,2,2:37,1357,1357,Foul on Lindsay Allen.,40,32,8,0,0.7584923230530107,Syracuse,Notre Dame,4,4,0,0,NA,400912203,2017-02-19,
128,2,2:37,1357,1357,Lindsay Allen Turnover.,40,32,8,25,0.7584923230530107,Syracuse,Notre Dame,4,4,0,0,NA,400912203,2017-02-19,
129,2,2:12,1332,1332,Isabella Slim missed Three Point Jumper.,40,32,8,0,0.7607492678186498,Syracuse,Notre Dame,4,4,0,0,NA,400912203,2017-02-19,
130,2,2:12,1332,1332,Mychal Johnson Defensive Rebound.,40,32,8,31,0.7607492678186498,Syracuse,Notre Dame,4,4,0,0,NA,400912203,2017-02-19,
131,2,1:41,1301,1301,Foul on Jackie Young.,40,32,8,0,0.7636259864859253,Syracuse,Notre Dame,4,4,0,0,NA,400912203,2017-02-19,
132,2,1:41,1301,1301,Jackie Young Turnover.,40,32,8,11,0.7636259864859253,Syracuse,Notre Dame,4,4,0,0,NA,400912203,2017-02-19,
133,2,1:30,1290,1290,Brittney Sykes Turnover.,40,32,8,0,0.7646816776749923,Syracuse,Notre Dame,4,4,0,0,NA,400912203,2017-02-19,
134,2,1:30,1290,1290,Erin Boley Steal.,40,32,8,10,0.7646816776749923,Syracuse,Notre Dame,4,4,0,0,NA,400912203,2017-02-19,
135,2,1:20,1280,1280,Brianna Turner made Jumper. Assisted by Arike Ogunbowale.,40,34,6,17,0.7084737187999415,Syracuse,Notre Dame,4,4,0,0,NA,400912203,2017-02-19,Notre Dame
136,2,1:03,1263,1263,Alexis Peterson missed Jumper.,40,34,6,0,0.7099599800344327,Syracuse,Notre Dame,4,4,0,0,NA,400912203,2017-02-19,
137,2,1:03,1263,1263,Marina Mabrey Defensive Rebound.,40,34,6,10,0.7099599800344327,Syracuse,Notre Dame,4,4,0,0,NA,400912203,2017-02-19,
138,2,0:53,1253,1253,Erin Boley missed Jumper.,40,34,6,0,0.7108663892737404,Syracuse,Notre Dame,4,4,0,0,NA,400912203,2017-02-19,
139,2,0:53,1253,1253,Brittney Sykes Defensive Rebound.,40,34,6,17,0.7108663892737404,Syracuse,Notre Dame,4,4,0,0,NA,400912203,2017-02-19,
140,2,0:36,1236,1236,Alexis Peterson made Jumper.,42,34,8,25,0.7702773649019546,Syracuse,Notre Dame,4,4,0,0,NA,400912203,2017-02-19,Syracuse
141,2,0:11,1211,1211,Marina Mabrey missed Three Point Jumper.,42,34,8,0,0.773174817481301,Syracuse,Notre Dame,4,4,0,0,NA,400912203,2017-02-19,
142,2,0:11,1211,1211,Brianna Turner made Free Throw.,42,35,7,0,0.7451736376490605,Syracuse,Notre Dame,4,4,0,0,NA,400912203,2017-02-19,Notre Dame
143,2,0:11,1211,1211,Notre Dame Offensive Rebound.,42,34,8,0,0.773174817481301,Syracuse,Notre Dame,4,4,0,0,NA,400912203,2017-02-19,
144,2,0:11,1211,1211,Foul on Brittney Sykes.,42,34,8,0,0.773174817481301,Syracuse,Notre Dame,4,4,0,0,NA,400912203,2017-02-19,
145,2,0:11,1211,1211,Brianna Turner missed Free Throw.,42,35,7,0,0.7451736376490605,Syracuse,Notre Dame,4,4,0,0,NA,400912203,2017-02-19,Notre Dame
146,2,0:11,1211,1211,Brittney Sykes Defensive Rebound.,42,35,7,10,0.7451736376490605,Syracuse,Notre Dame,4,4,0,0,NA,400912203,2017-02-19,
147,2,0:01,1201,1201,Foul on Mychal Johnson.,42,35,7,0,0.7463081927719248,Syracuse,Notre Dame,4,4,0,0,NA,400912203,2017-02-19,
148,2,0:01,1201,1201,Brittney Sykes made Free Throw.,43,35,8,0,0.7743718622647385,Syracuse,Notre Dame,4,4,0,0,NA,400912203,2017-02-19,Syracuse
149,2,0:01,1201,1201,Brittney Sykes missed Free Throw.,43,35,8,0,0.7743718622647385,Syracuse,Notre Dame,4,4,0,0,NA,400912203,2017-02-19,
150,2,0:01,1201,1201,Ali Patberg Defensive Rebound.,43,35,8,1,0.7743718622647385,Syracuse,Notre Dame,4,4,0,0,NA,400912203,2017-02-19,
151,2,0:00,1200,1200,End of 2nd Quarter,43,35,8,0,0.774489981219977,Syracuse,Notre Dame,4,4,0,0,NA,400912203,2017-02-19,
152,3,10:00,1200,1200,Jump Ball won by Notre Dame,43,35,8,8,0.774489981219977,Syracuse,Notre Dame,5,5,0,0,NA,400912203,2017-02-19,
153,3,9:52,1192,1192,Brianna Turner made Layup. Assisted by Marina Mabrey.,43,37,6,22,0.7169539965043947,Syracuse,Notre Dame,5,5,0,0,NA,400912203,2017-02-19,Notre Dame
154,3,9:30,1170,1170,Foul on Briana Day.,43,37,6,0,0.7191398687858451,Syracuse,Notre Dame,5,5,0,0,NA,400912203,2017-02-19,
155,3,9:30,1170,1170,Briana Day Turnover.,43,37,6,24,0.7191398687858451,Syracuse,Notre Dame,5,5,0,0,NA,400912203,2017-02-19,
156,3,9:06,1146,1146,Arike Ogunbowale missed Layup.,43,37,6,0,0.721456663853357,Syracuse,Notre Dame,5,5,0,0,NA,400912203,2017-02-19,
157,3,9:06,1146,1146,Brianna Turner Offensive Rebound.,43,37,6,0,0.721456663853357,Syracuse,Notre Dame,5,5,0,0,NA,400912203,2017-02-19,
158,3,9:06,1146,1146,Brianna Turner made Two Point Tip Shot.,43,39,4,25,0.6535013719071114,Syracuse,Notre Dame,5,5,0,0,NA,400912203,2017-02-19,Notre Dame
159,3,8:41,1121,1121,Gabrielle Cooper made Three Point Jumper. Assisted by Alexis Peterson.,46,39,7,22,0.7547681559011926,Syracuse,Notre Dame,5,5,0,0,NA,400912203,2017-02-19,Syracuse
160,3,8:19,1099,1099,Kathryn Westbeld made Jumper. Assisted by Marina Mabrey.,46,41,5,20,0.6925042461080666,Syracuse,Notre Dame,5,5,0,0,NA,400912203,2017-02-19,Notre Dame
161,3,7:59,1079,1079,Alexis Peterson Turnover.,46,41,5,18,0.6942618039410059,Syracuse,Notre Dame,5,5,0,0,NA,400912203,2017-02-19,
162,3,7:41,1061,1061,Foul on Isabella Slim.,46,41,5,0,0.6958969661322005,Syracuse,Notre Dame,5,5,0,0,NA,400912203,2017-02-19,
163,3,7:41,1061,1061,Kathryn Westbeld missed Free Throw.,46,41,5,0,0.6958969661322005,Syracuse,Notre Dame,5,5,0,0,NA,400912203,2017-02-19,
164,3,7:41,1061,1061,Notre Dame Deadball Team Rebound.,46,41,5,0,0.6958969661322005,Syracuse,Notre Dame,5,5,0,0,NA,400912203,2017-02-19,
165,3,7:41,1061,1061,Kathryn Westbeld missed Free Throw.,46,41,5,0,0.6958969661322005,Syracuse,Notre Dame,5,5,0,0,NA,400912203,2017-02-19,
166,3,7:41,1061,1061,Brianna Turner Offensive Rebound.,46,41,5,5,0.6958969661322005,Syracuse,Notre Dame,5,5,0,0,NA,400912203,2017-02-19,
167,3,7:36,1056,1056,Arike Ogunbowale made Three Point Jumper. Assisted by Marina Mabrey.,46,44,2,29,0.5822493909492018,Syracuse,Notre Dame,5,5,0,0,NA,400912203,2017-02-19,Notre Dame
168,3,7:07,1027,1027,Gabrielle Cooper missed Three Point Jumper.,46,44,2,0,0.5835498991686662,Syracuse,Notre Dame,5,5,0,0,NA,400912203,2017-02-19,
169,3,7:07,1027,1027,Arike Ogunbowale Defensive Rebound.,46,44,2,12,0.5835498991686662,Syracuse,Notre Dame,5,5,0,0,NA,400912203,2017-02-19,
170,3,6:55,1015,1015,Foul on Gabrielle Cooper.,46,44,2,11,0.5841222600738807,Syracuse,Notre Dame,5,5,0,0,NA,400912203,2017-02-19,
171,3,6:44,1004,1004,Brianna Turner made Layup. Assisted by Lindsay Allen.,46,46,0,12,0.5,Syracuse,Notre Dame,5,5,0,0,NA,400912203,2017-02-19,Notre Dame
172,3,6:32,992,992,Alexis Peterson made Jumper.,48,46,2,8,0.5852865353705452,Syracuse,Notre Dame,5,5,0,0,NA,400912203,2017-02-19,Syracuse
173,3,6:24,984,984,Arike Ogunbowale Turnover.,48,46,2,0,0.5857145415140341,Syracuse,Notre Dame,5,5,0,0,NA,400912203,2017-02-19,
174,3,6:24,984,984,Alexis Peterson Steal.,48,46,2,5,0.5857145415140341,Syracuse,Notre Dame,5,5,0,0,NA,400912203,2017-02-19,
175,3,6:19,979,979,Brittney Sykes made Layup. Assisted by Alexis Peterson.,50,46,4,25,0.6670368771396497,Syracuse,Notre Dame,5,5,0,0,NA,400912203,2017-02-19,Syracuse
176,3,5:54,954,954,Lindsay Allen missed Jumper.,50,46,4,0,0.6695626074727787,Syracuse,Notre Dame,5,5,0,0,NA,400912203,2017-02-19,
177,3,5:54,954,954,Gabrielle Cooper Defensive Rebound.,50,46,4,9,0.6695626074727787,Syracuse,Notre Dame,5,5,0,0,NA,400912203,2017-02-19,
178,3,5:45,945,945,Alexis Peterson Turnover.,50,46,4,13,0.6704009859344976,Syracuse,Notre Dame,5,5,0,0,NA,400912203,2017-02-19,
179,3,5:32,932,932,Jackie Young missed Jumper.,50,46,4,0,0.6715478302888682,Syracuse,Notre Dame,5,5,0,0,NA,400912203,2017-02-19,
180,3,5:32,932,932,Brittney Sykes Defensive Rebound.,50,46,4,3,0.6715478302888682,Syracuse,Notre Dame,5,5,0,0,NA,400912203,2017-02-19,
181,3,5:29,929,929,Foul on Jackie Young.,50,46,4,11,0.6718031729657888,Syracuse,Notre Dame,5,5,0,0,NA,400912203,2017-02-19,
182,3,5:18,918,918,Isabella Slim made Three Point Jumper. Assisted by Brittney Sykes.,53,46,7,23,0.779173198200986,Syracuse,Notre Dame,5,5,0,0,NA,400912203,2017-02-19,Syracuse
183,3,4:55,895,895,Marina Mabrey made Jumper. Assisted by Brianna Turner.,53,48,5,0,0.7131890699943814,Syracuse,Notre Dame,5,5,0,0,NA,400912203,2017-02-19,Notre Dame
184,3,4:55,895,895,Foul on Gabrielle Cooper.,53,48,5,0,0.7131890699943814,Syracuse,Notre Dame,5,5,0,0,NA,400912203,2017-02-19,
