play_id,period,time_remaining_period,secs_remaining,secs_remaining_absolute,description,home_score,away_score,score_diff,play_length,win_prob,home,away,home_time_out_remaining,away_time_out_remaining,home_timeout_ind,away_timeout_ind,home_favored_by,game_id,date,whichScored
188,3,6:08,968,968,McKayla Yentz missed Three Point Jumper.,61,50,11,0,0.8726733970892742,Marquette,DePaul,5,3,0,1,NA,400911391,2017-02-19,
189,3,6:08,968,968,Jacqui Grant Block.,61,50,11,2,0.8726733970892742,Marquette,DePaul,5,3,0,1,NA,400911391,2017-02-19,
190,3,6:06,966,966,Erika Davenport Offensive Rebound.,61,50,11,0,0.8729566518418039,Marquette,DePaul,5,3,0,1,NA,400911391,2017-02-19,
191,3,6:06,966,966,Foul on Brooke Schulte.,61,50,11,0,0.8729566518418039,Marquette,DePaul,5,3,0,1,NA,400911391,2017-02-19,
192,3,6:06,966,966,Danielle King made Free Throw.,62,50,12,0,0.8911528998137322,Marquette,DePaul,5,3,0,1,NA,400911391,2017-02-19,Marquette
193,3,6:06,966,966,Danielle King missed Free Throw.,62,50,12,0,0.8911528998137322,Marquette,DePaul,5,3,0,1,NA,400911391,2017-02-19,
194,3,6:06,966,966,Jacqui Grant Defensive Rebound.,62,50,12,13,0.8911528998137322,Marquette,DePaul,5,3,0,1,NA,400911391,2017-02-19,
195,3,5:53,953,953,Brooke Schulte made Jumper. Assisted by Kelly Campbell.,62,52,10,13,0.8540335788012363,Marquette,DePaul,5,3,0,1,NA,400911391,2017-02-19,DePaul
196,3,5:40,940,940,Danielle King made Layup.,64,52,12,15,0.8943628102739959,Marquette,DePaul,5,3,0,0,NA,400911391,2017-02-19,Marquette
197,3,5:25,925,925,Amarah Coleman Turnover.,64,52,12,1,0.896006990118282,Marquette,DePaul,5,3,0,0,NA,400911391,2017-02-19,
198,3,5:24,924,924,Natisha Hiedeman Steal.,64,52,12,3,0.8961123905977203,Marquette,DePaul,5,3,0,0,NA,400911391,2017-02-19,
199,3,5:21,921,921,Natisha Hiedeman Turnover.,64,52,12,8,0.8964258200149179,Marquette,DePaul,5,3,0,0,NA,400911391,2017-02-19,
200,3,5:13,913,913,Lauren Prochaska made Layup.,64,54,10,9,0.8588535293839851,Marquette,DePaul,5,3,0,0,NA,400911391,2017-02-19,DePaul
201,3,5:04,904,904,Natisha Hiedeman missed Jumper.,64,54,10,0,0.85983186245394,Marquette,DePaul,5,3,0,0,NA,400911391,2017-02-19,
202,3,5:04,904,904,Amani Wilborn Offensive Rebound.,64,54,10,2,0.85983186245394,Marquette,DePaul,5,3,0,0,NA,400911391,2017-02-19,
203,3,5:02,902,902,Amani Wilborn Turnover.,64,54,10,12,0.8600459375970244,Marquette,DePaul,5,3,0,0,NA,400911391,2017-02-19,
204,3,4:50,890,890,Jacqui Grant missed Three Point Jumper.,64,54,10,0,0.8613114256642723,Marquette,DePaul,5,3,0,0,NA,400911391,2017-02-19,
205,3,4:50,890,890,Natisha Hiedeman Defensive Rebound.,64,54,10,18,0.8613114256642723,Marquette,DePaul,5,3,0,0,NA,400911391,2017-02-19,
206,3,4:32,872,872,Allazia Blockton missed Jumper.,64,54,10,0,0.8631769604659978,Marquette,DePaul,5,3,0,0,NA,400911391,2017-02-19,
207,3,4:32,872,872,Kelly Campbell Defensive Rebound.,64,54,10,11,0.8631769604659978,Marquette,DePaul,5,3,0,0,NA,400911391,2017-02-19,
208,3,4:21,861,861,Brooke Schulte missed Three Point Jumper.,64,54,10,0,0.8643185092844887,Marquette,DePaul,5,3,0,0,NA,400911391,2017-02-19,
209,3,4:21,861,861,Marquette Defensive Rebound.,64,54,10,2,0.8643185092844887,Marquette,DePaul,5,3,0,0,NA,400911391,2017-02-19,
210,3,4:19,859,859,Official TV Timeout,64,54,10,14,0.8645274336888724,Marquette,DePaul,5,3,0,0,NA,400911391,2017-02-19,
211,3,4:05,845,845,Allazia Blockton made Layup.,66,54,12,23,0.903729290001831,Marquette,DePaul,5,3,0,0,NA,400911391,2017-02-19,Marquette
212,3,3:42,822,822,Foul on Amani Wilborn.,66,54,12,10,0.9060304918501865,Marquette,DePaul,5,3,0,0,NA,400911391,2017-02-19,
213,3,3:32,812,812,Brooke Schulte made Jumper.,66,56,10,19,0.869761044829076,Marquette,DePaul,5,3,0,0,NA,400911391,2017-02-19,DePaul
214,3,3:13,793,793,Shantelle Valentine missed Jumper.,66,56,10,0,0.8721701118498916,Marquette,DePaul,5,3,0,0,NA,400911391,2017-02-19,
215,3,3:13,793,793,Jacqui Grant Block.,66,56,10,3,0.8721701118498916,Marquette,DePaul,5,3,0,0,NA,400911391,2017-02-19,
216,3,3:10,790,790,Brooke Schulte Defensive Rebound.,66,56,10,7,0.8725717420433353,Marquette,DePaul,5,3,0,0,NA,400911391,2017-02-19,
217,3,3:03,783,783,Foul on Shantelle Valentine.,66,56,10,0,0.8735337699869186,Marquette,DePaul,5,3,0,0,NA,400911391,2017-02-19,
218,3,3:03,783,783,Amarah Coleman missed Free Throw.,66,56,10,0,0.8735337699869186,Marquette,DePaul,5,3,0,0,NA,400911391,2017-02-19,
219,3,3:03,783,783,DePaul Deadball Team Rebound.,66,56,10,0,0.8735337699869186,Marquette,DePaul,5,3,0,0,NA,400911391,2017-02-19,
220,3,3:03,783,783,Amarah Coleman missed Free Throw.,66,56,10,0,0.8735337699869186,Marquette,DePaul,5,3,0,0,NA,400911391,2017-02-19,
221,3,3:03,783,783,Danielle King Defensive Rebound.,66,56,10,19,0.8735337699869186,Marquette,DePaul,5,3,0,0,NA,400911391,2017-02-19,
222,3,2:44,764,764,Amani Wilborn missed Layup.,66,56,10,0,0.8763359762729535,Marquette,DePaul,5,3,0,0,NA,400911391,2017-02-19,
223,3,2:44,764,764,Kelly Campbell Defensive Rebound.,66,56,10,8,0.8763359762729535,Marquette,DePaul,5,3,0,0,NA,400911391,2017-02-19,
224,3,2:36,756,756,Foul on Allazia Blockton.,66,56,10,2,0.87760666461983,Marquette,DePaul,5,3,0,0,NA,400911391,2017-02-19,
225,3,2:34,754,754,Brooke Schulte Turnover.,66,56,10,1,0.8779332762456219,Marquette,DePaul,5,3,0,0,NA,400911391,2017-02-19,
226,3,2:33,753,753,Danielle King Steal.,66,56,10,3,0.8780979508880395,Marquette,DePaul,5,3,0,0,NA,400911391,2017-02-19,
227,3,2:30,750,750,Amani Wilborn made Layup.,68,56,12,9,0.9149055167911502,Marquette,DePaul,5,3,0,0,NA,400911391,2017-02-19,Marquette
228,3,2:21,741,741,Amarah Coleman Turnover.,68,56,12,17,0.9162603770636658,Marquette,DePaul,5,3,0,0,NA,400911391,2017-02-19,
229,3,2:04,724,724,Amani Wilborn made Three Point Jumper. Assisted by McKayla Yentz.,71,56,15,21,0.9541413083401377,Marquette,DePaul,5,3,0,0,NA,400911391,2017-02-19,Marquette
230,3,1:43,703,703,Jacqui Grant made Jumper. Assisted by Kelly Campbell.,71,58,13,31,0.9354874225032327,Marquette,DePaul,5,3,0,0,NA,400911391,2017-02-19,DePaul
231,3,1:12,672,672,Allazia Blockton missed Jumper.,71,58,13,0,0.9388068204861372,Marquette,DePaul,5,3,0,0,NA,400911391,2017-02-19,
232,3,1:12,672,672,Jacqui Grant Defensive Rebound.,71,58,13,6,0.9388068204861372,Marquette,DePaul,5,3,0,0,NA,400911391,2017-02-19,
233,3,1:06,666,666,Foul on Natisha Hiedeman.,71,58,13,0,0.9394022008931514,Marquette,DePaul,5,3,0,0,NA,400911391,2017-02-19,
234,3,1:06,666,666,Lauren Prochaska missed Free Throw.,71,58,13,0,0.9394022008931514,Marquette,DePaul,5,3,0,0,NA,400911391,2017-02-19,
235,3,1:06,666,666,DePaul Deadball Team Rebound.,71,58,13,0,0.9394022008931514,Marquette,DePaul,5,3,0,0,NA,400911391,2017-02-19,
236,3,1:06,666,666,Lauren Prochaska made Free Throw.,71,59,12,12,0.9262279291173893,Marquette,DePaul,5,3,0,0,NA,400911391,2017-02-19,DePaul
237,3,0:54,654,654,Erika Davenport made Layup.,73,59,14,0,0.9513983836606749,Marquette,DePaul,5,3,0,0,NA,400911391,2017-02-19,Marquette
238,3,0:54,654,654,Foul on Brooke Schulte.,73,59,14,0,0.9513983836606749,Marquette,DePaul,5,3,0,0,NA,400911391,2017-02-19,
239,3,0:54,654,654,Erika Davenport missed Free Throw.,73,59,14,0,0.9513983836606749,Marquette,DePaul,5,3,0,0,NA,400911391,2017-02-19,
240,3,0:54,654,654,Jacqui Grant Defensive Rebound.,73,59,14,12,0.9513983836606749,Marquette,DePaul,5,3,0,0,NA,400911391,2017-02-19,
241,3,0:42,642,642,Brooke Schulte made Layup. Assisted by Lauren Prochaska.,73,61,12,8,0.9288412649210942,Marquette,DePaul,5,3,0,0,NA,400911391,2017-02-19,DePaul
242,3,0:34,634,634,Danielle King made Layup. Assisted by Erika Davenport.,75,61,14,34,0.9531580499768247,Marquette,DePaul,5,3,0,0,NA,400911391,2017-02-19,Marquette
243,3,0:00,600,600,Lauren Prochaska missed Jumper.,75,61,14,0,0.9564300540713527,Marquette,DePaul,5,3,0,0,NA,400911391,2017-02-19,
244,3,0:00,600,600,Erika Davenport Defensive Rebound.,75,61,14,0,0.9564300540713527,Marquette,DePaul,5,3,0,0,NA,400911391,2017-02-19,
245,3,0:00,600,600,End of 3rd Quarter,75,61,14,15,0.9564300540713527,Marquette,DePaul,5,3,0,0,NA,400911391,2017-02-19,
246,4,9:45,585,585,Foul on Jacqui Grant.,75,61,14,0,0.958069685856736,Marquette,DePaul,6,4,0,0,NA,400911391,2017-02-19,
247,4,9:45,585,585,Erika Davenport made Free Throw.,76,61,15,0,0.9661835069686038,Marquette,DePaul,6,4,0,0,NA,400911391,2017-02-19,Marquette
248,4,9:45,585,585,Erika Davenport made Free Throw.,77,61,16,11,0.9727718660463983,Marquette,DePaul,6,4,0,0,NA,400911391,2017-02-19,Marquette
249,4,9:34,574,574,Brooke Schulte missed Jumper.,77,61,16,0,0.9737485496675802,Marquette,DePaul,6,4,0,0,NA,400911391,2017-02-19,
250,4,9:34,574,574,Danielle King Defensive Rebound.,77,61,16,6,0.9737485496675802,Marquette,DePaul,6,4,0,0,NA,400911391,2017-02-19,
251,4,9:28,568,568,Natisha Hiedeman missed Layup.,77,61,16,0,0.9743069230457352,Marquette,DePaul,6,4,0,0,NA,400911391,2017-02-19,
252,4,9:28,568,568,Lauren Prochaska Block.,77,61,16,2,0.9743069230457352,Marquette,DePaul,6,4,0,0,NA,400911391,2017-02-19,
253,4,9:26,566,566,Brooke Schulte Defensive Rebound.,77,61,16,23,0.9744971488098672,Marquette,DePaul,6,4,0,0,NA,400911391,2017-02-19,
254,4,9:03,543,543,Lauren Prochaska missed Layup.,77,61,16,0,0.9767795741995455,Marquette,DePaul,6,4,0,0,NA,400911391,2017-02-19,
255,4,9:03,543,543,Kelly Campbell Offensive Rebound.,77,61,16,4,0.9767795741995455,Marquette,DePaul,6,4,0,0,NA,400911391,2017-02-19,
256,4,8:59,539,539,Amarah Coleman missed Three Point Jumper.,77,61,16,0,0.9771392012396448,Marquette,DePaul,6,4,0,0,NA,400911391,2017-02-19,
257,4,8:59,539,539,McKayla Yentz Defensive Rebound.,77,61,16,7,0.9771392012396448,Marquette,DePaul,6,4,0,0,NA,400911391,2017-02-19,
258,4,8:52,532,532,Erika Davenport missed Layup.,77,61,16,0,0.9777208984735745,Marquette,DePaul,6,4,0,0,NA,400911391,2017-02-19,
259,4,8:52,532,532,Jacqui Grant Defensive Rebound.,77,61,16,11,0.9777208984735745,Marquette,DePaul,6,4,0,0,NA,400911391,2017-02-19,
260,4,8:41,521,521,Brooke Schulte missed Jumper.,77,61,16,0,0.978539235725806,Marquette,DePaul,6,4,0,0,NA,400911391,2017-02-19,
261,4,8:41,521,521,Natisha Hiedeman Block.,77,61,16,2,0.978539235725806,Marquette,DePaul,6,4,0,0,NA,400911391,2017-02-19,
262,4,8:39,519,519,Amani Wilborn Defensive Rebound.,77,61,16,6,0.9786783896145449,Marquette,DePaul,6,4,0,0,NA,400911391,2017-02-19,
263,4,8:33,513,513,Natisha Hiedeman missed Three Point Jumper.,77,61,16,0,0.9790828003159869,Marquette,DePaul,6,4,0,0,NA,400911391,2017-02-19,
264,4,8:33,513,513,Kelly Campbell Defensive Rebound.,77,61,16,9,0.9790828003159869,Marquette,DePaul,6,4,0,0,NA,400911391,2017-02-19,
265,4,8:24,504,504,Kelly Campbell missed Jumper.,77,61,16,0,0.979663647919383,Marquette,DePaul,6,4,0,0,NA,400911391,2017-02-19,
266,4,8:24,504,504,Erika Davenport Defensive Rebound.,77,61,16,6,0.979663647919383,Marquette,DePaul,6,4,0,0,NA,400911391,2017-02-19,
267,4,8:18,498,498,Danielle King made Layup. Assisted by Amani Wilborn.,79,61,18,17,0.9876383483651786,Marquette,DePaul,6,4,0,0,NA,400911391,2017-02-19,Marquette
268,4,8:01,481,481,Jacqui Grant Turnover.,79,61,18,19,0.988396488578659,Marquette,DePaul,6,4,0,0,NA,400911391,2017-02-19,
269,4,7:42,462,462,Amani Wilborn missed Three Point Jumper.,79,61,18,0,0.9893161028230244,Marquette,DePaul,6,4,0,0,NA,400911391,2017-02-19,
270,4,7:42,462,462,Tanita Allen Defensive Rebound.,79,61,18,0,0.9893161028230244,Marquette,DePaul,6,4,0,0,NA,400911391,2017-02-19,
271,4,7:42,462,462,Foul on Shantelle Valentine.,79,61,18,12,0.9893161028230244,Marquette,DePaul,6,4,0,0,NA,400911391,2017-02-19,
272,4,7:30,450,450,Lauren Prochaska missed Three Point Jumper.,79,61,18,0,0.9899659047498843,Marquette,DePaul,6,4,0,0,NA,400911391,2017-02-19,
273,4,7:30,450,450,Marquette Defensive Rebound.,79,61,18,20,0.9899659047498843,Marquette,DePaul,6,4,0,0,NA,400911391,2017-02-19,
274,4,7:10,430,430,Erika Davenport made Jumper.,81,61,20,10,0.9947705082441359,Marquette,DePaul,6,4,0,0,NA,400911391,2017-02-19,Marquette
275,4,7:00,420,420,Chante Stonewall missed Three Point Jumper.,81,61,20,0,0.9951746755107341,Marquette,DePaul,6,4,0,0,NA,400911391,2017-02-19,
276,4,7:00,420,420,Tanita Allen Offensive Rebound.,81,61,20,4,0.9951746755107341,Marquette,DePaul,6,4,0,0,NA,400911391,2017-02-19,
277,4,6:56,416,416,Lauren Prochaska missed Three Point Jumper.,81,61,20,0,0.995320833780022,Marquette,DePaul,6,4,0,0,NA,400911391,2017-02-19,
278,4,6:56,416,416,Kelly Campbell Offensive Rebound.,81,61,20,1,0.995320833780022,Marquette,DePaul,6,4,0,0,NA,400911391,2017-02-19,
279,4,6:55,415,415,Tanita Allen made Layup.,81,63,18,2,0.9920831371204905,Marquette,DePaul,6,4,0,0,NA,400911391,2017-02-19,DePaul
280,4,6:53,413,413,DePaul  Timeout,81,63,18,3,0.9921894302239669,Marquette,DePaul,5,4,1,0,NA,400911391,2017-02-19,
281,4,6:50,410,410,Amani Wilborn missed Layup.,81,63,18,0,0.9923445630688199,Marquette,DePaul,5,4,1,0,NA,400911391,2017-02-19,
282,4,6:50,410,410,Brooke Schulte Block.,81,63,18,3,0.9923445630688199,Marquette,DePaul,5,4,1,0,NA,400911391,2017-02-19,
283,4,6:47,407,407,Brooke Schulte Defensive Rebound.,81,63,18,8,0.9924950119929157,Marquette,DePaul,5,4,1,0,NA,400911391,2017-02-19,
284,4,6:39,399,399,Lauren Prochaska made Jumper.,81,65,16,29,0.9877354778527155,Marquette,DePaul,5,4,1,0,NA,400911391,2017-02-19,DePaul
285,4,6:10,370,370,Natisha Hiedeman made Jumper.,83,65,18,21,0.9941334945526294,Marquette,DePaul,5,4,1,0,NA,400911391,2017-02-19,Marquette
286,4,5:49,349,349,Kelly Campbell missed Three Point Jumper.,83,65,18,0,0.9950177397121932,Marquette,DePaul,5,4,0,0,NA,400911391,2017-02-19,
287,4,5:49,349,349,DePaul Offensive Rebound.,83,65,18,16,0.9950177397121932,Marquette,DePaul,5,4,0,0,NA,400911391,2017-02-19,
288,4,5:33,333,333,Amarah Coleman made Jumper. Assisted by Lauren Prochaska.,83,67,16,32,0.9921668348873423,Marquette,DePaul,5,4,0,0,NA,400911391,2017-02-19,DePaul
289,4,5:01,301,301,Amani Wilborn missed Three Point Jumper.,83,67,16,0,0.994295612298153,Marquette,DePaul,5,4,0,0,NA,400911391,2017-02-19,
290,4,5:01,301,301,Brooke Schulte Defensive Rebound.,83,67,16,9,0.994295612298153,Marquette,DePaul,5,4,0,0,NA,400911391,2017-02-19,
291,4,4:52,292,292,Foul on Amani Wilborn.,83,67,16,3,0.9944847337627558,Marquette,DePaul,5,4,0,0,NA,400911391,2017-02-19,
292,4,4:49,289,289,Tanita Allen made Three Point Jumper. Assisted by Brooke Schulte.,83,70,13,28,0.9855576602655528,Marquette,DePaul,5,4,0,0,NA,400911391,2017-02-19,DePaul
293,4,4:21,261,261,Natisha Hiedeman missed Jumper.,83,70,13,0,0.9844673690166226,Marquette,DePaul,5,4,0,0,NA,400911391,2017-02-19,
294,4,4:21,261,261,Jacqui Grant Defensive Rebound.,83,70,13,24,0.9844673690166226,Marquette,DePaul,5,4,0,0,NA,400911391,2017-02-19,
295,4,3:57,237,237,Amarah Coleman made Three Point Jumper. Assisted by Tanita Allen.,83,73,10,25,0.9585942100886815,Marquette,DePaul,5,4,0,0,NA,400911391,2017-02-19,DePaul
296,4,3:32,212,212,Foul on Kelly Campbell.,83,73,10,9,0.9620875564858202,Marquette,DePaul,5,4,0,0,NA,400911391,2017-02-19,
297,4,3:23,203,203,Foul on Brooke Schulte.,83,73,10,11,0.965439114398358,Marquette,DePaul,5,4,0,0,NA,400911391,2017-02-19,
298,4,3:12,192,192,Foul on Amarah Coleman.,83,73,10,0,0.9709053564446719,Marquette,DePaul,5,4,0,1,NA,400911391,2017-02-19,
299,4,3:12,192,192,Marquette  Timeout,83,73,10,8,0.9709053564446719,Marquette,DePaul,5,3,0,1,NA,400911391,2017-02-19,
300,4,3:04,184,184,Foul on Amarah Coleman.,83,73,10,0,0.9752368972395487,Marquette,DePaul,5,3,0,1,NA,400911391,2017-02-19,
301,4,3:04,184,184,Erika Davenport made Free Throw.,84,73,11,0,0.9827180258302555,Marquette,DePaul,5,3,0,1,NA,400911391,2017-02-19,Marquette
302,4,3:04,184,184,Erika Davenport made Free Throw.,85,73,12,7,0.9879669330765857,Marquette,DePaul,5,3,0,1,NA,400911391,2017-02-19,Marquette
303,4,2:57,177,177,Kelly Campbell made Jumper.,85,75,10,15,0.9785701447993878,Marquette,DePaul,5,3,0,1,NA,400911391,2017-02-19,DePaul
304,4,2:42,162,162,Foul on Brooke Schulte.,85,75,10,0,0.9845204723781308,Marquette,DePaul,5,3,0,1,NA,400911391,2017-02-19,
305,4,2:42,162,162,Danielle King made Free Throw.,86,75,11,0,0.9897268975214063,Marquette,DePaul,5,3,0,1,NA,400911391,2017-02-19,Marquette
306,4,2:42,162,162,Danielle King made Free Throw.,87,75,12,6,0.9931942850621287,Marquette,DePaul,5,3,0,1,NA,400911391,2017-02-19,Marquette
307,4,2:36,156,156,Foul on Erika Davenport.,87,75,12,0,0.9942469422520973,Marquette,DePaul,5,3,0,1,NA,400911391,2017-02-19,
308,4,2:36,156,156,Jacqui Grant made Free Throw.,87,76,11,0,0.9911889590563381,Marquette,DePaul,5,3,0,1,NA,400911391,2017-02-19,DePaul
309,4,2:36,156,156,Jacqui Grant missed Free Throw.,87,76,11,0,0.9911889590563381,Marquette,DePaul,5,3,0,1,NA,400911391,2017-02-19,
310,4,2:36,156,156,DePaul Offensive Rebound.,87,76,11,4,0.9911889590563381,Marquette,DePaul,5,3,0,1,NA,400911391,2017-02-19,
311,4,2:32,152,152,Jacqui Grant missed Jumper.,87,76,11,0,0.9920773593283401,Marquette,DePaul,5,3,0,1,NA,400911391,2017-02-19,
312,4,2:32,152,152,Erika Davenport Defensive Rebound.,87,76,11,10,0.9920773593283401,Marquette,DePaul,5,3,0,1,NA,400911391,2017-02-19,
313,4,2:22,142,142,Foul on Lauren Prochaska.,87,76,11,0,0.9940242019904607,Marquette,DePaul,5,3,0,1,NA,400911391,2017-02-19,
314,4,2:22,142,142,Danielle King missed Free Throw.,87,76,11,0,0.9940242019904607,Marquette,DePaul,5,3,0,1,NA,400911391,2017-02-19,
315,4,2:22,142,142,Marquette Deadball Team Rebound.,87,76,11,0,0.9940242019904607,Marquette,DePaul,5,3,0,1,NA,400911391,2017-02-19,
316,4,2:22,142,142,Danielle King made Free Throw.,88,76,12,9,0.996237705917343,Marquette,DePaul,5,3,0,1,NA,400911391,2017-02-19,Marquette
317,4,2:13,133,133,Foul on Amani Wilborn.,88,76,12,8,0.9972214813524544,Marquette,DePaul,5,3,0,1,NA,400911391,2017-02-19,
318,4,2:05,125,125,Kelly Campbell missed Three Point Jumper.,88,76,12,2,0.9979279860367861,Marquette,DePaul,5,3,0,0,NA,400911391,2017-02-19,
319,4,2:03,123,123,Amani Wilborn Defensive Rebound.,88,76,12,2,0.9980820267715558,Marquette,DePaul,5,3,0,0,NA,400911391,2017-02-19,
320,4,2:01,121,121,Foul on Kelly Campbell.,88,76,12,0,0.9982275545837315,Marquette,DePaul,5,3,0,0,NA,400911391,2017-02-19,
321,4,2:01,121,121,Amani Wilborn made Free Throw.,89,76,13,0,0.998953673381753,Marquette,DePaul,5,3,0,0,NA,400911391,2017-02-19,Marquette
322,4,2:01,121,121,Amani Wilborn missed Free Throw.,89,76,13,0,0.998953673381753,Marquette,DePaul,5,3,0,0,NA,400911391,2017-02-19,
323,4,2:01,121,121,Tanita Allen Defensive Rebound.,89,76,13,7,0.998953673381753,Marquette,DePaul,5,3,0,0,NA,400911391,2017-02-19,
324,4,1:54,114,114,Brooke Schulte made Jumper. Assisted by Kelly Campbell.,89,78,11,34,0.9976987240833054,Marquette,DePaul,5,3,0,0,NA,400911391,2017-02-19,DePaul
325,4,1:20,80,80,Natisha Hiedeman made Three Point Jumper. Assisted by Allazia Blockton.,92,78,14,18,0.9999410926598007,Marquette,DePaul,5,3,0,0,NA,400911391,2017-02-19,Marquette
326,4,1:02,62,62,Brooke Schulte made Jumper.,92,80,12,0,0.999920006527533,Marquette,DePaul,5,3,1,0,NA,400911391,2017-02-19,DePaul
327,4,1:02,62,62,DePaul  Timeout,92,80,12,7,0.999920006527533,Marquette,DePaul,4,3,1,0,NA,400911391,2017-02-19,
328,4,0:55,55,55,Foul on Lauren Prochaska.,92,80,12,0,0.9999491011366496,Marquette,DePaul,4,3,1,0,NA,400911391,2017-02-19,
329,4,0:55,55,55,Natisha Hiedeman made Free Throw.,93,80,13,0,0.9999776669516467,Marquette,DePaul,4,3,1,0,NA,400911391,2017-02-19,Marquette
330,4,0:55,55,55,Natisha Hiedeman missed Free Throw.,93,80,13,0,0.9999776669516467,Marquette,DePaul,4,3,1,0,NA,400911391,2017-02-19,
331,4,0:55,55,55,Brooke Schulte Defensive Rebound.,93,80,13,8,0.9999776669516467,Marquette,DePaul,4,3,1,0,NA,400911391,2017-02-19,
332,4,0:47,47,47,Kelly Campbell missed Layup.,93,80,13,0,0.9999875420304992,Marquette,DePaul,4,3,1,0,NA,400911391,2017-02-19,
333,4,0:47,47,47,Jacqui Grant Offensive Rebound.,93,80,13,5,0.9999875420304992,Marquette,DePaul,4,3,1,0,NA,400911391,2017-02-19,
334,4,0:42,42,42,Tanita Allen missed Three Point Jumper.,93,80,13,0,0.9999914774905424,Marquette,DePaul,4,3,1,0,NA,400911391,2017-02-19,
335,4,0:42,42,42,DePaul Deadball Team Rebound.,93,80,13,1,0.9999914774905424,Marquette,DePaul,4,3,1,0,NA,400911391,2017-02-19,
336,4,0:41,41,41,Foul on Danielle King.,93,80,13,0,0.9999921117126365,Marquette,DePaul,4,3,1,0,NA,400911391,2017-02-19,
337,4,0:41,41,41,Kelly Campbell missed Free Throw.,93,80,13,0,0.9999921117126365,Marquette,DePaul,4,3,1,0,NA,400911391,2017-02-19,
338,4,0:41,41,41,DePaul Deadball Team Rebound.,93,80,13,0,0.9999921117126365,Marquette,DePaul,4,3,1,0,NA,400911391,2017-02-19,
339,4,0:41,41,41,Kelly Campbell made Free Throw.,93,81,12,7,0.9999805232173724,Marquette,DePaul,4,3,1,0,NA,400911391,2017-02-19,DePaul
340,4,0:34,34,34,Foul on Chante Stonewall.,93,81,12,0,0.9999883110465111,Marquette,DePaul,4,3,1,0,NA,400911391,2017-02-19,
341,4,0:34,34,34,Allazia Blockton made Free Throw.,94,81,13,0,0.9999954630868856,Marquette,DePaul,4,3,1,0,NA,400911391,2017-02-19,Marquette
342,4,0:34,34,34,Allazia Blockton made Free Throw.,95,81,14,8,0.9999982390647245,Marquette,DePaul,4,3,1,0,NA,400911391,2017-02-19,Marquette
343,4,0:26,26,26,Jacqui Grant missed Jumper.,95,81,14,0,0.9999991293965845,Marquette,DePaul,4,3,1,0,NA,400911391,2017-02-19,
344,4,0:26,26,26,Erika Davenport Defensive Rebound.,95,81,14,3,0.9999991293965845,Marquette,DePaul,4,3,1,0,NA,400911391,2017-02-19,
345,4,0:23,23,23,Foul on Amarah Coleman.,95,81,14,0,0.9999993350900122,Marquette,DePaul,4,3,1,0,NA,400911391,2017-02-19,
346,4,0:23,23,23,Erika Davenport made Free Throw.,96,81,15,0,0.9999997592691013,Marquette,DePaul,4,3,1,0,NA,400911391,2017-02-19,Marquette
347,4,0:23,23,23,Erika Davenport missed Free Throw.,96,81,15,0,0.9999997592691013,Marquette,DePaul,4,3,1,0,NA,400911391,2017-02-19,
348,4,0:23,23,23,Brooke Schulte Defensive Rebound.,96,81,15,12,0.9999997592691013,Marquette,DePaul,4,3,1,0,NA,400911391,2017-02-19,
349,4,0:11,11,11,Foul on Altia Anderson.,96,81,15,0,0.9999999285471808,Marquette,DePaul,4,3,1,0,NA,400911391,2017-02-19,
350,4,0:11,11,11,Brooke Schulte missed Free Throw.,96,81,15,0,0.9999999285471808,Marquette,DePaul,4,3,1,0,NA,400911391,2017-02-19,
351,4,0:11,11,11,DePaul Deadball Team Rebound.,96,81,15,0,0.9999999285471808,Marquette,DePaul,4,3,1,0,NA,400911391,2017-02-19,
352,4,0:11,11,11,Brooke Schulte missed Free Throw.,96,81,15,0,0.9999999285471808,Marquette,DePaul,4,3,1,0,NA,400911391,2017-02-19,
353,4,0:11,11,11,Chelsey Gibson Defensive Rebound.,96,81,15,11,0.9999999285471808,Marquette,DePaul,4,3,1,0,NA,400911391,2017-02-19,
354,4,0:00,0,0,End of Game,96,81,15,0,1,Marquette,DePaul,4,3,0,0,NA,400911391,2017-02-19,
