play_id,period,time_remaining_period,secs_remaining,secs_remaining_absolute,description,home_score,away_score,score_diff,play_length,win_prob,home,away,home_time_out_remaining,away_time_out_remaining,home_timeout_ind,away_timeout_ind,home_favored_by,game_id,date,whichScored
194,2,0:22,1222,1222,Maya Stovall Defensive Rebound.,34,26,8,1,0.7718717907866444,DePaul,Providence,4,4,0,0,NA,401091089,2018-12-31,
195,2,0:21,1221,1221,Chante Stonewall Turnover.,34,26,8,18,0.771988361749585,DePaul,Providence,4,4,0,0,NA,401091089,2018-12-31,
196,2,0:03,1203,1203,Kaela Webb missed Jumper.,34,26,8,0,0.7741347727953571,DePaul,Providence,4,4,0,0,NA,401091089,2018-12-31,
197,2,0:03,1203,1203,Dee Bekelja Defensive Rebound.,34,26,8,3,0.7741347727953571,DePaul,Providence,4,4,0,0,NA,401091089,2018-12-31,
198,2,0:00,1200,1200,End of 2nd Quarter,34,26,8,4,0.774489981219977,DePaul,Providence,4,4,0,0,NA,401091089,2018-12-31,
199,3,9:56,1196,1196,Lexi Held made Three Point Jumper. Assisted by Ashton Millender.,37,26,11,16,0.8455648974701229,DePaul,Providence,5,5,0,0,NA,401091089,2018-12-31,DePaul
200,3,9:40,1180,1180,Providence  Turnover.,37,26,11,13,0.8474548482934676,DePaul,Providence,5,5,0,0,NA,401091089,2018-12-31,
201,3,9:27,1167,1167,Mart'e Grays missed Layup.,37,26,11,3,0.8489455795481146,DePaul,Providence,5,5,0,0,NA,401091089,2018-12-31,
202,3,9:24,1164,1164,Mary Baskerville Defensive Rebound.,37,26,11,12,0.8492849523079835,DePaul,Providence,5,5,0,0,NA,401091089,2018-12-31,
203,3,9:12,1152,1152,Foul on Olivia Orlando.,37,26,11,0,0.8506284498343993,DePaul,Providence,5,5,0,0,NA,401091089,2018-12-31,
204,3,9:12,1152,1152,Olivia Orlando Turnover.,37,26,11,21,0.8506284498343993,DePaul,Providence,5,5,0,0,NA,401091089,2018-12-31,
205,3,8:51,1131,1131,Chante Stonewall made Jumper. Assisted by Lexi Held.,39,26,13,15,0.888694734538288,DePaul,Providence,5,5,0,0,NA,401091089,2018-12-31,DePaul
206,3,8:36,1116,1116,Mary Baskerville made Layup. Assisted by Jovana Nogic.,39,28,11,8,0.854582066941236,DePaul,Providence,5,5,0,0,NA,401091089,2018-12-31,Providence
207,3,8:28,1108,1108,Kelly Campbell made Three Point Jumper.,42,28,14,15,0.9057649733978692,DePaul,Providence,5,5,0,0,NA,401091089,2018-12-31,DePaul
208,3,8:13,1093,1093,Mary Baskerville made Layup. Assisted by Chanell Williams.,42,30,12,7,0.8759183680038763,DePaul,Providence,5,5,0,0,NA,401091089,2018-12-31,Providence
209,3,8:06,1086,1086,Ashton Millender Turnover.,42,30,12,8,0.8766701558499073,DePaul,Providence,5,5,0,0,NA,401091089,2018-12-31,
210,3,7:58,1078,1078,Maddie Jolin missed Three Point Jumper.,42,30,12,5,0.8775357168791795,DePaul,Providence,5,5,0,0,NA,401091089,2018-12-31,
211,3,7:53,1073,1073,Alyssa Geary Offensive Rebound.,42,30,12,3,0.8780808224210666,DePaul,Providence,5,5,0,0,NA,401091089,2018-12-31,
212,3,7:50,1070,1070,Mary Baskerville made Layup. Assisted by Jovana Nogic.,42,32,10,24,0.8386042123066685,DePaul,Providence,5,5,0,0,NA,401091089,2018-12-31,Providence
213,3,7:26,1046,1046,Ashton Millender missed Three Point Jumper.,42,32,10,4,0.8414485687664723,DePaul,Providence,5,5,0,0,NA,401091089,2018-12-31,
214,3,7:22,1042,1042,Jovana Nogic Defensive Rebound.,42,32,10,8,0.841936130666404,DePaul,Providence,5,5,0,0,NA,401091089,2018-12-31,
215,3,7:14,1034,1034,Foul on Chante Stonewall.,42,32,10,3,0.8429245881991504,DePaul,Providence,5,5,0,0,NA,401091089,2018-12-31,
216,3,7:11,1031,1031,Mary Baskerville made Layup. Assisted by Maddie Jolin.,42,34,8,6,0.7935391743721772,DePaul,Providence,5,5,0,0,NA,401091089,2018-12-31,Providence
217,3,7:05,1025,1025,Dee Bekelja missed Three Point Jumper.,42,34,8,3,0.7942927940303257,DePaul,Providence,5,5,0,0,NA,401091089,2018-12-31,
218,3,7:02,1022,1022,DePaul Offensive Rebound.,42,34,8,4,0.7946742549847388,DePaul,Providence,5,5,0,0,NA,401091089,2018-12-31,
219,3,6:58,1018,1018,Tanita Allen made Three Point Jumper. Assisted by Kelly Campbell.,45,34,11,22,0.865898103825802,DePaul,Providence,5,5,0,0,NA,401091089,2018-12-31,DePaul
220,3,6:36,996,996,Foul on Chante Stonewall.,45,34,11,3,0.8687648874682286,DePaul,Providence,5,5,0,0,NA,401091089,2018-12-31,
221,3,6:33,993,993,Andrea Cooper made Layup. Assisted by Maddie Jolin.,45,36,9,9,0.8248178202972646,DePaul,Providence,5,5,0,0,NA,401091089,2018-12-31,Providence
222,3,6:24,984,984,Ashton Millender missed Three Point Jumper.,45,36,9,3,0.8261017811933852,DePaul,Providence,5,5,0,0,NA,401091089,2018-12-31,
223,3,6:21,981,981,Dee Bekelja Offensive Rebound.,45,36,9,2,0.8265377907091604,DePaul,Providence,5,5,0,0,NA,401091089,2018-12-31,
224,3,6:19,979,979,Kelly Campbell made Three Point Jumper. Assisted by Mart'e Grays.,48,36,12,20,0.8893816809752619,DePaul,Providence,5,5,0,0,NA,401091089,2018-12-31,DePaul
225,3,5:59,959,959,Foul on Maddie Jolin.,48,36,12,0,0.8920703397828343,DePaul,Providence,5,5,0,0,NA,401091089,2018-12-31,
226,3,5:59,959,959,Maddie Jolin Turnover.,48,36,12,19,0.8920703397828343,DePaul,Providence,5,5,0,0,NA,401091089,2018-12-31,
227,3,5:40,940,940,Tanita Allen made Jumper.,50,36,14,18,0.9235874031386097,DePaul,Providence,5,5,0,0,NA,401091089,2018-12-31,DePaul
228,3,5:22,922,922,Alyssa Geary missed Three Point Jumper.,50,36,14,3,0.9252910780202893,DePaul,Providence,5,5,0,0,NA,401091089,2018-12-31,
229,3,5:19,919,919,Kelly Campbell Defensive Rebound.,50,36,14,15,0.9255606881427584,DePaul,Providence,5,5,0,0,NA,401091089,2018-12-31,
230,3,5:04,904,904,Tanita Allen Turnover.,50,36,14,21,0.9268616765104388,DePaul,Providence,5,5,0,0,NA,401091089,2018-12-31,
231,3,4:43,883,883,Chanell Williams missed Three Point Jumper.,50,36,14,3,0.9285922799894085,DePaul,Providence,5,5,0,0,NA,401091089,2018-12-31,
232,3,4:40,880,880,Dee Bekelja Defensive Rebound.,50,36,14,12,0.9288345999177762,DePaul,Providence,5,5,0,0,NA,401091089,2018-12-31,
233,3,4:28,868,868,Dee Bekelja made Three Point Jumper. Assisted by Kelly Campbell.,53,36,17,9,0.958403399242115,DePaul,Providence,5,5,0,0,NA,401091089,2018-12-31,DePaul
234,3,4:19,859,859,Alyssa Geary Turnover.,53,36,17,0,0.958940374115096,DePaul,Providence,5,5,0,0,NA,401091089,2018-12-31,
235,3,4:19,859,859,Official TV Timeout,53,36,17,11,0.958940374115096,DePaul,Providence,5,5,0,0,NA,401091089,2018-12-31,
236,3,4:08,848,848,Sonya Morris missed Jumper.,53,36,17,1,0.9596016117217099,DePaul,Providence,5,5,0,0,NA,401091089,2018-12-31,
237,3,4:07,847,847,Mart'e Grays Offensive Rebound.,53,36,17,0,0.9596621972996209,DePaul,Providence,5,5,0,0,NA,401091089,2018-12-31,
238,3,4:07,847,847,Foul on Andrea Cooper.,53,36,17,0,0.9596621972996209,DePaul,Providence,5,5,0,0,NA,401091089,2018-12-31,
239,3,4:07,847,847,Sonya Morris missed Three Point Jumper.,53,36,17,0,0.9596621972996209,DePaul,Providence,5,5,0,0,NA,401091089,2018-12-31,
240,3,4:07,847,847,Tanita Allen Offensive Rebound.,53,36,17,11,0.9596621972996209,DePaul,Providence,5,5,0,0,NA,401091089,2018-12-31,
241,3,3:56,836,836,Ashton Millender made Three Point Jumper. Assisted by Tanita Allen.,56,36,20,17,0.9770052941265582,DePaul,Providence,5,5,0,0,NA,401091089,2018-12-31,DePaul
242,3,3:39,819,819,Kaela Webb Turnover.,56,36,20,0,0.9777516089147207,DePaul,Providence,5,5,0,0,NA,401091089,2018-12-31,
243,3,3:39,819,819,Mart'e Grays Steal.,56,36,20,9,0.9777516089147207,DePaul,Providence,5,5,0,0,NA,401091089,2018-12-31,
244,3,3:30,810,810,Ashton Millender missed Three Point Jumper.,56,36,20,6,0.9781614319070825,DePaul,Providence,5,5,0,0,NA,401091089,2018-12-31,
245,3,3:24,804,804,Kelly Campbell Offensive Rebound.,56,36,20,6,0.9784414104817004,DePaul,Providence,5,5,0,0,NA,401091089,2018-12-31,
246,3,3:18,798,798,Tanita Allen made Layup. Assisted by Kelly Campbell.,58,36,22,16,0.9853954754834036,DePaul,Providence,5,5,0,0,NA,401091089,2018-12-31,DePaul
247,3,3:02,782,782,Alyssa Geary missed Three Point Jumper.,58,36,22,1,0.9859979986258891,DePaul,Providence,5,5,0,0,NA,401091089,2018-12-31,
248,3,3:01,781,781,Kyra Spiwak Offensive Rebound.,58,36,22,0,0.986036802796538,DePaul,Providence,5,5,0,0,NA,401091089,2018-12-31,
249,3,3:01,781,781,Foul on Sonya Morris.,58,36,22,13,0.986036802796538,DePaul,Providence,5,5,0,0,NA,401091089,2018-12-31,
250,3,2:48,768,768,Mary Baskerville missed Layup.,58,36,22,2,0.9865541899669954,DePaul,Providence,5,5,0,0,NA,401091089,2018-12-31,
251,3,2:46,766,766,Mart'e Grays Defensive Rebound.,58,36,22,0,0.9866359587252571,DePaul,Providence,5,5,0,0,NA,401091089,2018-12-31,
252,3,2:46,766,766,Foul on Mary Baskerville.,58,36,22,5,0.9866359587252571,DePaul,Providence,5,5,0,0,NA,401091089,2018-12-31,
253,3,2:41,761,761,Foul on Earlette Scott.,58,36,22,0,0.9868429512381552,DePaul,Providence,5,5,1,0,NA,401091089,2018-12-31,
254,3,2:41,761,761,Providence  Timeout,58,36,22,0,0.9868429512381552,DePaul,Providence,4,5,1,0,NA,401091089,2018-12-31,
255,3,2:41,761,761,Kelly Campbell made Free Throw.,59,36,23,0,0.9891620648086531,DePaul,Providence,4,5,1,0,NA,401091089,2018-12-31,DePaul
256,3,2:41,761,761,Kelly Campbell made Free Throw.,60,36,24,20,0.9910760987412526,DePaul,Providence,4,5,1,0,NA,401091089,2018-12-31,DePaul
257,3,2:21,741,741,Foul on Mart'e Grays.,60,36,24,9,0.9917165406315472,DePaul,Providence,4,5,1,0,NA,401091089,2018-12-31,
258,3,2:12,732,732,Maddie Jolin Turnover.,60,36,24,12,0.9920171312782228,DePaul,Providence,4,5,1,0,NA,401091089,2018-12-31,
259,3,2:00,720,720,Mart'e Grays made Layup.,62,36,26,15,0.99492691922824394,DePaul,Providence,4,5,1,0,NA,401091089,2018-12-31,DePaul
260,3,1:45,705,705,Kyra Spiwak missed Three Point Jumper.,62,36,26,4,0.9952298676399054,DePaul,Providence,4,5,1,0,NA,401091089,2018-12-31,
261,3,1:41,701,701,Mart'e Grays Defensive Rebound.,62,36,26,3,0.9953030898480054,DePaul,Providence,4,5,1,0,NA,401091089,2018-12-31,
262,3,1:38,698,698,Kelly Campbell missed Three Point Jumper.,62,36,26,4,0.9953562515997398,DePaul,Providence,4,5,0,0,NA,401091089,2018-12-31,
263,3,1:34,694,694,Mary Baskerville Defensive Rebound.,62,36,26,7,0.9954249976926794,DePaul,Providence,4,5,0,0,NA,401091089,2018-12-31,
264,3,1:27,687,687,Maddie Jolin made Layup.,62,38,24,12,0.9932547369617867,DePaul,Providence,4,5,0,0,NA,401091089,2018-12-31,Providence
265,3,1:15,675,675,Ashton Millender missed Three Point Jumper.,62,38,24,3,0.9935127236798306,DePaul,Providence,4,5,0,0,NA,401091089,2018-12-31,
266,3,1:12,672,672,Mary Baskerville Defensive Rebound.,62,38,24,5,0.9935746601075459,DePaul,Providence,4,5,0,0,NA,401091089,2018-12-31,
267,3,1:07,667,667,Kaela Webb made Three Point Jumper. Assisted by Maddie Jolin.,62,41,21,17,0.9881668480707623,DePaul,Providence,4,5,0,0,NA,401091089,2018-12-31,Providence
268,3,0:50,650,650,Mart'e Grays Turnover.,62,41,21,22,0.9887130333643177,DePaul,Providence,4,5,0,0,NA,401091089,2018-12-31,
269,3,0:28,628,628,Kyra Spiwak made Jumper. Assisted by Chanell Williams.,62,43,19,27,0.9837884868761978,DePaul,Providence,4,5,0,0,NA,401091089,2018-12-31,Providence
270,3,0:01,601,601,Ashton Millender missed Three Point Jumper.,62,43,19,0,0.9850591694773393,DePaul,Providence,4,5,0,0,NA,401091089,2018-12-31,
271,3,0:01,601,601,Chanell Williams Defensive Rebound.,62,43,19,1,0.9850591694773393,DePaul,Providence,4,5,0,0,NA,401091089,2018-12-31,
272,3,0:00,600,600,End of 3rd Quarter,62,43,19,24,0.9851090283578244,DePaul,Providence,4,5,0,0,NA,401091089,2018-12-31,
273,4,9:36,576,576,Foul on Lexi Held.,62,43,19,0,0.9863802542365786,DePaul,Providence,5,6,0,0,NA,401091089,2018-12-31,
274,4,9:36,576,576,Kyra Spiwak made Free Throw.,62,44,18,0,0.9829954818510896,DePaul,Providence,5,6,0,0,NA,401091089,2018-12-31,Providence
275,4,9:36,576,576,Kyra Spiwak made Free Throw.,62,45,17,10,0.9787876173824083,DePaul,Providence,5,6,0,0,NA,401091089,2018-12-31,Providence
276,4,9:26,566,566,Mart'e Grays made Layup.,64,45,19,5,0.9869549862783354,DePaul,Providence,5,6,0,0,NA,401091089,2018-12-31,DePaul
277,4,9:21,561,561,Chanell Williams Turnover.,64,45,19,0,0.987252492010845,DePaul,Providence,5,6,0,0,NA,401091089,2018-12-31,
278,4,9:21,561,561,Sonya Morris Steal.,64,45,19,5,0.987252492010845,DePaul,Providence,5,6,0,0,NA,401091089,2018-12-31,
279,4,9:16,556,556,Dee Bekelja made Layup. Assisted by Sonya Morris.,66,45,21,7,0.9921118378152034,DePaul,Providence,5,6,0,0,NA,401091089,2018-12-31,DePaul
280,4,9:09,549,549,Foul on Sonya Morris.,66,45,21,18,0.9924180789672461,DePaul,Providence,5,6,0,0,NA,401091089,2018-12-31,
281,4,8:51,531,531,Chanell Williams missed Layup.,66,45,21,3,0.9930915065498315,DePaul,Providence,5,6,0,0,NA,401091089,2018-12-31,
282,4,8:48,528,528,Mart'e Grays Defensive Rebound.,66,45,21,11,0.9931869777950646,DePaul,Providence,5,6,0,0,NA,401091089,2018-12-31,
283,4,8:37,517,517,Ashton Millender missed Three Point Jumper.,66,45,21,5,0.9935094122819117,DePaul,Providence,5,6,0,0,NA,401091089,2018-12-31,
284,4,8:32,512,512,Mart'e Grays Offensive Rebound.,66,45,21,1,0.9936451206609179,DePaul,Providence,5,6,0,0,NA,401091089,2018-12-31,
285,4,8:31,511,511,Mart'e Grays missed Layup.,66,45,21,0,0.9936716647327978,DePaul,Providence,5,6,0,0,NA,401091089,2018-12-31,
286,4,8:31,511,511,Providence Defensive Rebound.,66,45,21,23,0.9936716647327978,DePaul,Providence,5,6,0,0,NA,401091089,2018-12-31,
287,4,8:08,488,488,Jovana Nogic Turnover.,66,45,21,13,0.9942562131334934,DePaul,Providence,5,6,0,0,NA,401091089,2018-12-31,
288,4,7:55,475,475,Chante Stonewall missed Jumper.,66,45,21,3,0.9945909599351345,DePaul,Providence,5,6,0,0,NA,401091089,2018-12-31,
289,4,7:52,472,472,Chante Stonewall Offensive Rebound.,66,45,21,0,0.9946709989280674,DePaul,Providence,5,6,0,0,NA,401091089,2018-12-31,
290,4,7:52,472,472,Foul on Jovana Nogic.,66,45,21,2,0.9946709989280674,DePaul,Providence,5,6,0,0,NA,401091089,2018-12-31,
291,4,7:50,470,470,Foul on Maddie Jolin.,66,45,21,0,0.9947251134121882,DePaul,Providence,5,6,0,1,NA,401091089,2018-12-31,
292,4,7:50,470,470,DePaul  Timeout,66,45,21,0,0.9947251134121882,DePaul,Providence,5,5,0,1,NA,401091089,2018-12-31,
293,4,7:50,470,470,Foul on Chante Stonewall.,66,45,21,2,0.9947251134121882,DePaul,Providence,5,5,0,1,NA,401091089,2018-12-31,
294,4,7:48,468,468,Kaela Webb Turnover.,66,45,21,0,0.99477987785879,DePaul,Providence,5,5,0,1,NA,401091089,2018-12-31,
295,4,7:48,468,468,Lexi Held Steal.,66,45,21,3,0.99477987785879,DePaul,Providence,5,5,0,1,NA,401091089,2018-12-31,
296,4,7:45,465,465,Foul on Kaela Webb.,66,45,21,0,0.994863321058496,DePaul,Providence,5,5,0,1,NA,401091089,2018-12-31,
297,4,7:45,465,465,Lexi Held made Free Throw.,67,45,22,0,0.9959980755763818,DePaul,Providence,5,5,0,1,NA,401091089,2018-12-31,DePaul
298,4,7:45,465,465,Lexi Held made Free Throw.,68,45,23,12,0.9968829345174156,DePaul,Providence,5,5,0,1,NA,401091089,2018-12-31,DePaul
299,4,7:33,453,453,Mary Baskerville missed Layup.,68,45,23,4,0.9971159686419315,DePaul,Providence,5,5,0,1,NA,401091089,2018-12-31,
300,4,7:29,449,449,Mary Baskerville made Layup.,68,47,21,0,0.9953381740152067,DePaul,Providence,5,5,0,1,NA,401091089,2018-12-31,Providence
301,4,7:29,449,449,Mary Baskerville Offensive Rebound.,68,47,21,20,0.9953381740152067,DePaul,Providence,5,5,0,1,NA,401091089,2018-12-31,
302,4,7:09,429,429,Foul on Chanell Williams.,68,47,21,3,0.9960076672365351,DePaul,Providence,5,5,0,1,NA,401091089,2018-12-31,
303,4,7:06,426,426,Mart'e Grays made Layup. Assisted by Lexi Held.,70,47,23,19,0.9977019958597567,DePaul,Providence,5,5,0,1,NA,401091089,2018-12-31,DePaul
304,4,6:47,407,407,Maddie Jolin made Jumper.,70,49,21,11,0.9966610792305175,DePaul,Providence,5,5,0,0,NA,401091089,2018-12-31,Providence
305,4,6:36,396,396,Mart'e Grays made Layup. Assisted by Lexi Held.,72,49,23,14,0.9982279247758609,DePaul,Providence,5,5,0,0,NA,401091089,2018-12-31,DePaul
306,4,6:22,382,382,Maddie Jolin missed Three Point Jumper.,72,49,23,1,0.9984251196529385,DePaul,Providence,5,5,0,0,NA,401091089,2018-12-31,
307,4,6:21,381,381,Kelly Campbell Defensive Rebound.,72,49,23,0,0.9984386152297829,DePaul,Providence,5,5,0,0,NA,401091089,2018-12-31,
308,4,6:21,381,381,Foul on Tanita Allen.,72,49,23,0,0.9984386152297829,DePaul,Providence,5,5,0,0,NA,401091089,2018-12-31,
309,4,6:21,381,381,Tanita Allen Turnover.,72,49,23,3,0.9984386152297829,DePaul,Providence,5,5,0,0,NA,401091089,2018-12-31,
310,4,6:18,378,378,Mary Baskerville made Layup. Assisted by Maddie Jolin.,72,51,21,6,0.997329043407906,DePaul,Providence,5,5,0,0,NA,401091089,2018-12-31,Providence
311,4,6:12,372,372,Dee Bekelja made Layup. Assisted by Kelly Campbell.,74,51,23,10,0.9985577474343585,DePaul,Providence,5,5,0,0,NA,401091089,2018-12-31,DePaul
312,4,6:02,362,362,Chanell Williams Turnover.,74,51,23,0,0.9986867311503397,DePaul,Providence,5,5,0,0,NA,401091089,2018-12-31,
313,4,6:02,362,362,Tanita Allen Turnover.,74,51,23,0,0.9986867311503397,DePaul,Providence,5,5,0,0,NA,401091089,2018-12-31,
314,4,6:02,362,362,Kyra Spiwak Steal.,74,51,23,22,0.9986867311503397,DePaul,Providence,5,5,0,0,NA,401091089,2018-12-31,
315,4,5:40,340,340,Foul on Mary Baskerville.,74,51,23,0,0.9989645064019929,DePaul,Providence,5,5,0,0,NA,401091089,2018-12-31,
316,4,5:40,340,340,Mary Baskerville Turnover.,74,51,23,24,0.9989645064019929,DePaul,Providence,5,5,0,0,NA,401091089,2018-12-31,
317,4,5:16,316,316,Ashton Millender missed Three Point Jumper.,74,51,23,4,0.999257475999955,DePaul,Providence,5,5,0,0,NA,401091089,2018-12-31,
318,4,5:12,312,312,Tanita Allen Offensive Rebound.,74,51,23,2,0.9993042286856291,DePaul,Providence,5,5,0,0,NA,401091089,2018-12-31,
319,4,5:10,310,310,Dee Bekelja missed Three Point Jumper.,74,51,23,3,0.9993272756224687,DePaul,Providence,5,5,0,0,NA,401091089,2018-12-31,
320,4,5:07,307,307,Ashton Millender Offensive Rebound.,74,51,23,3,0.9993579569069319,DePaul,Providence,5,5,0,0,NA,401091089,2018-12-31,
321,4,5:04,304,304,Tanita Allen missed Three Point Jumper.,74,51,23,5,0.9993820006764315,DePaul,Providence,5,5,0,0,NA,401091089,2018-12-31,
322,4,4:59,299,299,Jovana Nogic Defensive Rebound.,74,51,23,2,0.9994099283460581,DePaul,Providence,5,5,0,0,NA,401091089,2018-12-31,
323,4,4:57,297,297,Foul on Tanita Allen.,74,51,23,0,0.9994174971635855,DePaul,Providence,5,5,0,0,NA,401091089,2018-12-31,
324,4,4:57,297,297,Kyra Spiwak made Free Throw.,74,52,22,0,0.9991949376175328,DePaul,Providence,5,5,0,0,NA,401091089,2018-12-31,Providence
325,4,4:57,297,297,Kyra Spiwak missed Free Throw.,74,52,22,0,0.9991949376175328,DePaul,Providence,5,5,0,0,NA,401091089,2018-12-31,
326,4,4:57,297,297,Kelly Campbell Defensive Rebound.,74,52,22,17,0.9991949376175328,DePaul,Providence,5,5,0,0,NA,401091089,2018-12-31,
327,4,4:40,280,280,Chante Stonewall missed Layup.,74,52,22,0,0.9992011375696744,DePaul,Providence,5,5,0,0,NA,401091089,2018-12-31,
328,4,4:40,280,280,Mary Baskerville Block.,74,52,22,7,0.9992011375696744,DePaul,Providence,5,5,0,0,NA,401091089,2018-12-31,
329,4,4:33,273,273,Chante Stonewall Offensive Rebound.,74,52,22,2,0.9991745959822492,DePaul,Providence,5,5,0,0,NA,401091089,2018-12-31,
330,4,4:31,271,271,Chante Stonewall made Layup.,76,52,24,17,0.9995614007875512,DePaul,Providence,5,5,0,0,NA,401091089,2018-12-31,DePaul
331,4,4:14,254,254,Mary Baskerville made Layup. Assisted by Chanell Williams.,76,54,22,6,0.9990668242045859,DePaul,Providence,5,5,0,0,NA,401091089,2018-12-31,Providence
332,4,4:08,248,248,Chante Stonewall missed Three Point Jumper.,76,54,22,4,0.9990355792308349,DePaul,Providence,5,5,0,0,NA,401091089,2018-12-31,
333,4,4:04,244,244,Mary Baskerville Defensive Rebound.,76,54,22,0,0.99901953134094,DePaul,Providence,5,5,0,0,NA,401091089,2018-12-31,
334,4,4:04,244,244,Foul on Chante Stonewall.,76,54,22,0,0.99901953134094,DePaul,Providence,5,5,0,0,NA,401091089,2018-12-31,
335,4,4:04,244,244,Mary Baskerville made Free Throw.,76,55,21,0,0.9986572046621225,DePaul,Providence,5,5,0,0,NA,401091089,2018-12-31,Providence
336,4,4:04,244,244,Mary Baskerville missed Free Throw.,76,55,21,0,0.9986572046621225,DePaul,Providence,5,5,0,0,NA,401091089,2018-12-31,
337,4,4:04,244,244,Kyra Spiwak Offensive Rebound.,76,55,21,0,0.9986572046621225,DePaul,Providence,5,5,0,0,NA,401091089,2018-12-31,
338,4,4:04,244,244,Maddie Jolin missed Layup.,76,55,21,0,0.9986572046621225,DePaul,Providence,5,5,0,0,NA,401091089,2018-12-31,
339,4,4:04,244,244,Dee Bekelja Defensive Rebound.,76,55,21,21,0.9986572046621225,DePaul,Providence,5,5,0,0,NA,401091089,2018-12-31,
340,4,3:43,223,223,Lexi Held made Three Point Jumper. Assisted by Maya Stovall.,79,55,24,16,0.9994995431769311,DePaul,Providence,5,5,0,0,NA,401091089,2018-12-31,DePaul
341,4,3:27,207,207,Kyra Spiwak Turnover.,79,55,24,20,0.999620828802829,DePaul,Providence,5,5,0,0,NA,401091089,2018-12-31,
342,4,3:07,187,187,Dee Bekelja missed Layup.,79,55,24,0,0.9998275744391011,DePaul,Providence,5,5,0,0,NA,401091089,2018-12-31,
343,4,3:07,187,187,Mary Baskerville Block.,79,55,24,4,0.9998275744391011,DePaul,Providence,5,5,0,0,NA,401091089,2018-12-31,
344,4,3:03,183,183,Mary Baskerville Defensive Rebound.,79,55,24,3,0.9998589633810253,DePaul,Providence,5,5,0,0,NA,401091089,2018-12-31,
345,4,3:00,180,180,Kyra Spiwak missed Jumper.,79,55,24,2,0.9998788208536843,DePaul,Providence,5,5,0,0,NA,401091089,2018-12-31,
346,4,2:58,178,178,Mary Baskerville Offensive Rebound.,79,55,24,2,0.9998905543297166,DePaul,Providence,5,5,0,0,NA,401091089,2018-12-31,
347,4,2:56,176,176,Mary Baskerville made Layup.,79,57,22,14,0.999786985612538,DePaul,Providence,5,5,0,0,NA,401091089,2018-12-31,Providence
348,4,2:42,162,162,Lexi Held missed Three Point Jumper.,79,57,22,2,0.9998922727169777,DePaul,Providence,5,5,0,0,NA,401091089,2018-12-31,
349,4,2:40,160,160,Kyra Spiwak Defensive Rebound.,79,57,22,6,0.999902709612047,DePaul,Providence,5,5,0,0,NA,401091089,2018-12-31,
350,4,2:34,154,154,Foul on Lexi Held.,79,57,22,0,0.9999289566014863,DePaul,Providence,5,5,0,0,NA,401091089,2018-12-31,
351,4,2:34,154,154,Sophia Widmeyer missed Free Throw.,79,57,22,0,0.9999289566014863,DePaul,Providence,5,5,0,0,NA,401091089,2018-12-31,
352,4,2:34,154,154,Providence Offensive Rebound.,79,57,22,0,0.9999289566014863,DePaul,Providence,5,5,0,0,NA,401091089,2018-12-31,
353,4,2:34,154,154,Sophia Widmeyer made Free Throw.,79,58,21,8,0.9998903338355816,DePaul,Providence,5,5,0,0,NA,401091089,2018-12-31,Providence
354,4,2:26,146,146,Lexi Held made Three Point Jumper. Assisted by Maya Stovall.,82,58,24,18,0.9999816086763026,DePaul,Providence,5,5,0,0,NA,401091089,2018-12-31,DePaul
355,4,2:08,128,128,Olivia Orlando made Layup.,82,60,22,3,0.9999851485586344,DePaul,Providence,5,5,0,0,NA,401091089,2018-12-31,Providence
356,4,2:05,125,125,Foul on Kaela Webb.,82,60,22,0,0.9999879302169655,DePaul,Providence,5,5,0,0,NA,401091089,2018-12-31,
357,4,2:05,125,125,Maya Stovall made Free Throw.,83,60,23,0,0.9999927865554885,DePaul,Providence,5,5,0,0,NA,401091089,2018-12-31,DePaul
358,4,2:05,125,125,Maya Stovall made Free Throw.,84,60,24,15,0.9999956889299585,DePaul,Providence,5,5,0,0,NA,401091089,2018-12-31,DePaul
359,4,1:50,110,110,Alyssa Geary missed Jumper.,84,60,24,0,0.9999987595883075,DePaul,Providence,5,5,0,0,NA,401091089,2018-12-31,
360,4,1:50,110,110,Maya Stovall Defensive Rebound.,84,60,24,0,0.9999987595883075,DePaul,Providence,5,5,0,0,NA,401091089,2018-12-31,
361,4,1:50,110,110,Foul on Lexi Held.,84,60,24,0,0.9999987595883075,DePaul,Providence,5,5,0,0,NA,401091089,2018-12-31,
362,4,1:50,110,110,Sophia Widmeyer made Free Throw.,84,61,23,0,0.9999978139160229,DePaul,Providence,5,5,0,0,NA,401091089,2018-12-31,Providence
363,4,1:50,110,110,Sophia Widmeyer made Free Throw.,84,62,22,8,0.9999961472793765,DePaul,Providence,5,5,0,0,NA,401091089,2018-12-31,Providence
364,4,1:42,102,102,Lexi Held missed Three Point Jumper.,84,62,22,5,0.9999980663031016,DePaul,Providence,5,5,0,0,NA,401091089,2018-12-31,
365,4,1:37,97,97,Jolene Daninger Offensive Rebound.,84,62,22,2,0.9999987824068087,DePaul,Providence,5,5,0,0,NA,401091089,2018-12-31,
366,4,1:35,95,95,Tanita Allen missed Three Point Jumper.,84,62,22,4,0.9999989953530792,DePaul,Providence,5,5,0,0,NA,401091089,2018-12-31,
367,4,1:31,91,91,Dee Bekelja Offensive Rebound.,84,62,22,3,0.999999319891471,DePaul,Providence,5,5,0,0,NA,401091089,2018-12-31,
368,4,1:28,88,88,Lexi Held missed Layup.,84,62,22,2,0.9999994938648987,DePaul,Providence,5,5,0,0,NA,401091089,2018-12-31,
369,4,1:26,86,86,Dee Bekelja Offensive Rebound.,84,62,22,8,0.999999585160071,DePaul,Providence,5,5,0,0,NA,401091089,2018-12-31,
370,4,1:18,78,78,Jolene Daninger Turnover.,84,62,22,0,0.9999998169307663,DePaul,Providence,5,5,0,0,NA,401091089,2018-12-31,
371,4,1:18,78,78,Sophia Widmeyer Steal.,84,62,22,6,0.9999998169307663,DePaul,Providence,5,5,0,0,NA,401091089,2018-12-31,
372,4,1:12,72,72,Kaela Webb missed Layup.,84,62,22,4,0.999999904031484,DePaul,Providence,5,5,0,0,NA,401091089,2018-12-31,
373,4,1:08,68,68,Dee Bekelja Defensive Rebound.,84,62,22,15,0.9999999386755869,DePaul,Providence,5,5,0,0,NA,401091089,2018-12-31,
374,4,0:53,53,53,Foul on Sophia Widmeyer.,84,62,22,0,0.9999999894412768,DePaul,Providence,5,5,0,0,NA,401091089,2018-12-31,
375,4,0:53,53,53,Maya Stovall made Free Throw.,85,62,23,0,0.9999999954180717,DePaul,Providence,5,5,0,0,NA,401091089,2018-12-31,DePaul
376,4,0:53,53,53,Maya Stovall made Free Throw.,86,62,24,9,0.999999998011685,DePaul,Providence,5,5,0,0,NA,401091089,2018-12-31,DePaul
377,4,0:44,44,44,Earlette Scott Turnover.,86,62,24,0,0.9999999994192861,DePaul,Providence,5,5,0,0,NA,401091089,2018-12-31,
378,4,0:44,44,44,Tanita Allen Steal.,86,62,24,5,0.9999999994192861,DePaul,Providence,5,5,0,0,NA,401091089,2018-12-31,
379,4,0:39,39,39,Dee Bekelja made Layup. Assisted by Maya Stovall.,88,62,26,11,0.9999999999544501,DePaul,Providence,5,5,0,0,NA,401091089,2018-12-31,DePaul
380,4,0:28,28,28,Earlette Scott Turnover.,88,62,26,0,0.9999999999922539,DePaul,Providence,5,5,0,0,NA,401091089,2018-12-31,
381,4,0:28,28,28,Dee Bekelja Steal.,88,62,26,16,0.9999999999922539,DePaul,Providence,5,5,0,0,NA,401091089,2018-12-31,
382,4,0:12,12,12,DePaul  Turnover.,88,62,26,12,0.9999999999995073,DePaul,Providence,5,5,0,0,NA,401091089,2018-12-31,
383,4,0:00,0,0,End of 4th Quarter,88,62,26,0,1,DePaul,Providence,5,5,0,0,NA,401091089,2018-12-31,
384,4,0:00,0,0,End of Game,88,62,26,0,1,DePaul,Providence,5,5,0,0,NA,401091089,2018-12-31,
