play_id,period,time_remaining_period,secs_remaining,secs_remaining_absolute,description,home_score,away_score,score_diff,play_length,win_prob,home,away,home_time_out_remaining,away_time_out_remaining,home_timeout_ind,away_timeout_ind,home_favored_by,game_id,date,whichScored
1,1,9:51,2391,2391,Maraiyah Smith made Three Point Jumper. Assisted by Oluwadamilola Oloyede.,0,0,0,21,0.5,Missouri,Coppin State,4,4,0,0,NA,400987801,2017-11-24,NA
2,1,9:30,2370,2370,Jordan Frericks missed Layup.,0,3,-3,0,0.4332310607745658,Missouri,Coppin State,4,4,0,0,NA,400987801,2017-11-24,Coppin State
3,1,9:30,2370,2370,Cierra Porter Offensive Rebound.,0,3,-3,0,0.4332310607745658,Missouri,Coppin State,4,4,0,0,NA,400987801,2017-11-24,
4,1,9:30,2370,2370,Foul on Oluwadamilola Oloyede.,0,3,-3,0,0.4332310607745658,Missouri,Coppin State,4,4,0,0,NA,400987801,2017-11-24,
5,1,9:30,2370,2370,Cierra Porter made Free Throw.,1,3,-2,0,0.4553392623404728,Missouri,Coppin State,4,4,0,0,NA,400987801,2017-11-24,Missouri
6,1,9:30,2370,2370,Cierra Porter made Free Throw.,2,3,-1,14,0.4776249128627064,Missouri,Coppin State,4,4,0,0,NA,400987801,2017-11-24,Missouri
7,1,9:16,2356,2356,Oluwadamilola Oloyede Turnover.,2,3,-1,1,0.47747377344269587,Missouri,Coppin State,4,4,0,0,NA,400987801,2017-11-24,
8,1,9:15,2355,2355,Amber Smith Steal.,2,3,-1,3,0.4774629266909198,Missouri,Coppin State,4,4,0,0,NA,400987801,2017-11-24,
9,1,9:12,2352,2352,Amber Smith made Layup.,4,3,1,16,0.5225696534786984,Missouri,Coppin State,4,4,0,0,NA,400987801,2017-11-24,Missouri
10,1,8:56,2336,2336,Candice Beverly Turnover.,4,3,1,2,0.5227443988383682,Missouri,Coppin State,4,4,0,0,NA,400987801,2017-11-24,
11,1,8:54,2334,2334,Amber Smith Steal.,4,3,1,2,0.5227663552678309,Missouri,Coppin State,4,4,0,0,NA,400987801,2017-11-24,
12,1,8:52,2332,2332,Lauren Aldridge missed Layup.,4,3,1,0,0.5227883361633022,Missouri,Coppin State,4,4,0,0,NA,400987801,2017-11-24,
13,1,8:52,2332,2332,Sophie Cunningham Offensive Rebound.,4,3,1,3,0.5227883361633022,Missouri,Coppin State,4,4,0,0,NA,400987801,2017-11-24,
14,1,8:49,2329,2329,Foul on Maraiyah Smith.,4,3,1,0,0.5228213529190979,Missouri,Coppin State,4,4,0,0,NA,400987801,2017-11-24,
15,1,8:49,2329,2329,Sophie Cunningham made Free Throw.,5,3,2,0,0.5455478180458078,Missouri,Coppin State,4,4,0,0,NA,400987801,2017-11-24,Missouri
16,1,8:49,2329,2329,Sophie Cunningham made Free Throw.,6,3,3,29,0.5680860791706658,Missouri,Coppin State,4,4,0,0,NA,400987801,2017-11-24,Missouri
17,1,8:20,2300,2300,Genesis Lucas missed Three Point Jumper.,6,3,3,0,0.5690354297880675,Missouri,Coppin State,4,4,0,0,NA,400987801,2017-11-24,
18,1,8:20,2300,2300,Jordan Frericks Block.,6,3,3,2,0.5690354297880675,Missouri,Coppin State,4,4,0,0,NA,400987801,2017-11-24,
19,1,8:18,2298,2298,Jordan Frericks Defensive Rebound.,6,3,3,3,0.5691013846518673,Missouri,Coppin State,4,4,0,0,NA,400987801,2017-11-24,
20,1,8:15,2295,2295,Jordan Frericks Turnover.,6,3,3,19,0.5692004269661427,Missouri,Coppin State,4,4,0,0,NA,400987801,2017-11-24,
21,1,7:56,2276,2276,Maraiyah Smith made Three Point Jumper. Assisted by Genesis Lucas.,6,6,0,23,0.5,Missouri,Coppin State,4,4,0,0,NA,400987801,2017-11-24,Coppin State
22,1,7:33,2253,2253,Amber Smith missed Three Point Jumper.,6,6,0,0,0.5,Missouri,Coppin State,4,4,0,0,NA,400987801,2017-11-24,
23,1,7:33,2253,2253,Chance Graham Defensive Rebound.,6,6,0,11,0.5,Missouri,Coppin State,4,4,0,0,NA,400987801,2017-11-24,
24,1,7:22,2242,2242,Genesis Lucas Turnover.,6,6,0,14,0.5,Missouri,Coppin State,4,4,0,0,NA,400987801,2017-11-24,
25,1,7:08,2228,2228,Kayla Michael made Layup. Assisted by Sophie Cunningham.,8,6,2,16,0.5478098713841724,Missouri,Coppin State,4,4,0,0,NA,400987801,2017-11-24,Missouri
26,1,6:52,2212,2212,Maraiyah Smith Turnover.,8,6,2,12,0.5481756490460405,Missouri,Coppin State,4,4,0,0,NA,400987801,2017-11-24,
27,1,6:40,2200,2200,Sophie Cunningham made Three Point Jumper. Assisted by Lauren Aldridge.,11,6,5,18,0.6191718133352563,Missouri,Coppin State,4,4,0,0,NA,400987801,2017-11-24,Missouri
28,1,6:22,2182,2182,Chance Graham missed Three Point Jumper.,11,6,5,0,0.620157450118268,Missouri,Coppin State,4,4,0,0,NA,400987801,2017-11-24,
29,1,6:22,2182,2182,Lauren Aldridge Defensive Rebound.,11,6,5,11,0.620157450118268,Missouri,Coppin State,4,4,0,0,NA,400987801,2017-11-24,
30,1,6:11,2171,2171,Cierra Porter made Jumper. Assisted by Amber Smith.,13,6,7,33,0.6659426936712102,Missouri,Coppin State,4,4,0,0,NA,400987801,2017-11-24,Missouri
31,1,5:38,2138,2138,Genesis Lucas made Jumper.,13,8,5,18,0.622580619091764,Missouri,Coppin State,4,4,0,0,NA,400987801,2017-11-24,Coppin State
32,1,5:20,2120,2120,Jordan Frericks made Layup.,15,8,7,20,0.6696682100881042,Missouri,Coppin State,4,4,0,0,NA,400987801,2017-11-24,Missouri
33,1,5:00,2100,2100,Alexis Taylor missed Jumper.,15,8,7,0,0.6711428619630171,Missouri,Coppin State,4,4,0,0,NA,400987801,2017-11-24,
34,1,5:00,2100,2100,Alexis Taylor Offensive Rebound.,15,8,7,16,0.6711428619630171,Missouri,Coppin State,4,4,0,0,NA,400987801,2017-11-24,
35,1,4:44,2084,2084,Genesis Lucas missed Three Point Jumper.,15,8,7,0,0.6723289107069886,Missouri,Coppin State,4,4,0,0,NA,400987801,2017-11-24,
36,1,4:44,2084,2084,Missouri Defensive Rebound.,15,8,7,6,0.6723289107069886,Missouri,Coppin State,4,4,0,0,NA,400987801,2017-11-24,
37,1,4:38,2078,2078,Official TV Timeout,15,8,7,11,0.6727752144096473,Missouri,Coppin State,4,4,0,0,NA,400987801,2017-11-24,
38,1,4:27,2067,2067,Foul on Jordan Roundtree.,15,8,7,0,0.6735957073363456,Missouri,Coppin State,4,4,0,0,NA,400987801,2017-11-24,
39,1,4:27,2067,2067,Jordan Roundtree Turnover.,15,8,7,13,0.6735957073363456,Missouri,Coppin State,4,4,0,0,NA,400987801,2017-11-24,
40,1,4:14,2054,2054,Chance Graham made Jumper. Assisted by Candice Beverly.,15,10,5,14,0.6273022369711612,Missouri,Coppin State,4,4,0,0,NA,400987801,2017-11-24,Coppin State
41,1,4:00,2040,2040,Jordan Chavis Turnover.,15,10,5,23,0.6281039472021778,Missouri,Coppin State,4,4,0,0,NA,400987801,2017-11-24,
42,1,3:37,2017,2017,Genesis Lucas missed Three Point Jumper.,15,10,5,0,0.6294314758889934,Missouri,Coppin State,4,4,0,0,NA,400987801,2017-11-24,
43,1,3:37,2017,2017,Jordan Frericks Defensive Rebound.,15,10,5,19,0.6294314758889934,Missouri,Coppin State,4,4,0,0,NA,400987801,2017-11-24,
44,1,3:18,1998,1998,Foul on Alexis Taylor.,15,10,5,0,0.6305384577576696,Missouri,Coppin State,4,4,0,0,NA,400987801,2017-11-24,
45,1,3:18,1998,1998,Jordan Frericks made Free Throw.,16,10,6,0,0.6550773189182073,Missouri,Coppin State,4,4,0,0,NA,400987801,2017-11-24,Missouri
46,1,3:18,1998,1998,Jordan Frericks made Free Throw.,17,10,7,17,0.6788165573156661,Missouri,Coppin State,4,4,0,0,NA,400987801,2017-11-24,Missouri
47,1,3:01,1981,1981,Chance Graham Turnover.,17,10,7,3,0.6801245763077797,Missouri,Coppin State,4,4,0,0,NA,400987801,2017-11-24,
48,1,2:58,1978,1978,Sophie Cunningham made Three Point Jumper. Assisted by Jordan Chavis.,20,10,10,14,0.7463344539219667,Missouri,Coppin State,4,4,0,0,NA,400987801,2017-11-24,Missouri
49,1,2:44,1964,1964,Genesis Lucas made Jumper.,20,12,8,12,0.7045451354181178,Missouri,Coppin State,4,4,0,0,NA,400987801,2017-11-24,Coppin State
50,1,2:32,1952,1952,Jordan Frericks Turnover.,20,12,8,15,0.7055705536993376,Missouri,Coppin State,4,4,0,0,NA,400987801,2017-11-24,
51,1,2:17,1937,1937,Chance Graham missed Jumper.,20,12,8,0,0.7068594779847691,Missouri,Coppin State,4,4,0,0,NA,400987801,2017-11-24,
52,1,2:17,1937,1937,Cierra Porter Defensive Rebound.,20,12,8,13,0.7068594779847691,Missouri,Coppin State,4,4,0,0,NA,400987801,2017-11-24,
53,1,2:04,1924,1924,Lauren Aldridge missed Three Point Jumper.,20,12,8,0,0.7079819439630075,Missouri,Coppin State,4,4,0,0,NA,400987801,2017-11-24,
54,1,2:04,1924,1924,Amber Smith Offensive Rebound.,20,12,8,3,0.7079819439630075,Missouri,Coppin State,4,4,0,0,NA,400987801,2017-11-24,
55,1,2:01,1921,1921,Foul on Sophie Cunningham.,20,12,8,5,0.7082406300548159,Missouri,Coppin State,4,4,0,0,NA,400987801,2017-11-24,
56,1,1:56,1916,1916,Candice Beverly missed Jumper.,20,12,8,0,0.7086712272904133,Missouri,Coppin State,4,4,0,0,NA,400987801,2017-11-24,
57,1,1:56,1916,1916,Amber Smith Defensive Rebound.,20,12,8,17,0.7086712272904133,Missouri,Coppin State,4,4,0,0,NA,400987801,2017-11-24,
58,1,1:39,1899,1899,Cierra Porter missed Jumper.,20,12,8,0,0.7101309547201213,Missouri,Coppin State,4,4,0,0,NA,400987801,2017-11-24,
59,1,1:39,1899,1899,Cierra Porter Offensive Rebound.,20,12,8,2,0.7101309547201213,Missouri,Coppin State,4,4,0,0,NA,400987801,2017-11-24,
60,1,1:37,1897,1897,Cierra Porter missed Jumper.,20,12,8,0,0.7103023282249372,Missouri,Coppin State,4,4,0,0,NA,400987801,2017-11-24,
61,1,1:37,1897,1897,Cierra Porter Offensive Rebound.,20,12,8,5,0.7103023282249372,Missouri,Coppin State,4,4,0,0,NA,400987801,2017-11-24,
62,1,1:32,1892,1892,Hannah Schuchts missed Three Point Jumper.,20,12,8,0,0.7107305027682428,Missouri,Coppin State,4,4,0,0,NA,400987801,2017-11-24,
63,1,1:32,1892,1892,Genesis Lucas Defensive Rebound.,20,12,8,29,0.7107305027682428,Missouri,Coppin State,4,4,0,0,NA,400987801,2017-11-24,
64,1,1:03,1863,1863,Maraiyah Smith missed Three Point Jumper.,20,12,8,0,0.713209608651688,Missouri,Coppin State,4,4,0,0,NA,400987801,2017-11-24,
65,1,1:03,1863,1863,Patricia Albert Offensive Rebound.,20,12,8,6,0.713209608651688,Missouri,Coppin State,4,4,0,0,NA,400987801,2017-11-24,
66,1,0:57,1857,1857,Patricia Albert missed Jumper.,20,12,8,0,0.7137223136435029,Missouri,Coppin State,4,4,0,0,NA,400987801,2017-11-24,
67,1,0:57,1857,1857,Amber Smith Defensive Rebound.,20,12,8,21,0.7137223136435029,Missouri,Coppin State,4,4,0,0,NA,400987801,2017-11-24,
68,1,0:36,1836,1836,Cierra Porter made Layup. Assisted by Hannah Schuchts.,22,12,10,33,0.7600449746897773,Missouri,Coppin State,4,4,0,0,NA,400987801,2017-11-24,Missouri
69,1,0:03,1803,1803,Chance Graham missed Jumper.,22,12,10,0,0.7632188666134916,Missouri,Coppin State,4,4,0,0,NA,400987801,2017-11-24,
70,1,0:03,1803,1803,Amber Smith Block.,22,12,10,1,0.7632188666134916,Missouri,Coppin State,4,4,0,0,NA,400987801,2017-11-24,
71,1,0:02,1802,1802,Coppin State Deadball Team Rebound.,22,12,10,1,0.7633153833916291,Missouri,Coppin State,4,4,0,0,NA,400987801,2017-11-24,
72,1,0:01,1801,1801,Coppin State  Turnover.,22,12,10,1,0.7634119261492818,Missouri,Coppin State,4,4,0,0,NA,400987801,2017-11-24,
73,1,0:00,1800,1800,End of 1st Quarter,22,12,10,40,0.7635084954020187,Missouri,Coppin State,4,4,0,0,NA,400987801,2017-11-24,
74,2,9:20,1760,1760,Hannah Schuchts made Jumper.,24,12,12,10,0.8072777335734557,Missouri,Coppin State,4,4,0,0,NA,400987801,2017-11-24,Missouri
75,2,9:10,1750,1750,Genesis Lucas made Jumper.,24,14,10,3,0.7683819376422882,Missouri,Coppin State,4,4,0,0,NA,400987801,2017-11-24,Coppin State
76,2,9:07,1747,1747,Jordan Chavis made Jumper.,26,14,12,2,0.8086145402561213,Missouri,Coppin State,4,4,0,0,NA,400987801,2017-11-24,Missouri
77,2,9:05,1745,1745,Sophie Cunningham Turnover.,26,14,12,5,0.8088208373864336,Missouri,Coppin State,4,4,0,0,NA,400987801,2017-11-24,
78,2,9:00,1740,1740,Genesis Lucas missed Three Point Jumper.,26,14,12,0,0.8093373761165377,Missouri,Coppin State,4,4,0,0,NA,400987801,2017-11-24,
79,2,9:00,1740,1740,Sophie Cunningham Defensive Rebound.,26,14,12,30,0.8093373761165377,Missouri,Coppin State,4,4,0,0,NA,400987801,2017-11-24,
80,2,8:30,1710,1710,Foul on Hannah Schuchts.,26,14,12,13,0.8124634877344633,Missouri,Coppin State,4,4,0,0,NA,400987801,2017-11-24,
81,2,8:17,1697,1697,Chance Graham made Free Throw.,26,15,11,0,0.7944880862057102,Missouri,Coppin State,4,4,0,0,NA,400987801,2017-11-24,Coppin State
82,2,8:17,1697,1697,Chance Graham made Free Throw.,26,16,10,20,0.7736903015200158,Missouri,Coppin State,4,4,0,0,NA,400987801,2017-11-24,Coppin State
83,2,7:57,1677,1677,Sophie Cunningham made Jumper. Assisted by Amber Smith.,28,16,12,15,0.815942058510225,Missouri,Coppin State,4,4,0,0,NA,400987801,2017-11-24,Missouri
84,2,7:42,1662,1662,Chance Graham made Three Point Jumper. Assisted by Candice Beverly.,28,19,9,14,0.7548240857325392,Missouri,Coppin State,4,4,0,0,NA,400987801,2017-11-24,Coppin State
85,2,7:28,1648,1648,Jordan Chavis missed Three Point Jumper.,28,19,9,0,0.7561277853518087,Missouri,Coppin State,4,4,0,0,NA,400987801,2017-11-24,
86,2,7:28,1648,1648,Kayla Michael Offensive Rebound.,28,19,9,5,0.7561277853518087,Missouri,Coppin State,4,4,0,0,NA,400987801,2017-11-24,
87,2,7:23,1643,1643,Sophie Cunningham missed Layup.,28,19,9,0,0.7565880946128557,Missouri,Coppin State,4,4,0,0,NA,400987801,2017-11-24,
88,2,7:23,1643,1643,Sophie Cunningham Offensive Rebound.,28,19,9,4,0.7565880946128557,Missouri,Coppin State,4,4,0,0,NA,400987801,2017-11-24,
89,2,7:19,1639,1639,Sophie Cunningham missed Jumper.,28,19,9,0,0.7569545954159205,Missouri,Coppin State,4,4,0,0,NA,400987801,2017-11-24,
90,2,7:19,1639,1639,Kayla Michael Offensive Rebound.,28,19,9,9,0.7569545954159205,Missouri,Coppin State,4,4,0,0,NA,400987801,2017-11-24,
91,2,7:10,1630,1630,Kayla Michael missed Three Point Jumper.,28,19,9,0,0.7577742041623423,Missouri,Coppin State,4,4,0,0,NA,400987801,2017-11-24,
92,2,7:10,1630,1630,Candice Beverly Defensive Rebound.,28,19,9,9,0.7577742041623423,Missouri,Coppin State,4,4,0,0,NA,400987801,2017-11-24,
93,2,7:01,1621,1621,Genesis Lucas missed Three Point Jumper.,28,19,9,0,0.7585879715252829,Missouri,Coppin State,4,4,0,0,NA,400987801,2017-11-24,
94,2,7:01,1621,1621,Kayla Michael Defensive Rebound.,28,19,9,13,0.7585879715252829,Missouri,Coppin State,4,4,0,0,NA,400987801,2017-11-24,
95,2,6:48,1608,1608,Jordan Chavis made Jumper.,30,19,11,20,0.8033231365963215,Missouri,Coppin State,4,4,0,0,NA,400987801,2017-11-24,Missouri
96,2,6:28,1588,1588,Candice Beverly missed Jumper.,30,19,11,0,0.805212304395158,Missouri,Coppin State,4,4,0,0,NA,400987801,2017-11-24,
97,2,6:28,1588,1588,Jordan Chavis Defensive Rebound.,30,19,11,6,0.805212304395158,Missouri,Coppin State,4,4,0,0,NA,400987801,2017-11-24,
98,2,6:22,1582,1582,Amber Smith missed Layup.,30,19,11,0,0.8057779118426508,Missouri,Coppin State,4,4,0,0,NA,400987801,2017-11-24,
99,2,6:22,1582,1582,Missouri Offensive Rebound.,30,19,11,19,0.8057779118426508,Missouri,Coppin State,4,4,0,0,NA,400987801,2017-11-24,
100,2,6:03,1563,1563,Sophie Cunningham missed Three Point Jumper.,30,19,11,0,0.8075721674444588,Missouri,Coppin State,4,4,0,0,NA,400987801,2017-11-24,
101,2,6:03,1563,1563,Maraiyah Smith Defensive Rebound.,30,19,11,21,0.8075721674444588,Missouri,Coppin State,4,4,0,0,NA,400987801,2017-11-24,
102,2,5:42,1542,1542,Foul on Jordan Frericks.,30,19,11,0,0.8095726028040523,Missouri,Coppin State,4,4,0,0,NA,400987801,2017-11-24,
103,2,5:42,1542,1542,Candice Beverly missed Free Throw.,30,19,11,0,0.8095726028040523,Missouri,Coppin State,4,4,0,0,NA,400987801,2017-11-24,
104,2,5:42,1542,1542,Coppin State Deadball Team Rebound.,30,19,11,0,0.8095726028040523,Missouri,Coppin State,4,4,0,0,NA,400987801,2017-11-24,
105,2,5:42,1542,1542,Candice Beverly made Free Throw.,30,20,10,20,0.7884601706917092,Missouri,Coppin State,4,4,0,0,NA,400987801,2017-11-24,Coppin State
106,2,5:22,1522,1522,Cierra Porter made Jumper. Assisted by Lauren Aldridge.,32,20,12,12,0.8309759505728589,Missouri,Coppin State,4,4,0,0,NA,400987801,2017-11-24,Missouri
107,2,5:10,1510,1510,Candice Beverly missed Jumper.,32,20,12,0,0.83216001395358,Missouri,Coppin State,4,4,0,0,NA,400987801,2017-11-24,
108,2,5:10,1510,1510,Coppin State Deadball Team Rebound.,32,20,12,0,0.83216001395358,Missouri,Coppin State,4,4,0,0,NA,400987801,2017-11-24,
109,2,5:10,1510,1510,Foul on Cierra Porter.,32,20,12,18,0.83216001395358,Missouri,Coppin State,4,4,0,0,NA,400987801,2017-11-24,
110,2,4:52,1492,1492,Genesis Lucas missed Jumper.,32,20,12,0,0.8339707418288705,Missouri,Coppin State,4,4,0,0,NA,400987801,2017-11-24,
111,2,4:52,1492,1492,Cierra Porter Defensive Rebound.,32,20,12,12,0.8339707418288705,Missouri,Coppin State,4,4,0,0,NA,400987801,2017-11-24,
112,2,4:40,1480,1480,Jordan Frericks made Jumper. Assisted by Cierra Porter.,34,20,14,20,0.8691507151434009,Missouri,Coppin State,4,4,0,0,NA,400987801,2017-11-24,Missouri
113,2,4:20,1460,1460,Foul on Jordan Roundtree.,34,20,14,1,0.8711848514811446,Missouri,Coppin State,4,4,0,0,NA,400987801,2017-11-24,
114,2,4:19,1459,1459,Maraiyah Smith made Free Throw.,34,21,13,0,0.8551772696173588,Missouri,Coppin State,4,4,0,0,NA,400987801,2017-11-24,Coppin State
115,2,4:19,1459,1459,Maraiyah Smith made Free Throw.,34,22,12,0,0.8374258426376012,Missouri,Coppin State,4,4,0,0,NA,400987801,2017-11-24,Coppin State
116,2,4:19,1459,1459,Official TV Timeout,34,22,12,8,0.8374258426376012,Missouri,Coppin State,4,4,0,0,NA,400987801,2017-11-24,
117,2,4:11,1451,1451,Foul on Candice Beverly.,34,22,12,22,0.8382946171745399,Missouri,Coppin State,4,4,0,0,NA,400987801,2017-11-24,
118,2,3:49,1429,1429,Jordan Frericks made Jumper. Assisted by Sophie Cunningham.,36,22,14,15,0.8743725712397447,Missouri,Coppin State,4,4,0,0,NA,400987801,2017-11-24,Missouri
119,2,3:34,1414,1414,Chance Graham missed Three Point Jumper.,36,22,14,0,0.875836099902692,Missouri,Coppin State,4,4,0,0,NA,400987801,2017-11-24,
120,2,3:34,1414,1414,Missouri Defensive Rebound.,36,22,14,20,0.875836099902692,Missouri,Coppin State,4,4,0,0,NA,400987801,2017-11-24,
121,2,3:14,1394,1394,Emmanuelle Tahane missed Three Point Jumper.,36,22,14,0,0.8777207075167809,Missouri,Coppin State,4,4,0,0,NA,400987801,2017-11-24,
122,2,3:14,1394,1394,Jordan Frericks Offensive Rebound.,36,22,14,5,0.8777207075167809,Missouri,Coppin State,4,4,0,0,NA,400987801,2017-11-24,
123,2,3:09,1389,1389,Foul on Candice Beverly.,36,22,14,0,0.8781826232635184,Missouri,Coppin State,4,4,0,0,NA,400987801,2017-11-24,
124,2,3:09,1389,1389,Sophie Cunningham made Free Throw.,37,22,15,0,0.8924895421884678,Missouri,Coppin State,4,4,0,0,NA,400987801,2017-11-24,Missouri
125,2,3:09,1389,1389,Sophie Cunningham made Free Throw.,38,22,16,17,0.9052973767835563,Missouri,Coppin State,4,4,0,0,NA,400987801,2017-11-24,Missouri
126,2,2:52,1372,1372,Chance Graham missed Jumper.,38,22,16,0,0.9067162055557535,Missouri,Coppin State,4,4,0,0,NA,400987801,2017-11-24,
127,2,2:52,1372,1372,Jordan Frericks Defensive Rebound.,38,22,16,0,0.9067162055557535,Missouri,Coppin State,4,4,0,0,NA,400987801,2017-11-24,
128,2,2:52,1372,1372,Nadia Green missed Three Point Jumper.,38,22,16,0,0.9067162055557535,Missouri,Coppin State,4,4,0,0,NA,400987801,2017-11-24,
129,2,2:52,1372,1372,Sophie Cunningham Offensive Rebound.,38,22,16,7,0.9067162055557535,Missouri,Coppin State,4,4,0,0,NA,400987801,2017-11-24,
130,2,2:45,1365,1365,Foul on Candice Beverly.,38,22,16,13,0.9072936423214569,Missouri,Coppin State,4,4,0,0,NA,400987801,2017-11-24,
131,2,2:32,1352,1352,Foul on Mia Crooms.,38,22,16,0,0.908359842185954,Missouri,Coppin State,4,4,0,0,NA,400987801,2017-11-24,
132,2,2:32,1352,1352,Jordan Frericks missed Free Throw.,38,22,16,0,0.908359842185954,Missouri,Coppin State,4,4,0,0,NA,400987801,2017-11-24,
133,2,2:32,1352,1352,Missouri Deadball Team Rebound.,38,22,16,0,0.908359842185954,Missouri,Coppin State,4,4,0,0,NA,400987801,2017-11-24,
134,2,2:32,1352,1352,Jordan Frericks made Free Throw.,39,22,17,14,0.9196153103799736,Missouri,Coppin State,4,4,0,0,NA,400987801,2017-11-24,Missouri
135,2,2:18,1338,1338,Chance Graham missed Jumper.,39,22,17,0,0.9206948982035635,Missouri,Coppin State,4,4,0,0,NA,400987801,2017-11-24,
136,2,2:18,1338,1338,Missouri Defensive Rebound.,39,22,17,12,0.9206948982035635,Missouri,Coppin State,4,4,0,0,NA,400987801,2017-11-24,
137,2,2:06,1326,1326,Emmanuelle Tahane made Jumper.,41,22,19,9,0.9401689742545846,Missouri,Coppin State,4,4,0,0,NA,400987801,2017-11-24,Missouri
138,2,1:57,1317,1317,Coppin State  Timeout,41,22,19,12,0.9407761417064948,Missouri,Coppin State,3,4,1,0,NA,400987801,2017-11-24,
139,2,1:45,1305,1305,Genesis Lucas missed Three Point Jumper.,41,22,19,0,0.9415906675140642,Missouri,Coppin State,3,4,1,0,NA,400987801,2017-11-24,
140,2,1:45,1305,1305,Amber Smith Defensive Rebound.,41,22,19,23,0.9415906675140642,Missouri,Coppin State,3,4,1,0,NA,400987801,2017-11-24,
141,2,1:22,1282,1282,Emmanuelle Tahane missed Jumper.,41,22,19,0,0.943177814737313,Missouri,Coppin State,3,4,1,0,NA,400987801,2017-11-24,
142,2,1:22,1282,1282,Alexis Taylor Block.,41,22,19,2,0.943177814737313,Missouri,Coppin State,3,4,1,0,NA,400987801,2017-11-24,
143,2,1:20,1280,1280,Amber Smith Offensive Rebound.,41,22,19,2,0.9433179357758792,Missouri,Coppin State,3,4,1,0,NA,400987801,2017-11-24,
144,2,1:18,1278,1278,Foul on Alexis Taylor.,41,22,19,0,0.943458448641389,Missouri,Coppin State,3,4,1,0,NA,400987801,2017-11-24,
145,2,1:18,1278,1278,Amber Smith made Free Throw.,42,22,20,0,0.9508608723535997,Missouri,Coppin State,3,4,1,0,NA,400987801,2017-11-24,Missouri
146,2,1:18,1278,1278,Amber Smith made Free Throw.,43,22,21,27,0.957337992907827,Missouri,Coppin State,3,4,1,0,NA,400987801,2017-11-24,Missouri
147,2,0:51,1251,1251,Foul on Emmanuelle Tahane.,43,22,21,0,0.9589766500036389,Missouri,Coppin State,3,4,0,0,NA,400987801,2017-11-24,
148,2,0:51,1251,1251,Maraiyah Smith made Free Throw.,43,23,20,0,0.9526483037634732,Missouri,Coppin State,3,4,0,0,NA,400987801,2017-11-24,Coppin State
149,2,0:51,1251,1251,Maraiyah Smith made Free Throw.,43,24,19,20,0.9453993165006781,Missouri,Coppin State,3,4,0,0,NA,400987801,2017-11-24,Coppin State
150,2,0:31,1231,1231,Nadia Green made Jumper.,45,24,21,0,0.9602379273922007,Missouri,Coppin State,3,4,0,0,NA,400987801,2017-11-24,Missouri
151,2,0:31,1231,1231,Foul on Alexis Taylor.,45,24,21,0,0.9602379273922007,Missouri,Coppin State,3,4,0,0,NA,400987801,2017-11-24,
152,2,0:31,1231,1231,Nadia Green missed Free Throw.,45,24,21,0,0.9602379273922007,Missouri,Coppin State,3,4,0,0,NA,400987801,2017-11-24,
153,2,0:31,1231,1231,Chance Graham Defensive Rebound.,45,24,21,15,0.9602379273922007,Missouri,Coppin State,3,4,0,0,NA,400987801,2017-11-24,
154,2,0:16,1216,1216,Mia Crooms Turnover.,45,24,21,3,0.9612149115704913,Missouri,Coppin State,3,4,0,0,NA,400987801,2017-11-24,
155,2,0:13,1213,1213,Kelsey Winfrey Steal.,45,24,21,11,0.9614137272751132,Missouri,Coppin State,3,4,0,0,NA,400987801,2017-11-24,
156,2,0:02,1202,1202,Hannah Schuchts Turnover.,45,24,21,2,0.9621404387963112,Missouri,Coppin State,3,4,0,0,NA,400987801,2017-11-24,
157,2,0:00,1200,1200,End of 2nd Quarter,45,24,21,5,0.9622696665818932,Missouri,Coppin State,3,4,0,0,NA,400987801,2017-11-24,
158,3,9:55,1195,1195,Mia Crooms made Three Point Jumper. Assisted by Candice Beverly.,45,27,18,23,0.9417887788472731,Missouri,Coppin State,4,5,0,0,NA,400987801,2017-11-24,Coppin State
159,3,9:32,1172,1172,Lauren Aldridge missed Three Point Jumper.,45,27,18,0,0.943624384379256,Missouri,Coppin State,4,5,0,0,NA,400987801,2017-11-24,
160,3,9:32,1172,1172,Coppin State Defensive Rebound.,45,27,18,25,0.943624384379256,Missouri,Coppin State,4,5,0,0,NA,400987801,2017-11-24,
161,3,9:07,1147,1147,Candice Beverly missed Jumper.,45,27,18,0,0.9455079498704162,Missouri,Coppin State,4,5,0,0,NA,400987801,2017-11-24,
162,3,9:07,1147,1147,Chance Graham Offensive Rebound.,45,27,18,18,0.9455079498704162,Missouri,Coppin State,4,5,0,0,NA,400987801,2017-11-24,
163,3,8:49,1129,1129,Maraiyah Smith missed Three Point Jumper.,45,27,18,0,0.9468168667148812,Missouri,Coppin State,4,5,0,0,NA,400987801,2017-11-24,
164,3,8:49,1129,1129,Amber Smith Block.,45,27,18,1,0.9468168667148812,Missouri,Coppin State,4,5,0,0,NA,400987801,2017-11-24,
165,3,8:48,1128,1128,Coppin State Offensive Rebound.,45,27,18,12,0.9468887980125227,Missouri,Coppin State,4,5,0,0,NA,400987801,2017-11-24,
166,3,8:36,1116,1116,Maraiyah Smith made Three Point Jumper. Assisted by Genesis Lucas.,45,30,15,20,0.9179640663533324,Missouri,Coppin State,4,5,0,0,NA,400987801,2017-11-24,Coppin State
167,3,8:16,1096,1096,Kayla Michael missed Jumper.,45,30,15,0,0.9197702903905154,Missouri,Coppin State,4,5,0,0,NA,400987801,2017-11-24,
168,3,8:16,1096,1096,Candice Beverly Defensive Rebound.,45,30,15,24,0.9197702903905154,Missouri,Coppin State,4,5,0,0,NA,400987801,2017-11-24,
169,3,7:52,1072,1072,Mia Crooms missed Three Point Jumper.,45,30,15,0,0.9219580898276327,Missouri,Coppin State,4,5,0,0,NA,400987801,2017-11-24,
170,3,7:52,1072,1072,Cierra Porter Defensive Rebound.,45,30,15,12,0.9219580898276327,Missouri,Coppin State,4,5,0,0,NA,400987801,2017-11-24,
171,3,7:40,1060,1060,Amber Smith missed Three Point Jumper.,45,30,15,0,0.9230706947977262,Missouri,Coppin State,4,5,0,0,NA,400987801,2017-11-24,
172,3,7:40,1060,1060,Coppin State Defensive Rebound.,45,30,15,3,0.9230706947977262,Missouri,Coppin State,4,5,0,0,NA,400987801,2017-11-24,
173,3,7:37,1057,1057,Coppin State  Timeout,45,30,15,8,0.9233514929603194,Missouri,Coppin State,3,5,1,0,NA,400987801,2017-11-24,
174,3,7:29,1049,1049,Maraiyah Smith missed Jumper.,45,30,15,0,0.9241062173624031,Missouri,Coppin State,3,5,1,0,NA,400987801,2017-11-24,
175,3,7:29,1049,1049,Cierra Porter Defensive Rebound.,45,30,15,23,0.9241062173624031,Missouri,Coppin State,3,5,1,0,NA,400987801,2017-11-24,
176,3,7:06,1026,1026,Cierra Porter made Layup.,47,30,17,0,0.94630409362179,Missouri,Coppin State,3,5,1,0,NA,400987801,2017-11-24,Missouri
177,3,7:06,1026,1026,Foul on Chance Graham.,47,30,17,0,0.94630409362179,Missouri,Coppin State,3,5,1,0,NA,400987801,2017-11-24,
178,3,7:06,1026,1026,Cierra Porter missed Free Throw.,47,30,17,0,0.94630409362179,Missouri,Coppin State,3,5,1,0,NA,400987801,2017-11-24,
179,3,7:06,1026,1026,Coppin State Defensive Rebound.,47,30,17,14,0.94630409362179,Missouri,Coppin State,3,5,1,0,NA,400987801,2017-11-24,
180,3,6:52,1012,1012,Candice Beverly Turnover.,47,30,17,1,0.9474865352920185,Missouri,Coppin State,3,5,1,0,NA,400987801,2017-11-24,
181,3,6:51,1011,1011,Jordan Frericks Steal.,47,30,17,14,0.9475721618457915,Missouri,Coppin State,3,5,1,0,NA,400987801,2017-11-24,
182,3,6:37,997,997,Cierra Porter made Layup. Assisted by Jordan Frericks.,49,30,19,14,0.9631252915503288,Missouri,Coppin State,3,5,1,0,NA,400987801,2017-11-24,Missouri
183,3,6:23,983,983,Genesis Lucas Turnover.,49,30,19,1,0.9641451868256997,Missouri,Coppin State,3,5,0,0,NA,400987801,2017-11-24,
