play_id,period,time_remaining_period,secs_remaining,secs_remaining_absolute,description,home_score,away_score,score_diff,play_length,win_prob,home,away,home_time_out_remaining,away_time_out_remaining,home_timeout_ind,away_timeout_ind,home_favored_by,game_id,date,whichScored
1,1,9:40,2380,2380,Regan Magarity Turnover.,0,0,0,14,0.5,Miami,Virginia Tech,4,4,0,0,NA,400912122,2017-01-11,NA
2,1,9:26,2366,2366,Erykah Davenport Turnover.,0,0,0,2,0.5,Miami,Virginia Tech,4,4,0,0,NA,400912122,2017-01-11,
3,1,9:24,2364,2364,Sidney Cook Steal.,0,0,0,18,0.5,Miami,Virginia Tech,4,4,0,0,NA,400912122,2017-01-11,
4,1,9:06,2346,2346,Regan Magarity Turnover.,0,0,0,14,0.5,Miami,Virginia Tech,4,4,0,0,NA,400912122,2017-01-11,
5,1,8:52,2332,2332,Erykah Davenport Turnover.,0,0,0,9,0.5,Miami,Virginia Tech,4,4,0,0,NA,400912122,2017-01-11,
6,1,8:43,2323,2323,Chanette Hicks made Jumper.,0,2,-2,13,0.45432062009867336,Miami,Virginia Tech,4,4,0,0,NA,400912122,2017-01-11,Virginia Tech
7,1,8:30,2310,2310,Foul on Chanette Hicks.,0,2,-2,5,0.4540341708711008,Miami,Virginia Tech,4,4,0,0,NA,400912122,2017-01-11,
8,1,8:25,2305,2305,Foul on Samantha Hill.,0,2,-2,0,0.4539235074515363,Miami,Virginia Tech,4,4,0,0,NA,400912122,2017-01-11,
9,1,8:25,2305,2305,Keyanna Harris missed Free Throw.,0,2,-2,0,0.4539235074515363,Miami,Virginia Tech,4,4,0,0,NA,400912122,2017-01-11,
10,1,8:25,2305,2305,Miami Deadball Team Rebound.,0,2,-2,0,0.4539235074515363,Miami,Virginia Tech,4,4,0,0,NA,400912122,2017-01-11,
11,1,8:25,2305,2305,Keyanna Harris made Free Throw.,1,2,-1,11,0.47691263374444354,Miami,Virginia Tech,4,4,0,0,NA,400912122,2017-01-11,Miami
12,1,8:14,2294,2294,Foul on Erykah Davenport.,1,2,-1,3,0.47678965866213896,Miami,Virginia Tech,4,4,0,0,NA,400912122,2017-01-11,
13,1,8:11,2291,2291,Regan Magarity missed Jumper.,1,2,-1,0,0.47675601221531133,Miami,Virginia Tech,4,4,0,0,NA,400912122,2017-01-11,
14,1,8:11,2291,2291,Adrienne Motley Defensive Rebound.,1,2,-1,7,0.47675601221531133,Miami,Virginia Tech,4,4,0,0,NA,400912122,2017-01-11,
15,1,8:04,2284,2284,Adrienne Motley missed Jumper.,1,2,-1,0,0.476677330647579,Miami,Virginia Tech,4,4,0,0,NA,400912122,2017-01-11,
16,1,8:04,2284,2284,Regan Magarity Defensive Rebound.,1,2,-1,9,0.476677330647579,Miami,Virginia Tech,4,4,0,0,NA,400912122,2017-01-11,
17,1,7:55,2275,2275,Vanessa Panousis made Jumper. Assisted by Chanette Hicks.,1,4,-3,15,0.4301360678351613,Miami,Virginia Tech,4,4,0,0,NA,400912122,2017-01-11,Virginia Tech
18,1,7:40,2260,2260,Keyanna Harris Turnover.,1,4,-3,3,0.4296350218399352,Miami,Virginia Tech,4,4,0,0,NA,400912122,2017-01-11,
19,1,7:37,2257,2257,Sidney Cook Steal.,1,4,-3,2,0.42953448804264266,Miami,Virginia Tech,4,4,0,0,NA,400912122,2017-01-11,
20,1,7:35,2255,2255,Sidney Cook Turnover.,1,4,-3,10,0.42946740801801747,Miami,Virginia Tech,4,4,0,0,NA,400912122,2017-01-11,
21,1,7:25,2245,2245,Keyona Hayes missed Jumper.,1,4,-3,0,0.42913134152548055,Miami,Virginia Tech,4,4,0,0,NA,400912122,2017-01-11,
22,1,7:25,2245,2245,Keyanna Harris Offensive Rebound.,1,4,-3,18,0.42913134152548055,Miami,Virginia Tech,4,4,0,0,NA,400912122,2017-01-11,
23,1,7:07,2227,2227,Adrienne Motley missed Three Point Jumper.,1,4,-3,0,0.42852382078030044,Miami,Virginia Tech,4,4,0,0,NA,400912122,2017-01-11,
24,1,7:07,2227,2227,Virginia Tech Defensive Rebound.,1,4,-3,15,0.42852382078030044,Miami,Virginia Tech,4,4,0,0,NA,400912122,2017-01-11,
25,1,6:52,2212,2212,Sidney Cook missed Layup.,1,4,-3,0,0.4280152769692869,Miami,Virginia Tech,4,4,0,0,NA,400912122,2017-01-11,
26,1,6:52,2212,2212,Regan Magarity Offensive Rebound.,1,4,-3,3,0.4280152769692869,Miami,Virginia Tech,4,4,0,0,NA,400912122,2017-01-11,
27,1,6:49,2209,2209,Regan Magarity made Jumper.,1,6,-5,14,0.3813199180448499,Miami,Virginia Tech,4,4,0,0,NA,400912122,2017-01-11,Virginia Tech
28,1,6:35,2195,2195,Foul on Vanessa Panousis.,1,6,-5,0,0.38055467009761923,Miami,Virginia Tech,4,4,0,0,NA,400912122,2017-01-11,
29,1,6:35,2195,2195,Adrienne Motley missed Free Throw.,1,6,-5,0,0.38055467009761923,Miami,Virginia Tech,4,4,0,0,NA,400912122,2017-01-11,
30,1,6:35,2195,2195,Miami Deadball Team Rebound.,1,6,-5,0,0.38055467009761923,Miami,Virginia Tech,4,4,0,0,NA,400912122,2017-01-11,
31,1,6:35,2195,2195,Adrienne Motley made Free Throw.,2,6,-4,12,0.40377611680144293,Miami,Virginia Tech,4,4,0,0,NA,400912122,2017-01-11,Miami
32,1,6:23,2183,2183,Samantha Hill made Three Point Jumper. Assisted by Chanette Hicks.,2,9,-7,18,0.3349285220629494,Miami,Virginia Tech,4,4,0,0,NA,400912122,2017-01-11,Virginia Tech
33,1,6:05,2165,2165,Keyona Hayes Turnover.,2,9,-7,16,0.3336213261508693,Miami,Virginia Tech,4,4,0,0,NA,400912122,2017-01-11,
34,1,5:49,2149,2149,Chanette Hicks missed Three Point Jumper.,2,9,-7,0,0.332455864745472,Miami,Virginia Tech,4,4,0,0,NA,400912122,2017-01-11,
35,1,5:49,2149,2149,Emese Hof Defensive Rebound.,2,9,-7,12,0.332455864745472,Miami,Virginia Tech,4,4,0,0,NA,400912122,2017-01-11,
36,1,5:37,2137,2137,Keyona Hayes Turnover.,2,9,-7,12,0.3315788530041534,Miami,Virginia Tech,4,4,0,0,NA,400912122,2017-01-11,
37,1,5:25,2125,2125,Chanette Hicks made Jumper. Assisted by Samantha Hill.,2,11,-9,17,0.2877247439875395,Miami,Virginia Tech,4,4,0,0,NA,400912122,2017-01-11,Virginia Tech
38,1,5:08,2108,2108,Keyanna Harris missed Jumper.,2,11,-9,0,0.28623618345623475,Miami,Virginia Tech,4,4,0,0,NA,400912122,2017-01-11,
39,1,5:08,2108,2108,Sidney Cook Defensive Rebound.,2,11,-9,13,0.28623618345623475,Miami,Virginia Tech,4,4,0,0,NA,400912122,2017-01-11,
40,1,4:55,2095,2095,Sidney Cook missed Jumper.,2,11,-9,0,0.2850941404531077,Miami,Virginia Tech,4,4,0,0,NA,400912122,2017-01-11,
41,1,4:55,2095,2095,Laura Cornelius Defensive Rebound.,2,11,-9,12,0.2850941404531077,Miami,Virginia Tech,4,4,0,0,NA,400912122,2017-01-11,
42,1,4:43,2083,2083,Emese Hof missed Jumper.,2,11,-9,0,0.28403686113175497,Miami,Virginia Tech,4,4,0,0,NA,400912122,2017-01-11,
43,1,4:43,2083,2083,Khaila Prather Offensive Rebound.,2,11,-9,1,0.28403686113175497,Miami,Virginia Tech,4,4,0,0,NA,400912122,2017-01-11,
44,1,4:42,2082,2082,Official TV Timeout,2,11,-9,11,0.28394861510129465,Miami,Virginia Tech,4,4,0,0,NA,400912122,2017-01-11,
45,1,4:31,2071,2071,Laura Cornelius made Layup.,4,11,-7,28,0.3267029990771851,Miami,Virginia Tech,4,4,0,0,NA,400912122,2017-01-11,Miami
46,1,4:03,2043,2043,Chanette Hicks made Jumper.,4,13,-9,16,0.28048894456592927,Miami,Virginia Tech,4,4,0,0,NA,400912122,2017-01-11,Virginia Tech
47,1,3:47,2027,2027,Emese Hof made Layup. Assisted by Laura Cornelius.,6,13,-7,10,0.3233941689487355,Miami,Virginia Tech,4,4,0,0,NA,400912122,2017-01-11,Miami
48,1,3:37,2017,2017,Foul on Khaila Prather.,6,13,-7,0,0.32263468464038114,Miami,Virginia Tech,4,4,0,0,NA,400912122,2017-01-11,
49,1,3:37,2017,2017,Sidney Cook missed Free Throw.,6,13,-7,0,0.32263468464038114,Miami,Virginia Tech,4,4,0,0,NA,400912122,2017-01-11,
50,1,3:37,2017,2017,Virginia Tech Deadball Team Rebound.,6,13,-7,0,0.32263468464038114,Miami,Virginia Tech,4,4,0,0,NA,400912122,2017-01-11,
51,1,3:37,2017,2017,Sidney Cook made Free Throw.,6,14,-8,15,0.29992694121506736,Miami,Virginia Tech,4,4,0,0,NA,400912122,2017-01-11,Virginia Tech
52,1,3:22,2002,2002,Emese Hof made Jumper.,8,14,-6,15,0.34519487714014024,Miami,Virginia Tech,4,4,0,0,NA,400912122,2017-01-11,Miami
53,1,3:07,1987,1987,Sidney Cook missed Three Point Jumper.,8,14,-6,0,0.34417165610176115,Miami,Virginia Tech,4,4,0,0,NA,400912122,2017-01-11,
54,1,3:07,1987,1987,Nigia Greene Defensive Rebound.,8,14,-6,15,0.34417165610176115,Miami,Virginia Tech,4,4,0,0,NA,400912122,2017-01-11,
55,1,2:52,1972,1972,Khaila Prather missed Layup.,8,14,-6,0,0.3431414991959573,Miami,Virginia Tech,4,4,0,0,NA,400912122,2017-01-11,
56,1,2:52,1972,1972,Kendyl Brooks Defensive Rebound.,8,14,-6,10,0.3431414991959573,Miami,Virginia Tech,4,4,0,0,NA,400912122,2017-01-11,
57,1,2:42,1962,1962,Samantha Hill made Jumper.,8,16,-8,21,0.29528430758962787,Miami,Virginia Tech,4,4,0,0,NA,400912122,2017-01-11,Virginia Tech
58,1,2:21,1941,1941,Emese Hof made Jumper. Assisted by Khaila Prather.,10,16,-6,14,0.3409893766374379,Miami,Virginia Tech,4,4,0,0,NA,400912122,2017-01-11,Miami
59,1,2:07,1927,1927,Sidney Cook made Layup.,10,18,-8,10,0.29227700505469395,Miami,Virginia Tech,4,4,0,0,NA,400912122,2017-01-11,Virginia Tech
60,1,1:57,1917,1917,Foul on Kendyl Brooks.,10,18,-8,5,0.2914148399475533,Miami,Virginia Tech,4,4,0,0,NA,400912122,2017-01-11,
61,1,1:52,1912,1912,Jessica Thomas missed Jumper.,10,18,-8,0,0.29098474930425833,Miami,Virginia Tech,4,4,0,0,NA,400912122,2017-01-11,
62,1,1:52,1912,1912,Miami Offensive Rebound.,10,18,-8,12,0.29098474930425833,Miami,Virginia Tech,4,4,0,0,NA,400912122,2017-01-11,
63,1,1:40,1900,1900,Adrienne Motley made Jumper. Assisted by Jessica Thomas.,12,18,-6,11,0.33811565020683493,Miami,Virginia Tech,4,4,0,0,NA,400912122,2017-01-11,Miami
64,1,1:29,1889,1889,Sidney Cook Turnover.,12,18,-6,11,0.3373473645511194,Miami,Virginia Tech,4,4,0,0,NA,400912122,2017-01-11,
65,1,1:18,1878,1878,Emese Hof missed Layup.,12,18,-6,0,0.33657956416369994,Miami,Virginia Tech,4,4,0,0,NA,400912122,2017-01-11,
66,1,1:18,1878,1878,Regan Magarity Defensive Rebound.,12,18,-6,12,0.33657956416369994,Miami,Virginia Tech,4,4,0,0,NA,400912122,2017-01-11,
67,1,1:06,1866,1866,Sidney Cook missed Layup.,12,18,-6,0,0.3357418700306552,Miami,Virginia Tech,4,4,0,0,NA,400912122,2017-01-11,
68,1,1:06,1866,1866,Emese Hof Defensive Rebound.,12,18,-6,13,0.3357418700306552,Miami,Virginia Tech,4,4,0,0,NA,400912122,2017-01-11,
69,1,0:53,1853,1853,Adrienne Motley made Three Point Jumper. Assisted by Jessica Thomas.,15,18,-3,25,0.4150318595916069,Miami,Virginia Tech,4,4,0,0,NA,400912122,2017-01-11,Miami
70,1,0:28,1828,1828,Vanessa Panousis missed Three Point Jumper.,15,18,-3,0,0.41407556197755135,Miami,Virginia Tech,4,4,0,0,NA,400912122,2017-01-11,
71,1,0:28,1828,1828,Chanette Hicks Offensive Rebound.,15,18,-3,8,0.41407556197755135,Miami,Virginia Tech,4,4,0,0,NA,400912122,2017-01-11,
72,1,0:20,1820,1820,Chanette Hicks missed Jumper.,15,18,-3,0,0.4137678057527488,Miami,Virginia Tech,4,4,0,0,NA,400912122,2017-01-11,
73,1,0:20,1820,1820,Emese Hof Block.,15,18,-3,2,0.4137678057527488,Miami,Virginia Tech,4,4,0,0,NA,400912122,2017-01-11,
74,1,0:18,1818,1818,Sarah Mortensen Defensive Rebound.,15,18,-3,8,0.41369070853176043,Miami,Virginia Tech,4,4,0,0,NA,400912122,2017-01-11,
75,1,0:10,1810,1810,Foul on Kendyl Brooks.,15,18,-3,0,0.41338163301188374,Miami,Virginia Tech,4,4,0,0,NA,400912122,2017-01-11,
76,1,0:10,1810,1810,Laura Cornelius made Free Throw.,16,18,-2,0,0.441929359796612,Miami,Virginia Tech,4,4,0,0,NA,400912122,2017-01-11,Miami
77,1,0:10,1810,1810,Laura Cornelius made Free Throw.,17,18,-1,8,0.470866101029719,Miami,Virginia Tech,4,4,0,0,NA,400912122,2017-01-11,Miami
78,1,0:02,1802,1802,Foul on Jessica Thomas.,17,18,-1,2,0.4707598326384926,Miami,Virginia Tech,4,4,0,0,NA,400912122,2017-01-11,
79,1,0:00,1800,1800,End of 1st Quarter,17,18,-1,13,0.47073319422403154,Miami,Virginia Tech,4,4,0,0,NA,400912122,2017-01-11,
80,2,9:47,1787,1787,Chanette Hicks missed Layup.,17,18,-1,0,0.470559291216549,Miami,Virginia Tech,4,4,0,0,NA,400912122,2017-01-11,
81,2,9:47,1787,1787,Regan Magarity Offensive Rebound.,17,18,-1,4,0.470559291216549,Miami,Virginia Tech,4,4,0,0,NA,400912122,2017-01-11,
82,2,9:43,1783,1783,Regan Magarity missed Jumper.,17,18,-1,0,0.4705055032052506,Miami,Virginia Tech,4,4,0,0,NA,400912122,2017-01-11,
83,2,9:43,1783,1783,Laura Cornelius Defensive Rebound.,17,18,-1,21,0.4705055032052506,Miami,Virginia Tech,4,4,0,0,NA,400912122,2017-01-11,
84,2,9:22,1762,1762,Emese Hof missed Jumper.,17,18,-1,0,0.4702207012371656,Miami,Virginia Tech,4,4,0,0,NA,400912122,2017-01-11,
85,2,9:22,1762,1762,Sidney Cook Defensive Rebound.,17,18,-1,26,0.4702207012371656,Miami,Virginia Tech,4,4,0,0,NA,400912122,2017-01-11,
86,2,8:56,1736,1736,Chanette Hicks missed Three Point Jumper.,17,18,-1,0,0.469861663055782,Miami,Virginia Tech,4,4,0,0,NA,400912122,2017-01-11,
87,2,8:56,1736,1736,Jessica Thomas Defensive Rebound.,17,18,-1,9,0.469861663055782,Miami,Virginia Tech,4,4,0,0,NA,400912122,2017-01-11,
88,2,8:47,1727,1727,Jessica Thomas made Jumper.,19,18,1,3,0.5302645037705677,Miami,Virginia Tech,4,4,0,0,NA,400912122,2017-01-11,Miami
89,2,8:44,1724,1724,Chanette Hicks Turnover.,19,18,1,3,0.5303067924039676,Miami,Virginia Tech,4,4,0,0,NA,400912122,2017-01-11,
90,2,8:41,1721,1721,Foul on Chanette Hicks.,19,18,1,0,0.5303492010359951,Miami,Virginia Tech,4,4,0,0,NA,400912122,2017-01-11,
91,2,8:41,1721,1721,Jessica Thomas missed Free Throw.,19,18,1,0,0.5303492010359951,Miami,Virginia Tech,4,4,0,0,NA,400912122,2017-01-11,
92,2,8:41,1721,1721,Miami Deadball Team Rebound.,19,18,1,0,0.5303492010359951,Miami,Virginia Tech,4,4,0,0,NA,400912122,2017-01-11,
93,2,8:41,1721,1721,Jessica Thomas made Free Throw.,20,18,2,12,0.5604755920891067,Miami,Virginia Tech,4,4,0,0,NA,400912122,2017-01-11,Miami
94,2,8:29,1709,1709,Foul on Keyanna Harris.,20,18,2,0,0.5608135694543185,Miami,Virginia Tech,4,4,0,0,NA,400912122,2017-01-11,
95,2,8:29,1709,1709,Sidney Cook missed Free Throw.,20,18,2,0,0.5608135694543185,Miami,Virginia Tech,4,4,0,0,NA,400912122,2017-01-11,
96,2,8:29,1709,1709,Virginia Tech Deadball Team Rebound.,20,18,2,0,0.5608135694543185,Miami,Virginia Tech,4,4,0,0,NA,400912122,2017-01-11,
97,2,8:29,1709,1709,Sidney Cook made Free Throw.,20,19,1,16,0.5305200773813787,Miami,Virginia Tech,4,4,0,0,NA,400912122,2017-01-11,Virginia Tech
98,2,8:13,1693,1693,Jessica Thomas Turnover.,20,19,1,23,0.5307511825321546,Miami,Virginia Tech,4,4,0,0,NA,400912122,2017-01-11,
99,2,7:50,1670,1670,Samantha Hill missed Jumper.,20,19,1,0,0.5310828203365737,Miami,Virginia Tech,4,4,0,0,NA,400912122,2017-01-11,
100,2,7:50,1670,1670,Sidney Cook Offensive Rebound.,20,19,1,14,0.5310828203365737,Miami,Virginia Tech,4,4,0,0,NA,400912122,2017-01-11,
101,2,7:36,1656,1656,Regan Magarity Turnover.,20,19,1,2,0.5312798120360661,Miami,Virginia Tech,4,4,0,0,NA,400912122,2017-01-11,
102,2,7:34,1654,1654,Adrienne Motley Steal.,20,19,1,2,0.5313077029398375,Miami,Virginia Tech,4,4,0,0,NA,400912122,2017-01-11,
103,2,7:32,1652,1652,Adrienne Motley missed Jumper.,20,19,1,0,0.5313355377461423,Miami,Virginia Tech,4,4,0,0,NA,400912122,2017-01-11,
104,2,7:32,1652,1652,Vanessa Panousis Defensive Rebound.,20,19,1,19,0.5313355377461423,Miami,Virginia Tech,4,4,0,0,NA,400912122,2017-01-11,
105,2,7:13,1633,1633,Foul on Khaila Prather.,20,19,1,0,0.5315975907477417,Miami,Virginia Tech,4,4,0,0,NA,400912122,2017-01-11,
106,2,7:13,1633,1633,Regan Magarity missed Free Throw.,20,19,1,0,0.5315975907477417,Miami,Virginia Tech,4,4,0,0,NA,400912122,2017-01-11,
107,2,7:13,1633,1633,Virginia Tech Deadball Team Rebound.,20,19,1,0,0.5315975907477417,Miami,Virginia Tech,4,4,0,0,NA,400912122,2017-01-11,
108,2,7:13,1633,1633,Regan Magarity missed Free Throw.,20,19,1,0,0.5315975907477417,Miami,Virginia Tech,4,4,0,0,NA,400912122,2017-01-11,
109,2,7:13,1633,1633,Keyanna Harris Defensive Rebound.,20,19,1,9,0.5315975907477417,Miami,Virginia Tech,4,4,0,0,NA,400912122,2017-01-11,
110,2,7:04,1624,1624,Laura Cornelius missed Three Point Jumper.,20,19,1,0,0.5317205655619778,Miami,Virginia Tech,4,4,0,0,NA,400912122,2017-01-11,
111,2,7:04,1624,1624,Sidney Cook Defensive Rebound.,20,19,1,18,0.5317205655619778,Miami,Virginia Tech,4,4,0,0,NA,400912122,2017-01-11,
112,2,6:46,1606,1606,Sidney Cook missed Three Point Jumper.,20,19,1,0,0.5319653099882755,Miami,Virginia Tech,4,4,0,0,NA,400912122,2017-01-11,
113,2,6:46,1606,1606,Laura Cornelius Defensive Rebound.,20,19,1,21,0.5319653099882755,Miami,Virginia Tech,4,4,0,0,NA,400912122,2017-01-11,
114,2,6:25,1585,1585,Laura Cornelius missed Three Point Jumper.,20,19,1,0,0.5322506132922464,Miami,Virginia Tech,4,4,0,0,NA,400912122,2017-01-11,
115,2,6:25,1585,1585,Sidney Cook Defensive Rebound.,20,19,1,21,0.5322506132922464,Miami,Virginia Tech,4,4,0,0,NA,400912122,2017-01-11,
116,2,6:04,1564,1564,Vanessa Panousis made Three Point Jumper. Assisted by Samantha Hill.,20,22,-2,11,0.43519825304482407,Miami,Virginia Tech,4,4,0,0,NA,400912122,2017-01-11,Virginia Tech
117,2,5:53,1553,1553,Jessica Thomas made Three Point Jumper. Assisted by Keyanna Harris.,23,22,1,19,0.5326903903799105,Miami,Virginia Tech,4,4,0,0,NA,400912122,2017-01-11,Miami
118,2,5:34,1534,1534,Kendyl Brooks missed Three Point Jumper.,23,22,1,0,0.5329575724454707,Miami,Virginia Tech,4,4,0,0,NA,400912122,2017-01-11,
119,2,5:34,1534,1534,Jessica Thomas Defensive Rebound.,23,22,1,9,0.5329575724454707,Miami,Virginia Tech,4,4,0,0,NA,400912122,2017-01-11,
120,2,5:25,1525,1525,Erykah Davenport made Layup. Assisted by Adrienne Motley.,25,22,3,23,0.5981151904763176,Miami,Virginia Tech,4,4,0,0,NA,400912122,2017-01-11,Miami
121,2,5:02,1502,1502,Samantha Hill Turnover.,25,22,3,0,0.5990928370854987,Miami,Virginia Tech,4,4,0,0,NA,400912122,2017-01-11,
122,2,5:02,1502,1502,Laura Cornelius Steal.,25,22,3,0,0.5990928370854987,Miami,Virginia Tech,4,4,0,0,NA,400912122,2017-01-11,
123,2,5:02,1502,1502,Laura Cornelius Turnover.,25,22,3,17,0.5990928370854987,Miami,Virginia Tech,4,4,0,0,NA,400912122,2017-01-11,
124,2,4:45,1485,1485,Chanette Hicks made Jumper. Assisted by Vanessa Panousis.,25,24,1,0,0.5336827065022101,Miami,Virginia Tech,4,4,0,0,NA,400912122,2017-01-11,Virginia Tech
125,2,4:45,1485,1485,Foul on Erykah Davenport.,25,24,1,0,0.5336827065022101,Miami,Virginia Tech,4,4,0,0,NA,400912122,2017-01-11,
126,2,4:45,1485,1485,Official TV Timeout,25,24,1,0,0.5336827065022101,Miami,Virginia Tech,4,4,0,0,NA,400912122,2017-01-11,
127,2,4:45,1485,1485,Chanette Hicks made Free Throw.,25,25,0,13,0.5,Miami,Virginia Tech,4,4,0,0,NA,400912122,2017-01-11,Virginia Tech
128,2,4:32,1472,1472,Foul on Samantha Hill.,25,25,0,14,0.5,Miami,Virginia Tech,4,4,0,0,NA,400912122,2017-01-11,
129,2,4:18,1458,1458,Jessica Thomas missed Three Point Jumper.,25,25,0,0,0.5,Miami,Virginia Tech,4,4,0,0,NA,400912122,2017-01-11,
130,2,4:18,1458,1458,Sidney Cook Defensive Rebound.,25,25,0,16,0.5,Miami,Virginia Tech,4,4,0,0,NA,400912122,2017-01-11,
131,2,4:02,1442,1442,Chanette Hicks missed Jumper.,25,25,0,0,0.5,Miami,Virginia Tech,4,4,0,0,NA,400912122,2017-01-11,
132,2,4:02,1442,1442,Emese Hof Defensive Rebound.,25,25,0,8,0.5,Miami,Virginia Tech,4,4,0,0,NA,400912122,2017-01-11,
133,2,3:54,1434,1434,Adrienne Motley made Three Point Jumper. Assisted by Jessica Thomas.,28,25,3,24,0.6022337610270139,Miami,Virginia Tech,4,4,0,0,NA,400912122,2017-01-11,Miami
134,2,3:30,1410,1410,Regan Magarity made Layup.,28,27,1,15,0.5348913629138277,Miami,Virginia Tech,4,4,0,0,NA,400912122,2017-01-11,Virginia Tech
135,2,3:15,1395,1395,Emese Hof Turnover.,28,27,1,12,0.535123424011803,Miami,Virginia Tech,4,4,0,0,NA,400912122,2017-01-11,
136,2,3:03,1383,1383,Vanessa Panousis missed Three Point Jumper.,28,27,1,0,0.5353069866007617,Miami,Virginia Tech,4,4,0,0,NA,400912122,2017-01-11,
137,2,3:03,1383,1383,Chanette Hicks Offensive Rebound.,28,27,1,11,0.5353069866007617,Miami,Virginia Tech,4,4,0,0,NA,400912122,2017-01-11,
138,2,2:52,1372,1372,Regan Magarity made Layup. Assisted by Chanette Hicks.,28,29,-1,19,0.46452559227823725,Miami,Virginia Tech,4,4,0,0,NA,400912122,2017-01-11,Virginia Tech
139,2,2:33,1353,1353,Sarah Mortensen made Three Point Jumper. Assisted by Nigia Greene.,31,29,2,6,0.5711631981021713,Miami,Virginia Tech,4,4,0,0,NA,400912122,2017-01-11,Miami
140,2,2:27,1347,1347,Foul on Keyona Hayes.,31,29,2,7,0.5713439774811941,Miami,Virginia Tech,4,4,0,0,NA,400912122,2017-01-11,
141,2,2:20,1340,1340,Kaela Kinder made Jumper.,31,31,0,20,0.5,Miami,Virginia Tech,4,4,0,0,NA,400912122,2017-01-11,Virginia Tech
142,2,2:00,1320,1320,Keyona Hayes made Jumper. Assisted by Jessica Thomas.,33,31,2,7,0.5721700508603711,Miami,Virginia Tech,4,4,0,0,NA,400912122,2017-01-11,Miami
143,2,1:53,1313,1313,Chanette Hicks made Layup.,33,33,0,13,0.5,Miami,Virginia Tech,4,4,0,0,NA,400912122,2017-01-11,Virginia Tech
144,2,1:40,1300,1300,Sarah Mortensen made Three Point Jumper. Assisted by Adrienne Motley.,36,33,3,8,0.608246183430483,Miami,Virginia Tech,4,4,0,0,NA,400912122,2017-01-11,Miami
145,2,1:32,1292,1292,Foul on Sarah Mortensen.,36,33,3,0,0.6086263444827065,Miami,Virginia Tech,4,4,0,0,NA,400912122,2017-01-11,
146,2,1:32,1292,1292,Vanessa Panousis made Free Throw.,36,34,2,0,0.5730634866740758,Miami,Virginia Tech,4,4,0,0,NA,400912122,2017-01-11,Virginia Tech
147,2,1:32,1292,1292,Vanessa Panousis made Free Throw.,36,35,1,14,0.5367288700702502,Miami,Virginia Tech,4,4,0,0,NA,400912122,2017-01-11,Virginia Tech
148,2,1:18,1278,1278,Sarah Mortensen missed Jumper.,36,35,1,0,0.5369663268984698,Miami,Virginia Tech,4,4,0,0,NA,400912122,2017-01-11,
149,2,1:18,1278,1278,Regan Magarity Block.,36,35,1,0,0.5369663268984698,Miami,Virginia Tech,4,4,0,0,NA,400912122,2017-01-11,
150,2,1:18,1278,1278,Miami Offensive Rebound.,36,35,1,4,0.5369663268984698,Miami,Virginia Tech,4,4,0,0,NA,400912122,2017-01-11,
151,2,1:14,1274,1274,Keyona Hayes missed Jumper.,36,35,1,0,0.5370357273089071,Miami,Virginia Tech,4,4,0,0,NA,400912122,2017-01-11,
152,2,1:14,1274,1274,Keyona Hayes Offensive Rebound.,36,35,1,25,0.5370357273089071,Miami,Virginia Tech,4,4,0,0,NA,400912122,2017-01-11,
153,2,0:49,1249,1249,Keyona Hayes missed Jumper.,36,35,1,0,0.5374876819207891,Miami,Virginia Tech,4,4,0,0,NA,400912122,2017-01-11,
154,2,0:49,1249,1249,Sarah Mortensen Offensive Rebound.,36,35,1,23,0.5374876819207891,Miami,Virginia Tech,4,4,0,0,NA,400912122,2017-01-11,
155,2,0:26,1226,1226,Miami  Timeout,36,35,1,10,0.5379358689688774,Miami,Virginia Tech,3,4,1,0,NA,400912122,2017-01-11,
156,2,0:16,1216,1216,Jessica Thomas missed Three Point Jumper.,36,35,1,0,0.5381419710675935,Miami,Virginia Tech,3,4,1,1,NA,400912122,2017-01-11,
157,2,0:16,1216,1216,Chanette Hicks Block.,36,35,1,0,0.5381419710675935,Miami,Virginia Tech,3,4,1,1,NA,400912122,2017-01-11,
158,2,0:16,1216,1216,Miami Offensive Rebound.,36,35,1,0,0.5381419710675935,Miami,Virginia Tech,3,4,1,1,NA,400912122,2017-01-11,
159,2,0:16,1216,1216,Miami  Turnover.,36,35,1,0,0.5381419710675935,Miami,Virginia Tech,3,4,1,1,NA,400912122,2017-01-11,
160,2,0:16,1216,1216,Virginia Tech  Timeout,36,35,1,15,0.5381419710675935,Miami,Virginia Tech,3,3,1,1,NA,400912122,2017-01-11,
161,2,0:01,1201,1201,Chanette Hicks missed Jumper.,36,35,1,1,0.5384602500661886,Miami,Virginia Tech,3,3,1,1,NA,400912122,2017-01-11,
162,2,0:00,1200,1200,Virginia Tech Deadball Team Rebound.,36,35,1,0,0.5384812553577752,Miami,Virginia Tech,3,3,1,1,NA,400912122,2017-01-11,
163,2,0:00,1200,1200,End of 2nd Quarter,36,35,1,14,0.5384812553577752,Miami,Virginia Tech,3,3,1,1,NA,400912122,2017-01-11,
164,3,9:46,1186,1186,Emese Hof missed Jumper.,36,35,1,0,0.5387712418258391,Miami,Virginia Tech,4,4,0,0,NA,400912122,2017-01-11,
165,3,9:46,1186,1186,Regan Magarity Defensive Rebound.,36,35,1,18,0.5387712418258391,Miami,Virginia Tech,4,4,0,0,NA,400912122,2017-01-11,
166,3,9:28,1168,1168,Samantha Hill made Three Point Jumper.,36,38,-2,23,0.4222065339985064,Miami,Virginia Tech,4,4,0,0,NA,400912122,2017-01-11,Virginia Tech
167,3,9:05,1145,1145,Laura Cornelius made Layup.,38,38,0,9,0.5,Miami,Virginia Tech,4,4,0,0,NA,400912122,2017-01-11,Miami
168,3,8:56,1136,1136,Foul on Keyona Hayes.,38,38,0,12,0.5,Miami,Virginia Tech,4,4,0,0,NA,400912122,2017-01-11,
169,3,8:44,1124,1124,Samantha Hill missed Jumper.,38,38,0,0,0.5,Miami,Virginia Tech,4,4,0,0,NA,400912122,2017-01-11,
170,3,8:44,1124,1124,Keyona Hayes Defensive Rebound.,38,38,0,5,0.5,Miami,Virginia Tech,4,4,0,0,NA,400912122,2017-01-11,
171,3,8:39,1119,1119,Adrienne Motley made Layup. Assisted by Jessica Thomas.,40,38,2,6,0.5796948491585648,Miami,Virginia Tech,4,4,0,0,NA,400912122,2017-01-11,Miami
172,3,8:33,1113,1113,Foul on Adrienne Motley.,40,38,2,0,0.5799286487915525,Miami,Virginia Tech,4,4,0,0,NA,400912122,2017-01-11,
173,3,8:33,1113,1113,Chanette Hicks made Free Throw.,40,39,1,0,0.5402229553008159,Miami,Virginia Tech,4,4,0,0,NA,400912122,2017-01-11,Virginia Tech
174,3,8:33,1113,1113,Chanette Hicks made Free Throw.,40,40,0,7,0.5,Miami,Virginia Tech,4,4,0,0,NA,400912122,2017-01-11,Virginia Tech
175,3,8:26,1106,1106,Jessica Thomas Turnover.,40,40,0,2,0.5,Miami,Virginia Tech,4,4,0,0,NA,400912122,2017-01-11,
176,3,8:24,1104,1104,Chanette Hicks Steal.,40,40,0,1,0.5,Miami,Virginia Tech,4,4,0,0,NA,400912122,2017-01-11,
177,3,8:23,1103,1103,Chanette Hicks made Layup.,40,42,-2,13,0.4196789067496167,Miami,Virginia Tech,4,4,0,0,NA,400912122,2017-01-11,Virginia Tech
178,3,8:10,1090,1090,Laura Cornelius made Layup.,42,42,0,6,0.5,Miami,Virginia Tech,4,4,0,0,NA,400912122,2017-01-11,Miami
179,3,8:04,1084,1084,Foul on Laura Cornelius.,42,42,0,1,0.5,Miami,Virginia Tech,4,4,0,0,NA,400912122,2017-01-11,
180,3,8:03,1083,1083,Sidney Cook missed Layup.,42,42,0,0,0.5,Miami,Virginia Tech,4,4,0,0,NA,400912122,2017-01-11,
181,3,8:03,1083,1083,Keyona Hayes Block.,42,42,0,2,0.5,Miami,Virginia Tech,4,4,0,0,NA,400912122,2017-01-11,
182,3,8:01,1081,1081,Adrienne Motley Defensive Rebound.,42,42,0,12,0.5,Miami,Virginia Tech,4,4,0,0,NA,400912122,2017-01-11,
183,3,7:49,1069,1069,Jessica Thomas missed Jumper.,42,42,0,0,0.5,Miami,Virginia Tech,4,4,0,0,NA,400912122,2017-01-11,
184,3,7:49,1069,1069,Miami Deadball Team Rebound.,42,42,0,0,0.5,Miami,Virginia Tech,4,4,0,0,NA,400912122,2017-01-11,
185,3,7:49,1069,1069,Foul on Sidney Cook.,42,42,0,10,0.5,Miami,Virginia Tech,4,4,0,0,NA,400912122,2017-01-11,
186,3,7:39,1059,1059,Jessica Thomas missed Jumper.,42,42,0,0,0.5,Miami,Virginia Tech,4,4,0,0,NA,400912122,2017-01-11,
187,3,7:39,1059,1059,Samantha Hill Defensive Rebound.,42,42,0,4,0.5,Miami,Virginia Tech,4,4,0,0,NA,400912122,2017-01-11,
188,3,7:35,1055,1055,Samantha Hill made Layup.,42,44,-2,15,0.41770746592146163,Miami,Virginia Tech,4,4,0,0,NA,400912122,2017-01-11,Virginia Tech
189,3,7:20,1040,1040,Adrienne Motley missed Layup.,42,44,-2,0,0.41704641507834067,Miami,Virginia Tech,4,4,0,0,NA,400912122,2017-01-11,
190,3,7:20,1040,1040,Emese Hof Offensive Rebound.,42,44,-2,7,0.41704641507834067,Miami,Virginia Tech,4,4,0,0,NA,400912122,2017-01-11,
